article,article_sentiment,article_score
"Mechelle Dillon (left) and Adele Johnstone have campaigned for a full statutory inquiry A panel has called for a public inquiry to be held into institutions for unmarried mothers in Northern Ireland. The three experts also advised that there should be immediate redress payments to survivors. The devolved government committed to an investigation after research into mother-and-baby homes and Magdalene Laundries was published. Women said they were detained against their will, used as unpaid labour and had to give up babies for adoption. The primary recommendation in Tuesday's report is to establish an ""integrated investigation"" by a non-statutory independent panel, feeding into a statutory public inquiry. There are also further recommendations for supporting measures to ensure that victims and survivors can participate in the investigation, including access to records legislation. First Minister Paul Givan, Deputy First Minister Michelle O'Neill and Health Minister Robin Swann are due to meet the panel on Tuesday evening. They welcomed the report and added that the Northern Ireland Executive would consider the recommendations and ""next steps will be set out by the executive as soon as possible"". Mr Givan said the issue was a priority for the executive. ""I would hope within the next number of weeks the executive will be in a position to take definitive decisions around what the next steps should be,"" he said. Ms O'Neill said the report was ""another step forward for victims and survivors"", adding that she supported a full public enquiry. ""The barbaric way in which women and girls were treated over many decades is utterly shameful and a stain on our society,"" she said. This video can not be played 'One of the great scandals of our time' The Truth Recovery Design Panel recommends: Urgent appointment of a non-statutory independent panel of experts, including those with personal experience Legislation to appoint a statutory public inquiry New legislation to secure access to records for survivors and their families Immediate redress payments from the beginning of the investigation The panel, along with victims and survivors, called on ""all state, religious and other institutions, agencies, organisations and individuals complicit in the processes of institutionalisation and forced labour, family separation and adoption to act without delay in issuing unqualified apologies"". They said that they should clearly state their role, ""accept responsibility for harms done; demonstrate sincerity in their apology; and demonstrate the safeguards now in place to ensure there will be no repetition of the inhumanity and suffering to which they contributed"". 'Secrets have been shattered' 'Significant wrongs' in NI mother-and-baby homes Major findings of NI mother-and-baby homes report 'They called us fallen women, bad women' Listen: Shamed at Birth Maria Cogley, who was born in the Marianvale home in Belfast, told the BBC's Evening Extra programme that ""now is the time to take it [an inquiry] forwards"". ""This is the start,"" she said. ""Now we need the Department of Health and Robin Swann to sign this off as quickly as possible, in full, and the recommendations that are made today, in the report, that's the only way we're going to get the answers to the questions and shine some light on the truth."" The homes and laundries across the island of Ireland have in recent years come to the attention of United Nations (UN) human rights monitors. The former nuns' residence at the Marianvale mother-and-baby home in Newry, County Down Dr Lia Nadaraia, who sits on the UN's Committee Against Torture, and Committee for the Elimination of Discrimination Against Women (CEDAW), told the BBC there was evidence of ""systematic torture and ill-treatment"". ""Girls and women were involuntarily detained, stripped of their identities, forced to work constantly, and not paid wages,"" she said. Dr Nadaraia said any investigation should be aimed at uncovering the full truth about what happened in the institutions, bringing about prosecutions if possible, and providing financial redress for victims. The Truth Recovery Design Panel, which was established by the Stormont Executive in March, has been working with survivors to come up with recommendations. The three members are Professor Phil Scraton from Queen's University law school, Dr Maeve O'Rourke from the Irish Centre for Human Rights at the National University of Ireland (NUI) Galway, and Deirdre Mahon, executive director for social work at the Western Health Trust. The three panel members recommended a public inquiry into the institutions Prof Scraton said that ""lives and futures lost through the cruelty within these institutions cannot be recovered, but we must acknowledge the inter-generational pain and suffering inflicted on victims, survivors and families"". At a press conference, Prof Scraton thanked the victims and survivors, and their families, but said that their pain ""will never, ever, be assuaged by whatever we do because this is one of the great scandals of our time"". This video can not be played 'How dare we, as a society, blame those who suffered the most?' Dr O'Rourke said that any future investigation must be accessible to everyone involved, in particular those with disabilities. ""The key priorities raised by survivors and the relatives are that funding and resources should be sufficient to ensure effective and sustainable implementation of all the panel's recommendations; that the human rights of survivors and relatives are central to the recommendations' implementation; that all of the measures recommended must ensure full access for victims, survivors and relatives of the deceased to information,"" she said. The research report, published in January,found at least 10,500 women passed through mother-and-baby homes. There were eight institutions in Northern Ireland, run by Catholic and Protestant religious organisations. More than 3,000 women spent time in a Magdalene Laundry. These institutions were, in effect, workhouses, and were situated in Londonderry, Belfast, and Newry. The researchers recommended there should be more investigations into levels of infant mortality among children who were born to mothers in the homes. They also said there were more questions to be asked about potential illegal adoptions, including the movement of babies across the border with the Republic of Ireland. Religious orders, and the head of the Catholic Church in Ireland, Archbishop Eamon Martin, have said they will co-operate with the new investigation. There has already been a state inquiryinto mother-and-baby homes in the Republic of Ireland. Campaigners in Northern Ireland - including the survivors' group Birth Mothers and Their Children For Justice NI - have said the investigation must have the power to compel religious organisations and state agencies to provide records and witnesses. 'Women were ashamed, they shouldn't have been' As it happened: Mother and baby home inquiry backed 'Significant wrongs' in NI mother-and-baby homes 'They called us fallen women, bad women' Night-time curfew imposed in fire-hit areas of LA as police warn against 'despicable' looting 'I have nothing to go back to' - BBC reporter tells of LA fires heartbreak Trump avoids prison or fine in hush-money case sentencing LA fires: How three days of devastation unfolded What's the latest on the Los Angeles wildfires and what caused them? The '9/11 mastermind' wants to plead guilty. Why is the US trying to stop him? Pop star Chappell Roan wins BBC Sound Of 2025 Weekly quiz: Zendaya looked happy but who else sparkled at the Golden Globes? Inside the UK's first legal drug consumption room Sheen to fund new national theatre for Wales Danes struggle with response to Trump Greenland threat The Upbeat newsletter: Start your week on a high with uplifting stories delivered to your inbox Dragons’ Den returns with a new line-up of celebrity guests Can a fresh batch of entrepreneurs secure the deal of a lifetime? Are smart scales really as ‘smart’ as they claim to be? Greg Foot explores whether they can accurately measure weight, body fat, muscle and bone mass The award-winning psychological competition is back A nail-biting game of detection, backstabbing and trust. Who will make it through? How close are we to a cancer vaccine? How might it help in the treatment of the disease? © 2025 BBC. The BBC is not responsible for the content of external sites.Read about our approach to external linking.",Negative,0.072231725
"Sarah-Jane has sickle-cell disease, lives with constant pain and needs a blood transfusion every six weeks The first new sickle-cell treatment in 20 years will help keep thousands of people out of hospital over the next three years, NHS England has said. Sickle-cell disease is incurable and affects 15,000 people in the UK. And the National Institute for Health and Care Excellence said the hope of reducing health inequalities for black people, who are predominantly affected and often have poorer health outcomes due to a number of social factors, made the drug worth recommending. It called it ""an innovative treatment"". The drug, crizanlizumab, made by Novartis, is injected into a vein and can be taken on its own or alongside standard treatment and regular blood transfusions. And in a trial, patients taking the crizanlizumab had a sickle-cell crisis 1.6 times a year on average, compared with nearly three times a year normally. These painful episodes, which can require hospital treatment and lead to other health complications, are caused by by sickle-shaped red blood cells blocking the small blood vessels . But because the trial was small and lasted only a year, it remains unknown how long the benefits last for - and that makes it difficult to judge how cost-effective crizanlizumab is. Nevertheless, NICE, which recommends treatments in England and Wales, is recommending its use for over-16s, albeit under a special arrangement rather than routinely, on the NHS. And additional data on the treatment will be collected through clinical trials. The charity Sickle Cell Society said the new treatment brought ""new hope"" for people living with the world's most common genetic blood condition. NHS chief executive Amanda Pritchard said: ""The moment that a new drug comes that is approved to be used, our job is to make sure that we can do a deal to ensure it's affordable and get it out as quickly as possible."" Sarah-Jane has to rely on a whole range of medication to manage her sickle-cell disease, including very strong painkillers Diagnosed at birth, Sarah-Jane Nkrumah, 27, had her first crisis aged six months and has chronic pain in her joints. ""Every day is pain,"" she says. ""I don't remember the last time I had zero pain."" Sarah-Jane prefers to take breaks from taking painkillers -  but some days cannot get out of bed. ""You just have to try and manage it,"" she says. ""I don't have a choice. ""It's all about having a lot of mental strength and support."" And every six weeks, she has a blood transfusion to boost her energy levels. ""I feel weak and exhausted leading up to them and refreshed and stronger afterwards,"" she says. ""Thanks to donors, I get a chance to live another day."" Sarah-Jane had to give up her ambition to become a nursery teacher because it put her at risk of serious infection. ""Now, I have found my true purpose and love spreading awareness of sickle-cell disease,"" she says. Meindert Boysen, deputy chief executive and director of the Centre for Health Technology Evaluation, at NICE, said: ""Treatment for sickle-cell disease has been limited for years and there has been a lack of treatments for patients whose lives are affected by the condition. ""Crizanlizumab... has shown the potential to improve hundreds of lives and we are delighted to be able to recommend it as the first new treatment for sickle cell disease in two decades."" It is inherited from both parents, who pass on a particular gene It is possible to carry the gene without having the disease Nearly 300 babies are born with it each year in the UK A simple blood test will show whether someone has it Children with sickle cell are at greater risk of stroke Other symptoms can include serious infections, anaemia and tiredness Source: Sickle Cell Society / NHS UK Sickle cell disease - NHS About Sickle Cell » Sickle Cell Society Night-time curfew imposed in fire-hit areas of LA as police warn against 'despicable' looting 'I have nothing to go back to' - BBC reporter tells of LA fires heartbreak Trump avoids prison or fine in hush-money case sentencing LA fires: How three days of devastation unfolded What's the latest on the Los Angeles wildfires and what caused them? The '9/11 mastermind' wants to plead guilty. Why is the US trying to stop him? Pop star Chappell Roan wins BBC Sound Of 2025 Weekly quiz: Zendaya looked happy but who else sparkled at the Golden Globes? Inside the UK's first legal drug consumption room Sheen to fund new national theatre for Wales Danes struggle with response to Trump Greenland threat The Upbeat newsletter: Start your week on a high with uplifting stories delivered to your inbox Dragons’ Den returns with a new line-up of celebrity guests Can a fresh batch of entrepreneurs secure the deal of a lifetime? Are smart scales really as ‘smart’ as they claim to be? Greg Foot explores whether they can accurately measure weight, body fat, muscle and bone mass The award-winning psychological competition is back A nail-biting game of detection, backstabbing and trust. Who will make it through? How close are we to a cancer vaccine? How might it help in the treatment of the disease? © 2025 BBC. The BBC is not responsible for the content of external sites.Read about our approach to external linking.",Positive,0.843765
"The Canadian actor famously played Captain James T Kirk of the USS Enterprise The actor who played Captain Kirk in the Star Trek series is set to embark on a real-life journey into space. US tech billionaire Jeff Bezos's space travel company Blue Origin confirmed that William Shatner would be blasting off from Texas on 12 October. Aged 90, the actor will become the oldest person to have flown into space. ""I've heard about space for a long time now. I'm taking the opportunity to see it for myself. What a miracle,"" Shatner said in a statement. Shatner will be joining three other people aboard Blue Origin's New Shepard rocket for the company's second human spaceflight. Amazon founderJeff Bezos joined the first crewed flight in July,along with his brother, an 82-year-old pioneer of the space race and an 18-year-old student. This video can not be played The moment Jeff Bezos and crew launch into space on the first human flight of New Shepard As with the previous flight, the October voyage is expected to last about 10 minutes and will take the crew just beyond the Karman Line - the most widely recognised boundary of space which lies 100km (60 miles) above the Earth. Blue Origin said its vice president of mission and flight operations, Audrey Powers, would also be on board the flight, as well as a former Nasa engineer and the co-founder of a software company specialising in clinical research. A Canadian actor, Shatner famously played Captain James T Kirk of the USS Enterprise in the original Star Trek TV series in the 1960s, and later appeared in films of the franchise. Reports in 2013 said he had turned down Sir Richard Branson's offer to fly him into space with Virgin Galactic -the billionaire's space travel company which took Sir Richard to the edge of spacein July. Sir Richard told The Sun newspaper at the time it was because Shatner has a fear of flying. But in 2011 the actor said he had turned down the offer because the billionaire allegedly wanted him to pay for the journey. ""He wanted me to go up and pay for it and I said: 'Hey, you pay me and I'll go up. I'll risk my life for a large sum of money.' But he didn't pick me up on my offer,"" Shatner told reporters. The Star Trek star will not however be the first original cast member to leave the planet. Last yearThe Times revealed,externalthat the ashes of James Doohan, who played Montgomery ""Scotty"" Scott, were smuggled on board the International Space Station in 2008, three years after Doohan's death. New Shepard, built by Bezos' company Blue Origin, is designed to serve the burgeoning market for space tourism. Dubbed ""NewSpace"", an increasing number of entrepreneurs are joining in the race to create cheap, commercialised space travel. Bezos's Blue Origin hit headlines in recent days after21 current and former employees claimed it had ignored safety concernsto gain an advantage in the space race, and complained of a culture of sexism. Blue Origin rejected the charges and said it stands by its safety record. Jeff Bezos launches to space aboard rocket ship The billionaires fuelling a space race Jeff Bezos and crew launch into space on New Shepard. Video, 00:02:17Jeff Bezos and crew launch into space on New Shepard Night-time curfew imposed in fire-hit areas of LA as police warn against 'despicable' looting 'I have nothing to go back to' - BBC reporter tells of LA fires heartbreak Trump avoids prison or fine in hush-money case sentencing LA fires: How three days of devastation unfolded What's the latest on the Los Angeles wildfires and what caused them? The '9/11 mastermind' wants to plead guilty. Why is the US trying to stop him? Pop star Chappell Roan wins BBC Sound Of 2025 Weekly quiz: Zendaya looked happy but who else sparkled at the Golden Globes? Inside the UK's first legal drug consumption room Sheen to fund new national theatre for Wales Danes struggle with response to Trump Greenland threat The Upbeat newsletter: Start your week on a high with uplifting stories delivered to your inbox Dragons’ Den returns with a new line-up of celebrity guests Can a fresh batch of entrepreneurs secure the deal of a lifetime? Are smart scales really as ‘smart’ as they claim to be? Greg Foot explores whether they can accurately measure weight, body fat, muscle and bone mass The award-winning psychological competition is back A nail-biting game of detection, backstabbing and trust. Who will make it through? How close are we to a cancer vaccine? How might it help in the treatment of the disease? © 2025 BBC. The BBC is not responsible for the content of external sites.Read about our approach to external linking.",Positive,0.87644047
"About 200 servicemen and women from the Army and RAF have been drafted in to deliver fuel. One in five forecourts in London and the south-east of England is still without fuel, the body that represents independent fuel sellers has said. The Petrol Retailers Association (PRA) said there had been a ""marked improvement"" across the rest of the UK thanks to ""steady deliveries"". But conditions in the South East are ""still challenging"", the PRA said. The improvement in supplies has led to forecourt firm EG Group to remove its £30 cap on buying fuel at its sites. It said purchases were returning to normal levels in the majority of places, apart from the south of England. However, the company, which has about 400 sites in the UK, added it expected supply issues to ease ""in the coming days"" due to the military driving tankers to restore supplies. About 200 servicemen and women from the Army and RAF have been drafted in to deliver fuel from depots to forecourts. The PRA said the situation around London and the South East was ""still challenging"". In these areas, it said 62% of the sites surveyed had both grades of fuel available, 18% had only one grade and 20% were dry. In the rest of the country, the trade body said 86% of sites had both grades of fuel ""thanks to steady deliveries and stabilising demand"", with 6% having only one grade and 8% being dry. ""We are grateful for the support lent by the government through their provision of military drivers, although further action must be taken to address the needs of disproportionately affected areas,"" said Gordon Balmer, executive director of the PRA. The PRA represents the interests of the independent filling stations across the UK, which account for nearly 5,500 of the UK's 8,380 forecourts. Is the petrol shortage improving? The government has been criticised for not deploying the military earlier after panic-buying led to chaos and queues on some petrol station forecourts. More than 65 drivers will start work, with plans to increase this to 200 personnel to be deployed in total, including 100 drivers. The drivers have undertaken refresher training with the fuel delivery firm, Hoyer in order to take on the work. Hoyer said the training included company safety procedures as well as equipment familiarisation and forecourt driving manoeuvres. A government spokesperson said there were signs of improvement in average forecourt stocks across the UK, adding that demand was ""continuing to stabilise"". ""More than half of those who have completed training to make fuel deliveries are being deployed to terminals serving London and the South-East of England, demonstrating that the sector is allocating drivers to areas most affected in this first phase from Monday,"" the spokesperson said. 23 September:BP temporarily closes some petrol stationsdue to a shortage of lorry drivers 25 September:After days of long queues at stations, with many running dry, the governmentannounces a temporary visa scheme, allowing 5,000 lorry drivers to work in the UK in the run-up to Christmas 27 September:The Army is put on standbyto help deliver fuel to stations hit by shortages 28 September:Prime Minister Boris Johnsonsays the situation at forecourts is ""stabilising"", while the PRA says there are ""early signs"" pressure is starting to ease at pumps 2 October:Despite a ""distinct improvement"" nationwide,the PRA says petrol supplies remain critical in London and south-east England 4 October: Army starts to deliver fuel to speed up replenishments The crisis began more than 10 days ago when BP said it had run out of petrol in a number of its outlets. That prompted motorists to fill up more than usual, leaving deliveries unable to keep up with demand. Many sectors of the UK economy, including food firms and petrol retailers, have been affected by a chronic shortage of lorry drivers, which the haulage industry has blamed on factors including Covid, Brexit, an aging workforce, and tax changes. David Charman, who runs Parkfoot Garage in West Malling in Kent, told the BBC's Today programme there was a big task ahead to restore supplies. ""This is not panic-buying anymore, this is people that have waited as long as they possibly can and now they have no fuel. We're having to push cars that are in the queue to get to our site because they've run out of fuel,"" he said. ""We didn't have the normal two days of stock underground... because of Covid but we were still managing the situation perfectly well. But now, when we're all empty, it needs a huge influx of fuel deliveries to everybody, not just to me, to ensure that we can get through this."" Are you affected by issues covered in this story?  Share your stories and video by emailinghaveyoursay@bbc.co.uk,external. Please include a contact number if you are willing to speak to a BBC journalist. You can also get in touch in the following ways: WhatsApp:+44 7756 165803 Tweet:@BBC_HaveYourSay,external Upload pictures or video Please read ourterms & conditionsandprivacy policy If you are reading this page and can't see the form you will need to visit the mobile version of theBBC websiteto submit your question or comment or you can email us atHaveYourSay@bbc.co.uk,external. Please include your name, age and location with any submission. Fuel issues persist in south but 'over' elsewhere Military to deliver petrol to garages from Monday Comments can not be loaded To load Comments you need to enable JavaScript in your browser Night-time curfew imposed in fire-hit areas of LA as police warn against 'despicable' looting 'I have nothing to go back to' - BBC reporter tells of LA fires heartbreak Trump avoids prison or fine in hush-money case sentencing LA fires: How three days of devastation unfolded What's the latest on the Los Angeles wildfires and what caused them? The '9/11 mastermind' wants to plead guilty. Why is the US trying to stop him? Pop star Chappell Roan wins BBC Sound Of 2025 Weekly quiz: Zendaya looked happy but who else sparkled at the Golden Globes? Inside the UK's first legal drug consumption room Sheen to fund new national theatre for Wales Danes struggle with response to Trump Greenland threat The Upbeat newsletter: Start your week on a high with uplifting stories delivered to your inbox Dragons’ Den returns with a new line-up of celebrity guests Can a fresh batch of entrepreneurs secure the deal of a lifetime? Are smart scales really as ‘smart’ as they claim to be? Greg Foot explores whether they can accurately measure weight, body fat, muscle and bone mass The award-winning psychological competition is back A nail-biting game of detection, backstabbing and trust. Who will make it through? How close are we to a cancer vaccine? How might it help in the treatment of the disease? © 2025 BBC. The BBC is not responsible for the content of external sites.Read about our approach to external linking.",Positive,0.9995982
