article,article_sentiment,article_score
"The Duke of Cambridge has said the royal tour of the Caribbean was an ""opportunity to reflect"" The future relationship between the UK and Belize, Jamaica and the Bahamas is for their people to decide, the Duke of Cambridge has said. He said that he and the duchess were ""committed to service"" and that ""for us that's not telling people what to do"". Prince William's comments come after an eight-day tour of the Caribbean nations to mark the Queen's Platinum Jubilee. The trip saw the Jamaican prime minister publicly tell the royal couple that his country would be ""moving on"". It also came four months afterBarbados replaced the Queen with an elected president. In a written statement reflecting on the trip, the prince said foreign tours were an ""opportunity to reflect"". ""You learn so much,"" he said. ""What is on the minds of prime ministers. The hopes and ambitions of school children. The day-to-day challenges faced by families and communities."" William respects Caribbean nations mulling republics Duchess of Cambridge speaks to schoolchildren in the Bahamas The trip saw the duke and duchess visit Belize and Jamaica before a final stop in the Bahamas. The Bahamas leg included a trip to a primary school, where the duchess spoke to pupils about the importance of being able to reconnect after being separated during the pandemic. The couple also visited a church on the Abaco Islands to speak to locals about destruction caused by Hurricane Dorian in 2019, and a coral conservation project that was among last year's winners of the Royal Foundation's Earthshot Prize for contributions to environmentalism. The duke and duchess visit a memorial wall to the victims of Hurricane Dorian in 2019 on the Abaco Islands The duke continued: ""I know that this tour has brought into even sharper focus questions about the past and the future. ""In Belize, Jamaica and the Bahamas, that future is for the people to decide upon."" After the couple left Belize on Tuesday, a government minister announced a new commission would begin consulting with people across the country on how the ""decolonization process"" should proceed. Bahamian Prime Minister Philip Davis has not commented on the issue, although last year said it was ""not on the agenda"". However, the day before the duke and duchess arrived in the Bahamas, a letter was released by campaign group The National Reparations Committee, calling for Britain to pay reparations for the slave trade. In the statement, the duke said he and his wife saw the purpose of their roles as being to serve and support people ""in whatever way they think best, by using the platform we are lucky to have"". ""Who the Commonwealth chooses to lead its family in the future isn't what is on my mind,"" he said. ""What matters to us is the potential the Commonwealth family has to create a better future for the people who form it."" The royal couple visit a coral conservation project that was among the winners of the Royal Foundation's 2021 Earthshot Prize for contributions to environmentalism The PR missteps that overshadowed a royal tour William and Kate dance and try chocolate in Belize William expresses 'profound sorrow' over slavery Death toll rises as governor confirms hydrants issue 'impaired' LA wildfires fight 'I have nothing to go back to' - reporter tells of LA fires heartbreak Reeves pledges to 'make UK better off' on China visit LA fires: How three days of devastation unfolded What's the latest on the Los Angeles wildfires and what caused them? 'Cold bites' gas supply and 'Dementia shock' 'My mum died after four days on an A&E trolley' The '9/11 mastermind' wants to plead guilty. Why is the US trying to stop him? Pop star Chappell Roan wins BBC Sound Of 2025 Weekly quiz: Zendaya looked happy but who else sparkled at the Golden Globes? Inside the UK's first legal drug consumption room Danes struggle with response to Trump Greenland threat Dragons’ Den returns with a new line-up of celebrity guests Can a fresh batch of entrepreneurs secure the deal of a lifetime? Are smart scales really as ‘smart’ as they claim to be? Greg Foot explores whether they can accurately measure weight, body fat, muscle and bone mass The award-winning psychological competition is back A nail-biting game of detection, backstabbing and trust. Who will make it through? How close are we to a cancer vaccine? How might it help in the treatment of the disease? © 2025 BBC. The BBC is not responsible for the content of external sites.Read about our approach to external linking.",Negative,9.691488e-15
"Canada's Natural Resources Minister Jonathan Wilkinson says there is agreement about moving away from Russian oil and gas Canada says it can provide more oil, gas and uranium to help solve the global energy crisis. Prices have soared as a result of Russian supplies being squeezed because of its invasion of Ukraine. Canada's natural resources minister said many countries are committed ""to help as much as we can in terms of displacing Russian oil and gas"". The world's fourth biggest oil producer has committed to exporting an extra 200,000 barrels of oil. Its Natural Resources Minister Jonathan Wilkinson told BBC News it would also export an additional 100,000 barrels of natural gas. EU signs US gas deal to curb reliance on Russia Could the world cope without Russian oil and gas? Saudi oil giant to ramp up energy production It follows requests from its allies at ameeting of the world's energy ministers,externalat the International Energy Agency (IEA) in Paris, which pledged to accelerate the move to clean energy. ""We expect that by the end of the year we will be fully up to the 300,000 barrels,"" said Mr Wilkinson. However, that is only a fraction of the three million barrels a day that the IEA says will be removed from global markets by next month because of sanctions against Russia. Canada will export 200,000 more barrels of oil per day by the end of the year Canada is limited in how much oil it can export because its pipelines are running near full capacity, but Mr Wilkinson says sending it via the United States is an option. Canada's biggest pipeline company Enbridge told the BBC it is ""prepared to do what we can to increase energy security for both North America and Europe"". The impact of Canada's extra supplies ""will be relatively limited given the regionality of Canadian crude, which will likely stay in the North American market"", according to Louise Dickson, who is a senior oil analyst at the consultancy Rystad Energy. ""The main energy crisis is playing out in Europe due to supply shortages, and Asia where demand is on the cusp of recovering if Covid-19 lockdowns can be kept at bay,"" added Ms Dickson. Canada has joined the US and UK in introducinga ban on Russian oil. That hasseen prices pushed upas high as almost $130 (£98.56) a barrel since the war in Ukraine began. Mr Wilkinson believes ""there is a consensus"" among the other energy ministers at the meeting that the world needs to cope without Russian oil and gas, adding: ""I think the only differences are around how fast can you actually get away from it."" However, the investment bank JP Morgan says it thinks the ""current extreme aversion to Russian oil will subside"" and that the price of a barrel of oil will fall back to about $100 in the second half of this year. TheInternational Monetary Fund,externalis among those who have raised concerns that higher oil prices are causing costs of goods and energy bills to rise and that inflation is harming the global economy. Mr Wilkinson said leaders must ensure that people ""are able to heat their homes and that industries are able to produce the goods that we all need."" Motorists, including these in Toronto, have seen the price of filling up their car go up as a result of the war in Ukraine In the longer term, Mr Wilkinson said he recognised that ""energy security and fighting climate change are intimately linked"". Addressing immediate concerns, he argued: ""Canadian oil displacing Russian oil doesn't cause more climate change. There's no more CO2 emissions."" Having previously run a ""clean energy"" company, Mr Wilkinson said he was a big believer in using hydrogen and other renewable sources to create more energy going forward. The variable nature of solar and wind power means ""there is a role for nuclear in many jurisdictions in terms of providing baseload rather than intermittent power"", Mr Wilkinson said. Russia plays a key role in the global nuclear power industry. As well as mining uranium, it does a lot of the processing to make it useable in power stations. Energy ministers meeting at the IEA in Paris agreed to maintain a focus on cutting carbon emissions as they seek to move away from Russian oil and gas Canada is ""absolutely"" prepared to export more uranium, said Mr Wilkinson. He explained ""our uranium producers actually do have excess capacity and certainly could ramp up to to help to fill the gap that Russian supplies will provide"". The UN Secretary General didn't mention a role for nuclear power when he said a few days ago that therush to use fossil fuels because of the war in Ukraine is ""madness""and threatens the ability to limit the rise in global temperatures to 1.5C. Mr Wilkinson said: ""I think where the secretary general and I would agree very much... is the need to accelerate the work that we're doing on climate change. ""We are we are running out of time. There is no question about that - we need to make significant progress by 2030."" He suggested that the war in Ukraine is underlining ""how important it is not just from a climate perspective, although that's enough, it's from an energy security perspective that we actually do this now. We don't wait."" You can watch Jonathan Wilkinson's full interview on ""Talking Business with Aaron Heslehurst"" this weekend. Viewers in the UK can watch the show on Sunday at 15:30 on theBBC News Channel. In other countries, it will be onBBC World Newsat Saturday at 12:30 & 23:30 GMT and Sunday 06:30 & 18:30 GMT. Airline giant Delta warns ticket prices will rise Will war in Ukraine thaw US-Venezuela relations? Oil sanctions take west into uncharted waters Death toll rises as governor confirms hydrants issue 'impaired' LA wildfires fight 'I have nothing to go back to' - reporter tells of LA fires heartbreak Reeves pledges to 'make UK better off' on China visit LA fires: How three days of devastation unfolded What's the latest on the Los Angeles wildfires and what caused them? 'Cold bites' gas supply and 'Dementia shock' 'My mum died after four days on an A&E trolley' The '9/11 mastermind' wants to plead guilty. Why is the US trying to stop him? Pop star Chappell Roan wins BBC Sound Of 2025 Weekly quiz: Zendaya looked happy but who else sparkled at the Golden Globes? Inside the UK's first legal drug consumption room Danes struggle with response to Trump Greenland threat Dragons’ Den returns with a new line-up of celebrity guests Can a fresh batch of entrepreneurs secure the deal of a lifetime? Are smart scales really as ‘smart’ as they claim to be? Greg Foot explores whether they can accurately measure weight, body fat, muscle and bone mass The award-winning psychological competition is back A nail-biting game of detection, backstabbing and trust. Who will make it through? How close are we to a cancer vaccine? How might it help in the treatment of the disease? © 2025 BBC. The BBC is not responsible for the content of external sites.Read about our approach to external linking.",Positive,0.99999845
"Canada's Natural Resources Minister Jonathan Wilkinson says there is agreement about moving away from Russian oil and gas Canada says it can provide more oil, gas and uranium to help solve the global energy crisis. Prices have soared as a result of Russian supplies being squeezed because of its invasion of Ukraine. Canada's natural resources minister said many countries are committed ""to help as much as we can in terms of displacing Russian oil and gas"". The world's fourth biggest oil producer has committed to exporting an extra 200,000 barrels of oil. Its Natural Resources Minister Jonathan Wilkinson told BBC News it would also export an additional 100,000 barrels of natural gas. EU signs US gas deal to curb reliance on Russia Could the world cope without Russian oil and gas? Saudi oil giant to ramp up energy production It follows requests from its allies at ameeting of the world's energy ministers,externalat the International Energy Agency (IEA) in Paris, which pledged to accelerate the move to clean energy. ""We expect that by the end of the year we will be fully up to the 300,000 barrels,"" said Mr Wilkinson. However, that is only a fraction of the three million barrels a day that the IEA says will be removed from global markets by next month because of sanctions against Russia. Canada will export 200,000 more barrels of oil per day by the end of the year Canada is limited in how much oil it can export because its pipelines are running near full capacity, but Mr Wilkinson says sending it via the United States is an option. Canada's biggest pipeline company Enbridge told the BBC it is ""prepared to do what we can to increase energy security for both North America and Europe"". The impact of Canada's extra supplies ""will be relatively limited given the regionality of Canadian crude, which will likely stay in the North American market"", according to Louise Dickson, who is a senior oil analyst at the consultancy Rystad Energy. ""The main energy crisis is playing out in Europe due to supply shortages, and Asia where demand is on the cusp of recovering if Covid-19 lockdowns can be kept at bay,"" added Ms Dickson. Canada has joined the US and UK in introducinga ban on Russian oil. That hasseen prices pushed upas high as almost $130 (£98.56) a barrel since the war in Ukraine began. Mr Wilkinson believes ""there is a consensus"" among the other energy ministers at the meeting that the world needs to cope without Russian oil and gas, adding: ""I think the only differences are around how fast can you actually get away from it."" However, the investment bank JP Morgan says it thinks the ""current extreme aversion to Russian oil will subside"" and that the price of a barrel of oil will fall back to about $100 in the second half of this year. TheInternational Monetary Fund,externalis among those who have raised concerns that higher oil prices are causing costs of goods and energy bills to rise and that inflation is harming the global economy. Mr Wilkinson said leaders must ensure that people ""are able to heat their homes and that industries are able to produce the goods that we all need."" Motorists, including these in Toronto, have seen the price of filling up their car go up as a result of the war in Ukraine In the longer term, Mr Wilkinson said he recognised that ""energy security and fighting climate change are intimately linked"". Addressing immediate concerns, he argued: ""Canadian oil displacing Russian oil doesn't cause more climate change. There's no more CO2 emissions."" Having previously run a ""clean energy"" company, Mr Wilkinson said he was a big believer in using hydrogen and other renewable sources to create more energy going forward. The variable nature of solar and wind power means ""there is a role for nuclear in many jurisdictions in terms of providing baseload rather than intermittent power"", Mr Wilkinson said. Russia plays a key role in the global nuclear power industry. As well as mining uranium, it does a lot of the processing to make it useable in power stations. Energy ministers meeting at the IEA in Paris agreed to maintain a focus on cutting carbon emissions as they seek to move away from Russian oil and gas Canada is ""absolutely"" prepared to export more uranium, said Mr Wilkinson. He explained ""our uranium producers actually do have excess capacity and certainly could ramp up to to help to fill the gap that Russian supplies will provide"". The UN Secretary General didn't mention a role for nuclear power when he said a few days ago that therush to use fossil fuels because of the war in Ukraine is ""madness""and threatens the ability to limit the rise in global temperatures to 1.5C. Mr Wilkinson said: ""I think where the secretary general and I would agree very much... is the need to accelerate the work that we're doing on climate change. ""We are we are running out of time. There is no question about that - we need to make significant progress by 2030."" He suggested that the war in Ukraine is underlining ""how important it is not just from a climate perspective, although that's enough, it's from an energy security perspective that we actually do this now. We don't wait."" You can watch Jonathan Wilkinson's full interview on ""Talking Business with Aaron Heslehurst"" this weekend. Viewers in the UK can watch the show on Sunday at 15:30 on theBBC News Channel. In other countries, it will be onBBC World Newsat Saturday at 12:30 & 23:30 GMT and Sunday 06:30 & 18:30 GMT. Airline giant Delta warns ticket prices will rise Will war in Ukraine thaw US-Venezuela relations? Oil sanctions take west into uncharted waters Death toll rises as governor confirms hydrants issue 'impaired' LA wildfires fight 'I have nothing to go back to' - reporter tells of LA fires heartbreak Reeves pledges to 'make UK better off' on China visit LA fires: How three days of devastation unfolded What's the latest on the Los Angeles wildfires and what caused them? 'Cold bites' gas supply and 'Dementia shock' 'My mum died after four days on an A&E trolley' The '9/11 mastermind' wants to plead guilty. Why is the US trying to stop him? Pop star Chappell Roan wins BBC Sound Of 2025 Weekly quiz: Zendaya looked happy but who else sparkled at the Golden Globes? Inside the UK's first legal drug consumption room Danes struggle with response to Trump Greenland threat Dragons’ Den returns with a new line-up of celebrity guests Can a fresh batch of entrepreneurs secure the deal of a lifetime? Are smart scales really as ‘smart’ as they claim to be? Greg Foot explores whether they can accurately measure weight, body fat, muscle and bone mass The award-winning psychological competition is back A nail-biting game of detection, backstabbing and trust. Who will make it through? How close are we to a cancer vaccine? How might it help in the treatment of the disease? © 2025 BBC. The BBC is not responsible for the content of external sites.Read about our approach to external linking.",Negative,4.8538635e-11
"Three Arab League states normalised relations with Israel for the first time in 2020 Israel's foreign minster says deepening ties with friendly countries from the Arab League will ""first and foremost"" help counter the threat from Iran. He was speaking after a summit held in Israel for the first time with top diplomats from Arab League countries and the US. Three of them - the United Arab Emirates (UAE), Bahrain and Morocco - formed ties with Israel only in 2020. The foreign ministers pledged to continue to develop the partnership. The Arab League diplomats, along with US Secretary of State Anthony Blinken and Egypt's foreign minister, also reiterated their support for a peaceful solution to the Israel-Palestinian conflict. All back the creation of an independent Palestinian state alongside Israel as part of that, something Israeli Prime Minister Naftali Bennett has ruled out. The Palestinian foreign ministry called the summit ""a harsh attack against the Palestinian people"", although it did not directly accuse the Arab League participants, the Times of Israel reported. As the ministers gathered at a hotel in Israel's Negev desert on Sunday night,two Israeli Arab gunmen launched an attack in the northern Israeli city of Hadera, killing two policemen and wounding six people. The gunmen were shot dead by counter-terrorism officers. The Islamic State group said it had carried out the attack. The foreign ministers condemned the killings of the Israeli officers, with Morocco's saying the summit was ""the best response"" to such attacks. After the meeting on Monday morning, Israeli Foreign Minister Yair Lapid said the delegates had agreed to make the event ""a permanent forum"". ""What we are doing here is making history, building a new regional architecture based on progress, technology, religious tolerance, security and intelligence co-operation. This new architecture, the shared capabilities we are building, intimidates and deters our common enemies, first and foremost Iran and its proxies."" Five reasons why Israel's peace deals matter Meanwhile the King of Jordan, Abdullah II, visited Palestinian Prime Minister Mahmoud Abbas in the West Bank city of Ramallah on Monday in his first such trip since 2017. Mr Blinken also held talks with Mr Abbas on Sunday, where he reiterated his support for a two-state solution to the Israel-Palestinian conflict and for increasing funding to the Palestinians. Earlier in the day, Mr Blinken met Prime Minister Bennett in Jerusalem, following which Mr Bennett's spokesperson said the prime minister had tested positive for coronavirus. The Israel-US talks took place at a time of growing Israeli fears that the US is on the brink of signing a new agreement with Iran to curb its nuclear programme in return for an end to crippling US-led sanctions. It is also concerned that the US will remove Iran's powerful Islamic Revolution Guard Corps (IRGC) from its list of terrorist groups as part of a new nuclear deal. Former US President Donald Trump pulled out of a 2015 global nuclear agreement with Iran and restored sanctions in a move which led Iran to significantly advance its nuclear activities which had been barred by the accord. Israel says it believes a new deal will be weaker than the previous one and enable Iran to intensify its military activities across the region. Israel plays peacemaker in Ukraine-Russia war Israel and Morocco agree to normalise relations Death toll rises as governor confirms hydrants issue 'impaired' LA wildfires fight 'I have nothing to go back to' - reporter tells of LA fires heartbreak Reeves pledges to 'make UK better off' on China visit LA fires: How three days of devastation unfolded What's the latest on the Los Angeles wildfires and what caused them? 'Cold bites' gas supply and 'Dementia shock' 'My mum died after four days on an A&E trolley' The '9/11 mastermind' wants to plead guilty. Why is the US trying to stop him? Pop star Chappell Roan wins BBC Sound Of 2025 Weekly quiz: Zendaya looked happy but who else sparkled at the Golden Globes? Inside the UK's first legal drug consumption room Danes struggle with response to Trump Greenland threat Dragons’ Den returns with a new line-up of celebrity guests Can a fresh batch of entrepreneurs secure the deal of a lifetime? Are smart scales really as ‘smart’ as they claim to be? Greg Foot explores whether they can accurately measure weight, body fat, muscle and bone mass The award-winning psychological competition is back A nail-biting game of detection, backstabbing and trust. Who will make it through? How close are we to a cancer vaccine? How might it help in the treatment of the disease? © 2025 BBC. The BBC is not responsible for the content of external sites.Read about our approach to external linking.",Positive,1.0
