article,article_sentiment,article_score
"Refugees are forced to put their trust in strangers Five weeks into Russia's brutal invasion of Ukraine, imagine for a moment what it's like to live there now. Bombs, bloodshed, trauma. No school for your children, no healthcare for your parents, no safe roof over your head in many parts of the country. Would you try to run?Ten million Ukrainians have, according to the United Nations. Most seek refuge in other areas of Ukraine, believed to be safer. But more than three and a half million people have fled over the border. They are mainly women and children, as men under the age of 60 are obliged by the Ukrainian government to stay put and fight. Displaced and disoriented, often with no idea where to go next, refugees are forced to put their trust in strangers. The chaos of war is now behind them, but the truth is, they're not entirely safe outside Ukraine either. ""For predators and human traffickers, the war in Ukraine is not a tragedy,"" UN Secretary General António Guterres warned on Twitter. ""It's an opportunity - and women and children are the targets."" Trafficking rings are notoriously active in Ukraine and neighbouring countries in peace time. The fog of war is perfect cover to increase business. Karolina Wierzbińska, a coordinator at Homo Faber, a human rights organisation based in Lublin, told me children were a huge concern. Many youngsters were travelling out of Ukraine unaccompanied, she said. Patchy registration processes in Poland and other border regions - especially at the start of the war - meant children disappeared, their current whereabouts unknown. My colleagues and I headed down to the Polish-Ukrainian border to see for ourselves. At a train station, well known for refugee arrivals, we found a hive of activity. Dazed-looking women and crying children were all around. Women and their children have been arriving at the border area Many were being comforted and offered hot food from steaming industrial-sized cooking pots by an army of volunteers wearing high-vis gilets. So far, so well organised, right? Not quite. We met Margherita Husmanov, a Ukrainian refugee from Kyiv in her early 20s. She arrived at the border two weeks ago, but decided to stay on, to help stop fellow refugees falling into the wrong hands. I asked her if she felt vulnerable. ""Yes,"" she told me. ""That's especially why I worry about their safety. ""The women and children come here from a terrible war. They don't speak Polish or English. They don't know what's going on and they believe what anyone tells them. ""Anyone can turn up at this station. The first day I volunteered, we saw three men from Italy. They were looking for beautiful women to sell into the sex trade. ""I called the police and it turned out I was right. It wasn't paranoia. It's horrible."" Margherita Husmanov is a refugee turned volunteer Margherita says local officials are a bit more organised now. Police regularly patrol the station. The people (mainly men, we're told) with cardboard signs to tempting destinations, so present in the first couple of weeks of refugee arrivals, have largely disappeared. But as we find out from a number of sources, other ill-intentioned individuals are now posing as high-vis-wearing volunteers. Elena Moskvitina spoke out on Facebook to raise awareness. She's now safely in Denmark, so we chatted at length via Skype. Her experience is chilling. She and her children crossed into neighbouring Romania from war-torn Ukraine. They were looking for a lift away from the border. What she described as fake volunteers at a refugee centre asked where she was staying. They turned up later in the day and aggressively told her Switzerland was the best place to go and that they'd give her a lift there, with a van full of other women. Elena told me the men looked at her and her daughter ""sleazily"". Her daughter was petrified. They asked her to show them her son, who was in another room. They looked him up and down, she said. They then insisted she travel with no-one else except them, and they got angry when she asked to see their ID cards. To get the men away from her family, Elena promised to meet them when the other women were in their van. But as soon as they left, she told me, she grabbed her children and ran. Elżbieta Jarmulska offers safe passage to Ukrainian refugees Elżbieta Jarmulska, a feisty Polish entrepreneur, is the founder of the Women Take The Wheel Initiative. Her aim, she says, is to provide Ukrainian refugees with a ""bubble of safety"". ""Those women have been through so much already, walking or driving their way through a war zone and then they are exposed to fear and exploitation here? I have no words for what that must be like,"" she says. By now, she has recruited more than 650 Polish ""amazing women"", as she describes them, driving backwards and forwards as often as they can to the Polish-Ukrainian border, in order to offer refugees safe passage. I accompany Elżbieta, better known as Ela, to a refugee centre where she makes a point of showing her ID card and proof of residence to officials, before she asks if anyone wants a lift to Warsaw. Her car was full in moments. The passengers: refugee Nadia and her three children. Ela settled the family into her thoughtfully stocked car, offering the small children water, chocolate and motion-sickness tablets if they needed them. Nadia and her children are grateful for the lift Nadia, meanwhile, told me of her dangerous journey out of Ukraine from Kharkiv. Now in Poland, she was so relieved, she said, to have a female driver. She'd heard of the risks of trafficking and exploitation on Ukrainian radio. But she came anyway. Her home was being shelled, she said. The risks of war were more immediate. Ela has the refugees' best interests at heart. But leaving the border safely doesn't mean the danger is over for them. Most we spoke to hoped to go home as soon as the violence ends. But over the next days, weeks, even months, they need somewhere to sleep, to eat, to send their children to school, as well as a job to properly support themselves. Those needs make refugees vulnerable. EU leaders have unanimously approved a measure to open up the job market, schools and access to health care for Ukrainians, but as human rights groups point out, refugees need help to get registered and be informed of their rights. One of the volunteers I met at the Polish-Ukrainian border told me that when you're down and out, friendless and in need of money, you can all too easily end up doing things you would have never imagined. This woman was lured into prostitution when she was younger. And that, she says, is a large part of the reason she's helping Ukrainian refugees now. ""I want to protect them. To warn them,"" she told me. She asked me not to reveal her name. She's since turned her life around and doesn't want her children to know about her past. Refugees are all too vulnerable to exploitation Five weeks into Russia's onslaught in Ukraine, processes across Europe screening those claiming to help Ukrainians are still far from foolproof. Organised crime (including sex and organ trafficking and frequently, slave labour) is not the only menace. Refugees are exploited by individuals too. People in Poland, Germany, the UK and elsewhere have opened up their homes to refugees, most with the best of intentions. But sadly not all. We found a post on social media from a Ukrainian woman who fled to Düsseldorf in Germany. The man who offered her a room confiscated her ID papers and demanded she clean his house for free. He then started to make sexual advances as well. She refused - and he kicked her out on the street. Irena Dawid-Olczyk, chief executive of the Warsaw branch of anti-trafficking NGO La Strada, told me the story was all too familiar. That kind of thing happens, war or no war, she told me. But an avalanche of conflict-scarred women and children bursting out of Ukraine means that exploitation and abuse cases escalate. She cites teenage refugees as a particular concern. ""We all know teenagers, don't we? They're insecure. They want acceptance and recognition,"" she says. ""And if they are refugees who are far from home and friends, they're even easier to exploit. ""Girls might love attention lavished on them by older men. Or they'll be introduced to a cool girl their own age, who has great clothes and invites them to parties. ""That's how it starts. Don't forget, it's not only men who are pimps, traffickers and abusers."" Refugees are given leaflets offering help The push factors for Ukrainian women to accept seemingly generous online offers to escape their difficulties also increase manyfold in war time. Without revealing identities, Irena reels off case after case that La Strada Poland is working on - Ukrainian girls offered plane tickets to Mexico, Turkey, the UAE, without ever having met the men inviting them. ""My colleagues are trying to persuade a 19-year-old girl not to join her friend at a man's house,"" she says. ""She knows her friend has been beaten. But the man calls her on her mobile, says sweet things and offers her presents. ""If they insist on going, we beg the girls to at least register with the local authorities. If they don't, they have our phone number. ""I hope they can call us if they need us."" Governments across Europe have pledged solidarity with Ukraine. Human rights groups want them to take better care of those running for their lives. They need protection. Where have Ukraine's millions of refugees gone? Death toll rises as governor confirms hydrants issue 'impaired' LA wildfires fight 'I have nothing to go back to' - reporter tells of LA fires heartbreak Reeves pledges to 'make UK better off' on China visit LA fires: How three days of devastation unfolded What's the latest on the Los Angeles wildfires and what caused them? 'Cold bites' gas supply and 'Dementia shock' 'My mum died after four days on an A&E trolley' The '9/11 mastermind' wants to plead guilty. Why is the US trying to stop him? Pop star Chappell Roan wins BBC Sound Of 2025 Weekly quiz: Zendaya looked happy but who else sparkled at the Golden Globes? Inside the UK's first legal drug consumption room Danes struggle with response to Trump Greenland threat Dragons’ Den returns with a new line-up of celebrity guests Can a fresh batch of entrepreneurs secure the deal of a lifetime? Are smart scales really as ‘smart’ as they claim to be? Greg Foot explores whether they can accurately measure weight, body fat, muscle and bone mass The award-winning psychological competition is back A nail-biting game of detection, backstabbing and trust. Who will make it through? How close are we to a cancer vaccine? How might it help in the treatment of the disease? © 2025 BBC. The BBC is not responsible for the content of external sites.Read about our approach to external linking.",Negative,0.085571505
"Tests take place behind the barriers of a makeshift Covid centre in Shanghai earlier this week China has announced its biggest city-wide lockdown since the Covid outbreak began more than two years ago. The city of Shanghai will be locked down in two stages over nine days while authorities carry out Covid-19 testing. The important financial hub has battled a new wave of infections for nearly a month, although case numbers are not high by some international standards. Authorities had so far resisted locking down the city of some 25 million people to avoid destabilising the economy. But after Shanghai recorded its highest daily number of cases on Saturday since the early days of the pandemic, authorities appear to have changed course. The lockdown will happen in two stages, with the eastern side of the city under restrictions from Monday until 1 April, and the western side from 1-5 April. Public transport will be suspended and firms and factories must halt operations or work remotely, authorities said. The city government published the instructions on its WeChat account, asking the public ""to support, understand and cooperate with the city's epidemic prevention and control work"". How is China's zero-Covid strategy changing? Omicron vs Zero-Covid: How long can China hold on? Other lockdowns during the pandemic have affected entire Chinese provinces, though people could often still travel within those regions. But Shanghai, due to its high population density, is the largest single city to be locked down to date. It is China's commercial capital and by some calculations the biggest city in the country - but is now one of the worst-hit areas as China fights to contain a resurgence of the virus with Omicron, leading to a spike in new cases. Officials had until now said the eastern Chinese port and financial hub must keep running for the good of the economy. The staggered approach to this lockdown means half the city will remain functioning at a time. Millions of residents in other Chinese cities have been subjected to citywide lockdowns,often after a relatively small number of Covid cases. In a city that's been on its knees for two weeks, parts of it reduced to something like a ghost town, the streets are now suddenly busy with panic shoppers. I've been out and seen queues stretching out of shop doors as people stock up before the lockdown starts early on Monday. The subway station at the end of my road, newly opened just a few months ago, will be shut on Monday. Public transport will stop and all residents will be subject to mass city-wide Covid testing. Almost 25 million people will be affected; the eastern side of the city first, then at the end of next week the western side. Wuhan was sealed off at the very outset of this pandemic. Before Christmas it was Xi'an. Now China's commercial and financial capital is being shut. Just a few days ago officials here said Shanghai was too big and too important to lock down. The question now on many residents' lips will be whether nine days is enough. The recent surge in cases in China, although small compared to some countries,is a significant challenge to China's ""zero-Covid"" strategy, which uses swift lockdowns and aggressive restrictions to contain any outbreak. The policy sets China apart from most other countries which are trying to live with the virus. But the increased transmissibility and milder nature of the Omicron variant has led to questions over whether the current strategy is sustainable in the long run. Some Shanghai residents have complained about the seemingly endless cycles of testing, suggesting that the cost of zero-Covid had become too high. China's national health commission reported more than 4,500 new domestically transmitted cases on Sunday. How many Covid cases are there in China? Omicron vs Zero-Covid: How long can China hold on? The economic cost of China's zero-Covid policy Death toll rises as governor confirms hydrants issue 'impaired' LA wildfires fight 'I have nothing to go back to' - reporter tells of LA fires heartbreak Reeves pledges to 'make UK better off' on China visit LA fires: How three days of devastation unfolded What's the latest on the Los Angeles wildfires and what caused them? 'Cold bites' gas supply and 'Dementia shock' 'My mum died after four days on an A&E trolley' The '9/11 mastermind' wants to plead guilty. Why is the US trying to stop him? Pop star Chappell Roan wins BBC Sound Of 2025 Weekly quiz: Zendaya looked happy but who else sparkled at the Golden Globes? Inside the UK's first legal drug consumption room Danes struggle with response to Trump Greenland threat Dragons’ Den returns with a new line-up of celebrity guests Can a fresh batch of entrepreneurs secure the deal of a lifetime? Are smart scales really as ‘smart’ as they claim to be? Greg Foot explores whether they can accurately measure weight, body fat, muscle and bone mass The award-winning psychological competition is back A nail-biting game of detection, backstabbing and trust. Who will make it through? How close are we to a cancer vaccine? How might it help in the treatment of the disease? © 2025 BBC. The BBC is not responsible for the content of external sites.Read about our approach to external linking.",Negative,0.13494146
"Jeehan Saleh and Hesham Hussain say they ""weren't shocked"" to hear standing charges where they live will see a big rise Sharp rises in standing charges on standard electricity bills will see customers face very different cost increases depending on where they live. Customers in South Scotland, Merseyside, North Wales and the South West of England will see the daily payments double from April. Those in London and the East of England will see increases of less than 60%. Almost all consumer bills include a standing charge; a fixed daily payment covering the costs of supply and other levies. The regulator Ofgem caps them for consumers on standard default tariffs in England, Wales and Scotland, although the cap varies by region. Standing charges are not the biggest part of an energy bill, but they are set to rise by more than £71 a year on average in April. Jeehan Saleh and Hesham Hussain told the BBC the wide regional differences were unfair at time when energy bills are soaring. They say they ""weren't shocked"" when they learned that standing charges where they live in Garston in South Liverpool would rise by double that of other areas. ""Surprise, surprise, Liverpool again isn't it,"" said Hesham. ""It's always us being hit the hardest,"" added Jeehan. ""There's people in poorer areas where we work who are choosing between food bills and energy bills. Thankfully we're not in that position but it's not too far from home. You're already feeling it in so many areas, this is just another hit."" The standing charge has always varied depending on where you live, due to different costs to supply homes with power in rural or more remote areas. What help with bills is there in my council tax band? Energy bills could reach £3,000 as oil price soars However, BBC research has shown that the increase this spring varies disproportionately in different parts of Britain, when comparing standard variable tariffs for electricity paid for by direct debit. Analysts told the BBC that local suppliers are moving charges which were once part of a consumer's unit price for energy (which now has a tight upper limit on it) over to their standing charge. They are also increasing standing charges to the maximum level for each region, which means a big jump for some places. The average increase - of just under 20p per day - will add more than £71 a year to a standard electricity tariff. But in North Wales and Merseyside, the South West, the Midlands, South Scotland and South Wales the rise will add over £80 a year. In London less than £30 will be added. Price per day for Single Rate Electricity Meter from April 2022 by British region in order of percentage charge. London: up 8p a day to 31p - a 38% increase Eastern: up 13p a day to 36p - a 58% increase South East: up 17p a day to 40p - a 73% increase North West: up 17p a day to 40p - 73% increase Southern: up 18p a day to 41p - an 80% increase Yorkshire: up 21p a day to 46p - an 81% increase North Scotland: up 22p a day to 48p - a 83% increase Northern: up 21p a day to 46p - an 85% increase East Midlands: up 20p a day to 43p - an 88% increase Midlands: up 22p a day to 46p - a 92% increase South Wales: up 22p a day to 46p - a 94% increase Southern Scotland: up 24p a day to 47p - a 100% increase South Western: up 25p a day to 49p - a 101% increase North Wales & Merseyside: up 23p a day to 45p - 102% increase Source: Ofgem The changes are slightly different for customers using prepayment meters. It comes as households in England, Scotland and Wales prepare for an even bigger hit when the energy price cap - which limits what consumer pay per unit of gas and electricity - also goes up in April. In Liverpool, David and Joan Boyle told us their energy bill was rising by £700. They are happy they will be able to manage but say they worry about other people. Elsewhere there was more concern. Kev Oloughlin and his son Leo ""Standing charges should be the same everywhere shouldn't they,"" said Kev Oloughlin. He was enjoying a day out in the sunshine with his son Leo. He told us they'd ""normally shop around every year when bills come in, but at the moment it's pointless"". He added: ""We're managing alright with things but we're conscious of having the heating and things like that on. Everyone's got to tighten their belt at the minute haven't they."" The standing charge not only covers costs such network maintenance, administration fees and certain government schemes. It is also the part of your bill that will contribute to the cost of the 28 energy suppliers that have gone bust since last autumn amid a cost crunch sparked by sharply rising wholesale energy prices. Ofgem told the BBC that the levy added to bills to pay for costs associated with energy suppliers going bust had been spread equally across the country. It says standing charges in some regions are increasing more than others because of a reallocation of network costs, the level of which differs between distribution networks. The BBC contacted major suppliers British Gas, Scottish Power, EDF, EOn, Ovo/SSE, Shell, Octopus and Bulb, and almost all confirmed they now have a majority of customers on a standard default tariff, which is controlled by the Ofgem cap. Three of the biggest suppliers, British Gas, Scottish and Ovo/SSE would not give details on their charges, calling them ""commercially sensitive"". But EOn, EDF, Shell, Octopus and Bulb confirmed they were increasing standing charges on these tariffs in line with the standard charge cap, with example prices (including VAT) from Bulb, EDF and Shell varying from 32p a day in London and 38p in the East, to around 50p in Northern Scotland and the South West. And it is not an expense that can be avoided by shopping around. While tariffs actively chosen by customers, such as fixed rate tariffs, are not subject to the default tariff cap on standard charges, there are only a handful of such deals on the market. Moneysupermarket told the BBC that as of 14 March, there were just five fixed tariffs available to consumers. This compares to about 96 fixed deals available at the same time in 2021. Standing charges are certainly not the biggest part of your energy bill, and they are dwarfed by the massive increases in the unit price for the energy you use. But in normal circumstances an extra £80 a year on your energy bill just from standing charges would not go unnoticed, especially as in some areas they are increasing by a lot more than others. So is something fishy going on? Ofgem assures me that the extra costs for failed energy companies are being spread equally across the country. But the Energy Networks Association say that no major network developments have happened in any areas in the last six months that would explain the regional divisions. Local suppliers are moving charges which were once part of your unit price, which now has a tight price cap on it, and shifting them across to your standing charge. Most suppliers are upping their standing charges to the maximum level for each region, which means a big jump for some places, adding insult to the injury of a whopping energy bill. Update 18 May 2022: This article was amended to reflect the fact that some previously offered deals don't include standing charges. WOMEN OF WALES:Showcasing amazing Welsh female talent and stories PEOPLE THOUGHT OF AS BITS OF AN ALGORITHM:Life and death in the warehouse How much are energy bills going up? Energy bills could reach £3,000 as oil price soars Comments can not be loaded To load Comments you need to enable JavaScript in your browser Death toll rises as governor confirms hydrants issue 'impaired' LA wildfires fight 'I have nothing to go back to' - reporter tells of LA fires heartbreak Reeves pledges to 'make UK better off' on China visit LA fires: How three days of devastation unfolded What's the latest on the Los Angeles wildfires and what caused them? 'Cold bites' gas supply and 'Dementia shock' 'My mum died after four days on an A&E trolley' The '9/11 mastermind' wants to plead guilty. Why is the US trying to stop him? Pop star Chappell Roan wins BBC Sound Of 2025 Weekly quiz: Zendaya looked happy but who else sparkled at the Golden Globes? Inside the UK's first legal drug consumption room Danes struggle with response to Trump Greenland threat Dragons’ Den returns with a new line-up of celebrity guests Can a fresh batch of entrepreneurs secure the deal of a lifetime? Are smart scales really as ‘smart’ as they claim to be? Greg Foot explores whether they can accurately measure weight, body fat, muscle and bone mass The award-winning psychological competition is back A nail-biting game of detection, backstabbing and trust. Who will make it through? How close are we to a cancer vaccine? How might it help in the treatment of the disease? © 2025 BBC. The BBC is not responsible for the content of external sites.Read about our approach to external linking.",Positive,0.9959054
