article,article_sentiment,article_score
"This video can not be played Mark Drakeford is set to remain as first minister of Wales as his party wins 30 seats in the Senedd Labour is set to stay in power in Wales after matching its best-ever Senedd election result, with exactly half of the 60 seats in the Welsh Parliament. The Tories took the Vale of Clwyd from Labour, and Brecon and Radnorshire from the Liberal Democrats. Labour held firm in other Tory target seats and took Rhondda back from Plaid Cymru. Leader Mark Drakeford, who extended the majority in his seat, vowed to form a ""stable and progressive"" government. With 52 of the 60 seats declared, Labour is on 30 with the Conservatives on 12, Plaid Cymru nine and the Liberal Democrats one. As it happened: Welsh election results day The Welsh election story - in charts It is unlikely Labour will gain further seats when votes for the regional lists in South Wales Central and South Wales East are counted on Saturday, after the party won the lion's share of constituency seats there. Current first minister Mr Drakeford,who raised his majority in his Cardiff West seat by 12.7 points and more than 6,000 votes, told BBC Wales he would ""do whatever I can"" to ensure Wales has a ""stable and progressive"" government. He added he would prefer to be in a position ""where you have a government that is able to command a majority for the action that it needs to take on the floor of the Senedd"". He added: ""Without trying to rush a decision at this time on a Friday we'll take a couple of days to make sure that we make the best decision that we can for Wales."" Allow Twitter content? This article contains content provided by Twitter. We ask for your permission before anything is loaded, as they may be using cookies and other technologies. You may want to readTwitter’s cookie policy,externalandprivacy policy,externalbefore accepting. To view this content choose‘accept and continue’. Labour also regained Rhondda from Plaid Cymru, toppling its former leader Leanne Wood. Her win there in 2016 was one of the major upsets of the last Senedd election but Labour's Buffy Williams overturned it with a 19% swing and a majority of more than 5,000. Ben Lake, the Plaid Cymru MP for Ceredigion, said losing the Rhondda seat was a ""terrible blow for the party"". Asked if the party could still play a role in a coalition with Labour if required, he said it was a ""dead duck"". ""The people of Wales have sent a very clear message at the election, and I can't see it being feasible or indeed desirable on the part of either party,"" he toldBBC Radio Wales Breakfast. Plaid Cymru has won five constituency seats, holding on to Arfon, Dwyfor Meirionnydd, Ynys Mon, Ceredigion, and Carmarthen East and Dinefwr. With three of the five regional list results declared so far, Plaid has won four list seats, the Conservatives four, Labour three and the Liberal Democrats one. The Conservatives held on to Montgomeryshire, Aberconwy, Clwyd West, Carmarthen West and South Pembrokeshire, and Preseli Pembrokeshire. The party also kept Monmouth where ex-Monmouthshire council leader Peter Fox is its new incumbent following the deselection of Nick Ramsay. But the Tories failed to capture the Vale of Glamorgan, another Labour-held target seat which is Conservative at Westminster. A modern browser with JavaScript and a stable internet connection is required to view this interactive. The Labour seats of Alyn and Deeside, Gower, Swansea East, Swansea West, Neath, Aberavon, Ogmore, Bridgend, Cynon Valley, Pontypridd, Cardiff Central, Cardiff North, Cardiff South and Penarth, Cardiff West, Caerphilly, Islwyn, Merthyr Tydfil and Rhymney, Newport East, Newport West and Torfaen have also remained red. Labour also held on to the Plaid Cymru target seat of Llanelli, with Welsh government deputy transport minister Lee Waters being re-elected. Following his victory, Mr Waters said Mark Drakeford was ""definitely an asset"", due to his leadership during the pandemic. ""He may not be flashy, he may be a bit nerdy, a bit boring, he's a university professor, but thank God for him,"" he said. Health Minister Vaughan Gething also paid tribute to his party leader, saying: ""The recognition of the way Mark has run the Welsh government in this extraordinary time was undoubtedly a factor in the way that people have voted."" How to organise an election in a pandemic A really simple guide to the Welsh elections Five things to find out from the Welsh election Despite the challenges of the pandemic, more than 1.1 million people voted, making it the highest-ever turnout for a Senedd election at 46.6%. This beat the previous record of 46.3% at the first Senedd election in 1999, but is still significantly lower than turnout for general elections. Laura McAllister, professor of public policy at Cardiff University, said Labour had ""performed better than most people expected"". ""After 22 years in power, with a Conservative Party that was really strongly tipped to make significant breakthroughs, and of course Plaid Cymru biting its ankles as well, that's some achievement."" Political commentator Prof Roger Awan-Scully said: ""I think it's been an astonishingly resilient performance by the Welsh Labour Party, amidst disasters for Labour elsewhere in the UK. ""The Conservatives are also performing strongly, but not quite bringing it home in terms of the number of constituency victories that they might have expected. ""For Plaid Cymru I think this has to be said to be a deeply disappointing election."" Gareth Davies thanked voters for their trust in him The Vale of Clwyd was the only Conservative gain in Labour's ""red wall"" of seats in north Wales where the Tories had enjoyed success in the 2019 General Election. Winning candidate Gareth Davies, an NHS physiotherapist, said: ""It's a magnificent achievement. ""In 1999 I was a small boy, and now I'm in my 30s and I never thought back then I'd ever be in this position. So I feel really humbled."" Andrew RT Davies, leader of the Tories in the Senedd, said the result in the Vale of Clwyd was ""fantastic"". North Wales has been a fiercely contested battleground, with re-elected Aberconwy Tory MS Janet Finch-Saunders sayingshe had been ""horrified""by personal attacks which had hurt her family during the campaign. Labour's win in Alyn and Deeside represents the last of the red wall seats that the Conservatives had hoped to take in north east Wales. It's the last brick in the wall. But they have only managed in this election to take Vale of Clwyd in that region - by a small amount. So it counts as a disappointing set of results for the Conservatives. Labour, which has been in charge of the Welsh government for 22 years, is now set to remain in power for a sixth term with exactly half the seats in the Senedd chamber. Of the 60 members of the Senedd (MSs) being elected, 40 will serve constituencies and 20 will be elected to represent larger regional areas of North Wales, Mid and West Wales, South Wales West, South Wales Central and South Wales East. A party needs to win 31 seats to claim a majority but it has never happened, with Labour last time having 29 seats. It previously won 30 seats in 2003 and 2011. Social distancing and other Covid measures have delayed the count in many areas For Plaid Cymru, the party's Westminster leader Liz Saville Roberts painted a gloomy picture for their hopes of making inroads into Labour's grip on the south Wales valleys. She said the pandemic had meant ""ministers in the governments, both in Westminster and Cardiff, have had an immense platform over the last year"". It had been an ""extraordinarily different"" election, Ms Saville Roberts said, ""to anything that anybody has been used to, and it's been difficult for a party like Plaid to get the same sort of platform"". ""At the same time there's a real sense that our policy, our offer of policies, has offered something that was progressive and new and is, I hope, really the seeds for something in the future,"" she added. Adam Price, who held Carmarthen East and Dinefwr with a reduced majority, said he would not stand down as Plaid Cymru leader. Adam Price was re-elected in Carmarthen East and Dinefwr but saw his majority fall Despite no gains, Mr Price said the party had increased its share of the vote and its stance on independence had been a ""net positive"". ""I'm not walking away from anything, because this is the moment when Wales needs leadership,"" he said. ""This is a historic challenge, because of the way that the politics is moving in this island, but it's also a historic opportunity for us. ""We can move our nation forward and I'm looking forward to playing my part, it's not something that anyone can do on their own. ""I have a role to play, we all have a role to play and that's what's exciting about politics at the moment. Wales is on the move Wales is on the march. I'm going to be part of that."" A modern browser with JavaScript and a stable internet connection is required to view this interactive.More information about these elections Enter your postcode, or the name of your English council or Scottish or Welsh constituency to find out. Eg 'W1A 1AA' or 'Westminster'   Meanwhile, the Welsh Liberal Democrats lost their constituency seat in Brecon and Radnorshire but won a list seat in Mid and West Wales with party leader Jane Dodds heading for the Senedd. Liberal Democrat peer Baroness Jenny Randerson said she did not think Welsh Labour would need the support of Ms Dodds to run a government as had happened with her predecessor, former Education Minister Kirsty Williams who stood down prior to the elections. ""I think Labour will have the numbers to just about manage on their own,"" said Baroness Randerson. Ian Price, director of CBI Wales, congratulated Labour. ""This is a critical time for the Welsh economy and the new parliament must have a laser-like focus on rebuilding from the devastating impact of the pandemic,"" he said. ""That means all parties pulling together and working with business to protect jobs, rebuild livelihoods and create a fair and sustainable recovery that addresses the longstanding structural challenges our economy faces."" The Abolish the Welsh Assembly Party was also hoping to make a breakthrough in the regional lists. Voting also took place for four police and crime commissioners, with those votes to be counted on Sunday. POSTCODE SEARCH:What are the results in your area? VOTE:Why full results might take longer BBC:How to follow the election results WALES:Election results,external SIGN UP FOR WALES ALERTS:Get extra updates on BBC election coverage As it happened: Welsh election results Labour's road to Welsh victory in numbers Long queues as polls close for Welsh elections How to organise an election in a pandemic Five things to find out from the Welsh election A really simple guide to the Welsh elections Deadly wildfires rage across LA as fierce winds threaten more destruction UK has enough gas, says No.10 after supply warning UK records coldest night of winter as freeze to last into weekend 'I paid fake doctor thousands for fillers - now I look like a gargoyle' The Papers: 'Lost Angeles' and 'Musk seeks plan to oust Starmer' Pop star Chappell Roan wins BBC Sound Of 2025 Weekly quiz: Zendaya looked happy but who else sparkled at the Golden Globes? The 20 child abuse inquiry proposals - what has happened so far? The '9/11 mastermind' wants to plead guilty. Why is the US trying to stop him? Why are UK borrowing costs rising and what does it mean for me? In maps: Thousands of acres on fire in LA Before and after: How wildfires tore through LA Ed Gamble hosts the official Traitors podcast Join Ed Gamble and guests as they dissect the first episodes of The Traitors! Can art, music and words bind us in divided times? Simon Schama explores how artists have captured the transformations of British society since 1945 Enjoy a satirical smorgasbord of The News Quiz Digest a dramatic year of news as Andy Zaltzman revels in some of 2024's funniest moments The multi-award-winning legal drama returns Two years on, the Defoes are back and have gathered for a beautiful wedding in Barcelona © 2025 BBC. The BBC is not responsible for the content of external sites.Read about our approach to external linking.",Positive,0.9999999
"The vaccine has already been given to millions of people The World Health Organization (WHO) has granted emergency approval for a Covid vaccine made by Chinese state-owned company Sinopharm. It is the first vaccine developed by a non-Western country to get WHO backing. The vaccine has already been given to millions of people in China and elsewhere. The WHO had previously only approved the vaccines made by Pfizer, AstraZeneca, Johnson & Johnson and Moderna. But individual health regulators in various countries - especially poorer ones in Africa, Latin America and Asia - have approved Chinese jabs for emergency use. With little data released internationally early on, the effectiveness of the various Chinese vaccines has long been uncertain. But the WHO on Friday said it had validated the ""safety, efficacy and quality"" of the Sinopharm jab developed by the Beijing Institute of Biological Products. The WHO said the addition of the vaccine had ""the potential to rapidly accelerate Covid-19 vaccine access for countries seeking to protect health workers and populations at risk"". It is recommending that the vaccine be administered in two doses to those aged 18 and over. A decision is expected in the coming days on another Chinese vaccine developed by Sinovac, while Russia's Sputnik vaccine is under assessment. The green light from the global health body is a guideline for national regulators that a vaccine is safe and effective. WHO director-general Tedros Adhanom Ghebreyesus said it would give countries ""confidence to expedite their own regulatory approval"". It also means that the vaccine can be used in the global Covax programme, which was set up last year to try to ensure fair access to vaccines among rich and poor nations. The decision to list the Chinese vaccine for emergency use is expected to give a substantial boost to the scheme, which has been struggling with supply problems. How will Covid vaccines be shared around the world? How many people have been vaccinated so far? Indians' desperate wait for Covid jab to get longer Prior to the WHO approval, the Sinopharm vaccine was already being widely used, with an estimated 65 million doses administered, according to reports. In addition to China, countries already using the vaccine include the UAE, Pakistan and Hungary. The decision on Friday to approve the vaccine for emergency use was made by the WHO's technical advisory group, which reviewed the latest clinical data and manufacturing practices. It said the vaccine's efficacy for symptomatic and hospitalised cases of Covid-19 was estimated to be 79%. The WHO noted that few adults over the age of 60 were included in clinical trials, so efficacy could not be estimated for this age group. But it said there was no reason to think that the vaccine would act differently in older recipients. The health body is yet to reach a decision on China's Sinovac vaccine. WHO experts on Friday said they were awaiting additional information before they could make a recommendation. Millions of doses of that vaccine have also already been shipped to a number of countries, which have permitted its emergency usage. This video can not be played What do we know about the Chinese vaccines? One of the Chinese vaccines' main advantages is that they can be stored in a standard refrigerator at 2-8 degrees Celsius, like the AstraZeneca vaccine. The WHO said these ""easy storage requirements"" made the Sinopharm vaccine ""highly suitable for low-resource settings"". The two Chinese vaccines differ significantly from some of the other Covid vaccines currently in use, especially those by Pfizer and Moderna. Developed in a more traditional way, they are so-called inactivated vaccines, which means they use killed viral particles to expose the immune system to the virus without risking a serious disease response. What's it like in the best place to live during Covid? Your top questions about India's Covid crisis answered By comparison, the BioNtech/Pfizer and Moderna vaccines are mRNA vaccines. This means part of the coronavirus' genetic code is injected into the body, training the immune system how to respond to it. The UK's AstraZeneca vaccine is yet another type of vaccine where a version of a common cold virus from chimpanzees is modified to contain genetic material shared by the coronavirus. Once injected, it teaches the immune system how to fight the real virus. BioNTech/Pfizer and Moderna have an efficacy rate of around 90% or higher, while the AstraZeneca jab is thought to be around 76%. In April,China's top disease control official said the efficacy of the country's Covid vaccines was low, although he later insisted his comments had been misinterpreted. How many vaccines are rich countries sharing? Indians' desperate wait for Covid jab to get longer How many people have had boosters so far? Covid vaccines: How fast is worldwide progress? Joe Rogan walks back anti-vaccination comments Deadly wildfires rage across LA as fierce winds threaten more destruction UK has enough gas, says No.10 after supply warning UK records coldest night of winter as freeze to last into weekend 'I paid fake doctor thousands for fillers - now I look like a gargoyle' The Papers: 'Lost Angeles' and 'Musk seeks plan to oust Starmer' Pop star Chappell Roan wins BBC Sound Of 2025 Weekly quiz: Zendaya looked happy but who else sparkled at the Golden Globes? The 20 child abuse inquiry proposals - what has happened so far? The '9/11 mastermind' wants to plead guilty. Why is the US trying to stop him? Why are UK borrowing costs rising and what does it mean for me? In maps: Thousands of acres on fire in LA Before and after: How wildfires tore through LA Ed Gamble hosts the official Traitors podcast Join Ed Gamble and guests as they dissect the first episodes of The Traitors! Can art, music and words bind us in divided times? Simon Schama explores how artists have captured the transformations of British society since 1945 Enjoy a satirical smorgasbord of The News Quiz Digest a dramatic year of news as Andy Zaltzman revels in some of 2024's funniest moments The multi-award-winning legal drama returns Two years on, the Defoes are back and have gathered for a beautiful wedding in Barcelona © 2025 BBC. The BBC is not responsible for the content of external sites.Read about our approach to external linking.",Positive,0.8337723
"The inquiry was launched in 2018 into a payment made to Stormy Daniels (pictured) An inquiry into whether Donald Trump violated campaign financial law during the 2016 election has been dropped. The case stemmed from an allegation that Mr Trump directed his former lawyer to pay Stormy Daniels, an adult film actress, to stop her speaking out about an alleged affair. The lawyer, Michael Cohen, was later jailed on multiple charges. The regulatory agency tasked with enforcing campaign finance law announced the case closure Thursday. It came after the Federal Election Commission (FEC), which is split evenly between Democrats and Republicans, became deadlocked on taking action at a closed-door meeting in February. The vote came months after an internal report recommended that there was ""reason to believe"" Mr Trump's campaign had knowingly violated campaign finance law. Trump's legal battles: How six cases may play out Two Republicans who voted to dismiss the case said they had concluded it would not be ""the best use of agency resources"" while two Democrat-aligned commissioners criticised their decision. ""To conclude that a payment, made 13 days before Election Day to hush up a suddenly newsworthy 10-year-old story, was not campaign-related, without so much as conducting an investigation, defies reality,"" they wrote in a letter. Cohen previously testified under oath that Mr Trump had directed him to make the payment of $130,000 (£100,000) just days before the election. Mr Trump has acknowledged reimbursing the payment but denied the affair and any wrongdoing regarding campaign laws. This video can not be played Five things Cohen said about Trump ""The hush money payment was done at the direction of and for the benefit of Donald J. Trump,""Cohen said in a statement to The New York Times,external, responding to the case dismissal. ""Like me, Trump should have been found guilty. How the FEC committee could rule any other way is confounding."" In a statement issued through his website, Mr Trump thanked the commission for dropping what he described as a ""phony case against me...built on lies from Michael Cohen, a corrupt and convicted lawyer"". Cohen, who once said he would take a bullet for Mr Trump, was given a three-year prison sentence after pleading guilty to multiple offences in 2018, including violating campaign finance laws and lying to Congress. Legal wrangling over the allegations involving Ms Daniels, who alleges she had sex with Mr Trump in 2006, were ongoing throughout the Trump presidency. Deadly wildfires rage across LA as fierce winds threaten more destruction UK has enough gas, says No.10 after supply warning UK records coldest night of winter as freeze to last into weekend 'I paid fake doctor thousands for fillers - now I look like a gargoyle' The Papers: 'Lost Angeles' and 'Musk seeks plan to oust Starmer' Pop star Chappell Roan wins BBC Sound Of 2025 Weekly quiz: Zendaya looked happy but who else sparkled at the Golden Globes? The 20 child abuse inquiry proposals - what has happened so far? The '9/11 mastermind' wants to plead guilty. Why is the US trying to stop him? Why are UK borrowing costs rising and what does it mean for me? In maps: Thousands of acres on fire in LA Before and after: How wildfires tore through LA Ed Gamble hosts the official Traitors podcast Join Ed Gamble and guests as they dissect the first episodes of The Traitors! Can art, music and words bind us in divided times? Simon Schama explores how artists have captured the transformations of British society since 1945 Enjoy a satirical smorgasbord of The News Quiz Digest a dramatic year of news as Andy Zaltzman revels in some of 2024's funniest moments The multi-award-winning legal drama returns Two years on, the Defoes are back and have gathered for a beautiful wedding in Barcelona © 2025 BBC. The BBC is not responsible for the content of external sites.Read about our approach to external linking.",Positive,0.9999896
