article,article_sentiment,article_score
"Sanctions on Russia are a ""hard lever"" that should only be removed following a ""full ceasefire and withdrawal"" from Ukraine, the foreign secretary says. Liz Truss told theSunday Telegraph,externalthat Moscow would also have to commit to ""no further aggression"" or face the prospect of them being reimposed. The West had to remain ""tough to get peace"", she said. The UK, US, and EU have so far imposed sanctions on over 1,000 Russian individuals and businesses. This week saw Moscow announce it would be refocusing its military operations in Ukraine to the country's east. The move was interpreted by many as a sign that the Kremlin was looking to scale back an invasion that has so far made significantly less progress than was widely expected. Ms Truss said that a negotiations unit had been set up to assist Ukraine once the Russians were ""serious"" about negotiations, but added: ""I don't believe they are serious at present."" ""That's why... we need to double down on sanctions,"" she said. The foreign secretary has previouslysaid she believes the peace talks are a ""smokescreen"",externaldesigned to distract from Russia's actions and allow its armed forces time to regroup. LIVE:Latest updates from Ukraine and nearby EXPLAINED:What sanctions are being imposed? VIDEO:Father killed trying to escape MOSCOW SHIFT:Change of emphasis or admission of failure? READ MORE:Full coverage of the crisis,external It comes after the government announced it haddetained indefinitely two jets owned by Russian oligarch Eugene Shvidler, who had been sanctioned over his ties with Chelsea owner Roman Abramovich. The jets, estimated to be worth $60m (£45m), were seized at Farnborough and Biggin Hill airports following a three-week investigation. Ms Truss said she believed more should have been done to deter Mr Putin following his annexation of Crimea in 2014. ""So there needs to be hard levers,"" she said. ""Of course, sanctions are a hard lever."" ""Those sanctions should only come off with a full ceasefire and withdrawal, but also commitments that there will be no further aggression."" She added that ""snapback sanctions"" could be used in the event of more aggression in the future. Eugene Shvidler (right) has been sanctioned over his ties with longstanding business partner Roman Abramovich As well as sanctions on individuals, recent weeks have seen dozens of countries impose bans on the export of luxury goods to Russia and close their airspace to Russian airlines. Some Russian banks have also been banned from using Swift, the system used to manage international payments, and efforts are underway to explore how Europe can reduce its dependency on Russian oil and gas. Ms Truss's comments echo those of US Secretary of State Anthony Blinken, who said this month that the sanctions on Russia were ""not designed to be permanent"". Mr Blinken said the sanctions could ""go away"" in the event of an ""irreversible"" withdrawal of Russian forces from Ukraine. However, speaking in Poland on Saturday, President Biden said that, while sanctions were weakening Russia, the West needed to ""steel ourselves for the long fight ahead"". Asked about ongoing disagreements with the EU about the implementation of the Northern Ireland Protocol, which sets out the post-Brexit trading arrangements between Northern Ireland and the EU, Ms Truss said that countries would always have ""differences that we need to resolve"". ""But those types of differences between friends and allies are different from the scale and the sheer belligerence and aggression and lying of Russia,"" she said. She added that, given the scale of their differences with Russia, it was vital that Western countries ""stick together."" THE KITCHEN GADGETS TIME FORGOT:Do you recognise any of these long-forgotten kitchen tools? FROM THE KGB TO THE KREMLIN:The revealing story of Putin's rise to power Isle of Man companies should know of Russia links Oligarch says he ditched mansions before sanctions Death toll rises as governor confirms hydrants issue 'impaired' LA wildfires fight 'I have nothing to go back to' - reporter tells of LA fires heartbreak Reeves pledges to 'make UK better off' on China visit LA fires: How three days of devastation unfolded What's the latest on the Los Angeles wildfires and what caused them? 'Cold bites' gas supply and 'Dementia shock' 'My mum died after four days on an A&E trolley' The '9/11 mastermind' wants to plead guilty. Why is the US trying to stop him? Pop star Chappell Roan wins BBC Sound Of 2025 Weekly quiz: Zendaya looked happy but who else sparkled at the Golden Globes? Inside the UK's first legal drug consumption room Danes struggle with response to Trump Greenland threat Dragons’ Den returns with a new line-up of celebrity guests Can a fresh batch of entrepreneurs secure the deal of a lifetime? Are smart scales really as ‘smart’ as they claim to be? Greg Foot explores whether they can accurately measure weight, body fat, muscle and bone mass The award-winning psychological competition is back A nail-biting game of detection, backstabbing and trust. Who will make it through? How close are we to a cancer vaccine? How might it help in the treatment of the disease? © 2025 BBC. The BBC is not responsible for the content of external sites.Read about our approach to external linking.",Negative,1.2341849e-08
"There was a last-day-of-school feeling on the hill on Thursday How best to sum up Stormont's bumpy journey over the past five years? Itstarted in deadlock, returned in 2020 only to be confronted by a global pandemic and now it has ended in deadlock once more. And 805 days since the parties agreed to return to the executive, there's now the small matter of an assembly election to fight. While assembly members (MLAs) have had their share of trying times, the assembly's end of term report card is far from blank. Just a quick glance at the list of legislation they have passed in two years and there are nownew laws on everything,externalfrom abolishing parking charges at hospitals, strengthening laws against domestic abuse and ensuring support for children who are adopted. In other areas where Northern Ireland lagged behind the rest of the UK for so long, because of previous stalemates, there is also now progress. Tacklingclimate change, anopt-out organ donation systemand makingstalking a specific offenceamong them. Then compare the 47 bits of legislation passed by Stormont since 2020 - half of them in just the last six weeks - to the 78 bills introduced in the 2011-2016 mandate, as detailed by the speaker Alex Maskey this week as he prepared to step down after more than two decades in front-line politics. Prime Minister Boris Johnson, then NI Secretary Julian Smith with then First and Deputy First Ministers Arlene Foster and Michelle O'Neill in 2020 when Stormont was restored Period poverty campaigners who came to Parliament Buildings on Thursday burst into song shortly after MLAs passed a bill to make period products more freely available, insisting Stormont can be a positive place for change. But the distinct last-day-of-school feel didn't detract from the reality that it could be a long time before the next group of 90 MLAs can get on with making more change. And others made clear as the assembly wrapped up that they feel little has been learned since the previous collapse. MPs pass bill to prevent future Stormont collapse Givan resignation triggers fresh political crisis O'Neill wants executive formed after election Independent MLA Claire Sugden - herself a former justice minister in 2016 - remarked that departments were still working in ""silos"" and too often ""pass the buck"". TUV leader Jim Allister, one of Stormont's biggest critics, used his end-of-term speech to describe power-sharing as ""unsustainable and unworkable"". But does it stand any chance of being revived yet again, after 5 May? Julian Smith, an architect of the last effort -New Decade, New Approach- in January 2020, is probably one of the few who thinks it does. The former Northern Ireland secretary said devolved government ""had to continue"". ""It's in the best interests of women, men and children across Northern Ireland, it's a huge economic opportunity,"" he said. ""The main thing is it comes back, and I believe it will come back."" Former NI civil service chief David Sterling says the secretary of state is ""quite interventionist"" After the election, the parties will have a period of 24 weeks - about six months - to reappoint a first and deputy first minister to lead the executive. Until then, other ministers can remain in place but only as caretakers, unable to take any significant decisions in a potentially long limbo. David Sterling, who was head of the Northern Ireland civil service from 2017 until 2020, is well versed in political crises. He believes the six-month window will prove problematic. ""If there are 24 weeks available, at least 24 weeks will be taken,"" he said. ""My big fear is that if we don't get an executive back, we're going to see further decay and stagnation across our public services."" The to-do list for an incoming executive is already packed. including tackling the cost-of-living crisis facing many households and businesses. There are also the ongoing UK-EU talks over the Northern Ireland Protocol which will factor into decisions taken by the Democratic Unionist Party (DUP) before power-sharing returns. And in the interim, what about the Northern Ireland secretary's role? Brandon Lewishas already announced he will step in over Northern Ireland's abortion laws after the election, bypassing the lack of executive approval on what has for many years been held up by political disagreement. Mr Sterling described the secretary of state as ""quite interventionist"" and said that could pave the way for Westminster to take forward other changes. Though the government still hasn't introduced the legislation on Irish and Ulster-Scots it promised to pass last autumn. All those issues will again be raised on the campaign trail over the next six weeks. What though comes after polling day? ""I just hope we get an executive quickly because this place badly needs it, the scale of the challenges we face requires that,"" added Mr Sterling. ""This time it will be harder to put back together than it was before."" Stormont has rarely stuck to the devolution timetable, but could it soon be out of service for good? O'Neill wants executive formed after election Givan resignation triggers fresh political crisis MPs pass bill to prevent future Stormont collapse Death toll rises as governor confirms hydrants issue 'impaired' LA wildfires fight 'I have nothing to go back to' - reporter tells of LA fires heartbreak Reeves pledges to 'make UK better off' on China visit LA fires: How three days of devastation unfolded What's the latest on the Los Angeles wildfires and what caused them? 'Cold bites' gas supply and 'Dementia shock' 'My mum died after four days on an A&E trolley' The '9/11 mastermind' wants to plead guilty. Why is the US trying to stop him? Pop star Chappell Roan wins BBC Sound Of 2025 Weekly quiz: Zendaya looked happy but who else sparkled at the Golden Globes? Inside the UK's first legal drug consumption room Danes struggle with response to Trump Greenland threat Dragons’ Den returns with a new line-up of celebrity guests Can a fresh batch of entrepreneurs secure the deal of a lifetime? Are smart scales really as ‘smart’ as they claim to be? Greg Foot explores whether they can accurately measure weight, body fat, muscle and bone mass The award-winning psychological competition is back A nail-biting game of detection, backstabbing and trust. Who will make it through? How close are we to a cancer vaccine? How might it help in the treatment of the disease? © 2025 BBC. The BBC is not responsible for the content of external sites.Read about our approach to external linking.",Negative,1.3327811e-11
"A new fund to help families in Northern Ireland pay the cost of a funeral following the death of a child will be available from June. The Child Funeral Fund will offer a one-off payment of £3,056 after the death of a child under 18. The money will also be made available in the event of a still birth after 24 weeks. The fund is not means-tested and will be available to all families regardless of their financial situation. The Department of Communities, which is responsible for the fund, has said the application process for the money is still being finalised but it would ensure access would be made as simple as possible. Similar schemes already exist elsewhere in the UK. A burial fund was introduced in England in 2018 and fees for the burial or cremation of a child in Scotlandwere abolished in the same year. A payment scheme towards funeral costs wasintroduced in Wales last year In Northern Ireland, some councils have alreadychosen to waive burial costs for children. Announcing the new fund, Communities Minister Deirdre Hargey said the money would support families at a time of ""devastation and sadness"". ""The Child Funeral Fund will lessen stress and anxiety for people during the most devastating of times,"" she said. Money for NI child funeral fund not yet in place Death toll rises as governor confirms hydrants issue 'impaired' LA wildfires fight 'I have nothing to go back to' - reporter tells of LA fires heartbreak Reeves pledges to 'make UK better off' on China visit LA fires: How three days of devastation unfolded What's the latest on the Los Angeles wildfires and what caused them? 'Cold bites' gas supply and 'Dementia shock' 'My mum died after four days on an A&E trolley' The '9/11 mastermind' wants to plead guilty. Why is the US trying to stop him? Pop star Chappell Roan wins BBC Sound Of 2025 Weekly quiz: Zendaya looked happy but who else sparkled at the Golden Globes? Inside the UK's first legal drug consumption room Danes struggle with response to Trump Greenland threat Dragons’ Den returns with a new line-up of celebrity guests Can a fresh batch of entrepreneurs secure the deal of a lifetime? Are smart scales really as ‘smart’ as they claim to be? Greg Foot explores whether they can accurately measure weight, body fat, muscle and bone mass The award-winning psychological competition is back A nail-biting game of detection, backstabbing and trust. Who will make it through? How close are we to a cancer vaccine? How might it help in the treatment of the disease? © 2025 BBC. The BBC is not responsible for the content of external sites.Read about our approach to external linking.",Positive,1.0
"Protests have taken place at ports over P&O Ferries' sacking of 800 workers in favour of lower-paid replacements. Unions rallied at Dover, Hull and Liverpool, chanting slogans such as ""seize the ship"". Protests caused disruptions, and vehicles in Hull were at one stage turned away. It comes after authorities detained P&O Ferries' European Causeway in Northern Ireland, saying it was ""unfit to sail"". P&O Ferries said it would make changes to return the ship to service. Unions have said that crews without experience of the vessels are a danger to shipping. In Hull, protestors from the RMT union at one stage attempted to block access to P&O ferry the Pride of Rotterdam at the city's King George Dock. They want customers to boycott the company. Are the P&O Ferries sackings legal? Calls grow for P&O boss to quit BBC correspondent Paul Murphy, at the scene, said picketers at one stage turned away cars and lorries attempting to board Saturday's 20:30 GMT sailing. However, the Pride of Rotterdam ferry left Hull on schedule for The Netherlands. Earlier, the Trades Union Congress had tweeted a video it said showed P&O dockers in Rotterdam refusing to load freight onto a ferry set for Hull in solidarity with sacked workers. Niek Stam, general secretary of the Docker Workers' Union in Rotterdam, told the BBC Radio 4's PM programme they hoped the protests would make ""P&O come back to the table"", adding ""what they have done is outrageous"". Mr Stam said: ""We believe in solidarity, and we will punish every employer who refuses to consult unions."" He added that the protests will carry on in the coming days ""if it is necessary"". Protests have been held across the UK and Ireland since P&O Ferries announced they were firing 800 members of staff on 17 March Unions have raised fears over a lack of training of new crew, after the firm replaced their members with agency workers whose average hourly rate of pay would be £5.50 - less than the UK minimum wage. As the company's ships operate internationally and are registered overseas, the UK minimum hourly rate of £8.91 does not apply. The company has said it had to replace crews as it was losing £100m a year, and would not be a viable business without making the changes. P&O Ferries bossPeter Hebblethwaite admitted to MPs on Fridaythat the decision to sack 800 workers without notice broke the law. He said there was ""absolutely no doubt"" that under UK employment law the firm was required to consult unions before making the mass cuts. But Mr Hebblethwaite said no union would have accepted the plan and it was easier to compensate workers ""in full"" instead. At Saturday's Dover protest, RMT union national secretary Darren Procter said: ""Bringing a crew on board a vessel they're not familiar with to sail across the busiest shipping lane in the world, carrying passengers, is going to be a dangerous act."" He said the Maritime and Coastguard Agency (MCA) should detain every P&O Ferries vessel around the UK, on the basis they are not fit to sail. This was the scene in Dover, where protesters condemned the dismissal of P&O workers On Saturday, the MCA said the European Causeway had been impounded in Larne over ""failures on crew familiarisation, vessel documentation and crew training"". No passengers or freight were aboard, it said, adding that the vessel would remain under detention until all issues were resolved by P&O Ferries. Transport Secretary Grant Shappswrote on social media,externalthat the ship's detention had followed an instruction from him to the MCA to inspect ""all P&O vessels"" before they entered back into service. ""I will not compromise the safety of these vessels, and P&O will not be able to rush inexperienced crew through training,"" he added. P&O Ferries said it would review the findings of the MCA's inspection, ""make any changes required and continue to work closely with the MCA to return the ship to service"". The company's services on the route the ferry sails - from Larne to Cairnryan, in Scotland - are currently suspended. Seamus Leheny, of freight industry body Logistics UK, said rival ferry operator Stena had increased capacity through Belfast by 50% but the situation at Larne was still causing difficulties for businesses. ""It's not sustainable to have so much freight coming through Belfast... we want that Larne service back up and running as soon as possible,"" he added. P&O Ferries services between Dover and Calais remain cancelled. The firm said it would organise an alternative carrier for passengers. Saturday evening's service from Rotterdam to Hull is also suspended, the firm said - but services between Dublin and Liverpool are expected to run as usual. Calls grow for P&O boss to quit over sackings ‘P&O Ferries weren’t just jobs they were our homes’ Video, 00:02:17‘P&O Ferries weren’t just jobs they were our homes’ Not consulting on cuts broke law, P&O boss admits Death toll rises as governor confirms hydrants issue 'impaired' LA wildfires fight 'I have nothing to go back to' - reporter tells of LA fires heartbreak Reeves pledges to 'make UK better off' on China visit LA fires: How three days of devastation unfolded What's the latest on the Los Angeles wildfires and what caused them? 'Cold bites' gas supply and 'Dementia shock' 'My mum died after four days on an A&E trolley' The '9/11 mastermind' wants to plead guilty. Why is the US trying to stop him? Pop star Chappell Roan wins BBC Sound Of 2025 Weekly quiz: Zendaya looked happy but who else sparkled at the Golden Globes? Inside the UK's first legal drug consumption room Danes struggle with response to Trump Greenland threat Dragons’ Den returns with a new line-up of celebrity guests Can a fresh batch of entrepreneurs secure the deal of a lifetime? Are smart scales really as ‘smart’ as they claim to be? Greg Foot explores whether they can accurately measure weight, body fat, muscle and bone mass The award-winning psychological competition is back A nail-biting game of detection, backstabbing and trust. Who will make it through? How close are we to a cancer vaccine? How might it help in the treatment of the disease? © 2025 BBC. The BBC is not responsible for the content of external sites.Read about our approach to external linking.",Positive,0.99999774
