article,article_sentiment,article_score
"A prominent Tory donor who contributed to Boris Johnson's leadership campaign was involved in one of Europe's biggest corruption scandals, a BBC investigation has discovered. Mohamed Amersi has given nearly £525,000 to the party since 2018. Leaked documents reveal how he worked on a series of controversial deals for a Swedish telecoms company that was later fined $965m (£700m) in a US prosecution. Mr Amersi denies any wrongdoing. The 61-year-old is a corporate lawyer who worked as a consultant for Telia between 2007 and 2013. Working with the International Consortium of Investigative Journalists and the Guardian, BBC Panorama has obtained documents that show how Mr Amersi was involved in a controversial $220m payment to a secretive offshore company in 2010. The firm was controlled by Gulnara Karimova - the daughter of the then president of Uzbekistan - and the payment was described by the US authorities as a ""$220m bribe"". Mr Amersi's lawyers said the offshore company had been ""vetted and approved by Telia"" and that its involvement ""did not raise any red flags"" to him. A simple guide to the Pandora Papers leak Your guide to nine years of finance leaks Questions about the sources of Mr Amersi's wealth come as the Conservative Party's annual conference is under way in Manchester. His donations have included more than £100,000 towards the 2019 general election campaign and £10,000 to the prime minister's leadership bid. Mr Amersi's Russian-born partner, Nadezhda Rodicheva, has also donated money to the Conservatives - more than £250,000 in 2017 and 2018. Political law expert Gavin Millar QC believes the Conservatives should return the money. ""I think they should give it back… if serious questions are being asked about the donor,"" he said. But Mr Millar added ""the bottom line is they don't have to, and there's nothing in the law or the regulation of our system that compels them to do that"". The main political parties including Labour and the Liberal Democrats have all faced calls to hand donations back over the years. Why are donations to political parties often so controversial? At the moment individual donors only need to be on the UK electoral register. Once a party has checked that, they can accept as much money as they like. Mr Millar said: ""You would have thought… that there should be some sort of obligation placed on them in law, to enquire a little bit into where that large sum of money comes from. In recent months, Mr Amersi has been drawn into a ""cash for access"" row centred around claims that high-spending Tory donors were able to gain regular meetings with the prime minister and chancellor. A company owned by Gulnara Karimova was linked to the deal Mr Amersi's name is featured in a leak of almost 12 million documents and files known as the Pandora Papers. They detail the workings of offshore financial firms in locations including the British Virgin Islands, Panama and Singapore. On Sunday, the BBC revealed how documents showed the King of Jordan amassed a secret property empire, and the Azerbaijani president and his associates have been involved in property deals in the UK worth more than £400m. The leaked documents also showed how the former UK prime minister Tony Blair and his wife, Cherie, bought a London property for £6.45 million in an offshore deal that saved them £312,000 in stamp duty. The documents show Mr Amersi purchased two properties in the UK - a Mayfair townhouse and country home in Gloucestershire using secretive offshore companies. Further investigations by the BBC and its media partners have indicated Mr Amersi was involved in negotiations that resulted in $220m being paid to a Gibraltar-based company. The firm was secretly owned through an offshore company by Gulnara Karimova, the daughter of the then president of Uzbekistan, Islam Karimov. Telia had given her shares in one of its companies in 2007 and three years later agreed to buy most of the stock back for $220m - amove US authorities described in a criminal prosecution as a ""bribe payment...,externalin order to continue its telecoms business in Uzbekistan"". Telia was seeking new mobile operating licences for its business in the country at the time, and prosecutors say Ms Karimova - a one-time pop star and UN ambassador - had ""influence"" with the Uzbek regulator. The incident formed part of the case brought by the US Department of Justice against Telia and some of its officials. The proceedings were settled in 2017 without going to trial after Telia agreed to pay a penalty of more than $965m and accepted responsibility for breaking anti-corruption laws. Telia officials were charged in Sweden over their dealings with Ms Karimova - butthey were acquitted,externalafter a court ruled that the country's bribery laws did not apply in the case. Mr Amersi with his partner Nadezhda Rodicheva and the Duchess of Cornwall at a charity fashion show in 2018 British citizen born in Kenya to a family from an Iranian-Indian background Educated in the UK - studied medicine and law at Sheffield and Cambridge universities Described on the website of his charitable foundation as a ""renowned global communications entrepreneur, philanthropist and thought leader"" Spoken out against corruption in speeches Recently faced opposition from some Conservatives over his decision to set up a group to help run the party's relationships in the Middle East Internal Telia emails seen by the BBC connect Mr Amersi to the company's dealings with Ms Karimova's offshore firm Takilant. One message shows a Telia executive wrote to Mr Amersi, saying: ""I do not want to be involved on day to day negotiations so maybe you... can handle it"". Mr Amersi responded: ""Sure... I agree."" An invoice for his ""success fees"" for ""Project Uzbekistan"" - for $500,000 - is among the internal Telia documents. Panorama has also obtained evidence about how Mr Amersi was involved in other deals for Telia. Leaked details from an internal company report describe the activities of a consultant referred to as Mr XY who was paid more than $65m over six years. The payments included expenses for ""lavish corporate entertainment"" - usually between $100,000 and $200,000 a month - that were not  evidenced by receipts. The report states that some of the payments to Mr XY ""may have been utilised to improperly acquire regulatory benefits and/or secure the go-ahead of transactions"". It recommended that Telia's relationship with Mr XY be terminated. Former Telia executive Michaela Ahlberg, who was brought in to clean up the company, told Panorama that Mr Amersi was the consultant referred to in the report. ""It is important that people around him, that trust him, that listen to him, understand the whole context of his career, and wealth,"" she said. Ms Ahlberg said: ""He has been involved in one of the biggest corruption scandals that we have seen in Sweden in modern times. Panorama has confirmed that Mr Amersi was the ""adviser"" referred to at Telia's annual general meeting in 2014 as having had ""agreements"" with the company terminated after ""certain transactions in Eurasia"". In the AGM speech, Telia's then chief mentioned the ""inadequate governance"" of its Eurasian operations and operations ""not aligned with [Telia's] ethical requirements"", as well as ""questionable lobbying activities… on behalf"" of Telia. Telia has since exited central Asia and divested all of its business there to concentrate on its Scandinavian and northern European businesses and made changes to its corporate governance. It says it has now committed itself to transparency and openness. Mr Amersi's lawyers say it is ""entirely false"" to suggest his contract was terminated. They said he met senior political figures with Telia managers but ""only dealt with individuals... who were not considered politically exposed persons by mainstream institutions"". They said his fees and expenses were ""entirely in keeping with industry practice"" and Telia ""did not require regular sight of the receipts"". They added that: ""Any allegation that our client operated as a conduit to help Telia acquire regulatory benefits and secure telecoms deals... is categorically false."" The Conservative Party said ""fund raising is a legitimate part of the democratic process"" and that all donations to the party are properly and lawfully declared. It said the party performs compliance checks in line with legislation enacted by the last Labour government. The BBC searched for information about donors to all of the political parties among the Pandora Papers documents but the stories that emerged from the files were about Conservative donors. 9 December 2022: This article is the subject of a legal complaint by Mr Amersi who says its contents are false and defamatory of him The Pandora Papers is a leak of almost 12 million documents and files exposing the secret wealth and dealings of world leaders, politicians and billionaires. The data was obtained by the International Consortium of Investigative Journalists in Washington DC and has led to one of the biggest ever global investigations. More than 600 journalists from 117 countries have looked at the hidden fortunes of some of the most powerful people on the planet. BBC Panorama and the Guardian have led the investigation in the UK. Pandora Papers coverage: follow reaction on Twitter using #PandoraPapers, in the BBC News app. Watch Pandora Papers: Political Donors Exposedon BBC One at 19.35 BST on Monday (UK viewers only) or later oniPlayer A simple guide to the Pandora Papers leak King of Jordan amassed £70m secret property empire Blairs saved £312,000 stamp duty in property deal Your guide to nine years of finance leaks Send us your questions about the Pandora Papers Night-time curfew imposed in fire-hit areas of LA as police warn against 'despicable' looting 'I have nothing to go back to' - BBC reporter tells of LA fires heartbreak Trump avoids prison or fine in hush-money case sentencing LA fires: How three days of devastation unfolded What's the latest on the Los Angeles wildfires and what caused them? The '9/11 mastermind' wants to plead guilty. Why is the US trying to stop him? Pop star Chappell Roan wins BBC Sound Of 2025 Weekly quiz: Zendaya looked happy but who else sparkled at the Golden Globes? Inside the UK's first legal drug consumption room Sheen to fund new national theatre for Wales Danes struggle with response to Trump Greenland threat The Upbeat newsletter: Start your week on a high with uplifting stories delivered to your inbox Dragons’ Den returns with a new line-up of celebrity guests Can a fresh batch of entrepreneurs secure the deal of a lifetime? Are smart scales really as ‘smart’ as they claim to be? Greg Foot explores whether they can accurately measure weight, body fat, muscle and bone mass The award-winning psychological competition is back A nail-biting game of detection, backstabbing and trust. Who will make it through? How close are we to a cancer vaccine? How might it help in the treatment of the disease? © 2025 BBC. The BBC is not responsible for the content of external sites.Read about our approach to external linking.",Positive,1.0
"The Pandora Papers leak has once again cast a spotlight on the funding of UK political parties by wealthy donors. The Conservative Party are under scrutiny after files included in the Pandora Papers leakrevealed how a prominent donor was involved in a corruption scandal. In the past, Labour and the Lib Dems have also been exposed for accepting money in questionable circumstances. Parties need to be able to raise money in order to run. But there are concerns when it looks like those giving cash expect something in return Running a political party costs money, particularly in the build-up to elections. Some £50m was spent by parties during the 2019 general election. Most income comes in the form of donations including those from individuals and companies. To give money as an individual you have to appear on a UK electoral register. Companies must be registered in the UK and carry out business in the country. Other sources of income for parties include membership fees, loans and a limited amount of public money. A vast majority of the Conservative Party's donations come from individuals: 68% during the 2019 election campaign. Who funds the Tory party and what's in it for them? The Labour Party's income looks different. During the 2019 general election campaign, 93% of donations came from trade unions. National parties only have to record donations above £7,500, so the totals do not pick up the large base of Labour supporters who give small amounts. The largest union backer of Labour is Unite the Union. Last year it gave the party £1.6m in donations. This is on top of the fees that union members pay to ""affiliate"" with the Labour Party. At the start of his premiership, Tony Blair faced criticism over his interactions with Formula One tycoon Bernie Eccleston. New Labour had received £1m from Mr Eccleston months before coming to power in 1997, with another possible chunk on the way. It was later revealed that he had met Mr Blair to lobby him to exempt F1 from a tobacco advertising ban. A ""cash for honours"" scandal hit Tony Blair's government in 2006, when it emerged that a number of large secret loans had been made to the Labour Party before the 2005 general election. Some of the lenders had subsequently been nominated for the House of Lords. Tony Blair became the first prime minister to be questioned by the police during an investigation. However, the long and expensive probe led to no charges from the CPS. Offering seats in the House of Lords is still a controversial issue. In 2020Prime Minister Boris Johnson nominated Peter Cruddas- who had given £50,000 to Mr Johnson's campaign to be party leader - for a seat in the House of Lords, going against official advice. A businessman who was later convicted for perjury became the Liberal Democrats' largest donor in 2005, giving £2.4m to the party. The party faced criticism for not returning the donation,despite Michael Brown not being a registered UK voterand donating through a newly-created company. It's not always wealthy individuals. This summer the police launched aninvestigation into the SNP's financesafter the party had raised money in a crowdfunding drive. Donors had complained about how the money went on to be used. MPs can accept their own donations and gifts, as long as they declare them. The register of MPs' interests - which includes outside employment and free tickets to horse races - is updated every two weeks. Politicians are frequently found to have failed to declare interests in the correct way - usually resulting in an apology in Parliament. In 2018 DUP MPIan Paisley admitted ""deep personal embarrassment""after failing to declare two luxury holidays paid for by the Sri Lankan government. Parties themselves must report donations and loans of more than £7,500 to the Electoral Commission - the organisation which regulates political donations in the UK. This register is updated every three months. Each party has a treasurer, who is legally responsible for checking whether a donor is legitimate. Guidance from the Electoral Commission says: ""As soon as you receive a donation, you must make sure you know who the donor is, and start checking their permissibility. You have 30 days to decide whether to accept or refuse the donation."" If a party breaks the rules about making declarations to the Electoral Commission a range of sanctions are available - including fines of up to £20,000. Very serious offensives can also be referred to the police. A parliamentaryreport published this year,externalrecommended steps to address the ""risk that the current rules on donations from companies provide a route for foreign money to influence UK elections"". The committee argued that donations should only be made ""from profits generated in the UK,"" and that new checks should be put in place ""for identifying the true source of a donation"". The report was welcomed by pressure groups including the Electoral Reform Society and Transparency International. In its 2019 election manifesto, the Conservative Party said it would ""protect the integrity of our democracy"". It has introduced new legislation, currently going through parliament, that includes measures to tighten the rules that prevent foreign money being used in campaigning. The Pandora Papers is a leak of almost 12 million documents and files exposing the secret wealth and dealings of world leaders, politicians and billionaires. The data was obtained by the International Consortium of Investigative Journalists in Washington DC and has led to one of the biggest ever global investigations. More than 600 journalists from 117 countries have looked at the hidden fortunes of some of the most powerful people on the planet. BBC Panorama and the Guardian have led the investigation in the UK. Pandora Papers coverage: follow reaction on Twitter using #PandoraPapers, in the BBC News app, orwatch Panorama on the BBC iPlayer(UK viewers only). A simple guide to the Pandora Papers leak Secret wealth of leaders exposed in document leak Night-time curfew imposed in fire-hit areas of LA as police warn against 'despicable' looting 'I have nothing to go back to' - BBC reporter tells of LA fires heartbreak Trump avoids prison or fine in hush-money case sentencing LA fires: How three days of devastation unfolded What's the latest on the Los Angeles wildfires and what caused them? The '9/11 mastermind' wants to plead guilty. Why is the US trying to stop him? Pop star Chappell Roan wins BBC Sound Of 2025 Weekly quiz: Zendaya looked happy but who else sparkled at the Golden Globes? Inside the UK's first legal drug consumption room Sheen to fund new national theatre for Wales Danes struggle with response to Trump Greenland threat The Upbeat newsletter: Start your week on a high with uplifting stories delivered to your inbox Dragons’ Den returns with a new line-up of celebrity guests Can a fresh batch of entrepreneurs secure the deal of a lifetime? Are smart scales really as ‘smart’ as they claim to be? Greg Foot explores whether they can accurately measure weight, body fat, muscle and bone mass The award-winning psychological competition is back A nail-biting game of detection, backstabbing and trust. Who will make it through? How close are we to a cancer vaccine? How might it help in the treatment of the disease? © 2025 BBC. The BBC is not responsible for the content of external sites.Read about our approach to external linking.",Positive,0.99464226
"Scientists who discovered how our bodies feel the warmth of the sun or the hug of a loved one have won the Nobel Prize. David Julius and Ardem Patapoutian, from the US, share the 2021 prize in Medicine or Physiology for their work on sensing touch and temperature. They unpicked how our bodies convert physical sensations into electrical messages in the nervous system. Their findings could lead to new ways of treating pain. Heat, cold and touch are crucial for experiencing the world around us and for our own survival. But how our bodies actually do it had been one of the great mysteries of biology. Allow Twitter content? This article contains content provided by Twitter. We ask for your permission before anything is loaded, as they may be using cookies and other technologies. You may want to readTwitter’s cookie policy,externalandprivacy policy,externalbefore accepting. To view this content choose‘accept and continue’. Thomas Perlman, from the Nobel Prize Committee, said: ""It was a very important and profound discovery."" Prof David Julius's breakthrough, at the University of California, San Francisco, came from investigating the burning pain we feel from eating a hot chilli pepper. He experimented with the source of a chilli's heat - the chemical capsaicin. He discovered the specific type of receptor (a part of our cells that detects the world around them) that responded to capsaicin. Further tests showed the receptor was responding to heat and kicked in at ""painful"" temperatures. This is what happens, for example, if you burn your hand on a cup of coffee. The discovery led to a flurry of other temperature-sensors being discovered. Prof Julius and Prof Ardem Patapoutian found one that could detect cold. Meanwhile, Prof Patapoutian, working at the Scripps Research institute, was also poking cells in a dish. Those experiments led to the discovery of a different type of receptor that was activated in response to mechanical force or touch. When you walk along a beach and feel the sand under your feet - it is these receptors that are sending signals to the brain. Allow Twitter content? This article contains content provided by Twitter. We ask for your permission before anything is loaded, as they may be using cookies and other technologies. You may want to readTwitter’s cookie policy,externalandprivacy policy,externalbefore accepting. To view this content choose‘accept and continue’. Prof Patapoutian actually missed multiple attempts by the Nobel Prize committee to let him know he was a winner. His phone was set to do-not-disturb so the flurry of phone calls from Sweden (at 0200 California time) went unanswered. ""They somehow got to my 94 year old father who lives in Los Angeles and he was able to call me and wake me up and tell me the news, which was ended up being a fantastic way to find out,"" he said. These touch and temperature sensors have since been shown to have a wide role in the body and in some diseases. The first heat sensor (called TRPV1) is also involved in chronic pain and how our body regulates its core temperature. The touch receptor (PIEZ02) has multiple roles, from urinating to blood pressure. The Prize Committee said their work had ""allowed us to understand how heat, cold and mechanical force can initiate the nerve impulses that allow us to perceive and adapt to the world around us."" It added: ""This knowledge is being used to develop treatments for a wide range of disease conditions, including chronic pain."" The pair will share the 10m Swedish kronor (£845,000) prize. FollowJameson Twitter,external 2020 - Michael Houghton, Harvey Alter and Charles Rice for thediscovery of the virus Hepatitis C. 2019 - Sir Peter Ratcliffe, William Kaelin and Gregg Semenza for discovered how cellssense and adapt to oxygen levels 2018 - James P Allison and Tasuku Honjo for discoveringhow to fight cancerusing the body's immune system 2017- Jeffrey Hall, Michael Rosbash and Michael Young for unravelling how bodies keep a circadian rhythm orbody clock 2016 - Yoshinori Ohsumi for discovering how cellsremain healthy by recycling waste 2015 - William C Campbell, Satoshi Ōmura and Youyou Tu foranti-parasite drug discoveries The woman who doesn't feel pain Is the chilli pepper friend or foe? The Nobel Prize in Physiology or Medicine Night-time curfew imposed in fire-hit areas of LA as police warn against 'despicable' looting 'I have nothing to go back to' - BBC reporter tells of LA fires heartbreak Trump avoids prison or fine in hush-money case sentencing LA fires: How three days of devastation unfolded What's the latest on the Los Angeles wildfires and what caused them? The '9/11 mastermind' wants to plead guilty. Why is the US trying to stop him? Pop star Chappell Roan wins BBC Sound Of 2025 Weekly quiz: Zendaya looked happy but who else sparkled at the Golden Globes? Inside the UK's first legal drug consumption room Sheen to fund new national theatre for Wales Danes struggle with response to Trump Greenland threat The Upbeat newsletter: Start your week on a high with uplifting stories delivered to your inbox Dragons’ Den returns with a new line-up of celebrity guests Can a fresh batch of entrepreneurs secure the deal of a lifetime? Are smart scales really as ‘smart’ as they claim to be? Greg Foot explores whether they can accurately measure weight, body fat, muscle and bone mass The award-winning psychological competition is back A nail-biting game of detection, backstabbing and trust. Who will make it through? How close are we to a cancer vaccine? How might it help in the treatment of the disease? © 2025 BBC. The BBC is not responsible for the content of external sites.Read about our approach to external linking.",Positive,0.9948828
