article,article_sentiment,article_score
"The five most frequent emergency callers were admitted to hospital 169 times in 12 months Ambulances and emergency response vehicles were deployed more than 1,500 times to five patients in 12 months, the BBC has learned. A total of 8,303 emergency calls were made by the five most frequent UK callers. An NHS spokesman said the calls were often related to mental health, chronic pain and alcohol or drug dependence. Vicki Nash from mental health charity Mind said the figures show that individuals' needs were not being met. The figures were released after a Freedom of Information request to the UK's 14 ambulance trusts. The highest number of calls by a single patient were made to London's ambulance service, which was contacted 3,594 times. Other services to receive frequent calls include East Midlands Ambulance service, which was called 1,244 times by a single patient, and South West Ambulance service, which received 1,044 calls from one person. ""Frequent callers"" are classed as those who call at least five times in a month, or at least 12 times in three months, and they cost the health service almost Â£19m a year. Paul Jefferies, assistant director of operations at South Central Ambulance Service, said about 10% of the calls they receive are from frequent callers. He said: ""If the ambulance, or the response vehicle, is being deployed to that patient who we know is a frequent caller, it means that a resource might not be available for a potential cardiac arrest."" Ms Nash, head of policy and campaigns for Mind, said the figures showed the service being offered was not good enough. She said: ""It's not meeting the needs of that individual, which is why they are repeatedly calling."" A West Midlands Ambulance service spokesman said misuse of the 999 number had a ""huge"" impact. He said: ""It's not just the financial cost, it is the effective removal of ambulances for people who really need them that is the greatest concern."" The trusts work with other agencies such as social services to put in place care packages that will stop individuals calling inappropriately, he added. A Department of Health spokesman said: ""NHS 999 call handlers do a challenging job helping callers seeking assistance in an emergency, and we expect the public to support them in their vital role by only calling 999 if necessary."" Frequent 999 callouts 'cut by 1,200' Public Health England Death toll rises amid most destructive wildfire in Los Angeles' history Moment friends abandon house as Palisades fire closes in 'Patients are collapsing in the waiting room': A&E nurses speak out Why does Trump want Greenland and what do its people think? How Canada's immigration debate soured - and helped seal Trudeau's fate 'I can't get divorced as I can't get my pension valued' What are cold weather payments and who can get them? BBC Sound of 2025: Barry Can't Swim is a new dance music superstar Ros Atkins on...Elon Musk's political interventions Jean-Marie Le Pen - founder of French far right and 'Devil of the Republic' Cases of HMPV are on the rise in China - but what is it? Politics Essential: Get the latest news and analysis delivered to your inbox every weekday Delivering brand-new miracles in 1970s East End Watch the latest series of Call the Midwife on iPlayer now Mark-Anthony Turnage shares the soundtrack of his life Once called 'Britainâs hippest composer', he's tackled topics from drug abuse to football in his work Paddyâs loaf-changing experience inside the bread factory Paddy McGuinness visits the bread factory he used to work in, and sees how they make 1.4 million loaves a week What's behind the global surrogacy boom? More countries are banning surrogacy â but demand is growing Â© 2025 BBC. The BBC is not responsible for the content of external sites.Read about our approach to external linking.",Negative,9.715576e-13
"This video can not be played Tusk on Brexit: 'We will be drifting apart' Donald Tusk has insisted the EU ""does not want to build a wall"", but Brexit means ""we will be drifting apart"". The EU Council president said Theresa May wanted to ""demonstrate at any price that Brexit could be a success"", but that was not the EU's objective. He was unveilingdraft guidelines for the EU side,externalof Brexit trade talks. Mr Tusk said the EU wanted an ""ambitious and advanced"" free trade deal - and continued access to UK waters for EU fishing vessels. Kuenssberg: Differences, but room for manoeuvre Reality Check: EU predicts Brexit costs for UK Kamal Ahmed: Hammond's hidden message ""Our agreement will not make trade between the UK and EU frictionless or smoother,"" he said. ""It will make it more complicated and costly than today for all of us. This is the essence of Brexit."" He said it would be the first time in history that a free trade agreement would ""loosen, not strengthen, economic ties"". This video can not be played Donald Tusk: Theresa May's political goal is Brexit success ""at any price"" The draft European Council guidelines call for zero-tariff trade in goods - where the EU has a surplus. The document also says access for services will be limited by the fact that the UK will be outside the EU and will no longer share a common regulatory and judiciary framework. The draft guidelines repeat EU warnings that there can be ""no cherry-picking"" of participation in the single market for particular sectors of industry. The BBC's Reality Check correspondent Chris Morris said the ""narrow negotiating mandate set out in these guidelines suggests that the EU doesn't think it will be much more ambitious than other free trade agreements it has negotiated - Canada is the most obvious example"". Mr Tusk said he wanted continued security and research cooperation and to ensure flights were not grounded. But he added: ""No member state is free to pick only those sectors of the internal market they like, or to accept the role of the ECJ only when it suits their interest."" The draft guidelines also say that the EU will ""preserve its autonomy as regards its decision-making, which excludes participation of the United Kingdom as a third-country to EU Institutions, agencies or bodies"". This video can not be played Theresa May: ""We must bring our country back together"" Mrs May acknowledged in her Mansion House speech on Brexit on Friday that neither side would get everything they want from negotiations. But she also stressed that the UK wanted a bespoke trade deal, rather than an ""off-the-shelf"" model. ""The fact is that every free trade agreement has varying market access depending on the respective interests of the countries involved,"" she said. ""If this is cherry-picking, then every trade arrangement is cherry-picking."" She also said: ""We will also want to explore with the EU, the terms on which the UK could remain part of EU agencies."" This appears to be in conflict with the EU draft guidelines, although BBC Research has found several examples of non-EU members participating - as a member or observer - in EU agencies and bodies, such as the European Environment Agency and the European Medicines Agency. The EU says it wants to maintain ""existing reciprocal access to fishing waters"" - a leading concern of the fishing industry in countries bordering the North Sea. In her Mansion House speech, Mrs May said: ""The UK will regain control over our domestic fisheries management rules and access to our waters."" She added that the UK would want to ""work together to manage shared stocks in a sustainable way and to agree reciprocal access to waters and a fairer allocation of fishing opportunities for the UK fishing industry"". Brexit Secretary David Davis - quizzed on Tuesday by Brexiteer Labour MP Kate Hoey - insisted the government would not betray UK fishing communities by ""trading away fishing rights"" for ""other things"". Asked about the EU's demand to keep access as it is now, Chancellor Philip Hammond said the UK was ""open to discussing with our EU partners about the appropriate arrangements for reciprocal access for our fishermen to EU waters and for EU fishermen to our waters"". Campaign group Fishing for Leave urged the government not to ""cave in"" to the EU demands, saying: ""Nowhere else is access to fisheries included as negotiating collateral for a free trade agreement."" Financial services are not mentioned specifically in the EU draft guidelines, but it is shaping up to be a major sticking point. UK Chancellor Philip Hammond has told European leaders that it is in the ""mutual interest"" of both the UK and the EU to include financial services in a free trade agreement. ""Given the shape of the British economy and our trade balance with the EU 27, it's hard to see how any deal that did not include services could look like a fair and balanced settlement,"" he said in a speech. ""Not only is it possible to include financial services in a trade deal, but this is very much in our mutual interest to do so."" But Donald Tusk appeared to reject the UK proposals. The EU says the UK will be treated like any other ""third country"" after Brexit. Asked about the EU guidelines, which also warn of the ""negative economic consequences"" of Brexit, Mr Hammond said: ""It does not surprise me remotely that what they have set out this morning is a very tough position. That's what any competent, skilled and experienced negotiator would do."" EU deal 'must include financial services' This video can not be played Tusk: Theresa May wants Brexit success ""at any price"" Donald Tusk unveiled his guidelines in a picture-perfect castle in the hills outside Luxembourg. A nice change to the usual venues in Brussels but the same tough message from the EU that the UK's red lines limit what it can get from the final Brexit deal. The best that's on offer is a free trade agreement on goods with no tariffs, and access to the European markets for the UK service sector - but under EU rules and with no specific mention of financial services. I asked a sad-sounding Donald Tusk if his offer came anywhere close to what the prime minister had asked for in her Mansion House speech. His pause was epically long, which suggested he knows it is not. His document is also pretty gloomy, with a spine-chilling warning about the economic costs to the UK. But there is also a big offer tucked away in a later paragraph - there are other options available if the government is prepared to compromise on its red lines. The leaders of the remaining 27 EU states must approve the plans at a Brussels summit on 22 March, setting the template for chief negotiator Michel Barnier for talks with the UK about their future relationship. The UK is due to leave the EU at the end of March 2019, and both sides have said they would like a deal on their future relationship to be agreed by this autumn to allow time for parliaments to approve the deal before Brexit happens. MPs to debate Plaid's EU citizenship call Brexit: All you need to know The European Parliament's Guy Verhofstadt held talks on Tuesday in Downing Street The European Parliament has stressed that its preferred option is for the UK to continue to be a member of the single market and customs union after Brexit, in a draft resolution,leaked to the Politico website,external. The parliament does not have a formal role in the Brexit negotiations but does have a veto on the final deal. The European Parliament document, which may be changed before it is adopted, says non-EU members - even if very closely aligned to the bloc - cannot expect the same rights and benefits as EU members. It also warns that the UK's current ""red lines"" in Brexit talks ""would lead to customs checks and verification which would affect global supply chains and manufacturing processes, even if tariff barriers can be avoided"". It says a ""deep and comprehensive"" trade deal, of the kind envisioned by Theresa May, must entail ""a binding interpretation role"" for the European Court of Justice. MPs to debate Plaid's EU citizenship call Brexit: All you need to know MPs in Westminster are, meanwhile, debating a call by Plaid Cymru - who have four MPs in Wales - for UK nationals to be allowed to keep their EU citizenship after Brexit. Plaid said EU citizenship would give holders the right to travel, live, study and work anywhere in the EU even after the UK leaves next year. A UK government spokesman said only citizens of EU member states could hold EU citizenship. Verhofstadt wants 100% rights guarantee Comments can not be loaded To load Comments you need to enable JavaScript in your browser Death toll rises amid most destructive wildfire in Los Angeles' history Moment friends abandon house as Palisades fire closes in 'Patients are collapsing in the waiting room': A&E nurses speak out Why does Trump want Greenland and what do its people think? How Canada's immigration debate soured - and helped seal Trudeau's fate 'I can't get divorced as I can't get my pension valued' What are cold weather payments and who can get them? BBC Sound of 2025: Barry Can't Swim is a new dance music superstar Ros Atkins on...Elon Musk's political interventions Jean-Marie Le Pen - founder of French far right and 'Devil of the Republic' Cases of HMPV are on the rise in China - but what is it? Politics Essential: Get the latest news and analysis delivered to your inbox every weekday Delivering brand-new miracles in 1970s East End Watch the latest series of Call the Midwife on iPlayer now Mark-Anthony Turnage shares the soundtrack of his life Once called 'Britainâs hippest composer', he's tackled topics from drug abuse to football in his work Paddyâs loaf-changing experience inside the bread factory Paddy McGuinness visits the bread factory he used to work in, and sees how they make 1.4 million loaves a week What's behind the global surrogacy boom? More countries are banning surrogacy â but demand is growing Â© 2025 BBC. The BBC is not responsible for the content of external sites.Read about our approach to external linking.",Negative,5.9959875e-05
"This video can not be played Burst pipe floods south London high street Motorists and pedestrians have been warned to avoid a south London high street after a burst pipe sent water cascading down the road. Tooting High Street was shut in the early hours, causing rush hour disruption. Police tweeted a picture of the scene, near Tooting Broadway Station, that was strewn with debris as water gushed from a crack in the pavement. It is not known if the burst pipe wasdamaged in recent severe cold weather. Some people in the area had low water pressure or no water supply because of the flooding but repairs have since been completed, Thames Water said. Allow Twitter content? This article contains content provided by Twitter. We ask for your permission before anything is loaded, as they may be using cookies and other technologies. You may want to readTwitterâs cookie policy,externalandprivacy policy,externalbefore accepting. To view this content chooseâaccept and continueâ. It comes after thousands of homes were left withoutwater or suffered from low pressure because of freezing weather over the weekend. Writing to Thames Water, London Mayor Sadiq Khan described the shortage as ""unacceptable"". In a letter to the firm's CEO Steve Robertson, Mr Khan said: ""I am extremely concerned to see the supply issues experienced this weekend with significant numbers of Londoners being left without water for up to four days. ""While I appreciate that the weather conditions played a part in the water outages and increase in leaks I would have expected Thames Water to have foreseen this and had appropriate plans in place. ""It is critical that Thames Water reviews and steps up plans to upgrade and maintain your network. ""I expect generous compensation to be issued to those affected and that this will be clearly and proactively communicated as well as issued quickly."" A spokesman for Thames Water, said ""The mayor of London and the Consumer Council for Water have asked us to look at how we compensate customers in these circumstances and we've agreed to do so. ""For now our focus remains on getting every single customer back into supply."" Flooding caused disruption during Wednesday's rush hour Thames Water said its engineers reached the scene in Tooting ""very quickly"" and have stopped the flooding. The A24/Tooting High Street remains closed between Tooting Broadway Station and Hoyle Road while Mitcham Road has reopened. Transport for London said Tooting Broadway Station remained fully open and trains were running as normal. Police tweeted a picture of the scene, near Tooting Broadway Station Mitcham Road has been closed both ways between Longmead Road and Tooting High Street Big thaw leaves thousands without water No water? Can you claim compensation? Limit water use plea as problems continue South London's Christmas Lane Community pays tribute to 14-year-old with âpure heartâ stabbed to death on bus The 13 London restaurants named as finalists in the 2025 Good Food Guide Awards Michelle Sadio: Arrest after woman killed in drive-by shooting outside London church Aspiring Psychologist Ealing January 2025 Supply Teaching Assistant - Kingston Death toll rises amid most destructive wildfire in Los Angeles' history Moment friends abandon house as Palisades fire closes in 'Patients are collapsing in the waiting room': A&E nurses speak out Why does Trump want Greenland and what do its people think? How Canada's immigration debate soured - and helped seal Trudeau's fate 'I can't get divorced as I can't get my pension valued' What are cold weather payments and who can get them? BBC Sound of 2025: Barry Can't Swim is a new dance music superstar Ros Atkins on...Elon Musk's political interventions Jean-Marie Le Pen - founder of French far right and 'Devil of the Republic' Cases of HMPV are on the rise in China - but what is it? Politics Essential: Get the latest news and analysis delivered to your inbox every weekday Delivering brand-new miracles in 1970s East End Watch the latest series of Call the Midwife on iPlayer now Mark-Anthony Turnage shares the soundtrack of his life Once called 'Britainâs hippest composer', he's tackled topics from drug abuse to football in his work Paddyâs loaf-changing experience inside the bread factory Paddy McGuinness visits the bread factory he used to work in, and sees how they make 1.4 million loaves a week What's behind the global surrogacy boom? More countries are banning surrogacy â but demand is growing Â© 2025 BBC. The BBC is not responsible for the content of external sites.Read about our approach to external linking.",Positive,0.88494277
"Coca-Cola is planning to produce an alcoholic drink for the first time in the company's 125-year history - with an alcopop-style product in Japan. It is keen to cash in on the country's growing taste for Chu-Hi - canned sparkling flavoured drinks given a kick with a local spirit called shochu. The product is typically between 3% and 8% alcohol by volume. A senior Coke executive in Japan said the move was a ""modest experiment for a specific slice of our market"". ""We haven't experimented in the low alcohol category before, but it's an example of how we continue to explore opportunities outside our core areas,"" said Jorge Garduno, Coca-Cola's Japan president. It was unlikely the drink would be sold outside of Japan, he suggested. Coca-Cola pledges to recycle all packaging by 2030 Coca-Cola to cut bottle size but increase price The quiet death of the alcopop Chu-Hi - an abbreviation for shochu highball - has been marketed as an alternative to beer, proving especially popular with female drinkers. The company says it markets dozens of new products on the Japanese market every year Japan's big drinks firms including Kirin, Suntory and Asahi all have varieties of the drink, and continue to experiment with flavours. The most popular flavours are strong citrus ones such as grapefruit or lemon, but the drink can also be made with other fruit flavours like grape, apple and peach. As younger consumers become more health conscious, Coca-Cola has been diversifying from fizzy drinks, including buying water and tea brands. This video can not be played How Coca-Cola became a million dollar idea But last November, Wells Fargo analyst Bonnie Herzog speculated that Coca-Cola might move into alcohol, as it looked to ""premium segments such as adult craft beverages"". The phrase alcopop typically refers to sweet but alcoholic drinks, and in 1990s UK brands such as Hooch, Reef, Smirnoff Ice and Bacardi Breezer became hugely popular. But they were controversial, raising concerns that they encouraged young people to drink alcohol in large quantities because they were so easy to consume. Coca-Cola unveils global recycling aims The quiet death of the alcopop How much sugar in a Coca-Cola? Video, 00:02:28How much sugar in a Coca-Cola? Comments can not be loaded To load Comments you need to enable JavaScript in your browser Death toll rises amid most destructive wildfire in Los Angeles' history Moment friends abandon house as Palisades fire closes in 'Patients are collapsing in the waiting room': A&E nurses speak out Why does Trump want Greenland and what do its people think? How Canada's immigration debate soured - and helped seal Trudeau's fate 'I can't get divorced as I can't get my pension valued' What are cold weather payments and who can get them? BBC Sound of 2025: Barry Can't Swim is a new dance music superstar Ros Atkins on...Elon Musk's political interventions Jean-Marie Le Pen - founder of French far right and 'Devil of the Republic' Cases of HMPV are on the rise in China - but what is it? Politics Essential: Get the latest news and analysis delivered to your inbox every weekday Delivering brand-new miracles in 1970s East End Watch the latest series of Call the Midwife on iPlayer now Mark-Anthony Turnage shares the soundtrack of his life Once called 'Britainâs hippest composer', he's tackled topics from drug abuse to football in his work Paddyâs loaf-changing experience inside the bread factory Paddy McGuinness visits the bread factory he used to work in, and sees how they make 1.4 million loaves a week What's behind the global surrogacy boom? More countries are banning surrogacy â but demand is growing Â© 2025 BBC. The BBC is not responsible for the content of external sites.Read about our approach to external linking.",Negative,1.2787092e-12
