article,article_sentiment,article_score
"The Army Foundation College in Harrogate trains recruits between the ages of 16 and 17 Smoking and vaping is to be banned at the UK's only Army training centre for teenage recruits. Hundreds of junior soldiers pass through the Army Foundation College (AFC) in Harrogate each year. Its commanding officer Lt Col Richard Hall said it was ""unacceptable"" that ""most recruits don't smoke on arrival, yet most do by graduation"". New recruits will be barred from smoking next week, with a complete ban on smoking and vaping on site by 2020. In a statement, Lt Col Hall said the ban was in order to develop recruits' health and fitness. He added: ""I hope that this will discourage smoking amongst new recruits and reverse the recent trend we've seen in recruits taking up the habit."" Allow Twitter content? This article contains content provided by Twitter. We ask for your permission before anything is loaded, as they may be using cookies and other technologies. You may want to readTwitterâs cookie policy,externalandprivacy policy,externalbefore accepting. To view this content chooseâaccept and continueâ. The decision has met with broad support on Twitter, although one post described it as denying trainees ""the right to choose when in a few years you will be expecting them to defend that right if called upon"". Lt Col Hall said he ""expected critics"", but the decision had been ""discussed at length over many months"". Allow Twitter content? This article contains content provided by Twitter. We ask for your permission before anything is loaded, as they may be using cookies and other technologies. You may want to readTwitterâs cookie policy,externalandprivacy policy,externalbefore accepting. To view this content chooseâaccept and continueâ. The college trains recruits between the ages of 16 and 17. The Army's website says it ""plays a vital role in providing basic military training and developing future leadership"". The military has a higher proportion of smokers than the civilian population. Figures supplied by the Ministry of Defence in 2013 showed 33% of Army personnel were regular smokers. In comparison, in the same year a NHS report found 19% of adults smoked regularly. Since then the number of civilian smokers has dropped further, with the latest NHS figures reporting 14.7% of adults smoking. It is against the law for under 18s to buy tobacco in England and Wales, although it is not illegal to smoke under the age of 18. Follow BBC Yorkshire onFacebook,external,Twitter,externalandInstagram,external. Send your story ideas toyorkslincs.news@bbc.co.uk,external. Inside the Armyâs training camp for 16-year-olds. Video, 00:02:01Inside the Armyâs training camp for 16-year-olds Army Foundation College Harrogate Big moment for brilliant team at Harrogate vets which has enjoyed a great first year Major York supermarket to close for good this weekend The 'must visit' pub named best in County Durham (and among England's finest) York midwife to offer help with new consultancy business Famous Eden Camp modern history museum in Malton is up for sale Housebuilder donates Â£1,500 to the Scarborough & Ryedale Mountain Rescue Team LA mayor says winds and drought created 'perfect storm', while official hits out at looters What's the latest on the LA fires, and what caused them? Joe Biden says Jimmy Carter made a 'powerful difference' in funeral eulogy Why are UK borrowing costs rising and what does it mean for me? Before and after: How wildfires tore through LA 'Where do I go?' Chaos on Hollywood streets as people flee flames How Elon Musk seized on baseless memo claim to fuel wave of misinformation 'Constant stress': Families tell BBC of life in limbo due to housing crisis Sound Of 2025: Ezra Collective on failed exams and keeping it real How Australia's beach cabana drama sparked a turf war The man who could become Canada's future PM US Election Unspun: Anthony's Zurcher's twice weekly newsletter - sign up now Ed Gamble hosts the official Traitors podcast Join Ed Gamble and guests as they dissect the first episodes of The Traitors! Can art, music and words bind us in divided times? Simon Schama explores how artists have captured the transformations of British society since 1945 Enjoy a satirical smorgasbord of The News Quiz Digest a dramatic year of news as Andy Zaltzman revels in some of 2024's funniest moments The multi-award-winning legal drama returns Two years on, the Defoes are back and have gathered for a beautiful wedding in Barcelona Â© 2025 BBC. The BBC is not responsible for the content of external sites.Read about our approach to external linking.",Positive,0.99999774
"This refill shop is bringing shoppers to Barry's town centre, which has suffered from large retailers closing down in quick succession Shop closures of large retailers in Wales far outweighed all new chain store openings in the first half of 2019, research has indicated. There was a net loss of 37 chain shops in the 11 towns surveyed, suggesting Wales was proportionally the worst-affected part of the UK. Pubs, bookmakers, and men's clothes shops saw the highest fall in Wales. However, there was some growth in opticians, chocolatiers, sports good shops and beauty salons. Researchers studied town centres deemed to be in Great Britain's top 500 high streets, including Abergavenny, Barry, Newport, Swansea, Cardiff, Carmarthen, Merthyr Tydfil, Neath, Pontypridd, Bridgend and Cwmbran. Five ways the High Street is changing Shops in Wales faced worst June in 20 years Towns eyeing big chains 'doomed to failure' The analysis by Local Data Company and PwC showed the shortfall between chains opening and closing was at the highest level since the analysis began in 2014. Barry in the Vale of Glamorgan was the only town surveyed in Wales not to see a net decline. The town's centre saw one chain shop closing and one opening in the first half of this year. Fifty-five per cent of its shops are independent, meaning the chain retailers make up a significant proportion of the occupants. Rachael Williams thinks chain closures can create a negative perception of an area Rachael Williams, who is involved with the Holton Road Traders' Association, said the departure of chains such as Dorothy Perkins, Burton and New Look had affected footfall and created a negative perception of the area. ""You've either got to make the units bigger to attract the bigger shops, or you've got to make the rates lower to attract the independents,"" she added. Her husband Ceri Williams, who co-owns Marshalls Butchers on the main street Holton Road, said a reduction in chain shops was ""another nail in the coffin"" for the high street. In July, locals Stuart Burnell and his fiancÃ©e opened the Awesome Wales zero waste refill shop, next to Marshalls, and said they had been well-supported by residents. ""It's vitally important we have different types of shop that will bring people back into the town centre,"" he said. Towns eyeing big chains to pull shoppers 'doomed to failure' Retailers 'frustrated' over progress to help struggling shops Shops in Wales faced worst June in 20 years His neighbour Mr Williams added: ""Getting people in the town is the biggest challenge because it's so hard to draw people in, but the [refill] shop next door, he has brought a lot of people in, and nice people who care about the environment and we're getting a bit of spin off from that."" This video can not be played 'Empty shops everywhere' on High Street The analysis looked at the top 500 high streets with the largest number of chain stores, which is why there were no towns in north Wales on the list. Ben Cottam, from the Federation of Small Businesses (FSB) Wales, described the analysis as ""sobering"". ""We now see that some of the pressures of consumer behaviour, business rates burdens and other issues are hitting even the biggest names,"" he added. FSB Wales called on the Welsh Government to allocate some of the Â£600m announced for Wales in the chancellor's recent spending review towards a future of Welsh towns fund to develop new thinking on boosting regional towns. The Welsh Government said the money did ""not make up for nearly a decade of cuts"" and it was considering how best to use the money and would bring forward a budget for 2020-21 ""as early as possible"". Retailers shut 2,870 stores in first half of 2019 Shops in Wales faced worst June in 20 years Frustrated retailers highlight value of shop work Towns eyeing big chains 'doomed to failure' LA mayor says winds and drought created 'perfect storm', while official hits out at looters What's the latest on the LA fires, and what caused them? Joe Biden says Jimmy Carter made a 'powerful difference' in funeral eulogy Why are UK borrowing costs rising and what does it mean for me? Before and after: How wildfires tore through LA 'Where do I go?' Chaos on Hollywood streets as people flee flames How Elon Musk seized on baseless memo claim to fuel wave of misinformation 'Constant stress': Families tell BBC of life in limbo due to housing crisis Sound Of 2025: Ezra Collective on failed exams and keeping it real How Australia's beach cabana drama sparked a turf war The man who could become Canada's future PM US Election Unspun: Anthony's Zurcher's twice weekly newsletter - sign up now Ed Gamble hosts the official Traitors podcast Join Ed Gamble and guests as they dissect the first episodes of The Traitors! Can art, music and words bind us in divided times? Simon Schama explores how artists have captured the transformations of British society since 1945 Enjoy a satirical smorgasbord of The News Quiz Digest a dramatic year of news as Andy Zaltzman revels in some of 2024's funniest moments The multi-award-winning legal drama returns Two years on, the Defoes are back and have gathered for a beautiful wedding in Barcelona Â© 2025 BBC. The BBC is not responsible for the content of external sites.Read about our approach to external linking.",Positive,1.0
"In the ad, someone is shown receiving a delivery in a field after apparently tunnelling underground to escape from prison A TV ad for Deliveroo has been banned for suggesting the food delivery firm could deliver anywhere in the UK. The ad, shown in March, showed various scenes of people using the Deliveroo app and having food delivered to them, all in unusual places or circumstances. The Advertising Standards Authority (ASA) said it was ""likely to mislead"" because it wrongly implied delivery ""was unrestricted throughout the UK"". Deliveroo said it felt on-screen text had made it clear restrictions applied. In the ad someone is shown receiving a delivery in a field after apparently tunnelling underground to escape from prison. An astronaut is also shown receiving a delivery in space. Meanwhile a voice-over states: ""Order what you want; where you want; when you want it"" while text at the bottom of the screen reads: ""Some restrictions apply, obviouslyâ¦"" Philadelphia and VW ads banned over gender rules Vaping advert banned over Mo Farah confusion There were 22 complaints from people who, knowing that Deliveroo did not deliver to their areas, said that the ad was misleading. Deliveroo's parent company, Roofoods, said that the exaggerated scenes in the ad showed it was not meant to represent real life - simply that it was possible to order from Deliveroo in different everyday locations. It also said customers could check their app to see whether their area was covered without incurring any cost. But the ASA said that without any additional explanation, viewers were likely to take the claim ""Order what you want; where you want; when you want it"" literally. A woman is also shown receiving a delivery during a car chase ""Because we considered the ad suggested delivery was unrestricted throughout the UK when that was not the case, we concluded that it was likely to mislead,"" it said. The ad must not appear again in its current form and Roofoods has been told to ensure that similar claims do not appears in its marketing again. A Deliveroo spokesman said: ""Deliveroo designed a playful advert to show that, through our service, people are able to order food to a wide range of places, whether home or work, for a range of occasions. ""We know some will be disappointed that their local area isn't currently served by Deliveroo, but we are expanding rapidly across the UK."" Vaping advert banned over Mo Farah confusion Philadelphia and VW ads banned over gender rules LA mayor says winds and drought created 'perfect storm', while official hits out at looters What's the latest on the LA fires, and what caused them? Joe Biden says Jimmy Carter made a 'powerful difference' in funeral eulogy Why are UK borrowing costs rising and what does it mean for me? Before and after: How wildfires tore through LA 'Where do I go?' Chaos on Hollywood streets as people flee flames How Elon Musk seized on baseless memo claim to fuel wave of misinformation 'Constant stress': Families tell BBC of life in limbo due to housing crisis Sound Of 2025: Ezra Collective on failed exams and keeping it real How Australia's beach cabana drama sparked a turf war The man who could become Canada's future PM US Election Unspun: Anthony's Zurcher's twice weekly newsletter - sign up now Ed Gamble hosts the official Traitors podcast Join Ed Gamble and guests as they dissect the first episodes of The Traitors! Can art, music and words bind us in divided times? Simon Schama explores how artists have captured the transformations of British society since 1945 Enjoy a satirical smorgasbord of The News Quiz Digest a dramatic year of news as Andy Zaltzman revels in some of 2024's funniest moments The multi-award-winning legal drama returns Two years on, the Defoes are back and have gathered for a beautiful wedding in Barcelona Â© 2025 BBC. The BBC is not responsible for the content of external sites.Read about our approach to external linking.",Positive,0.99998987
"The Army Foundation College in Harrogate trains recruits between the ages of 16 and 17 Smoking and vaping is to be banned at the UK's only Army training centre for teenage recruits. Hundreds of junior soldiers pass through the Army Foundation College (AFC) in Harrogate each year. Its commanding officer Lt Col Richard Hall said it was ""unacceptable"" that ""most recruits don't smoke on arrival, yet most do by graduation"". New recruits will be barred from smoking next week, with a complete ban on smoking and vaping on site by 2020. In a statement, Lt Col Hall said the ban was in order to develop recruits' health and fitness. He added: ""I hope that this will discourage smoking amongst new recruits and reverse the recent trend we've seen in recruits taking up the habit."" Allow Twitter content? This article contains content provided by Twitter. We ask for your permission before anything is loaded, as they may be using cookies and other technologies. You may want to readTwitterâs cookie policy,externalandprivacy policy,externalbefore accepting. To view this content chooseâaccept and continueâ. The decision has met with broad support on Twitter, although one post described it as denying trainees ""the right to choose when in a few years you will be expecting them to defend that right if called upon"". Lt Col Hall said he ""expected critics"", but the decision had been ""discussed at length over many months"". Allow Twitter content? This article contains content provided by Twitter. We ask for your permission before anything is loaded, as they may be using cookies and other technologies. You may want to readTwitterâs cookie policy,externalandprivacy policy,externalbefore accepting. To view this content chooseâaccept and continueâ. The college trains recruits between the ages of 16 and 17. The Army's website says it ""plays a vital role in providing basic military training and developing future leadership"". The military has a higher proportion of smokers than the civilian population. Figures supplied by the Ministry of Defence in 2013 showed 33% of Army personnel were regular smokers. In comparison, in the same year a NHS report found 19% of adults smoked regularly. Since then the number of civilian smokers has dropped further, with the latest NHS figures reporting 14.7% of adults smoking. It is against the law for under 18s to buy tobacco in England and Wales, although it is not illegal to smoke under the age of 18. Follow BBC Yorkshire onFacebook,external,Twitter,externalandInstagram,external. Send your story ideas toyorkslincs.news@bbc.co.uk,external. Inside the Armyâs training camp for 16-year-olds. Video, 00:02:01Inside the Armyâs training camp for 16-year-olds Army Foundation College Harrogate Big moment for brilliant team at Harrogate vets which has enjoyed a great first year Major York supermarket to close for good this weekend The 'must visit' pub named best in County Durham (and among England's finest) York midwife to offer help with new consultancy business Famous Eden Camp modern history museum in Malton is up for sale Housebuilder donates Â£1,500 to the Scarborough & Ryedale Mountain Rescue Team LA mayor says winds and drought created 'perfect storm', while official hits out at looters What's the latest on the LA fires, and what caused them? Joe Biden says Jimmy Carter made a 'powerful difference' in funeral eulogy Why are UK borrowing costs rising and what does it mean for me? Before and after: How wildfires tore through LA 'Where do I go?' Chaos on Hollywood streets as people flee flames How Elon Musk seized on baseless memo claim to fuel wave of misinformation 'Constant stress': Families tell BBC of life in limbo due to housing crisis Sound Of 2025: Ezra Collective on failed exams and keeping it real How Australia's beach cabana drama sparked a turf war The man who could become Canada's future PM US Election Unspun: Anthony's Zurcher's twice weekly newsletter - sign up now Ed Gamble hosts the official Traitors podcast Join Ed Gamble and guests as they dissect the first episodes of The Traitors! Can art, music and words bind us in divided times? Simon Schama explores how artists have captured the transformations of British society since 1945 Enjoy a satirical smorgasbord of The News Quiz Digest a dramatic year of news as Andy Zaltzman revels in some of 2024's funniest moments The multi-award-winning legal drama returns Two years on, the Defoes are back and have gathered for a beautiful wedding in Barcelona Â© 2025 BBC. The BBC is not responsible for the content of external sites.Read about our approach to external linking.",Negative,0.00043752533
"The store was a three-month experiment said Sainsbury's Tills have been reinstalled in an experimental till-less shop opened by supermarket Sainsbury's. It had been totally refurbished to remove the entire checkout area, freeing up shop assistants to help customers on the shop floor. Customers had to scan their groceries using Sainsbury's Pay & Go app, paying for them as they went around the shop. But it resulted in long queues at the helpdesk as people attempted to pay for their groceries in the traditional way. Sainsbury's said it had learned ""a huge amount"" from the experiment. Launching the three-month experiment at its Holborn store, group chief digital officer Clodagh Moriarty said executives ""were excited to understand how our customers respond to the app experience"". But this week, Sainsbury's saidin a blogpost,external: ""It's clear that not all our customers are ready for a totally till-free store."" The option to pay via app is still available at the Holborn shop and eight others across London. Why the UK's shops are closing down Facial recognition test run on unwitting shoppers LA mayor says winds and drought created 'perfect storm', while official hits out at looters What's the latest on the LA fires, and what caused them? Joe Biden says Jimmy Carter made a 'powerful difference' in funeral eulogy Why are UK borrowing costs rising and what does it mean for me? Before and after: How wildfires tore through LA 'Where do I go?' Chaos on Hollywood streets as people flee flames How Elon Musk seized on baseless memo claim to fuel wave of misinformation 'Constant stress': Families tell BBC of life in limbo due to housing crisis Sound Of 2025: Ezra Collective on failed exams and keeping it real How Australia's beach cabana drama sparked a turf war The man who could become Canada's future PM US Election Unspun: Anthony's Zurcher's twice weekly newsletter - sign up now Ed Gamble hosts the official Traitors podcast Join Ed Gamble and guests as they dissect the first episodes of The Traitors! Can art, music and words bind us in divided times? Simon Schama explores how artists have captured the transformations of British society since 1945 Enjoy a satirical smorgasbord of The News Quiz Digest a dramatic year of news as Andy Zaltzman revels in some of 2024's funniest moments The multi-award-winning legal drama returns Two years on, the Defoes are back and have gathered for a beautiful wedding in Barcelona Â© 2025 BBC. The BBC is not responsible for the content of external sites.Read about our approach to external linking.",Positive,0.98348147
