article,article_sentiment,article_score
"Germany's Ursula von der Leyen will replace Jean-Claude Juncker on 1 November Incoming European Commission President Ursula von der Leyen has named her choices for the EU's new top team. Those on her list face some difficult challenges, including handling the UK's exit from the 28-nation bloc and the fight against climate change. If approved by the European Parliament, Mrs von der Leyen's executive team will be the most gender-diverse in EU history, with 13 women and 14 men. There is no UK nominee, as Brexit is currently scheduled for 31 October. That exit date is the day before the new Commission takes office. MEPs will hold confirmation hearings for each nominee. Based in Brussels, the Commission is in charge of enforcing EU rules and the bloc's treaties. It is the only EU body that can draft laws. Mrs von der Leyen, Germany's former defence minister, will officially replace Commission President Jean-Claude Juncker on 1 November. Where does von der Leyen stand on the big issues? What does Europe's top job involve? The new executive team of 27 - one for each member state - is planned to be in place for five years. BBC reporter Adam Fleming says the appointments are considered hugely significant in Brussels - akin to the Oscars film awards - with national pride at stake. Mrs von der Leyen's list features some new posts within the Commission, but who are the key players? Nominee for Trade Commissioner In his current role as EU Commissioner for Agriculture and Rural Development, the former Irish government minister has criticised the UK government's attitude during Brexit negotiations and what he has called the ""tough guy approach"" of some ""Brexiteers"". Mr Hogan described what he said was Britain's poor grasp of the importance of the Ireland-Northern Ireland border issue as ""disheartening"". He has warned the UK that it faces ""a huge gap between hope and experience"" when it begins operating its own trade policy. Earlier this year, the 59-year-old warned plans published by the UK government for tariffs in the event of a no-deal Brexit were an attempt ""to break EU unity"" over the Irish border issue. On Tuesday, Mrs von der Leyen described Mr Hogan as an ""excellent"" negotiator, adding that he would be ""very fair but determined"". Nominee for Vice-President and Protecting Our European Way of Life Known to be extremely careful about what he does and does not say, the current EU Commission spokesman and member of Greece's governing centre-right party New Democracy has been outspoken about Brexit. Mr Schinas, 57, has pushed the UK to provide ""clarification"" on the rights of EU citizens living in Britain after Brexit. He has also said that in a no-deal scenario, it would be ""pretty obvious"" that there would be a hard border on the island of Ireland - meaning checks on people and goods. If approved for the role, Mr Schinas will oversee migration, security, employment and education. Nominee for Executive Vice-President for European Green Deal Currently First Vice-President of the Commission, the centre-left politician has already shown a preparedness to tackle the climate crisis, helping to steer through EU legislation banning plastic straws. The multilingual 58-year-old could now see himself helping to implement further environmental policies, which will be at the heart of the EU's agenda for the next five years. This video can not be played Ursula von der Leyen said she wanted Europe to be the first ""climate-neutral"" continent He has also previously negotiated the EU's 2016 deal with Turkey to reduce the flow of migrants and has warned of the risks of nationalism. ""People who used to vote for my party and many parties here are now voting for nationalist parties, sometimes even extremist parties. That's our fault,"" he said in June. Nominee for Executive Vice-President, Europe Fit for the Digital Age A big name in Danish politics, Ms Vestager has spent the past five years as EU competition commissioner, spearheading EU anti-trust investigations that have ended in big fines for US technology giants Google and Apple. Her nomination may cause technology firms to sit up and take note. She has already earned the wrath of US President Donald Trump: ""Your tax lady, she really hates the US,"" he is reported to have told her boss, Jean-Claude Juncker. But Ms Vestager believes companies must pay their way. Ms Vestager, 51, is a member of the European liberal group Renew Europe. She gained ground in the European elections earlier this year and was among the nominees for Mrs von der Leyen's role. She has previously served as Denmark's economy and interior minister. Denmark's EU 'tax lady' taking on corporate giants Johannes Hahn(Austria), Budget and Administration;Didier Reynders(Belgium), Justice; Mariya Gabriel(Bulgaria), Innovation and Youth; Dubravka Suica(Croatia), Democracy and Demography;Stella Kyriakides(Cyprus), Health;Vera Jourova(Czech Republic), Values and Transparency;Kadri Simson(Estonia), Energy;Jutta Urpilainen(Finland), International Partnerships;Sylvie Goulard(France), Internal Market;Laszlo Trocsanyi(Hungary), Neighbourhood and Enlargement;Paolo Gentiloni(Italy), Economy;Valdis Dombrovskis(Latvia), An Economy that Works for People;Virginijus Sinkevicius(Lithuania), Environment and Oceans;Nicolas Schmit(Luxemburg), Jobs;Helena Dalli(Malta), Equality; Janusz Wojciechowski(Poland), Agriculture;Elisa Ferreira(Portugal), Cohesion and Reforms;Rovana Plumb(Romania), Transport; Maros Sefcovic(Slovakia), Relations and Foresight;Janez Lenarcic(Slovenia), Crisis Management;Josep Borrell(Spain), A Stronger Europe in the World;Ylva Johansson(Sweden), Home Affairs. Phil Hogan named new EU trade commissioner MEPs elect first female EU Commission president What does Europe's top job involve? LA mayor says winds and drought created 'perfect storm', while official hits out at looters What's the latest on the LA fires, and what caused them? Joe Biden says Jimmy Carter made a 'powerful difference' in funeral eulogy Why are UK borrowing costs rising and what does it mean for me? Before and after: How wildfires tore through LA 'Where do I go?' Chaos on Hollywood streets as people flee flames How Elon Musk seized on baseless memo claim to fuel wave of misinformation 'Constant stress': Families tell BBC of life in limbo due to housing crisis Sound Of 2025: Ezra Collective on failed exams and keeping it real How Australia's beach cabana drama sparked a turf war The man who could become Canada's future PM US Election Unspun: Anthony's Zurcher's twice weekly newsletter - sign up now Ed Gamble hosts the official Traitors podcast Join Ed Gamble and guests as they dissect the first episodes of The Traitors! Can art, music and words bind us in divided times? Simon Schama explores how artists have captured the transformations of British society since 1945 Enjoy a satirical smorgasbord of The News Quiz Digest a dramatic year of news as Andy Zaltzman revels in some of 2024's funniest moments The multi-award-winning legal drama returns Two years on, the Defoes are back and have gathered for a beautiful wedding in Barcelona Â© 2025 BBC. The BBC is not responsible for the content of external sites.Read about our approach to external linking.",Positive,0.9999981
" Parliament goes pro-ROGUE.Read more now playing Flying Flamingos & Executive Fiats Parliament goes pro-ROGUE. The Week: Middle East, Tory Conference + Assisted Dying Adam, Chris and Alex wrap up the week How Might Israel Respond to Iran? Netanyahu has warned Iran will pay a “heavy price” How Is The Middle East Shaping UK Politics? The morning after the ‘worst night so far’ of attacks in Beirut. The Conflict: One Year On One year on since Hamas attacked Israel Sue Gray + Keir Starmer... What Went Wrong? Downing Street chief of staff leaves role less than 100 days after election. Matt Chorley interviews Boris Johnson Listen to the full interview, as the former PM joins Matt on his 5 Live show. The Boris Johnson Interview (Unpacked) Plus, another candidate is eliminated in the Tory leadership race. Robert Jenrick vs Kemi Badenoch The final two Conservative leadership candidates. Hurricane Milton and a Storm of Misinformation Newscast and Americast partner for a live episode The Week: Workers’ Rights, Tax Talk and Tory Leadership Drama Adam, Chris and friends wrap up the week. The Prime Minister is coming on Newscast… Adam and Chris interview Keir Starmer. The Prime Minister on Newscast Adam and Chris interview Keir Starmer 100 Days of Labour + Alex Salmond Dies We look at the government’s start, and the life of the former SNP leader Can Labour Climb The Investment Summit? And, the inquiry into the Salisbury poisonings begins. Weight Loss Jabs for Jobs? Health Secretary says jabs could be given to help people get back into work. What Lower Inflation Means For You There’s been a surprise fall in the rate at which prices increase Israel Kills Hamas Leader And Your Guide to the US Election The Week: The Budget, a Trip to China, and the US Election Adam, Chris and Paddy round up the political week. Is The Government about to break a manifesto pledge? Labour’s promise of no new taxes for “working people” is put to the test What Is Labour’s Plan For The NHS? Answer: weight loss drugs for the workless and AI! Police Officer Cleared of Murdering Chris Kaba Plus, Michael Gove joins Adam in the Newscast studio. Interview: Robert Jenrick The Tory leadership hopeful joins Adam and Chris in the studio. Prisoners Freed Early (Again) Plus, Newscast is heading to America! Trump Gets The Hump With Labour And we put your questions to American voters! Kamala Harris Calls Donald Trump ‘A Fascist’ And why is Keir Starmer facing questions about reparations for slavery? Conservative Leadership Profile: Robert Jenrick Everything you need to know about Robert Jenrick Conservative Leadership Profile: Kemi Badenoch Everything you need to know about Kemi Badenoch The Week: Fiscal Rules, Disposable Vapes and Assisted Dying Adam, Alex, Jo and Matt round up a week in Westminster. Israel Strikes Iran IDF confirms “precise” strikes hit military targets Is ‘Working People’ Working For Labour? Plus what to expect from the ‘bazooka’ Budget",Negative,0.0939328
"The government's Brexit legislation is on hold as the UK gears up for the general election on 12 December. But where do the parties stand on Brexit? Prime Minister Boris Johnson wants the UK to leave the European Union (EU) with the revised deal he agreed. He says that with a majority Conservative government,he would start the process to ""get Brexit done"" on day one,externalof the new Parliament. He previously said the UK would leave on 31 October ""do or die"". However, Mr Johnson was forced to write a Brexit extension letter to the EU, after MPs failed to approve his revised deal. Mr Johnson secured changes to the deal previously negotiated by Theresa May. It includes scrappingthe controversial Irish backstopand replacing it witha new customs arrangement. Boris Johnson's revised Brexit deal has not yet been approved by the UK Parliament Brexit left the Conservative Party heavily divided, with 21 MPs expelled for failing to follow the government's line. Ten were later welcomed back. What is in Boris Johnson's new Brexit deal? Key Conservative Party manifesto promises explained If it wins the election, Labour wants to renegotiate Mr Johnson's Brexit deal and put it to another public vote. It says it will achieve this within six months. Labour says its referendumwould be a choice between a ""sensible"" Leave option versus Remain.,external Under its Leave option, Labour says it will negotiate for the UK to remain in an EU customs union, and retain a ""close"" single market relationship. This would allow the UK to continue trading with the EU without checks, but it would prevent it from striking its own trade deals with other countries. If a referendum was held,Mr Corbyn has said he would remain neutralif he was prime minister ""so I can credibly carry out the results"". Just like the Conservatives, Labour has had to deal with internal divisions over its Brexit policy. More than 25 Labour MPs wrote to Mr Corbyn in June, saying another public vote would be ""toxic to our bedrock Labour voters"". While Labour's election strategy early on was to emphasise that the vote was about more than Brexit, it is changing its focus. The message now is thatLabour's leadership is not opposing Brexit by opposing Mr Johnson's deal- it wants to find what it believes is a better one. What is Labour's Brexit plan? Key Labour Party manifesto promises explained The SNP is pro-Remain and wants the UK to stay a member of the EU. It has been campaigning for another referendum,externalon Brexit. Alternatively,it wants Article 50 revokedif it is the only alternative to a no-deal Brexit. Scotland's First Minister, Nicola Sturgeon, said the possibility of a no-deal Brexit is ""catastrophic"" The SNP's ultimate objective is for an independent Scotland that is a full member of the EU. SNP launch: Scotland's Remain party? The Liberal Democrats have pledged to cancel Brexit if they win power at the general election. Party leader Jo Swinson says a Lib Dem majority government would cancel Brexit The policy was endorsed in September by party members at the Lib Dem party conference. If the Lib Dems do not win a majority, they would support another referendum. Leader Jo Swinson says thatstopping Brexit would free up Â£50bn, over five years, to spend on public services. She says that so-called ""Remain bonus"" would pay for 20,000 new teachers, extra money for schools and to help support low-paid workers. Lib Dems promise Â£50bn 'windfall' from stopping Brexit Key Lib Dems manifesto promises explained The Democratic Unionist Party (DUP) had an agreement with the Conservatives whereby it lent it support in the Commons during the last Parliament. However,while the DUP wants the UK to leave the EU,,externalit opposes elements of Mr Johnson's Brexit deal which relate to Northern Ireland,. The DUP is unhappy with the revised Brexit deal At its manifesto launch,the party said it will seek further changes to the dealif he is still prime minister after the election. The deal includes special arrangements for Northern Ireland. One gives the Northern Ireland Assembly a majority vote on how customs arrangements would work after Brexit. The DUP wants such a vote to be taken on a cross-community basis, rather than a straight majority. Johnson 'should seek Brexit deal changes' This party is made up of MPs who left the Conservatives and Labour, in part because of their positions on Brexit. It backs another referendum, or ""People's Vote"",,externaland wants the UK to remain in the EU. The party backs remaining in the EU, despite Wales voting Leave in the referendum.It wants a further referendum,externaland to Remain. In a bid to get as many pro-Remain MPs as possible into Parliament,Plaid Cymru, the Liberal Democrats and Greens have agreed an electoral pactin 11 of the 40 seats in Wales. Use Brexit extension to hold referendum - Plaid Cymru Key Plaid Cymru manifesto promises explained The party's one MP, Caroline Lucas, has been a vocal campaigner for another referendum, andbelieves the UK should stay in the EU.,external A simple guide to the Green Party The Brexit Party wants the UK to leave the EU without a deal, in what it calls a ""clean-break Brexit"". It says that is the wayto ""start changing Britain for good from day one"",externaland that the transition period after leaving would not be extended. It also saysMr Johnson's revised Brexit plan is a bad deal.,external What does 'clean-break' Brexit mean? Key Brexit Party policy promises explained Please upgrade your browser Use the list below or select a button Brexit - British exit - refers to the UK leaving the EU. A public vote was held in June 2016, to decide whether the UK should leave or remain. How soon could there be an election? A simple guide to Brexit What is in Boris Johnson's Brexit plan? What happens next? More news explainers What are the PM's remaining election options? LA mayor says winds and drought created 'perfect storm', while official hits out at looters What's the latest on the LA fires, and what caused them? Joe Biden says Jimmy Carter made a 'powerful difference' in funeral eulogy Why are UK borrowing costs rising and what does it mean for me? Before and after: How wildfires tore through LA 'Where do I go?' Chaos on Hollywood streets as people flee flames How Elon Musk seized on baseless memo claim to fuel wave of misinformation 'Constant stress': Families tell BBC of life in limbo due to housing crisis Sound Of 2025: Ezra Collective on failed exams and keeping it real How Australia's beach cabana drama sparked a turf war The man who could become Canada's future PM US Election Unspun: Anthony's Zurcher's twice weekly newsletter - sign up now Ed Gamble hosts the official Traitors podcast Join Ed Gamble and guests as they dissect the first episodes of The Traitors! Can art, music and words bind us in divided times? Simon Schama explores how artists have captured the transformations of British society since 1945 Enjoy a satirical smorgasbord of The News Quiz Digest a dramatic year of news as Andy Zaltzman revels in some of 2024's funniest moments The multi-award-winning legal drama returns Two years on, the Defoes are back and have gathered for a beautiful wedding in Barcelona Â© 2025 BBC. The BBC is not responsible for the content of external sites.Read about our approach to external linking.",Negative,6.741644e-05
"Menstruation apps track users' fertility Intimate data, including when people have had sex, is being shared with Facebook, a study from Privacy International has suggested. PI studied a range of period-tracking apps,externalto see exactly what information was shared with the social network. It included details such as what contraception was used, when periods were due and the type of symptoms experienced. Since the investigation, one app said it was changing its privacy policies. Menstruation apps collect some of the most intimate data imaginable - from general health, to information about sex, moods, what the user eats, drinks and even what sanitary products she uses. In exchange for this, the app will offer the user the dates of the month she is most fertile or when to expect her next period. PI published what it says Facebook sees - ""Purpose: Get Pregnant"" would provide invaluable insights to advertisers Sharing to Facebook happens via the social network's software development kit (SDK), tools that can be used by apps to help them make money by reaching advertisers who, in turn, provide users with personalised ads. PI found the most popular apps in this category - Period Tracker, Period Track Flo and Clue Period Tracker did not share data with Facebook. But others - such as Maya by Plackal Tech (which has 5 million downloads on Google Play), MIA by Mobapp Development Limited (1 million downloads) and My Period Tracker by Linchpin Health (more than 1 million downloads) - did. PI said: ""The wide reach of the apps that our research has looked at might mean that intimate details of the private lives of millions of users across the world are shared with Facebook and other third parties without those users' free unambiguous and informed or explicit consent, in the case of sensitive personal data, such as data relating to a user's health or sex life."" On being shown the study, Maya told PI that it had ""removed both the Facebook core SDK and Analytics SDK from Maya"" with the changes coming into effect almost immediately. It said it would continue to use Facebook Ad SDK for those who had agreed to its terms and conditions and privacy policy, but added that no ""personally identifiable data or medical data"" is shared. In a statement to the BBC it added: ""All data accessed by Maya are essential to the proper functioning of the product. Predicting information pertaining to menstrual cycles is complex and dependent on thousands of variables. ""Our users are made aware of our Terms and Conditions and Privacy Policy prior to signing up on Maya. Post sign up, our users can export their data and delete their account whenever they choose to."" Linchpin Health did not respond to PI and MIA said it did not wish its response to be published. Facebook told the BBC: ""Our terms of service prohibit developers from sending us sensitive health information and we enforce against them when we learn they are. ""In addition, ad targeting based on people's interests does not leverage information gleaned from people's activity across other apps or websites."" The Maya app encourages users to enter their mood and this is then shared with Facebook, in this case ""Anxious"" The BBC has contacted both companies but at the time of publishing had not received responses. PI believes its findings raise serious concerns as to how such apps are compliant with the EU's General Data Protection Regulation. ""The responsibility should be on the companies to comply with their legal obligations and live up to the trust that users have placed in them when deciding to use their service,"" PI concluded. Facebook has announcedit will launch a tool for users to stop apps and businesses sharing their data with the social network. Mental-health information 'sold to advertisers' Facebook to stop stalking you - but only if asked LA mayor says winds and drought created 'perfect storm', while official hits out at looters What's the latest on the LA fires, and what caused them? Joe Biden says Jimmy Carter made a 'powerful difference' in funeral eulogy Why are UK borrowing costs rising and what does it mean for me? Before and after: How wildfires tore through LA 'Where do I go?' Chaos on Hollywood streets as people flee flames How Elon Musk seized on baseless memo claim to fuel wave of misinformation 'Constant stress': Families tell BBC of life in limbo due to housing crisis Sound Of 2025: Ezra Collective on failed exams and keeping it real How Australia's beach cabana drama sparked a turf war The man who could become Canada's future PM US Election Unspun: Anthony's Zurcher's twice weekly newsletter - sign up now Ed Gamble hosts the official Traitors podcast Join Ed Gamble and guests as they dissect the first episodes of The Traitors! Can art, music and words bind us in divided times? Simon Schama explores how artists have captured the transformations of British society since 1945 Enjoy a satirical smorgasbord of The News Quiz Digest a dramatic year of news as Andy Zaltzman revels in some of 2024's funniest moments The multi-award-winning legal drama returns Two years on, the Defoes are back and have gathered for a beautiful wedding in Barcelona Â© 2025 BBC. The BBC is not responsible for the content of external sites.Read about our approach to external linking.",Negative,9.011795e-11
