article,article_sentiment,article_score
"This video can not be played Corbyn: ""We will commit to a public vote"" Jeremy Corbyn has promised a further referendum on Brexit with a ""credible Leave option"" versus Remain if his party wins the next general election. He said Labour was ""ready"" for the campaign, but its ""priority"" was to stop a no-deal Brexit. Its manifesto will promise to reach a better Brexit deal, but is not expected to commit to either Leave or Remain. Some senior party figures - close Corbyn allies - say they will campaign to stay in the EU in any circumstances. They include shadow chancellor John McDonnell and shadow foreign secretary Emily Thornberry, who have both said remaining would be the best thing for the UK - even if the other option is a Labour-negotiated Brexit deal. Union leaders want Leave on the ballot and met Mr Corbyn earlier to discuss the issue. What would the parties do about Brexit? Would a Labour government cancel Brexit? Corbyn: PM shifting power to wealthy Watson: Labour's hunt for Brexit 'reconciliation' The BBCs political correspondent, Iain Watson, said senior Labour figures had been arguing that backing Remain would recover ground lost to the pro-EU Liberal Democrats in recent elections. Pro-Remain Labour activists are also hoping the party's conference later this month will commit the leadership to backing Remain under all circumstances. But, while Labour-affiliated unions - including Unite, who are one of the party's biggest backers - would rather stay in the EU than have no deal, they believe a Corbyn government should offer voters a choice in a referendum between a negotiated deal and Remain. Speaking to the TUC conference in Brighton on Tuesday, he said: ""Our priority is first to stop no-deal and then to trigger a general election. ""No one can trust the word of a prime minister who is threatening to break the law to force through no deal. ""So a general election is coming, but we won't allow Johnson to dictate the terms."" He added: ""We're ready for that election. We're ready to unleash the biggest people-powered campaign we've ever seen. ""And in that election we will commit to a public vote with a credible option to leave and the option to remain."" The basis of Labour's election policy on Brexit became clear today. Jeremy Corbyn agreed with Labour's significant funders - the affiliated trade unions - that if elected, the party would negotiate a new Brexit deal and put that to a referendum, along with the option to remain. But the party will not say which option it would back during a general election. So, during an imminent campaign, the leadership will be unable to tell voters if a future Labour government would advocate coming out or staying in the EU. The Labour leader has rejected calls from senior figures in the party and grassroots activists to campaign explicitly to Remain during the election, amid fears votes and seats will be lost to the Lib Dems. Today's union meeting was described as a senior Labour source as ""decisive"" in determining policy because the unions are formally represented on the committee which draws up the manifesto, so have huge influence over it. Labour insiders hope to confine any disagreements on Brexit to a referendum, but sources admit the election campaign will be difficult to manage, as some shadow cabinet members have said they'd personally campaign to Remain even against a Labour deal. In a wide-ranging speech, Mr Corbyn also promised to ""put power in the hands of workers"", pledging a future Labour government would enact ""the biggest extension of rights for workers that our country has ever seen."" If elected, Labour would set up a specific government department for employment rights, he said, and give the brief to a dedicated cabinet minister. Enforcement of rights would be boosted by a new agency with the power to enter workplaces and bring prosecutions on behalf of staff, he added. Conservatives - 288 MPs Prime Minister Boris Johnson has said he wants to leave the EU on 31 October ""do or die"". He says he wants to leave with a deal, but is willing to exit without one to ensure Brexit goes ahead by the current deadline. SNP - 35 MPs The SNP is pro-Remain and wants the UK to stay a member of the EU. It has been campaigning for another referendum on Brexit, and if it were to get one, would support Remain. Liberal Democrats - 17 MPs The Lib Dems also want to stay in the EU and have another referendum to achieve their goal - to revoke Article 50 (the law that sees the UK having to leave the bloc). Democratic Unionist Party - 10 MPs The DUP has a confidence and supply agreement with the Conservatives, giving them their support in the Commons. They are backing the PM's plans to leave the EU with or without a deal at the end of October. The Independent Group for Change - 5 MPs This party is made up of MPs who left the Conservatives and Labour because of their positions on Brexit (as well as allegations of anti-Semitism in the Labour Party). They back another referendum, or ""People's Vote"", and want the UK to remain in the EU. Plaid Cymru - 4 MPs The Welsh Party backs remaining in the EU, despite Wales voting out in the referendum. They want a further referendum and to Remain. Green Party - 1 MP The party's one MP, Caroline Lucas, has been a vocal campaigner for another referendum and believes the UK should stay in the EU. Comments can not be loaded To load Comments you need to enable JavaScript in your browser LA mayor says winds and drought created 'perfect storm', while official hits out at looters What's the latest on the LA fires, and what caused them? Joe Biden says Jimmy Carter made a 'powerful difference' in funeral eulogy Why are UK borrowing costs rising and what does it mean for me? Before and after: How wildfires tore through LA 'Where do I go?' Chaos on Hollywood streets as people flee flames How Elon Musk seized on baseless memo claim to fuel wave of misinformation 'Constant stress': Families tell BBC of life in limbo due to housing crisis Sound Of 2025: Ezra Collective on failed exams and keeping it real How Australia's beach cabana drama sparked a turf war The man who could become Canada's future PM US Election Unspun: Anthony's Zurcher's twice weekly newsletter - sign up now Ed Gamble hosts the official Traitors podcast Join Ed Gamble and guests as they dissect the first episodes of The Traitors! Can art, music and words bind us in divided times? Simon Schama explores how artists have captured the transformations of British society since 1945 Enjoy a satirical smorgasbord of The News Quiz Digest a dramatic year of news as Andy Zaltzman revels in some of 2024's funniest moments The multi-award-winning legal drama returns Two years on, the Defoes are back and have gathered for a beautiful wedding in Barcelona Â© 2025 BBC. The BBC is not responsible for the content of external sites.Read about our approach to external linking.",Negative,8.245287e-08
"This video can not be played Would you notice if you crossed the Irish border? (Video from 2017) Prime Minister Boris Johnson insists ""there is a way"" to avoid checks along the Irish border after Brexit. But why has the Irish border remained a major sticking point in the Brexit negotiations? If Brexit happens, the 310-mile Irish border will represent the only land border between the UK and the EU. As well as no longer being in the EU, Northern Ireland is likely to end up with different rules and standards to its neighbour, the Republic of Ireland. That's because the UK intends to leave the customs union and single market - arrangements designed to make trade easier between EU countries. Lorries travelling to the EU from Northern Ireland would be required to stop at the border for document checks and some product inspections. This would be to ensure their goods meet EU standards. Following incidents likefoot-and-mouth disease,externaland thehorse meat scandal, the EU is very strict about these requirements. In theory, such checks would mean things like cameras and security posts, creating a so-called ""hard border"". Concerns have been raised that the return of a hard border couldjeopardise the Good Friday Agreement. This helped bring the period of violence in Northern Irelandknown as ""The Troubles""to an end. Boris Johnson says there are ""abundant"" technological solutions UK and EU Brexit negotiators came up with a solution - known as the Irish backstop - to avoid border checks. If used, the backstop would keep the UK in a very close relationship with the EU until a trade deal permanently avoiding the need for checks is agreed. However, the backstop proved unacceptable to many Conservative MPs, who feared the UK would be trapped in it indefinitely. Their opposition eventually led toTheresa May's resignation as prime minister. Boris Johnson, the new prime minister, said a revised Brexit deal must include ""the abolition of the backstop"". He says the current solution would mean ""signing away"" the UK's ""economic independence"". This video can not be played Confused by Brexit jargon? Reality Check unpacks the basics. A ""wealth of solutions"" including technology could replace the the backstop and avoid the need for a hard border, Boris Johnson said during the Tory leadership campaign. Supporters say custom checks could be done at warehouses before lorries set off. Mobile phone technology or microchips on lorries, would track goods and avoid the need for border posts. However, the EU does not currently share a single border with a non-EU country where checks have been completely eliminated. That includes Norway (not in the EU) and Sweden (an EU member) - which share one of the most technologically advanced borders in the world. Their main crossing point processes about 1,300 lorries a day, with each waiting 20 minutes on average. The EU has said it will consider other solutions to the Irish border problem, but only once the current Brexit deal has been signed off. It has also expressed doubts about a technological solution. The problem with just relying on technology, is that EU law also require some products to be physically checked - chemicals and food are among them. Single UK-Irish food zone suggested by report Border technology 'could take 10 years' Why are vets being recruited in Ireland? Alongside technology, Mr Johnson has also talked about a trusted trader scheme. Businesses would be allowed to by-pass checks once they've proven to be trustworthy and have met certain standards. For it to work, the UK would need to persuade the EU to recognise it. But setting up such a scheme would a take a lot of time and cost a lot of money. The UK would also need to come up with an effective way of enforcing it and prevent smuggling. Another solution that has been proposed is to allow agriculture checks to take place in""mobile units away from the border"".,external However, existing EU law states that animal checks must take place at designated Border Inspections Posts (BIPs)""in the immediate vicinity of the point of entry"",external- which would include the Irish border. The EU says ""geographic constraints"" are the only exception (eg mountains, cliffs, valleys, rivers). In these cases, ""a certain distance from the point of introduction may be tolerated."" So getting the EU to allow checks to take place away from the border, for non-geographic reasons, would require a change in the rules. DUP leader Arlene Foster also believes technology and other solutions can prevent a hard border after Brexit Mr Johnson has also suggested the idea ofan all-Ireland food standards zone. In other words, Northern Ireland would keep the same food and animal standards as the Republic of Ireland after Brexit. However, it's unclear how food and animal products would be separated from other trade in order to prevent smuggling. If smuggling was to occur, it could threaten the integrity of the single market. But some say the UK could go further and agree a Northern Ireland-only backstop. This would see Northern Ireland remain in the customs union and parts of the single market - eliminating the need for any cross-border checks. But the DUP, which supports the Conservatives in government, has previously rejected the idea of a Northern Ireland backstop on the basis it would create checks between Great Britain and Northern Ireland. No-one has started building border posts and the UK and Irish governments say they do not want a hard border. So there is a very real question, in the event of a no-deal Brexit, about who would actually install the border posts if the EU insist they're necessary. No-deal Brexit: What you need to know Boris Johnson and the border blocking Brexit Read more from Reality Check Send us your questions Follow us on Twitter,external What questions do you have about Brexit? Let us know and a selection will be answered by a BBC journalist. Use this form to ask your question: If you are reading this page on the BBC News app, you will need to visit the mobile version of theBBC websiteto submit your question on this topic. LA mayor says winds and drought created 'perfect storm', while official hits out at looters What's the latest on the LA fires, and what caused them? Joe Biden says Jimmy Carter made a 'powerful difference' in funeral eulogy Why are UK borrowing costs rising and what does it mean for me? Before and after: How wildfires tore through LA 'Where do I go?' Chaos on Hollywood streets as people flee flames How Elon Musk seized on baseless memo claim to fuel wave of misinformation 'Constant stress': Families tell BBC of life in limbo due to housing crisis Sound Of 2025: Ezra Collective on failed exams and keeping it real How Australia's beach cabana drama sparked a turf war The man who could become Canada's future PM US Election Unspun: Anthony's Zurcher's twice weekly newsletter - sign up now Ed Gamble hosts the official Traitors podcast Join Ed Gamble and guests as they dissect the first episodes of The Traitors! Can art, music and words bind us in divided times? Simon Schama explores how artists have captured the transformations of British society since 1945 Enjoy a satirical smorgasbord of The News Quiz Digest a dramatic year of news as Andy Zaltzman revels in some of 2024's funniest moments The multi-award-winning legal drama returns Two years on, the Defoes are back and have gathered for a beautiful wedding in Barcelona Â© 2025 BBC. The BBC is not responsible for the content of external sites.Read about our approach to external linking.",Negative,2.921307e-07
"Taylor Swift tried to sue Microsoft over a chatbot which posted racist messages on Twitter, the president of the tech company has revealed. Taylor's lawyers made a move on Microsoft in 2016, according to a new biography by its boss Brad Smith. She was unhappy with the name of its chatbot Tay, meant to interact with 18 to 24-year-olds online, because it was similar to hers. If you don't remember TayTweets, it's the Twitter chatbot that turned racist. TayTweets was controlled by artificial intelligence and was designed to learn from conversations held on social media. But shortly after Tay was launched, ittweeted to say it supported genocideand didn't believe the holocaust happened - among other things. Microsoft issued an apology andtook Tay offlineafter less than 18-hours of offensive conversations on Twitter. This video can not be played Donald Trump and Taylor Swift's political views do not align... as he sums up in this video Taylor Swift's legal action wasn't about what the chatbot had said online, but instead about the similarity to her own name. ""I was on vacation when I made the mistake of looking at my phone during dinner,"" Brad Smith writes in his new book, Tools and Weapons,reports the Guardian.,external Brad Smith is the president of Microsoft ""An email had just arrived from a Beverly Hills lawyer who introduced himself by telling me: 'We represent Taylor Swift, on whose behalf this is directed to you.' ""'The name Tay, as I'm sure you must know, is closely associated with our client',"" he adds. ""No, I actually didn't know, but the email nonetheless grabbed my attention."" He says the lawyer argued that the name Tay violated federal and state laws and ""created a false and misleading association between the popular singer and our chatbot"". Taylor and her legal team are pretty strict on people who come too close to the singer and her intellectual property rights. Her name, signature and initials are already trademarks and in 2015 she attempted to trademark lyrics from her album, 1989. Just before the record was released she successfully filed to make sayings like""this sick beat"" and ""nice to meet you, where you been"" trademarks. This made sure she was the only person in the world able to use sayings like these on merchandise - andthreatened Etsy sellers with legal actionin 2015 for using them on their homemade products. Radio 1 Newsbeat has contacted Taylor Swift's representatives for comment. Follow Newsbeat onInstagram,external,Facebook,external,Twitter,externalandYouTube,external. Listen to Newsbeatliveat 12:45 and 17:45 weekdays - or listen backhere. Microsoft chatbot goes rogue on Twitter Microsoft issues apology for racist bot Taylor Swift trademarks 'sick beat' 'Hakuna Matata' and other unlikely trademarks LA mayor says winds and drought created 'perfect storm', while official hits out at looters What's the latest on the LA fires, and what caused them? Joe Biden says Jimmy Carter made a 'powerful difference' in funeral eulogy Why are UK borrowing costs rising and what does it mean for me? Before and after: How wildfires tore through LA 'Where do I go?' Chaos on Hollywood streets as people flee flames How Elon Musk seized on baseless memo claim to fuel wave of misinformation 'Constant stress': Families tell BBC of life in limbo due to housing crisis Sound Of 2025: Ezra Collective on failed exams and keeping it real How Australia's beach cabana drama sparked a turf war The man who could become Canada's future PM US Election Unspun: Anthony's Zurcher's twice weekly newsletter - sign up now Ed Gamble hosts the official Traitors podcast Join Ed Gamble and guests as they dissect the first episodes of The Traitors! Can art, music and words bind us in divided times? Simon Schama explores how artists have captured the transformations of British society since 1945 Enjoy a satirical smorgasbord of The News Quiz Digest a dramatic year of news as Andy Zaltzman revels in some of 2024's funniest moments The multi-award-winning legal drama returns Two years on, the Defoes are back and have gathered for a beautiful wedding in Barcelona Â© 2025 BBC. The BBC is not responsible for the content of external sites.Read about our approach to external linking.",Negative,0.00477816
"A Labour government would introduce the biggest extension of workers' rights ever seen in the UK, including a new department to protect workers' rights, party leader Jeremy Corbyn has said. He told the TUC conference the aim was to deliver better wages, greater security and give workers more of a say in how their workplaces are run. He pledged to stand up for the majority who do the work and pay their taxes. ""Not the few at the top who hoard the wealth and dodge their taxes,"" he said. Addressing the conference in Brighton, Mr Corbyn said Labour would appoint a secretary of state for employment rights and a workers' protection agency to enforce rights, standards and protections so that every job was a ""good job"". ""If you're a worker with a boss who makes you work extra hours for no pay or forces you into dangerous situations, you deserve a government that's on your side and ready to step in to support you,"" he said. He added that workers would be offered security, dignity, fair pay and rights in the workplace under minimum standards set through collective bargaining. The Labour leader also repeated an earlier party pledge to repeal the2016 Trade Union Act,external, which made strikes illegal unless at least half of eligible union members take part in the ballot. Other new policies would include: Introducing a statutory real living wage of Â£10 an hour by 2020 for all workers aged 16 or over. (The government's ""National Living Wage"" for 25-year-olds and over, is currently Â£8.21 an hour) Banning unpaid internships Ending zero-hour contracts by requiring employers to give all workers a contract reflecting their fixed and regular hours Mr Corbyn was greeted by delegates at the TUC conference Mr Corbyn told delegates: ""The next Labour government will bring about the biggest extension of rights for workers that our country has ever seen. We will put power in the hands of workers. ""For 40 years, the share of the cake going to workers has been getting smaller and smaller. ""It's no coincidence that the same period has seen a sustained attack on the organisations that represent workers - trade unions. ""We have witnessed a deliberate, decades-long transfer of power away from working people. ""The consequences are stark for all workers, whether members of a trade union or not. Pay is lower than it was a decade ago in real terms. ""Labour is on the side of the people in the real battle against the born-to-rule establishment that [Boris] Johnson represents."" Mr Corbyn's speech also brought clarification on Labour's position on Brexit, with him promising a further referendum with a ""credible Leave option"" if Labour wins the next general election. He told the conference an general election was coming, but Labour would not allow Mr Johnson to dictate the terms. ""And in that election we will commit to a public vote with a credible option to leave and the option to remain."" But some senior party figures, including shadow chancellor John McDonnell and shadow foreign secretary Emily Thornberry, have said they will campaign to stay in the EU under any circumstances - even if Labour negotiates its own deal. Labour manifesto to offer vote on Leave and Remain Protests as five-week Parliament shutdown begins Comments can not be loaded To load Comments you need to enable JavaScript in your browser LA mayor says winds and drought created 'perfect storm', while official hits out at looters What's the latest on the LA fires, and what caused them? Joe Biden says Jimmy Carter made a 'powerful difference' in funeral eulogy Why are UK borrowing costs rising and what does it mean for me? Before and after: How wildfires tore through LA 'Where do I go?' Chaos on Hollywood streets as people flee flames How Elon Musk seized on baseless memo claim to fuel wave of misinformation 'Constant stress': Families tell BBC of life in limbo due to housing crisis Sound Of 2025: Ezra Collective on failed exams and keeping it real How Australia's beach cabana drama sparked a turf war The man who could become Canada's future PM US Election Unspun: Anthony's Zurcher's twice weekly newsletter - sign up now Ed Gamble hosts the official Traitors podcast Join Ed Gamble and guests as they dissect the first episodes of The Traitors! Can art, music and words bind us in divided times? Simon Schama explores how artists have captured the transformations of British society since 1945 Enjoy a satirical smorgasbord of The News Quiz Digest a dramatic year of news as Andy Zaltzman revels in some of 2024's funniest moments The multi-award-winning legal drama returns Two years on, the Defoes are back and have gathered for a beautiful wedding in Barcelona Â© 2025 BBC. The BBC is not responsible for the content of external sites.Read about our approach to external linking.",Negative,9.858709e-07
