article,article_sentiment,article_score
"Police said the bus left the road on a bend in the sliproad and went up an embankment One person is in a critical condition and two more have been seriously injured in a bus crash in Glasgow. Five more people are thought to have suffered injuries in the crash, on a sliproad to the Clydeside Expressway close to the Clyde Tunnel. It happened on the A814 sliproad, just north of the tunnel. The crash, which took place just after 19:00 on Sunday, involved a single-decker First Bus vehicle, which went up an embankment. Casualties were treated at the scene of the crash on the A814 sliproad It was not clear if any other vehicles were involved in the collision. Ambulance, fire and police crews were sent to the scene, where casualties were treated. The A814 sliproad was closed to traffic but reopened at about 05:30 on Monday. Police said eight people in total were taken to hospital. Five people, including the bus driver, were taken to Queen Elizabeth University Hospital where one person was described as being in a critical condition. One person was taken to Glasgow Royal Infirmary and two more to Royal Alexandra Hospital. Lisa Stirling's husband was among those on the bus. She told BBC Scotland: ""He was sitting at the front and he went flying forward. ""He has hurt his right leg. His knee is badly swollen. He hurt his arm and has he chest pains. He's got a big gash on his head - it's a big cut, split open."" First Glasgow, the operator of the bus, tweeted saying ""Our thoughts are with those involved in this serious incident. The firm said details about the cause of the crash were ""unclear"". It added: ""We have members of our team at the scene to assist the emergency services, who we cannot praise highly enough for their quick response and professionalism during this incident."" Police Scotland What's In This Week's Oban Times - 8th January 2025 More than 1000 roles up for grabs at Glasgow Airport jobs fair Teenager charged after vehicle crashes in Drumchapel Glasgow 850: 12 pictures showing the history and heritage of Glasgow's Southside Michael Jackson tribute show heading to the Beacon Arts Centre Stars including Ricky Gervais and Dame Judi Dench need help of Glasgow residents to speed up ban on trophy hunting imports in Parliament Death toll rises amid most destructive wildfire in Los Angeles' history Moment friends abandon house as Palisades fire closes in 'Patients are collapsing in the waiting room': A&E nurses speak out Chris Mason: Is Starmer leaving the door open to an abuse inquiry? The Papers: 'Apocalypse' LA and 'Reeves faces extra tax rises' Why does Trump want Greenland and what do its people think? How Canada's immigration debate soured - and helped seal Trudeau's fate 'I can't get divorced as I can't get my pension valued' What are cold weather payments and who can get them? BBC Sound of 2025: Barry Can't Swim is a new dance music superstar Ros Atkins on...Elon Musk's political interventions Jean-Marie Le Pen - founder of French far right and 'Devil of the Republic' Delivering brand-new miracles in 1970s East End Watch the latest series of Call the Midwife on iPlayer now Mark-Anthony Turnage shares the soundtrack of his life Once called 'Britain’s hippest composer', he's tackled topics from drug abuse to football in his work Paddy’s loaf-changing experience inside the bread factory Paddy McGuinness visits the bread factory he used to work in, and sees how they make 1.4 million loaves a week What's behind the global surrogacy boom? More countries are banning surrogacy – but demand is growing © 2025 BBC. The BBC is not responsible for the content of external sites.Read about our approach to external linking.",Negative,0.0013003402
"""It's incredible the difference one person can make in your whole life and how empty it feels without them,"" says Carolynn Burke. The 29-year-old wipes a tear as she talks about her friend Kirsty Maxwell, 27, who fell to her death in Benidorm exactly a year ago. Twenty girls were celebrating Carolynn's hen party and had enjoyed a drunken night out. Now four of them have gone back to mark the first anniversary. The women have been putting up posters, handing out flyers and talking to people to see if anyone has information. Kerry, Leslie-Anne, Suzanne and Carolynn revisit the site where Kirsty fell and hand out flyers The women, who are from Livingston, West Lothian, still don't know what happened leading up to her plunging from the 10th floor of a room of the Apartmentos Payma in the holiday resort. Five men from Nottingham were in the room she fell from. They were questioned by Spanish police but never charged. David Swindle, a former detective assisting the family, told Newsbeat: ""The key to this, to me, is in Nottingham. ""There were a large group of men from Nottingham here, there were over 50 of them. ""Some of them were in the room with Kirsty before she died, and some were staying at the Payma Apartments."" Kirsty fell from the tenth floor of a room of the Apartmentos Payma Kerry Langton, 27, walked home with Kirsty and put her to bed that night. ""We got home safe. She was in bed safe. That's the worst thing about all this, we did what we always do, we looked after each other. ""You think you're in your room, she's tucked up in bed, we were safe. ""There are so many 'what ifs'. But we were as sensible as we could have been and yet something as tragic as this still happened."" Kirsty with her husband Adam Nobody knows how Kirsty woke up and ended up in another room. Lesley-Anne Watson, 28, was a bridesmaid for Carolynn, along with Kirsty. ""That night we just had so much fun, having a drink and a dance, taking selfies. ""It's horrible looking back on them now. You never think that when you're taking those pictures that it'll be the last time you're going to have a picture taken with Kirsty. ""You think this isn't real. It's the strangest feeling ever."" Kirsty's family and friends have put up posters around the resort Lesley-Anne says she was haunted by seeing her friend's body that morning. ""That Saturday morning I got woken by a banging on the door. ""There were police officers in the corridor. ""I walked round the apartment to the opposite side and looked out the window and Kirsty was just lying at the pool. ""That's something that I never ever thought I'd have to look at or have to see. ""That image for weeks, if not months, was in my head. Why two hours after it happened she was still lying there, I'll never know. I was in a state of shock."" ""At first we thought it was a mistake. Everyone was in a panic,"" says Kerry. ""That's why we know people must have seen something,"" continues Lesley-Anne. ""We need people to come forward. I'm here for one reason, and that's to get answers. We're a close group and we are together here, even stronger."" Kirsty's friends Leslie, Kerry, Carolynn and Suzanne return to Benidorm in search of answers Carolynn says she struggles with the small things. ""It's the calls, texts, tags in a Facebook post - you have to really remind yourself she's not here anymore. ""I look at everything all the time. All the pictures that we've got, and all the Snapchat memories that we have. ""I got a book made of all our WhatsApp conversations just because I was so scared of losing it, and that I would lose those memories forever."" Kirsty with her friends on her wedding day ""She's always in my thoughts. She was hilarious, and most of the time when we speak about her we are laughing about the fun times but then it is tinged with sadness. ""At least the memories that we've got are the best, they are amazing. ""Watching her get married to Adam was one of the best weeks of my life, out in Cyprus. I've never seen such a beautiful bride, she was just gorgeous."" Adam and Kirsty on their wedding day Suzanne Lothian, 28, tells Newsbeat they are normal girls who were on a normal hen party. When the girls found out Kirsty had fallen to her death, they couldn't comprehend what happened. ""It was absolutely horrendous, but very surreal. I couldn't understand and put the two together, I couldn't understand how this could have happened. ""We didn't know if she was alive, we were told an accident, we didn't know at first. ""When you're asking the police, can you tell me if she is alive? When the answer is 'I'm sorry but no' - everything crumbles around you. It was terrible."" Kirsty's aunt Angela joined the girls in Benidorm on the anniversary of her death Kirsty's aunt Angela also travelled with the girls to help them raise awareness around the anniversary. ""It's been emotional, but positive, we've put up the posters and we've been speaking to people. ""We just want to find the answers. We're trying to get support from anyone who was here last year to come forward. ""It's quite upsetting to look up and know that's where my niece fell to her death. The void is just so huge in our family. That'll never be filled."" Kirsty's friends hope that by raising awareness in the resort, they'll get some answers over her death People are being asked to change their profile picture on social media accounts to one of Kirsty to mark the day. The girls also set up at Snapchat geofilter with #KirstyMaxwell on it, hoping people will use it and hear about what happened. Follow Newsbeat onInstagram,external,Facebook,externalandTwitter,external. Listen to Newsbeatliveat 12:45 and 17:45 every weekday on BBC Radio 1 and 1Xtra - if you miss us you can listen backhere. Piecing together Kirsty's last moments Spain death husband's tribute to wife Woman dies during holiday hen party Death toll rises amid most destructive wildfire in Los Angeles' history Moment friends abandon house as Palisades fire closes in 'Patients are collapsing in the waiting room': A&E nurses speak out Chris Mason: Is Starmer leaving the door open to an abuse inquiry? The Papers: 'Apocalypse' LA and 'Reeves faces extra tax rises' Why does Trump want Greenland and what do its people think? How Canada's immigration debate soured - and helped seal Trudeau's fate 'I can't get divorced as I can't get my pension valued' What are cold weather payments and who can get them? BBC Sound of 2025: Barry Can't Swim is a new dance music superstar Ros Atkins on...Elon Musk's political interventions Jean-Marie Le Pen - founder of French far right and 'Devil of the Republic' Delivering brand-new miracles in 1970s East End Watch the latest series of Call the Midwife on iPlayer now Mark-Anthony Turnage shares the soundtrack of his life Once called 'Britain’s hippest composer', he's tackled topics from drug abuse to football in his work Paddy’s loaf-changing experience inside the bread factory Paddy McGuinness visits the bread factory he used to work in, and sees how they make 1.4 million loaves a week What's behind the global surrogacy boom? More countries are banning surrogacy – but demand is growing © 2025 BBC. The BBC is not responsible for the content of external sites.Read about our approach to external linking.",Negative,6.1485617e-10
"Was Amber Rudd's resignation inevitable? Certainly there has been a mismatch between what she told MPs last week and the evidence that emerged. In a different time, and with a minister with enemies, she'd most likely have been out on Friday. This time the Tory party was fighting hard to keep her. But beyond the mess-ups, perhaps part of the issue was also that the home secretary was not necessarily in tune with her predecessor's attitude on immigration - the Home Office's most politically charged brief. It is hard to understand that she wasn't aware of a widespread culture of targets. But no one is suggesting that she deliberately misled MPs last week. So, it is pertinent to ask how much focus she gave to the immigration brief at the Home Office, or whether she was happy to delegate to trusted colleagues and focus on other areas. Those who have worked at junior levels in the Home Office as ministers sometimes joke that they'd never want the big job given how complicated it is. Home secretaries, however tightly they grip everything, can never be sure they won't trip up. But don't forget Ms Rudd's persona was also vital in the delicate Brexit balance of the cabinet. She was a Remainer, and trusted by the PM. A grown up, who was as open as politically possible about the case she would make for the softer end of Brexit privately, hinting at it in public too. Amber Rudd resigns: Live reaction What went wrong for Amber Rudd? Amber Rudd's resignation letter in full Given the fraught politics of the moment, replacing her is not just a matter of promoting a minister who looks competent, but making an appointment that does not tear the already strained Tory truce. And beyond all that, Ms Rudd's departure gives Theresa May not one, but several new potential headaches. It gives an impression of shaky government days before the local elections. Ms Rudd could give the Tory rebel Remainers more authority on the backbenches. And continuing questions about the Windrush fiasco may now be aimed more sharply at the prime minister herself. There are good reasons why Number 10 initially tried to resist this resignation. The pressure on the individual may be gone, but the wider impact may not yet have begun. Stretching to close one gap opens another. Ms Rudd was an important figure in cabinet, not just because she occupied one of the great offices of state, but because she was widely liked inside her party, at the more modern end of the Tory spectrum and a vigorous Remainer whose voice gave ballast to that side of the argument at the top table. The decision to go was - I'm told - entirely hers. Both Number 10 and her other political friends in government tried to persuade her to stay, it's said. It was her judgement that it was untenable to stay it's suggested, because she couldn't be sure that nothing else would emerge from the Home Office filing cabinets that might have made staying on in the job even more awkward than it already was. Amber Rudd resigns as home secretary Amber Rudd's resignation letter in full Death toll rises amid most destructive wildfire in Los Angeles' history Moment friends abandon house as Palisades fire closes in 'Patients are collapsing in the waiting room': A&E nurses speak out Chris Mason: Is Starmer leaving the door open to an abuse inquiry? The Papers: 'Apocalypse' LA and 'Reeves faces extra tax rises' Why does Trump want Greenland and what do its people think? How Canada's immigration debate soured - and helped seal Trudeau's fate 'I can't get divorced as I can't get my pension valued' What are cold weather payments and who can get them? BBC Sound of 2025: Barry Can't Swim is a new dance music superstar Ros Atkins on...Elon Musk's political interventions Jean-Marie Le Pen - founder of French far right and 'Devil of the Republic' Delivering brand-new miracles in 1970s East End Watch the latest series of Call the Midwife on iPlayer now Mark-Anthony Turnage shares the soundtrack of his life Once called 'Britain’s hippest composer', he's tackled topics from drug abuse to football in his work Paddy’s loaf-changing experience inside the bread factory Paddy McGuinness visits the bread factory he used to work in, and sees how they make 1.4 million loaves a week What's behind the global surrogacy boom? More countries are banning surrogacy – but demand is growing © 2025 BBC. The BBC is not responsible for the content of external sites.Read about our approach to external linking.",Positive,0.99998605
"Labour said the policy could help 2.7 million people who are stuck with permanent overdrafts Labour says it would cap the total amount anyone could pay in bank overdraft fees or interest repayments. Shadow chancellor John McDonnell said he wanted to end the ""national scandal"" of low paid families trapped in debt. Labour said the policy could help 2.7 million people who are stuck with permanent overdrafts, saving them the equivalent of £86 each per year. The Treasury said it had already tightened the rules to protect debtors and cracked down on payday loans. Call for stricter rules on doorstep loans Sheen tackles high cost of rent-to-own Mr McDonnell said: ""Too many families are having to rely on borrowing just to get to the end of the month, and are facing huge costs from our High Street banks. ""The national scandal of the low paid debt trap has to end. More needs to be done to level the playing field and bring greater fairness in consumer finance."" Actor and campaigner Michael Sheen is supporting the proposal According to Labour, people stuck with permanent overdrafts use them more than 85% of the time while incurring higher charges. The party also said overdraft charges could be up to four times higher than the equivalent borrowing from payday lending. Under the policy, regulators would impose a limit of £24 per month per £100 borrowed on any interest, fees and charges related to an overdraft. That would be equivalent to the current cap on payday loan interest charges. The proposal was welcomed by the actor and founder of the campaign group End High Cost Credit Alliance, Michael Sheen. Payday lenders like Wonga have faced tougher rules since 2015 The Frost/Nixon star, who is a Labour supporter, said: ""High cost credit is more than just pay day loans, rent to own businesses or doorstep lending. ""Millions of people across the UK are also trapped in their overdrafts by extortionate rates of interest charged by reputable high street banks."" Banks say they have introduced a number of measures to help customers avoid going into their overdrafts and minimise any charges when they do. These include accounts with ""overdraft buffers"", in which no overdraft fees are charged, and alerts for customers who are about to enter into an unarranged overdraft. The government has also taken steps to help vulnerable people in debt. Last year it committed to introducing a six-week grace period in which debtors would be protected from enforcement proceedings and mounting interest charges. And in 2015, the Financial Conduct Authority (FCA) imposed a cap on payday loan costs following criticism of lenders. The FCA has also raised concerns about overdrafts and plans to consult on possible remedies later this year. A Treasury spokesperson said: ""We know that families can struggle with debt. That is why we have tightened the rules to ensure that money can only be lent to people who can afford to repay. ""We have also cracked down on payday loans, saving borrowers over £150m a year, and are introducing an energy cap to help people with household bills."" Call for stricter rules on doorstep loans Sheen tackles high cost of rent-to-own Comments can not be loaded To load Comments you need to enable JavaScript in your browser Death toll rises amid most destructive wildfire in Los Angeles' history Moment friends abandon house as Palisades fire closes in 'Patients are collapsing in the waiting room': A&E nurses speak out Chris Mason: Is Starmer leaving the door open to an abuse inquiry? The Papers: 'Apocalypse' LA and 'Reeves faces extra tax rises' Why does Trump want Greenland and what do its people think? How Canada's immigration debate soured - and helped seal Trudeau's fate 'I can't get divorced as I can't get my pension valued' What are cold weather payments and who can get them? BBC Sound of 2025: Barry Can't Swim is a new dance music superstar Ros Atkins on...Elon Musk's political interventions Jean-Marie Le Pen - founder of French far right and 'Devil of the Republic' Delivering brand-new miracles in 1970s East End Watch the latest series of Call the Midwife on iPlayer now Mark-Anthony Turnage shares the soundtrack of his life Once called 'Britain’s hippest composer', he's tackled topics from drug abuse to football in his work Paddy’s loaf-changing experience inside the bread factory Paddy McGuinness visits the bread factory he used to work in, and sees how they make 1.4 million loaves a week What's behind the global surrogacy boom? More countries are banning surrogacy – but demand is growing © 2025 BBC. The BBC is not responsible for the content of external sites.Read about our approach to external linking.",Negative,6.521414e-16
"Labour said the policy could help 2.7 million people who are stuck with permanent overdrafts Labour says it would cap the total amount anyone could pay in bank overdraft fees or interest repayments. Shadow chancellor John McDonnell said he wanted to end the ""national scandal"" of low paid families trapped in debt. Labour said the policy could help 2.7 million people who are stuck with permanent overdrafts, saving them the equivalent of £86 each per year. The Treasury said it had already tightened the rules to protect debtors and cracked down on payday loans. Call for stricter rules on doorstep loans Sheen tackles high cost of rent-to-own Mr McDonnell said: ""Too many families are having to rely on borrowing just to get to the end of the month, and are facing huge costs from our High Street banks. ""The national scandal of the low paid debt trap has to end. More needs to be done to level the playing field and bring greater fairness in consumer finance."" Actor and campaigner Michael Sheen is supporting the proposal According to Labour, people stuck with permanent overdrafts use them more than 85% of the time while incurring higher charges. The party also said overdraft charges could be up to four times higher than the equivalent borrowing from payday lending. Under the policy, regulators would impose a limit of £24 per month per £100 borrowed on any interest, fees and charges related to an overdraft. That would be equivalent to the current cap on payday loan interest charges. The proposal was welcomed by the actor and founder of the campaign group End High Cost Credit Alliance, Michael Sheen. Payday lenders like Wonga have faced tougher rules since 2015 The Frost/Nixon star, who is a Labour supporter, said: ""High cost credit is more than just pay day loans, rent to own businesses or doorstep lending. ""Millions of people across the UK are also trapped in their overdrafts by extortionate rates of interest charged by reputable high street banks."" Banks say they have introduced a number of measures to help customers avoid going into their overdrafts and minimise any charges when they do. These include accounts with ""overdraft buffers"", in which no overdraft fees are charged, and alerts for customers who are about to enter into an unarranged overdraft. The government has also taken steps to help vulnerable people in debt. Last year it committed to introducing a six-week grace period in which debtors would be protected from enforcement proceedings and mounting interest charges. And in 2015, the Financial Conduct Authority (FCA) imposed a cap on payday loan costs following criticism of lenders. The FCA has also raised concerns about overdrafts and plans to consult on possible remedies later this year. A Treasury spokesperson said: ""We know that families can struggle with debt. That is why we have tightened the rules to ensure that money can only be lent to people who can afford to repay. ""We have also cracked down on payday loans, saving borrowers over £150m a year, and are introducing an energy cap to help people with household bills."" Call for stricter rules on doorstep loans Sheen tackles high cost of rent-to-own Comments can not be loaded To load Comments you need to enable JavaScript in your browser Death toll rises amid most destructive wildfire in Los Angeles' history Moment friends abandon house as Palisades fire closes in 'Patients are collapsing in the waiting room': A&E nurses speak out Chris Mason: Is Starmer leaving the door open to an abuse inquiry? The Papers: 'Apocalypse' LA and 'Reeves faces extra tax rises' Why does Trump want Greenland and what do its people think? How Canada's immigration debate soured - and helped seal Trudeau's fate 'I can't get divorced as I can't get my pension valued' What are cold weather payments and who can get them? BBC Sound of 2025: Barry Can't Swim is a new dance music superstar Ros Atkins on...Elon Musk's political interventions Jean-Marie Le Pen - founder of French far right and 'Devil of the Republic' Delivering brand-new miracles in 1970s East End Watch the latest series of Call the Midwife on iPlayer now Mark-Anthony Turnage shares the soundtrack of his life Once called 'Britain’s hippest composer', he's tackled topics from drug abuse to football in his work Paddy’s loaf-changing experience inside the bread factory Paddy McGuinness visits the bread factory he used to work in, and sees how they make 1.4 million loaves a week What's behind the global surrogacy boom? More countries are banning surrogacy – but demand is growing © 2025 BBC. The BBC is not responsible for the content of external sites.Read about our approach to external linking.",Positive,0.999925
