article,article_sentiment,article_score
"This video can not be played Thousands of people give Thomas a hero's welcome home Thousands of people lined the streets of Cardiff as Wales officially welcomed home Tour de France winner Geraint Thomas. The 32-year-old was congratulated by First Minister Carwyn Jones at the Senedd in front of more than 3,000 people in Cardiff Bay. Thomas became just the third Briton and first Welshman to win the gruelling 21-stage race which culminated in Paris. He has been ""blown away"" by support as 8,000 fans lined Cardiff's streets. ""I'm used to racing in front of thousands of people but to walk out to this, this is bonkers,"" Thomas said. The homecoming as it happened Watch the celebration again on iPlayer How the champ got the cycling bug ""Thanks for coming, I was a bit worried it was just going to be my wife and the dog,"" he joked as wife Sara and dog Blanche watched in the crowd. Geraint Thomas is thanked ""on behalf of Wales"" by First Minister and Carwyn Jones Geraint Thomas celebrated in front of huge crowds who gathered at Cardiff Castle and the Senedd Asked what was next for him, the double Olympic track champion replied: ""A few more beers! ""I thought the race would be harder, I felt pretty good. The race was a dream and couldn't have gone better."" Allow Twitter content? This article contains content provided by Twitter. We ask for your permission before anything is loaded, as they may be using cookies and other technologies. You may want to readTwitter’s cookie policy,externalandprivacy policy,externalbefore accepting. To view this content choose‘accept and continue’. Mr Jones, who joined Thomas on the steps of the Senedd, described the triumph as ""a stand-out moment in our sporting history"". ""In politics you spend a lot of time selling Wales to the world and Geraint has done more in 21 days than I could've done in 21 years,"" said the first minister. Thomas confident of new Sky deal Max Boyce immortalises Tour de France victory Geraint Thomas' rise from humble beginnings ""From the whole of the country, thanks for what you've done."" Thomas then cycled through the packed streets of Cardiff, accompanied by a peloton of young riders, before he took a stage outside the castle to speak to the crowd. Allow Twitter content? This article contains content provided by Twitter. We ask for your permission before anything is loaded, as they may be using cookies and other technologies. You may want to readTwitter’s cookie policy,externalandprivacy policy,externalbefore accepting. To view this content choose‘accept and continue’. But the Team Sky star, from the Birchgrove area of the Welsh capital, did have a word of advice for the young riders watching around the world. ""Just follow your dreams,"" the 2014 Commonwealth road race gold medallist told the crowd. Allow Twitter content? This article contains content provided by Twitter. We ask for your permission before anything is loaded, as they may be using cookies and other technologies. You may want to readTwitter’s cookie policy,externalandprivacy policy,externalbefore accepting. To view this content choose‘accept and continue’. ""Do what you love to do. Anything is possible with hard work. You're always going to have hard moments but if you really want to do something, go for it."" His parents were on the Champs-Elysees when Thomas crossed the finish line in July and his dad Howell said his son has the bragging rights over his rugby star friends. ""I don't think the rugby players can touch his performance,"" his dad said. Geraint Thomas's parents Hilary and Howell Thomas say their family have enjoyed a ""whirlwind"" time since their son won the Tour de France Geraint Thomas's family - wife Sara, father-in-law Eifion and brother-in-law Rhys and pet dog Blanche - followed him around France ""They'll have to beat the All Blacks if they want to be as good as Geraint winning the Tour de France!"" His mum Hilary, meanwhile, said she had not seen much of her son since he won the Tour. Geraint Thomas poses with a newly-married couple who had their wedding at Cardiff Castle before the celebrations started ""Hywel saw him yesterday but I was in work,"" she said. ""It has been like a whirlwind."" His dad added: ""I think he's so tired now I don't think he knows where he is!"" Geraint Thomas effect: 'Bike sales rise' Thomas inspires girl's Ventoux climb Thomas follows in the footsteps of two other former Whitchurch High School pupils in being recognised in the city. In 2012, then Welsh rugby captain Sam Warburton enjoyed a Grand Slam celebration at the Senedd, while Gareth Bale and Wales' football heroes brought Cardiff to a standstill with a Euro 2016 homecoming after reaching the semi-finals. More than 3,000 people were outside the Senedd in Cardiff Bay to welcome home Geraint Thomas Legendary Welsh entertainer Max Boyce penned a song about Thomas's Tour de France win 'The Boy Who Climbed a Mountain' Thomas's achievement also saw him immortalised in the same way as the great Welsh rugby players in the 1970s, with performer Max Boyce penning a poem about him. Cardiff council leader Huw Thomas said everyone in the city was ""extremely proud"" of the ""landmark victory"" while Welsh Cycling's Anne Adams-King said cyclists from across Wales enjoyed sharing ""this once in a lifetime moment"". This video can not be played The mural of Geraint Thomas took five hours to complete To celebrate his historic win, a 10ft-high graffiti mural depicting Thomas in his yellow jersey has been painted on a wall Maindy leisure centre overlooking the track used by the Maindy Flyers Cycling Club, where his love of the sport began, aged 10. As it happened: Geraint Thomas homecoming parade Tour winner Thomas confident of new deal Boyce pens Geraint Thomas victory poem Tour winner Thomas set for celebration Wales celebrates Tour de France hero Where does Thomas rank among Welsh greats? Hollywood Hills in flames amid most destructive wildfire in Los Angeles' history In maps: Thousands of acres on fire in LA Commuters warned of icy roads as cold snap continues to freeze UK Sound Of 2025: Ezra Collective are 'keeping music real' The Papers: 'Apocalypse' LA and 'Reeves faces extra tax rises' How Australia's beach cabana drama sparked a turf war Visa row fuels anxiety for Indians eyeing American dream 'I thought I was going to die': Jailed Venezuelan activist details brutality of prison life The man who could become Canada's future PM 'Trump 2.0' looms large over the global economy A politician was shot dead in Bangkok. Did another country do it? Chris Mason: Is Starmer leaving the door open to an abuse inquiry? Delivering brand-new miracles in 1970s East End Watch the latest series of Call the Midwife on iPlayer now Mark-Anthony Turnage shares the soundtrack of his life Once called 'Britain’s hippest composer', he's tackled topics from drug abuse to football in his work Paddy’s loaf-changing experience inside the bread factory Paddy McGuinness visits the bread factory he used to work in, and sees how they make 1.4 million loaves a week What's behind the global surrogacy boom? More countries are banning surrogacy – but demand is growing © 2025 BBC. The BBC is not responsible for the content of external sites.Read about our approach to external linking.",Positive,1.0
"This video can not be played The video game that's actually dementia research Men are better at navigating than women, according to a massive study, but there's not much for men to be proud about. Scientists at University College London say the difference has more to do with discrimination and unequal opportunities than any innate ability. The findings come from research into a test for dementia. But it has also given an unprecedented insight into people's navigational ability all around the world. The experiment is actually a computer game,Sea Hero Quest,external, that has had more than four million players. It's a nautical adventure to save an old sailor's lost memories and with a touch of a smartphone screen, you chart a course round desert islands and icy oceans. The game anonymously records the player's sense of direction and navigational ability. One clear picture, published in the journal Current Biology, was that men were better at navigating than women. But why? Prof Hugo Spiers thinks he has found the answer by looking at data from the World Economic Forum's Gender Gap Index - which studies equality in areas from education to health and jobs to politics. He told the BBC: ""We don't think the effects we see are innate. ""So countries where there is high equality between men and women, the difference between men and women is very small on our spatial navigation test. ""But when there's high inequality the difference between men and women is much bigger. And that suggests the culture people are living in has an effect on their cognitive abilities."" Women won't have equality for 100 years Sea Hero Quest has produced a raft of other findings. Denmark, Finland and Norway have the world's best navigational skills - possibly down to their ""Viking blood"" Sense of direction is in constant decline after you emerge from your teenage years People in wealthier countries also tend to be the best navigators The deeper the colour, the stronger the country's navigational ability The popularity of the game has turned it into the world's biggest dementia research experiment. Being lost or disoriented is one of the first signs of the disease. The next step in the research is to see if catching sudden declines in navigational ability could be used to test for dementia. Tim Parry, the director of Alzheimer's Research UK, said: ""The data from Sea Hero Quest is providing an unparalleled benchmark for how human navigation varies and changes across age, location and other factors. ""This really is only the beginning of what we might learn about navigation from this powerful analysis."" This project was funded by Deutsche Telekom and the game was designed by Glitchers. Follow Jameson Twitter.,external Mobile game 'helps dementia research' Being overweight 'cuts dementia risk' Drug 'may slow' Alzheimer's brain death Sea Hero Quest - Gaming to Help Study Dementia Hollywood Hills in flames amid most destructive wildfire in Los Angeles' history In maps: Thousands of acres on fire in LA Commuters warned of icy roads as cold snap continues to freeze UK Sound Of 2025: Ezra Collective are 'keeping music real' The Papers: 'Apocalypse' LA and 'Reeves faces extra tax rises' How Australia's beach cabana drama sparked a turf war Visa row fuels anxiety for Indians eyeing American dream 'I thought I was going to die': Jailed Venezuelan activist details brutality of prison life The man who could become Canada's future PM 'Trump 2.0' looms large over the global economy A politician was shot dead in Bangkok. Did another country do it? Chris Mason: Is Starmer leaving the door open to an abuse inquiry? Delivering brand-new miracles in 1970s East End Watch the latest series of Call the Midwife on iPlayer now Mark-Anthony Turnage shares the soundtrack of his life Once called 'Britain’s hippest composer', he's tackled topics from drug abuse to football in his work Paddy’s loaf-changing experience inside the bread factory Paddy McGuinness visits the bread factory he used to work in, and sees how they make 1.4 million loaves a week What's behind the global surrogacy boom? More countries are banning surrogacy – but demand is growing © 2025 BBC. The BBC is not responsible for the content of external sites.Read about our approach to external linking.",Negative,3.078065e-09
"This video can not be played WATCH: Samsung's Galaxy Note 9 aims to make it easier to take good snaps Samsung's new high-end smartphone alerts owners to problems with their photos as soon as they are snapped. The Galaxy Note 9 uses software to identify if the images are blurry or whether the subject is blinking, among other issues. The innovation is one of several artificial intelligence-enhanced abilities the handset offers that do not rely on remote computer servers. Analysts say this should help tackle increasing competition from Huawei. The Chinese rival made much of itsown flagship phone's machine learning abilitieswhen it launched in March. The Note 9's other new features include a stylus that wirelessly communicates with the phone to act as a remote control. Its display and battery are also bigger than earlier models. The stylus now works as a remote control It goes on sale on 24 August. The basic model will cost £899, while a version with more storage and memory will be £1,099. Note 9's S Pen doubles as a selfie stick Why is Samsung's Galaxy S9 struggling? Huawei P20 Pro 'sees in the dark' The New York launch comes just over a week after Samsung revealed that sales of its other high-end smartphone - the Galaxy S9 - had disappointed. It acknowledged at the time that the Note 9's release had beenbrought forward as a consequence,external. ""Samsung will be mindful to criticism that the S9 offered iterative improvements to the S8,"" commented Shaun Collins, chief executive of the CCS Insight consultancy. ""For existing Note users - who are fiercely loyal to the devices - the upgrades will be seen as compelling. ""But the jury is still out on whether people considering an alternative product, such as the iPhone or P20 Pro, will feel this is different enough to bring them across."" Samsung also revealed that a tie-up with games developer Epic meant thatexisting Galaxy phones,externalare the first Android devices to get access to the hit game Fortnite. Note 9 owners are promised access to an exclusive Fortnite outfit They can download a beta version of the game now ahead of it rolling out to other devices later this week. A Galaxy Home smart speaker powered by the firm's virtual assistant Bixby was also unveiled, in addition to a 4G-enabled smartwatch powered by the firm's Tizen operating system. Samsung has shipped nearly 143 million Galaxy Note handsets since the product line launched in 2011, according to market research firm IDC. That represents about 7% of all the smartphones it has delivered over the period, but their premium prices mean they have accounted for 10% of revenues. Source: IDC * Based on preliminary data for April-to-June 2018 Photo review The Note 9 makes use of a rear dual aperture camera - which adjusts how much light gets in - in a similar manner to the S9. But its software is now smarter. The Note 9 was unveiled at an event in New York The Flaw Detection facility warns when: images appear out of focus it detects a smudge on the lens the lighting is bad the subject has their eyes shut In addition, Scene Optimiser algorithms attempt to identify the contents of the scene. If they succeed,  one of 20 sets of adjustments are made to tweak the contrast, colour and other settings. A on-screen alert will warn users if there is a problem with an image None of this requires an internet connection. ""It was really important that Samsung did this on the device because it makes it faster and more secure,"" commented Francisco Jeronimo from IDC. ""But I was expecting to see even greater use of AI, and to me this seems like Samsung is catching up with Huawei rather than going beyond."" Samsung did, however, demo new capabilities for its smart assistant Bixby. These included the ability to handle follow-up questions during a conversation, and integration with Google Maps. The new S Pen is the first to include Bluetooth connectivity. This means that in addition to being a stylus, it acts as a remote control. The new S Pen can be recharged by putting it back in the phone It can be used to trigger selfies, play and pause YouTube clips, and move along PowerPoint slides. In addition, Samsung is making it possible for other app developers to make use of the functionality. Mr Jeronimo was more positive about the impact this would have. ""The targeted corporate and professional users will appreciate being able to control presentations remotely,"" he explained. ""Many will now be able to do without a laptop."" Samsung says the S Pen will make it easier to take selfies Although the device looks similar to its predecessor,  the Note 9 is slightly wider and thicker. This allows it to have a slightly bigger 6.4in (16.3cm) display and a 4,000mAh battery - representing 21% more capacity than the Note 8. A more expensive variant is also offered this time round, with 8 gigabytes rather than 6GB of RAM (random-access memory) and 512GB instead of 128GB of internal storage. The firm added that its proprietary CPU (central processing unit) was 33% faster than before. This is likely to appeal to hardcore gamers and other power users if they can justify the cost. Samsung also provided a brief first look at the forthcoming Galaxy Home smart speaker. Samsung has promised to reveal more details about the Galaxy Home at a later event It said the voice-controlled device would direct audio at owners via a technology it called SoundSteer, and added that the device included eight microphones to detect voices - more than Amazon's Echo, Google's Home Max or Apple's HomePod. Samsung said that it had partnered with Spotify to provide a streamed music service but did not reveal if other options would be available. Allow Twitter content? This article contains content provided by Twitter. We ask for your permission before anything is loaded, as they may be using cookies and other technologies. You may want to readTwitter’s cookie policy,externalandprivacy policy,externalbefore accepting. To view this content choose‘accept and continue’. The new Galaxy Watch ditches the previous Gear S branding. It also confounded predictions that the firm would swap Tizen for Google's Android Wear operating system. The Galaxy Watch is being offered in three designs The device promises up to seven days of battery life - up from the four days promised by the Gear S3. It also features stress-tracking software and the ability to connect to mobile networks independently. Allow Twitter content? This article contains content provided by Twitter. We ask for your permission before anything is loaded, as they may be using cookies and other technologies. You may want to readTwitter’s cookie policy,externalandprivacy policy,externalbefore accepting. To view this content choose‘accept and continue’. But the South Korean firm lags far behind in this market. While Apple is ranked the bestselling wearable tech manufacturer,according to IDC's latest figures,external, Samsung did not even make the top five. Note 9's stylus doubles as a selfie stick. Video, 00:02:30Note 9's stylus doubles as a selfie stick Is Samsung's Galaxy S9 flagship a flop? Galaxy S9 focuses on new camera tricks CCS Insight IDC Hollywood Hills in flames amid most destructive wildfire in Los Angeles' history In maps: Thousands of acres on fire in LA Commuters warned of icy roads as cold snap continues to freeze UK Sound Of 2025: Ezra Collective are 'keeping music real' The Papers: 'Apocalypse' LA and 'Reeves faces extra tax rises' How Australia's beach cabana drama sparked a turf war Visa row fuels anxiety for Indians eyeing American dream 'I thought I was going to die': Jailed Venezuelan activist details brutality of prison life The man who could become Canada's future PM 'Trump 2.0' looms large over the global economy A politician was shot dead in Bangkok. Did another country do it? Chris Mason: Is Starmer leaving the door open to an abuse inquiry? Delivering brand-new miracles in 1970s East End Watch the latest series of Call the Midwife on iPlayer now Mark-Anthony Turnage shares the soundtrack of his life Once called 'Britain’s hippest composer', he's tackled topics from drug abuse to football in his work Paddy’s loaf-changing experience inside the bread factory Paddy McGuinness visits the bread factory he used to work in, and sees how they make 1.4 million loaves a week What's behind the global surrogacy boom? More countries are banning surrogacy – but demand is growing © 2025 BBC. The BBC is not responsible for the content of external sites.Read about our approach to external linking.",Positive,0.9999994
"Evacuations continued as the Holy Fire approached within a half mile of homes on Wednesday Authorities have arrested a man for starting the so-called Holy Fire, which has burned over 9,600 acres through the mountains of Southern California. Forrest Gordon Clark, 51, had emailed the local volunteer fire chief to threaten ""this place will burn"", according to Orange County officials. Over 600 firefighters are battling the Holy Fire, which is just one of 18 wildfires raging across the state. The Mendocino Complex fire has been declared the largest in state history. Forrest Gordon Clark, 51, is accused of starting the fire after a decade-long dispute with his neighbours California wildfire 'largest in history' Eight images that reveal scale of California devastation The photos that explain the world's wildfires This video can not be played With wildfires occurring across the globe, here are some of the techniques used to stop them Mr Clark was arrested outside his cabin on Tuesday after a brief standoff with officers. He was charged with arson, felony threat to terrorise and resisting arrest. Evacuees watch flames crest over the nearby mountains He was booked in jail on a $1m bond in relation to the fire, which continues to burn in the Santa Ana Mountains south of Los Angeles. Authorities say he intentionally started the fire on Monday after a decade-long dispute with neighbours. All 12 nearby properties were burned by the fire, with only Mr Clark's home left standing. Susan Schroeder, spokeswoman for the Orange County district attorney's office, said her office would ""bring him to justice for these terrible crimes"". Allow Twitter content? This article contains content provided by Twitter. We ask for your permission before anything is loaded, as they may be using cookies and other technologies. You may want to readTwitter’s cookie policy,externalandprivacy policy,externalbefore accepting. To view this content choose‘accept and continue’. More than 600,000 acres across the state have been consumed by this year's fire season, which experts warn is growing longer each year. More than 14,000 firefighters are working across the state, with crews from Australia and New Zealand assisting. Allow Twitter content? This article contains content provided by Twitter. We ask for your permission before anything is loaded, as they may be using cookies and other technologies. You may want to readTwitter’s cookie policy,externalandprivacy policy,externalbefore accepting. To view this content choose‘accept and continue’. Prisoners, including fewer than 100 juvenile offenders, are also lending a hand in exchange for only a few dollars a day. Two firefighters have been treated for heat-related injuries in the Holy Fire. Officials say that fire is only 5% contained as temperatures continue to stay above 90F (32C). But they are hopeful that weather conditions will improve when temperatures fall over the weekend. Meanwhile, evacuations continued on Wednesday as the Holy Fire flames approached within half a mile of homes. The Mendocino Complex Fire in northern California, which is made up of two separate fires, has burned at least 302,086 acres since it began on 27 July. The area of destruction is now larger than the entire city of Los Angeles. Authorities say it is only 47% contained, and predict that it will continue to burn into September. The second largest is the Carr Fire, which has burned more than 176,000 acres, and has killed seven people and destroyed more than 1,000 homes. According to state fire officials, California's fire expenses have more than trebled from $242m in 2013 to $773m in the 2018 fiscal year ending on 30 June. Wildfires are also burning in British Columbia, Canada, where reinforcements have arrived from Mexico and New Zealand to help combat the outbreak. California wildfire 'largest in history' Eight images that reveal scale of California devastation Thousands flee 'tornado' California fires Dry conditions fuel California wildfires How wildfires start and how to stop them Reality Check: Mapping the global heatwave New fire erupts in Hollywood Hills and threatens landmarks as chaos grips LA In maps: Thousands of acres on fire in LA Commuters warned of icy roads as cold snap continues to freeze UK Sound Of 2025: Ezra Collective are 'keeping music real' The Papers: 'Apocalypse' LA and 'Reeves faces extra tax rises' How Australia's beach cabana drama sparked a turf war Visa row fuels anxiety for Indians eyeing American dream 'I thought I was going to die': Jailed Venezuelan activist details brutality of prison life The man who could become Canada's future PM 'Trump 2.0' looms large over the global economy A politician was shot dead in Bangkok. Did another country do it? Chris Mason: Is Starmer leaving the door open to an abuse inquiry? Delivering brand-new miracles in 1970s East End Watch the latest series of Call the Midwife on iPlayer now Mark-Anthony Turnage shares the soundtrack of his life Once called 'Britain’s hippest composer', he's tackled topics from drug abuse to football in his work Paddy’s loaf-changing experience inside the bread factory Paddy McGuinness visits the bread factory he used to work in, and sees how they make 1.4 million loaves a week What's behind the global surrogacy boom? More countries are banning surrogacy – but demand is growing © 2025 BBC. The BBC is not responsible for the content of external sites.Read about our approach to external linking.",Positive,0.54822135
