article,article_sentiment,article_score
"Vaccinating a billion people will be a huge challenge When it comes to vaccine making, India is a powerhouse. It runs a massive immunisation programme, makes 60% of the world's vaccines and is home to half a dozen major manufacturers, including Serum Institute of India - the largest in the world. Not surprisingly, there's no lack of ambition when it comes to vaccinating a billion people against Covid-19. India plans to receive and utilise some 500 million doses of vaccines against the disease and immunise up to 250 million people by July next year. This video can not be played Covid-19: Why mass vaccination will be a challenge for India This confidence is bolstered by its track record of immunising large numbers of people every year. India's 42-year-old immunisation programme, one of the world's largest health programmes, targets 55 million people - mainly newborns and pregnant women who receive some 390 million free doses of vaccines against a dozen diseases every year. The country also has a well-oiled electronic system to stock and track these vaccines. Yet vaccinating a billion people, including hundreds of millions of adults for the first time, against Covid-19 is going to be a daunting and unprecedented challenge, say experts. Five of the 30 vaccine candidates being developed in India are in clinical trials. They include the Oxford-AstraZeneca vaccine which is being tested by Serum and a home-grown one being developed by Bharat BioTech. ""Having a home-grown vaccine is a top priority,"" Dr Renu Swarup, secretary of India's Department of Biotechnology, told me. The AstraZeneca vaccine is being tested in India From choosing a bouquet of vaccines to grappling with distribution to identifying groups for the early jabs, ""everything is a challenge"", says Dr Gagandeep Kang, a microbiologist and the first Indian woman to be elected Fellow of the Royal Society of London. ""We are underestimating the complexity of the exercise. It will take at least a couple of years to get half of Indians vaccinated."" Here are some of the main challenges: India has some 27,000 ""cold chain"" stores from where stocked vaccines can reach more than eight million locations. (Nearly all vaccines need to be transported and distributed between 2C and 8C in what comprises the so-called cold chain.) Will that be enough? India will also need enough auto-disabled syringes that will prevent reuse and possible reinfection. The country's biggest syringe maker says it will bemaking a billion such syringes,externalby next year to meet rising demand. Then there are questions about smooth supplies of medical glass vials. And what about the disposal of the huge amount of medical waste that will be generated by this mass vaccination drive? India immunisation programmes is one of the largest in the world Nearly four million doctors and nurses power India's immunisation programme, but India will need more to carry out Covid vaccinations. ""I worry about how we can [extend all the resources] to rural India,"" Kiran Mazumdar Shaw, founder of Biocon, the country's leading biotechnology enterprise, told me. Vaccine supplies will be tight next year, and deciding who will get the jabs first is going to be tricky. Health Minister Harsh Vardhan says private and government health care workers and frontline workers ""of other departments"" will receive the early doses. Experts believe it's not going to be easy. ""We will never have sufficient supply of vaccines. The prioritisation of recipients is going to be a considerable challenge,"" says  epidemiologist Dr Chandrakant Lahariya. Pune-based Serum Institute of India is the world's biggest vaccine maker Consider this. In a country where the majority of healthcare is private, will a private health worker get priority over a public one? Will permanent workers get priority over people working on contracts? If elderly people with underlying conditions are eligible for early shots, how will different co-morbidities be prioritised? India, for example, has more than 70 million diabetics, the second highest in the world. Will all of them be given a blanket preference? Rolling out the vaccine in all the 30 states will not be possible. So will early supplies go to states worst-hit by the pandemic? Questions about equity and non-partisanship are inevitable. Stitching up manufacturing contracts with vaccine makers with a ""reasonably good portfolio"" of vaccines should help India give sufficient doses to people relatively quickly, according to Prashant Yadav, who studies health care supply chains at the Washington-based Centre for Global Development. But the success at routine immunisation doesn't guarantee success with Covid-19 vaccines, he says. ""The routine immunisation infrastructure has a huge footprint, but is mostly for government-run clinics. There is no large-scale adult vaccination programme and adults don't routinely seek primary care in government public health care centres,"" says Dr Yadav. A well-regulated public-private partnership is the only way out this time, he adds. People like Ms Shaw and Nandan Nilekani, a co-founder of Infosys, one of India's biggest information technology services companies, suggest that India should useAadhaar, the unique 12-digit identification number that over a billion Indians use to access welfare and pay taxes, to record and track each dose. Hindustan Syringes is planning to produce a billion syringes ""We need to design a system than can do 10 million vaccinations a day across the length and breadth of the country but allunified by a digital backbone,external,"" Mr Nilekani told a newspaper. Some of the concerns are about corruption over access to vaccines. How do authorities prevent fraud such as people getting fake papers to include themselves in lists of people who are selected for early shots?  And how do you preventfake vaccines,externalbeing sold in remote markets? How a 'warm vaccine' could help India Are Indians more immune to Covid-19? Has the pandemic really peaked in India? Why Indiaâs Covid problem could be bigger than we think Vaccines come with side effects for some people. India has a 34-year-old surveillance programme for monitoring such ""adverse events"" following immunisation. But researchers have found that benchmarks for reporting side effects still remain weak andthe number of serious adverse events are still far less than the expected numbers.,external A failure to transparently report adverse effects could easily lead to fear-mongering around vaccines. This is possibly the biggest question. Will the government acquire all the doses and roll out a state-run free or subsidised vaccination programme? Or will the affluent pay for their doses at market prices through private distribution and sale? Experts like Dr Lahariya believe that the government should be footing the bill for vaccinating every Indian until the pandemic is over. Others like Dr Shaw say that private firms could pay to vaccinate their employees. Mr Nilekani reckons that with vaccines costing between $3 and $5 (Â£2.24 and Â£3.74) in the beginning, a dual dose vaccine could cost up to $10 for each Indian and $13bn for India. That would be very expensive. That's why, says Gagandeep Kang, a good vaccine for India should cost below 50 cents a shot, be plentifully available and delivered as a single dose. ENDGAME:When will life get back to normal? EASY STEPS:What can I do? A SIMPLE GUIDE:What are the symptoms? MAPS AND CHARTS:Visual guide to the outbreak VIDEO:The 20-second hand wash Follow Soutikon Twitter,external Will countries be left behind in the vaccine race? How a 'warm vaccine' could help India tackle Covid How India will play a major role in a virus vaccine How soon can we expect a working vaccine? Inside the Indian company betting big on Covid vaccines. Video, 00:02:40Inside the Indian company betting big on Covid vaccines Deadly wildfires rage across LA as fierce winds threaten more destruction UK has enough gas, says No.10 after supply warning UK records coldest night of winter as freeze to last into weekend 'I paid fake doctor thousands for fillers - now I look like a gargoyle' The Papers: 'Lost Angeles' and 'Musk seeks plan to oust Starmer' Pop star Chappell Roan wins BBC Sound Of 2025 Weekly quiz: Zendaya looked happy but who else sparkled at the Golden Globes? The 20 child abuse inquiry proposals - what has happened so far? The '9/11 mastermind' wants to plead guilty. Why is the US trying to stop him? Why are UK borrowing costs rising and what does it mean for me? In maps: Thousands of acres on fire in LA Before and after: How wildfires tore through LA Ed Gamble hosts the official Traitors podcast Join Ed Gamble and guests as they dissect the first episodes of The Traitors! Can art, music and words bind us in divided times? Simon Schama explores how artists have captured the transformations of British society since 1945 Enjoy a satirical smorgasbord of The News Quiz Digest a dramatic year of news as Andy Zaltzman revels in some of 2024's funniest moments The multi-award-winning legal drama returns Two years on, the Defoes are back and have gathered for a beautiful wedding in Barcelona Â© 2025 BBC. The BBC is not responsible for the content of external sites.Read about our approach to external linking.",Negative,1.6460349e-11
"The UK government is to cut 60% of its funding to Unicef, the United Nation's children's fund, as part of its move to reduce spending on foreign aid. It means the UN agency, which distributes humanitarian aid to children around the world, will get Â£16m this year, down from Â£40m. Unicef warned of ""serious consequences"" for children, particularly those affected by Covid-19. The Foreign Office said the pandemic has forced it to make tough decisions. The government announced last year it would cut UK aid spending from 0.7% of national income to 0.5% - which amounts to a reduction of more than Â£4bn. Some MPs defended the cuts at the time as being backed by the public, with some politicians arguing that domestic spending should come first during the pandemic. This cut is the latest to be announced as aid charities and agencies begin to reveal the impact of the government's reduced overseas development budget. What's behind the PM's aid department decision? UK cuts its pledge to UN family planning by 85% In a statement, the UK committee for Unicef said it was ""deeply concerned"" by the decision. It said the agency had been able to respond to the most pressing education, protection and health needs of children affected by Covid in 2020 thanks to the UK government funding. It went on to say it was too soon to know the full impact of this and future cuts on the Unicef programme but there was concern children living in some of the world's worst crises and conflicts would suffer the consequences. Unicef acknowledged the ""challenging"" financial situation facing governments, but called on the UK government to return to spending 0.7% of the national income on foreign aid from 2022 ""at the latest"". A spokesperson for the Foreign, Commonwealth and Development Office said: ""The seismic impact of the pandemic on the UK economy has forced us to take tough but necessary decisions, including temporarily reducing the overall amount we spend on aid. ""We will still spend more than Â£10bn this year to fight poverty, tackle climate change and improve global health."" Earlier this week, the BBC obtained an internal Foreign Office memo which said funding for global water, sanitation and hygiene bilateral projects would becut by more than 80%, prompting criticismfrom leading charity WaterAid. It also emerged that the United Nations global family planning programmewould not receive Â£154m for its projects, as pledged by the UK, and would instead get about Â£23m this year. Asked about the cuts, Prime Minister Boris Johnson said the government had always been clear it intended to return to spending 0.7% of national income on aid when it was ""fiscally prudent to do so"". Separately, the UK government has given the BBC World Service Â£8m to help tackle disinformation and inaccurate news reporting around the world. Foreign Secretary Dominic Raab said it would allow the BBC to ""take impartial journalism to many more people around the world, by countering those who distort the truth to mislead the public"". The money comes on top of previous funding for the BBC's World2020 programme, which was launched in 2016 and aims to expand the BBC's global reach. BBC director-general Tim Davie said through the programme the World Service has achieved an all-time record audience of 351 million, in 42 languages, with the BBC's global news services now reaching 438 million every week. UK cuts its pledge to UN family planning by 85% Charity warns UK aid to see 63% cut in funding UK's foreign aid spending cut by Â£2.9bn UK's aid cuts for clean water projects criticised Deadly wildfires rage across LA as fierce winds threaten more destruction UK has enough gas, says No.10 after supply warning UK records coldest night of winter as freeze to last into weekend 'I paid fake doctor thousands for fillers - now I look like a gargoyle' The Papers: 'Lost Angeles' and 'Musk seeks plan to oust Starmer' Pop star Chappell Roan wins BBC Sound Of 2025 Weekly quiz: Zendaya looked happy but who else sparkled at the Golden Globes? The 20 child abuse inquiry proposals - what has happened so far? The '9/11 mastermind' wants to plead guilty. Why is the US trying to stop him? Why are UK borrowing costs rising and what does it mean for me? In maps: Thousands of acres on fire in LA Before and after: How wildfires tore through LA Ed Gamble hosts the official Traitors podcast Join Ed Gamble and guests as they dissect the first episodes of The Traitors! Can art, music and words bind us in divided times? Simon Schama explores how artists have captured the transformations of British society since 1945 Enjoy a satirical smorgasbord of The News Quiz Digest a dramatic year of news as Andy Zaltzman revels in some of 2024's funniest moments The multi-award-winning legal drama returns Two years on, the Defoes are back and have gathered for a beautiful wedding in Barcelona Â© 2025 BBC. The BBC is not responsible for the content of external sites.Read about our approach to external linking.",Negative,1.1333212e-08
"Protesters skirmished with riot police during a May Day protest in Istanbul, Turkey Turkish police have arrested more than 200 people for holding unauthorised protests on May Day, which has seen rallies across the world despite the continued spread of Covid-19. The protesters in Turkey's largest city, Istanbul, were caught breaching restrictions imposed to curb a third wave of coronavirus. Marches led by workers and unions are held on 1 May every year as part of International Labour Day celebrations in many countries. This year, the rallies took place once again against the backdrop of a pandemic that has destroyed livelihoods and upended economies worldwide. German riot police stepped in to break up rallies in Berlin that were deemed to be in breach of Covid-19 restrictions Labour unions traditionally lead rallies worldwide on 1 May, such as this one in Turin In many countries, police were deployed in large numbers to deal with possible disorder and ensure coronavirus restrictions were observed. Scaled-back rallies were held in Germany, Russia, Spain, Sweden, the UK, Cuba, Colombia, the Philippines, Indonesia and many other countries. Most demonstrations were peaceful. Swedish police officers take a protester into custody in Stockholm Tensions were high in many cities, such as Paris, as the effects of the pandemic continue to be felt But Turkey was among several countries where police were embroiled in May Day protests that turned violent on Saturday. The office of Istanbul's governor said 212 people had been arrested after they broke away from marches and tried to enter Taksim Square, a symbolic area of protest. Pictures showed chaotic scenes in which police used their shields to push back crowds and dragged some protesters away from the square. The country went intoits first full pandemic lockdown earlier this week, in a bid to curb a surge in infections and deaths. Riot police detained demonstrators as they attempted to march on Taksim Square in Istanbul Scuffles between riot police and demonstrators broke out in the Turkish city In France, at least 46 people were arrested in the capital, Paris, after some marchers clashed with riot police, threw stones, smashed windows and set fire to rubbish bins. French government agencies condemned one protester who was pictured assaulting a firefighter as they attempted to extinguish a blaze in the capital. The Interior Ministry said more than 106,000 people marched at almost 300 rallies organised in Paris and other cities, including Lyon, Nantes, Lille and Toulouse. The protesters voiced their opposition to government plans to change unemployment benefits and demanded economic justice. Riot police were out in force in the French capital Barricades were set alight in the streets of Paris Similar demands were heard in Germany, where May Day protests were held nationwide despite the introduction of tougher Covid-19 rules last week. In the capital, Berlin, thousands of police were deployed to monitor multiple demonstrations, including one organised by a group that opposes the government's coronavirus strategy. An estimated 10,000 cyclists staged a peaceful anti-capitalist protest in the city. But as darkness fell, the mood grew more tense as protesters set barricades alight and confronted police who were trying to enforce Covid-19 regulations at a left-wing demonstration. Workers of the wheels united for an anti-capitalist protest in Berlin Large crowds were seen in Berlin, where protests were held in defiance of Covid-19 restrictions German police were pictured dragging some protesters away in the capital Berlin police broke up a left-wing demonstration, prompting a reaction from some protesters Coronavirus was on the agenda in Indonesia as well. At one rally, protesters in the capital of Jakarta laid mock graves on the street to symbolise the human toll of the pandemic. Mock graves were laid in the street at one May Day rally in Indonesia Rallies were held in multiple cities across Indonesia Labour Day celebrations were unusually muted in Cuba, where workers gather for large events to commemorate the communist revolution that brought Fidel Castro to power in 1959. But for the second year running, Cuba called off its May Day march though Havana's Plaza de la Revolution Square, as the country battles Covid-19 and an economic crisis. Instead, a small number of national leaders gathered at largely empty public spaces, while citizens were urged to celebrate at home. Cuba's May Day celebrations had little of the usual pomp and circumstance Labour Day is one of the biggest events of the year in Cuba In Brussels, Belgium's capital, officers trying to clear a dance rave from a park used water cannon, pepper spray and batons as some of the partygoers pelted them with eggs. During the commotion, one demonstrator was knocked unconscious after they were struck by a water cannon truck, local media said. Dubbed La Boum 2 (The Party 2), the event was a sequel toa fake concert that drew thousands of people after it was announced on social media as an April Fools' Day joke. Police used water cannon to clear the park of revellers in Brussels The Brussels event was organised in part as a protest against the government's coronavirus measures Meanwhile, a proposed law that would give police extra powers to curb protests was one of the main subjects of grievance at protests in the UK. Hundreds gathered in London to protest against thePolice, Crime, Sentencing and Courts bill, which activists fear would be used to curb dissent. The ""Kill the Bill"" protest saw thousands of demonstrators march through London Some protesters set off red flares during the London march against the policing bill All photographs subject to copyright In pictures: May Day protests around the world Four-day week: 'I don't waste holidays on chores' Amazon worker fight: 'You're a cog in the system' Â© 2025 BBC. The BBC is not responsible for the content of external sites.Read about our approach to external linking.",Positive,0.9999982
"Not quite a butterfly: Colin the deep fried caterpillar cake Britain's most famous birthday cake has been given the full Scottish chippy treatment. The concept of the deep fried chocolate bar was taken to a new level when a full Colin the Caterpillar cake was battered and dropped into the deep fat fryer in a Lanarkshire chip shop. The deep-fried Colin stunned customers on Friday as he posed on the hot plate. The culinary experiment follows a legal row between M&S and Aldi over use of the caterpillar cake idea. Ricky Brandon, who owns Emanuel's chip shop in East Kilbride was asked to batter the cake by local food delivery app East Kilbride Eats after the cake hit the headlines. M&S sues Aldi over Colin the Caterpillar cake M&S hits back at Aldi's Cuthbert the Caterpillar cake revival He said he had fried a few Mars bars in his time, several creme eggs and the odd Twix. But never a caterpillar. The process became heated when he realised he would need an extra-thick batter to hold the body together. Colin emerged from the deep fat fryer not as a butterfly but as a crispy chocolate log. Trust the process: Colin the caterpillar gets battered Mr Brandon told BBC Scotland: ""For my first attempt, I am not dissatisfied. ""The customers who came in and saw it were surprised,  saying 'What is that?'."" Controversially, he said: ""I think Cuthbert might fry a little better."" A row broke out last month when Marks & Spencer launched legal action against Aldi, arguing the supermarket's Cuthbert the Caterpillar cake infringed its Colin the Caterpillar trademark. M&S claimed that their similarity led consumers to believe they were of the same standard and that the Aldi cake ""rides on the coat-tails"" of M&S's reputation. Colin the caterpillar and Cuthbert It lodged an intellectual property claim with the High Court. The news prompted taste tests across the country, and social media was awash with ""free Cuthbert"" memes. A Twitter exchange between the two supermarket brands followed. Aldi, who had stopped selling the cake in February, announced a limited edition version of Cuthbert to benefit the Teenage Cancer Trust and Macmillan Cancer Support. M&S said it loved a charity idea, but Aldi should use its own character. Unveiling the idea on social media, Aldi said: ""Let's raise money for charity, not lawyers."" M&S replied that a cake based on Aldi's Kevin the Carrot commercials would be better, adding: ""That idea's on us."". M&S sues Aldi over Colin the Caterpillar cake M&S hits back at Aldi's caterpillar cake comeback Judge Rinder's verdict on Colin v Cuthbert. Video, 00:02:15Judge Rinder's verdict on Colin v Cuthbert Talented duo to bring jazz and classical music connections to Greenock concert Harlequins in must-win territory against Toulon, says Chris Robshaw Freckfest bring Juniper Three back to Irvine for Harbour Arts Centre gig Popular tribute act for iconic singer returning to Greenock this year Robert Burns' Glasgow: 6 spots in Glasgow that influenced Scotland's greatest poet Rail replacement buses to replace busy Glasgow train services this weekend Deadly wildfires rage across LA as fierce winds threaten more destruction UK has enough gas, says No.10 after supply warning UK records coldest night of winter as freeze to last into weekend 'I paid fake doctor thousands for fillers - now I look like a gargoyle' The Papers: 'Lost Angeles' and 'Musk seeks plan to oust Starmer' Pop star Chappell Roan wins BBC Sound Of 2025 Weekly quiz: Zendaya looked happy but who else sparkled at the Golden Globes? The 20 child abuse inquiry proposals - what has happened so far? The '9/11 mastermind' wants to plead guilty. Why is the US trying to stop him? Why are UK borrowing costs rising and what does it mean for me? In maps: Thousands of acres on fire in LA Before and after: How wildfires tore through LA Ed Gamble hosts the official Traitors podcast Join Ed Gamble and guests as they dissect the first episodes of The Traitors! Can art, music and words bind us in divided times? Simon Schama explores how artists have captured the transformations of British society since 1945 Enjoy a satirical smorgasbord of The News Quiz Digest a dramatic year of news as Andy Zaltzman revels in some of 2024's funniest moments The multi-award-winning legal drama returns Two years on, the Defoes are back and have gathered for a beautiful wedding in Barcelona Â© 2025 BBC. The BBC is not responsible for the content of external sites.Read about our approach to external linking.",Positive,0.9999783
