article,article_sentiment,article_score
"The US is planning tariffs on metals - but may be hit in kind by other countries Some countries may be exempt from US plans to impose tariffs on metal imports, the White House has announced. The exemptions - on national security grounds - included Canada and Mexico, spokeswoman Sarah Sanders said. Reports, however, suggested the apparent softening of the US stance would last for only 30 days. US President Donald Trump has said steel products will face a 25% tariff, with 10% on aluminium goods. He is expected to sign the plan on Thursday. Mr Trump tweeted on Thursday morning that he was ""looking forward"" to a meeting later in the day on the matter. Allow Twitter content? This article contains content provided by Twitter. We ask for your permission before anything is loaded, as they may be using cookies and other technologies. You may want to readTwitterâs cookie policy,externalandprivacy policy,externalbefore accepting. To view this content chooseâaccept and continueâ. Meanwhile, China threatened an ""appropriate and necessary response"" in any trade war with the US. Foreign Minister Wang Yi said China and the US should strive to be partners rather than rivals. The EU has proposed retaliatory measuresagainst a number of US goods including bourbon and peanut butter. Why Trump is hanging tough on trade Five reasons Why trade wars aren't easy to win Steel tariffs: What impact will they really have? Despite opposition at home and abroad,  Ms Sanders said the US president would sign the measures in by the end of the week. But she added: ""There are potential carve-outs for Mexico and Canada based on national security, and possibly other countries as well based on that process. That would be [on] a case-by-case and country by country basis."" President Trump has previously suggested that planned tariffs for Canada and Mexico could be abandoned if a ""new and fair"" North American Free Trade Agreement (Nafta) is signed. White House trade policy adviser Peter Navarro said on Wednesday that the tariffs would start in 15 to 30 days' time and there would be ""a clause that does not impose these tariffs immediately on Canada and Mexico"". Both countries knew the president was not ""messing around in this"", he added. Mr Trump has railed against the US trade deficit, arguing that other countries have been ""taking advantage of"" the US for decades. One of his campaign promises was to rebuild the US steel and aluminium industries which he said has suffered ""disgraceful"" treatment from other countries, in particular cheap Chinese imports. Allow Twitter content? This article contains content provided by Twitter. We ask for your permission before anything is loaded, as they may be using cookies and other technologies. You may want to readTwitterâs cookie policy,externalandprivacy policy,externalbefore accepting. To view this content chooseâaccept and continueâ. Last week he dismissed concerns he could trigger a trade war, instead saying ""trade wars are good"" and were something the US would easily win. Mr Trump has already hinted he could drop plans to impose tariffs on Mexican and Canadian metals but linked it to the US getting a better deal in the North American Free Trade Agreement (Nafta). Mexico and Canada are among the main suppliers of steel to the US. The US plans have sparked worldwide alarm and jolted stock markets. Critics argue that the tariffs would fail to protect American jobs and would ultimately raise prices for consumers. More than 100 Republicans on Wednesday signed a letter addressed to the president, expressing their ""deep concern"" about the tariffs. The letter referenced a sweeping tax cuts bill Congress and the White House worked to pass last year, arguing that ""adding new taxes in the form of broad tariffs would undermine the remarkable progress"". International Monetary Fund chief Christine Lagarde warned ""nobody wins"" in a trade war, saying it would harm global economic growth. The EU has set out tit-for-tat plans to impose import duties on bourbon, peanut butter, cranberries, orange juice, steel, and industrial products. Other countries are also considering retaliatory steps. Members of Mr Trump's Republican party are concerned too, with House Speaker Paul Ryan saying he wanted to see tariffs that were ""more surgical and more targeted"". Tuesday saw the departure of top White House economic advisor Gary Cohn, who is a strong supporter of free trade. US juice and peanut butter face new EU tax Key Trump economy adviser Cohn resigns Why Trump is hanging tough on trade Death toll rises amid most destructive wildfire in Los Angeles' history Moment friends abandon house as Palisades fire closes in 'Patients are collapsing in the waiting room': A&E nurses speak out Why does Trump want Greenland and what do its people think? How Canada's immigration debate soured - and helped seal Trudeau's fate 'I can't get divorced as I can't get my pension valued' What are cold weather payments and who can get them? BBC Sound of 2025: Barry Can't Swim is a new dance music superstar Ros Atkins on...Elon Musk's political interventions Jean-Marie Le Pen - founder of French far right and 'Devil of the Republic' Cases of HMPV are on the rise in China - but what is it? Politics Essential: Get the latest news and analysis delivered to your inbox every weekday Delivering brand-new miracles in 1970s East End Watch the latest series of Call the Midwife on iPlayer now Mark-Anthony Turnage shares the soundtrack of his life Once called 'Britainâs hippest composer', he's tackled topics from drug abuse to football in his work Paddyâs loaf-changing experience inside the bread factory Paddy McGuinness visits the bread factory he used to work in, and sees how they make 1.4 million loaves a week What's behind the global surrogacy boom? More countries are banning surrogacy â but demand is growing Â© 2025 BBC. The BBC is not responsible for the content of external sites.Read about our approach to external linking.",Negative,0.02421599
"Amazon's Alexa is finding something funny, and scaring some users Amazonâs Alexa has been letting out an unprompted, creepy cackle - startling users of the best-selling voice assistant. The laugh, described by some as âwitch likeâ was reported to sometimes happen without the device being âwokenâ up. Others reported the laugh occurring when they asked Alexa to perform a different task, such as playing music. ""Weâre aware of this and working to fix it,â Amazon said. ""In rare circumstances, Alexa can mistakenly hear the phrase 'Alexa, laugh'. ""We are changing that phrase to be 'Alexa, can you laugh?' which is less likely to have false positives, and we are disabling the short utterance 'Alexa, laugh'. ""We are also changing Alexa's response from simply laughter to 'sure, I can laugh' followed by laughter."" Voice assistants like Alexa are designed to respond or act only when prompted with a wake word, which in this case is âAlexaâ or âAmazonâ. But some people have suggested the glitch happened without any prior interaction, spooking Alexa owners. ""WHY DID MY ALEXA JUST LAUGH OUT OF THE BLUE?!?!?!?â wrote one user on Twitter. Another wrote: ""Lying in bed about to fall asleep when Alexa on my Amazon Echo Dot lets out a very loud and creepy laugh... thereâs a good chance I get murdered tonight.â The use of voice assistants in the home is often met with caution due to their nature - voice commands are recorded and sent to the cloud for processing, a system that stokes a fear of eavesdropping, unintended or otherwise. Incidents like this, where an assistant seems to rebel against its owner, naturally further this concern. That said, most users on social media have reacted with humour, drawing parallels with HAL 9000 from the 1968 film 2001: A Space Odyssey. âIâm sorry, Dave,â the machine famously said. âIâm afraid I canât do that."" Amazon 2017 sales jump by nearly a third The supermarket with no checkouts Comments can not be loaded To load Comments you need to enable JavaScript in your browser Death toll rises amid most destructive wildfire in Los Angeles' history Moment friends abandon house as Palisades fire closes in 'Patients are collapsing in the waiting room': A&E nurses speak out Why does Trump want Greenland and what do its people think? How Canada's immigration debate soured - and helped seal Trudeau's fate 'I can't get divorced as I can't get my pension valued' What are cold weather payments and who can get them? BBC Sound of 2025: Barry Can't Swim is a new dance music superstar Ros Atkins on...Elon Musk's political interventions Jean-Marie Le Pen - founder of French far right and 'Devil of the Republic' Cases of HMPV are on the rise in China - but what is it? Politics Essential: Get the latest news and analysis delivered to your inbox every weekday Delivering brand-new miracles in 1970s East End Watch the latest series of Call the Midwife on iPlayer now Mark-Anthony Turnage shares the soundtrack of his life Once called 'Britainâs hippest composer', he's tackled topics from drug abuse to football in his work Paddyâs loaf-changing experience inside the bread factory Paddy McGuinness visits the bread factory he used to work in, and sees how they make 1.4 million loaves a week What's behind the global surrogacy boom? More countries are banning surrogacy â but demand is growing Â© 2025 BBC. The BBC is not responsible for the content of external sites.Read about our approach to external linking.",Positive,0.9999999
"This video can not be played Tusk on Brexit: 'We will be drifting apart' Donald Tusk has insisted the EU ""does not want to build a wall"", but Brexit means ""we will be drifting apart"". The EU Council president said Theresa May wanted to ""demonstrate at any price that Brexit could be a success"", but that was not the EU's objective. He was unveilingdraft guidelines for the EU side,externalof Brexit trade talks. Mr Tusk said the EU wanted an ""ambitious and advanced"" free trade deal - and continued access to UK waters for EU fishing vessels. Kuenssberg: Differences, but room for manoeuvre Reality Check: EU predicts Brexit costs for UK Kamal Ahmed: Hammond's hidden message ""Our agreement will not make trade between the UK and EU frictionless or smoother,"" he said. ""It will make it more complicated and costly than today for all of us. This is the essence of Brexit."" He said it would be the first time in history that a free trade agreement would ""loosen, not strengthen, economic ties"". This video can not be played Donald Tusk: Theresa May's political goal is Brexit success ""at any price"" The draft European Council guidelines call for zero-tariff trade in goods - where the EU has a surplus. The document also says access for services will be limited by the fact that the UK will be outside the EU and will no longer share a common regulatory and judiciary framework. The draft guidelines repeat EU warnings that there can be ""no cherry-picking"" of participation in the single market for particular sectors of industry. The BBC's Reality Check correspondent Chris Morris said the ""narrow negotiating mandate set out in these guidelines suggests that the EU doesn't think it will be much more ambitious than other free trade agreements it has negotiated - Canada is the most obvious example"". Mr Tusk said he wanted continued security and research cooperation and to ensure flights were not grounded. But he added: ""No member state is free to pick only those sectors of the internal market they like, or to accept the role of the ECJ only when it suits their interest."" The draft guidelines also say that the EU will ""preserve its autonomy as regards its decision-making, which excludes participation of the United Kingdom as a third-country to EU Institutions, agencies or bodies"". This video can not be played Theresa May: ""We must bring our country back together"" Mrs May acknowledged in her Mansion House speech on Brexit on Friday that neither side would get everything they want from negotiations. But she also stressed that the UK wanted a bespoke trade deal, rather than an ""off-the-shelf"" model. ""The fact is that every free trade agreement has varying market access depending on the respective interests of the countries involved,"" she said. ""If this is cherry-picking, then every trade arrangement is cherry-picking."" She also said: ""We will also want to explore with the EU, the terms on which the UK could remain part of EU agencies."" This appears to be in conflict with the EU draft guidelines, although BBC Research has found several examples of non-EU members participating - as a member or observer - in EU agencies and bodies, such as the European Environment Agency and the European Medicines Agency. The EU says it wants to maintain ""existing reciprocal access to fishing waters"" - a leading concern of the fishing industry in countries bordering the North Sea. In her Mansion House speech, Mrs May said: ""The UK will regain control over our domestic fisheries management rules and access to our waters."" She added that the UK would want to ""work together to manage shared stocks in a sustainable way and to agree reciprocal access to waters and a fairer allocation of fishing opportunities for the UK fishing industry"". Brexit Secretary David Davis - quizzed on Tuesday by Brexiteer Labour MP Kate Hoey - insisted the government would not betray UK fishing communities by ""trading away fishing rights"" for ""other things"". Asked about the EU's demand to keep access as it is now, Chancellor Philip Hammond said the UK was ""open to discussing with our EU partners about the appropriate arrangements for reciprocal access for our fishermen to EU waters and for EU fishermen to our waters"". Campaign group Fishing for Leave urged the government not to ""cave in"" to the EU demands, saying: ""Nowhere else is access to fisheries included as negotiating collateral for a free trade agreement."" Financial services are not mentioned specifically in the EU draft guidelines, but it is shaping up to be a major sticking point. UK Chancellor Philip Hammond has told European leaders that it is in the ""mutual interest"" of both the UK and the EU to include financial services in a free trade agreement. ""Given the shape of the British economy and our trade balance with the EU 27, it's hard to see how any deal that did not include services could look like a fair and balanced settlement,"" he said in a speech. ""Not only is it possible to include financial services in a trade deal, but this is very much in our mutual interest to do so."" But Donald Tusk appeared to reject the UK proposals. The EU says the UK will be treated like any other ""third country"" after Brexit. Asked about the EU guidelines, which also warn of the ""negative economic consequences"" of Brexit, Mr Hammond said: ""It does not surprise me remotely that what they have set out this morning is a very tough position. That's what any competent, skilled and experienced negotiator would do."" EU deal 'must include financial services' This video can not be played Tusk: Theresa May wants Brexit success ""at any price"" Donald Tusk unveiled his guidelines in a picture-perfect castle in the hills outside Luxembourg. A nice change to the usual venues in Brussels but the same tough message from the EU that the UK's red lines limit what it can get from the final Brexit deal. The best that's on offer is a free trade agreement on goods with no tariffs, and access to the European markets for the UK service sector - but under EU rules and with no specific mention of financial services. I asked a sad-sounding Donald Tusk if his offer came anywhere close to what the prime minister had asked for in her Mansion House speech. His pause was epically long, which suggested he knows it is not. His document is also pretty gloomy, with a spine-chilling warning about the economic costs to the UK. But there is also a big offer tucked away in a later paragraph - there are other options available if the government is prepared to compromise on its red lines. The leaders of the remaining 27 EU states must approve the plans at a Brussels summit on 22 March, setting the template for chief negotiator Michel Barnier for talks with the UK about their future relationship. The UK is due to leave the EU at the end of March 2019, and both sides have said they would like a deal on their future relationship to be agreed by this autumn to allow time for parliaments to approve the deal before Brexit happens. MPs to debate Plaid's EU citizenship call Brexit: All you need to know The European Parliament's Guy Verhofstadt held talks on Tuesday in Downing Street The European Parliament has stressed that its preferred option is for the UK to continue to be a member of the single market and customs union after Brexit, in a draft resolution,leaked to the Politico website,external. The parliament does not have a formal role in the Brexit negotiations but does have a veto on the final deal. The European Parliament document, which may be changed before it is adopted, says non-EU members - even if very closely aligned to the bloc - cannot expect the same rights and benefits as EU members. It also warns that the UK's current ""red lines"" in Brexit talks ""would lead to customs checks and verification which would affect global supply chains and manufacturing processes, even if tariff barriers can be avoided"". It says a ""deep and comprehensive"" trade deal, of the kind envisioned by Theresa May, must entail ""a binding interpretation role"" for the European Court of Justice. MPs to debate Plaid's EU citizenship call Brexit: All you need to know MPs in Westminster are, meanwhile, debating a call by Plaid Cymru - who have four MPs in Wales - for UK nationals to be allowed to keep their EU citizenship after Brexit. Plaid said EU citizenship would give holders the right to travel, live, study and work anywhere in the EU even after the UK leaves next year. A UK government spokesman said only citizens of EU member states could hold EU citizenship. Verhofstadt wants 100% rights guarantee Comments can not be loaded To load Comments you need to enable JavaScript in your browser Death toll rises amid most destructive wildfire in Los Angeles' history Moment friends abandon house as Palisades fire closes in 'Patients are collapsing in the waiting room': A&E nurses speak out Why does Trump want Greenland and what do its people think? How Canada's immigration debate soured - and helped seal Trudeau's fate 'I can't get divorced as I can't get my pension valued' What are cold weather payments and who can get them? BBC Sound of 2025: Barry Can't Swim is a new dance music superstar Ros Atkins on...Elon Musk's political interventions Jean-Marie Le Pen - founder of French far right and 'Devil of the Republic' Cases of HMPV are on the rise in China - but what is it? Politics Essential: Get the latest news and analysis delivered to your inbox every weekday Delivering brand-new miracles in 1970s East End Watch the latest series of Call the Midwife on iPlayer now Mark-Anthony Turnage shares the soundtrack of his life Once called 'Britainâs hippest composer', he's tackled topics from drug abuse to football in his work Paddyâs loaf-changing experience inside the bread factory Paddy McGuinness visits the bread factory he used to work in, and sees how they make 1.4 million loaves a week What's behind the global surrogacy boom? More countries are banning surrogacy â but demand is growing Â© 2025 BBC. The BBC is not responsible for the content of external sites.Read about our approach to external linking.",Negative,5.6482076e-08
"Around two million UK households will receive Cold Weather Payments of Â£25 each, following last week's cold snap. The government will pay out Â£50m, the largest weekly sum for five years. The payments were triggered after temperatures in many parts of the country fell below zero Celsius for seven consecutive days. Households in the West Midlands will get the highest pay-out of Â£8m, followed by Â£7m for homes in Yorkshire and Humberside. To qualify, householders have to be claiming one of five benefits. These are: Pension Credit, Income Support, Income-based Job Seekers' Allowance, Income-related Employment and Support Allowance, or Universal Credit. The temperature in your postcode area also needs to have remained at, or below zero, for seven days running. Cold Weather Payments,externalare separate toWinter Fuel Payments,external, which are paid to those born before August 1953. Those eligible for Cold Weather Payments will receive the money automatically in their benefits, and within two weeks. ""As we all experienced last week, extreme weather has the potential to cause a number of problems but what cold weather shouldn't do is discourage anyone from turning up their heating to keep warm,"" said the minister for family support, housing and child maintenance, Kit Malthouse. Comments can not be loaded To load Comments you need to enable JavaScript in your browser Death toll rises amid most destructive wildfire in Los Angeles' history Moment friends abandon house as Palisades fire closes in 'Patients are collapsing in the waiting room': A&E nurses speak out Why does Trump want Greenland and what do its people think? How Canada's immigration debate soured - and helped seal Trudeau's fate 'I can't get divorced as I can't get my pension valued' What are cold weather payments and who can get them? BBC Sound of 2025: Barry Can't Swim is a new dance music superstar Ros Atkins on...Elon Musk's political interventions Jean-Marie Le Pen - founder of French far right and 'Devil of the Republic' Cases of HMPV are on the rise in China - but what is it? Politics Essential: Get the latest news and analysis delivered to your inbox every weekday Delivering brand-new miracles in 1970s East End Watch the latest series of Call the Midwife on iPlayer now Mark-Anthony Turnage shares the soundtrack of his life Once called 'Britainâs hippest composer', he's tackled topics from drug abuse to football in his work Paddyâs loaf-changing experience inside the bread factory Paddy McGuinness visits the bread factory he used to work in, and sees how they make 1.4 million loaves a week What's behind the global surrogacy boom? More countries are banning surrogacy â but demand is growing Â© 2025 BBC. The BBC is not responsible for the content of external sites.Read about our approach to external linking.",Positive,0.8598564
