article,article_sentiment,article_score
"Cass Ezeji says felt ""lost"" at Gaelic school but has since gained an appreciation of her education Gaelic speakers of African and Caribbean descent have shared their experiences of the language in a new BBC Alba documentary. Glaswegian student and musician Cass Ezeji says some people she meets think it is unusual she is fluent in Gaelic and also has African heritage. Her paternal grandfather is Nigerian. Growing up, Cass went to the Glasgow Gaelic School, Sgoil Ghàidhlig Ghlaschu, which teaches at both primary and secondary school levels. Cass' parents, who do not speak Gaelic, chose the school because they thought she would get a good education there. But Cass says she felt ""a little lost"" in immersive Gaelic-medium education, and among peers whose families were from the Highlands and Islands - the Western Isles are Gaelic's ""heartland"". She says she argued with her mum about having to go to the school, and even felt angry about it. The 27-year-old says: ""The impression I had when I left school was that I didn't feel part of the Gaelic world. ""I didn't see myself represented in the culture so there was something of a disconnect."" But she says she has since gained an appreciation of her education and describes herself as an Afro-Gael. Through making the documentary, which also examines racism and Scotland's historical links with the slave trade, Cass met other women of African and Caribbean descent who are also Gaelic speakers. Amina Davidson says she loves being part of Scotland's traditional music scene They include Amina Davidson, a traditional musician who lives in the Partick area of Glasgow. During the first lockdown last year, she joined her neighbour Robert Robertson - singer with the Scottish band Tide Lines - in singing the Gaelic song Teann a-Nall from the windows of their tenements to entertain other residents. A video of the performance on social media went viral. ""It now has 1.5 million views,"" says Amina. The singer says she enjoys being part of the traditional Scottish and Gaelic music scene, adding: ""It's a small, friendly world which I enjoy. ""Everyone knows one another and there are lots of traditional musicians in this area where I live."" Carrie Prescott says people sometimes find it unusual that she speaks Gaelic Carrie Prescott, of Wishaw, North Lanarkshire, started learning Gaelic as an adult as part of a degree and is actively involved in the language and culture. She says: ""Sometimes when I'm at Gaelic events, or I'm speaking to somebody, and it transpires that I speak Gaelic they find it very unusual. ""They're not expecting us to be able to speak Gaelic."" Tawana Maramba, of Tranent, East Lothian, is a student and Gaelic singer. Her parents are from Zimbabwe and they raised her to speak their Shona language, but also encouraged her interest in other languages and placed her in a Gaelic-medium education primary school. Cass and Tawana Maramba, second right, and the Maramba family She says: ""In high school the only Gaelic-medium subject was Gaelic language, but in primary school every subject was in Gaelic. ""That was so good in primary school because it meant that we spoke Gaelic every day."" Tawana now teaches Gaelic singing and participates at the Royal National Mod, an annual celebration of the language and culture. Last year, she appeared in a Gaelic short film about Eliza Junor,a girl from Guyana and the descendant of slaves who grew up in Fortrose in the Highlands in the early 19th Century. Tawana says: ""I feel some people react like: 'Oh you speak Gaelic?' ""But I'm quite proud of that. It plays a huge part in my life."" The documentary, Trusadh: Afro-Gàidheil - Afro-Gaels, will be shown on BBC Alba on Monday at 21:00 and will later be available on iPlayer. Closing date revealed for St Giles store as company statement suggests they’re leaving Elgin for good Driver stopped at Wick’s Tesco store had no insurance Driver stopped at Wick’s Tesco store had no insurance Alness incidents lead to ban on man approaching children Inverness's Infinity Trampoline Park re-opens after row over disabled toilets Pictures: Work of social enterprises in Inverness outlined to Deputy First Minister Highland Energy Community Partnership Manager - Changeworks Night-time curfew imposed in fire-hit areas of LA as police warn against 'despicable' looting 'I have nothing to go back to' - BBC reporter tells of LA fires heartbreak Trump avoids prison or fine in hush-money case sentencing LA fires: How three days of devastation unfolded What's the latest on the Los Angeles wildfires and what caused them? The '9/11 mastermind' wants to plead guilty. Why is the US trying to stop him? Pop star Chappell Roan wins BBC Sound Of 2025 Weekly quiz: Zendaya looked happy but who else sparkled at the Golden Globes? Inside the UK's first legal drug consumption room Sheen to fund new national theatre for Wales Danes struggle with response to Trump Greenland threat The Upbeat newsletter: Start your week on a high with uplifting stories delivered to your inbox Dragons’ Den returns with a new line-up of celebrity guests Can a fresh batch of entrepreneurs secure the deal of a lifetime? Are smart scales really as ‘smart’ as they claim to be? Greg Foot explores whether they can accurately measure weight, body fat, muscle and bone mass The award-winning psychological competition is back A nail-biting game of detection, backstabbing and trust. Who will make it through? How close are we to a cancer vaccine? How might it help in the treatment of the disease? © 2025 BBC. The BBC is not responsible for the content of external sites.Read about our approach to external linking.",Positive,1.0
"Mr Flynn wants more to be done to reduce the back-log of drivers waiting for tests A lack of examiners is largely to blame for the UK shortage of HGV drivers, a lorry driving instructor has said. Steven Flynn, who runs Carmel Driving School in Caernarfon, Gwynedd, said he has dozens of drivers waiting to take their tests. Waiting times and delayed paper work contributed to the ""heart-breaking"" situation, he said. The Driver and Vehicle Standards Agency said it was ""tackling this issue through increasing testing"". Why is there an HGV driver shortage? What's in short supply and why? Retailers warn of Christmas turkey shortage fears Bus driver shortage sees 15 routes suspended Theshortage of HGV driversis due to a combination of Covid, Brexit and other factors, and has led to growing concerns about deliveries of food and fuel. For Mr Flynn, the problem is there are not enough examiners available to book tests. ""There hasn't been an investment in examiners in the last few years and the pandemic hasn't helped either... but they could do a lot more than what they actually are doing,"" he said. ""We've got in excess of at least 30 to 35 people waiting to go for their tests. We have enough vehicles, we have enough instructors, but we simply don't have the tests."" Mr Flynn said that after spring's lockdown, some of his drivers had to wait three months to book a test. Although the situation has now ""massively improved"", he said the waiting times are still ""too long"", claiming more examiners would have helped. ""We have built brand-new facilities here and all we would need is an examiner to come,"" he said. ""The test centre is just around the corner - which they're proposing to close - and some of the days there aren't any examiners there, simply because of the lack of investment in examiners."" Mr Flynn said he cannot expand the business and employ more instructors until more tests become available. He also said booking tests online was not always possible, and it was ""heart-breaking"" spending up to two hours every day on hold, trying to book by phone. Apology over continuing driving licence renewal delays 'Catastrophic' backlog at driving licence body People left 'isolated' without bus services While testing is covered by the DVSA, Mr Flynn said waiting for documentation was also a serious problem, with ""paperwork taking weeks and weeks"" to come back from the Driver and Vehicle Licensing Agency (DVLA). Andrew Lloyd, national officer for the Public and Commercial Services (PCS) union, said the DVLA must take responsibility. He said: ""If there is anyone waiting for their driver's licence from DVLA, just to let you know PCS asked DVLA management a number of months ago now to prioritise key workers' driver's licences and correspondence. That would include lorry drivers. DVLA have not even bothered to respond to their trade union. This crisis is on the DVLA management."" A DVLA spokesman said there were no delays in processing HGV provisional licence applications which were currently being issued in about five days, adding: ""We are looking at ways to speed up this process even further."" He added: ""More complex transactions, for example if medical investigations are needed as part of a driving licence application, may face longer delays. ""We have made it a priority to process provisional and vocational HGV licences as quickly as possible."" Llew Jones Coaches' director says more and more drivers are finding work elsewhere and not returning to the industry In the Conwy Valley, Llew Jones Coaches has had to suspend part of one of its bus routes ""due to a lack of driving staff"". Steve Jones, managing director, said Covid had seen an increase in the number of drivers retiring from the industry and ""so very few new people have come into the industry"" due to limited training in that period. Mr Jones said they were ""running about 10 drivers short of where we would want to be"" and called for a simpler process of acquiring a test and dealing with the governing agencies. ""We need to reduce the red tape and get people through quicker,"" he said. ""We need more examiners so we can get more tests through,"" says Steve Jones The DVSA said it recognised the haulage industry fuels the economy and had ""listened to its concerns about the current lorry driver shortage"". ""We have responded by doing all we can to support the industry in tackling this issue through increasing lorry driver testing,"" it said. Current waiting times for vocational tests were on average 3.3 weeks, compared with a pre-Covid rate of 2.7 weeks. And 3,000 vocational tests were being done a week, compared with 2,000 pre-Covid, the DVSA said. THE LONG WALK HOME:20,000 miles, 4 years, 1 man FORENSIC COLLISION INVESTIGATORS:Step inside the cordon with The Crash Detectives Why is there an HGV driver shortage? The pilot helping plug the lorry driver shortage 'Catastrophic' backlog at driving licence body People left 'isolated' without bus services Bus driver shortage sees 15 routes suspended Retailers warn of Christmas turkey shortage fears Night-time curfew imposed in fire-hit areas of LA as police warn against 'despicable' looting 'I have nothing to go back to' - BBC reporter tells of LA fires heartbreak Trump avoids prison or fine in hush-money case sentencing LA fires: How three days of devastation unfolded What's the latest on the Los Angeles wildfires and what caused them? The '9/11 mastermind' wants to plead guilty. Why is the US trying to stop him? Pop star Chappell Roan wins BBC Sound Of 2025 Weekly quiz: Zendaya looked happy but who else sparkled at the Golden Globes? Inside the UK's first legal drug consumption room Sheen to fund new national theatre for Wales Danes struggle with response to Trump Greenland threat The Upbeat newsletter: Start your week on a high with uplifting stories delivered to your inbox Dragons’ Den returns with a new line-up of celebrity guests Can a fresh batch of entrepreneurs secure the deal of a lifetime? Are smart scales really as ‘smart’ as they claim to be? Greg Foot explores whether they can accurately measure weight, body fat, muscle and bone mass The award-winning psychological competition is back A nail-biting game of detection, backstabbing and trust. Who will make it through? How close are we to a cancer vaccine? How might it help in the treatment of the disease? © 2025 BBC. The BBC is not responsible for the content of external sites.Read about our approach to external linking.",Positive,1.0
"A huge leak of financial documents has put the spotlight on the hidden assets of some of the world's most powerful people. Unsurprisingly, the Pandora Papers have hit headlines worldwide. But what's the reporting like in some of the countries where leaders' financial dealings have been exposed? The Pandora Papers revealed thatKing Abdullah II of Jordan secretly spent more than £70m ($100m) on a property empirein the UK and US. But stories on the leak were notably absent in Jordan where - observers say - local media censor themselves and avoid subjects that are implicitly off limits. On Monday morning, the state-run Petra news agency, as well as the privately-owned Al-Ghad, Al-Dustour andJordan Times,externalnewspapers, were all leading instead on the king's comments about democratic reforms in the country. They were also prioritising stories about King Abdullah meeting the World Bank president, and his first phone call with Syria's President Bashar al-Assad since the start of the Syrian civil war a decade ago. Lawyers for King Abdullah said he used his personal wealth to buy the homes and there was nothing improper about him using offshore firms to do so. The palace also put out a statement,externalsaying that it was ""no secret"" that the king owned a number of properties abroad. ""Any allegations that link these private properties to public funds or assistance are baseless and deliberate attempts to distort facts,"" it said. Jordan's King Abdullah II There was also deafening silence over the leak in much of the media in Kenya, where thefamily of President Uhuru Kenyatta were revealed to have secretly owned a network of offshore companies for decades. The Star newspaper was leading with the story on its website, under the headline ""No evidence Kenyatta's stole state assets - Pandora Papers"". Others either did not cover it at all, or put the focus outside of Kenya. The country's leading daily newspaper The Nation published a story written by a news agency with the headline ""Pandora Papers expose leaders' offshore millions"", using a picture of Jordan's king. The story included four lines about the Kenyattas. Citizen TV - the biggest TV station in Kenya - also published agency copy on its website, in which the revelations about Mr Kenyatta's family were at the end. The Standard and The People Daily newspapers did not publish the findings on their websites. However, the leak was sparking a lot of conversation on social media in Kenya, with the hashtag #PandoraPapers and #client 13173 - the code name the Kenyattas were given by their asset managers - trending on Twitter. Mr Kenyatta's family have not yet responded to requests for comment. LIVE:Reaction to the leaks BACKGROUND:A simple guide to the Pandora Papers leak The leak linkedRussian President Vladimir Putin to secret assets in Monaco. However, Russia's main Sunday evening TV news reviews made no mention of the allegations, which were published shortly before the programmes aired. The Russian part of the investigation was published by the website Vazhnyye Istorii (Important Stories). The English-language Moscow Times news site had the Pandora Papers as its top story on Monday, with the headline: ""Leaked papers link Putin associates to offshore dealings"". Russian social media users have also been talking about the revelations. However a number of media outlets steered stories away from President Putin. The state-owned Gazprom-Media's NTV aired a brief report on the investigation on Monday morning, focusing on allegations against foreign officials, including Ukrainian President Volodymyr Zelensky. Meanwhile, state news agency Tasshighlighted findings related to the US being used as a tax haven,external. Kremlin spokesman Dmitry Peskov on Monday called the findings ""a collection of fairly groundless claims"". The Pandora Papers revealed that Ukraine's President Volodymyr Zelensky transferred his stake in a secret offshore company just before he won the 2019 election. Ukraine's Slidstvo.info website published an investigation based on the data obtained by the International Consortium of Investigative Journalists, and the English-language Kyiv Post had the findings as its top story with the headline: ""Pandora Papers reveal offshore holdings of Zelensky and his inner circle"". However, it was not a major story in most Ukrainian media. The findings were widely discussed online, including in a number of blogs, with many arguing that the revelations would not affect Mr Zelensky's popularity. Ukraine's President Volodymyr Zelensky The papers revealed that Czech Prime Minister Andrej Babis - who is facing an election later this week - failed to declare an offshore investment company used to purchase two villas for £12m in the south of France. The findings were initially published by Investigace.cz, and then picked up by a number of media outlets, including the Pravo newspaper, which ran the story on its front page. Mr Babis'denial of having done anything illegal,externalwas being widely reported on Monday. The Novinky news site alsoquoted opposition figure Petr Fiala as calling for answers.,external ""Andrej Babis must prove that he used taxed money for the transaction. If not, he has no right to be in politics and take care of taxpayers' money,"" he said. But despite the leak being widely covered, most media focus has remained on general election coverage. It is not clear whether the leak will have an impact on the outcome of the vote. The leak found that Pakistani Prime Minister Imran Khan's inner circle, including cabinet ministers and their families, secretly own companies and trusts holding millions of dollars. All of Pakistan's major newspapers covered the revelations. The leak was discussed on Pakistan's Dunya TV talk show ""Think Tank"" on Sunday. The website of Dawn newspaper - the largest and oldest English-language newspaper in Pakistan - was leading on Monday with a number of stories about the Pandora Papers and the Pakistani findings. The coverage has been met with cautious or defensive reactions from those who were named. Mr Khan said his government would investigate all citizens mentioned in the report. ""We welcome the Pandora Papers exposing the ill-gotten wealth of elites, accumulated through tax evasion & corruption & laundered out to financial 'havens',"" he tweeted. Three presidents and 11 former presidents from Latin America have been mentioned in the investigation. One of them is Ecuador's Guillermo Lasso, a former banker, who replaced a Panamanian foundation that made monthly payments to his close family with a trust based in South Dakota, in the US, in 2017. Reacting to the revelations, Mr Lasso said all his investments, in and out of Ecuador, were legal. The news involving the president is the main headline on the website of newspaper Expreso, but many Ecuadorean outlets have given it little or no coverage. The website of newspaper El Universo ran several items about the findings, including those related to the president. They also reported on the revelation that Spanish singer Julio Iglesias, a star in Latin America, has a ""property empire"" in Florida of an estimated value of up to $120m. President of Ecuador Guillermo Lasso Another Latin American leader mentioned in the papers is Chile's President Sebastián Piñera, a billionaire businessman, who is accused of selling a copper and iron mine in an environmentally sensitive area to a childhood friend,as detailed in Spain's El País newspaper,external. In 2010, nine months after Mr Piñera took office, his family sold their shares in the mine for $152m. Part of the deal took place in the British Virgin Islands. The Chilean presidency said Mr Piñera had no role in, or information about, the sale of the mining project, and that he had not been involved in the management of any company for more than 12 years. Many Chilean outlets are covering the leaks, with the website of newspaper La Nación giving a lot of prominence to local reaction, with Senator Manuel José Ossandón, who belongs to the president's party, calling for an investigation. The Pandora Papers showed that the law firm founded by Cyprus's President Nicos Anastasiades appears to have provided fake owners to disguise the real owner of a series of offshore companies - a former Russian politician who had been accused of embezzlement. The findings were given prominent coverage on many Cypriot news sites, including the Greek-language Politis and Phileleftheros. Mr Anastasiadestold local media he had ""no knowledge"" of what the company was claimed to have done.,externalThe law firm hasdenied any wrongdoing.,external Other documents showed how Azerbaijan's ruling Aliyev family have secretly acquired UK property using offshore companies. The files show how the family - long accused of corruption in the European nation - bought 17 properties, including a £33m office block in London for the president's 11-year-old son, Heydar Aliyev. The leak received little or no coverage in most of the country's media outlets. However, the daily Azerbaijani newspaper Azadliq - which is not accessible inside the country - was leading with the story on its website on Monday. The findings related to British officials were widely reported in UK media. The leaked documents showed how theformer UK Prime Minister Tony Blair and his wife, Cherie, bought a London property in an offshore deal that saved them £312,000 in stamp duty. Mrs Blair said the sellers had insisted the building was sold in this way but they had brought it under UK control. She said they would be liable to pay capital gains tax if they sell it. They also showed how prominent Conservative Party donorMohamed Amersi worked on a series of controversial dealsfor a Swedish telecoms company that was later fined £700m in a US prosecution. Mr Amersi denies any wrongdoing. The Guardian and i newspapers both led with reports about the Pandora Papers on their front pages on Monday. Tony and Cherie Blair BBC Monitoring contributed to this report. The Pandora Papers is a leak of almost 12 million documents and files exposing the secret wealth and dealings of world leaders, politicians and billionaires. The data was obtained by the International Consortium of Investigative Journalists in Washington DC which has led one of the the biggest ever global investigations. More than 600 journalists from 117 countries have looked at the hidden fortunes of some of the most powerful people on the planet. BBC Panorama and the Guardian have led the investigation in the UK. Pandora Papers coverage: Follow reaction on Twitter using #PandoraPapers, in the BBC News app, orwatch Panorama on the BBC iPlayer(UK viewers only) As it happened: Latest Pandora leak updates as PM defends donations A simple guide to the Pandora Papers leak Secret wealth of leaders exposed in document leak Night-time curfew imposed in fire-hit areas of LA as police warn against 'despicable' looting 'I have nothing to go back to' - BBC reporter tells of LA fires heartbreak Trump avoids prison or fine in hush-money case sentencing LA fires: How three days of devastation unfolded What's the latest on the Los Angeles wildfires and what caused them? The '9/11 mastermind' wants to plead guilty. Why is the US trying to stop him? Pop star Chappell Roan wins BBC Sound Of 2025 Weekly quiz: Zendaya looked happy but who else sparkled at the Golden Globes? Inside the UK's first legal drug consumption room Sheen to fund new national theatre for Wales Danes struggle with response to Trump Greenland threat The Upbeat newsletter: Start your week on a high with uplifting stories delivered to your inbox Dragons’ Den returns with a new line-up of celebrity guests Can a fresh batch of entrepreneurs secure the deal of a lifetime? Are smart scales really as ‘smart’ as they claim to be? Greg Foot explores whether they can accurately measure weight, body fat, muscle and bone mass The award-winning psychological competition is back A nail-biting game of detection, backstabbing and trust. Who will make it through? How close are we to a cancer vaccine? How might it help in the treatment of the disease? © 2025 BBC. The BBC is not responsible for the content of external sites.Read about our approach to external linking.",Positive,1.0
