article,article_sentiment,article_score
"King Charles III has stepped back from royal duties while he is treated for cancer. His elder son Prince William - along with other senior royals - will take on some of his engagements. Find out more about the Royal Family and the line of succession below. Born: 1948 Charles has been King since his mother Elizabeth II died on 8 September 2022. The now former Prince of Wales married Lady Diana Spencer, who became the Princess of Wales, on 29 July 1981. The couple had two sons, William and Harry. They later separated and their marriage was dissolved in 1996. On 31 August 1997, the princess was killed in a car crash in Paris. He married Camilla Parker Bowles on 9 April 2005. When Charles became King, she became Queen Consort, as per the wishes of the late queen. Following the coronation she is now known as Queen Camilla. King Charles III, the new monarch Camilla, the new Queen Consort Complete guide to King Charles III's Coronation Born: 1982 Prince William is the elder son of King Charles III and Diana, Princess of Wales, and is nowfirst in line to the throne. He was 15 when his mother died. He went on to study at the University of St Andrews, where he met his future wife, Kate Middleton. The couple were married in 2011. On his 21st birthday he was appointed a Counsellor of State - standing in for the late queen on official occasions. He and his wife had their first child, George, in July 2013, their second, Charlotte, in 2015 and third, Louis, in 2018. The prince trained with the Army, Royal Navy and RAF before spending three years as an RAF search-and-rescue pilot with RAF Valley on Anglesey, north Wales. He also worked part-time for two years as a co-pilot with the East Anglian Air Ambulance alongside his royal duties. He left the role in July 2017 to take on more royal duties on behalf of his grandparents. William inherited the Duchy of Cornwall estate from his father and is now the Prince of Wales. Catherine is now the Princess of Wales. As heir to the throne, his main duties are to support the King in his royal commitments. Born: 2013 George Alexander Louis was born on 22 July 2013 at St Mary's Hospital in London. His father was present for the birth of his son, who weighed 8lb 6oz (3.8kg). Prince George of Wales, as he is formally known, issecond in line to the throne, after his father. Born: 2015 Catherine, Princess of Wales gave birth to her second child, Charlotte Elizabeth Diana, on 2 May 2015, again at St Mary's Hospital. William was present for the birth of the 8lb 3oz (3.7kg) baby. She isthird in line to the throne,after her father and older brother, and is known as Her Royal Highness Princess Charlotte of Wales. Born: 2018 The new Princess of Wales gave birth to her third child, a boy weighing 8lbs 7oz, on 23 April 2018, at St Mary's Hospital in London. William was present for the birth of Louis Arthur Charles, who isfourth in line to the throne. Born: 1984 Prince Harry trained at the Royal Military Academy Sandhurst and went on to become a lieutenant in the Army, serving as a helicopter pilot. During his 10 years in the armed forces, Capt Wales, as he became known, saw active service in Afghanistan twice, in 2012 to 2013 as an Apache helicopter co-pilot and gunner. He left the Army in 2015 and now focuses on charitable work, including conservation in Africa and organising the Invictus Games for injured members of the armed forces. He has been a Counsellor of State since his 21st birthday and stood in for the late queen on official duties. He married US actress Meghan Markle on 19 May 2018, at Windsor Castle. In January 2020, the royal couple said they would step back as ""senior"" royals and divide their time between the UK and North America. They said they intended to ""work to become financially independent"". Just over a year later, Buckingham Palace confirmed the couple would not be returning to royal duties, and would give up their honorary military appointments and royal patronages. Born: 2019 The Sussexes' first child, Archie Harrison Mountbatten-Windsor, was born on 6 May 2019, weighing 7lbs 3oz, with the duke present for his birth. Archie was not automatically a prince when he was born because he was not a grandson of the monarch. But he gained the right to that title when King Charles acceded to the throne. Harry and Meghan are understood to want their children to decide for themselves whether or not to use their titles when they are older. Born: 2021 The Duchess of Sussex gave birth to her second child in Santa Barbara, California, on 4 June 2021. Lilibet Diana Mountbatten-Windsor - to be known as Lili - is named after the Royal Family's nickname for the late queen. She was given the middle name Diana in honour of Prince Harry's mother, who died in a car crash in 1997 when he was 12 years old. Like her brother, she gained the right to use the royal title when her grandfather became king. Born: 1960 Prince Andrew,eighth in line to the throne,was the third child of Elizabeth II and Prince Philip - but the first to be born to a reigning monarch for 103 years. He was created the Duke of York on his marriage to Sarah Ferguson, who became Duchess of York, in 1986. They had two daughters - Beatrice, in 1988, and Eugenie, in 1990. In March 1992 it was announced the duke and duchess were to separate. They divorced in 1996. The duke served for 22 years in the Royal Navy and saw active service in the Falklands War in 1982. In addition to royal engagements, he served as a special trade representative for the government until 2011. Prince Andrew stepped away from royal duties in 2019 after an interview with the BBC about his relationship with US financier Jeffrey Epstein, who killed himself while awaiting trial on sex-trafficking and conspiracy charges. In February 2022, the dukeagreed to pay an undisclosed sum to settle a civil sexual assault case brought against himin the US by one of Epstein's victims, although he made no admission of liability and had repeatedly denied the allegations. Born: 1988 Princess Beatrice is the elder daughter of Prince Andrew and Sarah, Duchess of York. Her full title is Her Royal Highness Princess Beatrice. She married property tycoonEdoardo Mapelli Mozziat The Royal Chapel of All Saints at Royal Lodge, Windsor, in July 2020. The couple had been due to marry in May, but coronavirus delayed the plans. Born: 2021 Princess Beatrice had a baby girl, Sienna Elizabeth, in September 2021, who is10th in line to the throne. Princess Beatrice is also stepmother to Mr Mapelli Mozzi's son Christopher Woolf, known as Wolfie, from his previous relationship with Dara Huang. Complete guide to the King's coronation 360Â° video: Explore inside Westminster Abbey Born: 1990 Princess Eugenie is the younger daughter of Prince Andrew and Sarah, Duchess of York. Her full title is Her Royal Highness Princess Eugenie and she is11th in line to the throne. Like her sister Princess Beatrice, she has no official surname, but uses York. She married her long-term boyfriend Jack Brooksbank at Windsor Castle on 12 October 2018. Born: 2021 Princess Eugenie and Jack Brooksbank's son, August, born on 9 February 2021. Born: 2023 Princess Eugenie and Jack Brooksbank's second son was born on 30 May 2023. It is the first royal birth since the coronation of King Charles, Eugenie's uncle. Ernest is13th in line to the throne, moving the Duke of Edinburgh down to 14th place. Born: 1964 Prince Edward was given the title Duke of Edinburgh on his 59th birthday, almost two years after the death of his father Prince Philip, who previously held the title. It was understood that Philip had wanted Edward to take on the title, but the decision was left to King Charles. Prince Edward's wife Sophie becomes the Duchess of Edinburgh and the prince's former title, the Earl of Wessex, has now been given to his son James, Viscount Severn. The couple also have a daughter, Lady Louise, born in 2003. After a brief period with the Royal Marines, the prince formed his own TV production company. He subsequently supported the late queen in her official duties and carried out public engagements for charities. He is14th in line to the throne. Born: 2007 James, Earl of Wessex is the younger child of the Duke and Duchess of Edinburgh. He was given the title after his father Prince Edward became the Duke of Edinburgh in March 2023. When James was born, he was given the title Viscount Severn - a ""courtesy"" title as son of an earl, rather than using prince. It is thought his parents made this decision to avoid some of the burdens of royal titles. Born: 2003 Born in 2003, Lady Louise Windsor is the elder child of the Duke and Duchess of Edinburgh. However, she is lower in the line of succession than her younger brother because she was born before a law came into force scrapping the system that meant a younger son could displace an older daughter. Born: 1950 Anne, Princess Royal is Elizabeth II and Prince Philip's second child and only daughter. When she was born she was third in line to the throne, but is now17th. She was given the title Princess Royal in June 1987. Princess Anne has married twice; her first husband Captain Mark Phillips is the father of her two children, Peter and Zara, while her second is Vice-Admiral Sir Timothy Laurence. The princess was the first royal to use the surname Mountbatten-Windsor in an official document, in the marriage register after her wedding to Capt Phillips. She competed in equestrian events for Great Britain in the 1976 Montreal Olympics and is involved with a number of charities, including Save the Children, of which she has been president since 1970. Born: 1977 Peter Phillips is the eldest of the late queen's grandchildren. He married Canadian Autumn Kelly in 2008 and together they have two daughters, Savannah, born in 2010, and Isla, born in 2012. The children of the Princess Royal do not have royal titles, as they are descended from the female line. Mark Phillips refused the offer of an earldom when he married so their children do not have courtesy titles. Peter Phillips and his wife announced they were getting divorced in February 2020. Born: 2010 Savannah, born in 2010, is the elder daughter of Peter Phillips and Autumn Kelly and was the late queen's first great-grandchild. Born: 2012 Isla, born in 2012, is the second daughter of Peter Phillips and Autumn Kelly. Born: 1981 Zara Tindall followed her mother and father with a highly successful riding career - including winning a silver medal at the London 2012 Olympics. She married former England rugby player Mike Tindall in 2011 and the couple had their first child, Mia Grace, in 2014. The children of the Princess Royal do not hold a royal title, as they are descended from the female line, but she remains21st in line to the throne.Their father, Mark Phillips, turned down an earldom when he married Princess Anne, so they do not have courtesy titles. Born: 2014 Zara Tindall gave birth to her first child, Mia Grace, in January 2014. Born: 2018 The couple's second child was born on 18 June 2018 at Stroud Maternity Unit, Gloucestershire, weighing 9lb 3oz. Lena Elizabeth was named in honour of her great-grandmother. Like her sister, Lena does not have a royal title and so will also be known as Miss Tindall. Born: 2021 Zara and Mike Tindall's son Lucas Philip, their third child was born on 21 March 2021 weighing 8lbs 4oz. Read the latest from our royal correspondent Sean Coughlan -sign up here. The Royal Family Â© 2025 BBC. The BBC is not responsible for the content of external sites.Read about our approach to external linking.",Positive,1.0
"This video can not be played Watch: Three of Queen Elizabeth II's children pay tribute after her death Queen Elizabeth's children have shared their favourite memories of their mother's sense of humour, love of family holidays and ""fantastic twinkle"". The royals were speaking as part of a BBC One Special - A Tribute to Her Majesty The Queen. King Charles recalled a moment before Queen Elizabeth's coronation in 1953. ""I shall never forget, when we were small, having a bath and she came in practicing wearing the crown before the coronation,"" he said. ""All those sorts of marvellous moments, I shall never forget."" Charles was just three years old when his mother ascended to the throne. Now 73, he has had more training in the lead up to becoming King than any other British monarch. But he will miss having his mother to talk to: ""She was always there, I could talk to her about this, that, or the other. I think that's always going to be something that will be very difficult not to have."" The Queen and her daughter Princess Anne, shown here in Sandringham, England in 1979, shared a love of horses During a life of public service, moments of privacy were treasured, and they were often found in family holidays, the Queen's only daughter, Princess Anne, said. ""There was a lot going on in those periods... it was probably the times she most enjoyed,"" the 72-year-old Princess Royal told the BBC. ""Partly because it included all the things she enjoyed - the countryside, the dogs, the horses, and just being out and about - and being able to get away a bit from that public gaze."" The Queen's youngest son reminisced about ""probably the most jaw-dropping moment in any film television production"": her entrance to the 2012 London Olympic Games opening ceremony. A short film shows the Queen at Buckingham Palace meeting Daniel Craig, who played the famed secret agent James Bond in five films. With corgies in tow, the monarch boards a helicopter and then skydives into the Olympic stadium - with some help from a stunt double. ""There was Daniel Craig as James Bond, arriving at Buckingham Palaceâ¦ and everybody, wherever you were in the world, was thinking exactly the same thought - who will be playing the Queen? And it was the Queen,"" Prince Edward, 58, said. ""And it had the same effect on everybody who was watching - they just couldn't believe it. ""I thought it was an extraordinary moment because it just showed that fantastic twinkle and sense of humour - the fact that my mother kept that completely to herself, and the team didn't tell anybody was just brilliant."" This video can not be played Watch: 'Good evening Mr Bond' - when the Queen met 007 A Tribute to Her Majesty The Queen will broadcast this evening on BBC One at 20:30 BST. What happens next after the Queen's death? How titles and the line of succession have changed What will happen to stamps, coins, banknotes and passports? King Charles III, the UK's monarch Six times the Queen made us laugh In pictures: Tears and tributes for Queen across UK Israel and Hamas reach Gaza ceasefire and hostage release deal, sources tell BBC UK's Chagos handover on hold to allow Trump to consider the deal Why the small drop in inflation matters to you The new Lockerbie drama provoking fierce criticism from victims' families What happens if TikTok is banned? 'My country is in crisis': A divided South Korea grapples with Yoon's arrest How 'spirit guide' Usha Vance supported JD Vance's meteoric rise BBC hopes new Match of the Day hosting team is a winning formation Fatbergs turned into perfume - inside Britain's bizarre new industrial revolution Dive boat survivors say they were pressed to sign statements they couldn't read They hired Banksy for Â£50 then painted over his mural Politics Essential: Get the latest news and analysis delivered to your inbox every weekday Lily and Miquita answer your questions about respect Join lifelong friends as they discuss the world around them Dragonsâ Den returns with a new line-up of celebrity guests Can a fresh batch of entrepreneurs secure the deal of a lifetime? The dark side of the wellness industry Mirandaâs search for inner peace through yoga leads her into a shocking world Learn more about Britain's gardens with Monty Don What can the humble backyard tell us about our culture, climate and history? Â© 2025 BBC. The BBC is not responsible for the content of external sites.Read about our approach to external linking.",Negative,0.30180016
"This video can not be played Watch: Tears and laughter as MPs and peers pay tribute to Queen Elizabeth II Politicians from both Houses of Parliament have gathered to mark the death of Queen Elizabeth II and share their memories of the late monarch. Prime Minister Liz Truss described the Queen as one of the world's greatest-ever leaders, as she opened two days of special tributes in Parliament. MPs and ex-PMs paid their respects in personal speeches that aroused both tears and laughter in emotional scenes. A minute's silence was held to remember the Queen after 70 years on the throne. Both Houses of Parliament are sitting on Friday and Saturday to allow politicians to pay tribute to the Queen, following her death on Thursday. Follow the latest developments A life well lived - King pays tribute to his mother Former prime ministers reflect on Queen's reign Obituary: A long life marked by a sense of duty Friday's proceedings in Parliament paused at 18:00 BST for MPs and peers to watch the new king, Charles III, deliver a televised address to the nation, his first as monarch. Earlier, King Charles III was greeted by crowds singing ""God save the king"" outside Buckingham Palace, where he held his first in-person audience with Ms Truss. On Saturday, Ms Truss and senior ministers will attend the Accession Council at St James's Palace, where Charles will be formally proclaimed king. In Parliament on Friday, MPs and peers from all sides, dressed in dark clothing, paid tribute to the Queen by sharing memories of their own encounters with her. There have been many anecdotes about the Queen's wisdom, sense of humour and ability to put people at their ease. Some MPs laughed uproariously as former Prime Minister Theresa May recalled how mortified she was when the Queen caught her returning a dropped piece of cheese to a plate, as she helped prepare a picnic at Balmoral. ""I looked at her. She looked at me. And she just smiled. And the cheese remained on the table."" But the session began in solemn fashion, as Commons Speaker Sir Lindsay Hoyle invited a packed Commons chamber to rise and observe a minute's silence. MPs stood for a minute's silence as they gathered for tributes to the Queen As the silence ended, Sir Lindsay described the Queen as a ""devoted monarch"" who had seen 57 complete sessions of Parliament during her reign in a brief speech. Ms Truss, who was appointed prime minister by the Queen just three days ago at Balmoral, paid tribute to her ""sheer humanity"", which she said had made her ""loved and admired"" all over the world. She said her reign had been ""dignified but not distant"" and credited her with re-inventing the British monarchy for the modern age. The Queen's successor, her eldest son King Charles III, now carried the ""awesome responsibility"" of the British crown, added the prime minister. ""The crown endures. Our nation endures. And in that spirit, I say God save the King."" Cheers of approval erupted from MPs, with some shouting ""God save the King"" from the side gallery in the moments after Ms Truss's speech concluded. This video can not be played Liz Truss: Queen 'one of the greatest leaders the world has known' Next to speak was the leader of the Opposition, Labour MP Sir Keir Starmer, who reflected on the tumultuous political events of recent times and the extraordinary national change heralded by the Queen's death. ""When everything is spinning, a nation requires a still point, when times are difficult, it requires comfort, and when direction is hard to find, it requires leadership,"" Sir Keir said. ""The loss of our Queen robs this country of its stillest point, its greatest comfort, at precisely the time we need those things most."" He said the Queen had enjoyed a ""personal relationship with us all"", based on ""total commitment"" to duty and a ""deep devotion to the country, the Commonwealth, and the people she loved"". This video can not be played Watch: Sir Keir Starmer pays tribute to the Queen Boris Johnson - who offered the Queen his resignation as prime minister at Balmoral on Tuesday - reflected on that meeting, saying the late monarch ""was as radiant and as knowledgeable and as fascinated by politics as ever I can remember"". Praising the late monarch as ""Elizabeth the Great"", he recalled her ""humility"" and, like other former leaders, spoke of informal gatherings with the Royal Family, at Balmoral. ""Unlike us politicians, with our outriders and our armour-plated convoys, I can tell you as a direct eyewitness that she drove herself in her own car with no detectives and no bodyguard, bouncing at alarming speed over the Scottish landscape to the total amazement of the ramblers and the tourists we encountered."" Mrs May described her weekly prime ministerial meetings with the Queen as ""a conversation with a woman of experience and knowledge and immense wisdom"". ""They were also the one meeting I went to, which I knew it would not be briefed out to the media,"" Mrs May said, to laughter from MPs. Harriet Harman, who is known as Mother of the House, told MPs about the Queen's kindness after she lost her senior government role in 1998. ""My diary was empty, and my phone stopped ringing. My office was astonished to get a call from Buckingham Palace. No one else wanted to have anything to do with me, but the Queen wanted to see me. ""I was invited to take tea with the Queen for her to thank me for my service as secretary of state."" This video can not be played Theresa May shares an amusing story about how down-to-earth the Queen was SNP Westminster leader Ian Blackford used his speech to draw attention to the Queen's well-known affection for Scotland, where she spent her final days at Balmoral Castle. ""The relationship between Scotland and the Queen was one of shared admiration,"" Mr Blackford said. ""Indeed, whilst she was everyone's Queen, for many in Scotland, she was Elizabeth, Queen of Scots."" Former Foreign Secretary Margaret Beckett said she was one of the few MPs to remember the Queen's coronation in 1953. The veteran Labour MP shared fond memories of the Queen's sense of fun, and choked back tears as she hailed ""a remarkable person, a remarkable monarch"". Meanwhile in the Lords, the newly appointed leader of Parliament's upper house, Lord True, led tributes to the Queen, calling her an ""anchor of stability in a changing world"". Ending his moving tribute, Lord True looked poignantly at the sovereign's throne, where the Queen had sat for numerous state openings of Parliament, and said: ""Thank you, Ma'am. May you ever rest in peace as you will ever rest in our hearts."" His words were followed by those of Archbishop of Canterbury Justin Welby, who spoke of the Queen's ""profound sense of being called by God"" and her dry sense of humour. And former Labour cabinet minister Lord Blunkett recalled how the Queen came to his aid after he ended up facing the wrong way as he knelt during a royal audience. The blind peer said the Queen, in a ""careful and never patronising way"" managed to ""gently - by touching my arm - shift me round"". On Saturday evening, Parliament will be postponed until after 21 September, during a period of national mourning. Obituary: A long life marked by a sense of duty Former prime ministers reflect on Queen's reign Israel and Hamas reach Gaza ceasefire and hostage release deal, sources tell BBC UK's Chagos handover on hold to allow Trump to consider the deal Why the small drop in inflation matters to you The new Lockerbie drama provoking fierce criticism from victims' families What happens if TikTok is banned? 'My country is in crisis': A divided South Korea grapples with Yoon's arrest How 'spirit guide' Usha Vance supported JD Vance's meteoric rise BBC hopes new Match of the Day hosting team is a winning formation Fatbergs turned into perfume - inside Britain's bizarre new industrial revolution Dive boat survivors say they were pressed to sign statements they couldn't read They hired Banksy for Â£50 then painted over his mural Politics Essential: Get the latest news and analysis delivered to your inbox every weekday Lily and Miquita answer your questions about respect Join lifelong friends as they discuss the world around them Dragonsâ Den returns with a new line-up of celebrity guests Can a fresh batch of entrepreneurs secure the deal of a lifetime? The dark side of the wellness industry Mirandaâs search for inner peace through yoga leads her into a shocking world Learn more about Britain's gardens with Monty Don What can the humble backyard tell us about our culture, climate and history? Â© 2025 BBC. The BBC is not responsible for the content of external sites.Read about our approach to external linking.",Negative,0.007166733
