article,article_sentiment,article_score
"Alexander Litvinenko lies in a hospital bed in London, shortly before his death in 2006 When Sergei Skripal, a former Russian double agent, collapsed suddenly on Sunday in the sleepy cathedral city of Salisbury, there were unavoidable echoes of a messy, high-profile death in London a little over a decade before. In 2006, Alexander Litvinenko, another former Russian agent, was rushed to hospital after collapsing in London. As the world watched, a rare and highly radioactive isotope destroyed Litvinenko's organs one by one, and he died three weeks later. A British public inquiry found that the former Russian agent had ingested Polonium 210, and that his assassination was likely ordered directly by Russian President Vladimir Putin. Mr Skripal, 66, who was imprisoned in Russia for working for British intelligence and later came to the UK as part of a spy swap, is currently in critical condition, along with his 33-year-old daughter who was also taken ill. Authorities say they are trying to determine if he was poisoned. Russia has denied any involvement, but the case has put renewed scrutiny on a string of deaths in the UK in the past two decades. The chair of the home affairs select committee,Yvette Cooper MP, wrote to Home Secretary Amber Rudd on Tuesday,externalcalling for a review of 14 other cases. Those cases were variously found to have been heart attacks, suicides, accidents, and deaths by natural causes, but some allege that they amount to a pattern of state-sponsored murder on British streets. Security guard Neil St Clair-Ford was driving through Weybridge in Surrey in November 2012 when he saw something lying in the road ahead of him. He pulled over and found Alexander Perepilichnyy, an exiled Russian banker, in the foetal position, pale, cold, and displaying ""very faint"" signs of life. Mr St Clair-Ford called a local former Navy colleague, Liam Walsh, to help administer first aid. Mr Walsh told an inquest that Perepilichnyy vomited ""greeny-yellow"" bile during mouth-to-mouth resuscitation with a strange taste, like ""licking a battery"". Perepilichnyy was born in Ukraine and made his fortune as a financier in Russia, allegedly helping government-connected Russians launder money. In 2010 he fled to Britain and began to co-operate with British authorities. He collapsed during a run near his home, the day he returned from a short trip to Paris. An expert botanist said tests suggested the presence of a rare plant toxin in Perepilichnyy's stomach Initial toxicology tests on Perepilichnyy's body revealed nothing suspicious and police said they had no evidence of foul play. But later tests performed by an expert botanist at Kew Gardens suggested the presence of a rare and deadly plant toxin in Perepilichnyy's stomach. Gelsemium, a flowering plant native to China and South East Asia, is known as ""heartbreak grass"", because its leaves, if swallowed, cause cardiac arrest. Further tests of the compound found in Perepilichnyy could not definitively identify it as gelsemium, and an inquest into his death was suspended last year pending yet more tests. The inquest resumes next month. US intelligence sources told the BBC in 2016 that they believed Perepilichnyy was murdered.An extensive investigation by Buzzfeed News,externalclaimed that the businessman was one of at least 14 deaths in the UK that US officials suspected were connected to Russia. The following year, 2013, Boris Berezovsky, a one-time oligarch and close friend of Vladimir Putin, was found hanged in his bathroom. All the evidence seemed to point to a suicide. He had been suffering from depression and was in debt. According to police there was no sign of a struggle. A Home Office pathologist concluded that his injuries were consistent with hanging. But he had also made himself a sworn enemy of Mr Putin, having fled Russia for exile in Britain and fiercely criticised the regime from afar. Berezovsky's family arranged for an asphyxiation expert to examine photographs of his body. Dr Bernd Brinkmann testified that the ligature mark on Berezovsky's neck did not share the typical V-shape created by a hanging, and instead suggested strangling. The dead man also had a broken rib and a cut on the back of his head. It was enough to persuade the coroner to record an open verdict. Boris Berezovsky was found hanged in a bathroom at home in 2013 ""Anyone Putin deems to have betrayed Russia is at the highest level of risk,"" saidBill Browder, a former Moscow-based financier who led a campaign to impose sanctions on top Russian officials accused of corruption - sanctions that enraged Mr Putin. ""And Russia can get away with brazenness in the UK because there have never been any consequences to Russian assassinations here,"" he said. ""The British government either ignores the crimes completely, as they did in the Perepilichnyy case, or they recognise the crime and don't do anything about it."" Speaking in parliament on Tuesday, UK Foreign Secretary Boris Johnson said any evidence of Russian involvement with Mr Skripal's condition would be dealt with ""appropriately and robustly"". ""I say to governments around the world that no attempt to take innocent life on UK soil will go unsanctioned or unpunished,"" he said. How will experts know if ex-spy was poisoned? The 'quintessentially English' home of a Russian spy Skripal case highlights UK's Russia dilemma Among the other deaths flagged to the home secretary on Tuesday are those of Gareth Williams, the so-called ""spy in the bag"", whose badly decomposed body was found locked inside a holdall in his bath; Dr Matthew Puncher, a British scientist involved in the Litvinenko case who was found in his kitchen with multiple stab wounds from two separate knives; and Scot Young, a business associate of Berezovsky, who was found impaled on railings outside his London flat after falling from a fourth-floor window. Williams' death was ruled to be ""probably an accident"" and Puncher's and Young's both suicides, and British police say they have found no evidence of Russian involvement in any of the cases barring Litvinenko's. ""British police are under no sort of political pressure whatsoever,"" Tony Brenton, the British ambassador to Moscow at the time of Litvinenko's death, told the BBC. ""If they had found evidence of Russian involvement in those cases, we would have followed it up."" But the UK government has faced criticism over a perceived lack of action. In the wake of Litvinenko's death, the UK tried and failed to extradite two Russian agents alleged to have carried out the hit. Instead, several Russian diplomats were expelled, provoking a tit for tat response from Russia. A video still shows Sergei Skripal being detained by Russian security services in 2004 The problem facing the UK government now, said Mr Brenton, is that ministers have already levied significant sanctions on Russia over its actions in Ukraine and Syria, and diplomatic relations are already very poor. ""If it is proven that this was an attack with Russian state involvement we will of course do something, there will be lots of anger and probably more sanctions. But we have already used up an awful lot of our ammunition. The locker is quite bare,"" he said. In a statement, the Russian embassy in London said: ""Media reports create an impression of a planned operation by the Russian special services, which is completely untrue."" In Salisbury, counter-terror police have taken over the investigation. The park bench where Mr Skripal collapsed has been cordoned off and a restaurant where he ate lunch has been temporarily closed. If it turns out to have been a Russian attack, part of the purpose will have been to warn those in Russia against betrayal, and those in exile that they are never safe, said Mr Browder. ""It sends a message to the rank and file that terrible things can befall you and your family,"" he said. Critically ill man is former Russian spy Russiaâs elite FSB spy club Who is Sergei Skripal? 'They looked so out of it' Video, 00:00:31'They looked so out of it' Death toll rises amid most destructive wildfire in Los Angeles' history Moment friends abandon house as Palisades fire closes in 'Patients are collapsing in the waiting room': A&E nurses speak out Why does Trump want Greenland and what do its people think? How Canada's immigration debate soured - and helped seal Trudeau's fate 'I can't get divorced as I can't get my pension valued' What are cold weather payments and who can get them? BBC Sound of 2025: Barry Can't Swim is a new dance music superstar Ros Atkins on...Elon Musk's political interventions Jean-Marie Le Pen - founder of French far right and 'Devil of the Republic' Cases of HMPV are on the rise in China - but what is it? Politics Essential: Get the latest news and analysis delivered to your inbox every weekday Delivering brand-new miracles in 1970s East End Watch the latest series of Call the Midwife on iPlayer now Mark-Anthony Turnage shares the soundtrack of his life Once called 'Britainâs hippest composer', he's tackled topics from drug abuse to football in his work Paddyâs loaf-changing experience inside the bread factory Paddy McGuinness visits the bread factory he used to work in, and sees how they make 1.4 million loaves a week What's behind the global surrogacy boom? More countries are banning surrogacy â but demand is growing Â© 2025 BBC. The BBC is not responsible for the content of external sites.Read about our approach to external linking.",Negative,0.00030720106
"Theresa May hosted Saudi Crown Prince Mohammed bin Salman at No 10 Theresa May has raised concerns about human rights in Saudi Arabia during talks with the country's crown prince. Mohammed bin Salman has begun a three-day UK visit amid protests against his country's role in the war in Yemen. The PM said ties with Saudi Arabia had saved hundreds of UK lives but she had urged full access for humanitarian aid in Yemen and a political solution. Labour leader Jeremy Corbyn accused the government of ""colluding"" in war crimes by selling arms to Riyadh. The 32-year-old crown prince, seen by some as a modernising force in the Gulf State, held talks with Mrs May and cabinet ministers at No 10 ahead of a summit at Chequers on Thursday. He has already had lunch with the Queen and Duke of York, and is due to have dinner with the Prince of Wales and Duke of Cambridge. This video can not be played Five things about Saudi Arabia's Crown Prince Mohammed bin Salman The crown prince, who is regarded as being heir presumptive to the 82-year old King Salman, said there were ""huge opportunities"" to boost trade between the two countries while the UK and Saudi Arabia had to work together to deal with ""failed states...terrorist and extremist organisations"" in the Middle East. The UK hopes to capitalise on Saudi plans to open up and diversify its economy by agreeing up to Â£65bn in mutual trade and investment opportunities over the next 10 years as well as a significant role for the UK in advising on the modernisation of the Saudi schools system. But there were some protesters outside Downing Street demonstrating against the killing of Yemeni civilians in air strikes by a Saudi-led multinational coalition - backed by the UK and US - that is battling the rebel Houthi movement. Why the Saudi Crown Prince's visit matters Profile: Saudi Crown Prince Mohammed bin Salman Yemen crisis: Who is fighting whom? The crown prince is credited with kick-starting economic and social reforms in the conservative desert kingdom, such as the upcoming lifting of the ban on women driving. Prince Mohammed bin Salman earlier had lunch with the Queen In a statement following the talks, Downing Street said Mrs May had offered assistance to ""progress and intensify these reforms, particularly on women's rights, and on universal human rights"". The prime minister expressed particular concern about the case of Raif Badawi, a Saudi bloggersentenced to 1,000 lashes and 10 years in prisonfor ""insulting Islam"" online. Many have criticised the crown prince's decisions to intervene in Yemen and impose a de facto blockade of neighbouring Qatar, as well as crack down on perceived opponents of his policies. By BBC diplomatic correspondent James Landale When this relative novice on the world stage arrives in London on his first global tour since taking office, he will be granted the reddest of red carpets. The Crown Prince is looking for international support for his internal economic reforms while at the same time trying to offer reassurance to nervous international investors. And the British government is keen to transform a security and defence relationship into one that includes broader economic ties as well. The UK also has an unashamed appetite for inward investment from Saudi Arabia. In other words, post-Brexit Britain will need allies, markets and money - and the Saudis are high on the UK's wish list. Read more from James The conflict in Yemen is seen as part of a regional power struggle between Saudi Arabia, which backs the government, and Iran, which supports the Houthis but denies allegations that it is sending them weapons. According to the United Nations, more than 9,000 people, over half of them civilians, have been killed and more than 52,000 wounded in fighting in Yemen since March 2015. Saudi Arabia allows women to join army Saudi to lift driving ban on women Speaking earlier at Prime Minister's Questions, Mr Corbyn urged Mrs May to use her meeting to call for a halt to ""the shocking abuse of human rights in Saudi Arabia"", which he claimed included a sharp increase in the arrest and detention of dissidents, the torture of prisoners, unfair trials and executions. The PM responded by saying the UK's historic links with Saudi Arabia had saved the lives of potentially hundreds of people in this country, but she would be ""raising concerns about human rights"". Mr Corbyn added that 600,000 children in Yemen had cholera ""because of the Saudi-led bombing campaign and the blockade"", and asked why British arms sales to Saudi Arabia had ""sharply increased"". ""Germany has suspended arms sales to Saudi Arabia but British arms sales have sharply increased, and British military advisers are directing war,"" he said. ""It cannot be right that her government is colluding in what the United Nations says is evidence of war crimes. Will you use your meeting today with the crown prince to halt the arms supplies and demand an immediate ceasefire in Yemen?"" Vans carrying billboards protesting against the visit in Westminster Other vans parked in Whitehall feature a welcome to the Saudi crown prince Billboards next to London's A4 advertise the Saudi crown prince with the hashtag ""#ANewSaudiArabia"" Mrs May told the Commons everyone was ""concerned"" about the humanitarian crisis in Yemen. She said she had raised concerns about the Saudi blockades of ports in Yemen during a meeting in December, and it withdrew. ""This vindicates the engagement that we have with Saudi Arabia, to be able to sit down with them,"" she said. ""Their involvement in Yemen came at the request of the legitimate government of the Yemen, it is backed by the United Nations Security Council and as such we support it."" The prime minister's official spokesman also rejected Mr Corbyn's claims that British military advisers were ""directing the war"". ""We're not a member of that (Saudi-led) coalition; we're not involved in carrying out strikes, directing or conducting operations, or involved in the targeting decision making process,"" he said. Get news from the BBC in your inbox, each weekday morning,external Who is Saudi Crown Prince Mohammed bin Salman? Saudi Crown Prince: Five things to know. Video, 00:03:08Saudi Crown Prince: Five things to know Death toll rises amid most destructive wildfire in Los Angeles' history Moment friends abandon house as Palisades fire closes in 'Patients are collapsing in the waiting room': A&E nurses speak out Why does Trump want Greenland and what do its people think? How Canada's immigration debate soured - and helped seal Trudeau's fate 'I can't get divorced as I can't get my pension valued' What are cold weather payments and who can get them? BBC Sound of 2025: Barry Can't Swim is a new dance music superstar Ros Atkins on...Elon Musk's political interventions Jean-Marie Le Pen - founder of French far right and 'Devil of the Republic' Cases of HMPV are on the rise in China - but what is it? Politics Essential: Get the latest news and analysis delivered to your inbox every weekday Delivering brand-new miracles in 1970s East End Watch the latest series of Call the Midwife on iPlayer now Mark-Anthony Turnage shares the soundtrack of his life Once called 'Britainâs hippest composer', he's tackled topics from drug abuse to football in his work Paddyâs loaf-changing experience inside the bread factory Paddy McGuinness visits the bread factory he used to work in, and sees how they make 1.4 million loaves a week What's behind the global surrogacy boom? More countries are banning surrogacy â but demand is growing Â© 2025 BBC. The BBC is not responsible for the content of external sites.Read about our approach to external linking.",Positive,0.99999964
"Layla was not seen by a doctor for an hour and 50 minutes A six-year-old girl died after a doctor missed a ""classic indicator"" that she had meningitis, an inquest heard. Layla Rose Ermenekli was taken to Royal Oldham Hospital with a high temperature, leg and stomach pains and a tell-tale rash on her hip, and died eight hours later. Dr Harsha Rajanna said he asked her mother Kirsty about the hip mark and was told she bumped into a table. Mrs Ermenekli said the exchange never happened. The hearing was told that Layla, from Oldham, Greater Manchester, was a lively girl who loved playing with her friends and dancing. She became ill in February last year and was taken to the hospital's accident and emergency department. She was triaged as ""priority two"" at 20:55 GMT and should have been seen by a doctor within 10 minutes, but Dr Rajanna did not see her until 22:50 GMT. Mrs Ermenekli told the inquest he said Layla could go home and she felt pressured to take her. Dr Harsha Rajanna said he was told Layla bumped into a table A nurse called in junior doctor Imogen Buck who saw the non-blanching rash - a ""classic indicator"" of meningitis. Layla was transferred to a high dependency unit but died of meningococcal meningitis and septicaemia hours later. Dr Rajanna told the inquest he noticed Layla's hip mark and thought it was a bruise, but made no note of it. When asked why, he said Mrs Ermenekli had told him the child had bumped into a table, which she denies. Layla was taken to Royal Oldham Hospital after becoming ill He said she wanted to take Layla home but he recommended she be seen by the paediatric team. A lawyer representing Layla's family said: ""Either your recollection is wrong or you are giving dishonest evidence to this court."" The coroner asked Dr Buck why she did not challenge Dr Rajanna after Layla died and she said felt it ""wasn't appropriate"". The health trust has already apologised to the family for the quality of care received. The hearing continues. Courts and Tribunals Judiciary - Coroners The exact times it will be coldest in every Greater Manchester borough tonight as temperatures to plummet to -16C across UK Met Office warns more snow could fall over UK at weekend in fresh update Man and woman charged in connection with M62 crash death appear in court Wanted man in custody after police find items believed to be stolen Disruption on M66 northbound after 'police incident' Man sentenced as GMP secures biggest penalty in Bury domestic violence pilot scheme Death toll rises amid most destructive wildfire in Los Angeles' history Moment friends abandon house as Palisades fire closes in 'Patients are collapsing in the waiting room': A&E nurses speak out Why does Trump want Greenland and what do its people think? How Canada's immigration debate soured - and helped seal Trudeau's fate 'I can't get divorced as I can't get my pension valued' What are cold weather payments and who can get them? BBC Sound of 2025: Barry Can't Swim is a new dance music superstar Ros Atkins on...Elon Musk's political interventions Jean-Marie Le Pen - founder of French far right and 'Devil of the Republic' Cases of HMPV are on the rise in China - but what is it? Politics Essential: Get the latest news and analysis delivered to your inbox every weekday Delivering brand-new miracles in 1970s East End Watch the latest series of Call the Midwife on iPlayer now Mark-Anthony Turnage shares the soundtrack of his life Once called 'Britainâs hippest composer', he's tackled topics from drug abuse to football in his work Paddyâs loaf-changing experience inside the bread factory Paddy McGuinness visits the bread factory he used to work in, and sees how they make 1.4 million loaves a week What's behind the global surrogacy boom? More countries are banning surrogacy â but demand is growing Â© 2025 BBC. The BBC is not responsible for the content of external sites.Read about our approach to external linking.",Positive,1.0
