article,article_sentiment,article_score
"This video can not be played BBC Weather's Simon King has the UK forecast A man has died after being swept out to sea in Kent as heavy rain, winds and ""unseasonably cold"" weather hit parts of the UK. Two other men were taken to hospital after being washed from East Pier in Ramsgate by a large wave, police said. A yellow warning,externalfor heavy rain and strong winds remains in place for southern and eastern parts of England for the whole of Monday. Forecasters said some areas could see more than a month's rainfall in a day. Some trains in the south-east of England were cancelled and roads have been blocked by fallen trees. The RNLI, whose crews were called to help the three men at Royal Harbour in Ramsgate, called the conditions ""atrocious"". They said they rescued two men from the water but one was pronounced dead at the scene. The third man had been knocked over on the harbour wall by the wave and has been airlifted to hospital. Strong winds have caused large waves across coastal areas in the south east, including in Ramsgate in Kent Also in Kent, firefighters rescued two adults and a baby from a car which was stuck in flood water in Sutton Valence, while another man in Herne Bay was trapped when a tree fell on his car. Meanwhile, two flood warnings - which means flooding is expected - remain in place along the River Nene, east of Peterborough, and on the coast in North Shields in north-east England. Flood warnings and alerts,external, issued by the Environment Agency, are in force across England and staff are maintaining defences at at-risk spots. By 07:00 BST, Kent had seen more than 20mm of rain in 24 hours - nearly half of the monthly average for this time of year - and gusts of 50mph have been recorded. Some services on Southeastern Railway were cancelled and others diverted because of flooding and a tree blocking the line at Charing in Kent. Southern Rail faced disruption because of speed restrictions due to the weather and a fallen tree, while a tree hanging over the line between Woking and Weybridge also affected some South Western Railway services. Several flights leavingLondon City Airport,externalhave been delayed. A spokesman for the airport said air traffic control restricted the number of flights that can take off and land because of the poor weather conditions. Strong winds have brought down trees across the south-east, including in Streatham, south London UK Power Networks, which covers part of the south-east of England, said although there are outages it was a ""normal day"" with no widespread problems due to the weather. The wet and windy weather is the result of an area of low pressure moving northwards overnight on Sunday. It will feel ""unseasonably cold"" for the time of year, the BBC Weather Centre said, with maximum temperatures about 6 to 7C in these areas, but feeling much colder under the rain and wind. Peter Siddle of Essex bowls against Hampshire in the county cricket match on Monday High ground - like the Chilterns and the Cotswolds - could even see sleet and snow, although it will not settle. County cricketers playing at the Ageas Bowl in Hampshire wore woolly hats to keep warm. On social media, people shared photos and videos of flooded roads and large waves in coastal areas. Allow Twitter content? This article contains content provided by Twitter. We ask for your permission before anything is loaded, as they may be using cookies and other technologies. You may want to readTwitter’s cookie policy,externalandprivacy policy,externalbefore accepting. To view this content choose‘accept and continue’. Allow Twitter content? This article contains content provided by Twitter. We ask for your permission before anything is loaded, as they may be using cookies and other technologies. You may want to readTwitter’s cookie policy,externalandprivacy policy,externalbefore accepting. To view this content choose‘accept and continue’. Did comedian's Sarah Sanders 'roast' go too far? Sainsbury's vows Asda deal will cut prices Brazilian surfer breaks wave world record It is in sharp contrast to earlier April weather -on 19 April, 29.1C was recorded at St James's Park in central London,making it the hottest UK day in April since 1949. The average maximum temperature for the UK in April is 11.9C. The UK saw its hottest April day for nearly 70 years earlier this month Has your area been affected by heavy rain, winds and cold weather?  Please share your experiences with us by emailinghaveyoursay@bbc.co.uk,external. Please include a contact number if you are willing to speak to a BBC journalist. You can also contact us in the following ways: WhatsApp:+447555 173285 Tweet:@BBC_HaveYourSay,external Upload your pictures / videohere,external Send an SMS or MMS to61124or+44 7624 800 100 Death toll rises amid most destructive wildfire in Los Angeles' history Moment friends abandon house as Palisades fire closes in 'Patients are collapsing in the waiting room': A&E nurses speak out Chris Mason: Is Starmer leaving the door open to an abuse inquiry? The Papers: 'Apocalypse' LA and 'Reeves faces extra tax rises' Why does Trump want Greenland and what do its people think? How Canada's immigration debate soured - and helped seal Trudeau's fate 'I can't get divorced as I can't get my pension valued' What are cold weather payments and who can get them? BBC Sound of 2025: Barry Can't Swim is a new dance music superstar Ros Atkins on...Elon Musk's political interventions Jean-Marie Le Pen - founder of French far right and 'Devil of the Republic' Delivering brand-new miracles in 1970s East End Watch the latest series of Call the Midwife on iPlayer now Mark-Anthony Turnage shares the soundtrack of his life Once called 'Britain’s hippest composer', he's tackled topics from drug abuse to football in his work Paddy’s loaf-changing experience inside the bread factory Paddy McGuinness visits the bread factory he used to work in, and sees how they make 1.4 million loaves a week What's behind the global surrogacy boom? More countries are banning surrogacy – but demand is growing © 2025 BBC. The BBC is not responsible for the content of external sites.Read about our approach to external linking.",Positive,1.0
"Labour MP John Woodcock said he did not intend to discuss details of the issue ahead of any hearing An MP has been suspended by the Labour Party amid claims he sent inappropriate messages to a former female member of staff. Barrow and Furness MP John Woodcock said he was told in December that the complaint was being referred as a potential breach of the Labour Party's policy on sexual harassment. The Mirror reported that the aide felt uncomfortable,externaland left her job. Mr Woodcock has said he ""does not accept"" the allegation. A Labour Party spokesperson said he had been suspended ""pending due process"" and added ""it would not be appropriate to comment further on an ongoing case"". In a statement, Mr Woodcock said the complaint had been referred to Labour's national constitutional committee. ""I do not accept the charge being brought against me but have been co-operating fully with the process and remain committed to a thorough and fair investigation of the case,"" he said. ""I am therefore very concerned that one of the very few individuals with knowledge of the case chose to place selective details of it in newspapers this weekend. Labour's new general secretary has cited this publicity as a reason to suspend me from the Labour whip. ""The decision at this politically charged time to place details of my case in the press and then suspend me places a serious question mark over the integrity of the process, which serves neither those making complaints nor those facing allegations."" A Labour Party spokesperson said ""all allegations are fully investigated"" and any disciplinary action is ""taken in line with the party's rule book and procedures"". Mr Woodcock was first elected in 2010 and has been a fierce critic of Labour leader Jeremy Corbyn. Film festival champions local talent as it marks anniversary An Evening with Shaun Ryder relocated from The Forum following asbestos closure Decision made on new 180-space car park at Cumberland Infirmary Drunk man grabbed concrete slab and threatened to smash up petrol station House damaged in suspected gas explosion to be demolished Police investigating 'serious assault' on Botchergate, Carlisle Death toll rises amid most destructive wildfire in Los Angeles' history Moment friends abandon house as Palisades fire closes in 'Patients are collapsing in the waiting room': A&E nurses speak out Chris Mason: Is Starmer leaving the door open to an abuse inquiry? The Papers: 'Apocalypse' LA and 'Reeves faces extra tax rises' Why does Trump want Greenland and what do its people think? How Canada's immigration debate soured - and helped seal Trudeau's fate 'I can't get divorced as I can't get my pension valued' What are cold weather payments and who can get them? BBC Sound of 2025: Barry Can't Swim is a new dance music superstar Ros Atkins on...Elon Musk's political interventions Jean-Marie Le Pen - founder of French far right and 'Devil of the Republic' Delivering brand-new miracles in 1970s East End Watch the latest series of Call the Midwife on iPlayer now Mark-Anthony Turnage shares the soundtrack of his life Once called 'Britain’s hippest composer', he's tackled topics from drug abuse to football in his work Paddy’s loaf-changing experience inside the bread factory Paddy McGuinness visits the bread factory he used to work in, and sees how they make 1.4 million loaves a week What's behind the global surrogacy boom? More countries are banning surrogacy – but demand is growing © 2025 BBC. The BBC is not responsible for the content of external sites.Read about our approach to external linking.",Positive,0.8217575
"This video can not be played BBC Weather's Simon King has the UK forecast A man has died after being swept out to sea in Kent as heavy rain, winds and ""unseasonably cold"" weather hit parts of the UK. Two other men were taken to hospital after being washed from East Pier in Ramsgate by a large wave, police said. A yellow warning,externalfor heavy rain and strong winds remains in place for southern and eastern parts of England for the whole of Monday. Forecasters said some areas could see more than a month's rainfall in a day. Some trains in the south-east of England were cancelled and roads have been blocked by fallen trees. The RNLI, whose crews were called to help the three men at Royal Harbour in Ramsgate, called the conditions ""atrocious"". They said they rescued two men from the water but one was pronounced dead at the scene. The third man had been knocked over on the harbour wall by the wave and has been airlifted to hospital. Strong winds have caused large waves across coastal areas in the south east, including in Ramsgate in Kent Also in Kent, firefighters rescued two adults and a baby from a car which was stuck in flood water in Sutton Valence, while another man in Herne Bay was trapped when a tree fell on his car. Meanwhile, two flood warnings - which means flooding is expected - remain in place along the River Nene, east of Peterborough, and on the coast in North Shields in north-east England. Flood warnings and alerts,external, issued by the Environment Agency, are in force across England and staff are maintaining defences at at-risk spots. By 07:00 BST, Kent had seen more than 20mm of rain in 24 hours - nearly half of the monthly average for this time of year - and gusts of 50mph have been recorded. Some services on Southeastern Railway were cancelled and others diverted because of flooding and a tree blocking the line at Charing in Kent. Southern Rail faced disruption because of speed restrictions due to the weather and a fallen tree, while a tree hanging over the line between Woking and Weybridge also affected some South Western Railway services. Several flights leavingLondon City Airport,externalhave been delayed. A spokesman for the airport said air traffic control restricted the number of flights that can take off and land because of the poor weather conditions. Strong winds have brought down trees across the south-east, including in Streatham, south London UK Power Networks, which covers part of the south-east of England, said although there are outages it was a ""normal day"" with no widespread problems due to the weather. The wet and windy weather is the result of an area of low pressure moving northwards overnight on Sunday. It will feel ""unseasonably cold"" for the time of year, the BBC Weather Centre said, with maximum temperatures about 6 to 7C in these areas, but feeling much colder under the rain and wind. Peter Siddle of Essex bowls against Hampshire in the county cricket match on Monday High ground - like the Chilterns and the Cotswolds - could even see sleet and snow, although it will not settle. County cricketers playing at the Ageas Bowl in Hampshire wore woolly hats to keep warm. On social media, people shared photos and videos of flooded roads and large waves in coastal areas. Allow Twitter content? This article contains content provided by Twitter. We ask for your permission before anything is loaded, as they may be using cookies and other technologies. You may want to readTwitter’s cookie policy,externalandprivacy policy,externalbefore accepting. To view this content choose‘accept and continue’. Allow Twitter content? This article contains content provided by Twitter. We ask for your permission before anything is loaded, as they may be using cookies and other technologies. You may want to readTwitter’s cookie policy,externalandprivacy policy,externalbefore accepting. To view this content choose‘accept and continue’. Did comedian's Sarah Sanders 'roast' go too far? Sainsbury's vows Asda deal will cut prices Brazilian surfer breaks wave world record It is in sharp contrast to earlier April weather -on 19 April, 29.1C was recorded at St James's Park in central London,making it the hottest UK day in April since 1949. The average maximum temperature for the UK in April is 11.9C. The UK saw its hottest April day for nearly 70 years earlier this month Has your area been affected by heavy rain, winds and cold weather?  Please share your experiences with us by emailinghaveyoursay@bbc.co.uk,external. Please include a contact number if you are willing to speak to a BBC journalist. You can also contact us in the following ways: WhatsApp:+447555 173285 Tweet:@BBC_HaveYourSay,external Upload your pictures / videohere,external Send an SMS or MMS to61124or+44 7624 800 100 Death toll rises amid most destructive wildfire in Los Angeles' history Moment friends abandon house as Palisades fire closes in 'Patients are collapsing in the waiting room': A&E nurses speak out Chris Mason: Is Starmer leaving the door open to an abuse inquiry? The Papers: 'Apocalypse' LA and 'Reeves faces extra tax rises' Why does Trump want Greenland and what do its people think? How Canada's immigration debate soured - and helped seal Trudeau's fate 'I can't get divorced as I can't get my pension valued' What are cold weather payments and who can get them? BBC Sound of 2025: Barry Can't Swim is a new dance music superstar Ros Atkins on...Elon Musk's political interventions Jean-Marie Le Pen - founder of French far right and 'Devil of the Republic' Delivering brand-new miracles in 1970s East End Watch the latest series of Call the Midwife on iPlayer now Mark-Anthony Turnage shares the soundtrack of his life Once called 'Britain’s hippest composer', he's tackled topics from drug abuse to football in his work Paddy’s loaf-changing experience inside the bread factory Paddy McGuinness visits the bread factory he used to work in, and sees how they make 1.4 million loaves a week What's behind the global surrogacy boom? More countries are banning surrogacy – but demand is growing © 2025 BBC. The BBC is not responsible for the content of external sites.Read about our approach to external linking.",Positive,0.9975629
"A postcard believed to have been sent by Jack the Ripper warning of two murders has been sold at auction. The note, which was sent to Ealing police station, warns the killer's knife ""is still in good order"". The card is dated 29 October 1888, which was 11 days before Mary Kelly - believed to be Jack the Ripper's final victim - was murdered on 9 November. The 2.75-inch by 4.75-inch card, sold for £22,000. The card once belonged to a Metropolitan Police constable who was given it when he retired from the force in 1966. The card, which had an estimate of £600 to £900 prior to sale, states: ""Beware there is two women I want here and I mean to have them my knife is still in good order it is a students knife and I hope you liked the kidney. ""I am Jack the Ripper."" Jonathan Riley of Grand Auctions in Folkestone, Kent, said a British private collector won a bidding war with an American for the rare letter, ""the likes of which have never come up for sale before"". The final price will be closer to £30,000 once an auction premium is paid, Mr Riley said, adding the sale shows ""how much interest in the Ripper there still is"". The card once belonged to a Metropolitan Police constable who was given it as a memento when he retired from the force in 1966. It was sold by his widow. The auctioneers state: ""There is mention of his 'students' knife in our card. Some believe that the ripper had some medical training from the way he cut up his victims, but this is not universally accepted. ""The kidney that was mentioned also appears in the 'Letter from Hell',another Ripper letter, where the writer stated he had fried one of his victim's kidneys and 'it tasted nice'. ""The card is definitely of the period and has police provenance."" Attacks ascribed to Jack the Ripper typically involved female prostitutes who lived and worked in the slums of the East End of London Jack the Ripper's murders remain the most notorious unsolved mystery in British criminal history. Between August and November 1888 he murdered five women in the Whitechapel area of east London. Dozens of letters signed ""Jack the Ripper"" were sent at the time, but many were - and still are - regarded as hoaxes. Speculation about his identity was rife at the time and remains so to this day. Ripper letters back newsman hoax theory Grand Auctions Buying Coordinator (14 months FTC) Robot-guided ‘smart biopsy’ technique tested on patients in UK first South London's Christmas Lane Community pays tribute to 14-year-old with ‘pure heart’ stabbed to death on bus The 13 London restaurants named as finalists in the 2025 Good Food Guide Awards Aspiring Psychologist Ealing January 2025 Death toll rises amid most destructive wildfire in Los Angeles' history Moment friends abandon house as Palisades fire closes in 'Patients are collapsing in the waiting room': A&E nurses speak out Chris Mason: Is Starmer leaving the door open to an abuse inquiry? The Papers: 'Apocalypse' LA and 'Reeves faces extra tax rises' Why does Trump want Greenland and what do its people think? How Canada's immigration debate soured - and helped seal Trudeau's fate 'I can't get divorced as I can't get my pension valued' What are cold weather payments and who can get them? BBC Sound of 2025: Barry Can't Swim is a new dance music superstar Ros Atkins on...Elon Musk's political interventions Jean-Marie Le Pen - founder of French far right and 'Devil of the Republic' Delivering brand-new miracles in 1970s East End Watch the latest series of Call the Midwife on iPlayer now Mark-Anthony Turnage shares the soundtrack of his life Once called 'Britain’s hippest composer', he's tackled topics from drug abuse to football in his work Paddy’s loaf-changing experience inside the bread factory Paddy McGuinness visits the bread factory he used to work in, and sees how they make 1.4 million loaves a week What's behind the global surrogacy boom? More countries are banning surrogacy – but demand is growing © 2025 BBC. The BBC is not responsible for the content of external sites.Read about our approach to external linking.",Positive,0.99999774
"Stormy Daniels, seen here with her lawyer Michael Avenatti, says she had an affair with the president Adult film star Stormy Daniels is suing US President Donald Trump over a ""defamatory"" tweet about alleged threats against her, her lawyer says. Ms Daniels, real name Stephanie Clifford, says she was threatened by a man in a Las Vegas car park to drop her allegations of an affair with Mr Trump. Mr Trump retweeted a sketch of the man, calling it ""a total con job"". But Ms Daniel's lawyer tweeted that Mr Trump was ""well aware of what transpired"". Allow Twitter content? This article contains content provided by Twitter. We ask for your permission before anything is loaded, as they may be using cookies and other technologies. You may want to readTwitter’s cookie policy,externalandprivacy policy,externalbefore accepting. To view this content choose‘accept and continue’. ""Mr Trump used his national and international audience of millions of people to make a false factual statement to denigrate and attack Ms Clifford,"" the filing to a New York federal court reads. The suit says the president's tweet was defamatory as it accused Ms Daniels of  ""committing a serious crime"" - namely, falsely accusing a person of threatening her. Mr Trump retweeted the sketch of the person earlier this month, calling him ""a nonexistent man"". Allow Twitter content? This article contains content provided by Twitter. We ask for your permission before anything is loaded, as they may be using cookies and other technologies. You may want to readTwitter’s cookie policy,externalandprivacy policy,externalbefore accepting. To view this content choose‘accept and continue’. Ms Daniels says she and the president had an affair, starting in 2006. The president strongly denies the allegation. She told CBS News' 60 minutes programme that following the end of the relationship, a man approached her and her daughter in a Las Vegas car park and told her to ""forget the story, leave Donald Trump alone"". This video can not be played Stormy Daniels: 'I was threatened' The president and the porn star: Why this matters Stormy Daniels at court for Trump lawyer Ms Daniels previously sued Mr Trump's lawyer Michael Cohen to end an alleged non-disclosure agreement about the relationship, which she says Mr Trump never signed. Mr Cohen has previously admitted giving Ms Daniels $130,000 out of his own pocket, but has not said why he did this. Mr Trump denies any knowledge of Mr Cohen, pictured here entering court, paying Ms Daniels This case was, however, halted for 90 days, when the presiding judge saidMr Cohen's rights could be put in dangerif the case continued while he was under criminal investigation. Mr Cohen is under scrutiny as part of Special Counsel Robert Mueller's investigation into alleged Russian interference in the 2016 US presidential election and alleged collusion with President Trump's campaign. Who is Michael Cohen? Why the raid on Trump's lawyer is a big deal Porn star 'threatened over Trump affair' Trump dismisses Stormy Daniels sketch Stormy case against Trump lawyer on hold Michael Cohen: Trump's personal lawyer Death toll rises amid most destructive wildfire in Los Angeles' history Moment friends abandon house as Palisades fire closes in 'Patients are collapsing in the waiting room': A&E nurses speak out Chris Mason: Is Starmer leaving the door open to an abuse inquiry? The Papers: 'Apocalypse' LA and 'Reeves faces extra tax rises' Why does Trump want Greenland and what do its people think? How Canada's immigration debate soured - and helped seal Trudeau's fate 'I can't get divorced as I can't get my pension valued' What are cold weather payments and who can get them? BBC Sound of 2025: Barry Can't Swim is a new dance music superstar Ros Atkins on...Elon Musk's political interventions Jean-Marie Le Pen - founder of French far right and 'Devil of the Republic' Delivering brand-new miracles in 1970s East End Watch the latest series of Call the Midwife on iPlayer now Mark-Anthony Turnage shares the soundtrack of his life Once called 'Britain’s hippest composer', he's tackled topics from drug abuse to football in his work Paddy’s loaf-changing experience inside the bread factory Paddy McGuinness visits the bread factory he used to work in, and sees how they make 1.4 million loaves a week What's behind the global surrogacy boom? More countries are banning surrogacy – but demand is growing © 2025 BBC. The BBC is not responsible for the content of external sites.Read about our approach to external linking.",Negative,0.015743338
