article,article_sentiment,article_score
"Tributes for the Queen continued to pour in at the weekend as her funeral cortege was due to leave Balmoral Castle for Edinburgh On Saturday, Charles III was proclaimed King at an elaborate ceremony in London Princes William and Harry, and their wives Kate and Meghan, met crowds at Windsor in an unexpected joint appearance They collected floral tributes and spoke to some of those who had gathered to pay their respects The Queenâs funeral will be held in Westminster Abbey on Monday 19 September Edited by Dulcie Lee Thank you for joining us. We're moving our live coverage - you can continue following developments on our new pagehere. The first stage of Queen Elizabeth's final journey will begin later when her coffin is moved from Balmoral to Edinburgh. Let's look at what to expect overthe coming days. Sunday The Queen's body will depart Balmoral, travelling more than 175 miles through the cities of Perth, Aberdeen and Dundee before arriving at the Palace of Holyroodhouse. Monday In the afternoon, the Queen's coffin will travel by procession to St Giles' Cathedral, accompanied by the King and members of the Royal Family. Tuesday Princess Anne will accompany her mother's coffin on a flight to London. From there it will travel to Buckingham Palace, and be witnessed by King Charles and Queen Consort, Camilla. Wednesday The coffin will be taken on a procession through central London, and then will be laid in state at Westminster Hall. It will remain there for the next four days. Monday 19 September During the morning the Queen's lying in state will end, and the coffin will be taken in procession to Westminster Abbey for the state funeral, which will be a Bank Holiday in the UK. Find more details on all of the abovehere. If you want topay tribute to the Queen, there are several options. Members of the public can pay their respects at St Giles' Cathedral in Edinburgh for 24 hours from Monday afternoon. From Tuesday, the Queen's body will lie in state in Westminster Hall for four days, where mourners are expected to be invited to file past her coffin. Floral tributes can be left at sites in Green Park and Hyde Park in London, the main gate in Balmoral Castle, as well as Physic Garden in Edinburgh and Hillsborough Castle. Check in at your local library, town hall or civic building to sign a book of condolence. Added to this, you can send a message online viathe Royal Family website,external. The BBC is also collecting online tributes, which can be left viathis form here. Queen Elizabeth with the Duke of Edinburgh at a lodge in Kenya In January 1952, Princess Elizabeth and her husband the Duke of Edinburgh set off on an overseas tour in place of the monarch, who was terminally ill with lung cancer. Against medical advice, the King went to the airport to see the couple off. It was to be the last time Elizabeth, then just 25 years old, would see her father. She heard the news of his death while staying at a game lodge in Kenya and immediately returned to London as the Queen. She later recalled: ""In a way, I didn't have an apprenticeship. My father died much too young, so it was all a very sudden kind of taking on and making the best job you can.â Queen Elizabeth II returns to England Welsh politicians will be recalled to the Senedd - the Welsh
Parliament - on Sunday to pay tribute to Queen Elizabeth II. The session, in Cardiff Bay, will take place at 14:00 BST and
all other business will be suspended until after the state funeral. Amotion of condolence will express the Seneddâs ""deep sadness at the death of Her Majesty The Queen"". The Queen officially opened the Senedd building in 2006 and last
visited in 2021 to open its sixth session. This video can not be played American Corgi owner reflects on Queen's influence outside British Embassy An American woman who showed up at the UK embassy in Washington, DC to pay her respects to the Queen said it was the monarch's love of corgis that inspired her to own some of her own. ""One of the reasons we got them was because the Queen had them,"" she said, pushing a pram with two corgis patiently sitting inside. The Queen was known for her love of corgis dating back to when she was a child, and kept dozens of them over the course of her 70-year reign. Read more abouthow the Queen's love of corgis started a global phenomenon On Saturday, Windsor Castle became the site of a rare joint appearance by the new Prince of Wales, William, with his brother Prince Harry, and their wives. It is a building that had deep significance to the monarch throughout her life - a place of work but also her own private retreat. The Queen's special association with Windsor Castle began when she was a child. 
The then-Princess Elizabeth and her family made Royal Lodge - a mansion in the grounds of the Windsor Estate - their weekend country home. The first instinct of many mourning the death of Queen Elizabeth II has been to leave flowers at Windsor Castle.  At the age of 14, the then-princess and her sister Margaret were sent to the castle for much of World War Two while their home in London faced the threat of being bombed. The castle has been inhabited continuously by 40 monarchs across almost 1,000 years. With 1,000 rooms, 13 acres (five hectares) of grounds and reminders of its rich history amid the gothic architecture, it is little wonder the Queen saw the castle as a sanctuary. This video can not be played Commonwealth countries pay tribute to the Queen Countries throughout the Commonwealth - the association of 56 nations with ties to the former British empire - have been sharing their condolences and memories of Queen Elizabeth II. From world leaders to members of the public, people reflected on Her Majesty's legacy. Tributes for the Queen have poured in from statesmen around the world, and on Saturday, the US Secretary of State Antony Blinken was the latest to issue his  condolences. On Twitter, Blinken posted a photo from the US embassy in Washington, thanking the Queen for her ""steadfast leadership"" and ""unwavering commitment to service"". Dame Karen Pierce, the UK ambassador to the US, thanked Blinken for the message, calling the Queen ""our foremost diplomat"" and ""active supporter"" of the two countries' ""special relationship"" - a phrase that had been coined by her first prime minister, Churchill. Allow Twitter content? This article contains content provided by Twitter. We ask for your permission before anything is loaded, as they may be using cookies and other technologies. You may want to readTwitterâs cookie policy,externalandprivacy policy,externalbefore accepting. To view this content chooseâaccept and continueâ. Katty KayUS special correspondent Queen Elizabeth and Ronald Reagan ride horses in Windsor Home Park in 1982 US presidents wield hard power. They control the
biggest military in the world and its richest country. Yet,
one after one, they would walk into Buckingham Palace and go jelly-kneed. This
diminutive woman reduced powerful presidents to grinning school boys. She traded scone recipes with Dwight Eisenhower, danced
with Gerald Ford and rode with Ronald Reagan. Somehow she managed to find a way to
connect with each of them, not just as a fellow head of state, but as a person. The one president who, according to someone who worked
for him, didn't go into his first meeting with the Queen already star struck
was Barack Obama. Apparently he rather resisted the ""hype,"" as
this staffer put it. But then he met her. And, like the 11 presidents
before him, he, too, was won over. Indeed, the two developed such a good
relationship that the Queen reportedly asked him to come and visit even after
he left office. I'm told that what changed the 44th president's view was her
sense of responsibility and duty - she was, in Obama language, a no-drama
Queen. US presidents often have a keen sense of history and all those years on the throne wasn't lost on them. As a long day draws to a close in the UK, let's look back at what happened today: Charles III was proclaimed kingby the Accession Council in a ceremony at St James's Palace in London.Read more here. In Balmoral, three of the Queen's children -Princess Anne, Prince Andrew and Prince Edward -attended a church service along with other members of the royal family, and stopped to greet well-wishers outside the gates of Balmoral. Details of the Queen's funeral were announced- it will take place at 11am on Monday, 19 September at Westminster Abbey.Get more details here. Prince William, the new Prince of Wales,paid tribute to Queen Elizabeth saying his grandmother had been at his side on both his happiest and saddest days.Read what he said here. King Charlesheld audiences with ministers and met opposition politicians at Buckingham Palace. Princes Harry and William, joined by their wives,delighted crowds as they went for a walkabout in Windsor, collecting floral tributes and meeting some of those who turned out to pay their respects.Watch the moment here. The Queen was a big part of the community in the village near Balmoral, says the church minister Balmoral, the Scottish castle where the Queen died, was the place where she ""enjoyed being normal"", according to royal historian Robert Lacey, So it's no surprise thatpeople in the nearby village of Ballater remember her with special affection. ""She was not just our Queen, she was a neighbour - and a big part of this community,"" says Rev David Barr at Glenmuick Church in the village. Alistair Cassie, who runs a hardware shop in Ballater and has a royal warrant for supplying Balmoral with its televisions, remembered being called to the castle to fix interference with the radio. The Royal Banner of Scotland flies at half-mast at Balmoral Castle ""I was walking along this corridor, and who did I meet but the Queen,"" he says. They chatted about her appreciation for the BBC Radio 2 presenter Jimmy Young. The sprawling Balmoral Estate includes dozens of houses, many occupied by estate staff, and Cassie says at times the Queen would appear unannounced at someone's home, asking: ""How are you doing?"" Grant Harrold, a former butler to King Charles when he was Prince of Wales, says the Queen and Prince Philip would sometimes stay at a small cottage on the estate. He says: ""From what I was told - I never witnessed it - she would be in the kitchen cooking away and he would lay the table, so it was very much a chance for them to be a normal couple."" Alistair Cassie met the Queen on a formal visit - and unexpectedly in the corridor of the castle Crowds continued to form at Buckingham Palace on Saturday night as people paid tribute to the Queen Many took photos at the gates, where flowers have been left in memory of the monarch Six-year-old Penelope is among the people to have left tributes for the Queen near the palace As the nation continues to mourn the death of Queen Elizabeth II, here's what we know about the plans for tomorrow:  Sean CoughlanBBC News, royal correspondent Headline writers will be thinking about ""Brothers in arms"" or maybe ""Brothers in grief"" for their coverage. The sight of Princes William and Harry meeting the crowds together will become one of the stand-out and most unexpected images from what have been sombre days. With their wives, Catherine and Meghan, they greeted people in Windsor, in a way that couldn't have been predicted last week, when the Sussexes returned to the UK. The talk then was of feuds and unbridgeable differences between couples. They were said to be staying in houses close together on the Windsor estate, while emotionally many miles apart. The couple hadn't been seen together in public for more than two years. That all changed on Thursday. If William and Harry were not planning to see each other, they were brought together in ways that couldn't have been predicted. Read the full piece here King Charles III paid tribute to the Queen and spoke of the ""irreparable loss we've all suffered"" as he was formally declared monarch William, Catherine, Harry and Meghan appeared together outside Windsor Castle The group spent time greeting people and looking at tributes to the Queen Lady Louise Windsor, Princess Beatrice of York, and Sophie, Countess of Wessex, looked at tributes to the Queen in Scotland You can view the full gallery here. Chi Chi IzunduReporting from Washington DC A
small group of people were making their way to the British Embassy in
Washington DC to lay flowers and read some of the messages that people had
left. Dignitaries
are expected to continue to make their way to the embassy and pay their
respects. Wanita Harris-Wise was
carrying a small bunch of flowers and wanted to go and show her respects to the
monarch. âQueen Elizabeth was all we
knew growing up. Iâm 64 years of age and when you thought of the Queen thatâs
who the Queen was. We call our children princesses. We want our children to
grow up to be in that same honour in light of the Queen.â Wanita left a small bunch of flowers in memory of the Queen Eloise AlannaReporting from Ottawa, Canada Itâs been a very hot day
     here in the capital of Canada, Ottawa. Justin Trudeau and his
     son walked slowly up to Rideau Hall, the residency of the Governor
     General, Mary Simon - she is the representative of the monarch in Canada
     and the first indigenous person to hold that position. Itâs a quiet residency
     just out of town. Wild turkeys walk around the grounds and among the
     trees, some of which have been planted by royals. There are 14
     commonwealth realms in addition to the UK. A realm is a country whose
     monarch is the King. Canada is one of the realms and today, like in the
     UK, there was an official proclamation of the King. Trumpets sounded, the
     doors opened and the Chief Herald walked out of Rideau Hall to announce
     the King of Canada. Firstly in English and then in French, with Trudeau at
     his side, Samy Khalid, proclaimed His Royal Highness Prince Charles III,
     King. Cannon shots were fired,
     flags were raised and Guardsmen marched among the small crowd that had
     gathered.  Tributes for Queen Elizabeth II are continuing to pour in from around the world. Oliver Atkin from Bromley says he remembers meeting the monarch on the Balmoral estate in 2012 while on a family day out. She ""walked straight up to us and said hello. I remember my Mum and Dad introducing us all. She asked where we were going and took time to find out where we were from,"" he recalls. Yasmine Jamil says she ""couldn't have enough"" of stories about the Queen when she was growing up in Pakistan, and that the monarch's death felt like ""losing a dear family member"". Jimmy Staveley from Carmarthenshire in Wales tells us that he has always admired the monarch and received five letters from her after writing to her a number of times. You can read more tributes onour special BBC live page.And you can send us your own memories of the Queen and her reign byfilling in our online form. Jimmy Staveley holds up a letter from the Queen Jo CouzensReporting from Windsor Castle SJ and Julia were among the crowd at Windsor Castle Sukhjit Johal (SJ) travelled from her home in Coventry to
Windsor Castle today to pay her respects to the Queen. Just feet away when Kate, William, Harry and Meghan came
to speak to the crowd, she was disappointed not to get the chance to talk to
them. âBut honestly it was amazing to see them. Kate was bending to see all the children, if she heard
anyone say her name she would turn around and try to talk to them - like
the Queen did,"" she said. âThey really seem to understand the nation has lost the
Queen too - theyâre allowing us to grieve with them.â Julia from London was also close enough to catch a glimpse of the royals but didnât manage to speak to them. âThis morning on TV William looked very sombre
but now he was smiling. I could see Harry on the other side and he was reaching up high, trying to reach as many hands as possible,"" she said. Read more from about the scene in Windsor here. Â© 2025 BBC. The BBC is not responsible for the content of external sites.Read about our approach to external linking.",Negative,0.0029104373
