article,article_sentiment,article_score
"The withdrawal will be completed by 11 September The US has started formally withdrawing troops from Afghanistan, beginning the end of what President Joe Biden called ""the forever war"". The US and Nato have had a presence in Afghanistan for almost 20 years. But the withdrawal, which runs until 11 September, comes amid escalating violence, with Afghan security forces on high alert for reprisal attacks. The Taliban have warned they are no longer bound by an agreement not to target international troops. Under a deal signed last year between the militants and then-President Donald Trump, foreign forces were to have left by 1 May while the Taliban held off attacking international troops. Officials told Reuters during this time the Taliban has been protecting western military bases from rival Islamist groups.,externalThat has not stopped Taliban attacks on Afghan forces and civilians. US General Scott Miller warned against attacks on foreign troops as they start to withdraw. ""Make no mistake, we have the military means to respond forcefully to any type of attacks against the coalition and the military means to support the Afghan security forces,"" he said in a video posted on Twitter. Allow Twitter content? This article contains content provided by Twitter. We ask for your permission before anything is loaded, as they may be using cookies and other technologies. You may want to readTwitterâs cookie policy,externalandprivacy policy,externalbefore accepting. To view this content chooseâaccept and continueâ. US President Joe Biden last month pushed back the 1 May pullout, saying some troops would stay on until 11 September this year, the 20th anniversary of the 9/11 attacks, citing the security situation. A Taliban spokesman said ""this violation in principle has opened the way for [Taliban fighters] to take every counter-action it deems appropriate against the occupying forces"". What do US veterans think of Afghan War? 20 years in Afghanistan: Was it worth it? 'We have won the war, America has lost' But he also said Taliban fighters would await instructions from leaders before mounting attacks. Some analysts suggested with a US deadline for withdrawal in place large-scale attacks could be averted. Meanwhile the US faces the logistical challenge of packing up and leaving.The AP report the military has been taking inventory,external, deciding what will be shipped back and what will be sold as junk on Afghanistan's markets. On 11 September 2001, attacks in America killed nearly 3,000 people. Osama Bin Laden, the head of Islamist terror group al-Qaeda, was quickly identified as the man responsible. The Taliban, radical Islamists who ran Afghanistan and protected Bin Laden, refused to hand him over. So, a month after 9/11, the US launched air strikes against Afghanistan. As other countries joined the war, the Taliban were quickly removed from power. But they didn't just disappear - their influence grew back and they dug in. Since then, the US and its allies have struggled to stop Afghanistan's government collapsing, and to end deadly attacks by the Taliban. The withdrawal of US troops begins against a backdrop of fierce clashes between the Taliban and government forces, in the absence of a peace deal. A flare up of violence in Ghazni province overnight left an unknown number of people dead. And on Friday, a car bombing in Pul-e-Alam, Logar province,killed up to 30 peopleand wounded 110 - mostly school pupils. The bombing in Pul-e-Alam on Friday killed at least 24 people US President Joe Biden says the US pull-out is justified as US forces have made sure the country cannot again become a base for foreign jihadists to plot against the West. And Afghan President Ashraf Ghani says government forces are fully capable of keeping insurgents at bay. He has argued that withdrawing US and Nato forces will remove the Taliban's reason for fighting, saying to the Taliban: ""Who are you killing? What are you destroying? Your pretext of fighting the foreigners is now over."" But many do not share the optimism. ""Everyone is scared that we might go back to the dark days of the Taliban era,"" Mena Nowrozi, who works at a private radio station in Kabul told news agency AFP. ""The Taliban are still the same; they have not changed. The US should have extended their presence by at least a year or two."" BBC Pakistan and Afghanistan correspondent Secunder Kermani says that with peace talks between the militants and Afghan government stalled, despite the drawing down of international involvement, it seems inevitable the conflict will continue. This video can not be played Tens of thousands of Afghan soldiers have been killed and injured. This 2019 video tells their story. Why a US photographer says 'sorry for the war' Video, 00:03:29Why a US photographer says 'sorry for the war' Former Afghan interpreters fear death after UK exit How can the West fight terror after leaving Afghanistan? Deadly wildfires rage across LA as fierce winds threaten more destruction UK has enough gas, says No.10 after supply warning UK records coldest night of winter as freeze to last into weekend 'I paid fake doctor thousands for fillers - now I look like a gargoyle' The Papers: 'Lost Angeles' and 'Musk seeks plan to oust Starmer' Pop star Chappell Roan wins BBC Sound Of 2025 Weekly quiz: Zendaya looked happy but who else sparkled at the Golden Globes? The 20 child abuse inquiry proposals - what has happened so far? The '9/11 mastermind' wants to plead guilty. Why is the US trying to stop him? Why are UK borrowing costs rising and what does it mean for me? In maps: Thousands of acres on fire in LA Before and after: How wildfires tore through LA Ed Gamble hosts the official Traitors podcast Join Ed Gamble and guests as they dissect the first episodes of The Traitors! Can art, music and words bind us in divided times? Simon Schama explores how artists have captured the transformations of British society since 1945 Enjoy a satirical smorgasbord of The News Quiz Digest a dramatic year of news as Andy Zaltzman revels in some of 2024's funniest moments The multi-award-winning legal drama returns Two years on, the Defoes are back and have gathered for a beautiful wedding in Barcelona Â© 2025 BBC. The BBC is not responsible for the content of external sites.Read about our approach to external linking.",Negative,0.053341188
"Dirty Vegan star Matt Pritchard has been rowing the Atlantic as part of a four-man crew While most of us have spent months locked down, Dirty Vegan Matt Pritchard has completed a row of the Atlantic. TheBBC TV chefwas in a team of four crossing the ocean to raise awareness about mental health - and they reached the finish line in Antigua on Sunday. Initially setting off on the 3,200 mile trip from Lanzarote on 6 March, they had to restart from Fuerteventura a week later. They could undertake the voyage as Covid rules allow charity events. After they completed the journey, Matt posted on his Instagram account: ""I'm thirsty, hungry, tired and adopted bingo wings on my arms and calf's [sic]. ""Walking on land is very weird, it doesn't move. I'll be a cheap date tonight, one whiff of champagne and I'll be on my back mun."" Allow Instagram content? This article contains content provided by Instagram.  We ask for your permission before anything is loaded, as they may be using cookies and other technologies.  You may want to readMetaâs Instagram cookie policy,externalandprivacy policy,externalbefore accepting. To view this content chooseâaccept and continueâ. The trip, named Atlantic Dash, was initially halted because of seat problems, before their craft was holed during a tow to Fuerteventura. After Matt and crewmates Billy Taylor, Johnny Ward and Martin Heseltine had repaired the vessel they set off again. Dirty Sanchez star Matt Pritchard to host BBC vegan cookery show Farmers hit out at meat production 'propaganda' Oldest man to complete 'toughest Atlantic row' raises Â£1m Matt earlier said progress in the trip had been ""absolutely fantastic"" and had also been ""nice to be at sea during all the craziness"" of Covid. The sailors have enjoyed seeing dolphins, turtles and marlins and, for three weeks, they did not see another boat. But disaster struck for Matt, who celebrated his birthday at sea, as the end of the trip neared. The ex-pro skateboarder, from Cardiff, injured his back while rowing. The 48-year-old said: ""I pulled my right lateral muscle rowing and, as you do, I just ignored it. ""Because at the end of the day you have no other option other than to keep rowing and get on with it."" The men last saw land when the left Fuerteventura in March But after two days the pain got much worse. ""All of a sudden something went, and I was in absolute agony, and there was nothing else I could do,"" the former Dirty Sanchez star said. ""Billy said: 'You're going to have to get into the forecabin'."" Getting in the forecabin - at the front of a boat - was also ""absolute agony."" After speaking to a doctor he was advised to take painkillers they had with them. ""I'm absolutely gutted,"" Matt said. ""I've sat here, and there's loads of stuff going through my mind. ""I just feel helpless being here listening to the boys rowing. ""I want to be out there rowing with them, but I can't because I don't want to do any more damage to my lateral muscle."" He had hoped to be back as an oarsman within a day or two but he is still not in the best shape. As they neared their destination of Antigua, Matt injured a muscle in his back ""I've not come all this way to lay on my arse,"" he said. ""But at the same time I have got to be sensible, because I do not want to do longer lasting damage to myself."" By Friday, Matt was still not rowing but was making food and doing other duties. Billy said it was ""so nice"" to see him on the mend. He was laid up for a number of days but is now on the mend ""Matt's been up and about,"" he said. ""He's been cooking for everyone and making sure everyone has water. ""It's a real team, crew effort."" The four are aiming to raise Â£20,000 to be split between Dean Farm Trust and men's mental health charity Humen. YOUNG WELSH AND BOSSIN' IT:Meet the young, Welsh entrepreneurs who've been bossin' it through lockdown WHEN NUDES ARE STOLEN:Former glamour model Jess Davies uncovers the hidden trade in nude photographs Ex-SAS soldier set for solo row across Atlantic All-female crew makes Atlantic rowing history Teacher is youngest woman to row Atlantic solo Deadly wildfires rage across LA as fierce winds threaten more destruction UK has enough gas, says No.10 after supply warning UK records coldest night of winter as freeze to last into weekend 'I paid fake doctor thousands for fillers - now I look like a gargoyle' The Papers: 'Lost Angeles' and 'Musk seeks plan to oust Starmer' Pop star Chappell Roan wins BBC Sound Of 2025 Weekly quiz: Zendaya looked happy but who else sparkled at the Golden Globes? The 20 child abuse inquiry proposals - what has happened so far? The '9/11 mastermind' wants to plead guilty. Why is the US trying to stop him? Why are UK borrowing costs rising and what does it mean for me? In maps: Thousands of acres on fire in LA Before and after: How wildfires tore through LA Ed Gamble hosts the official Traitors podcast Join Ed Gamble and guests as they dissect the first episodes of The Traitors! Can art, music and words bind us in divided times? Simon Schama explores how artists have captured the transformations of British society since 1945 Enjoy a satirical smorgasbord of The News Quiz Digest a dramatic year of news as Andy Zaltzman revels in some of 2024's funniest moments The multi-award-winning legal drama returns Two years on, the Defoes are back and have gathered for a beautiful wedding in Barcelona Â© 2025 BBC. The BBC is not responsible for the content of external sites.Read about our approach to external linking.",Positive,0.99949825
"The performance took place shortly after 05:00 BST A group of Morris dancers have changed their face paint from black to blue following concerns over racism. Members of the Hook Eagle Morris Men showcased their new look at a performance near Hook, Hampshire, to mark the May Day dawn earlier. A statement was issued last year calling for dancing groups to eliminate the use of full-face black makeup. Dancer John Ellis, 70, said it was ""by far and away the biggest change"" in the group's 30-year history. The call to stop the use of black makeup on the face was issued by cross-county group the Joint Morris Organisations in June in response to the Black Lives matter movement. In a statement, it said its traditions do not operate in a vacuum. ""While no morris dancer wants to cause offence, we must recognise that full-face black or other skin tone makeup is a practice that has the potential to cause deep hurt,"" it said. Mr Ellis said other Morris troupes had adapted their face paints to different colours too, with some going green and a group in Kent opting for yellow and black stripes. The Joint Morris Organisations issued a statement in June last year calling for dancing groups to eliminate the use of full-face black makeup The group was happy to be back performing after a 16-month absence caused by the pandemic He said the tradition of covering faces with soot derived from poor farm workers in the 1400s who would use it to disguise themselves so they could beg - which was illegal at the time. That historical tradition ""died out"", he said, but was revived in the 1970s by Border Morris dancers - a dance type which originated in villages along the border of England and Wales. ""We adopted this idea because the dancing is really easy, good fun and we quite like the idea of dancing in disguise,"" Mr Ellis added. He said there were only three people in the audience on Saturday morning, including a photographer and cafe owner, but felt this was ""pretty good"" given the performance took place shortly after 05:00 BST. Mr Ellis said it was ""fantastic"" to be back performing after a 16-month absence caused by the coronavirus pandemic. Follow BBC South onFacebook,external,Twitter,external, orInstagram,external. Send your story ideas tosouth.newsonline@bbc.co.uk,external. LGBT plea over 'blackface' Pride acts Abuse probe over face-paint Morris dancers Black face-paint Morris dancers heckled Morris dancers 'mocking black people' Video, 00:00:36Morris dancers 'mocking black people' Convoy of tractors spotted on major A-road believed to be heading for Southampton Suspected drug dealers arrested after police pull over Mercedes Fundraiser for Havant motorcyclist hospitalised after incident on the M25 surpasses Â£11,000 on GoFundMe Council approves plans for bus fare caps and improved bus journey reliability Park cafe in heart of Winchester shuts due to 'personal events' and financial issues Hampshire couple hoping to start a family to appear on Ant & Dec's Limitless Win Deadly wildfires rage across LA as fierce winds threaten more destruction UK has enough gas, says No.10 after supply warning UK records coldest night of winter as freeze to last into weekend 'I paid fake doctor thousands for fillers - now I look like a gargoyle' The Papers: 'Lost Angeles' and 'Musk seeks plan to oust Starmer' Pop star Chappell Roan wins BBC Sound Of 2025 Weekly quiz: Zendaya looked happy but who else sparkled at the Golden Globes? The 20 child abuse inquiry proposals - what has happened so far? The '9/11 mastermind' wants to plead guilty. Why is the US trying to stop him? Why are UK borrowing costs rising and what does it mean for me? In maps: Thousands of acres on fire in LA Before and after: How wildfires tore through LA Ed Gamble hosts the official Traitors podcast Join Ed Gamble and guests as they dissect the first episodes of The Traitors! Can art, music and words bind us in divided times? Simon Schama explores how artists have captured the transformations of British society since 1945 Enjoy a satirical smorgasbord of The News Quiz Digest a dramatic year of news as Andy Zaltzman revels in some of 2024's funniest moments The multi-award-winning legal drama returns Two years on, the Defoes are back and have gathered for a beautiful wedding in Barcelona Â© 2025 BBC. The BBC is not responsible for the content of external sites.Read about our approach to external linking.",Positive,0.99660575
