article,article_sentiment,article_score
"This video can not be played Donald Trump attended a rally instead of the correspondents' dinner The US president has lashed out at comedian Michelle Wolf over her performance at Saturday's White House Correspondents' Dinner. Donald Trump, who skipped the event for the second year, said the ""filthy 'comedian' totally bombed"" after she targeted him and his staff. Wolf sparked both praise and condemnation for her scathing ""roasts"". The organisation behind the annual event expressed regret at the divisiveness of the after-dinner act. Margaret Talev, head of the White House Correspondents' Association, said the night was ""meant to offer a unifying message about our common commitment to a vigorous and free press while honouring the civility, great reporting and scholarship winners, not to divide people"". ""Unfortunately, the entertainer's monologue was not in the spirit of that mission,"" she said in a statement.,external Among Wolf's most controversial - and often crude - takedowns was her blistering mockery of White House press secretary Sarah Sanders. The former Daily Show contributor was criticised by some for commenting on Ms Sanders' appearance, comparing her to the matronly disciplinarian Aunt Lydia in The Handmaid's Tale, while others applauded her for attacking White House ""lies"". Wolf has denied she took aim at Ms Sanders looks, and said ""all these jokes were about her despicable behaviour"". Read more:Did comedian's Sarah Sanders 'roast' go too far? The comic shrugged off the controversy in an interview aired by National Public Radio. She said: ""I wouldn't change a single word that I said. I'm very happy with what I said, and I'm glad I stuck to my guns."" Wolff added that before she took to the stage, a friend passed her a note saying: ""Be true to yourself. Never apologise. Burn it to the ground."" Allow Twitter content? This article contains content provided by Twitter. We ask for your permission before anything is loaded, as they may be using cookies and other technologies. You may want to readTwitter’s cookie policy,externalandprivacy policy,externalbefore accepting. To view this content choose‘accept and continue’. For almost a century, it has been a tradition for US presidents to attend the White House Correspondents' Dinner and have fun poked at them. But Mr Trump has boycotted the event since winning power, choosing this year instead to hold a rally for supporters in Michigan. Trump attacks media after snubbing dinner US comedian Hasan Minhaj targets Trump at 2017 dinner President Obama pokes fun at himself Afterwards, he condemned the dinner as ""an embarrassment to everyone associated with it"". Allow Twitter content? This article contains content provided by Twitter. We ask for your permission before anything is loaded, as they may be using cookies and other technologies. You may want to readTwitter’s cookie policy,externalandprivacy policy,externalbefore accepting. To view this content choose‘accept and continue’. Some White House aides who did attend the event walked out early, saying the performance demonstrated media bias. Allow Twitter content? This article contains content provided by Twitter. We ask for your permission before anything is loaded, as they may be using cookies and other technologies. You may want to readTwitter’s cookie policy,externalandprivacy policy,externalbefore accepting. To view this content choose‘accept and continue’. Other commentators defended Wolf. But the public backlash has led some journalists to call for changes to the dinner next year. Allow Twitter content? This article contains content provided by Twitter. We ask for your permission before anything is loaded, as they may be using cookies and other technologies. You may want to readTwitter’s cookie policy,externalandprivacy policy,externalbefore accepting. To view this content choose‘accept and continue’. In her statement, Ms Talev said the White House Correspondents' Association was recognising the industry's concerns and was ""committed to hearing your views on the format going forward"". Did comedian's Sarah Sanders 'roast' go too far? 'Roasted' in Washington, Trump holds rally elsewhere. Video, 00:02:02'Roasted' in Washington, Trump holds rally elsewhere Six takes from last year's correspondents' dinner How Trump 'enemies' remark echoes tyrants Trump attacks media at 100-day rally. Video, 00:01:10Trump attacks media at 100-day rally Death toll rises amid most destructive wildfire in Los Angeles' history Moment friends abandon house as Palisades fire closes in 'Patients are collapsing in the waiting room': A&E nurses speak out Chris Mason: Is Starmer leaving the door open to an abuse inquiry? The Papers: 'Apocalypse' LA and 'Reeves faces extra tax rises' Why does Trump want Greenland and what do its people think? How Canada's immigration debate soured - and helped seal Trudeau's fate 'I can't get divorced as I can't get my pension valued' What are cold weather payments and who can get them? BBC Sound of 2025: Barry Can't Swim is a new dance music superstar Ros Atkins on...Elon Musk's political interventions Jean-Marie Le Pen - founder of French far right and 'Devil of the Republic' Delivering brand-new miracles in 1970s East End Watch the latest series of Call the Midwife on iPlayer now Mark-Anthony Turnage shares the soundtrack of his life Once called 'Britain’s hippest composer', he's tackled topics from drug abuse to football in his work Paddy’s loaf-changing experience inside the bread factory Paddy McGuinness visits the bread factory he used to work in, and sees how they make 1.4 million loaves a week What's behind the global surrogacy boom? More countries are banning surrogacy – but demand is growing © 2025 BBC. The BBC is not responsible for the content of external sites.Read about our approach to external linking.",Positive,0.9999714
"Brand praised the ""importance and significance"" of the NHS Comedian Russell Brand has cancelled the remainder of his ReBirth tour after his mother, Barbara, sustained ""life-threatening"" injuriesin a car crash. In a Twitter video he confirmed tickets will be refunded with shows ""possibly"" being rescheduled at a later date. Brand also praised the ""importance and significance"" of the NHS and said it had previously saved his mother's life six times following cancer. He added he would take a break from social media to focus on his family. The announcement follows the short-notice cancellation of a show in Aberdeen following the crash on Friday. At the time, Barbara and her driver were not thought to have had life-threatening injuries - but Brand told his Twitter followers his mother was seriously hurt and that the driver, ""a friend of mine, Tas, is making a good recovery"". Allow Twitter content? This article contains content provided by Twitter. We ask for your permission before anything is loaded, as they may be using cookies and other technologies. You may want to readTwitter’s cookie policy,externalandprivacy policy,externalbefore accepting. To view this content choose‘accept and continue’. Apologising to fans, Brand said he felt ""too sad"" to perform at the moment, but thanked those who had sent ""positive, beautiful messages"". ""If you've got tickets they'll be refunded or possibly rescheduled but I can't really imagine that and I certainly can't imagine performing at the moment because I feel too sad. ""I apologise, but obviously it's circumstances beyond my control."" Follow us onFacebook,external, on Twitter@BBCNewsEnts,external, or on Instagram atbbcnewsents,external. If you have a story suggestion emailentertainment.news@bbc.co.uk,external. Russell Brand cancels Aberdeen show Russell Brand's official website Death toll rises amid most destructive wildfire in Los Angeles' history Moment friends abandon house as Palisades fire closes in 'Patients are collapsing in the waiting room': A&E nurses speak out Chris Mason: Is Starmer leaving the door open to an abuse inquiry? The Papers: 'Apocalypse' LA and 'Reeves faces extra tax rises' Why does Trump want Greenland and what do its people think? How Canada's immigration debate soured - and helped seal Trudeau's fate 'I can't get divorced as I can't get my pension valued' What are cold weather payments and who can get them? BBC Sound of 2025: Barry Can't Swim is a new dance music superstar Ros Atkins on...Elon Musk's political interventions Jean-Marie Le Pen - founder of French far right and 'Devil of the Republic' Delivering brand-new miracles in 1970s East End Watch the latest series of Call the Midwife on iPlayer now Mark-Anthony Turnage shares the soundtrack of his life Once called 'Britain’s hippest composer', he's tackled topics from drug abuse to football in his work Paddy’s loaf-changing experience inside the bread factory Paddy McGuinness visits the bread factory he used to work in, and sees how they make 1.4 million loaves a week What's behind the global surrogacy boom? More countries are banning surrogacy – but demand is growing © 2025 BBC. The BBC is not responsible for the content of external sites.Read about our approach to external linking.",Negative,0.00023396155
"This video can not be played The second explosion targeted those at the scene of the first At least 26 people have been killed in two bombings in the Afghan capital Kabul, including several journalists documenting the scene. AFP chief photographer in Kabul, Shah Marai, is among the victims. The first explosion was carried out by an attacker on a motorbike. A second followed about 15 minutes later after a crowd, including several reporters, had gathered at the scene. The Islamic State group (IS) said it had carried out the attack. It was one of several fatal incidents on Monday. BBC reporter Ahmad Shah was also killed in a separate attack in the Khost region. And in a third attack, 11 children were killed in a suicide bombing intended to target Nato troops in Kandahar province. In the Kabul attack, the AFP news agency said the second blast had deliberately targeted the group of journalists, including its photographer Shah Marai. Allow Twitter content? This article contains content provided by Twitter. We ask for your permission before anything is loaded, as they may be using cookies and other technologies. You may want to readTwitter’s cookie policy,externalandprivacy policy,externalbefore accepting. To view this content choose‘accept and continue’. ""The bomber disguised himself as a journalist and detonated himself among the crowd,"" AFP quoted a police spokesman as saying. Nine journalists and photographers and four police officers, were among the dead, officials say. So far, 45 people have been reported injured. Radio Free Europe/Radio Liberty confirmed that three of its journalists,externalwere killed in the attack. Abadullah Hananzai, a journalist and cameraman, had been working on a story about narcotics, while Maharram Durrani worked on the weekly women's programme. Sabawoon Kakar had earlier been listed as injured, but died later in hospital Tolo News said its cameraman Yar Mohammad Tokhi,externalwas among the victims Afghanistan's 1TV said reporter Ghazi Rasooli and cameraman Nowroz Ali Rajabi had been killed,external The intelligence services headquarters had been the target, IS said in a statement released through its self-styled news outlet Amaq. In pictures: Remembering photographer Shah Marai The hell of losing loved ones in Afghanistan The Shashdarak district also houses the defence ministry and a Nato compound. ""This is the deadliest day for Afghan media in the past 15 years,"" the head of Tolo News TV, Lotfullah Najafizada, told the BBC. ""We went, all of us, to the blast site. We said: 'If you killed an entire line of journalists reporting here, in five hours time we're back here; the line is longer; the queue is longer and the resolve is greater."" Bombings in the Afghan capital are not uncommon. Earlier in April, a suicide bomb at a voter registration killed almost 60 people and injured 119, in an attack claimed by the Islamic State group. The Taliban also remain active in the country, only 30% of which is under full government control,according to BBC research published earlier this year. Photo by Shah Marai: An Afghan girl scavenges for recyclables, 2011 AFP paid tribute to Shah Marai, who it said had six children, including a newborn baby. ""This is a devastating blow,"" global news director Michele Leridon said. ""We can only honour the extraordinary strength, courage and generosity of a photographer who covered often traumatic, horrific events with sensitivity and consummate professionalism."" A shooting in Khost province resulted in the death of a BBC reporter. ""It is with great sadness that the BBC can confirm the death of BBC Afghan reporter Ahmad Shah following an attack earlier today,"" said Jamie Angus, director of the BBC World Service. Ahmad Shah, 29, was killed by unknown attackers in Khost ""Ahmad Shah was 29.  He had worked for the BBC Afghan service for more than a year and had already established himself as a highly capable journalist who was a respected and popular member of the team. ""This is a devastating loss and I send my sincere condolences to Ahmad Shah's friends and family and the whole BBC Afghan team. ""We are doing all we can to support his family at this very difficult time."" Local police are investigating a motive. Also on Monday, a suicide bomb attack in the Kandahar region killed 11 schoolchildren and injured many more. The bomber appeared to have been targeting a military vehicle convoy in Daman district, but the explosion struck a nearby religious school. In addition to the dead, more than a dozen children were reported injured in the blast. Nato forces operate from a base in the area, and Nato officials confirmed that some of its people had been injured, as had Afghan police. Eight of the injured were of Romanian nationality, Nato said, but all were in stable condition. No group has yet said it carried out the Kandahar attack. Afghan voter centre blast kills dozens Taliban 'threaten 70% of Afghanistan' Afghan Taliban announce spring offensive The hell of losing loved ones in Afghanistan Death toll rises amid most destructive wildfire in Los Angeles' history Moment friends abandon house as Palisades fire closes in 'Patients are collapsing in the waiting room': A&E nurses speak out Chris Mason: Is Starmer leaving the door open to an abuse inquiry? The Papers: 'Apocalypse' LA and 'Reeves faces extra tax rises' Why does Trump want Greenland and what do its people think? How Canada's immigration debate soured - and helped seal Trudeau's fate 'I can't get divorced as I can't get my pension valued' What are cold weather payments and who can get them? BBC Sound of 2025: Barry Can't Swim is a new dance music superstar Ros Atkins on...Elon Musk's political interventions Jean-Marie Le Pen - founder of French far right and 'Devil of the Republic' Delivering brand-new miracles in 1970s East End Watch the latest series of Call the Midwife on iPlayer now Mark-Anthony Turnage shares the soundtrack of his life Once called 'Britain’s hippest composer', he's tackled topics from drug abuse to football in his work Paddy’s loaf-changing experience inside the bread factory Paddy McGuinness visits the bread factory he used to work in, and sees how they make 1.4 million loaves a week What's behind the global surrogacy boom? More countries are banning surrogacy – but demand is growing © 2025 BBC. The BBC is not responsible for the content of external sites.Read about our approach to external linking.",Negative,3.9549357e-14
"Michel Barnier said the Republic of Ireland has the support of all EU member states There can be no Brexit withdrawal agreement without a ""backstop"" option for the Irish border, the EU's chief Brexit negotiator has said. Michel Barnier said the Republic of Ireland has the full support of all EU member states and all EU institutions. The backstop would involve NI, or the UK as a whole, aligning with the EU rules required to support North-South cooperation and an all-island economy. Mr Barnier was speaking atthe start of a two-day visit to Ireland. The UK has accepted the need for a backstop to be written into the Brexit withdrawal agreement. Analysis: Brexit brokers and backstop ‘bingo’ Q&A: Brexit and the Irish border Long read: The hardest border But it has not agreed what EU rules it should cover. At the beginning of the all-island Brexit forum in Dundalk, County Louth, Mr Barnier said he knows that the so-called backstop has been the subject of ""heated discussions in the UK"". ""To be clear: without a backstop, there can be no withdrawal agreement,"" said Mr Barnier. ""This is an EU issue, not only an Irish issue."" It almost became Brexit bingo - as journalists lost count of how many times Mr Barnier referenced the ""backstop"" option for the Irish border. The backstop would mean that in the absence of any other solution, Northern Ireland, or the UK as a whole, would align with EU rules required to support north-south cooperation and an all-island economy. While in principle the UK signed up to this option, precise detail on it has yet to appear. Mr Barnier's three points were: The UK government has agreed to a backstop and knows that without it there is no withdrawal agreement The EU is not using the backstop as a negotiating tactic The backstop is necessary to protect the integrity of the customs union and single market In brief - the backstop was agreed - so let's get on with it. Read more from Jayne here Mr Barnier also denied claims from Arlene Foster, the leader of the Democratic Unionist Party (DUP), that he has been ""aggressive"" towards Northern Ireland unionists in the Brexit talks. The DUP leader said earlier that Mr Barnier did not understand the dispute and was not an ""honest broker"". In response, the EU's chief Brexit negotiator said he was not ready to engage in ""polemics"" with Mrs Foster. Mr Barnier's visit comes amid rising tensions over the future UK-Ireland border. He told a press conference in Dundalk at the beginning of the all-island Brexit forum that his ""door is open"" to Mrs Foster and the DUP. He said he had not approached the negotiations in a ""spirit of revenge"". This video can not be played DUP leader Arlene Foster: Brexit negotiations have 'become aggressive' He added that he regretted the UK had voted to leave the EU, and said he was determined to work with the UK to find a solution to the Irish border issue. The all-island Brexit forum is being hosted by the Taoiseach (Irish prime minister) Leo Varadkar and his deputy, Simon Coveney. On Sunday,Mr Barnier said the UKwas contradicting itself over its Irish border policy. But Mrs Foster said she believes Mr Barnier does not understand the dispute and is ""not an honest broker"". In return, he said that Mrs Foster needed to respect that his role was to negotiate on behalf of the EU and not to act as a mediator. Meanwhile the Taoiseach again there needed to be ""meaningful progress"" on the border issue by the June EU summit. Mr Varadkar said otherwise it would be difficult to get thewithdrawal agreementin place by October. The two-day all-island Brexit forum began on Monday In December, the UK and EU reached a political agreement in which the UK committed to protecting north-south cooperation on the island of Ireland. It also guaranteed there would be no hard border, including physical infrastructure or related checks and controls. However, the EU's proposed backstop solution to avoid a hard border - keeping Northern Ireland in the customs union after Brexit - continues to be at odds with what the UK government and the DUP say they would accept. Mrs Foster told BBC political editor Laura Kuenssberg the DUP would not accept Northern Ireland being treated differently to the rest of the UK. Arlene Foster has warned Michel Barnier the DUP will not accept Northern Ireland being treated differently to the rest of the UK She said: ""Michel Barnier's trying to present himself as someone who cares deeply about Northern Ireland and if that is the case he needs to hear the fact that we are part of the United Kingdom [and] will remain part of the United Kingdom constitutionally, politically and economically. ""Therefore his proposal of us being in an all-Ireland regulatory scenario with a border down the Irish Sea simply does not work. ""It does not work constitutionally, politically and it certainly does not work from an economic perspective."" This video can not be played The Irish border bridge where stakes are high Mrs Foster added: ""We've tried to get him to understand the unionist position for the people of Northern Ireland but he hasn't really responded and I'm disappointed about that. ""I don't think he does understand the wider unionist culture of Northern Ireland."" The DUP is also expressing annoyance that Mr Varadkar is visiting Northern Ireland later without giving notice. Mr Barnier is due to meet Mr Varadkar on Monday and will also speak to business leaders on both sides of the Irish border during his trip. Brexit brokers and backstop ‘bingo’ Barnier begins two-day visit to Ireland Fourth all-island Brexit forum to be held UK must resolve border 'contradictions' On the bridge over the Brexit border. Video, 00:04:57On the bridge over the Brexit border Death toll rises amid most destructive wildfire in Los Angeles' history Moment friends abandon house as Palisades fire closes in 'Patients are collapsing in the waiting room': A&E nurses speak out Chris Mason: Is Starmer leaving the door open to an abuse inquiry? The Papers: 'Apocalypse' LA and 'Reeves faces extra tax rises' Why does Trump want Greenland and what do its people think? How Canada's immigration debate soured - and helped seal Trudeau's fate 'I can't get divorced as I can't get my pension valued' What are cold weather payments and who can get them? BBC Sound of 2025: Barry Can't Swim is a new dance music superstar Ros Atkins on...Elon Musk's political interventions Jean-Marie Le Pen - founder of French far right and 'Devil of the Republic' Delivering brand-new miracles in 1970s East End Watch the latest series of Call the Midwife on iPlayer now Mark-Anthony Turnage shares the soundtrack of his life Once called 'Britain’s hippest composer', he's tackled topics from drug abuse to football in his work Paddy’s loaf-changing experience inside the bread factory Paddy McGuinness visits the bread factory he used to work in, and sees how they make 1.4 million loaves a week What's behind the global surrogacy boom? More countries are banning surrogacy – but demand is growing © 2025 BBC. The BBC is not responsible for the content of external sites.Read about our approach to external linking.",Positive,1.0
