article,article_sentiment,article_score
"This video can not be played Chancellor Rishi Sunak: ""Our recovery comes with a cost"" Rishi Sunak has told Conservative party members that future tax cuts are conditional on repairing the UK's public finances after Covid. In his first conference speech as chancellor, he said he wanted lower taxes - but funding the pandemic recovery ""comes with a cost"". Vowing that ""we need to fix our public finances"", he said allowing borrowing to rise further would be ""immoral"". The comments come three weeks before his autumn Budget on 27 October. He also told party delegates that leaving the EU was in the UK's long-term interests, despite current disruption to fuel and food supplies. And he added he was ""proud"" to have backed Brexit, in spite of warnings before the 2016 referendum it could end his political career. PM: UK in period of adjustment after Brexit Sunak: No magic wand to solve supply problems Mr Sunak's speech comes amid a difficult backdrop of rising food and energy prices, alongside supply chain disruption caused by a shortage of lorry drivers. The government has so far rejected demands from the haulage industry for it to increase the 5,000 temporary visas it plans for foreign drivers to plug shortfalls. In his speech, Mr Sunak insisted that despite ""challenges"", Brexit would foster a ""culture of enterprise"" and help the UK adapt to the modern world. He also defendedraising taxesto pay for the NHS and social care, insisting that it would be ""irresponsible"" to pay for investment with higher borrowing instead. He told delegates the country should be grateful for ""sound Conservative management"" of the economy by his predecessors since 2010. And whilst he acknowledged tax rises were unpopular and perceived as ""un-Conservative"", he said they were a better option than more debt. ""I'll tell you what is un-Conservative: Unfunded pledges, reckless borrowing, and soaring debt,"" he added. ""Yes, I want tax cuts. But in order to do that, our public finances must be put back on a sustainable footing."" There was no whizz-bangery in the chancellor's speech - no cranking of the huge economic levers on tax or spending, no huge headline grabbing policy. And, a little like Rishi Sunak himself, it was quite short. (He made a little joke about his stature himself...) This felt like the first draft of Sunak-ism: where the chancellor has come from, what he's all about, where he might go in the future, to an audience where many will wonder if he might one day be prime minister. There were repeated references to his time in California, that spot so often associated with sunshine and innovation. After the public spending splurges of the pandemic, he portrayed himself as a traditional Conservative: cautious in how taxpayers' money is spent, drawn to cut taxes when he can - even though he's put them up. This hoodie-wearing chancellor - although he did wear a suit for his speech - made 16 references to the ""future,"" including the line ""the future is here."" Whom could he have been referring to? Against the backdrop of the withdrawal of a£20-a-week universal credit top-up, Mr Sunak also attacked Labour - which opposes the cut - for wanting struggling families to ""lean ever more on the state"". ""Is the answer to their hopes and dreams just to increase their benefits?,"" he asked, adding: ""Be in no doubt, that is the essence of the Labour answer"". ""Not only does Labour's approach not work in practice, it is a desperately sad vision for our future."" ""But there is an alternative. An approach focused on good work, better skills, and higher wages."" Mr Sunak also announced the government would give funding to double the number of Turing research fellows investigating the potential of artificial intelligence. He also committed £500m to renew job support programmes set up during the Covid pandemic, after the end of the furlough scheme last month. The Kickstart Scheme - which subsidises eligible jobs for young people on universal credit - will be extended by three months to March 2022. And the JETS scheme, which helps long-term unemployed people on universal credit, will be prolonged until September 2022. The Treasury said that details will be confirmed at the Spending Review, which will take place alongside the Budget later this month. Most roles not filled in plan to help young jobless PM: UK in period of adjustment after Brexit Night-time curfew imposed in fire-hit areas of LA as police warn against 'despicable' looting 'I have nothing to go back to' - BBC reporter tells of LA fires heartbreak Trump avoids prison or fine in hush-money case sentencing LA fires: How three days of devastation unfolded What's the latest on the Los Angeles wildfires and what caused them? The '9/11 mastermind' wants to plead guilty. Why is the US trying to stop him? Pop star Chappell Roan wins BBC Sound Of 2025 Weekly quiz: Zendaya looked happy but who else sparkled at the Golden Globes? Inside the UK's first legal drug consumption room Sheen to fund new national theatre for Wales Danes struggle with response to Trump Greenland threat The Upbeat newsletter: Start your week on a high with uplifting stories delivered to your inbox Dragons’ Den returns with a new line-up of celebrity guests Can a fresh batch of entrepreneurs secure the deal of a lifetime? Are smart scales really as ‘smart’ as they claim to be? Greg Foot explores whether they can accurately measure weight, body fat, muscle and bone mass The award-winning psychological competition is back A nail-biting game of detection, backstabbing and trust. Who will make it through? How close are we to a cancer vaccine? How might it help in the treatment of the disease? © 2025 BBC. The BBC is not responsible for the content of external sites.Read about our approach to external linking.",Negative,5.0931006e-17
"About 200 servicemen and women from the Army and RAF have been drafted in to deliver fuel. One in five forecourts in London and the south-east of England is still without fuel, the body that represents independent fuel sellers has said. The Petrol Retailers Association (PRA) said there had been a ""marked improvement"" across the rest of the UK thanks to ""steady deliveries"". But conditions in the South East are ""still challenging"", the PRA said. The improvement in supplies has led to forecourt firm EG Group to remove its £30 cap on buying fuel at its sites. It said purchases were returning to normal levels in the majority of places, apart from the south of England. However, the company, which has about 400 sites in the UK, added it expected supply issues to ease ""in the coming days"" due to the military driving tankers to restore supplies. About 200 servicemen and women from the Army and RAF have been drafted in to deliver fuel from depots to forecourts. The PRA said the situation around London and the South East was ""still challenging"". In these areas, it said 62% of the sites surveyed had both grades of fuel available, 18% had only one grade and 20% were dry. In the rest of the country, the trade body said 86% of sites had both grades of fuel ""thanks to steady deliveries and stabilising demand"", with 6% having only one grade and 8% being dry. ""We are grateful for the support lent by the government through their provision of military drivers, although further action must be taken to address the needs of disproportionately affected areas,"" said Gordon Balmer, executive director of the PRA. The PRA represents the interests of the independent filling stations across the UK, which account for nearly 5,500 of the UK's 8,380 forecourts. Is the petrol shortage improving? The government has been criticised for not deploying the military earlier after panic-buying led to chaos and queues on some petrol station forecourts. More than 65 drivers will start work, with plans to increase this to 200 personnel to be deployed in total, including 100 drivers. The drivers have undertaken refresher training with the fuel delivery firm, Hoyer in order to take on the work. Hoyer said the training included company safety procedures as well as equipment familiarisation and forecourt driving manoeuvres. A government spokesperson said there were signs of improvement in average forecourt stocks across the UK, adding that demand was ""continuing to stabilise"". ""More than half of those who have completed training to make fuel deliveries are being deployed to terminals serving London and the South-East of England, demonstrating that the sector is allocating drivers to areas most affected in this first phase from Monday,"" the spokesperson said. 23 September:BP temporarily closes some petrol stationsdue to a shortage of lorry drivers 25 September:After days of long queues at stations, with many running dry, the governmentannounces a temporary visa scheme, allowing 5,000 lorry drivers to work in the UK in the run-up to Christmas 27 September:The Army is put on standbyto help deliver fuel to stations hit by shortages 28 September:Prime Minister Boris Johnsonsays the situation at forecourts is ""stabilising"", while the PRA says there are ""early signs"" pressure is starting to ease at pumps 2 October:Despite a ""distinct improvement"" nationwide,the PRA says petrol supplies remain critical in London and south-east England 4 October: Army starts to deliver fuel to speed up replenishments The crisis began more than 10 days ago when BP said it had run out of petrol in a number of its outlets. That prompted motorists to fill up more than usual, leaving deliveries unable to keep up with demand. Many sectors of the UK economy, including food firms and petrol retailers, have been affected by a chronic shortage of lorry drivers, which the haulage industry has blamed on factors including Covid, Brexit, an aging workforce, and tax changes. David Charman, who runs Parkfoot Garage in West Malling in Kent, told the BBC's Today programme there was a big task ahead to restore supplies. ""This is not panic-buying anymore, this is people that have waited as long as they possibly can and now they have no fuel. We're having to push cars that are in the queue to get to our site because they've run out of fuel,"" he said. ""We didn't have the normal two days of stock underground... because of Covid but we were still managing the situation perfectly well. But now, when we're all empty, it needs a huge influx of fuel deliveries to everybody, not just to me, to ensure that we can get through this."" Are you affected by issues covered in this story?  Share your stories and video by emailinghaveyoursay@bbc.co.uk,external. Please include a contact number if you are willing to speak to a BBC journalist. You can also get in touch in the following ways: WhatsApp:+44 7756 165803 Tweet:@BBC_HaveYourSay,external Upload pictures or video Please read ourterms & conditionsandprivacy policy If you are reading this page and can't see the form you will need to visit the mobile version of theBBC websiteto submit your question or comment or you can email us atHaveYourSay@bbc.co.uk,external. Please include your name, age and location with any submission. Fuel issues persist in south but 'over' elsewhere Military to deliver petrol to garages from Monday Comments can not be loaded To load Comments you need to enable JavaScript in your browser Night-time curfew imposed in fire-hit areas of LA as police warn against 'despicable' looting 'I have nothing to go back to' - BBC reporter tells of LA fires heartbreak Trump avoids prison or fine in hush-money case sentencing LA fires: How three days of devastation unfolded What's the latest on the Los Angeles wildfires and what caused them? The '9/11 mastermind' wants to plead guilty. Why is the US trying to stop him? Pop star Chappell Roan wins BBC Sound Of 2025 Weekly quiz: Zendaya looked happy but who else sparkled at the Golden Globes? Inside the UK's first legal drug consumption room Sheen to fund new national theatre for Wales Danes struggle with response to Trump Greenland threat The Upbeat newsletter: Start your week on a high with uplifting stories delivered to your inbox Dragons’ Den returns with a new line-up of celebrity guests Can a fresh batch of entrepreneurs secure the deal of a lifetime? Are smart scales really as ‘smart’ as they claim to be? Greg Foot explores whether they can accurately measure weight, body fat, muscle and bone mass The award-winning psychological competition is back A nail-biting game of detection, backstabbing and trust. Who will make it through? How close are we to a cancer vaccine? How might it help in the treatment of the disease? © 2025 BBC. The BBC is not responsible for the content of external sites.Read about our approach to external linking.",Negative,5.736869e-16
"About 200 servicemen and women from the Army and RAF have been drafted in to deliver fuel. One in five forecourts in London and the south-east of England is still without fuel, the body that represents independent fuel sellers has said. The Petrol Retailers Association (PRA) said there had been a ""marked improvement"" across the rest of the UK thanks to ""steady deliveries"". But conditions in the South East are ""still challenging"", the PRA said. The improvement in supplies has led to forecourt firm EG Group to remove its £30 cap on buying fuel at its sites. It said purchases were returning to normal levels in the majority of places, apart from the south of England. However, the company, which has about 400 sites in the UK, added it expected supply issues to ease ""in the coming days"" due to the military driving tankers to restore supplies. About 200 servicemen and women from the Army and RAF have been drafted in to deliver fuel from depots to forecourts. The PRA said the situation around London and the South East was ""still challenging"". In these areas, it said 62% of the sites surveyed had both grades of fuel available, 18% had only one grade and 20% were dry. In the rest of the country, the trade body said 86% of sites had both grades of fuel ""thanks to steady deliveries and stabilising demand"", with 6% having only one grade and 8% being dry. ""We are grateful for the support lent by the government through their provision of military drivers, although further action must be taken to address the needs of disproportionately affected areas,"" said Gordon Balmer, executive director of the PRA. The PRA represents the interests of the independent filling stations across the UK, which account for nearly 5,500 of the UK's 8,380 forecourts. Is the petrol shortage improving? The government has been criticised for not deploying the military earlier after panic-buying led to chaos and queues on some petrol station forecourts. More than 65 drivers will start work, with plans to increase this to 200 personnel to be deployed in total, including 100 drivers. The drivers have undertaken refresher training with the fuel delivery firm, Hoyer in order to take on the work. Hoyer said the training included company safety procedures as well as equipment familiarisation and forecourt driving manoeuvres. A government spokesperson said there were signs of improvement in average forecourt stocks across the UK, adding that demand was ""continuing to stabilise"". ""More than half of those who have completed training to make fuel deliveries are being deployed to terminals serving London and the South-East of England, demonstrating that the sector is allocating drivers to areas most affected in this first phase from Monday,"" the spokesperson said. 23 September:BP temporarily closes some petrol stationsdue to a shortage of lorry drivers 25 September:After days of long queues at stations, with many running dry, the governmentannounces a temporary visa scheme, allowing 5,000 lorry drivers to work in the UK in the run-up to Christmas 27 September:The Army is put on standbyto help deliver fuel to stations hit by shortages 28 September:Prime Minister Boris Johnsonsays the situation at forecourts is ""stabilising"", while the PRA says there are ""early signs"" pressure is starting to ease at pumps 2 October:Despite a ""distinct improvement"" nationwide,the PRA says petrol supplies remain critical in London and south-east England 4 October: Army starts to deliver fuel to speed up replenishments The crisis began more than 10 days ago when BP said it had run out of petrol in a number of its outlets. That prompted motorists to fill up more than usual, leaving deliveries unable to keep up with demand. Many sectors of the UK economy, including food firms and petrol retailers, have been affected by a chronic shortage of lorry drivers, which the haulage industry has blamed on factors including Covid, Brexit, an aging workforce, and tax changes. David Charman, who runs Parkfoot Garage in West Malling in Kent, told the BBC's Today programme there was a big task ahead to restore supplies. ""This is not panic-buying anymore, this is people that have waited as long as they possibly can and now they have no fuel. We're having to push cars that are in the queue to get to our site because they've run out of fuel,"" he said. ""We didn't have the normal two days of stock underground... because of Covid but we were still managing the situation perfectly well. But now, when we're all empty, it needs a huge influx of fuel deliveries to everybody, not just to me, to ensure that we can get through this."" Are you affected by issues covered in this story?  Share your stories and video by emailinghaveyoursay@bbc.co.uk,external. Please include a contact number if you are willing to speak to a BBC journalist. You can also get in touch in the following ways: WhatsApp:+44 7756 165803 Tweet:@BBC_HaveYourSay,external Upload pictures or video Please read ourterms & conditionsandprivacy policy If you are reading this page and can't see the form you will need to visit the mobile version of theBBC websiteto submit your question or comment or you can email us atHaveYourSay@bbc.co.uk,external. Please include your name, age and location with any submission. Fuel issues persist in south but 'over' elsewhere Military to deliver petrol to garages from Monday Comments can not be loaded To load Comments you need to enable JavaScript in your browser Night-time curfew imposed in fire-hit areas of LA as police warn against 'despicable' looting 'I have nothing to go back to' - BBC reporter tells of LA fires heartbreak Trump avoids prison or fine in hush-money case sentencing LA fires: How three days of devastation unfolded What's the latest on the Los Angeles wildfires and what caused them? The '9/11 mastermind' wants to plead guilty. Why is the US trying to stop him? Pop star Chappell Roan wins BBC Sound Of 2025 Weekly quiz: Zendaya looked happy but who else sparkled at the Golden Globes? Inside the UK's first legal drug consumption room Sheen to fund new national theatre for Wales Danes struggle with response to Trump Greenland threat The Upbeat newsletter: Start your week on a high with uplifting stories delivered to your inbox Dragons’ Den returns with a new line-up of celebrity guests Can a fresh batch of entrepreneurs secure the deal of a lifetime? Are smart scales really as ‘smart’ as they claim to be? Greg Foot explores whether they can accurately measure weight, body fat, muscle and bone mass The award-winning psychological competition is back A nail-biting game of detection, backstabbing and trust. Who will make it through? How close are we to a cancer vaccine? How might it help in the treatment of the disease? © 2025 BBC. The BBC is not responsible for the content of external sites.Read about our approach to external linking.",Negative,0.4773313
"The chairman of supermarket chain Morrisons has insisted the supermarket will be able to deliver a ""good"" Christmas for customers despite supply chain issues. Andy Higginson said he was ""not worried"" about logistical issues with supermarkets supplying products. He said the issues were ""well publicised"" and ""slightly overblown"". His comments come just two days after US private equity firm CD&R won an auction to buy Morrisons. The £7bn ($9.5bn) bid for the UK's fourth-largest supermarket chain from Clayton, Dubilier & Rice (CD&R) just trumped an offer from rival suitor Fortress. The takeover will mark a return to the UK grocery sector for Terry Leahy, the former chief executive of Tesco, who is a senior adviser to CD&R. There has been speculation that Mr Leahy will become the new chairman of Morrisons, as Mr Higginson will stand down from his post once the deal with CD&R is completed. Morrisons warns driver shortage will raise prices Visas won't solve petrol supply issues - retailers Morrisons to stop selling plastic carrier bags Morrisons owns a quarter of its suppliers, including fisheries and meat production operations, and Mr Higginson said that was one of the reasons the private equity firm had found the business attractive. ""Private equity gets a bit of a bad rap sometimes,"" Mr Higginson said. He added that private equity is ""focused on growth and trying to grow businesses - it's the way they make returns... and that's very much the case here"". The supermarket chain has arrangements with 2,700 British farmers, who deliver livestock and produce directly to its 17 food processing facilities, which supply 493 stores. ""Supply chains in the UK are incredibly efficient and I'm sure we'll be able to deliver a great Christmas for customers as we go through,"" Mr Higginson added. ""I think it'll be a good Christmas for people, I think they'll want to treat themselves"". Rewind to the start of the summer, and the supermarket chain Morrisons is a stock market plodder, a company to be invested in for its healthy dividend rather than any hope of a big rise in the share price. It's a British supermarket, and we all know that the UK grocery market is fiercely competitive with big players that are well-entrenched and little hope of rapid growth. That was the orthodoxy, and the events of the past four months have made it look a little silly. Then, Morrisons shares hovered around 180p. On Saturday, a private-equity-led consortium won an auction to buy the company at 287p a share. Those fund managers who dismissed Morrison's prospects and chose not to own the shares have missed out on a pound-a-share payday. What did the City miss? According to Andy Higginson, Morrison's outgoing chairman - like the company's other non-executive directors, he will leave when the deal is completed - the Square Mile's fund managers could not see the ""inherent strength"" of the chain, which owns many of its store freeholds, has its own food production assets, and a pension scheme in surplus. Mr Higginson said Morrisons was not alone in having been undervalued, describing it as a ""sector problem"". That idea that supermarkets in general are neglected by the City raises the intriguing prospect that other chains may find themselves being wooed by private investor groups. Last month, the supermarket warned that it expected the UK's lorry driver shortage to push up prices this year. It said the lack of drivers, plus higher freight charges and commodity prices, could lead to higher prices. However, it also said it would seek to mitigate those and other potential cost increases, such as any incurred in maintaining good product availability. Morrisons was founded in Bradford in 1899 - where it still has its headquarters. The group has almost 500 shops and more than 110,000 staff. The business was founded by William Morrison, and his son, the late Sir Ken Morrison, ran the business for 50 years. US firm wins auction to take over Morrisons Morrisons warns driver shortage will raise prices Visas won't solve petrol supply issues - retailers Comments can not be loaded To load Comments you need to enable JavaScript in your browser Night-time curfew imposed in fire-hit areas of LA as police warn against 'despicable' looting 'I have nothing to go back to' - BBC reporter tells of LA fires heartbreak Trump avoids prison or fine in hush-money case sentencing LA fires: How three days of devastation unfolded What's the latest on the Los Angeles wildfires and what caused them? The '9/11 mastermind' wants to plead guilty. Why is the US trying to stop him? Pop star Chappell Roan wins BBC Sound Of 2025 Weekly quiz: Zendaya looked happy but who else sparkled at the Golden Globes? Inside the UK's first legal drug consumption room Sheen to fund new national theatre for Wales Danes struggle with response to Trump Greenland threat The Upbeat newsletter: Start your week on a high with uplifting stories delivered to your inbox Dragons’ Den returns with a new line-up of celebrity guests Can a fresh batch of entrepreneurs secure the deal of a lifetime? Are smart scales really as ‘smart’ as they claim to be? Greg Foot explores whether they can accurately measure weight, body fat, muscle and bone mass The award-winning psychological competition is back A nail-biting game of detection, backstabbing and trust. Who will make it through? How close are we to a cancer vaccine? How might it help in the treatment of the disease? © 2025 BBC. The BBC is not responsible for the content of external sites.Read about our approach to external linking.",Positive,0.97949904
