article,article_sentiment,article_score
"This video can not be played Footage from the arresting officer's bodycam has been shown to the jury at Mr Stokes' trial. England cricketer Ben Stokes told a court he ""stepped in"" to defend two gay men before an alleged brawl. The Durham all-rounder is one of two men accused of fighting outside a Bristol nightclub on 25 September. Mr Stokes, 27, denies affray and says he acted in self defence. He said he had drunk up to three pints and six vodka and lemonades but was not drunk. Ryan Ali, 28, has also denied affray while Ryan Hale, 27, was acquitted at Bristol Crown Court of affray earlier. Giving evidence for the first time, Mr Stokes told the court he intervened when he heard Mr Hale and Mr Ali ""shouting homophobic comments"" at two gay men, Kai Barry and William O'Connor. He told the jury: ""I stepped in and said 'you shouldn't be saying these things to these two men'."" The prosecution has accused Mr Stokes of mimicking the voices and mannerisms of Mr Barry and Mr O'Connor in what was described as ""a derogatory way"". Mr Stokes was asked by his barrister Gordon Cole QC if any of his actions towards the two gay men outside Mbargo nightclub were homophobic. The cricketer told the court: ""Definitely not. The only comments between myself and this gay couple was about what we was wearing that night."" Prosecutors previously told the court Mr Ali, who they say had been holding a glass beer bottle, and Mr Hale were knocked unconscious by Mr Stokes. Ben Stokes has begun giving evidence in his defence in court When asked what was ""the first action in any violence"" Mr Stokes replied: ""Mr Ali turning the bottle he had. He took the neck of the bottle."" Mr Stokes said he had been ""protecting himself"" and the people around him when he got involved in the fight. He said: ""I took the decision for what I did very quickly. As soon as this episode started I knew not just myself but other people could be a target of these two men. He added: ""As soon as I decided to get involved, everything I did was under self-defence. I did what I could to keep myself and those around me safe."" When asked if he had become ""enraged"" at any point during the incident, Mr Stokes replied it was a ""difficult question to answer"". The 6ft 2in tall sportsman added: ""I didn't know they could be carrying more weapons on them. ""They could decide to attack me at any time if I was to turn my back on either of these two. ""At all times I felt under threat from these two."" Mr Stokes, who was dressed in court in a blue suit, white shirt and blue tie, said that after a win against the West Indies he had celebrated at the ground then had two or three pints with a meal. After the meal, Mr Stokes and some of his England teammates went to Mbargo, where they drank five or six vodka and lemonades. Mr Cole asked: ""Were you drunk?"" ""No,"" Mr Stokes replied. The cricketer said a large group then decided to go to the Pryzm nightclub instead. Mr Cole showed the jury a photograph of Mr Stokes and teammates James Anderson, Jake Ball and Alex Hales taken outside Pryzm. He then returned to Mbargo in a taxi with Mr Hales. Mr Stokes said there was nothing unusual in how he had behaved in his dealings with nightclub doorman Andrew Cunningham. When asked by Mr Cole if he had become enraged at some point, Mr Stokes said: ""No."" He also said he did not remember flicking his cigarette at the gay couple outside the club. Ryan Hale has been found not guilty of affray The court heard earlier that former soldier Mr Hale told police in a formal interview he believed Mr Stokes could have killed him. He added: ""I'm a dad. He could have killed me. I don't know why he didn't stop."" Mr Stokes, of Castle Eden, Durham, and Mr Ali, of Bristol, both deny a joint charge of affray. The trial continues. Ben Stokes trial: CCTV footage of fight. Video, 00:00:31Ben Stokes trial: CCTV footage of fight Ben Stokes 'spiteful before fight' Ben Stokes 'mocked gay men before fight' HM Courts & Tribunals Service Great British Pub Awards runner-up donates prize money to local charity New Met Office weather warning as big freeze looms after snow, sleet and rain Flu pressures build on both of Bristol's two hospitals ‘Hotter than a Turbo Island bonfire’ Sound engineer crafts device to play records through digital set up X-Press makes a Mark on local charity Hollywood Hills in flames amid most destructive wildfire in Los Angeles' history In maps: Thousands of acres on fire in LA Commuters warned of icy roads as cold snap continues to freeze UK Sound Of 2025: Ezra Collective are 'keeping music real' The Papers: 'Apocalypse' LA and 'Reeves faces extra tax rises' How Australia's beach cabana drama sparked a turf war Visa row fuels anxiety for Indians eyeing American dream 'I thought I was going to die': Jailed Venezuelan activist details brutality of prison life The man who could become Canada's future PM 'Trump 2.0' looms large over the global economy A politician was shot dead in Bangkok. Did another country do it? Chris Mason: Is Starmer leaving the door open to an abuse inquiry? Delivering brand-new miracles in 1970s East End Watch the latest series of Call the Midwife on iPlayer now Mark-Anthony Turnage shares the soundtrack of his life Once called 'Britain’s hippest composer', he's tackled topics from drug abuse to football in his work Paddy’s loaf-changing experience inside the bread factory Paddy McGuinness visits the bread factory he used to work in, and sees how they make 1.4 million loaves a week What's behind the global surrogacy boom? More countries are banning surrogacy – but demand is growing © 2025 BBC. The BBC is not responsible for the content of external sites.Read about our approach to external linking.",Negative,0.00010180034
"This video can not be played Heavy floods hit southern France Heavy floods have forced the evacuation of 1,600 people - most of them campers - in southern France, officials say. They say a 70-year-old German man who was helping to supervise children at one of the summer camps is missing. The worst-hit areas are Gard, Ardeche and Drome. More than 400 firefighters and police - as well as four helicopters - have been deployed. The storms which caused the floods come after a period of unusually hot weather in southern France and much of Europe. According to UK Met Office meteorologist Marco Petagna , almost 3in (8cm) of rain fell in a 24-hour period. In a statement (in French), the French interior ministry said six departments had been placed on a flood alert,,externalwhile about 17,000 homes were without power in the south-west and north-east. Tents were destroyed in the Saint-Julien-de-Peyrolas campsite In one summer camp in Saint-Julien-de-Peyrolas, in the Gard region, 119 children were evacuated.One camper told French network BFMTV they could hear the children's cries,external""in the branches"", but were unable to reach them. The missing German was supervising the children at the camp. Trapped by a fast-flowing torrent, he had sought shelter inside his caravan - but the vehicle was swept away, AFP news agency reports. It was later found ""empty and in pieces"", according to police. Divers were called in as the search operation continued. In pictures: Europe heatwave The side effects of the European heatwave Human actions boosted heatwave odds Regional police spokesman Jérôme Tallaron said 10 people had been taken to hospital with hypothermia and minor injuries, according to the news agency. Harry Ollerton, from Shropshire, in the UK, was camping in the Ardeche when he was woken at 05:00 on Thursday to ""the loudest thunder and brightest flashes of lighting"". ""It didn't let up - the lightning was constant and terrifyingly close to our tent and campsite,"" he told the BBC. ""It passed straight over us, knocking out the power to our pitch and our phone signal suddenly went dead."" A woman surveys the damaged campsite After realising a nearby drainage ditch was overflowing, Mr Ollerton decided it was no longer safe to stay - but even the drive to the nearest town was difficult. ""Village streets had turned into rivers and the rain was so hard that we couldn't barely see out of the window,"" he said. ""Some of the roads were so flooded that they were barely passable. We were lucky to make it out of the area, soaked through but unharmed, by the sound of things."" Rachel Buchanan, from Oxford in the UK, was also camping in the Ardeche when flooding hit. ""We knew a storm was imminent and couldn't believe the ferocity of last night's storm,"" she told the BBC. ""The level and speed of the river today was extraordinary - we woke up in about a foot of water. ""Driving in our camper van was very frightening as the road by the river was completely under water and waterfalls had appeared from nowhere crashing down the gorge."" Girl, 7, and four adults die canyoning Paris river 'rising beyond six metres' Hollywood Hills in flames amid most destructive wildfire in Los Angeles' history In maps: Thousands of acres on fire in LA Commuters warned of icy roads as cold snap continues to freeze UK Sound Of 2025: Ezra Collective are 'keeping music real' The Papers: 'Apocalypse' LA and 'Reeves faces extra tax rises' How Australia's beach cabana drama sparked a turf war Visa row fuels anxiety for Indians eyeing American dream 'I thought I was going to die': Jailed Venezuelan activist details brutality of prison life The man who could become Canada's future PM 'Trump 2.0' looms large over the global economy A politician was shot dead in Bangkok. Did another country do it? Chris Mason: Is Starmer leaving the door open to an abuse inquiry? Delivering brand-new miracles in 1970s East End Watch the latest series of Call the Midwife on iPlayer now Mark-Anthony Turnage shares the soundtrack of his life Once called 'Britain’s hippest composer', he's tackled topics from drug abuse to football in his work Paddy’s loaf-changing experience inside the bread factory Paddy McGuinness visits the bread factory he used to work in, and sees how they make 1.4 million loaves a week What's behind the global surrogacy boom? More countries are banning surrogacy – but demand is growing © 2025 BBC. The BBC is not responsible for the content of external sites.Read about our approach to external linking.",Positive,0.9988312
"Pupils at Ampleforth (pictured) and Downside were subjected to ""appalling"" sexual abuse over 40 years, the report says Two leading Roman Catholic schools ""prioritised monks and their own reputations over the protection of children"", a report says. ""Appalling"" abuse was inflicted on pupils at Ampleforth in North Yorkshire and Downside in Somerset over 40 years, the Independent Inquiry into Child Sexual Abuse (IICSA) said. But, the report said, both institutions attempted to cover up the allegations. Ten individuals, including monks, have been convicted or cautioned for abuse. The report, based on evidence heard by the IICSA's investigation of the Roman Catholic Church and the English Benedictine Congregation, said, however, the true extent of the abuse is ""likely to be considerably higher"" than the number of convictions. It states many of the perpetrators did not hide their sexual interests from the children and pupils were often abused in front of each other. ""The blatant openness of the activities demonstrates there was a culture of acceptance of abusive behaviour,"" it said. The scale and nature of the abuse inflictedis contained in the full report published on Thursday.,external(WARNING: Contains distressing detail). Both Ampleforth and Downside Abbey, near Radstock, have affiliated schools within their grounds where fees range from £16,000 to £35,000 per year. Ampleforth teacher David Lowe carried out the crimes at two schools more than 30 years ago Professor Alexis Jay, chairwoman of the inquiry, said: ""For decades Ampleforth and Downside tried to avoid giving any information about child sexual abuse to police and social services. ""Instead, monks in both institutions were very often secretive, evasive and suspicious of anyone outside the English Benedictine Congregation. ""Safeguarding children was less important than the reputation of the church and the wellbeing of the abusive monks."" She said the institutions continued to try to manage internally allegations of abuse despite recommendations in the 2001 Nolan Report they should be referred to statutory authorities. Manager drafted in at 'abuse' college Priest 'tried to control' abuse inquiry Boy 'abused' by head of Catholic school ""Even after new procedures were introduced in 2001, when monks gave the appearance of co-operation and trust, their approach could be summarised as a 'tell them nothing' attitude."" One former Downside pupil, who tried to speak out at the the time about his abuse said he was made to feel like a ""sinner"". ""I was vulnerable, broken and needed help from the church when I was a child,"" he said. ""I trusted them to help, but instead my life was destroyed and I was handed a life sentence of suffering by my abuser and those who failed to act against it."" Perpetrators from the two schools who were convicted include Ampleforth teachers David Lowe and Piers Grant-Ferris and former Downside geography teacher Richard White, known as Father Nicholas. Richard David White taught at Downside School in the 1980s Lowe, who also taught at Westminster Cathedral Choir School, was convicted of assaulting boys aged from eight to 13 between 1978 and 1984. He was jailed in 2015 for 10 years. The inquiry heard that when abuse committed by White came to light he was moved from the junior to the senior school where he was given the role of housemaster to his first victim. The report said: ""The abuse of a second victim could have been prevented if the abbot and the headmaster had referred the first abuse to the police and social services."" White was jailed in 2012 for five years. Prof Alexis Jay was appointed in 2016 and is the fourth person to chair the inquiry The inquiry heard both institutions were ""hostile"" to the recommendations of the Nolan report, taking the view its implementation was ""neither obligatory nor desirable"". ""For much of the time under consideration by the inquiry, the overriding concern in both Ampleforth and Downside was to avoid contact with the local authority or the police at all costs, regardless of the seriousness of the alleged abuse or actual knowledge of its occurrence,"" it said. The inquiry also heard that in about 2012 then headmaster of Downside, Dom Leo Maidlow Davies, burned wheelbarrows full of files from the school. The report said while it was ""impossible to say"" what information was in the documents ""it adds to the perception of a cover-up on the part of Downside"". It said a ""strict separation"" between the governance of the school and the abbey was needed in order to safeguard pupils in future and while Ampleforth had taken steps to do just that Downside still had not. LBC radio presenter James O'Brien, who was a pupil at Ampleforth,told BBC Radio 4's World at One the monks wielded a ""secular and spiritual power""that could have played a part in the abuse being hidden for so long. Pupils at Downside School pay up to £11,000 per term Both Downside and Ampleforth have issued statements apologising to the victims. ""The Abbey and School fully acknowledges the serious failings and mistakes made in both protecting those within our care and responding to safeguarding concerns,"" a Downside spokesman said. ""We have reflected deeply and will continue to listen with the ear of the heart going forward to ensure that the mistakes of the past are never repeated."" A spokesman for Ampleforth said it had publicly accepted responsibility for ""past failings on many occasions"". ""The Ampleforth of today has never been afraid to learn difficult lessons,"" he said. ""We remain completely focused on the safety and wellbeing of those entrusted to our care and our commitment to implement meaningful change."" Father Christopher Jamison, Abbot President of the English Benedictine Congregation, said the report highlighted ""how flawed many of our past responses have been"". He said: ""Once again I apologise unequivocally to all those who were abused by any person connected with our abbeys and schools."" Richard Scorer, a lawyer from Slater and Gordon who represented victims from both schools at the inquiry, said: ""The abhorrent and disgraceful abuse in the Catholic Church has once again been laid bare by this inquiry. ""This familiar and shameful story of cover-up has been told time and time again, and is a devastating indictment of an organisation guilty of gross failures on child protection. ""It is clear the Catholic Church is woefully incapable of policing itself. ""That is why we urgently need a mandatory reporting law to prevent the perpetuation of the abuse of vulnerable children."" Asked if he thought institutions like Ampleforth and Downside could continue in the wake of the report, the inquiry's secretary John O'Brien said: ""You're not going to survive if you don't recognise that you need to change. ""From where I sit right now we've heard no evidence that those changes are happening, even now we still don't have separation of the governance at Downside."" Manager drafted in at 'abuse' college Boy 'abused' by head of Catholic school Charity abuse inquiry for public school Teacher jailed for abusing pupils Head admits reputation 'damaged' Monk jailed for child sex crimes BBC Radio 4 - World at One, Child abuse inquiry- 'It was all about the school's reputation' Independent Inquiry into Child Sexual Abuse Downside Abbey Ampleforth Abbey & College Hollywood Hills in flames amid most destructive wildfire in Los Angeles' history In maps: Thousands of acres on fire in LA Commuters warned of icy roads as cold snap continues to freeze UK Sound Of 2025: Ezra Collective are 'keeping music real' The Papers: 'Apocalypse' LA and 'Reeves faces extra tax rises' How Australia's beach cabana drama sparked a turf war Visa row fuels anxiety for Indians eyeing American dream 'I thought I was going to die': Jailed Venezuelan activist details brutality of prison life The man who could become Canada's future PM 'Trump 2.0' looms large over the global economy A politician was shot dead in Bangkok. Did another country do it? Chris Mason: Is Starmer leaving the door open to an abuse inquiry? Delivering brand-new miracles in 1970s East End Watch the latest series of Call the Midwife on iPlayer now Mark-Anthony Turnage shares the soundtrack of his life Once called 'Britain’s hippest composer', he's tackled topics from drug abuse to football in his work Paddy’s loaf-changing experience inside the bread factory Paddy McGuinness visits the bread factory he used to work in, and sees how they make 1.4 million loaves a week What's behind the global surrogacy boom? More countries are banning surrogacy – but demand is growing © 2025 BBC. The BBC is not responsible for the content of external sites.Read about our approach to external linking.",Negative,0.001508338
"Net migration targets should be scrapped after Brexit, the Confederation of British Industry says. Targets should be replaced with a system that ensures people coming to the UK make a positive contribution to the economy, the business group said. Schools and hospitals should receive extra funding where demand is increased by immigration, the CBI added. But the Home Office said it was committed to bringing net migration down to ""tens of thousands"". The contribution of EU workers to the UK economy was ""profoundly important and will be needed in the future"", after the free movement of EU citizens comes to an end as part of Brexit, the CBI said. It said EU citizens should be registered on arrival to the UK and restrict their visit to three months ""unless they can prove that they are working, studying or are self-sufficient"". It would be ""entirely unworkable"" to move EU nationals into the existing non-EU immigration system, which the CBI described as ""highly complex, time-consuming and expensive, particularly for small businesses"". European fruit pickers shun Britain Construction bodies warn of Brexit 'cliff edge' skills gap Carney: No-deal Brexit risk 'uncomfortably high' The CBI said immigration had been shown time and again to bring net economic benefits to the UK, yet people had legitimate concerns about the pressures immigration could have on public services and society. The answer was to shift away from numbers and instead to focus on who could benefit the UK. This need not just be high earners, but anyone who could contribute. There is an impetus to overhaul UK immigration policy after Brexit to make sure the system allows skilled people to come into the country from around the world, the CBI said. ""The stakes are high. Get it wrong, and the UK risks having too few people to run the health service, pick food crops or deliver products to stores around the country,"" it added. ""We also risk harming our future as a global innovation hub, rooted in our longstanding ability to attract talented people the world over."" However, the Home Office said it had no plans to scrap immigration targets. The target of reducing net migration to tens of thousands was set by David Cameron in 2010. But the goal has never been met, with recent annual net migration to the UK at about 240,000. There is ""no consent in Britain for uncontrolled immigration"", the Home Office said. ""After we leave the EU, we will end free movement and put in place a system which works in the best interests of the whole of the UK,"" the Home Office said. ""We are considering a range of options that will ensure that we are in control of our borders and managing migration, while continuing to attract and retain people who come here to work and bring significant benefits."" The government has asked the Migration Advisory Committee, a non-departmental public body, to assess the contribution that EU citizens make to the UK. The body has been talking to businesses, the NHS and universities, and is due to bring out a report in September. The government will then set out its plans, taking into account ""the UK's social and economic circumstances and our discussions with the EU around our future relationship"", the Home Office said. The department added that the government had already reached agreements on EU citizens' rights, while its White Paper proposed visa-free travel for tourists and short-term business travellers. Carney warns of no-deal Brexit risk Leave.EU 'led people up the garden path' European fruit pickers shun Britain Hollywood Hills in flames amid most destructive wildfire in Los Angeles' history In maps: Thousands of acres on fire in LA Commuters warned of icy roads as cold snap continues to freeze UK Sound Of 2025: Ezra Collective are 'keeping music real' The Papers: 'Apocalypse' LA and 'Reeves faces extra tax rises' How Australia's beach cabana drama sparked a turf war Visa row fuels anxiety for Indians eyeing American dream 'I thought I was going to die': Jailed Venezuelan activist details brutality of prison life The man who could become Canada's future PM 'Trump 2.0' looms large over the global economy A politician was shot dead in Bangkok. Did another country do it? Chris Mason: Is Starmer leaving the door open to an abuse inquiry? Delivering brand-new miracles in 1970s East End Watch the latest series of Call the Midwife on iPlayer now Mark-Anthony Turnage shares the soundtrack of his life Once called 'Britain’s hippest composer', he's tackled topics from drug abuse to football in his work Paddy’s loaf-changing experience inside the bread factory Paddy McGuinness visits the bread factory he used to work in, and sees how they make 1.4 million loaves a week What's behind the global surrogacy boom? More countries are banning surrogacy – but demand is growing © 2025 BBC. The BBC is not responsible for the content of external sites.Read about our approach to external linking.",Positive,0.99215806
