headline,article
Caught in Iran power struggle,"Nazanin Zaghari-Ratcliffe is serving a five-year sentence in Iran The case of Nazanin Zaghari-Ratcliffe is first and foremost a story of terrible personal suffering for a young woman, her husband and their baby girl. Eighteen months into a five-year sentence, Mrs Zaghari-Ratcliffe faces the prospect of up to 16 years in an Iranian jail. It is also, however, a story of an internal power struggle in Iran, as well as of the nation's deeply difficult relationship with the UK. To understand how she fits into this, the first thing to examine is the timing of her arrest. Mrs Zaghari-Ratcliffe was detained in April 2016, a few months ahead of the first anniversary of Iran's historic nuclear deal. This video can not be played Mr Ratcliffe maintains his wife is innocent The accord, on which President Hassan Rouhani had staked his reputation, was bitterly opposed by elements of the powerful Revolutionary Guards. They had often benefited financially from the sanctions regime. They were adamant that the nuclear deal must be seen as a failure, that it had changed nothing and that compromise with the West was a fruitless exercise. Arrests of a number of Iranians with dual nationality came about in this context: Siamak Namzi, an Iranian-American businessman, was detained in October 2015 Nazanin Zaghari-Ratcliffe, a charity worker, was held the following April Homa Hoodfar, a Iranian-Canadian academic, was detained in June last year. Iran is in the grip of an ideological power-struggle, with two competing world views. President Rouhani came to power promising to open Iran up to the world; the supreme leader, the Revolutionary Guards and the judiciary have a far more hardline position, both in relation to how the country should be run as well as its foreign relations. Profile: Hassan Rouhani presents a vision for a moderate, modern and outward-looking Iran All the arrests were seen as an attempt by the Revolutionary Guards to undermine not just the president, but the very process of thawing relations with the West. Of the three dual-national prisoners arrested after the deal was agreed, only one has since been released: Ms Hoodfar was sent home a few months later on what the Iranians called ""humanitarian grounds"". The only significant difference between her case and Mrs Zaghari-Ratcliffe's was their nationalities: one was half-Canadian, the other half-British. To Iranian minds, the UK is viewed with almost unique suspicion. Indeed, in 2009 the supreme leader said that of all the world's ""arrogant powers"", the UK was the ""most evil"". To understand why, one must go back to the 1953 coup-d'Ã©tat that overthrew nationalist Prime Minister Mohammad Mosaddegh, returning the autocratic Shah to power. Behind it were the British and American intelligence agencies. Almost 300 people were killed in the streets of Tehran after protesting against the prime minister's removal in a US- and British-organised coup in 1953 This led to deep-rooted suspicions of the West's intentions; once the Shah was ousted by the Islamic Revolution of 1979, those suspicions became open hostilities. Relations have never really recovered. Over the years there have been a number of key points, notably the 1989 fatwah calling for the death of British author Salman Rushdie. His book, The Satanic Verses, was denounced as blasphemous by the supreme leader; he called on Muslims around the world to try and kill Rushdie. The controversy led to a severing of diplomatic ties, which were not repaired until 1998. In 2007, 15 British Royal Navy personnel were detained off the South Coast of Iran. They were paraded on TV, a show of power by Tehran, but ultimately released under diplomatic pressure. The 2009 re-election of President Mahmoud Ahmadinejad was followed by peaceful street protests, which the supreme leader accused the West of encouraging.  A number of staff at the British embassy were arrested and forced to sign confessions. In November 2011, relations deteriorated further. After the UK increased sanctions on Iran, the parliament voted to expel the British ambassador. Before he could pack his bags, members of the hardline Basij militia ransacked the British embassy in Tehran. It did not re-open until 2014. But, it is not just the British government that has been viewed with great hostility. Western media, most notably the BBC's Persian Service, has long been regarded with deep distrust, fear and often hatred by the hardline Iranian establishment. For years Persian Service journalists have been harassed and intimidated by the Iranian authorities. Two months ago all the assets of 150 BBC staff, former staff and contributors were frozen for ""conspiracy against national security"". And here we come to the final part of the story of Nazanin Zaghari-Ratcliffe. Many years ago, she worked for BBC Media Action, the charitable wing of the BBC. Although it has no direct connection to the BBC's Persian service, it has been used as evidence that she was in Iran for political reasons. This video can not be played Mr Johnson called the Iranian foreign minister, Javad Zarif, about Mrs Zaghari-Ratcliffe's case It is, therefore, for this reason that the recent comments by Foreign Secretary Boris Johnson were so controversial, and potentially damaging. By stating that she was involved in ""training journalists"", he has given ammunition to those elements of the establishment who view her as just another example what the supreme leader described as ""an infiltration project"" by the West. All the while, Mrs Zaghari-Ratcliffe languishes in Tehran's Evin jail. Her daughter, who has now forgotten how to speak English, can only see her for an hour-and-a-half a week. Meanwhile her husband Richard suffers in London. The future of a family, half-British, half-Iranian, has been torn apart by the suspicion and distrust caused by their own countries' pasts. Johnson sorry for Iran remarks 'anxiety' Fears for jailed mum after Johnson remark More charges for mother jailed in Iran UK-Iranian 'jailed on secret charges' Profile: Hassan Rouhani Mother jailed in Iran loses final appeal Charges against detained mother 'absurd' At least two killed and 1,000 structures destroyed as wildfires rage in Los Angeles In maps: Thousands of acres on fire in LA 'Patients are collapsing in the waiting room': A&E nurses speak out Why does Trump want Greenland and what do its people think? How Canada's immigration debate soured - and helped seal Trudeau's fate 'I can't get divorced as I can't get my pension valued' What are cold weather payments and who can get them? BBC Sound of 2025: Barry Can't Swim is a new dance music superstar Ros Atkins on...Elon Musk's political interventions Jean-Marie Le Pen - founder of French far right and 'Devil of the Republic' Cases of HMPV are on the rise in China - but what is it? Politics Essential: Get the latest news and analysis delivered to your inbox every weekday Delivering brand-new miracles in 1970s East End Watch the latest series of Call the Midwife on iPlayer now Mark-Anthony Turnage shares the soundtrack of his life Once called 'Britainâs hippest composer', he's tackled topics from drug abuse to football in his work Paddyâs loaf-changing experience inside the bread factory Paddy McGuinness visits the bread factory he used to work in, and sees how they make 1.4 million loaves a week What's behind the global surrogacy boom? More countries are banning surrogacy â but demand is growing Â© 2025 BBC. The BBC is not responsible for the content of external sites.Read about our approach to external linking."
Charges against detained mother 'absurd',"This video can not be played Richard Ratcliffe: ""She's a loyal and proud Iranian"" The husband of a British mother detained in Iran has said the idea she could be involved in trying to overthrow the regime is ""absurd"". Nazanin Zaghari-Ratcliffe, 37, is due on trial on as yet unspecified charges after being arrested in April. Speaking to the BBC on the couple's seventh wedding anniversary, Richard Ratcliffe, from north London, said his wife was ""a proud and loyal Iranian"". Prime Minister Theresa May raised the case with Iran's president last week. The British-Iranian charity worker was arrested while she was at an airport with her daughter Gabriella while visiting her family on holiday. Iranian officials have previously accused Mrs Zaghari-Ratcliffe of leading a ""foreign-linked hostile network"". Richard's only contact with his daughter is via Skype Mr Ratcliffe told the BBC's Caroline Hawley her arrest was ""so absurd"", adding: ""The idea that anyone with a baby could be busy overthrowing the regime is obviously nonsense."" He said his wife had been under ""intense interrogation"" for the first two months of her imprisonment and was kept in solitary confinement. She lost a lot of weight and became very weak, he said, adding: ""When she came out of solitary that was when she couldn't walk without blackouts and her hair was falling out."" Mr Ratcliffe believes his wife is being used as a pawn in a larger dispute. ""There is definitely a political game going on between different parts of the Iranian government and the Iranian regime, so the revolutionary guard versus the government, and she's caught up in that. ""There have been various attempts by the Iranian government to improve relations with the West and this is almost as provocative as possible to stop that happening."" Mr Ratcliffe said his wife had been caught up in a ""political game"" His daughter has had her passport confiscated and is currently being taken care of by relatives in Tehran, he said. ""There's a picture in Nazanin's parents' living room of our wedding and she'll go and point to the wedding photo if she wants to speak to daddy or if she wants to speak to mummy,"" he added. ""But, of course, she associates where she sees them, so she knows she sees mummy at prison at the moment. She knows that she sees daddy on the telephone."" He admitted being away from his daughter was ""tough"" and said ""online parenting"" was not the same as watching your daughter grow up. However, he said it was a ""small mercy"" she was with relatives in Iran. He welcomed the involvement of Mrs May - who ""raised concerns"" about Mrs Zaghari-Ratcliffe and other cases of detained nationals during a phone call with Iranian president Hassan Rouhani. ""We are still at the stage where we are not clear what is going on or how the process is working,"" Mr Ratcliffe added. ""Certainly the fact that Theresa May has raised Nazanin's case, and that it has reached that level - that can only help the situation."" A Downing Street spokeswoman said the PM had ""stressed the importance of resolving these cases as we worked to strengthen our diplomatic relationship"". Ms Zaghari-Ratcliffe, who is a project manager with the Thomson Reuters Foundation, travelled to Iran on an Iranian passport. She is being prosecuted in Tehran's Revolutionary Court and her case is to be handled by judge Abolghassem Salavati. PM presses Iran over detained mother UK-Iranian woman faces trial in Iran British mother accused of Iran plot Husband calls for wife's Iran release Husband's plea for Briton held in Iran. Video, 00:01:33Husband's plea for Briton held in Iran At least two killed and 1,000 structures destroyed as wildfires rage in Los Angeles In maps: Thousands of acres on fire in LA 'Patients are collapsing in the waiting room': A&E nurses speak out Why does Trump want Greenland and what do its people think? How Canada's immigration debate soured - and helped seal Trudeau's fate 'I can't get divorced as I can't get my pension valued' What are cold weather payments and who can get them? BBC Sound of 2025: Barry Can't Swim is a new dance music superstar Ros Atkins on...Elon Musk's political interventions Jean-Marie Le Pen - founder of French far right and 'Devil of the Republic' Cases of HMPV are on the rise in China - but what is it? Politics Essential: Get the latest news and analysis delivered to your inbox every weekday Delivering brand-new miracles in 1970s East End Watch the latest series of Call the Midwife on iPlayer now Mark-Anthony Turnage shares the soundtrack of his life Once called 'Britainâs hippest composer', he's tackled topics from drug abuse to football in his work Paddyâs loaf-changing experience inside the bread factory Paddy McGuinness visits the bread factory he used to work in, and sees how they make 1.4 million loaves a week What's behind the global surrogacy boom? More countries are banning surrogacy â but demand is growing Â© 2025 BBC. The BBC is not responsible for the content of external sites.Read about our approach to external linking."
UK marks Remembrance Sunday,"This video can not be played Prince Charles lays Remembrance Sunday wreath as the Queen watches from a balcony Politicians, members of the Royal Family and veterans are commemorating those who lost their lives in conflict as the UK marks Remembrance Sunday. A two-minute silence was held across the country and wreaths were laid at memorials. Prince Charles attended the annual ceremony at the Cenotaph in London and Big Ben chimed at 11:00 GMT. The Queen did not lay a wreath but instead watched from the Foreign Office's balcony. The only other occasions when she has not laid the wreath were when she was pregnant or abroad. Why the Queen didn't lay a Remembrance wreath 'I thought Remembrance was a white event' Your stories on Remembrance Day Thankful villages: The shame of surviving World War One In pictures: Britons mark Remembrance Day At the Cenotaph on Whitehall, the Last Post was played shortly before the Prince of Wales laid the wreath. The royals were joined by Prime Minister Theresa May, other senior politicians, religious leaders and dignitaries from around the Commonwealth. Theresa May and Labour leader Jeremy Corbyn also paid their respects The Queen watched the ceremony with Prince Philip and the Duchess of Cornwall from a nearby balcony... ...as did the Duchess of Cambridge and other royals The Duke of Cambridge and Prince Harry also laid wreaths As part ofservices being held across Scotland, more than 100 wreaths were laid at Edinburgh's City Chambers. First Minister Nicola Sturgeon attended the service. In Wales,a service was held at the Welsh National War Memorialand a field of remembrance at Cardiff Castle featured more than 10,000 crosses. At the Cenotaph in Enniskillen in Northern Ireland, Irish Taoiseach Leo Varadkar laid a green laurel wreath, 30 years after an IRA bombing there killed 12 people. Northern Ireland secretary James Brokenshire and DUP leader Arlene Foster also laid wreaths. In Omagh, a wreath-laying ceremony was postponedafter a suspicious object was found. Meanwhile,bell ringers are being soughtfor 2018 to honour the 1,400 ringers who died in World War One. Lance Sergeant Johnson Beharry paraded with Chelsea pensioners Veterans gathered for Remembrance Sunday at the Cenotaph in Whitehall Sir Stuart Peach, chief of the defence staff, told the Andrew Marr show that the day was one of remembrance and reconciliation. ""Today we mark and remember over a million British and Commonwealth soldiers who died in both world wars. So it is about remembering the sacrifice they made so that we can enjoy the freedom and liberty that we have today,"" he said. ""It's also very important to understand that this is about reconciliation. That nations move on."" The new Defence Secretary, Gavin Williamson, said: ""We must not forget the continued sacrifices our armed services make, right across the globe serving in 30 countries, making sure that this country remains safe - and that the freedoms that we have today continue to be protected."" On Saturday,events were held around the UK to mark the 99th anniversary of Armistice Daywith Big Ben chiming for the first time since August. The evening saw a Festival of Remembrance held at Albert Hall. Members of the Royal Family watched as Emeli Sande, Tom Odell and other stars performed alongside the Queen's Colour Squadron and The Band of HM Royal Marines. The event was held by the Royal British Legion and hosted by the BBC's Huw Edwards. It commemorated all the British military personnel killed in combat since World War One. In pictures: Britain marks Remembrance Sunday Remembrance Sunday services held Bell ringers sought to mark WW1 centenary Nation falls silent for Armistice Day In pictures: Armistice Day around the world Thankful villages: The shame of surviving World War One At least two killed and 1,000 structures destroyed as wildfires rage in Los Angeles In maps: Thousands of acres on fire in LA 'Patients are collapsing in the waiting room': A&E nurses speak out Why does Trump want Greenland and what do its people think? How Canada's immigration debate soured - and helped seal Trudeau's fate 'I can't get divorced as I can't get my pension valued' What are cold weather payments and who can get them? BBC Sound of 2025: Barry Can't Swim is a new dance music superstar Ros Atkins on...Elon Musk's political interventions Jean-Marie Le Pen - founder of French far right and 'Devil of the Republic' Cases of HMPV are on the rise in China - but what is it? Politics Essential: Get the latest news and analysis delivered to your inbox every weekday Delivering brand-new miracles in 1970s East End Watch the latest series of Call the Midwife on iPlayer now Mark-Anthony Turnage shares the soundtrack of his life Once called 'Britainâs hippest composer', he's tackled topics from drug abuse to football in his work Paddyâs loaf-changing experience inside the bread factory Paddy McGuinness visits the bread factory he used to work in, and sees how they make 1.4 million loaves a week What's behind the global surrogacy boom? More countries are banning surrogacy â but demand is growing Â© 2025 BBC. The BBC is not responsible for the content of external sites.Read about our approach to external linking."
Nation in Armistice Day silence,"This video can not be played Big Ben breaks silence to mark Armistice Day Millions of people have fallen silent to remember the nation's war dead, as the UK marked Armistice Day. Big Ben, which has been silent since August while repair work is carried out, chimed at 11:00 GMT. Events have been held around the country to mark the 99th anniversary of the end of World War One. And the Queen and other members of the Royal Family have taken part in a Royal Festival of Remembrance at the Royal Albert Hall in London. Prime Minister Theresa May, the Prince of Wales and the Duchess of Cambridge were among those at the event, run by the British Legion and featuring performances from Emeli Sande, Tom Odell, Melanie C, Alfie Boe and the Band of HM Royal Marines. The service marked the centenaries of the women's service in the regular Armed Forces, the Battle of Passchendaele, the creation of the Commonwealth War Graves Commission and the 100th birthday of Dame Vera Lynn. There was also praise for service personnel and civilian services who came to the aid of the injured in this year's terrorist attacks in London and Manchester. This video can not be played Les Cherrington said thinking about his fallen comrades made him very emotional Earlier, the Western Front Association held its annual service of remembrance at the Cenotaph, in Whitehall, central London, where a two-minute silence was observed. And the National Memorial Arboretum in Staffordshire hosted an outdoor service of remembrance within the walls of the Armed Forces Memorial. People observe a two minute silence at the National Memorial Arboretum in Staffordshire The Western Front Association's annual service of remembrance at the Cenotaph, Whitehall The Duke of York and Duchess of Cambridge were among those attending the Royal Festival of Remembrance They were joined by the Queen and Prince Philip In Brighton, the world's tallest moving observation tower, the British Airways i360, is turning red to mark the event. Has poppy mania gone over the top? Scottish landmarks light up red Thankful villages: The shame of surviving World War One Fake Scottish poppy jewellery seized In pictures: Armistice Day around the world The Field of Remembrance at Westminster Abbey On Sunday, Prince Charles will lay a wreath at the Cenotaph on his mother's behalf. It will be the first time, as head of state, that the Queen will observe the ceremony from a nearby balcony, where she will be joined by the Duke of Edinburgh. People gathered at the Cenotaph on Whitehall to observe a two minute silence A service of remembrance was held at the Edinburgh Garden of Remembrance Elsewhere, Australians have observed a minute's silence to remember their war dead. The country's Sydney Opera House was lit up with red poppies. The sails of the Sydney Opera House are seen illuminated with red poppies Australian prime minister Malcolm Turnbull joined his New Zealand counterpart, Jacinda Ardern, in Vietnam - where the Apec summit is taking place - to attend a service of remembrance. ""We remember every ANZAC serviceman and woman who has made the supreme sacrifice to keep our two countries free,"" he said. French President Emmanuel Macron lays a wreath in front of the statue of Georges Clemenceau in Paris Armistice Day is a national holiday in France and Belgium. French president Emmanuel Macron has laid a wreath in front of the statue of Georges Clemenceau - the prime minister of France during World War One. Princess Anne paid tribute during the Last Post ceremony at Ypres Memorial in Belgium Soldiers and civilians celebrate Armistice Day on 11 November 1918 Armistice Day falls each year on 11 November to mark the day in 1918 when the fighting in World War One was stopped. The Allies and Germany signed an armistice in a railway carriage in the Forest of Compiegne in France at 05:00. Six hours later, at 11:00, the conflict ceased. King George V announced that a two-minute silence would be observed in 1919, four days before the first anniversary of Armistice Day. The silence continues to be observed every year on the 11th hour of the 11th day of the 11th month. Watch the Royal British Legion Festival of Remembrance on BBC One on Saturday at 21:00 GMT. Thankful villages: The shame of surviving World War One The man who calls out 'insincere' poppy wearers Fake Scottish poppy jewellery seized Queen will not lay Remembrance wreath At least two killed and 1,000 structures destroyed as wildfires rage in Los Angeles In maps: Thousands of acres on fire in LA 'Patients are collapsing in the waiting room': A&E nurses speak out Why does Trump want Greenland and what do its people think? How Canada's immigration debate soured - and helped seal Trudeau's fate 'I can't get divorced as I can't get my pension valued' What are cold weather payments and who can get them? BBC Sound of 2025: Barry Can't Swim is a new dance music superstar Ros Atkins on...Elon Musk's political interventions Jean-Marie Le Pen - founder of French far right and 'Devil of the Republic' Cases of HMPV are on the rise in China - but what is it? Politics Essential: Get the latest news and analysis delivered to your inbox every weekday Delivering brand-new miracles in 1970s East End Watch the latest series of Call the Midwife on iPlayer now Mark-Anthony Turnage shares the soundtrack of his life Once called 'Britainâs hippest composer', he's tackled topics from drug abuse to football in his work Paddyâs loaf-changing experience inside the bread factory Paddy McGuinness visits the bread factory he used to work in, and sees how they make 1.4 million loaves a week What's behind the global surrogacy boom? More countries are banning surrogacy â but demand is growing Â© 2025 BBC. The BBC is not responsible for the content of external sites.Read about our approach to external linking."
