headline,article
Giant ship blocking Suez Canal finally freedA container ship blocking one the world's busiest trade routes is freed after almost a week.,"This video can not be played (29 March 2021) The stranded container ship is seen finally on the move and no longer blocking the canal Traffic has resumed in Egypt's Suez Canal after a stranded container ship blocking it for nearly a week was finally freed by salvage crews. Tug boats honked their horns in celebration as the 400m-long (1,300ft) Ever Given was dislodged on Monday with the help of dredgers. Hundreds of ships are waiting to pass through the canal which links the Mediterranean to the Red Sea. It is one of the world's busiest trade routes. The cost of the Suez Canal blockage How do you refloat a giant cargo ship? In pictures: Efforts to shift huge ship from canal Peter Berdowski, CEO of Dutch salvage company Boskalis, said the Ever Given had been refloated at 15:05 (13:05 GMT) on Monday, ""thereby making free passage through the Suez Canal possible again"". Egyptian officials say the backlog of ships waiting to transit through should be cleared in around three days, but experts believe the knock-on effect on global shipping could take weeks or even months to resolve. The Ever Given on the move on Monday Salvage teams had faced a daunting challenge after the 200,000-tonne ship ran aground last Tuesday morning in high winds and a sandstorm which reduced visibility. A Dutch specialist team, SMIT, oversaw a flotilla of 13 tugs, small but powerful vessels that can shift large ships, as they tried to dislodge the Ever Given. Dredgers were brought in and dug 30,000 cubic metres of mud and sand from beneath the ends of the ship. Over the weekend, it was feared that some of the ship's cargo of some 18,000 containers would have to be removed in order to lighten the load. But high tides helped the tugs and dredgers in their work and early on Monday, the stern (rear of the ship) was freed and the great ship swung across the canal, to shouts of celebration. Hours later, the bow (front) too came unstuck, and the Ever Given was able to move out. The vessel was towed to the Great Bitter Lake, which sits between two sections of the canal to the north of the salvage site, where it will undergo safety checks. A marine source told Reuters news agency on Monday evening that ships were travelling southwards towards the Red Sea while canal services provider Leth Agencies said vessels had resumed transit from the Great Bitter Lake. Some ships have already left the region, preferring to take an alternative, longer route around the southern tip of Africa. Inevitably, cargoes will be reaching their destination much later than planned. There may be congestion when they arrive in port, while future sailing schedules have been thrown into disarray, The cost of shipping goods to Europe is expected to rise as a result, BBC Business Correspondent Theo Leggett reports. Shipping group Maersk saidthe ""ripple effects on global capacity and equipment"" were significant,external. ""There'll be an investigation, clearly, because this has had such a big impact and exactly what's happened here, I think, will be debated for some time,"" Marcus Baker, global head of marine and cargo at Marsh Inc, told Reuters. ""What do we do going forward to ensure it doesn't happen again? Again, I would leave that to the competent authorities that are in Egypt to decide how they want to make sure that traffic transits safely through the canal because, look, it's in their interest to do that."" By Sally Nabil, BBC Arabic bilingual correspondent, Port of Suez Spirits here are quite high. There's a strong sense of achievement. Some experts had warned that it might take weeks to free the Ever Given. But the high tide, as well as the specialist equipment brought in, all helped the rescue operation. Now the authorities will have to address another challenge - congestion. The head of the Suez Canal Authority said that hundreds of stranded vessels would be allowed through the canal on a first-come-first-served basis, though there might be some exceptions to specific ships, based on the types of goods on board. The blockage put the authorities under immense pressure, given the major impact it had on global trade. For Egyptians, the canal is not only a source of national pride, but it also provides the economy with much needed foreign currency. A couple of days ago, I asked Osama Rabie, the head of the Suez Canal Authority, whether he was concerned that some shipping companies might be discouraged from sending such giant ships through the canal in the future. He replied that there was no alternative to the Suez Canal, which he said was fast and safe. So, it's not just about time here, but also about security. It will now undergo a full inspection at the Great Bitter Lake, the vessel's technical managers, Bernhard Schulte Shipmanagement, said. It said there had been no reports of pollution or cargo damage, and initial investigations had ruled out any mechanical or engine failure as a cause of the grounding last week. The ship's Indian crew of 25 remaining aboard the vessel are safe and in good health, BSM said, adding: ""Their hard work and tireless professionalism are greatly appreciated."" The ship's containers are carrying a huge variety of items and the insured value of the cargo is believed to amount to hundreds of millions of dollars. Comments can not be loaded To load Comments you need to enable JavaScript in your browser Deadly wildfires rage across LA as fierce winds threaten more destruction What's the latest on the LA fires, and why can't they be put out? Danes struggle with response to Trump Greenland threat 'I paid fake doctor thousands for fillers - now I look like a gargoyle' The Papers: 'Lost Angeles' and 'Musk seeks plan to oust Starmer' Pop star Chappell Roan wins BBC Sound Of 2025 Weekly quiz: Zendaya looked happy but who else sparkled at the Golden Globes? The 20 child abuse inquiry proposals - what has happened so far? The '9/11 mastermind' wants to plead guilty. Why is the US trying to stop him? Why are UK borrowing costs rising and what does it mean for me? In maps: Thousands of acres on fire in LA Before and after: How wildfires tore through LA Ed Gamble hosts the official Traitors podcast Join Ed Gamble and guests as they dissect the first episodes of The Traitors! Can art, music and words bind us in divided times? Simon Schama explores how artists have captured the transformations of British society since 1945 Enjoy a satirical smorgasbord of The News Quiz Digest a dramatic year of news as Andy Zaltzman revels in some of 2024's funniest moments The multi-award-winning legal drama returns Two years on, the Defoes are back and have gathered for a beautiful wedding in Barcelona © 2025 BBC. The BBC is not responsible for the content of external sites.Read about our approach to external linking."
Freight firm: Our customers are worried,"Steve Parks says he has 20 containers of goods stuck on the Ever Given British businesses are getting worried as Egypt's Suez Canal continues to be blocked by a Taiwanese mega-container ship for the fourth day in a row. Seaport Freight Services, a shipping and freight-forwarding company based at the Port of Felixstowe, has 20 containers of goods stranded on the Ever Given. ""We're waiting on food goods like coconut milk and syrups, some spare parts for motors, we've got some fork lift trucks, some Amazon goods on there, all sorts,"" Steve Parks, director of Seaport Freight Services, tells the BBC. ""All our customers are hearing about it, and they're phoning us to ask when it will be resolved."" The 400m-long (1,312ft) ship Ever Given, operated by Taiwanese transport company Evergreen Marine, is one of the world's largest container vessels. The Suez Canal blockage in numbers Suez blockage is holding up $9.6bn of goods a day Egypt's Suez Canal blocked by huge container ship How do you refloat a giant cargo ship? It weighs 200,000 tonnes, with a maximum capacity of 20,000 containers. The ship ran aground and became lodged sideways across the waterway on Tuesday after a gust of wind blew it off course. It is blocking one of the world's busiest trade routes, causing a huge tailback of other ships trying to pass through the Suez Canal, which separates Africa from the Middle East and Asia. There are more than 160 vessels waiting at either end of the canal, according to tracking data from Lloyd's List. The Ever Given ship, viewed from satellite, remains stuck in the Suez Canal At the moment, Mr Park says there is only one way to get goods through - go round the Horn of Africa, which will add another seven days to the journey. ""We've had supply problems from the Far East, we've had Covid, we've had the Brexit changes. You couldn't really make it up,"" he says. ""Things were just starting to get better. We were just starting to get over the shortage of containers, the shortage of vessels, and then this happens."" Mirical Emblems is a firm specialising in heat-applied print transfers for clothing and uniforms, based in Mansfield, Nottinghamshire. It has a shipment of raw material stuck on a boat in the Red Sea that is trying to get into the Suez Canal. The cost of the goods and the cost to ship them comes to £16,000. The shipment is already delayed due to the pandemic, as the original ship it was meant to travel on was rerouted, and had to wait for the next vessel bound for the UK. The ship with the raw material shipment is meant to dock at the Port of Southampton on 9 April. But if the delivery continues to be delayed, Mirical Emblems will have to pay for a second shipment of the raw material and have it flown over from South Korea for three times the shipping cost - roughly £21,000 - because the firm can't afford to upset its clients and affect their supply chains too. ""We're about to run out of stock, and this is just another cost we could do without,"" says Mirical Emblems' managing director Jonathan Dul. ""The pandemic has caused our turnover to fall by 20%. We've increased costs due to Brexit and now we're having delayed shipments and having to potentially buy materials twice."" Thomas O'Brien is managing director of Boxer Gifts, a toy manufacturer based in Leeds. Toy manufacturer Thomas O'Brien says shipping is current ""difficult, long and expensive"" His products are made in China, and he has six containers on ships now queuing up to get through the Suez Canal, each containing around 50,000 toys. ""It means longer shipping times, less stock availability, more money tied up on goods at sea, rather than in our warehouses, and it means more stress,"" he tells the BBC. He says it will also impact his customers - retailers, who will have to wait a little longer to get their stock. Plus, Mr O'Brien recently heard that it is likely his firm will have to pay some additional charges in order to receive the outstanding shipments, due to the ongoing situation at the Suez Canal. 'It's another addition to the long list of reasons why shipping is difficult, long and expensive at the moment, "" he says. ""The Suez Canal situation is yet another spanner in the works that makes dealing with international shipping a hell of a lot harder."" Logistics UK, which represents freight businesses, says that a lot of the goods currently bound for the UK are likely to be for retailers who are stocking their shelves ready for the summer. Egyptian officials inspect the operation to refloat the Ever Given ship There is a risk that some goods, such as perishable foods, could arrive too late to be sold, due to ships either waiting to go through the canal, or having to be re-routed round the southern tip of Africa, warns Alex Veitch, general manager of policy at Logistics UK. And while the current industry trend for extraordinarily large vessels means more goods can be transported in one go, the impact is much greater when things go wrong. ""When they turn up late or at the wrong time, it puts a lot of pressure on ports to offload them very quickly so that they can go off to the next stop,"" he says. ""That then puts pressure on domestic transport operations to get them to the shops in time, so it really does show how easy it can be to disrupt almost and invisible network of moving goods from source to the shop."" Suez blockage is holding up $9.6bn of goods a day Egypt's Suez Canal blocked by huge container ship Deadly wildfires rage across LA as fierce winds threaten more destruction What's the latest on the LA fires, and why can't they be put out? Danes struggle with response to Trump Greenland threat 'I paid fake doctor thousands for fillers - now I look like a gargoyle' The Papers: 'Lost Angeles' and 'Musk seeks plan to oust Starmer' Pop star Chappell Roan wins BBC Sound Of 2025 Weekly quiz: Zendaya looked happy but who else sparkled at the Golden Globes? The 20 child abuse inquiry proposals - what has happened so far? The '9/11 mastermind' wants to plead guilty. Why is the US trying to stop him? Why are UK borrowing costs rising and what does it mean for me? In maps: Thousands of acres on fire in LA Before and after: How wildfires tore through LA Ed Gamble hosts the official Traitors podcast Join Ed Gamble and guests as they dissect the first episodes of The Traitors! Can art, music and words bind us in divided times? Simon Schama explores how artists have captured the transformations of British society since 1945 Enjoy a satirical smorgasbord of The News Quiz Digest a dramatic year of news as Andy Zaltzman revels in some of 2024's funniest moments The multi-award-winning legal drama returns Two years on, the Defoes are back and have gathered for a beautiful wedding in Barcelona © 2025 BBC. The BBC is not responsible for the content of external sites.Read about our approach to external linking."
Biden administration threatens tariffs on UK goods,"The US has warned it could put tariffs of up to 25% on a host of UK exports in retaliation for a UK tax on tech firms. Ceramics, make-up, overcoats, games consoles and furniture,externalcould all be hit, according to a list published by the Biden administration. The duties are designed to raise $325m (£235.8m), the amount the US believes the UK will raise from US tech firms. A UK government spokesperson said it wanted to ""make sure tech firms pay their fair share of tax"". They added: ""Should the US proceed to implement these measures, we would consider all options to defend UK interests and industry."" Washington is pressing ahead with the action, initiated under President Donald Trump, and has scheduled hearings on the list. It argues the recently introduced digital services tax - which taxes tech firms on their revenues - has ""unreasonable, discriminatory, and burdensome attributes"". US suspends tariffs on single malt Scotch whisky Sunak urges US to back digital services tax Facebook agrees to pay France €106m in back taxes Such actions have proceeded against similar taxes in India, Austria and Spain, but action against the European Union as a whole was dropped. The US Section 301 action is designed to apply domestic political pressure within the UK and other countries over the imposition of such taxes. The UK and US held talks about the digital services tax on 4 December, and UK government sources stressed that the tariff list was being seen as procedural, rather than an escalation. The tariffs are now subject to a consultation in the US over the next few weeks. Burberry's famous trench coats would be affected UK ceramics are on the US Trade Representative's list, including certain tiles, bathroom ware like sinks and bidets, as well as ceramics for laboratory uses. About £17m of these products were exported to the US in 2020, and £24m in 2019 before Covid. Trade group the British Ceramic Confederation said it was ""monitoring developments closely, working with UK officials"". Meanwhile Adam Mansell, head of the UK Fashion & Textile Association (UKFT), called the threat to UK-made overcoats ""hugely disappointing"", noting the US had only removed separate tariffs on other types of fashion goods, such as British cashmere last month. ""At a time when we are trying to start discussions over a UK-US trade deal, it is extremely important that both governments get around the table to remove this threat as soon as possible,"" he said. ""With the industry still struggling with the impact of Covid-19 and understanding the new trade arrangements with the EU, an additional burden on our exports couldn't come at a worse time."" At the Budget, the Office for Budget Responsibility calculated the digital services tax would raise £300m in the current financial year, and as much as £700m in future years. Brought in last April it taxes at 2% the revenues - not profits - of search engines, social media services and online marketplaces which derive value from UK users. It followed years of claims in Europe and elsewhere that big tech firms do not pay enough tax in the countries where they operate. Last August, Facebook agreed to pay the French government €106m (£95.7m) in back taxes to settle a dispute over revenues earned in the country. Earlier that year, Facebook boss Mark Zuckerbergsaid he recognised the public's frustration over the amount of tax paid by tech giants. A UK government spokesperson said: ""Like many countries around the world, we want to make sure tech firms pay their fair share of tax. Our digital services tax (DST) is reasonable, proportionate and non-discriminatory. ""It's also temporary. We're working positively with the US and other international partners to find a global solution to this problem and will remove the DST when that is in place."" There are signs the Biden administration wants a more conciliatory relationship on trade with the UK than Donald Trump did. Last month, Washington agreed to suspend tariffs on UK goods, including single malt whiskies, that were imposed in retaliation over subsidies to aircraft maker Airbus. However, the UK is still lobbying the US to drop duties on British steel brought in in 2018. US suspends tariffs on single malt Scotch whisky Sunak urges US to back digital services tax Facebook agrees to pay France €106m in back taxes Comments can not be loaded To load Comments you need to enable JavaScript in your browser Deadly wildfires rage across LA as fierce winds threaten more destruction What's the latest on the LA fires, and why can't they be put out? Danes struggle with response to Trump Greenland threat 'I paid fake doctor thousands for fillers - now I look like a gargoyle' The Papers: 'Lost Angeles' and 'Musk seeks plan to oust Starmer' Pop star Chappell Roan wins BBC Sound Of 2025 Weekly quiz: Zendaya looked happy but who else sparkled at the Golden Globes? The 20 child abuse inquiry proposals - what has happened so far? The '9/11 mastermind' wants to plead guilty. Why is the US trying to stop him? Why are UK borrowing costs rising and what does it mean for me? In maps: Thousands of acres on fire in LA Before and after: How wildfires tore through LA Ed Gamble hosts the official Traitors podcast Join Ed Gamble and guests as they dissect the first episodes of The Traitors! Can art, music and words bind us in divided times? Simon Schama explores how artists have captured the transformations of British society since 1945 Enjoy a satirical smorgasbord of The News Quiz Digest a dramatic year of news as Andy Zaltzman revels in some of 2024's funniest moments The multi-award-winning legal drama returns Two years on, the Defoes are back and have gathered for a beautiful wedding in Barcelona © 2025 BBC. The BBC is not responsible for the content of external sites.Read about our approach to external linking."
"Scottish shelters 'at capacity' with unwanted lockdown petsThe Scottish SPCA received more than 136,000 calls about unwanted animals in the past year.","Rescue rabbit Tulip has now been rehomed The Scottish SPCA says its centres across Scotland have hit capacity as a result of the fallout from Covid. The animal welfare charity said last year its frontline team attended an average of 214 incidents every day. More than 3,000 animals were rehomed and more than 7,000 were taken into care. A rise in demand for puppies also led to an increase in the number of raids and seizures of dogs from low-welfare puppy farms and dealers. Calls about unwanted pets rise by more than 130% Illegal puppy trade warning as sales boom The charity recorded a dramatic increase in the number of calls to its helpline about unwanted animals, with more than 136,000 calls received in 2020. Chief superintendent Mike Flynn said: ""In many cases, neglect is not deliberate. Even people who love their animals can find themselves in a position where they are unable to continue to provide them with the care they need. The demand for puppies during lockdown has led to more raids on puppy farms ""This could be a change in personal circumstance or an accident. The decision can be heartbreaking, but ultimately it is the right one for the welfare of that animal. It is admirable to put an animal's needs first. ""Our centres have hit capacity and we desperately need the support of the animal-loving Scottish public so that they don't let animals suffer."" Eileen Silver and her family were looking for a companion for Malcolm, a pony who was soon to be arriving in their care. They eventually took in three Shetland ponies - named Mouse, Maisie and Honey - who were signed over to the Scottish SPCA last March after their previous owner could no longer care for them. Shetland ponies Mouse, Maisie and Honey were rescued when their owner could no longer care for them Ms Silver said: ""We contacted the Scottish SPCA and they told us about the three Shetlands. We knew we couldn't separate them so we took them all. ""They all settled in straight away. They even have their own little stables with their names on the doors. ""They arrived with us very well handled, we believe this is down to the hard work before they came to us. ""It's been a very straightforward process. Mouse, Maisie and Honey just needed the right care and environment and we are so happy to be able to provide that for them."" WHO KILLED EMMA?Journalist Sam Poling investigates the unsolved murder of a young woman THE DOORSTEP MURDER:The killing of Alistair Wilson is one of Scotland’s most baffling cases PODLITICAL:BBC journalists provide updates from the Scottish Parliament election campaign Comments can not be loaded To load Comments you need to enable JavaScript in your browser Deadly wildfires rage across LA as fierce winds threaten more destruction What's the latest on the LA fires, and why can't they be put out? Danes struggle with response to Trump Greenland threat 'I paid fake doctor thousands for fillers - now I look like a gargoyle' The Papers: 'Lost Angeles' and 'Musk seeks plan to oust Starmer' Pop star Chappell Roan wins BBC Sound Of 2025 Weekly quiz: Zendaya looked happy but who else sparkled at the Golden Globes? The 20 child abuse inquiry proposals - what has happened so far? The '9/11 mastermind' wants to plead guilty. Why is the US trying to stop him? Why are UK borrowing costs rising and what does it mean for me? In maps: Thousands of acres on fire in LA Before and after: How wildfires tore through LA Ed Gamble hosts the official Traitors podcast Join Ed Gamble and guests as they dissect the first episodes of The Traitors! Can art, music and words bind us in divided times? Simon Schama explores how artists have captured the transformations of British society since 1945 Enjoy a satirical smorgasbord of The News Quiz Digest a dramatic year of news as Andy Zaltzman revels in some of 2024's funniest moments The multi-award-winning legal drama returns Two years on, the Defoes are back and have gathered for a beautiful wedding in Barcelona © 2025 BBC. The BBC is not responsible for the content of external sites.Read about our approach to external linking."
