headline,article
Winter Hill fire 'may burn for days',"This video can not be played The blaze has spread over Lancashire moorland Firefighters tackling a blaze near a major TV transmitter say it will take days to extinguish but ""fear it may be much longer"". The fire, which started at Winter Hill on Thursday, is smouldering across a 1.9 sq miles (5 sq km) area. A 22-year-old man, from Bolton, was arrested on Friday on suspicion of arson with intent to endanger life. The fire has ""intensified"" following increased winds during the afternoon, Lancashire fire service said. A helicopter has been dropping water over the plume It comes as crews from around the country have joinedfirefighters and the Army to deal with a separate fire at Saddleworth Moorin Greater Manchester, which started on Sunday. Along with the Winter Hill blaze, it has blanketed the region in smoke and ash. People in nearby areas have been asked to keep doors and windows closed. About 100 soldiers from the 4th Battalion, Royal Regiment of Scotland, were sent from their Yorkshire barracks on Thursday to aid firefighters for an initial 48-hour deployment. Their presence has been extended for a further three days following a request by Greater Manchester mayor Andy Burnham. Soldiers have been drafted in to help tackle the Saddleworth Moor fire The Winter Hill blaze started on Thursday A Lancashire Fire and Rescue Service spokesman said the Winter Hill blaze was currently smouldering between the TV transmitter, which serves viewers in north-west England, and Rivington Pike near Bolton. He said predicting when it would be fully extinguished was ""not an exact science"" and depended on the strength and direction of the wind. Following the hot weather and recent blazes across the region, he appealed for people not to use naked flames near dry grass. The Winter Hill blaze stretches over 1.6 sq miles (5 sq km) Area manager Ben Norman, from the service, explained: ""I wouldn't like to say when we'd be leaving the moors - we are hopeful it would be within the next few days but we fear it may be much longer."" A trench has also been dug to prevent the fire from reaching the highest house on the hill. Mike Sewell and his family were evacuated from their home as fire crews and the water firm United Utilities, which manages an area nearby, tried to protect the property. ""It's been a bit of a nightmare but the fire service has been brilliant, they're keeping us informed all the way,"" he said. ""We've had a few little fires before but nothing on this magnitude. ""Normally there are birds flying around but there are not as many now so that's one of the main downfalls."" A trench has been dug around one family's home About 60 firefighters and 10 fire engines were at the scene of the fire earlier. They have been aided by a helicopter crew, who have been dropping water to help douse the fire. Despite the location, the blaze is not expected to affect local TV transmission services. Arson arrest over Winter Hill moor fire Lancashire Fire and Rescue Service Lancashire Constabulary Greater Manchester Fire and Rescue Service Significant pressure at Royal Preston Hospital with decision to declare ‘critical incident’ under constant review 31 hairstylists, barbers and salons in Lancashire you need to try in 2025 Trains cancelled and engineers heading to Blackburn Station – here’s why 31 hairstylists, barbers and salons you need to try in 2025 15 hairstylists, barbers and salons in and around Blackpool you need to try in 2025 Preston charity joins in the Big Adoption Day urging people to consider helping children LA fire chief leaves mid-briefing to confront new wildfire in Hollywood Hills In maps: Thousands of acres on fire in LA 'Patients are collapsing in the waiting room': A&E nurses speak out Chris Mason: Is Starmer leaving the door open to an abuse inquiry? The Papers: 'Apocalypse' LA and 'Reeves faces extra tax rises' Why does Trump want Greenland and what do its people think? How Canada's immigration debate soured - and helped seal Trudeau's fate 'I can't get divorced as I can't get my pension valued' What are cold weather payments and who can get them? BBC Sound of 2025: Barry Can't Swim is a new dance music superstar Ros Atkins on...Elon Musk's political interventions Jean-Marie Le Pen - founder of French far right and 'Devil of the Republic' Delivering brand-new miracles in 1970s East End Watch the latest series of Call the Midwife on iPlayer now Mark-Anthony Turnage shares the soundtrack of his life Once called 'Britain’s hippest composer', he's tackled topics from drug abuse to football in his work Paddy’s loaf-changing experience inside the bread factory Paddy McGuinness visits the bread factory he used to work in, and sees how they make 1.4 million loaves a week What's behind the global surrogacy boom? More countries are banning surrogacy – but demand is growing © 2025 BBC. The BBC is not responsible for the content of external sites.Read about our approach to external linking."
Mix-and-match holidays get more protection,"Holidaymakers who book hotels and flights from different firms but via a single travel intermediary will now get the same protection as those buying traditional package holidays. Package holidaymakers are both financially and legally covered if things go wrong. But those who book different elements of their holiday separately have been less well protected. The new EU regulations attempt to close the gap in consumer protection. ""Proper package holidays are the gold standard of travel,"" Simon Calder, travel correspondent at The Independent, told the BBC. ""By booking flights and accommodation in a single transaction from a tour operator, you transfer all the risk to the company. They have to sort out things like cancelled flight or an overbooked hotel. ""They also have to provide a refund or compensation as appropriate. But with the growth of online travel agents, people have been buying what they think is a package holiday, only to discover when it all goes wrong that the travel firm denies all responsibility. ""With these new changes the basic rule is - if it looks like a package holiday, with flights, accommodation and possibly a rental car all included in a single transaction, then it should have with all the prodigious consumer protection that comes with a proper package."" He said that already some companies such as On The Beach and Travel Republic had changed their terms to reflect the change. However he warned that if you are asked to pay separately online for flights and accommodation, it is likely you won't get any extra protection. The government said the new rules would protect an extra 10 million package travel holidays a year. The Package Travel Regulations 2018 were prompted by the growing number of people who book flights, hotels and other tourist services, like car hire, online. Last year 83% of British people booked a holiday over the internet. The new rules will also apply to people who go into a High Street travel agent and pick and choose separate elements of their holiday and pay for them all together. Until now mix-and-match holidays were financially protected, if an airline went out of business, for example. However, if a holidaymaker had a grievance with a hotelier, for example, they would have had to pursue any legal action themselves. Widening the definition of a package holiday means that from now on in such a situation the travel company is ""responsible for making sure that you get the holiday you paid for"", theAssociation of British Travel Agents,external(Abta) said in its guidance on the new rules. ""If something isn't provided or isn't as expected, and your travel company or its suppliers is at fault, they will need to sort this out for you,"" it added. Travel litigation specialist Joanne Brine of JMW Solicitors said: ""Should anything happen while you're on holiday - such as an accident or injury on hotel property - subsequent claims will be more straightforward to deal with, since the operator you booked with will hold liability if travel services aren't provided with reasonable skill and care. ""Plus, if an operator goes bust, you're guaranteed to receive a full refund or, if you're already abroad, to be brought home. Added legal protection also gives the right to help if weather conditions or industrial action hamper your plans. The European Union (EU)Package Travel Directive,externalapplies in all 28 EU nations. Earlier this year, theUK government issued guidance,externalon what it means for the UK travel industry. ""Package holiday regulations have finally been dragged out of the dark ages,"" said Which? travel editor Rory Boland. ""These new rules mean far more holidays will be classed as packages, giving holidaymakers protection when something goes wrong."" However, there are instances when a holidaymaker might think they are fully covered when they are not. That is because there are separate rules for ""linked travel arrangements"" online. This is when someone buys a flight on an airline's website, for example, and pays for it. They might be encouraged to go to a separate accommodation site, either immediately or within the next 24 hours, and they pay for a hotel or car rental separately. This arrangement is not classed as a package. It does not have any legal protection and the financial protection is at a lower level than for packages. Watchdog takes aim at hotel booking sites Travellers 'encouraged' to fake illness LA fire chief leaves mid-briefing to confront new wildfire in Hollywood Hills In maps: Thousands of acres on fire in LA 'Patients are collapsing in the waiting room': A&E nurses speak out Chris Mason: Is Starmer leaving the door open to an abuse inquiry? The Papers: 'Apocalypse' LA and 'Reeves faces extra tax rises' Why does Trump want Greenland and what do its people think? How Canada's immigration debate soured - and helped seal Trudeau's fate 'I can't get divorced as I can't get my pension valued' What are cold weather payments and who can get them? BBC Sound of 2025: Barry Can't Swim is a new dance music superstar Ros Atkins on...Elon Musk's political interventions Jean-Marie Le Pen - founder of French far right and 'Devil of the Republic' Delivering brand-new miracles in 1970s East End Watch the latest series of Call the Midwife on iPlayer now Mark-Anthony Turnage shares the soundtrack of his life Once called 'Britain’s hippest composer', he's tackled topics from drug abuse to football in his work Paddy’s loaf-changing experience inside the bread factory Paddy McGuinness visits the bread factory he used to work in, and sees how they make 1.4 million loaves a week What's behind the global surrogacy boom? More countries are banning surrogacy – but demand is growing © 2025 BBC. The BBC is not responsible for the content of external sites.Read about our approach to external linking."
Belgian boy off to university aged 8,"A Belgian boy has graduated secondary school aged eight after completing six years' study in just a year and a half. Laurent Simons, whose father is Belgian and mother Dutch, and has an IQ of 145 according to his parents, collected a diploma with a class of 18-year-olds. Speaking to Belgium's RTBF radio, Laurent said his favourite subject was maths ""because it's so vast, there's statistics, geometry, algebra"". After a two-month holiday from school, he will start university. His father said his son had struggled when he was younger to play with other children, and had not been particularly interested in toys. Laurent said he had considered becoming a surgeon and an astronaut but was now thinking about going into computers. ""If he decided tomorrow to become a carpenter, that would not be a problem for us, as long as he is happy,"" his father said. This four-year-old's art sells for thousands This four-year-old's art sells for thousands - BBC News LA fire chief leaves mid-briefing to confront new wildfire in Hollywood Hills In maps: Thousands of acres on fire in LA 'Patients are collapsing in the waiting room': A&E nurses speak out Chris Mason: Is Starmer leaving the door open to an abuse inquiry? The Papers: 'Apocalypse' LA and 'Reeves faces extra tax rises' Why does Trump want Greenland and what do its people think? How Canada's immigration debate soured - and helped seal Trudeau's fate 'I can't get divorced as I can't get my pension valued' What are cold weather payments and who can get them? BBC Sound of 2025: Barry Can't Swim is a new dance music superstar Ros Atkins on...Elon Musk's political interventions Jean-Marie Le Pen - founder of French far right and 'Devil of the Republic' Delivering brand-new miracles in 1970s East End Watch the latest series of Call the Midwife on iPlayer now Mark-Anthony Turnage shares the soundtrack of his life Once called 'Britain’s hippest composer', he's tackled topics from drug abuse to football in his work Paddy’s loaf-changing experience inside the bread factory Paddy McGuinness visits the bread factory he used to work in, and sees how they make 1.4 million loaves a week What's behind the global surrogacy boom? More countries are banning surrogacy – but demand is growing © 2025 BBC. The BBC is not responsible for the content of external sites.Read about our approach to external linking."
NHS to stop 'ineffective' treatments,"Tonsils removal, breast reductions and snoring surgery will be offered to far fewer patients from next year, under plans being drawn up by NHS England. Officials are to discuss proposals to stop or reduce 17 routine procedures deemed to be ""ineffective or risky"". The treatment will be offered only if it is judged to be of ""compelling"" benefit and there are no alternatives. NHS England said the move would affect about 100,000 people every year and free up an estimated £200m. The British Society for Surgery of the Hand (BSSH) said cutting back on certain procedures would cost the economy more as people would be unable to work without surgery. Patients at risk of serious harm from their condition will continue to be offered treatment. It follows reviews last year to save £190m from supplying over-the-counter medications and treatments described as ""low value"". NHS plans to cut homeopathy treatments NHS plan: What we still need to know Theresa May unveils £20bn boost for NHS The announcement comes as thousands of people gathered in central London to mark the 70th anniversary of the NHS and demonstrate against cuts to the health service. Organisers of the rally, which include the People's Assembly - which campaigns against austerity cuts - and unions, are calling for more money for the NHS. This video can not be played Samantha Lilley: ""We are allowing the NHS to become unrecognisable"" NHS England says for most of the 17 procedures under consideration, alternative treatments including physiotherapy, a minor injection or change of diet are likely to be effective. It says the savings made by not carrying out the procedures will be reinvested in better frontline cancer, mental health and other critical services. Its national medical director, Prof Stephen Powis, said: ""If we want the very best clinical care for our patients, we need to stop putting them through treatments where risks and harms outweigh the benefits. ""By reducing unnecessary or risky procedures for some patients we can get better outcomes while reducing waste and targeting resource to where it is most needed."" The plans have the backing of health professionals and the National Institute for Health and Care Excellence, which advises on the clinical benefits and cost-effectiveness of treatments. It is proposed four treatments will be offered only when a patient makes an individual request. These include surgery for snoring, where there is said to be only limited clinical evidence of effectiveness and which poses significant risks to patients. The others are: dilatation and curettage for heavy menstrual bleeding, knee arthroscopies for osteoarthritis and injections for non-specific back pain. A further 13 procedures will only to be offered when specific criteria are met: Breast reduction Removal of benign skin lesions Grommets for Glue Ear Tonsillectomy for sore throats Haemorrhoid surgery Hysterectomy for heavy menstrual bleeding Chalazia (lesions on eyelids) removal Removal of bone spurs for shoulder pain Carpal tunnel syndrome release Dupuytren's contracture release for  tightening of fingers Ganglion excision - removal of noncancerous lumps on the wrist or hand Trigger finger release Varicose vein surgery NHS England plans to consult publicly on the proposals between 4 July and 28 September, with changes planned to start in 2019-20. Some have criticised the plans. Samantha Lilley, 29, was born with a rare genetic condition called epidermal nevus syndrome, which causes skin lesions. Throughout her life she has had procedures to help the physical and mental suffering but is worried about whether those would be discontinued. She said: ""They're not life threatening, but they're painful and unsightly, to leave them would be detrimental to my health."" She added: ""My condition is lifelong. Is this what the NHS is now - that you must be at death's door to receive treatment? This isn't what it was created for - its purpose was to improve the quality of life of British citizens."" Thousands march through the streets of London on Saturday marking the 70th anniversary of the NHS Matthew Bennett from Bracknell, Berkshire, said having grommets for glue ear fitted when he was a boy fully restored his hearing. He also said his brother benefited hugely from an operation after severe tonsillitis meant he missed time at university time and lost him a job. Mr Bennett said: ""If he hadn't had his tonsils out recently, he'd probably still be struggling with work."" Anthony Stuart, a 52-year-old artist blacksmith, has Dupuytren's contracture - where fingers become permanently bent or flexed - and has had surgery on one of his hands to correct this. He is due to have another procedure to try to correct his other hand in July. He said the treatment had a huge positive impact on his condition. ""I'm astounded that the government can call treatment for Dupuytren's ineffective,"" added Mr Stuart. ""My consultant says if people don't have this procedure it could lead to amputation, which is even more costly to the NHS."" GP Brian Hope said he hoped publishing the list would make people come up with healthier solutions to certain problems. He added: ""We have still got to try and get people to think, 'Wait a minute, could I do something myself - lose weight, be more active?' BSSH President David Shewring said conditions such as Mr Stuart's could force people to take time off work or stop altogether. He also said it was ""wrong"" to brand such procedures unnecessary or risky and did patients a ""huge disservice"". Physiotherapist Lucy Macdonald also welcomed the plans, saying she was pleased knee arthroscopies and shoulder decompressions would be limited, ""because for a long time research has shown they are largely ineffective"". Academy of Medical Royal Colleges chairwoman Prof Carrie MacEwen said the changes would benefit patients, clinicians and the NHS as a whole ""by reducing harm and targeting those who will benefit most"". Theresa May unveils £20bn boost for NHS NHS plan: What we still need to know NHS no to dandruff and diarrhoea treatment NHS plans to cut homeopathy treatments LA fire chief leaves mid-briefing to confront new wildfire in Hollywood Hills In maps: Thousands of acres on fire in LA 'Patients are collapsing in the waiting room': A&E nurses speak out Chris Mason: Is Starmer leaving the door open to an abuse inquiry? The Papers: 'Apocalypse' LA and 'Reeves faces extra tax rises' Why does Trump want Greenland and what do its people think? How Canada's immigration debate soured - and helped seal Trudeau's fate 'I can't get divorced as I can't get my pension valued' What are cold weather payments and who can get them? BBC Sound of 2025: Barry Can't Swim is a new dance music superstar Ros Atkins on...Elon Musk's political interventions Jean-Marie Le Pen - founder of French far right and 'Devil of the Republic' Delivering brand-new miracles in 1970s East End Watch the latest series of Call the Midwife on iPlayer now Mark-Anthony Turnage shares the soundtrack of his life Once called 'Britain’s hippest composer', he's tackled topics from drug abuse to football in his work Paddy’s loaf-changing experience inside the bread factory Paddy McGuinness visits the bread factory he used to work in, and sees how they make 1.4 million loaves a week What's behind the global surrogacy boom? More countries are banning surrogacy – but demand is growing © 2025 BBC. The BBC is not responsible for the content of external sites.Read about our approach to external linking."
