headline,article
Top designer reveals fireplace explosion injuries,"Olivier Rousteing's Instagram photo showed injuries he suffered last year, he said Celebrated French fashion designer Olivier Rousteing has revealed he was injured following an accident at his home last year, sharing a picture of himself in heavy bandages. Rousteing, the creative director of fashion house Balmain, shared the news inan Instagram post,externalon Saturday. ""Exactly a year ago, the fireplace inside my house exploded,"" he wrote. He woke the next day at the Hôpital Saint Louis in Paris, and has since been recovering from his injuries. Rousteing said his insecurities and fashion's ""obsession with perfection"" had stopped him from revealing all before now. ""To be honest I am not really sure why I was so ashamed,"" he wrote. As he recovered he had hidden his injuries with long sleeves and jewellery during interviews. ""Now, a year later - healed, happy and healthy,"" he wrote. He thanked the medical staff who had treated him despite ""dealing with an incredible number of Covid cases at that same time"", and spoke about how lucky he now felt. ""There is always the sun after the storm."" The designer, pictured here at Paris Fashion Week earlier this month, says he is ""healed, happy and healthy"" Fellow fashion designers, models and other celebrities were among those to offer their support in response to Rousteing's post. The designer Donatella Versace wrote she was ""so glad"" he was safe. ""Let love rule,"" said musician Lenny Kravitz. Kim Kardashian West wrote ""I love you"", while her mother Kris Jenner said she was ""beyond proud"" of Rousteing, adding that his ""message of hope and strength and focus and love will always inspire everyone who you come in contact with"". Rousteing took up his post as Balmain's creative director in 2011 at the age of just 25.According to a profile in Out Magazine,externalthe brand grew between 15% and 20% between 2012 and 2015. He has opened boutiques in London and New York, the company's first outside Paris. A 2019 Netflix documentary, Wonder Boy, looked at his career and followed him as he searched for his biological mother. Night-time curfew imposed in fire-hit areas of LA as police warn against 'despicable' looting 'I have nothing to go back to' - BBC reporter tells of LA fires heartbreak Trump avoids prison or fine in hush-money case sentencing LA fires: How three days of devastation unfolded What's the latest on the Los Angeles wildfires and what caused them? The '9/11 mastermind' wants to plead guilty. Why is the US trying to stop him? Pop star Chappell Roan wins BBC Sound Of 2025 Weekly quiz: Zendaya looked happy but who else sparkled at the Golden Globes? Inside the UK's first legal drug consumption room Sheen to fund new national theatre for Wales Danes struggle with response to Trump Greenland threat The Upbeat newsletter: Start your week on a high with uplifting stories delivered to your inbox Dragons’ Den returns with a new line-up of celebrity guests Can a fresh batch of entrepreneurs secure the deal of a lifetime? Are smart scales really as ‘smart’ as they claim to be? Greg Foot explores whether they can accurately measure weight, body fat, muscle and bone mass The award-winning psychological competition is back A nail-biting game of detection, backstabbing and trust. Who will make it through? How close are we to a cancer vaccine? How might it help in the treatment of the disease? © 2025 BBC. The BBC is not responsible for the content of external sites.Read about our approach to external linking."
"Top designer reveals fireplace explosion injuriesOlivier Rousteing, creative director of Balmain, shared a picture of himself swathed in bandages.Europe","Olivier Rousteing's Instagram photo showed injuries he suffered last year, he said Celebrated French fashion designer Olivier Rousteing has revealed he was injured following an accident at his home last year, sharing a picture of himself in heavy bandages. Rousteing, the creative director of fashion house Balmain, shared the news inan Instagram post,externalon Saturday. ""Exactly a year ago, the fireplace inside my house exploded,"" he wrote. He woke the next day at the Hôpital Saint Louis in Paris, and has since been recovering from his injuries. Rousteing said his insecurities and fashion's ""obsession with perfection"" had stopped him from revealing all before now. ""To be honest I am not really sure why I was so ashamed,"" he wrote. As he recovered he had hidden his injuries with long sleeves and jewellery during interviews. ""Now, a year later - healed, happy and healthy,"" he wrote. He thanked the medical staff who had treated him despite ""dealing with an incredible number of Covid cases at that same time"", and spoke about how lucky he now felt. ""There is always the sun after the storm."" The designer, pictured here at Paris Fashion Week earlier this month, says he is ""healed, happy and healthy"" Fellow fashion designers, models and other celebrities were among those to offer their support in response to Rousteing's post. The designer Donatella Versace wrote she was ""so glad"" he was safe. ""Let love rule,"" said musician Lenny Kravitz. Kim Kardashian West wrote ""I love you"", while her mother Kris Jenner said she was ""beyond proud"" of Rousteing, adding that his ""message of hope and strength and focus and love will always inspire everyone who you come in contact with"". Rousteing took up his post as Balmain's creative director in 2011 at the age of just 25.According to a profile in Out Magazine,externalthe brand grew between 15% and 20% between 2012 and 2015. He has opened boutiques in London and New York, the company's first outside Paris. A 2019 Netflix documentary, Wonder Boy, looked at his career and followed him as he searched for his biological mother. Night-time curfew imposed in fire-hit areas of LA as police warn against 'despicable' looting 'I have nothing to go back to' - BBC reporter tells of LA fires heartbreak Trump avoids prison or fine in hush-money case sentencing LA fires: How three days of devastation unfolded What's the latest on the Los Angeles wildfires and what caused them? The '9/11 mastermind' wants to plead guilty. Why is the US trying to stop him? Pop star Chappell Roan wins BBC Sound Of 2025 Weekly quiz: Zendaya looked happy but who else sparkled at the Golden Globes? Inside the UK's first legal drug consumption room Sheen to fund new national theatre for Wales Danes struggle with response to Trump Greenland threat The Upbeat newsletter: Start your week on a high with uplifting stories delivered to your inbox Dragons’ Den returns with a new line-up of celebrity guests Can a fresh batch of entrepreneurs secure the deal of a lifetime? Are smart scales really as ‘smart’ as they claim to be? Greg Foot explores whether they can accurately measure weight, body fat, muscle and bone mass The award-winning psychological competition is back A nail-biting game of detection, backstabbing and trust. Who will make it through? How close are we to a cancer vaccine? How might it help in the treatment of the disease? © 2025 BBC. The BBC is not responsible for the content of external sites.Read about our approach to external linking."
Remove court's oversight of NI Protocol - Frost,"Lord Frost will use a speech next week to reiterate that the UK wants the European Court of Justice (ECJ) removed from oversight of the NI Protocol. The EU will bring forward proposals on Wednesday for reforming the protocol. They will focus on easing practical problems, rather than changing oversight arrangements. But the Brexit minister will say: 'Without new arrangements in this area the protocol will never have the support it needs to survive"". The protocol is a special Brexit deal for Northern Ireland, agreed by the UK and EU in 2019. It avoids a hard border on the island of Ireland by keeping Northern Ireland in the EU's single market for goods. That creates a new trade border between Northern Ireland and the rest of the UK. Why are there tensions over the NI Brexit deal? EU to table new proposals for NI Protocol This has caused practical difficulties for some businesses while unionists say it undermines Northern Ireland's constitutional position as part of the UK. The UK government also wants to reverse its previous agreement on the oversight role of the ECJ, which is the EU's highest court. In a paper published in July, the government said it had only agreed to the ECJ's role because of the ""very specific circumstances"" of the protocol negotiation. It now wants a new governance arrangement in which disputes should be ""managed collectively and ultimately through international arbitration."" Lord Frost is the UK's Brexit minister The ECJ is the supreme interpreter of the rules of the single market. As the protocol works by keeping Northern Ireland in the single market for goods, the EU says removing the ECJ would simply unravel the protocol. Speaking last week, European Commission Vice President Maros Sefcovic said: ""I find it hard to see how Northern Ireland would stay or would keep the access to the single market without oversight of the European Court of Justice."" This video can not be played Boris Johnson said he believes the Northern Ireland Protocol could ""in principle work"" if it was ""fixed"". Lord Frost is expected to address that issue when he makes a speech to diplomats in Portugal on Tuesday. He will say: ""The commission have been too quick to dismiss governance as a side issue. The reality is the opposite. ""The role of the ECJ  in Northern Ireland and the consequent inability of the UK government to implement the very sensitive arrangements in the protocol in a reasonable way has created a deep imbalance in the way the protocol operates."" When the EU publishes its proposals next week that is expected to lead to a new round of negotiations. Both sides have suggested there will beshort, intense talks processbeginning in late October or early November. PM says NI Protocol could work if it was 'fixed' Night-time curfew imposed in fire-hit areas of LA as police warn against 'despicable' looting 'I have nothing to go back to' - BBC reporter tells of LA fires heartbreak Trump avoids prison or fine in hush-money case sentencing LA fires: How three days of devastation unfolded What's the latest on the Los Angeles wildfires and what caused them? The '9/11 mastermind' wants to plead guilty. Why is the US trying to stop him? Pop star Chappell Roan wins BBC Sound Of 2025 Weekly quiz: Zendaya looked happy but who else sparkled at the Golden Globes? Inside the UK's first legal drug consumption room Sheen to fund new national theatre for Wales Danes struggle with response to Trump Greenland threat The Upbeat newsletter: Start your week on a high with uplifting stories delivered to your inbox Dragons’ Den returns with a new line-up of celebrity guests Can a fresh batch of entrepreneurs secure the deal of a lifetime? Are smart scales really as ‘smart’ as they claim to be? Greg Foot explores whether they can accurately measure weight, body fat, muscle and bone mass The award-winning psychological competition is back A nail-biting game of detection, backstabbing and trust. Who will make it through? How close are we to a cancer vaccine? How might it help in the treatment of the disease? © 2025 BBC. The BBC is not responsible for the content of external sites.Read about our approach to external linking."
Covid coma cancer patient 'a cat with nine lives',"Mrs Luttrell was only able to see her husband via a video-link while he was being treated A cancer patient whose wife was told he might not wake from a coma he was put in while being treated for Covid-19 has been called ""a cat with nine lives"" by doctors after making a speedy recovery. Paul Luttrell, who has myeloma cancer, went to Bristol's Southmead Hospital on 27 July and was placed in a coma. His wife Dalma said she was ""very much prepared for the worst"", but the 52-year-old woke after 11 days and left hospital a month after arriving. She said it was ""unbelievable"". Mr Luttrell, from Frome, was sent to the hospital after nurses noticed he was ""very unwell"" and had to put him on oxygen whilst on a routine dialysis visit. ""They put me into an induced coma for 11 days and it took me a week to fully wake up,"" he said. ""When I did, I asked doctors to call Dalma. ""They couldn't believe it."" Mr Luttrell said he hoped his story will show that the dangers of Covid-19 still exist Mrs Luttrell said following conversations with her husband's doctors, she had ""very much prepared for the worst"". She also said the medical team had warned her that as he was in a coma, he would probably need a long recovery time if he survived. However, within two weeks ,she said she ""had a call from him"", adding: ""It was unbelievable."" Mr Luttrell, who had been double vaccinated, said though he had had lucid dreams whilst in the coma of ""terrible things"", after he woke, he could walk ""my stairs at home to go to dialysis"" within a week. He returned home on 26 August. ""My haematologist and doctors said I was a cat with nine lives,"" he said. However, he said he felt lucky to be alive and was worried that about ""people still not taking [coronavirus] seriously"". ""Get vaccinated,"" he said, adding: ""Covid is very real."" Follow BBC West onFacebook,external,Twitter,externalandInstagram,external. Send your story ideas to:bristol@bbc.co.uk,external Ambulance worker 'scarred' by 33 day Covid coma Covid survivor back home after two months in coma Covid survivor urges people against complacency '100 free bowls': award-winning street vendor coming to Taunton Concerns over ‘industrial’ activities at former RAF airfield near Bridgwater Stokely gets increased care rating after being 'in breach of regulations' Shepton Mallet jobs roundup: from cheese stacking to saving lives – apply now or regret it later North Somerset Council could join devolved Wessex group Street and Glastonbury job market: apply now or forever wonder what could have been Night-time curfew imposed in fire-hit areas of LA as police warn against 'despicable' looting 'I have nothing to go back to' - BBC reporter tells of LA fires heartbreak Trump avoids prison or fine in hush-money case sentencing LA fires: How three days of devastation unfolded What's the latest on the Los Angeles wildfires and what caused them? The '9/11 mastermind' wants to plead guilty. Why is the US trying to stop him? Pop star Chappell Roan wins BBC Sound Of 2025 Weekly quiz: Zendaya looked happy but who else sparkled at the Golden Globes? Inside the UK's first legal drug consumption room Sheen to fund new national theatre for Wales Danes struggle with response to Trump Greenland threat The Upbeat newsletter: Start your week on a high with uplifting stories delivered to your inbox Dragons’ Den returns with a new line-up of celebrity guests Can a fresh batch of entrepreneurs secure the deal of a lifetime? Are smart scales really as ‘smart’ as they claim to be? Greg Foot explores whether they can accurately measure weight, body fat, muscle and bone mass The award-winning psychological competition is back A nail-biting game of detection, backstabbing and trust. Who will make it through? How close are we to a cancer vaccine? How might it help in the treatment of the disease? © 2025 BBC. The BBC is not responsible for the content of external sites.Read about our approach to external linking."
James Bond actor gives fundraising dads £10k boost,"Mr Airey said he was happy the actor had allowed them to share details of his donation Film star Daniel Craig has donated £10,000 to three fathers who have set out on a 300-mile walk to raise funds for a suicide prevention charity after their daughters took their own lives. Andy Airey, Mike Palmer and Tim Owen's ""Three Dads Walking"" trek will see them walk between their homes in Cumbria, Greater Manchester and Norfolk. They are raising money for the Papyrus charity. They said the donation from the James Bond actor was ""amazing"". This video can not be played Three dads united by daughters' suicides take on challenge Mr Airey said he was happy that the actor had let them share the news of his generosity. ""Allowing us to shout about it is fantastic news, especially as he's just about the most famous film actor in the world at the moment, isn't he?"" he said. The trio, who set out earlier, will be walking about 20 miles a day between Mr Airey's home, near Cumbria, Mr Palmer's house in Sale, Greater Manchester, and Mr Owen's property in Shouldham, Norfolk. They expect to complete the challenge on 23 October. Mr Airey, whose 29-year-old daughter Sophie took her own life in 2018, said they had ""three different stories to tell, but each has the same tragic ending; the devastating loss of a daughter to suicide"". ""Daniel Craig has clearly been moved by the indescribable pain we and our families are suffering and wants to help us to bring something positive out of the utter devastation,"" he added. Mr Palmer, whose daughter Beth died in 2020, said being part of the challenge was ""not a club I want to belong to, but [it gives us] an opportunity to fight back and maybe make a difference. ""We hope that by linking our three homes and telling our three daughters' very different stories, we will put a spotlight on young mental health."" As well as fundraising, the trio want to raise awareness of the help and support available Mr Owen added that ""strongly"" believed that ""in a moment of darkness"", his 19-year-old daughter Emily ""made a wrong decision"" last year. ""Had she just taken time to think or to speak to someone, her decision and my family's lives would be on another path,"" he said. ""Instead, she decided she could no longer go on, leaving behind a devastating ripple effect on her family and friends."" If you're affected by the issues in this piece, you can find support fromBBC Action Line. Follow BBC North East & Cumbria onTwitter,external,Facebook,externalandInstagram,external. Send your story ideas tonortheastandcumbria@bbc.co.uk,external. The three dads united by their daughters' suicides. Video, 00:04:00The three dads united by their daughters' suicides Papyrus UK Cumbria police operation leads to reduction in antisocial behaviour 'Concerning' reports of children playing on frozen pond Plans for new urgent treatment centre at Cumberland Infirmary approved Ulverston event to celebrate Burns Night with alternative to traditional supper Tributes pour in for popular businessman and community stalwart Bryan Lloyd Gritters set off on 840-mile journey to treat icy roads in Cumbria Night-time curfew imposed in fire-hit areas of LA as police warn against 'despicable' looting 'I have nothing to go back to' - BBC reporter tells of LA fires heartbreak Trump avoids prison or fine in hush-money case sentencing LA fires: How three days of devastation unfolded What's the latest on the Los Angeles wildfires and what caused them? The '9/11 mastermind' wants to plead guilty. Why is the US trying to stop him? Pop star Chappell Roan wins BBC Sound Of 2025 Weekly quiz: Zendaya looked happy but who else sparkled at the Golden Globes? Inside the UK's first legal drug consumption room Sheen to fund new national theatre for Wales Danes struggle with response to Trump Greenland threat The Upbeat newsletter: Start your week on a high with uplifting stories delivered to your inbox Dragons’ Den returns with a new line-up of celebrity guests Can a fresh batch of entrepreneurs secure the deal of a lifetime? Are smart scales really as ‘smart’ as they claim to be? Greg Foot explores whether they can accurately measure weight, body fat, muscle and bone mass The award-winning psychological competition is back A nail-biting game of detection, backstabbing and trust. Who will make it through? How close are we to a cancer vaccine? How might it help in the treatment of the disease? © 2025 BBC. The BBC is not responsible for the content of external sites.Read about our approach to external linking."
