headline,article
Inter 0-0 AC Milan - Deulofeu hits post,"Seventh v sixth in Serie A Milan taken over by Chinese investors this week Clubs drew last derby 2-2 in November Emlyn Begley When these sides met in November, it was Inter who rescued an injury-time 2-2 draw throughÂ Ivan Perisic. The quality mightn't be what it once was in this great rivalry but there's no doubting the drama. Magnificent stuff. I'm going to leave you there. Thanks for joining me this lunchtime. Follow Spurs v Bournemouth here. I'll be back later to talk you though Sporting Gijon v Real Madrid at 15:15 BST. #bbceurofooty Ayo Obit:ÂAmazing end to the Milan Derby!!! Thank goodness for goal line technology! Inter 2-2 AC Milan That was it, the final kick of the game. Inter MIlan players look devastated as they miss out on the chance to overtake their rivals in the league. For the second time this season, the Milan derby ends 2-2. AC Milan have rescued this from 2-0 down right at the death. The corner comes all the way through toÂCristian Zapata,who hooks the ball off the underside of the post and Gary Medel hacks it away. But... goalline technology says GOAL. It had just crossed the line before Medel got it away. DRAMA. AC Milan have one last chance asÂ Gerard Deulofeu wins a corner. Jonathan Biabiany almost seals it for Inter but blasts high and wide. It's getting heated now. Milan's chance might be gone - 30 seconds left. Manuel Locatelli is booked for a hack. Free-kick to AC Milan asÂ Manuel Locatelli is felled byÂ Roberto Gagliardini. Yellow card. But the free-kick comes to nothing. Just 90 seconds left. AC Milan come forward but Miranda guides the ball out for a goal-kick after Suso failed to get onto it. Two minutes of the five gone. Five minutes added on. Inter bring on winger Jonathan Biabiany for his first Serie A appearance of the season. Maverick decision. Off comes goalscorer Antonio Candreva.  End to end. Samir Handanovic punches away a Suso free-kick under pressure. Inter break but they lose out to an offside decision. Will there be one last chance? Inter keeperÂ Samir Handanovic is booked for time wasting. It could be a long final four minutes plus injury time. And just like that, we have a game on our hands. Milan play a short corner and Suso whips the ball in with defender Alessio Romagnoli prodding the ball home. Alessio Romagnoli Game on! Both sides make a change, AC Milan bring on forwardÂ Lucas Ocampos for defenderÂ Davide Calabria. Inter replace midfielder Joao Mario with defenderÂ Jeison Murillo. AC Milan are going for it now, Carlos Bacca goes round keeper Samir Handanovic and tries to cross the ball into new strike partnerÂ Gianluca Lapadula, but he doesn't get near to it. They need to find a goal soon to give them time for a second. #bbceurofooty Rob Cantarero:ÂMilan clubs may not have superstars anymore but some good players in there today. Juve would probably win the PL at presentÂ AC Milan's Jose Sosa has been hurt in a fair challenge from Eder.Â Gianluca Lapadula replaces him. He's going up front with Carlos Bacca. Fifteen minutes left. Â© 2025 BBC. The BBC is not responsible for the content of external sites.Read about our approach to external linking."
Inter v AC Milan,"Seventh v sixth in Serie A Milan taken over by Chinese investors this week Clubs drew last derby 2-2 in November Emlyn Begley When these sides met in November, it was Inter who rescued an injury-time 2-2 draw throughÂ Ivan Perisic. The quality mightn't be what it once was in this great rivalry but there's no doubting the drama. Magnificent stuff. I'm going to leave you there. Thanks for joining me this lunchtime. Follow Spurs v Bournemouth here. I'll be back later to talk you though Sporting Gijon v Real Madrid at 15:15 BST. #bbceurofooty Ayo Obit:ÂAmazing end to the Milan Derby!!! Thank goodness for goal line technology! Inter 2-2 AC Milan That was it, the final kick of the game. Inter MIlan players look devastated as they miss out on the chance to overtake their rivals in the league. For the second time this season, the Milan derby ends 2-2. AC Milan have rescued this from 2-0 down right at the death. The corner comes all the way through toÂCristian Zapata,who hooks the ball off the underside of the post and Gary Medel hacks it away. But... goalline technology says GOAL. It had just crossed the line before Medel got it away. DRAMA. AC Milan have one last chance asÂ Gerard Deulofeu wins a corner. Jonathan Biabiany almost seals it for Inter but blasts high and wide. It's getting heated now. Milan's chance might be gone - 30 seconds left. Manuel Locatelli is booked for a hack. Free-kick to AC Milan asÂ Manuel Locatelli is felled byÂ Roberto Gagliardini. Yellow card. But the free-kick comes to nothing. Just 90 seconds left. AC Milan come forward but Miranda guides the ball out for a goal-kick after Suso failed to get onto it. Two minutes of the five gone. Five minutes added on. Inter bring on winger Jonathan Biabiany for his first Serie A appearance of the season. Maverick decision. Off comes goalscorer Antonio Candreva.  End to end. Samir Handanovic punches away a Suso free-kick under pressure. Inter break but they lose out to an offside decision. Will there be one last chance? Inter keeperÂ Samir Handanovic is booked for time wasting. It could be a long final four minutes plus injury time. And just like that, we have a game on our hands. Milan play a short corner and Suso whips the ball in with defender Alessio Romagnoli prodding the ball home. Alessio Romagnoli Game on! Both sides make a change, AC Milan bring on forwardÂ Lucas Ocampos for defenderÂ Davide Calabria. Inter replace midfielder Joao Mario with defenderÂ Jeison Murillo. AC Milan are going for it now, Carlos Bacca goes round keeper Samir Handanovic and tries to cross the ball into new strike partnerÂ Gianluca Lapadula, but he doesn't get near to it. They need to find a goal soon to give them time for a second. #bbceurofooty Rob Cantarero:ÂMilan clubs may not have superstars anymore but some good players in there today. Juve would probably win the PL at presentÂ AC Milan's Jose Sosa has been hurt in a fair challenge from Eder.Â Gianluca Lapadula replaces him. He's going up front with Carlos Bacca. Fifteen minutes left. Â© 2025 BBC. The BBC is not responsible for the content of external sites.Read about our approach to external linking."
French election: Getting the estate to vote,"This video can not be played Meet the teenagers from Citizen Challenge. Votes have no colour, religion or class, so why so few election posters in multi-ethnic La Busserine? About 3,000 people (nobody seems to know for sure) are packed into this 1960s housing estate in northern Marseille and they have some serious issues. Think ""ghetto"" and you are on the right track. La Busserine is in the 14th Arrondissement, a district which made national headlines in 2014 when, together with the neighbouring 13th, it elected the city's first (sector-level) mayor from the far right National Front (more on that later). Yet over two days, the only traces I found of this month's presidential election were a few posters for radical leftist Jean-Luc MÃ©lenchon. But one group of first-time voters do not need posters because they have smartphones and can telltheir Macron from their Hamonby actually reading their manifestos. These daughters and sons of Comorans, Moroccans and other immigrants want to reconnect their neighbours to politics. Oh and they are looking for a party of the other kind too. Fifty areas in 34 towns and cities across France are competing to see who can reduce electoral abstention the most. Citizen Challenge,external(in French) was launched in the deprived Strasbourg suburb of Neuhof after 80% of voters there stayed away from the first round of regional elections in December 2015. Razia Mohamed Zaki (centre) and Delphine Soumalia (sitting beside little Delyha) are also part of Citizen Challenge, along with Sarah Mmamdi (right) Avideo,external(in French) which features kids daring adults to get out and vote for their future got more than 200,000 views on YouTube and abstention fell to 70% in the second round, Neuhof community centre director Khoutir Khechab explains. He and his team are negotiating with public bodies and bands to come up with the prize: a concert in the winning area. French election: Everything you need to know Strasbourg's grassroots campaign Elections come and go but on the estate, a place full of children, people have been sinking under the same issues for years. One issue comes around ten o'clock in the morning as the spotters emerge into the sun to watch over the estate's notorious hashish trade. Another emerges after dark when therÃ©seaux(drug gangs) settle scores, sometimes with akalash(Kalashnikov). And morning, noon and night, the issues of unemployment and poverty hang over this community living 8km (five miles) from the luxury boutiques and restaurants of Marseille's Vieux Port (city centre). Discrimination is also a live issue for the numerous Muslims here. Some 200,000 live in Marseille (population 855,393 as of 2013), according to French media. ""Muslims here are like disabled people,"" says a local shipyard worker of Algerian ancestry who does not want to be named. Bullet holes at an abandoned flat on the Flamants estate, adjacent to La Busserine ""If your name is Mohamed it's like you're missing an arm or a foot or a face. We're given all the hard work, the dirtiest work, the worst jobs."" ""It's called a challenge because it's not easy,"" says French radio correspondentStephane Burgatt,external, who followed the group around the flats of La Busserine in December. ""It's the kind of place where most people don't care about politics and don't know for whom to vote."" A Citizen Challenge event in La Busserine last month brought in people from across Marseille First-time voters Amal Osman, 18, Mohamed Abdallah, 19, and Sarah Mmadi, 18, are among a couple of dozen activists who went door to door persuading people to register to vote. Today, equipped with props like a mock polling station, they focus on reminding voters in La Busserine (70% abstention at the regional elections) to actually use their ballots. The bright side of France's migrant suburbs The 14th, a working-class district, traditionally voted Communist or Socialist but in 2014 voters swung to the far right. Most of the Front's support came from outside the housing estates, among white voters. However it is clear that some Muslims also voted for Stephane Ravier as their mayor despite his party'shard line on Islam and mass immigration, says Richard Ghevontian, a politics expert atAix Marseille University,external. Professor Ghevontian says uncertainty over the election's outcome is unprecedented ""[Socialist President Francois] Hollande's policies disappointed many and Marriage For Everyone [the Socialists' same-sex marriage act of 2013, opposed by the National Front] greatly shocked Muslims, who are extremely conservative on social matters,"" he says, citing opinion surveys. ""It was a vote to punish Hollande,"" says a teacher in La Busserine, who does not want to be identified. The shipyard worker, like nearly every voter I spoke to on the estate, is voting for Mr MÃ©lenchon. ""He tells the truth and a vote for him is a vote for peace with Muslims,"" he explains. And three years under Mayor Ravier? ""He does nothing for us but he leaves us alone,"" he says with a shrug. Who are the candidates? France was once a model for voter turnout in the EU, says Professor Ghevontian, but in this election there is a real concern that abstention may rise. If election campaigners do not go into places like La Busserine, it is because they have become no-go areas even for the police, he says. Marseille is France's second-biggest city Yet the first-time voters keep up their campaign, encouraged by growing publicity for their cause and, crucially, the 100 or so people who registered to vote after talking to them. ""Citizen Challenge is good for the young because it gets them active and gives them a bit more value as human beings and citizens,"" says the teacher, ""but our politicians live on another planet and they need to come back down to Earth."" Patrick Housseini runs the estate's football team, AS Busserine Will La Busserine win the concert? Street parties are an old and happy tradition in other parts of Marseille, with free concerts and kids' activities. There is a real appetite on the estate for breaking out of the social isolation.AS Busserine,externalfootball club inspires a loyal following and the Agora social centre runs clubs. Sarah, who still remembers the fear of failure she felt as she knocked on her first door last year, says: ""Our aim is to revive the area because the life went out of it."" ""We got together to show the little ones that there is a good path and a bad path and they can choose the right one,"" says Amal. ""Citizen Challenge lets them see the world of politics. It's only the beginning."" Graphics by Mike Hills and David Molloy More on Patrick's Marseille assignment in thisTwitter Moment,external. The election explained in five charts Marine Le Pen: The battle to be president The young alt-right making waves Election Tour de France: South-west voters want change Fake news in the French election Fake news in the French election French election explained in five charts Election Tour de France: South-west voters want change Patriot power: How France's alt-right seeks to sway election Is Russia really interfering in European states? Who's funding France's far right? LA firefighters say 'no possibility' of containing blazes as fifth wildfire breaks out Inside the neighbourhood totally lost in LA fires Starmer and Badenoch clash over call for grooming inquiry How Canada's immigration debate soured - and helped seal Trudeau's fate 'I can't get divorced as I can't get my pension valued' BBC Sound of 2025: Barry Can't Swim is a new dance music superstar Ros Atkins on...Elon Musk's political interventions A journalist's murder highlights risks of reporting in small-town India Jean-Marie Le Pen - founder of French far right and 'Devil of the Republic' Cases of HMPV are on the rise in China - but what is it? Cryptocurrencies and personal AI: Tech to watch out for in 2025 Politics Essential: Get the latest news and analysis delivered to your inbox every weekday Delivering brand-new miracles in 1970s East End Watch the latest series of Call the Midwife on iPlayer now Mark-Anthony Turnage shares the soundtrack of his life Once called 'Britainâs hippest composer', he's tackled topics from drug abuse to football in his work Paddyâs loaf-changing experience inside the bread factory Paddy McGuinness visits the bread factory he used to work in, and sees how they make 1.4 million loaves a week What's behind the global surrogacy boom? More countries are banning surrogacy â but demand is growing Â© 2025 BBC. The BBC is not responsible for the content of external sites.Read about our approach to external linking."
Care home fees: Can you avoid them?,"Care from the NHS is free, but if you need social care because you're physically or mentally frail, you have to pay for it yourself. And it is not cheap. The latest figures show a place in a residential care home in the UK costs, on average, more than Â£30,000 a year. A nursing home costs more than Â£40,000 a year. In the South East, it is Â£10,000 a year more than that, according to consultants LaingBuisson. There is financial help from local authorities, but it is strictly means-tested. You only qualify if your home, savings and investments are together worth less than Â£23,250. If you are worth more than that, you have to pay the full cost of your care - during your lifetime and, if necessary, from your estate after you have died. It may not leave much for your family to inherit. Which is why marketing leaflets from a will-writing firm called Universal Wealth Preservation are eye-catching. One of the leaflets issued by Universal Wealth Preservation The leaflet claims that 45,000 families are forced to sell their homes every year, to pay for care. In 2015, one of Universal's leaflets dropped through the letterbox of retired teachers Susan and Don Steer. Don had just been diagnosed with a terminal cancer. Since the Steers owned their home near Hull outright, and had savings as well, they would not qualify for council support. ""Don thought that if he had to go into a care home or nursing home that we would have to pay and we could lose the house,"" Susan recalls. ""Universal said they could protect the house from care home fees, and he thought that would be a good thing to do."" So, after a home consultation with a Universal representative, the Steers signed up, paying Universal a fee of almost Â£4,000. Susan Steer says she was told she wouldn't need to sell her house Universal's scheme works by transferring the ownership of assets like a home or savings into what it calls a ""Wealth Preservation Trust"". Trusts are legal devices designed to hold assets on behalf of named beneficiaries - often children. With a trust owning the assets, the theory is those assets will no longer be counted in the means test. That should make it more likely that the individual will qualify for local authority help. But there's a big catch. According to Bridgette Shilton, chair of the National Association of Financial Assessment Officers, if avoiding care fees is a substantial motive for putting assets into a trust, then a local authority can challenge it  as ""deliberate deprivation"". ""If people are trying to protect their house in the avoidance of care fees then that's not allowed; that is a clear deprivation of assets. It doesn't work,"" Ms Shilton says. ""As soon as we find out a property has been transferred we will be looking into the motivation, we will be asking questions."" If trusts are genuinely set up for reasons other than avoiding care fees, Mary Butler, the senior partner of solicitors Bell Buxton, says they may succeed in avoiding care fees as well. ""I'm not saying that these products would not in certain circumstances work, if you were seeking to part with ownership of a property when you're fit and healthy, when there's no prospect whatever that you're going to go into a home."" But with the financial squeeze on local authorities growing, Mary Butler says, it's getting harder to slip such trusts under the radar. ""We've got a social care crisis on our hands now, a local authority funding crisis, so they're using every possible means to get money in. The people who are looking at these forms are wise to the stunts that people pull."" Don Steer died last year. He never did pay care fees because his treatment was covered by the NHS. Universal says its representative wasn't told the Steers' main goal was protecting the family home from care fees. It says it wasn't told that Don's cancer was terminal and would have provided different advice if it had been. Surprisingly, while care fee protection is prominent on Universal's marketing fliers, the company told the BBC: ""We deny that we offer strategies to avoid paying care fees."" We wanted to explore what lies behind this apparent contradiction, but Universal did not take up the BBC's offer of an interview. Potential customers might therefore be wise to ask searching questions of their own, or to take advice from a solicitor before signing up. Universal is one of a number of firms offering such services. Almost all are unregulated, so customers have nowhere to complain if things go wrong. In 2013, Chris Grayling, then Lord Chancellor, turned down a recommendation from the legal industry and consumer groups that will-writing should be regulated. And the government has delayed the introduction of a Â£72,000 cap on the amount anyone has to pay towards their care. Originally scheduled for April last year, it's now postponed to April 2020. Economist Andrew Dilnot, the chair of the commission that first proposed the care fee cap in 2011, says a cap would remove the fear generated by a means test he describes as the ""most pernicious"" in Britain. He says a Â£72,000 cap would also reduce the incentive for people to try to avoid paying them altogether. ""If we could get the cap in place, the worst case is that you'd be liable up to the cap. So you're taking away the catastrophic element and I think then the avoidance industry would find things much tougher."" Removal of the fear of the financial catastrophe would also reduce the moral dilemma care fees now pose for people like Susan Steer. ""I'm torn about what I feel,"" she says. ""I don't like the rule about having to sell to pay for care home fees. On the other hand,  I've got socialist views so it sounds ludicrous, but it's human nature to not want to sell the house."" LA firefighters say 'no possibility' of containing blazes as fifth wildfire breaks out Inside the neighbourhood totally lost in LA fires Starmer and Badenoch clash over call for grooming inquiry How Canada's immigration debate soured - and helped seal Trudeau's fate 'I can't get divorced as I can't get my pension valued' BBC Sound of 2025: Barry Can't Swim is a new dance music superstar Ros Atkins on...Elon Musk's political interventions A journalist's murder highlights risks of reporting in small-town India Jean-Marie Le Pen - founder of French far right and 'Devil of the Republic' Cases of HMPV are on the rise in China - but what is it? Cryptocurrencies and personal AI: Tech to watch out for in 2025 Politics Essential: Get the latest news and analysis delivered to your inbox every weekday Delivering brand-new miracles in 1970s East End Watch the latest series of Call the Midwife on iPlayer now Mark-Anthony Turnage shares the soundtrack of his life Once called 'Britainâs hippest composer', he's tackled topics from drug abuse to football in his work Paddyâs loaf-changing experience inside the bread factory Paddy McGuinness visits the bread factory he used to work in, and sees how they make 1.4 million loaves a week What's behind the global surrogacy boom? More countries are banning surrogacy â but demand is growing Â© 2025 BBC. The BBC is not responsible for the content of external sites.Read about our approach to external linking."
