headline,article
"How plans to tackle cost of living will affect youThe chancellor says the new support will help with soaring bills, so how will you be impacted?BusinessComments","Eight million people are receiving the final instalment of cost of living payments totalling £900. Those on means-tested benefits including universal credit will be paid directly, without the need to make a claim, by 22 February. However, the payments have not tackled the extent of the financial problems many people face, a group of MPs says. It is available to households who receive these benefits,external: universal credit income-based jobseeker's allowance income-related employment and support allowance income support working tax credit child tax credit pension credit The final instalment of £299 follows two others last year, of £301 and £300. To qualify, people need to have claimed a benefits payment between 13 November 2023 and 12 December 2023. Those who received a payment for an assessment period ending between these dates are also eligible. Pensioner households may be able to have a new pension credit claim backdated. An estimated 850,000 pensioner householdsdo not claim pension credit, which is a gateway to these extra payments. People are not eligible if they receive new-style employment and support allowance, contributory employment and support allowance, or new-style jobseeker's allowance - unless they get universal credit. Anyone who thinks they should have received the help but did not should contact the office that pays their benefit or tax credits, orreport it here,external. The payment reference on a recipient's bank account is their National Insurance number, followed by DWP COL. The 1.1 million people who receive only working tax credit or child tax credit, rather than any of the other benefits have the reference HMRC COLS. Cost of living payments do not affect the tax you pay, or the benefits or tax credits you receive. Households thatreceive the winter fuel payment,external- which is paid to nearly all homes with at least one person of pension age - received an extra payment of between £150 and £300 during the winter. Lower-income pensioners who claim pension credit get the money in addition to the support provided for those on benefits. A £150 payment was also made to up to six million people receiving disability benefits, between 20 June and 4 July. All cost of living payments go straight into recipients' bank accounts. People are being warned about scammers trying to trick people into handing over personal information. Try our Family £1 recipe meal plan Why are prices rising so much? What happens if I can't afford to pay my mortgage? Payments were not enough for many people, MPs on the Commons Work and Pensions Committee said in a report published in November. It said payments were not enough for those with extra costs associated with their disabilities. Disability charity Scope says some people cannot afford to power vital equipment. There was particular concern for some larger families. The report said the payments have had an important impact, but the system was relatively unsophisticated, meaning some of those in need slipped through the net. It said that in future, the government should consider increasing benefits rather than giving ad-hoc payments. However, the government said cost of living payments have provided ""a significant financial boost to millions of households"". What is the energy cap and what's happening to bills? What are cold weather payments and who is eligible? What can I do if I can't pay my energy bill? How much are energy bills going up? Death toll rises as governor confirms hydrants issue 'impaired' LA wildfires fight 'I have nothing to go back to' - reporter tells of LA fires heartbreak Reeves pledges to 'make UK better off' on China visit LA fires: How three days of devastation unfolded What's the latest on the Los Angeles wildfires and what caused them? 'Cold bites' gas supply and 'Dementia shock' 'My mum died after four days on an A&E trolley' The '9/11 mastermind' wants to plead guilty. Why is the US trying to stop him? Pop star Chappell Roan wins BBC Sound Of 2025 Weekly quiz: Zendaya looked happy but who else sparkled at the Golden Globes? Inside the UK's first legal drug consumption room Danes struggle with response to Trump Greenland threat Dragons’ Den returns with a new line-up of celebrity guests Can a fresh batch of entrepreneurs secure the deal of a lifetime? Are smart scales really as ‘smart’ as they claim to be? Greg Foot explores whether they can accurately measure weight, body fat, muscle and bone mass The award-winning psychological competition is back A nail-biting game of detection, backstabbing and trust. Who will make it through? How close are we to a cancer vaccine? How might it help in the treatment of the disease? © 2025 BBC. The BBC is not responsible for the content of external sites.Read about our approach to external linking."
Universal credit fraud costs taxpayers over £5bn,"Universal credit fraud is at a record high of 13% of all spending on the benefit, costing the taxpayer £5.6bn. It marks an increase of almost three-quarters on pre-pandemic fraud levels, and a slight rise on the previous year. From the start of the pandemic, the government eased certain conditions to allow unprecedented numbers of people to access financial help. Fraud levels across all benefits were 3%, which the Department for Work and Pensions (DWP) said was ""unacceptable"". The DWP statistics show one in four claims for universal credit was overpaid - either because of error or fraud. Total spending on benefits in the year to April 2022 went up by 2.1% or £4.1bn, mainly because of a rise in the number of universal credit claimants, and an inflation-linked increase to the payments. Removing £20 uplift 'has made every day a worry' Universal credit is the main benefit payment for working-age people. It was introduced to replace a range of different benefits for those who are unemployed or low-paid, in a bid to make the system simpler. It's claimed by more than 5.8 million people in England, Scotland and Wales, 40% of whom are in work. Claimants received an extra £20 per week from April 2020 to October 2021. Universal credit fraud was already rising before the pandemic started. But an unprecedented spike in applications at the beginning of lockdown in 2020 meant some benefit rules were relaxed to ensure that people were paid quickly. This in turn led to widespread fraud, including by organised crime groups. In December 2021, the DWP announced it was tospend more than £500m over the next three years tackling fraud,including hiring about 2,000 fraud investigators. Earlier this month, the DWP set itself a target of cutting £2bn in fraud over the next three years. Part of these plans include forcing banks to share more data with the department, for instance to check if a claimant's savings are too large to qualify for benefits. ""It's unacceptable to see that fraud rose as a result of callous criminals exploiting measures to help those in need during the pandemic. Our new fraud plan will root these crooks out of the system, while protecting it from new threats in the future,"" a DWP spokesperson said of the newly released figures. Last November, a group of MPs said that while they could understand why the DWP had chosen to relax the rules, ""the amount of taxpayers' money being lost is simply unacceptable"". Death toll rises as governor confirms hydrants issue 'impaired' LA wildfires fight 'I have nothing to go back to' - reporter tells of LA fires heartbreak Reeves pledges to 'make UK better off' on China visit LA fires: How three days of devastation unfolded What's the latest on the Los Angeles wildfires and what caused them? 'Cold bites' gas supply and 'Dementia shock' 'My mum died after four days on an A&E trolley' The '9/11 mastermind' wants to plead guilty. Why is the US trying to stop him? Pop star Chappell Roan wins BBC Sound Of 2025 Weekly quiz: Zendaya looked happy but who else sparkled at the Golden Globes? Inside the UK's first legal drug consumption room Danes struggle with response to Trump Greenland threat Dragons’ Den returns with a new line-up of celebrity guests Can a fresh batch of entrepreneurs secure the deal of a lifetime? Are smart scales really as ‘smart’ as they claim to be? Greg Foot explores whether they can accurately measure weight, body fat, muscle and bone mass The award-winning psychological competition is back A nail-biting game of detection, backstabbing and trust. Who will make it through? How close are we to a cancer vaccine? How might it help in the treatment of the disease? © 2025 BBC. The BBC is not responsible for the content of external sites.Read about our approach to external linking."
"Police accused of delay in storming Texas schoolThe gunman was inside the Texas school for between 40 minutes and an hour, officials say.","People have been laying flowers near the school campus in Uvalde as tributes Police were urged to charge into a deadly school shooting in the US state of Texas by onlookers, witnesses say, with one suggesting he considered doing so himself as he became frustrated. Officials say gunman Salvador Ramos, 18, was inside the school in Uvalde for up to an hour before he was killed. Nineteen children and two adults died, while 17 others were injured. Eyewitness Juan Carranza told the Associated Press that women shouted at officers to ""go in there"". But the 24-year-old, who witnessed the scene at the Robb Elementary School from outside his house, said police did not enter. Javier Cazares, whose daughter was killed in the attack, told the news agency he suggested running in with other onlookers because the police ""weren't doing anything"". Authorities said the gunman locked himself in a classroom which officers then struggled to gain access to. Steven McCraw, the director of the Texas Department of Public Safety, told a news conference on Wednesday that the gunman was on site for between 40 minutes and an hour before law enforcement were able to ""contain"" him. US Border Patrol Chief Raul Ortiz, meanwhile, told CNN that dozens of officers responded to the shooting and ""didn't hesitate"". ""They entered that classroom and they took care of the situation as quickly as they possibly could,"" he said. Texas victims: 'The sweetest little boy I've ever known' America's bitter debate that never goes away It has also emerged that the attacker sent messages on social media about the shooting minutes before it happened. Texas Governor Greg Abbott said Ramos had promised to shoot his grandmother in private messages sent 30 minutes before the attack. A later message declared he had done so, and in a final one sent 15 minutes before the shooting, he announced he would target an elementary school. According to CNN, the private messages were sent to a 15-year-old girl in Germany who Ramos had met online. In a statement, Meta, Facebook's parent company, said the ""private one-to-one text messages"" were ""discovered after the terrible tragedy occurred"". It added that it was ""closely co-operating"" with investigators. This video can not be played Watch: Texas governor heckled by rival over gun laws Tuesday's events in Uvalde - an unassuming town some 80 miles (129km) from San Antonio - brought the discussion around gun control once again to the fore, even as members of the small community sought to make sense of the tragedy. Many there expressed divided attitudes about guns. ""As a kid, I remember my uncles teaching me and training me on how to hold a gun,"" Carlos Velasquez, a local resident, told the BBC. ""The juxtaposition of good safety with what just happened is so nuanced. It's not just a clean-cut thought - it's a really sticky situation and sticky conversation to have now,"" he said. Others, however, were shocked that Ramos was able to carry out an attack with an AR-15 style semi-automatic rifle. ""This kid was just 18. You have to be 21 to drink. How?"" asked Sandra Parra, who lives down the street from the school. ""I hope there are changes,"" she said, referring to gun laws in Texas. ""I don't have a gun myself, but if I did, it would be for protection,"" she added. It is legal to buy a gun at 18 in Texas, and according to US media, the attacker bought his soon after his birthday. Described as a loner from a ""fraught home life"", the gunman shot his grandmother before fleeing the scene in a battered truck carrying firearms and copious ammunition. He then drove erratically across town and crashed his car into a ditch near Robb Elementary School. An officer engaged with him, but failed to stop him from entering the school. He then proceeded to shoot 19 children and two teachers dead, before officers converged on the classroom and a border patrol officer who had responded while nearby killed him, according to Mr Abbott. Mr Abbott said there had been no history to suggest the gunman could be a danger apart from the social media messages sent before the killings. Speaking on Wednesday, US President Joe Biden said the idea that a teenager was able to legally purchase weapons that were ""designed and marketed to kill, is just wrong"". ""I'm just sick and tired of what's going on and what continues to go on,"" he said, calling for ""action"" on gun control. His comments followed an incident at Mr Abbott's news conference, where the governor's Democratic challenger for office, Beto O'Rourke, heckled the Republican for not doing enough on gun control. In response, Mr Abbott accused Mr O'Rourke of grandstanding. According to the Texas Politics Project, only 43% of Texans support stricter gun laws. Nationally, the figure is 53% in support, according to a 2021 Pew Research Center poll. As more details of the mass shooting emerged, the Uvalde community grieved. The children killed were aged between seven and 10 years old. Teachers Eva Mireles and Irma Garcia also died in the attack. More than a dozen people were also wounded. Vigils took place for the victims of the shooting, while people have been laying flowers near the school campus as tributes. ""The normality is not here anymore,"" Ms Parra said. ""Uvalde will be known for its mass shooting,"" said Mr Velazquez. ""That's really unfortunate."" Texas victims: 'They were sweet kids and lovable' Texas primary school shooting leaves 21 dead America's bitter debate that never goes away Texas governor heckled by rival over gun laws. Video, 00:01:32Texas governor heckled by rival over gun laws Death toll rises as governor confirms hydrants issue 'impaired' LA wildfires fight 'I have nothing to go back to' - reporter tells of LA fires heartbreak Reeves pledges to 'make UK better off' on China visit LA fires: How three days of devastation unfolded What's the latest on the Los Angeles wildfires and what caused them? 'Cold bites' gas supply and 'Dementia shock' 'My mum died after four days on an A&E trolley' The '9/11 mastermind' wants to plead guilty. Why is the US trying to stop him? Pop star Chappell Roan wins BBC Sound Of 2025 Weekly quiz: Zendaya looked happy but who else sparkled at the Golden Globes? Inside the UK's first legal drug consumption room Danes struggle with response to Trump Greenland threat Dragons’ Den returns with a new line-up of celebrity guests Can a fresh batch of entrepreneurs secure the deal of a lifetime? Are smart scales really as ‘smart’ as they claim to be? Greg Foot explores whether they can accurately measure weight, body fat, muscle and bone mass The award-winning psychological competition is back A nail-biting game of detection, backstabbing and trust. Who will make it through? How close are we to a cancer vaccine? How might it help in the treatment of the disease? © 2025 BBC. The BBC is not responsible for the content of external sites.Read about our approach to external linking."
"Police accused of delay in storming Texas schoolThe gunman was inside the Texas school for between 40 minutes and an hour, officials say.US & Canada","People have been laying flowers near the school campus in Uvalde as tributes Police were urged to charge into a deadly school shooting in the US state of Texas by onlookers, witnesses say, with one suggesting he considered doing so himself as he became frustrated. Officials say gunman Salvador Ramos, 18, was inside the school in Uvalde for up to an hour before he was killed. Nineteen children and two adults died, while 17 others were injured. Eyewitness Juan Carranza told the Associated Press that women shouted at officers to ""go in there"". But the 24-year-old, who witnessed the scene at the Robb Elementary School from outside his house, said police did not enter. Javier Cazares, whose daughter was killed in the attack, told the news agency he suggested running in with other onlookers because the police ""weren't doing anything"". Authorities said the gunman locked himself in a classroom which officers then struggled to gain access to. Steven McCraw, the director of the Texas Department of Public Safety, told a news conference on Wednesday that the gunman was on site for between 40 minutes and an hour before law enforcement were able to ""contain"" him. US Border Patrol Chief Raul Ortiz, meanwhile, told CNN that dozens of officers responded to the shooting and ""didn't hesitate"". ""They entered that classroom and they took care of the situation as quickly as they possibly could,"" he said. Texas victims: 'The sweetest little boy I've ever known' America's bitter debate that never goes away It has also emerged that the attacker sent messages on social media about the shooting minutes before it happened. Texas Governor Greg Abbott said Ramos had promised to shoot his grandmother in private messages sent 30 minutes before the attack. A later message declared he had done so, and in a final one sent 15 minutes before the shooting, he announced he would target an elementary school. According to CNN, the private messages were sent to a 15-year-old girl in Germany who Ramos had met online. In a statement, Meta, Facebook's parent company, said the ""private one-to-one text messages"" were ""discovered after the terrible tragedy occurred"". It added that it was ""closely co-operating"" with investigators. This video can not be played Watch: Texas governor heckled by rival over gun laws Tuesday's events in Uvalde - an unassuming town some 80 miles (129km) from San Antonio - brought the discussion around gun control once again to the fore, even as members of the small community sought to make sense of the tragedy. Many there expressed divided attitudes about guns. ""As a kid, I remember my uncles teaching me and training me on how to hold a gun,"" Carlos Velasquez, a local resident, told the BBC. ""The juxtaposition of good safety with what just happened is so nuanced. It's not just a clean-cut thought - it's a really sticky situation and sticky conversation to have now,"" he said. Others, however, were shocked that Ramos was able to carry out an attack with an AR-15 style semi-automatic rifle. ""This kid was just 18. You have to be 21 to drink. How?"" asked Sandra Parra, who lives down the street from the school. ""I hope there are changes,"" she said, referring to gun laws in Texas. ""I don't have a gun myself, but if I did, it would be for protection,"" she added. It is legal to buy a gun at 18 in Texas, and according to US media, the attacker bought his soon after his birthday. Described as a loner from a ""fraught home life"", the gunman shot his grandmother before fleeing the scene in a battered truck carrying firearms and copious ammunition. He then drove erratically across town and crashed his car into a ditch near Robb Elementary School. An officer engaged with him, but failed to stop him from entering the school. He then proceeded to shoot 19 children and two teachers dead, before officers converged on the classroom and a border patrol officer who had responded while nearby killed him, according to Mr Abbott. Mr Abbott said there had been no history to suggest the gunman could be a danger apart from the social media messages sent before the killings. Speaking on Wednesday, US President Joe Biden said the idea that a teenager was able to legally purchase weapons that were ""designed and marketed to kill, is just wrong"". ""I'm just sick and tired of what's going on and what continues to go on,"" he said, calling for ""action"" on gun control. His comments followed an incident at Mr Abbott's news conference, where the governor's Democratic challenger for office, Beto O'Rourke, heckled the Republican for not doing enough on gun control. In response, Mr Abbott accused Mr O'Rourke of grandstanding. According to the Texas Politics Project, only 43% of Texans support stricter gun laws. Nationally, the figure is 53% in support, according to a 2021 Pew Research Center poll. As more details of the mass shooting emerged, the Uvalde community grieved. The children killed were aged between seven and 10 years old. Teachers Eva Mireles and Irma Garcia also died in the attack. More than a dozen people were also wounded. Vigils took place for the victims of the shooting, while people have been laying flowers near the school campus as tributes. ""The normality is not here anymore,"" Ms Parra said. ""Uvalde will be known for its mass shooting,"" said Mr Velazquez. ""That's really unfortunate."" Texas victims: 'They were sweet kids and lovable' Texas primary school shooting leaves 21 dead America's bitter debate that never goes away Texas governor heckled by rival over gun laws. Video, 00:01:32Texas governor heckled by rival over gun laws Death toll rises as governor confirms hydrants issue 'impaired' LA wildfires fight 'I have nothing to go back to' - reporter tells of LA fires heartbreak Reeves pledges to 'make UK better off' on China visit LA fires: How three days of devastation unfolded What's the latest on the Los Angeles wildfires and what caused them? 'Cold bites' gas supply and 'Dementia shock' 'My mum died after four days on an A&E trolley' The '9/11 mastermind' wants to plead guilty. Why is the US trying to stop him? Pop star Chappell Roan wins BBC Sound Of 2025 Weekly quiz: Zendaya looked happy but who else sparkled at the Golden Globes? Inside the UK's first legal drug consumption room Danes struggle with response to Trump Greenland threat Dragons’ Den returns with a new line-up of celebrity guests Can a fresh batch of entrepreneurs secure the deal of a lifetime? Are smart scales really as ‘smart’ as they claim to be? Greg Foot explores whether they can accurately measure weight, body fat, muscle and bone mass The award-winning psychological competition is back A nail-biting game of detection, backstabbing and trust. Who will make it through? How close are we to a cancer vaccine? How might it help in the treatment of the disease? © 2025 BBC. The BBC is not responsible for the content of external sites.Read about our approach to external linking."
