headline,article
Prostate cancer deaths overtake breast cancer,"This video can not be played 'I didn't want to be a statistic' The number of men dying from prostate cancer has overtaken female deaths from breast cancer for the first time in the UK, figures show. An ageing population means more men are developing and dying from the disease. Prostate Cancer UK says advances in the diagnosis and treatment of breast cancer are paying off, and increased funding could benefit prostate cancer. The biggest cancer killers in the UK remain lung and bowel cancer, with prostate now in third place. The latest figures from 2015 show there were 11,819 deaths from prostate cancer compared with 11,442 from breast cancer. Although deaths from prostate cancer have been rising over the past 10 years or so, the mortality rate or the proportion of men dying from the disease has fallen - by 6% - between 2010 and 2015. For breast cancer the mortality rate has come down by 10%, meaning deaths in women are declining more quickly. Gary Pettit works in the City of London Gary Pettit was 43 when he was diagnosed with prostate cancer, five years ago, after a routine medical through work. He had no symptoms - only an abnormally high PSA (prostate-specific antigen) blood test, which led to further tests and biopsies. Within weeks, he had a seven-hour operation at the Royal Marsden in London to remove the cancer. ""I'm a lucky boy. I stored my sperm before the op and now we've got a little seven-month-old miracle baby, called Teddy. I can't say how lucky I've been."" Gary says recovering from the surgery took quite a while and there were some side-effects which he is still getting used to - but he is clear of cancer and keen to raise awareness among other men. ""It is still a taboo subject with men. They get shy and embarrassed, but it's so important to get checked out."" Men 'dangerously ignorant' of prostate Lasers 'transform' prostate treatment Test could aid prostate cancer treatment Angela Culhane, chief executive of the charity Prostate Cancer UK, said the disease currently received half the funding and half the research that is devoted to breast cancer. She said developing better diagnostic tests that could be used as part of a nationwide screening programme would be a priority. At present, there is no single, reliable test for prostate cancer - the PSA test, biopsies and physical examinations are all used. Men with prostate cancer can also live for decades without symptoms or needing treatment because the disease often progresses very slowly. There can be fewsymptoms of prostate cancer,externalin the early stages, and because of its location most symptoms are linked to urination: needing to urinate more often, especially at night needing to run to the toilet difficulty in starting to urinate weak urine flow or taking a long time while urinating feeling your bladder has not emptied fully Men with male relatives who have had prostate cancer, black men and men over 50 are at higher risk of getting the disease. Prostate cancer is the most common cancer in men in the UK Ms Culhane said: ""It's incredibly encouraging to see the tremendous progress that has been made in breast cancer over recent years. ""The introduction of precision medicine, a screening programme and a weighty research boost has no doubt played an important role in reducing the number of women who die from the disease. ""The good news is that many of these developments could be applied to prostate cancer and we're confident that with the right funding, we can dramatically reduce deaths within the next decade."" Michael Chapman, director of information and involvement at Cancer Research UK, said: ""The number of men getting and dying from prostate cancer is increasing mostly because of population growth and because we are living longer. ""We're dedicated to improving diagnosis and treatments for all cancers which is why we're investing in research to help develop more treatments to give more people more time this World Cancer Day on Sunday."" Prostate cancer symptoms explained. Video, 00:01:34Prostate cancer symptoms explained Cancer blood test ‘enormously exciting’ Prostate cancer drug's 'powerful results' Doctors hail prostate cancer test advance Test could aid prostate cancer treatment Lasers 'transform' prostate treatment Prostate Cancer UK PSA test for prostate cancer - NHS Choices Prostate cancer - Cancer Research UK Prostate cancer - NHS.UK Breast cancer in women - NHS.UK Home - WCD Firefighters running out of water as wildfire declared most destructive in LA's history In maps: Thousands of acres on fire in LA 'Patients are collapsing in the waiting room': A&E nurses speak out Why does Trump want Greenland and what do its people think? How Canada's immigration debate soured - and helped seal Trudeau's fate 'I can't get divorced as I can't get my pension valued' What are cold weather payments and who can get them? BBC Sound of 2025: Barry Can't Swim is a new dance music superstar Ros Atkins on...Elon Musk's political interventions Jean-Marie Le Pen - founder of French far right and 'Devil of the Republic' Cases of HMPV are on the rise in China - but what is it? Politics Essential: Get the latest news and analysis delivered to your inbox every weekday Delivering brand-new miracles in 1970s East End Watch the latest series of Call the Midwife on iPlayer now Mark-Anthony Turnage shares the soundtrack of his life Once called 'Britain’s hippest composer', he's tackled topics from drug abuse to football in his work Paddy’s loaf-changing experience inside the bread factory Paddy McGuinness visits the bread factory he used to work in, and sees how they make 1.4 million loaves a week What's behind the global surrogacy boom? More countries are banning surrogacy – but demand is growing © 2025 BBC. The BBC is not responsible for the content of external sites.Read about our approach to external linking."
Trump attacks FBI amid row over memo,"This video can not be played All you need to know about the Trump-Russia investigation US President Donald Trump has accused top officials of politicising FBI and justice department investigations to damage his Republican party. Later on Friday, he is expected to approve the release of a memo that is thought to suggest the FBI abused its powers to spy on one of his aides. Controversy over the memo has railed for days in US politics and the two main parties are divided on it. Democrats say the document is aimed at derailing investigations into Mr Trump. They portray the memo, commissioned by the Republican head of the House Intelligence Committee, Devin Nunes, as an attempt to undermine a federal inquiry into allegations that the Trump campaign colluded with Russia during the 2016 election campaign. However, another top Republican, House Speaker Paul Ryan, played down the potential impact of the memo's publication on the inquiry led by Special Counsel Robert Mueller. He said Congress had a duty to see surveillance powers were used correctly. Meet the cast in the drama to end all dramas Political time bomb or rumour mill? Mr Trump tweeted,external: ""The top Leadership and Investigators of the FBI and the Justice Department have politicized the sacred investigative process in favor of Democrats and against Republicans."" The current FBI director, Christopher Wray, was nominated to the post by Mr Trump after the president dismissed his predecessor, James Comey. Last week the agency's deputy director, Andrew McCabe, resigned. Mr Trump had repeatedly accused him of political bias but the White House said the president was not involved in the decision. Approved by the House Intelligence Committee on Monday, the document reportedly accuses the FBI (Federal Bureau of Investigation) and justice department of misleading a judge in March of last year while seeking to extend a surveillance warrant against Carter Page. The memo is said to argue the FBI and justice department did not tell the judge that some of their justification for the warrant relied on a much-disputed Trump dossier. Compiled by a former British intelligence agent, Christopher Steele, that dossier was financed in part through the campaign of Democratic presidential candidate Hillary Clinton to dig up dirt on Mr Trump. Unnamed sources told Reuters news agency the Republican memo was misleading because all the dossier excerpts used in the FBI warrant application were independently confirmed by US intelligence. All you need to know about Trump Russia story Carter Page, 46, a foreign policy adviser to the Trump campaign, visited Russia several times in 2016.He adamantly denies allegations in the Trump dossier that he served as an intermediarybetween Russian officials and the Trump campaign. Devin Nunes, 44, has long been pursuing President Trump's claims that he was put under surveillance by the Obama administration - so much so thatthe congressman was dubbed ""Inspector Clouseau"" by a fellow Republican,external, Sen Lindsey Graham, in March. Rod Rosenstein, 53, was appointed deputy attorney general last April.He is said by the New York Times to have been involved at various points in authorising applications for the surveillance,external.President Trump questioned his loyalties,externalin December, CNN reports. House Speaker Ryan denied the memo was an indictment of the FBI and justice department. ""It does not impugn the Mueller investigation, or the deputy attorney general,"" he added. He said it was job of his chamber to ""conduct oversight over the executive branch if abuses were made"". Another House Republican who read the memo, Jeff Duncan, predicted it would shake the FBI ""down to its core"". It would, he tweeted, show ""Americans just how the agency was weaponized"" by the Obama administration and Democrats to ""target political adversaries"". Allow Twitter content? This article contains content provided by Twitter. We ask for your permission before anything is loaded, as they may be using cookies and other technologies. You may want to readTwitter’s cookie policy,externalandprivacy policy,externalbefore accepting. To view this content choose‘accept and continue’. Several Republican lawmakers are opposed to releasing the memo. John Thune, who is the party's number three in the Senate, said FBI objections should be heeded. Senators Lindsey Graham and Susan Collins also voiced unease. Senator Jeff Flake teamed up with a Democrat, Chris Coons, to issued a joint statement. It said releasing the memo ""risks undermining US intelligence-gathering efforts, politicizing Congress' oversight role and eroding confidence in our institutions of government"". Congressional Democratic leaders called on Thursday for Mr Nunes' immediate removal as chairman of the House Intelligence Committee. Democratic Congressman Adam Schiff accused Republicans of having amended the memo after it was approved. However, an unnamed Republican aide said the amendments were grammatical changes and ""minor edits"", including two tweaks requested by the FBI and by Democrats. The Trump-Russia saga in 200 words It has voiced ""grave concerns about material omissions of fact that fundamentally impact the memo's accuracy"". The justice department, which oversees the FBI, has warned the memo's release could jeopardise intelligence-gathering and damage trust between the agency and lawmakers. Pressure has mounted on the FBI, which is the subject of a forthcoming inspector general report. Its deputy director, Andrew McCabe, resigned on Tuesday. He had been repeatedly accused of political bias by President Trump. James Comey, who led the FBI at the time of the 2016 election and who was sacked by the new president, suggested the agency was being subjected to a witch hunt by ""weasels and liars"". While President Trump is expected to approve the memo's release, the exact method for publishing it is ""still being figured out"", the Associated Press news agency reports. As president, Mr Trump has the power to declassify the document himself and either release it or hand it to Congress to release. Firefighters running out of water as wildfire declared most destructive in LA's history In maps: Thousands of acres on fire in LA 'Patients are collapsing in the waiting room': A&E nurses speak out Why does Trump want Greenland and what do its people think? How Canada's immigration debate soured - and helped seal Trudeau's fate 'I can't get divorced as I can't get my pension valued' What are cold weather payments and who can get them? BBC Sound of 2025: Barry Can't Swim is a new dance music superstar Ros Atkins on...Elon Musk's political interventions Jean-Marie Le Pen - founder of French far right and 'Devil of the Republic' Cases of HMPV are on the rise in China - but what is it? Politics Essential: Get the latest news and analysis delivered to your inbox every weekday Delivering brand-new miracles in 1970s East End Watch the latest series of Call the Midwife on iPlayer now Mark-Anthony Turnage shares the soundtrack of his life Once called 'Britain’s hippest composer', he's tackled topics from drug abuse to football in his work Paddy’s loaf-changing experience inside the bread factory Paddy McGuinness visits the bread factory he used to work in, and sees how they make 1.4 million loaves a week What's behind the global surrogacy boom? More countries are banning surrogacy – but demand is growing © 2025 BBC. The BBC is not responsible for the content of external sites.Read about our approach to external linking."
Man denies 1986 double child murder,"The bodies of Nicola Fellows (left) and Karen Hadaway were found the day after they disappeared A 51-year-old man has pleaded not guilty to the murder of two nine-year-old schoolgirls more than 30 years ago. Nicola Fellows and Karen Hadaway went missing from their homes in Brighton and were found the following day in bushes at Wild Park, near the Moulsecoomb estate, on 9 October 1986. Russell Bishop appeared before Mr Justice Edis for a plea hearing at the Old Bailey via video link from prison. Mr Bishop will stand trial on 15 October. Russell Bishop appeared before Mr Justice Edis for a plea hearing Wearing a black and white striped T-shirt and sitting with his arms crossed, he spoke only to confirm his name and enter his plea. The case is expected to last for six to eight weeks. Mr Bishop was remanded back into custody. HM Courts & Tribunals Service Extra storey and penthouse flat approved by planners Bus and lorry get stuck due to snow on A-road Brighton travel chaos: Full list of reported crashes and snow incidents Thanks to the public for making the right choice of NHS service this week amidst cold weather alert Driver accused of running over Sussex man’s head with 4x4 as murder trial continues Snow settles in Brighton and Hove Firefighters running out of water as wildfire declared most destructive in LA's history In maps: Thousands of acres on fire in LA 'Patients are collapsing in the waiting room': A&E nurses speak out Why does Trump want Greenland and what do its people think? How Canada's immigration debate soured - and helped seal Trudeau's fate 'I can't get divorced as I can't get my pension valued' What are cold weather payments and who can get them? BBC Sound of 2025: Barry Can't Swim is a new dance music superstar Ros Atkins on...Elon Musk's political interventions Jean-Marie Le Pen - founder of French far right and 'Devil of the Republic' Cases of HMPV are on the rise in China - but what is it? Politics Essential: Get the latest news and analysis delivered to your inbox every weekday Delivering brand-new miracles in 1970s East End Watch the latest series of Call the Midwife on iPlayer now Mark-Anthony Turnage shares the soundtrack of his life Once called 'Britain’s hippest composer', he's tackled topics from drug abuse to football in his work Paddy’s loaf-changing experience inside the bread factory Paddy McGuinness visits the bread factory he used to work in, and sees how they make 1.4 million loaves a week What's behind the global surrogacy boom? More countries are banning surrogacy – but demand is growing © 2025 BBC. The BBC is not responsible for the content of external sites.Read about our approach to external linking."
Police stop car driven without tyre,"The car had no tyre on the wheel on the driver's side Police have stopped a motorist for driving a car with a front tyre missing. The Peugeot was also missing the front panel on the driver's side and leads appeared to be dangling on to the road. Officers stopped the 2001-registered car on a Pembrokeshire road on Thursday evening. Dyfed-Powys Police said it had no insurance and its MOT ran out in July 2016. Atweet,externalby the Pembrokeshire Roads Policing Unit said the driver passed their test last November. Officers reported the motorist for driving a vehicle in a dangerous condition. The tweet added: ""And yes, it was being driven in that condition on public roads."" The remains of the tyre were found inside the car The cars abandoned in a robot car park What does the colour of your car say about you? When is a Japanese car not a Japanese car? Crashed car lands on parked car Met Office issues another weather warning as temperatures drop below freezing Met Office weather maps show exact time temperatures will fall to -6C in Wales Fit and Fed project supports more than 2000 Pembrokeshire kids Food hygiene ratings handed to seven Pembrokeshire establishments Pembrokeshire theatre group starting new term for young people Woman in court accused of manslaughter over paddleboarder deaths Firefighters running out of water as wildfire declared most destructive in LA's history In maps: Thousands of acres on fire in LA 'Patients are collapsing in the waiting room': A&E nurses speak out Why does Trump want Greenland and what do its people think? How Canada's immigration debate soured - and helped seal Trudeau's fate 'I can't get divorced as I can't get my pension valued' What are cold weather payments and who can get them? BBC Sound of 2025: Barry Can't Swim is a new dance music superstar Ros Atkins on...Elon Musk's political interventions Jean-Marie Le Pen - founder of French far right and 'Devil of the Republic' Cases of HMPV are on the rise in China - but what is it? Politics Essential: Get the latest news and analysis delivered to your inbox every weekday Delivering brand-new miracles in 1970s East End Watch the latest series of Call the Midwife on iPlayer now Mark-Anthony Turnage shares the soundtrack of his life Once called 'Britain’s hippest composer', he's tackled topics from drug abuse to football in his work Paddy’s loaf-changing experience inside the bread factory Paddy McGuinness visits the bread factory he used to work in, and sees how they make 1.4 million loaves a week What's behind the global surrogacy boom? More countries are banning surrogacy – but demand is growing © 2025 BBC. The BBC is not responsible for the content of external sites.Read about our approach to external linking."
Online estate agent in row over sales claim,"Online estate agency Purplebricks has defended its business after critical comments by analysts. On Thursday, stockbrokers Jefferies issued a research note questioning its claim it sold more than three quarters of homes listed with it. Jefferies said Purplebricks' sales success rate was just over 51% and near the middle of the pack of its study of 7,000 agents. But Purplebricks said it sold 78% of homes listed. Purplebricks charges a flat fee rather than a percentage of the sale price and uses a mix of online and local agents. The company's latest results, published in December, reported that its average revenue per UK customer was £1,138. Jefferies called selling with Purplebricks a ""£1,000 coin toss"", saying that, unlike traditional agents, its customers had to pay the fee regardless of whether the property sold. The brokers said the business model had not been sufficiently tested and that its shares were priced ""for perfection"". The note from Jefferies said: ""Purplebricks does not disclose how many homes it sells. Our research sample found that it had sold 51.6% of the homes listed in November 2016 within 10 months, a similar success rate to the overall market, but below the company's claim of 88% [made in an interview on the BBC's Moneybox programme]. ""Our concern is that the group has expanded quickly across three continents before the model has been proven and therefore that the shares are priced for perfection. Our research is not able to replicate the views on selling success expressed by the company."" In a statement, Purplebricks said: ""Purplebricks firmly refutes the criticism in the research note of its revenue recognition policy and stands behind both the fully audited results and the accounting policy itself."" It added that the estimated completion rate in the Jefferies research note was based on one month's data and did not cover deals that have yet to be included on the Land Registry. The company said its most recently published sales conversion rate was 78%, which it said ""more accurately reflects its sales performance"". Shares in Purplebricks fell 7% on Thursday, and dropped a further 3% on Friday to about 440p. However, this is still well above the valuation given in the Jefferies note, which said the true value of the shares was between 94-158p. Purplebricks, which operates in Australia as well as the UK and is moving into the US, has come in for criticism in the past. The Advertising Standards Authority has upheld a number of complaints about its marketing. The BBC's5 live Investigatesis taking a deeper look into the world of online estate agency on Sunday, 4 February from 11:00am. Estate agents 'stretching the facts' Firefighters running out of water as wildfire declared most destructive in LA's history In maps: Thousands of acres on fire in LA 'Patients are collapsing in the waiting room': A&E nurses speak out Why does Trump want Greenland and what do its people think? How Canada's immigration debate soured - and helped seal Trudeau's fate 'I can't get divorced as I can't get my pension valued' What are cold weather payments and who can get them? BBC Sound of 2025: Barry Can't Swim is a new dance music superstar Ros Atkins on...Elon Musk's political interventions Jean-Marie Le Pen - founder of French far right and 'Devil of the Republic' Cases of HMPV are on the rise in China - but what is it? Politics Essential: Get the latest news and analysis delivered to your inbox every weekday Delivering brand-new miracles in 1970s East End Watch the latest series of Call the Midwife on iPlayer now Mark-Anthony Turnage shares the soundtrack of his life Once called 'Britain’s hippest composer', he's tackled topics from drug abuse to football in his work Paddy’s loaf-changing experience inside the bread factory Paddy McGuinness visits the bread factory he used to work in, and sees how they make 1.4 million loaves a week What's behind the global surrogacy boom? More countries are banning surrogacy – but demand is growing © 2025 BBC. The BBC is not responsible for the content of external sites.Read about our approach to external linking."
