headline,article
"Israelis 'kill Hamas commander' in GazaPalestinians say seven people were killed and Israel confirms a soldier died in ""operational activity"".Middle East","Israel carried out air strikes when the firefight erupted Seven Palestinians, including a local militant commander, have been killed during a covert Israeli operation in Gaza, Palestinian officials say. An Israeli soldier was also killed and another wounded, the Israeli military said, after a firefight erupted. Palestinians said an Israeli unit travelling in a civilian vehicle had killed the Hamas commander. It was followed by rocket-fire into Israel, while on Monday a Palestinian mortar hit an Israeli bus. Initial reports say the vehicle was empty, although a 19-year-old was seriously hurt, Israel's ambulance service said. According to Palestinian sources, the Israeli unit was about 3km (2 miles) inside the Gaza Strip, which borders Israel, when it fired at Nur Barakeh, a commander of the Izzedine al-Qassam brigades, Hamas' military wing. The incident is reported to have happened east of Khan Younis, in the south of the territory. A gun battle erupted and Israeli tanks and aircraft opened fire in the area, witnesses said. Hamas commander Nur Barakeh's mother was seen at the morgue where his body was reportedly brought Six of the Palestinians killed belonged to Hamas - the militant Islamist group which controls the Gaza Strip - and the seventh was a member of the militant Popular Resistance Committees, AFP news agency cited Palestinian officials as saying. The Israel Defense Forces (IDF) said a member of the special unit involved was killed and another was lightly wounded. In the wake of the clashes, Israeli Prime Minister Benjamin Netanyahu cut short his visit to Paris for events to mark the 100th anniversary of the end of World War One and returned to Israel, his office said. Due to the secrecy of the operation, Israel has not revealed specific details about the mission. The IDF said though that the operation was ""not intended to kill or abduct terrorists, but to strengthen Israeli security"". The BBC's Tom Bateman in Jerusalem says that according to a former Israeli general, the incident was likely to have been an intelligence gathering operation that went wrong. The exposure of such an operation by Israeli special forces inside Gaza would be extremely rare, he says. Fawzi Barhoum, a spokesman for the group, denounced the incident as a ""cowardly Israeli attack"". IDF chief Lt Gen Gadi Eisenkot said the Israeli unit had carried out ""a very meaningful operation to Israel's security"", without giving further details. The Israeli military said that after the clashes 17 rockets had been fired from Gaza into Israel and three were shot down. Life in the Gaza Strip Gaza protest image likened to famous painting Hamas won Palestinian elections in 2006 and reinforced its power in the Gaza Strip after ousting West Bank-based Palestinian President Mahmoud Abbas' rival Fatah faction in clashes the following year. While Mr Abbas' umbrella Palestine Liberation Organisation (PLO) has signed peace accords with Israel, Hamas does not recognise Israel's right to exist and advocates the use of violence against it. Schools have been ordered closed in Israeli border communities as a precaution Israel, along with Egypt, has maintained a blockade of Gaza since about 2006, in order, they say, to stop attacks by militants. Israel and Hamas have gone to war three times, and rocket-fire from Gaza and Israel air strikes against militant targets are a regular occurrence. Sunday night's incident comes after apparent progress in an Egyptian- and UN-brokered process to mediate after a series of escalations between the two sides in recent months. More than 200 Palestinians in Gaza have been killed by Israeli forces since the end of March - most during weekly protests along the border at which thousands have expressed their support for the declared right of Palestinian refugees to return to their ancestral homes in what is now Israel. Did Israel use excessive force at Gaza protests? Israel has said its soldiers have only opened fire in self-defence or on potential attackers trying to infiltrate its territory under the cover of the protests. One Israeli soldier was killed on the Gaza-Israel border by a Palestinian sniper in July. Palestinian forces 'torturing critics' Gaza protest image divides opinion Did Israel use excessive force at Gaza protests? Gaza in maps: How life has been upended after a year of war Gaza: Coding in a conflict zone Wildfire sweeps through Hollywood Hills and threatens landmarks as chaos grips LA Paris Hilton among stars 'heartbroken' as she watches home 'burn to ground' Commuters warned of icy roads as cold snap continues to freeze UK Sound Of 2025: Ezra Collective are 'keeping music real' The Papers: 'Apocalypse' LA and 'Reeves faces extra tax rises' How Australia's beach cabana drama sparked a turf war H-1B: Visa row under Trump fuels anxiety for Indian dreamers 'I thought I was going to die': Jailed Venezuelan activist details brutality of prison life The man who could become Canada's future PM 'Trump 2.0' looms large over the global economy A politician was shot dead in Bangkok. Did another country do it? Chris Mason: Is Starmer leaving the door open to an abuse inquiry? Delivering brand-new miracles in 1970s East End Watch the latest series of Call the Midwife on iPlayer now Mark-Anthony Turnage shares the soundtrack of his life Once called 'Britain’s hippest composer', he's tackled topics from drug abuse to football in his work Paddy’s loaf-changing experience inside the bread factory Paddy McGuinness visits the bread factory he used to work in, and sees how they make 1.4 million loaves a week What's behind the global surrogacy boom? More countries are banning surrogacy – but demand is growing © 2025 BBC. The BBC is not responsible for the content of external sites.Read about our approach to external linking."
Rail company wants more women driversSoutheastern says it wants 40% of applications for driver vacancies to come from women.England,"Kelly-Joe Ballard say she always wanted to be a train driver Rail companies have launched campaigns to recruit more women train drivers. Southeastern, which serves London, Kent and East Sussex, said fewer than 5% of its drivers were women and it wants 40% of applicants to be women by 2021. Its train services director Ellie Burrows said: ""It's no longer the case that little boys play with toy trains and little girls play with dolls."" Train driver Kelly-Joe Ballard said there ""isn't anything stopping a woman from becoming a train driver"". ""I think it's a society perception that train driving is seen as a male profession,"" she added. Mrs Ballard, 40, worked as a bus driver for six years before becoming a train driver with Southeastern in 2016. She said passengers were ""surprised"" when they ask her if she is the driver, but said there was no reason why women should not be train drivers. ""I don't feel gender really comes into it. I love the job, I work with fantastic people, I've never been treated differently because I'm a woman. ""There is more of a male domination but I think that society is changing and women are coming forward in all job roles,"" she added. Helen Dickerson is Greater Anglia's first female yard controller Southeastern said it had 51 women train drivers and had introduced initiatives to encourage more women to apply for a variety of roles. Ms Burrows said ""society has moved on"" and added that railways should not be male-dominated. Rail firm Greater Anglia also described the industry as ""male-dominated"" and said fewer than 5% of its train drivers were women. The company, which serves the east of England, has launched an internal recruitment campaign and recently appointed its first female yard controller. Helen Dickerson, who is responsible for train movements at its Norwich depot, said: ""There are more than 100 men at Crown Point [depot] and I am the only woman working in a front-line engineering role."" Greater Anglia said 22% of its employees were women, which was ""something the company is working to address along with the rest of the industry"". Southeastern's trains run between London, Kent and East Sussex Southern rail said it was ""pushing hard to make the industry more attractive to female applicants"". The operator said 30% of its trainee drivers this year were women, up from 18% in 2017. West Midlands Railway said about 10 of its 700 train drivers were women. But a spokeswoman said it had no plans to run a recruitment campaign aimed specifically at women ""as we welcome applications from all genders and backgrounds to work for us"". Baby born on board high-speed train Meet Thomas the Tank Engine's new female friends What's wrong with doing make-up on a train? Aslef said train drivers were ""predominantly made up of heterosexual white men aged over 35"". A spokesman for the train drivers' union said until recently train companies had ""proved reluctant to employ many women"". ""We want the rail industry to reflect the society it serves, a society comprised of men and women, regardless of ethnicity, age, sexual orientation or any other ideologies, who each day perform a vital job moving passengers and freight around Britain,"" he added. The Rail Delivery Group, which represents the rail industry, said it had ""committed to increasing diversity by 20% by 2020 because our railway needs to attract the brightest and best talent and better represent the people it is there to serve"". Baby born on board high-speed train Rail firm takes cash fee from lost purse Southeastern services to get worse What's wrong with doing make-up on a train? Is it OK to paint your nails on a train? Rail commuters delayed as trains axed Creative commuters who enjoy the ride Southeastern rail Greater Anglia Southern rail West Midlands Railway Aslef Wildfire sweeps through Hollywood Hills and threatens landmarks as chaos grips LA Paris Hilton among stars 'heartbroken' as she watches home 'burn to ground' Commuters warned of icy roads as cold snap continues to freeze UK Sound Of 2025: Ezra Collective are 'keeping music real' The Papers: 'Apocalypse' LA and 'Reeves faces extra tax rises' How Australia's beach cabana drama sparked a turf war H-1B: Visa row under Trump fuels anxiety for Indian dreamers 'I thought I was going to die': Jailed Venezuelan activist details brutality of prison life The man who could become Canada's future PM 'Trump 2.0' looms large over the global economy A politician was shot dead in Bangkok. Did another country do it? Chris Mason: Is Starmer leaving the door open to an abuse inquiry? Delivering brand-new miracles in 1970s East End Watch the latest series of Call the Midwife on iPlayer now Mark-Anthony Turnage shares the soundtrack of his life Once called 'Britain’s hippest composer', he's tackled topics from drug abuse to football in his work Paddy’s loaf-changing experience inside the bread factory Paddy McGuinness visits the bread factory he used to work in, and sees how they make 1.4 million loaves a week What's behind the global surrogacy boom? More countries are banning surrogacy – but demand is growing © 2025 BBC. The BBC is not responsible for the content of external sites.Read about our approach to external linking."
Australia berry scare 'motivated by spite',"My Ut Trinh was arrested in Queensland on Sunday An Australian woman accused of putting sewing needles inside strawberries in a high-profile sabotage case was motivated by spite, a court has heard. My Ut Trinh, 50, was arrested on Sunday following a nationwide police investigation that began in September. Ms Trinh had worked as a supervisor at a strawberry farm north of Brisbane, according to Queensland Police. The maximum prison term for contaminating goods in Australia was recently raised to 15 years. Ms Trinh faces seven counts, and has not said whether she will fight the charges. The ""unprecedented"" strawberry scare spread to every Australian state and later to New Zealand, raising public alarm. Police said there had been 186 reports of needle-contaminated strawberries since September, though 15 turned out to have been hoaxes. It is not yet clear how many of those Ms Trinh is alleged to have caused. On Monday, police described their investigation as ""far from over"". Australia's strawberry needle scare widens Apple and banana in Australia needle scares PM vows crackdown on fruit scare 'idiots' The court in Brisbane on Monday heard that Ms Trinh's DNA had been found on strawberries in the state of Victoria. ""The case that is put is that it is motivated by some spite or revenge,"" Magistrate Christine Roney said. ""She has embarked on a course over several months of putting a metal object into fruit."" Ms Trinh allegedly intended to cause financial harm to a farm where she had worked, reported Fairfax Media, citing court documents. The first cases emerged in Queensland, where a man was taken to hospital with stomach pains after eating strawberries. Shocked consumers reported finding sewing needles in strawberries Farmers were forced to dump tonnes of berries, and supermarkets pulled the fruit off sale. In response, Australia's government raised the maximum prison term for fruit tampering from 10 to 15 years. Prime Minister Scott Morrison vowed to ""throw the book"" at anyone responsible, saying: ""It's not funny, putting the livelihoods of hard-working Australians at risk, and you are scaring children. And you are a coward and a grub."" On Monday Supt Jon Wacker, from Queensland Police, described it as a ""unique investigation impacting virtually every state and jurisdiction in Australia"". In Queensland, where the strawberry industry is worth A$130m (£72m; $93m) a year,external, the local government pledged A$1m to support the state's stricken farmers. A $100,000 reward was offered for information leading to the arrest and conviction of perpetrators. Prosecutors said they opposed giving bail to Ms Trinh because she may face ""retribution"" in the community. However, Ms Roney said a bail application would not be considered until more information about the case was known. Needles found in Australian strawberries in NZ Woolworths pulls needles amid fruit scare Australia crackdown on fruit scare 'idiots' Apple and banana in Australia needle scares Australia's strawberry needle scare widens Warning over needles in strawberries Wildfire sweeps through Hollywood Hills and threatens landmarks as chaos grips LA Paris Hilton among stars 'heartbroken' as she watches home 'burn to ground' Commuters warned of icy roads as cold snap continues to freeze UK Sound Of 2025: Ezra Collective are 'keeping music real' The Papers: 'Apocalypse' LA and 'Reeves faces extra tax rises' How Australia's beach cabana drama sparked a turf war H-1B: Visa row under Trump fuels anxiety for Indian dreamers 'I thought I was going to die': Jailed Venezuelan activist details brutality of prison life The man who could become Canada's future PM 'Trump 2.0' looms large over the global economy A politician was shot dead in Bangkok. Did another country do it? Chris Mason: Is Starmer leaving the door open to an abuse inquiry? Delivering brand-new miracles in 1970s East End Watch the latest series of Call the Midwife on iPlayer now Mark-Anthony Turnage shares the soundtrack of his life Once called 'Britain’s hippest composer', he's tackled topics from drug abuse to football in his work Paddy’s loaf-changing experience inside the bread factory Paddy McGuinness visits the bread factory he used to work in, and sees how they make 1.4 million loaves a week What's behind the global surrogacy boom? More countries are banning surrogacy – but demand is growing © 2025 BBC. The BBC is not responsible for the content of external sites.Read about our approach to external linking."
Service rounds off Armistice commemorations,"This video can not be played Flowers are laid at the grave of the Unknown Warrior and Prince Charles reads from the Gospel of John The Queen has attended a remembrance service at Westminster Abbey for those killed and wounded in conflict, as the UK marks 100 years since Armistice Day. Earlier, millions of people joined in a two-minute silence at 11:00 GMT that marked the end of World War One on the 11th hour of 11 November 1918. Prince Charles laid a wreath on behalf of the Queen at the Cenotaph in London. Ten thousand people - including veterans and relatives of WW1 soldiers - marched past the monument. Remembrance services have been held across the country, includingat Llandaff Cathedralin Cardiff,Glasgow CathedralandSt Anne's Cathedral in Belfast. A beacon was lit at Westminster Abbey, followed by more than 1,000 others across the UK on Sunday evening. The lights are intended to symbolise the end of the darkness of war and a return to the lightness of peace. Armistice Day events held around the world Pride and awe: Views from the People's Procession In pictures: Armistice Day The Queen was joined at the Westminster Abbey service by Prince Charles, the Duchess of Cornwall and the dukes and duchesses of Cambridge and Sussex. Prime Minister Theresa May and German President Frank-Walter Steinmeier - who earlier became the first German leader to lay a wreath at the Cenotaph - were among the 2,000-strong congregation. The Queen laid flowers atthe grave of the Unknown Warrior,,externalwhose body was brought from France in 1920. The Queen and Germany's President Frank-Walter Steinmeier Princes William and Harry and the duchesses of Sussex and Cambridge at the Sunday evening service Theresa May read a passage from the Book of Isaiah A beacon burns at Rugeley war memorial in Staffordshire - one of more than 1,000 across Britain The names of people who died in World War One are projected onto the Scottish Parliament in Edinburgh Readings were given by Mrs May, Prince Charles, actress Sophie Okonedo and actor Simon Beale. The Dean of Westminster Dr John Hall prayed for a time when ""aggression between peoples and nations is transformed into friendship and collaboration"". Earlier, the Queen observed the two-minute silence at 11:00 in Whitehall from the balcony of the nearby Foreign and Commonwealth Office. The Duke of Edinburgh was absent. This video can not be played A two-minute silence is marked at the Cenotaph, after other tributes of remembrance around the UK The Queen watched the service from a balcony, alongside the Duchess of Cornwall and the Duchess of Cambridge Prince Charles laid a wreath in place of the Queen Prince Charles, the Duke of Cambridge and the Duke of Sussex, Mrs May, and Labour leader Jeremy Corbyn laid wreaths. Big Ben's renovations were paused ahead of Armistice Day to allow the bell to chime before and after the traditional two minutes of silence. This video can not be played Beach images across the UK honour World War One soldiers Jeremy Corbyn and Theresa May both laid wreaths At 12:30, 10,000 members of the public - chosen by ballot - began a procession past the Cenotaph, beginning at the Mall and ending at St James's Park. The march was described by organisers as a ""nation's thank you"" to all those who fought in WW1, and featured descendants of veterans from across the country. Ten thousand people marched past the Cenotaph in London Emma Silk, 47, from Wiltshire, told the BBC she was proud and emotional to be walking in the parade. ""I want to honour the memory of my grandfather - what he did for our freedom,"" she said. Her grandfather lied about his age to join the war in 1917. Emma Silk holds a photo of her grandfather, aged 17. ""He looks so young,"" she says Helen Wightman and Julie Jones travelled to London for the parade Helen Wightman, 67, from Surrey, was in London for the parade with her younger sister, Julie Jones, 53, from Wigan, to remember their grandfather, Charles Izzard. ""I've got six grandchildren and think its important that we remember if it was not for them, we would not have the freedom that we have today,"" Helen told the BBC. They were wearing his medals but details of his experience are hazy. Julie did try to interview him once for a school project but he got too upset. ""So many men died, he thought he was one of the very lucky ones,"" she said. Robert Malin, whose job it was to carry away the wounded on stretchers, and his grandson Jeremy Cripps wearing his bravery medals Jeremy Cripps, 64 and from South Shields, walked in the parade in honour of his grandfather, Robert Malin. Mr Cripps said his grandfather went beyond the call of duty by going out under fire to rescue wounded soldiers. By Marie Jackson, BBC News The Mall was packed with people proud to remember the part their families played in the war. Dressed in the sombre, dark clothes of remembrance, many wore an ancestor's solitary medal, others row upon row, alongside their poppies. They carried wreaths with carefully crafted messages of thanks and spoke of their pride in their grandfathers, great-grandfathers and great uncles. Read more from Marie Donald Trump, Angela Merkel and Emmanuel Macron were among 70 world leaders at a service in Paris In France, where many of the battles of the Western Front were fought,70 world leaders gathered for a ceremonyat the Arc de Triomphe in Paris, hosted by French President Emmanuel Macron. In a speech, Mr Macron urged the assembled world leaders to come together in a joint ""fight for peace"". ""Let us build our hopes rather than playing our fears against each other,"" he said, describing patriotism as ""the exact opposite of nationalism"". Long read:The forgotten female soldier on the forgotten frontline Video:War footage brought alive in colour Interactive:,externalWhat would you have done between 1914 and 1918? Living history:Why 'indecent' Armistice Day parties ended Armistice Day falls each year on 11 November to mark the day in 1918 when the fighting in World War One was stopped. The Allies and Germany signed an armistice in a railway carriage in the Forest of Compiegne in France at 05:00. Six hours later, at 11:00, the conflict ceased. King George V announced that a two-minute silence would be observed in 1919, four days before the first anniversary of Armistice Day. The silence continues to be observed every year on the 11th hour of the 11th day of the 11th month. Pride and awe: Views from the People's Procession The last deaths of World War One The boozy Armistice Day parties WW1 footage transformed into colour. Video, 00:02:08WW1 footage transformed into colour Is it wrong to wear a white poppy? In Pictures: Poppies ahead of Armistice Day How Germans remember the World Wars. Video, 00:02:42How Germans remember the World Wars The forgotten Muslim soldiers of World War One What role did weapons and technology play in WW1? Video, 00:01:52What role did weapons and technology play in WW1? 'Khadi' poppy marks India's WW1 servicemen. Video, 00:01:52'Khadi' poppy marks India's WW1 servicemen The Caribbean's overlooked WW1 soldiers Wildfire sweeps through Hollywood Hills and threatens landmarks as chaos grips LA Paris Hilton among stars 'heartbroken' as she watches home 'burn to ground' Commuters warned of icy roads as cold snap continues to freeze UK Sound Of 2025: Ezra Collective are 'keeping music real' The Papers: 'Apocalypse' LA and 'Reeves faces extra tax rises' How Australia's beach cabana drama sparked a turf war H-1B: Visa row under Trump fuels anxiety for Indian dreamers 'I thought I was going to die': Jailed Venezuelan activist details brutality of prison life The man who could become Canada's future PM 'Trump 2.0' looms large over the global economy A politician was shot dead in Bangkok. Did another country do it? Chris Mason: Is Starmer leaving the door open to an abuse inquiry? Delivering brand-new miracles in 1970s East End Watch the latest series of Call the Midwife on iPlayer now Mark-Anthony Turnage shares the soundtrack of his life Once called 'Britain’s hippest composer', he's tackled topics from drug abuse to football in his work Paddy’s loaf-changing experience inside the bread factory Paddy McGuinness visits the bread factory he used to work in, and sees how they make 1.4 million loaves a week What's behind the global surrogacy boom? More countries are banning surrogacy – but demand is growing © 2025 BBC. The BBC is not responsible for the content of external sites.Read about our approach to external linking."
