headline,article
Second night of property burnings in Sri Lanka,"Mobs have attacked buses as well as property belonging to the Rajapaksas and other politicians Security forces are deployed across Sri Lanka with orders to shoot looters on sight amid continuing protests at the government's handling of a devastating economic crisis. President Gotabaya Rajapaksa has vowed to restore order, in his first national speech since protests began last month. Ignoring calls to resign, he offered to cede some powers to parliament and name a prime minister, but set no timetable. His brother quit as PM on Monday amid fury over soaring prices and shortages. Sri Lankans are desperate as basic items like food and fuel run out or become unaffordable. ""We have come to the protest site despite the curfew,"" one protester, Chandrasekaran, told BBC Tamil in Colombo. ""We are suffering even now. There is no kerosene, no petrol, no diesel, and no power."" Despite a nationwide curfew, there have been two consecutive nights of arson attacks by mobs - many have targeted property belonging to the Rajapaksas and other politicians who are blamed for the mess the country is in. Shops near Colombo were torched, as well as a resort owned by the son of former Prime Minister Mahinda Rajapaksa. Mr Rajapaksa, the president's elder brother and a two-time former president, is holed up in a naval base in the north-east for his own safety, the military has confirmed. This video can not be played ""I never wanted him"" - people from Sri Lanka's protests on the country's leaders At least nine people have been killed and about 200 injured in unrest since Monday. It began when government supporters attacked protesters who are demanding that Gotabaya Rajapaksa leave office. Opposition politicians have warned the violence could have been staged to give the army a pretext to take power. Rumours of a possible coup have been fuelled by the presence of large numbers of troops with armoured vehicles on the streets. But the military have denied any such move is planned. ""When there is a dangerous situation in the country, powers are given to the military to deal with it,"" Defence Secretary Kamal Gunaratne told a news conference. ""Don't ever think that we are trying to capture power. The military has no such intentions."" Sri Lanka had already seen weeks of protests over its dire financial situation, which has caused the Sri Lankan rupee to plunge, provoking severe shortages of basic items such as food, fuel and medical supplies. The worst trouble overnight was in the north of the capital, Colombo, where rival groups set fire to shops in the town of Negombo. On Monday night, mobs burned more than 50 houses belonging to politicians, while a controversial museum dedicated to the Rajapaksa family was also razed to the ground in their traditional heartland, Hambantota, in the country's south. Soldiers and police are under orders to shoot anyone damaging property or threatening life Shops, businesses and offices were shut for a third day on Wednesday under a nationwide curfew in place until Thursday morning. Another protester told the BBC the president's speech on Wednesday was long overdue. ""Where were you for the last 30 days? People don't have medicine, people don't have food, the entire country's at a standstill,"" Kavindya Thennakoon said. ""The reforms he's suggesting are not what we need. What we need right now is for [the president] to resign from office... It baffles my mind that Gotabaya Rajapaksa doesn't understand that."" The streets of the capital, Colombo, bear the evidence of this week's rioting - a heavy police presence, troops on the streets, and overturned and burnt buses after Monday's violence. Why Sri Lankans want their rulers thrown out The divisions behind Sri Lanka's united protests Sri Lankans left desperate over medicine hikes Nonetheless, protesters continue to gather despite the curfew at Galle Face Green. They insist President Rajapaksa has grossly mismanaged the economy and must stand aside. He is the last Rajapaksa family member in office and the resignation of his brother as prime minister did nothing to placate demonstrators or bring calm. Protesters blame Gotabaya (right) and Mahinda Rajapaksa for the current crisis President Rajapaska says he is holding talks with other political parties aimed at forming a unity government. But the main opposition  has said it will not be part of the interim administration unless the president stands down. At present, there is no clarity on which political parties might come together to form such a government. The political stalemate comes as Sri Lanka attempts to iron out a bailout package with the International Monetary Fund (IMF) - the island's $81bn economy is near bankruptcy. It has suspended its foreign debt payments, largely because it cannot service loans from China that paid for massive infrastructure projects. While the pandemic hit the vital tourism sector and shrank Sri Lanka's earnings and foreign exchange reserves, experts say problems have been exacerbated by populist tax cuts in 2019 and a disastrous ban on chemical fertilisers in 2021 that devastated crop yields. Protesters gathered in front of Trincomalee Naval Base in the north-east after reports that Mahinda Rajapaksa had fled there with his family after escaping from his Colombo residence when it was besieged by crowds on Monday night. The military confirmed on Wednesday that he was inside the base. ""We took Mahinda to the naval base for safety reasons,"" the defence secretary said. Earlier, there had been rumours that Mr Rajapaksa and others in the family had fled to India, which the Indian High Commission in Colombo denied. Anbarasan Ethirajan, BBC News, Colombo Sri Lankans are still reeling from the violence that has erupted. Many politicians are sheltering in safe houses or avoiding appearing in public. ""It is not at all safe, particularly for politicians on the government side,"" Nalaka Godahewa, until recently media minister, told the BBC. His house was among those torched. Mahinda Rajapaksa, once celebrated by the majority Sinhalese as a war hero for defeating the Tamil Tiger rebels, has suddenly become a villain. Many blame his supporters for targeting anti-government protesters, which then set off a chain of violent events. The Rajapaksas have always stood together, but this time, their differences are out in the open. The problem appears to have started after Gotabaya asked the family patriarch Mahinda to ""take one for the team"" and resign. How the family, who have dominated Sri Lankan politics for years, overcome this crisis is now an open question. Why is Sri Lanka in crisis? The divisions behind Sri Lanka's united protests Death toll rises as governor confirms hydrants issue 'impaired' LA wildfires fight 'I have nothing to go back to' - reporter tells of LA fires heartbreak Reeves pledges to 'make UK better off' on China visit LA fires: How three days of devastation unfolded What's the latest on the Los Angeles wildfires and what caused them? 'Cold bites' gas supply and 'Dementia shock' 'My mum died after four days on an A&E trolley' The '9/11 mastermind' wants to plead guilty. Why is the US trying to stop him? Pop star Chappell Roan wins BBC Sound Of 2025 Weekly quiz: Zendaya looked happy but who else sparkled at the Golden Globes? Inside the UK's first legal drug consumption room Danes struggle with response to Trump Greenland threat Dragons’ Den returns with a new line-up of celebrity guests Can a fresh batch of entrepreneurs secure the deal of a lifetime? Are smart scales really as ‘smart’ as they claim to be? Greg Foot explores whether they can accurately measure weight, body fat, muscle and bone mass The award-winning psychological competition is back A nail-biting game of detection, backstabbing and trust. Who will make it through? How close are we to a cancer vaccine? How might it help in the treatment of the disease? © 2025 BBC. The BBC is not responsible for the content of external sites.Read about our approach to external linking."
Holiday bookings surge but no late deals - Tui,"Holiday giant Tui has said it expects summer bookings to ""almost reach"" 2019 levels this year, but warned there will be ""no last minute"" low price deals. The company said bookings had surged in the past six weeks as people planned for summer breaks after the easing of Covid travel restrictions. But it warned the impact of Covid and the Ukraine war on customer behaviour remained ""difficult to predict"". Tui's boss warned of price rises and limited offers due to high fuel costs. ""There will be practically no last minute offers at low prices this summer,"" said Fritz Joussen. Tui's losses halved to €614.5m (£525m) in the six months to March, as it hailed a strong recovery in customer demand. How are travel rules being relaxed? Holiday bookings jump as Covid travel tests axed As a result, the company told its shareholders it could return to profit by the end of the year. ""The high demand for travel and the very good business performance confirm our forecasts,"" said Mr Joussen. ""2022 will be a good financial year. Capacity almost reaches pre-corona level of 2019."" He added: ""After two years of crisis, we expect Tui to become profitable again in the current financial year... This is the basis for new growth."" Tui told the BBC Greece was its most popular destination currently, closely followed by the Canary and Balearic Islands and Turkey. In the past three months, 1.9 million customers flew with Tui which was an increase of 1.7 million compared to the same period in 2021 when global travel was on its knees due to the pandemic. The firm said bookings for summer holidays were currently at 85% of 2019 levels, with reservations from UK customers up 11% on two years ago. With Covid travel restrictions receding, demand for overseas summer holidays is coming back with a bang. And for Tui, UK holidaymakers are leading the way back to the beach. The tour operator says people are spending more on summer trips, for example going for longer and taking more package tours. The optimism isn't completely un-clouded. Tui -  like other travel businesses  - will be keeping an eye on how the Ukraine war, inflation and any future travel restrictions affect consumers' behaviour. Many airports and some airlines had a tricky Easter holiday period. Some simply didn't have enough staff to cope with the sudden surge in demand. But this is another sign that lots of people still want to go away, and they are getting booking. In fact, people trying to book summer trips or hotels at the last minute might find their options limited as lots of other people have got there first. The phasing out of UK testing rules in February has resulted in growing demand for flights and holidays. However, some countries still expect travellers to follow isolation and testing requirements. On Tuesday, Heathrow Airport said it had seen strong demand in April and forecast that passenger numbers will grow this summer. However, the UK's biggest airport said demand would only hit 65% of pre-pandemic levels overall for the year as rising prices force customers to cut back. The Bank of England expects inflation - the rate at which prices rise - to breach 10% later this year, putting the UK at risk of recession. ""The ongoing war in Ukraine, higher fuel costs, continuing travel restrictions for key markets like the United States and the potential for a further variant of concern creates uncertainty going forward,"" the airport said. Holiday bookings jump as Covid travel tests axed How are travel rules being relaxed? Comments can not be loaded To load Comments you need to enable JavaScript in your browser Death toll rises as governor confirms hydrants issue 'impaired' LA wildfires fight 'I have nothing to go back to' - reporter tells of LA fires heartbreak Reeves pledges to 'make UK better off' on China visit LA fires: How three days of devastation unfolded What's the latest on the Los Angeles wildfires and what caused them? 'Cold bites' gas supply and 'Dementia shock' 'My mum died after four days on an A&E trolley' The '9/11 mastermind' wants to plead guilty. Why is the US trying to stop him? Pop star Chappell Roan wins BBC Sound Of 2025 Weekly quiz: Zendaya looked happy but who else sparkled at the Golden Globes? Inside the UK's first legal drug consumption room Danes struggle with response to Trump Greenland threat Dragons’ Den returns with a new line-up of celebrity guests Can a fresh batch of entrepreneurs secure the deal of a lifetime? Are smart scales really as ‘smart’ as they claim to be? Greg Foot explores whether they can accurately measure weight, body fat, muscle and bone mass The award-winning psychological competition is back A nail-biting game of detection, backstabbing and trust. Who will make it through? How close are we to a cancer vaccine? How might it help in the treatment of the disease? © 2025 BBC. The BBC is not responsible for the content of external sites.Read about our approach to external linking."
Food and energy bills warning for 1.5m households,"Faith Angwet told the BBC there was no support to help her pay rising food and energy bills Single mum Faith Angwet struggled to make ends meet during the pandemic but says the cost of living crisis has hit her even harder. ""I was starting to feel like I was getting to a good place but now the price of everything has gone up it has pushed me right back,"" she said. Ms Angwet is one of an estimated 1.5m UK households that will struggle to pay food and energy bills in the next year. That's according to research which also predicts a UK recession in 2022. The National Institute of Economic and Social Research (NIESR) has also warned that a combination of rising prices andmeasures announced in the Chancellor's Spring Statement- such as the decision not to scrap a planned rise in National Insurance tax - are hitting the poorest households hardest. Ms Angwet, 36, from Southwark in south London, is a single mother-of-two who has been unemployed since having her daughter two years ago. ""In the pandemic if you couldn't afford something you could shop around or buy in bulk. But now you can't afford it everywhere. And if I am able to buy in bulk, if the kids see it they want to eat it now. So I find myself hiding things from them so I can bring it out another day like magic."" Faith Angwet said plans to take her children to the beach would have to be pushed back due to rising costs Things have got so bad that Ms Angwet sometimes forgoes her prescription for blood pressure medication so she can afford to buy formula and nappies for her daughter. As she is unemployed, she cannot get any other form of benefit or financial help from the government so has turned to food banks for support. She said her five-year-old son's free school meals were a ""huge help"" and that she was grateful for nappies and clothes from Little Village baby bank. ""It's got to the point that I turned to a payday loan, but they want you to borrow more than you need. We can't always go to the food bank, it's a vicious cycle,"" she said. Why are prices rising so quickly? Warning of economic downturn as interest rates rise Five ways the Ukraine war could push up prices Inflation - the rate at which prices rise - is at a 30-year high, as the Ukraine war drives up fuel and energy prices. The Bank of England has warned inflation might reach 10% within months. The think tank urged the government to raise Universal Credit by £25 per week between May and October, which would cost around £1.35bn, and give £250 each to 11.3 million lower income households. ""Without this targeted support we expect a further increase in extreme poverty,"" the think tank said, with about a quarter of a million households sliding into extreme poverty, taking the number to about a million. About half a million households would ""face the choice between eating and heating"" without these payments, it said, adding that the chancellor had a reported £20bn of ""headroom"" for government spending that could be used to cushion the shock to income. The think tank predicted that inflation would average 7.8% in 2022 and will remain above 3% until 2024 - above the Bank of England's 2% target. At the same time, economic growth is set to slow. While NIESR forecast that UK economic growth in 2022 would increase by 3.5% on average, it predicted a fall in the final two quarters of the year. This would push the UK into a recession, which is two consecutive quarters of economic decline. Meanwhile, government policies are set to leave households with even less disposable income, according to NIESR. It forecasts household income when adjusted for inflation will fall by 2.4% in 2022, along with a small rise in unemployment next year. Tony Danker, director general of the CBI, which represents big businesses, told the BBC's Today programme that companies were suffering too. He said inflation, higher energy prices, labour shortages and the war in Ukraine had made firms ""pause before investing"", and that this was stopping them ""creating jobs and paying good wages"". He said the government needed to create ""reasons to invest"" such as subsidising the shift to clean energy or cutting business rates for shops. ""If we wait... the economy will end up in more trouble,"" he added. ""Get firms investing now because that will stop us facing dire consequences later on."" Fears as energy hike hits disabled families Money tips: How to cut spending as energy bills rise Professor Stephen Millard, NIESR's deputy director for macroeconomics, said: ""Although the war in Ukraine is fundamentally a human tragedy, it has resulted in another supply shock for the UK economy: pushing down growth and pushing up on inflation."" He added: ""We need fiscal policy to loosen and monetary policy to tighten if the UK economy is going to sail safely through these treacherous seas."" A Treasury spokesperson said the country has had a ""strong economic recovery"" from the pandemic but acknowledged that these are ""anxious times"", and said the government is taking action to support households. ""This includes a tax cut of over £330 a year for the typical employee, lowering the Universal Credit taper rate to help people keep more of the money they earn, and providing millions of households with up to £350 each to help with rising energy bills,"" the spokesperson said. ""Public debt is at the highest levels since the 1960s and rising inflation is pushing up our debt interest costs, which means we must manage public finances sustainably to avoid saddling future generations with further debt."" Shadow chancellor Rachel Reeves said the government should bring in an emergency budget ""urgently"", adding: ""With a one-off windfall tax on oil and gas producer profits we can cut household bills by up to £600 and support businesses through the cost of living storm."" It comes as NIESR separately forecast that global economic growth would be 1% lower, or about $1.5tn, at the end of 2022, due to the Ukraine war. Are you personally affected by the rising cost of living? Emailhaveyoursay@bbc.co.uk,external. Please include a contact number if you are willing to speak to a BBC journalist. You can also get in touch in the following ways: WhatsApp:+44 7756 165803 Tweet:@BBC_HaveYourSay,external Upload pictures or video Please read ourterms & conditionsandprivacy policy If you are reading this page and can't see the form you will need to visit the mobile version of theBBC websiteto submit your question or comment or you can email us atHaveYourSay@bbc.co.uk,external. Please include your name, age and location with any submission. Warning of economic downturn as interest rates rise EU divided over how to step away from Russian energy Death toll rises as governor confirms hydrants issue 'impaired' LA wildfires fight 'I have nothing to go back to' - reporter tells of LA fires heartbreak Reeves pledges to 'make UK better off' on China visit LA fires: How three days of devastation unfolded What's the latest on the Los Angeles wildfires and what caused them? 'Cold bites' gas supply and 'Dementia shock' 'My mum died after four days on an A&E trolley' The '9/11 mastermind' wants to plead guilty. Why is the US trying to stop him? Pop star Chappell Roan wins BBC Sound Of 2025 Weekly quiz: Zendaya looked happy but who else sparkled at the Golden Globes? Inside the UK's first legal drug consumption room Danes struggle with response to Trump Greenland threat Dragons’ Den returns with a new line-up of celebrity guests Can a fresh batch of entrepreneurs secure the deal of a lifetime? Are smart scales really as ‘smart’ as they claim to be? Greg Foot explores whether they can accurately measure weight, body fat, muscle and bone mass The award-winning psychological competition is back A nail-biting game of detection, backstabbing and trust. Who will make it through? How close are we to a cancer vaccine? How might it help in the treatment of the disease? © 2025 BBC. The BBC is not responsible for the content of external sites.Read about our approach to external linking."
