headline,article
Calls for clarity over new England lockdown,"Prof Chris Whitty and Sir Patrick Vallance have been answering questions from MPs on the evidence behind the lockdown in England Nicola Sturgeon has asked for clarity on whether the furlough scheme will be extended in Scotland beyond 2 December Faith leaders ask that the government reconsider restrictions placed on churches and mosques People in Wales will be able to meet in groups of 4 in pubs, bars and cafes from next week Liverpool is to take part in the first trial of city-wide coronavirus testing in England If the pilot is successful, the government says it could be rolled out to ""millions"" by Christmas Sports coaches have criticised the decision to suspend all children's grassroots sport during England's new lockdown Michael Gove has apologised for wrongly suggesting that playing golf or tennis would be exempt from the new lockdown Edited by Emma Owen Here are today's headlines:  Today's coverage has been edited by Emma Owen, Suzanne Leigh and Paul Gribben and written by Alex Therrien, Becky Morton, Katie Wright, Johanna Howitt and Gavin Evans. Thanks for joining us and we will be back tomorrow morning.  The government has publisheda list of businesses which will be allowed to remain open,externalin England during the four-week lockdown. It includes: Hull Trains will stop its four services a day to and from London on 5 November due to the new lockdown in England. That's the second time it has felt the need to do this - the first suspension saw services paused on 29 March and reopened with a reduced timetable on 21 August. Hull Trains is thought to be Britain's smallest train company with about 130 staff. It started in 2000 and usually operates 92 direct services a week between Hull and London. The RMT union wants to see the government offering financial support. Read more about the storyhere. Sweden has not imposed tough restrictions seen elsewhere in Europe Sweden has limited to eight per table the number of people sitting together in cafes and restaurants, amid a sharp rise in coronavirus infections. ""We have a very serious situation,"" Prime Minister Stefan Löfven warned, saying the virus was ""going in the wrong direction"". Sweden has reported 31 Covid deaths since Friday, taking the death toll to 5,969 - far higher than its neighbours. Unlike them, Sweden has never imposed a nationwide lockdown. Mr Löfven also announced stricter recommendations - including working from home if possible and avoiding public transport - for another three regions: Halland, Örebro and Jönköping, This means that about 70% of the country's 10.5 million people now live under the new government guidelines, which are voluntary. Read more on this here. Are dentists still open? How will Remembrance Sunday services be affected? Will hotels close? If you're wondering about a particular scenario, chances are someone else is too. We answer some of your questions about the rapidly changing rules and restrictions in the UK.  As we reported earlier, there have been calls for youth sport to be exempt when thenew restrictions come into effectin England on Thursday. But the government’s chief scientific adviser says the decision to suspend children's sport is a matter for ministers. Sir Patrick Vallance told MPs: “We just don’t go down to
that level of individual activities. “They’ve had advice from us in terms of the general principles
and some of the areas but not down to individual, specific activities like
that.” Appearing alongside him at the Commons science select committee, Prof Chris Whitty agreed, saying it
was the job of the Scientific Advisory Group for Emergencies (Sage) to “give the broad advice”. This video can not be played Coronavirus: Celebrating a 100th birthday with thousands of cards Turning 100 is a cause for big celebrations. But, when Evie Bowles could not have the big party she had planned due to coronavirus restrictions, her grandson had another idea to mark the occasion. He took to social media to ask people to send a birthday card to Evie at her care home in Lisnaskea, County Fermanagh. The post went viral and more than 1,000 people from around the world sent cards to celebrate her big day. Dan RoanBBC Sports editor British Cycling chief Julie Harrington has written to the culture secretary to ask for ""small outdoor groups and club-led"" activities to be allowed to continue during England's lockdown. Writing on behalf of GB Cycling, British Triathlon & England Athletics she said: ""We have, largely thanks to the work of volunteers, been able to reintroduce group rides and runs, club activity, adapted competitions and coaching sessions. And given that all activities take place outdoors, participants are able to maintain appropriate social distancing at all times, we believe that the risk of transmission through taking part is limited."" Harrington added that while training alone or with members of their household might work for some, many people rely on the support and encouragement of a friendly group, and may ""stop altogether"" without it. ""Prohibiting group activities will deny millions of people the right to be active at a time when they need it most,"" she said. A leading imam has joined other faith leaders in calling for the government to reconsider its restrictions on places of worship during the second national lockdown in England. Qari Asim, of Makkah Mosque in Leeds, said finding a way of keeping mosques open was of ""paramount importance"" and should be considered ""essential"", along with other services. Places of worship will be closed from Thursday, unless they are being used for funerals, individual prayer, formal childcare or other essential voluntary and public services such as support groups. Imam Asim, who is a government adviser on Islamophobia, said: ""The complete cessation of communal prayer and worship is a matter of concern for Muslim communities."" He added there was no evidence of Covid outbreaks in mosques and said they ""serve not only the spiritual and religious needs of the Muslim community but also they help maintain the mental wellbeing of the community as well"". Prof Chris Whitty says the new national lockdown in England
will reduce the R number - the number of people that one infected person will pass on the virus to - below 1 if the measures are followed by the public. England's chief medical officer, speaking to MPs, says that would ""make a huge difference” but he wants to
reiterate that the virus will still be a problem that “we need to see through winter”. He adds that this doesn’t mean that the country will need to stay in lockdown through winter but “we’ll need to be doing things that keep the rates down”. He adds that young people have “brought the rates down in their
own age groups by their actions – that has been remarkable”. Asked whether the restrictions will be lifted on 2 December,
he says that is a decision for ministers but the aim of the lockdown is to get
rates down so “we can move far enough that it’s a realistic possibility to move
into a different state of play at that point”. Reality Check As we've been reporting, chief medical officer for England Prof Chris Whitty and chief scientific adviser Sir Patrick Vallance are being questioned by MPs about the figures they gave at Saturday’s briefing when the prime minister announced the new lockdown for England. There has been much focus on the chart above, which included one model that gave a scenario of 4,000 people a day dying of coronavirus over winter (roughly four times the figure during the worst days of the first wave). Sir Patrick said he hoped the focus had not been on the longer term models in that chart, but on the six week forecasts in other charts in the presentation. Prof Whitty said “I have never used anything beyond six weeks in anything I have ever said to any minister on this issue”, but Sir Patrick then said that the chart had indeed been shown to the prime minister. There has also been criticism that the curves in the chart were all produced at the start of October, just after the rapid rise in cases that followed students returning to university. These were based on models for worst-case planning that assumed no changes in policy or behaviour. But, since then, England has introduced a three-tier system of stricter measures and the epidemic has grown more slowly than the curves assumed it would. Indeed, on the day the chart was used, an average of 215 deaths had been reported each day in the previous week. That was far below the 1,000 a day envisioned by the most pessimistic model. David PorterScotland Westminster editor There has been much discussion of the furlough scheme today, and UK government sources now insist the  scheme and funding will be extended to the devolved administrations if needed because of further lockdowns. A source said that Prime Minister Boris Johnson's statement yesterday, in which he said ""the furlough scheme is a UK-wide scheme"", still stood. The Treasury is now ""dotting the i's and crossing the t's"", the source said, although they added a formal statement may not come today. Chief Secretary to the Treasury Steve Barclay was questioned on the matter earlier in the House of Commons and echoed the prime minister's words that the furlough was a UK-wide scheme. You can read more about the rowhere. Prof Chris Whitty has defended England's Test and Trace system after being questioned about its effectiveness by MPs. ""Test and trace has gone from a standing start to a long way
down the track,"" says England's chief medical officer, however he adds that once
you have very high rates of transmission of the virus it is not as effective. “We’ve all said from the very beginning this is most
effective when the rates are low”. He says Test and Trace will probably be having “a bigger
effect” on areas which have lower rates right now, than those in the areas where it is higher. He adds that a “secondary gain” of the new lockdown in England is that
it “will bring the numbers down to the rate where this becomes a much bigger
part of the solution”. Sir Patrick Vallance, the government's chief scientific officer, adds that across Europe “even very
effective test and trace systems do not work well at high prevalence”. Back to the Science and Technology Committee now, and Prof Chris Whitty was asked why, given improvements in treatments for coroanvirus patients, the number of deaths this winter could still reach the levels of the first peak. England's chief medical adviser replied that treatments like the drug dexamethasone ""reduce mortality"" but ""they are not going to take it right the way down"". “Some people, sadly, will come into hospital and whatever you do they will die,"" he told MPs. “I think the idea there’s been a huge transformation
in the mortality rate would not be supported by the data."" He added that he was ""confident"" there had been a reduction in the mortality rate but ""the best we can hope for"" is that it has halved. Meanwhile in Scotland, Nicola Sturgeon has said she does not plan to make any changes to her Covid restrictions before next week. The first minister saidshe wanted to stick to the timetable under which new measures, that came into effect this week, will be reviewed next Tuesday. Sturgeon had indicated on Monday that questions over furlough funding meant she may need to decide within days whether to take tougher steps. UK Prime Minister Boris Johnson has said support will be available in the future. At her daily press conference Sturgeon said: ""We are going to stick, if we can, to our scheduled review period. That is probably, on balance, the best thing to do."" While Prof Chris Whitty and Sir Patrick Valance have been explaining the current situation to MPs, some changes to the rules in Wales have been announced. Up to four people will be able to meet  in pubs, cafes and restaurants in in the countryafter its firebreak lockdown ends on 9 November. The 22:00 curfew on alcohol sales will remain in place. First Minister Mark Drakeford asked people to visit the venues in the smallest groups possible. He said reopening would be ""subject to strict protections discussed with the hospitality sector, including advance booking, time-limited slots and verified identification"". ""Our clear advice to people in Wales is that we should visit these places in as small a group as possible, and for many, this will only be the people we live with,"" he told the Welsh Parliament. ""But we have listened to those young people, and single people especially have told us how important it is for them to meet some friends and other family members."" England's chief medical officer, Prof Chris Whitty, says he understands why some documents about virus scenarios are not put into the public domain because they can create unnecessary worry. He was asked whetherthe government's ""reasonable worst-case scenario""- which is used by
officials and the NHS to plan for the months ahead - would be published. Speaking to MPs, he says: ""There’s a danger with these extreme forward projections that
people then misinterpret them as ‘this is what it’s going to happen’”. He says this can cause people to get “unduly worried” by
something when the whole point of a reasonable worst case scenario
is to say “we need to stop this happening”. However, he adds that he’s “in favour of publishing as much as
possible”. The UK government's chief scientific adviser, Sir Patrick Vallance, has defended presenting modelling to the public that suggested deaths could reach more than 4,000 a day if no action was taken. Labour MP Graham Stringer suggested that without caveats this data could frighten people, who did not fully understand the context. Sir Patrick said the aim was to give as much information as possible, not to frighten people but he acknowledged models looking further ahead were less reliable. Prof Chris Whitty says the three-tier system of restrictions in England has “slowed
things down from where they would have been otherwise”. “I am confident that the tier two has had an effect and that
the tier three has had a bigger effect,” he says. Prof Whitty says he believes infection rates are “substantially lower then
they would have been” without those tighter measures being implemented in large parts of the country. But the measures have not managed to reduce the reproduction rate of the virus - or R number - below 1, at which point it would decline in the population. However, he did say it had got closer to 1. ""That's due to the remarkable work of individuals taking really quite difficult social decisions for quite prolonged periods,"" he said. He also said there was “no evidence” the R number was falling below 1 in the older age groups. What is the R number?Here is a reminder. Prof Chris Whitty says putting exact dates on virus projections
is “almost impossible” and he says none of the government's scientific advisers would say “this
is definitely going to happen on this date”. But he says the chances that things are ""likely to improve without
action” once the R number - the rate at which the virus is spreading - goes above 1 and you’re heading into the winter
months “are quite low”. He tells MPs: ""If you’re giving advice to ministers, that has to be the
advice you give. Ministers then have to make decisions not just on that advice.
They have to use multiple other things."" He says the government's scientific advisers give “one
strand of advice” but he believes “quite strongly"" that these ""deeply difficult
societal measures fundamentally are decided by ministers”. © 2025 BBC. The BBC is not responsible for the content of external sites.Read about our approach to external linking."
"Diana's brother demands BBC inquiry over interviewThe BBC will investigate ""substantial new information"" amid a row over the 1995 Panorama interview.","Princess Diana's brother has called for a BBC inquiry over faked bank statements he says helped secure his sister's historic Panorama interview. Charles Spencer said ""sheer dishonesty"" was used to secure the 1995 Martin Bashir interview with the princess. In a letter to BBC director-general Tim Davie,reported by the Daily Mail,external, the earl accused the BBC of a ""whitewash"". The BBC has apologised for the faked statements, but it says a note from the princess says she did not see them. ""They had played no part in her decision to take part in the interview,"" the BBC said. The corporation said it would investigate ""substantive new information"" but this was ""hampered at the moment"" by the fact that Bashir was ""seriously unwell"" and unable to discuss the claims. Bashir, 57, currently BBC News religion editor,has been unwell with Covid-19 complications, the BBC said last month. Nearly 23 million people tuned in to watch the Panorama interview, recorded almost 25 years ago, on 20 November 1995. In the interview the princess famously said that ""there were three of us in this marriage"", referring to Prince Charles' relationship with Camilla Parker-Bowles. At the time Princess Diana was separated from Prince Charles but not yet divorced. The letter comes afterthe Sunday Times reported,externalthat the director-general of the BBC apologised to Earl Spencer last week for the use of the fake bank statements 25 years ago but declined to open a further investigation. In Earl Spencer's response, reported by the Daily Mail, he said Bashir had used the forged bank statements to persuade the princess into doing the interview. The statements wrongly purported to show that two senior courtiers were being paid by the security services for information on his sister, the newspaper said. Earl Spencer wrote: ""If it were not for me seeing these statements, I would not have introduced Bashir to my sister. ""In turn, he would have remained just one of thousands of journalists hoping that he/she had a tiny chance of getting her to speak to them, with no realistic prospect of doing so."" Earl Spencer accused Bashir of ""yellow journalism"" - a term for sensationalist and unethical reporting - and said the BBC had not accepted ""the full gravity of this situation"". The earl also said he had a letter allegedly written by Bashir in 1995, in which the journalist referred to false rumours about the Prince of Wales having an affair with her children's nanny, Tiggy Legge-Bourke. In a statement, the BBC said: ""The BBC has apologised. We are happy to repeat that apology. ""And while this was a quarter of a century ago, we absolutely will investigate - robustly and fairly - substantive new information."" The statement said Earl Spencer had been asked to share further information with the BBC. It said: ""Unfortunately, we are hampered at the moment by the simple fact that we are unable to discuss any of this with Martin Bashir, as he is seriously unwell.  When he is well, we will of course hold an investigation into these new issues."" The BBC added that a ""key piece of information"" in investigations following the interview was a handwritten statement from the princess. Her note ""said she hadn't seen the mocked-up documents and they had played no part in her decision to take part in the interview"". BBC's Martin Bashir 'seriously unwell' from Covid California's fire death toll doubles as chaos grips LA What's the latest on the LA fires, and what caused them? Israeli settlers in West Bank see Trump win as chance to go further 'I paid fake doctor thousands for fillers - now I look like a gargoyle' The Papers: 'Lost Angeles' and 'Musk seeks plan to oust Starmer' Pop star Chappell Roan wins BBC Sound Of 2025 Weekly quiz: Who joined Demi as a big winner at the Golden Globes? The 20 child abuse inquiry proposals - what has happened so far? The '9/11 mastermind' wants to plead guilty. Why is the US trying to stop him? Why are UK borrowing costs rising and what does it mean for me? In maps: Thousands of acres on fire in LA Before and after: How wildfires tore through LA Ed Gamble hosts the official Traitors podcast Join Ed Gamble and guests as they dissect the first episodes of The Traitors! Can art, music and words bind us in divided times? Simon Schama explores how artists have captured the transformations of British society since 1945 Enjoy a satirical smorgasbord of The News Quiz Digest a dramatic year of news as Andy Zaltzman revels in some of 2024's funniest moments The multi-award-winning legal drama returns Two years on, the Defoes are back and have gathered for a beautiful wedding in Barcelona © 2025 BBC. The BBC is not responsible for the content of external sites.Read about our approach to external linking."
