headline,article
UK ships prepare to leave Jersey after fishing row,"Two Royal Navy ships are preparing to return home after a protest by French fishermen over post-Brexit rights in Jersey's territorial waters ended. The UK government said ""the situation is resolved for now"" but ""we remain on standby"" to assist Jersey. French fishermen say their rights are unfairly restricted by licences issued under the Channel Island's new system. Jersey's External Relations Minister Ian Gorst said discussions with the French crews had been ""positive"". The UK said it had agreed with Jersey's government that one of the Royal Navy offshore patrol vessels will return to its home port on Thursday night while the other will leave on Friday morning. Prime Minister Boris Johnson said he was ""pleased the situation in Jersey has been resolved."" ""The UK will always stand resolutely by the people of Jersey,"" he said. What's the fishing row about? Who really owns UK fishing rights? What does the Brexit trade deal mean for fishing? About 60 boats took part in a protest at St Helier, Jersey's capital and main port, prompting the dispatch of two Royal Navy ships - HMS Severn and HMS Tamar - and two French vessels to the area. The French government said it was acting ""in a spirit of responsibility"" after the ""British failure"" to abide by the trade deal. It said it hoped the situation would be ""swiftly resolved by the full and total implementation"" of the deal, which France said allowed continued access to British waters for fishermen who worked in them prior to Brexit. ""We want to use all the leverage at our disposal to protect the fishing industry and enable it to continue its activities,"" a spokesman for France's ministry for Europe and foreign affairs said. By Jean Mackenzie, BBC Europe correspondent, in Carteret port on the Normandy coast As the boats pulled out of this harbour at 02:30 on Thursday morning, the fishermen were prepared for this 15-hour stand-off in the cold and rain. This protest was their plan to get noticed and it worked. Yes they are angry, but they are also shaken by these unexpected restrictions and worried about their livelihoods. Some fishermen have only been given permission to fish for a handful of days a year. One fisherman, who catches half his whelks and lobsters along Jersey's shores, told me if he can't get full access to Jersey's waters he will have to sell his boat and change his job. When they returned to the French coast this evening, drenched and exhausted, they were surprisingly upbeat. Talks with Jersey's government did not go well, they said, but they know they have been heard. They are now hopeful their government and Brussels will step in to resolve the issue. They feel their part is done, for now. A spokesman for fishermen from France's Normandy region suggested the situation was still in ""deadlock"". Hugo Lehuby told Reuters news agency: ""Either this gets resolved, or retaliatory measures are taken."" And a European Commission spokeswoman said ""additional conditions"" attached to the new fishing licences were a breach of the Brexit trade deal. France has threatened to cut off electricity to Jersey, the largest Channel Island and a Crown dependency, located 14 miles (22km) off France. Crown dependencies are not part of the UK, but are defended and represented internationally by the British government. The boats were protesting against new fishing rules - introduced last week by the Jersey government under the UK-EU Trade and Co-operation Agreement (TCA) - which require French boats to show they have a history of fishing in Jersey's waters. But it has been claimed additional requirements were added without notice. French authorities say ""new technical measures"" had not been communicated to the EU, rendering them ""null and void"". Jersey's Senator Gorst said after Thursday's talks ""all sides remain committed"" to resolving the concerns that led to the fisherman's protest. HMS Tamar is one of two Royal Navy ships sent to Jersey The Royal Navy ships sent to Jersey, HMS Severn and HMS Tamar, are based in Portsmouth and are routinely used for fisheries protection - with sailors able to board other boats for spot checks. They are both 90.5m in length, have two large guns, including a short-range anti-aircraft weapon, and are crewed by 45 sailors and up to 50 Royal Marines. France said its two vessels were not on military missions and were told to stay in French waters and to be near the French fishermen to ensure safety. ""I READ MUSIC SCORES AS IF THEY WERE SUBTITLES"":What it's like to be a deaf musician FRESH STARTS:Stacey Dooley chats to people who have embarked on new beginnings French threat in fishing row is 'unacceptable' France threatens Jersey power cut in fishing row Deadly wildfires rage across LA as fierce winds threaten more destruction UK has enough gas, says No.10 after supply warning UK records coldest night of winter as freeze to last into weekend 'I paid fake doctor thousands for fillers - now I look like a gargoyle' The Papers: 'Lost Angeles' and 'Musk seeks plan to oust Starmer' Pop star Chappell Roan wins BBC Sound Of 2025 Weekly quiz: Zendaya looked happy but who else sparkled at the Golden Globes? The 20 child abuse inquiry proposals - what has happened so far? The '9/11 mastermind' wants to plead guilty. Why is the US trying to stop him? Why are UK borrowing costs rising and what does it mean for me? In maps: Thousands of acres on fire in LA Before and after: How wildfires tore through LA Ed Gamble hosts the official Traitors podcast Join Ed Gamble and guests as they dissect the first episodes of The Traitors! Can art, music and words bind us in divided times? Simon Schama explores how artists have captured the transformations of British society since 1945 Enjoy a satirical smorgasbord of The News Quiz Digest a dramatic year of news as Andy Zaltzman revels in some of 2024's funniest moments The multi-award-winning legal drama returns Two years on, the Defoes are back and have gathered for a beautiful wedding in Barcelona Â© 2025 BBC. The BBC is not responsible for the content of external sites.Read about our approach to external linking."
"Holiday costs to jump this summer, warns travel boss","Tel Aviv's beaches have been busy again as coronavirus restrictions have eased Prices for international travel are set to rise this year due to pent-up demand and fewer aeroplanes in service, a travel boss has warned. Booking.com's chief executive Glenn Fogel told the BBC that holiday ""prices are already going up"". Many airlines have significantly reduced the number of flights they operate due to travel restrictions. However, Tui's UK boss Andrew Flintham said it would be ""a long time"" before holiday firms try to boost profits. Mr Fogel said that despite huge demand, uncertainty makes it hard for airlines to plan bringing more planes back into service. ""There's so much pent-up demand,"" said Mr Fogel. ""Everybody wants to go travelling, but we all want to do it safely."" EU unveils plans for overseas tourists to return When can I holiday abroad and how will the green list work? Airlines' Covid travel pass ready 'within weeks' John Grant, an aviation analyst with global travel data provider OAG said this will have a knock-on impact on air fares as travel restrictions are eased. ""That will, in the short term, create a rush of pent-up demand and revenge spending,"" he said. ""In turn, the airline algorithms will detect an uptick in demand and move prices up accordingly"". Airlines have reduced capacity by putting aeroplanes into storage, such as these in France The government will shortly announce which foreign destinations holidaymakers from England can visit from 17 May without needing to quarantine on their return. Air fares to Portugal - which is expected to be on the green list - have already started to rise as airlines respond to higher demand. According to PA, British Airways is charging Â£530 for a flight from Heathrow to the Algarve on 17 May, compared with Â£276 two days earlier. A Ryanair flight from Stansted to Lisbon costs Â£262 on 19 May, PA found, more than double the price of Â£128 on 14 May. But Tui's managing director for the UK and Ireland, Andrew Flintham, told BBC Breakfast travel firms were unlikely to push up prices anytime soon. ""Our prices are very, very stable. They're pretty much like for like, flat, year over year. There isn't a big increase in there. ""We've got plenty of holidays to sell. I think everybody in the industry has. ""It'll be a long time before the idea of trying to increase prices to make more money. We want to get people away on holiday, having a great time, because we think they genuinely all deserve it."" A lack of clarity about how governments will go about recognising vaccine and testing statuses from other countries is troubling the travel industry, which has been hit hard by the coronavirus pandemic. Mr Fogel believes a single system would be helpful: ""So many different people in so many different governments are talking about different programmes, but right now, there is nothing out there that is unified, so it's very confusing. ""I listened to the prime minister of Italy saying how they want to let people into Italy soon and you just have to prove that you have a vaccine and it'd be great. ""And my thinking is, well, I have my vaccine myself, but how do I prove it? Do I just bring my little white card that I got in the US that said I got it, is that going to be good enough? We need some clarifications."" Several systems are being explored, including the International Air Transport Association (IATA)'s travel pass, which is being trialled by a number of airlines. Meanwhile, theEuropean Union is working on having a digital passready in time for the summer holidays. The idea of a scheme that allows passengers who have had the vaccine to travel has proved divisive. The UK equality watchdog recently warned it could create a ""two-tier society, whereby only certain groups are able to fully enjoy their rights"". That's a view supported by the World Health Organization (WHO) but Mr Fogel disagrees. ""It's true that if you're not vaccinated, you may not be able to enter a country under this type of a system,"" he said. ""But I'm okay with that. Because the alternative is what - nobody gets to go in? That doesn't make a lot of sense to me."" He added that there are countries that people cannot go into if they don't have proof of vaccination against yellow fever, for example. ""There's nothing wrong with using technology to prove you are a safe traveller that can help get the industry up faster,"" said Mr Fogel. How to verify the coronavirus vaccine and test status of travellers like this man at Milan's Malpensa Airport has become a divisive issue The lack of clarity has hurt the finances of Booking.com's US owner Booking Holdings, which also owns Kayak and rentalcars.com. Revenues for the three months to the end of March fell to $1.1bn (Â£790m) - 50% lower than the same period a year ago. Figures from the World Travel & Tourism Council (WTTC) reflect a similar picture across the industry, showing tourism's value to the global economy fell from nearly $9.2tn in 2019 to $4.7tn in 2020. As a share of the global economy that equates to a fall from 10.4% to just 5.5%. But Mr Fogel, who is chief executive of both the Dutch-based Booking.com and its parent firm Booking Holdings, told investors that there is still reason to be optimistic things will improve. ""While the pace of vaccine distribution remains frustratingly slow in most places around the world, Israel, the UK and the US are benefiting from successful vaccine distribution programs,"" he said. ""In each of these countries, we have seen encouraging booking trends, which supports our view that vaccine distribution is key to unlocking pent-up travel demand."" This video can not be played Can Covid travel bans work? Spain plans to welcome tourists under EU scheme Qantas says vaccines will be required to fly Coronavirus: Your travel rights explained Comments can not be loaded To load Comments you need to enable JavaScript in your browser Deadly wildfires rage across LA as fierce winds threaten more destruction UK has enough gas, says No.10 after supply warning UK records coldest night of winter as freeze to last into weekend 'I paid fake doctor thousands for fillers - now I look like a gargoyle' The Papers: 'Lost Angeles' and 'Musk seeks plan to oust Starmer' Pop star Chappell Roan wins BBC Sound Of 2025 Weekly quiz: Zendaya looked happy but who else sparkled at the Golden Globes? The 20 child abuse inquiry proposals - what has happened so far? The '9/11 mastermind' wants to plead guilty. Why is the US trying to stop him? Why are UK borrowing costs rising and what does it mean for me? In maps: Thousands of acres on fire in LA Before and after: How wildfires tore through LA Ed Gamble hosts the official Traitors podcast Join Ed Gamble and guests as they dissect the first episodes of The Traitors! Can art, music and words bind us in divided times? Simon Schama explores how artists have captured the transformations of British society since 1945 Enjoy a satirical smorgasbord of The News Quiz Digest a dramatic year of news as Andy Zaltzman revels in some of 2024's funniest moments The multi-award-winning legal drama returns Two years on, the Defoes are back and have gathered for a beautiful wedding in Barcelona Â© 2025 BBC. The BBC is not responsible for the content of external sites.Read about our approach to external linking."
Harry and Meghan share birthday picture of Archie,"The Duke and Duchess of Sussex have shared a picture of their son Archie to mark his second birthday. The sepia-toned picture, taken on Thursday, shows the toddler standing in a garden with his back to the camera, holding a large bunch of balloons. It was shared on theirArchewell website,external, along with a plea for donations to a fund for Covid vaccinations in poor nations. The Queen and other members of the Royal Family sent birthday messages. A message from the Royal Family's official Twitter account,externalsaid: ""Wishing Archie Mountbatten-Windsor a very happy 2nd birthday today."" The post was shared alongside a picture of the Duke and Duchess of Sussex with their son days after he was born. Royal Family tree and line of succession William and Harry seen chatting after funeral Ina statement on their Archewell foundation website,external, Prince Harry and Meghan - who are expecting their second child - said they were ""deeply touched"" by people who had donated to charities in honour of Archie's birthday in previous years. They urged people to support GAVI, the global vaccine alliance, saying: ""We will not be able to truly recover until everyone, everywhere, has equal access to the vaccine. ""We cannot think of a more resonant way to honour our son's birthday. If we all show up, with compassion for those we both know and don't know, we can have a profound impact."" Meanwhile, the duke and duchess also wrote an open letter to major Covid vaccine manufacturers such as Pfizer, Moderna and AstraZeneca, urging them to redouble support for the UN-sponsored Covax programme distributing doses in poorer parts of the world. And asmomentum builds around a US-backed proposal to waive vaccine patents, Harry and Meghan called on the firms to temporarily suspend intellectual property rights on Covid-19 vaccines. Archie lives with his parents in California, following Prince Harry and Meghan's decision to step back as senior royals and move to the US. The Duke and Duchess of Cambridge, Archie's uncle and aunt, along with his grandparents the Prince of Wales and the Duchess of Cornwall, also posted birthday messages from their Twitter accounts. Alongside their message, Charles and his wife shared a photo of the Prince of Wales with Harry and Archie at his christening. Allow Twitter content? This article contains content provided by Twitter. We ask for your permission before anything is loaded, as they may be using cookies and other technologies. You may want to readTwitterâs cookie policy,externalandprivacy policy,externalbefore accepting. To view this content chooseâaccept and continueâ. Archie, the Sussexes' first child, was born on 6 May 2019 weighing 7lbs 3oz. He is seventh in line to the throne and does not have a title. Allow Twitter content? This article contains content provided by Twitter. We ask for your permission before anything is loaded, as they may be using cookies and other technologies. You may want to readTwitterâs cookie policy,externalandprivacy policy,externalbefore accepting. To view this content chooseâaccept and continueâ. For Archie's first birthday, the Sussexes released a video of Meghan reading the popular children's book, Duck! Rabbit!, to her son. He has rarely been seen in public but last December made a surprise appearance in the couple's first podcast for Spotify, during which he was heard speaking with an American accent. This video can not be played The Duchess of Sussex read the book Duck! Rabbit! to her son It comes afterMeghan revealed she was publishing a children's bookabout father-son relationships, inspired by the bond between Archie and the duke. In February the coupleannounced they were expecting their second child. Prince Harry was last in the UK in April for the funeral of his grandfather, the Duke of Edinburgh. However, Meghan stayed in California on the advice of her doctor. The Sussexesstepped back as senior royalsand said they would work to become financially independent last March. Additional reporting by Joseph Lee. Duchess of Sussex to publish children's book Meghan's story for Archie's first birthday. Video, 00:00:37Meghan's story for Archie's first birthday William and Harry seen chatting after funeral 'Overjoyed' Harry and Meghan expecting second child Royal Family tree: Charles III and the line of succession Deadly wildfires rage across LA as fierce winds threaten more destruction UK has enough gas, says No.10 after supply warning UK records coldest night of winter as freeze to last into weekend 'I paid fake doctor thousands for fillers - now I look like a gargoyle' The Papers: 'Lost Angeles' and 'Musk seeks plan to oust Starmer' Pop star Chappell Roan wins BBC Sound Of 2025 Weekly quiz: Zendaya looked happy but who else sparkled at the Golden Globes? The 20 child abuse inquiry proposals - what has happened so far? The '9/11 mastermind' wants to plead guilty. Why is the US trying to stop him? Why are UK borrowing costs rising and what does it mean for me? In maps: Thousands of acres on fire in LA Before and after: How wildfires tore through LA Ed Gamble hosts the official Traitors podcast Join Ed Gamble and guests as they dissect the first episodes of The Traitors! Can art, music and words bind us in divided times? Simon Schama explores how artists have captured the transformations of British society since 1945 Enjoy a satirical smorgasbord of The News Quiz Digest a dramatic year of news as Andy Zaltzman revels in some of 2024's funniest moments The multi-award-winning legal drama returns Two years on, the Defoes are back and have gathered for a beautiful wedding in Barcelona Â© 2025 BBC. The BBC is not responsible for the content of external sites.Read about our approach to external linking."
