headline,article
Scuffle at Rees-Mogg student event,"This video can not be played Protesters disrupt a speech by MP Jacob Rees-Mogg Conservative MP Jacob Rees-Mogg was caught up in a scuffle after protesters disrupted a speech he was giving at a student event. Videos show the backbencher surrounded by a group of people at the University of the West of England (UWE). Bristol Anti-Fascists claimed online they disrupted the event because of the politician's ""homophobic and anti-abortion beliefs"". Mr Rees Mogg said they were ""entitled to protest"". However, he said it was ""sad"" they would not engage and discuss views to which they objected. The prominent Brexiteer had been invited to speak at an event organised by the university's Politics and International Relations Society. Police said they had launched an investigation into the scenes at the Frenchay Campus in Bristol, but no arrests had yet been made. The university vice-chancellor Steve West said: ""At the moment, as far as I'm aware, no UWE students were involved. But if it transpires that one or more students were involved then disciplinary action will be taken which could mean expulsion."" In a statement on Twitter the university added it was ""absolutely appalled by the conduct of a small number of attendees"" at the event. This video can not be played ""They weren't going to hit me,"" said Jacob Rees-Mogg MP It continued: ""It is our understanding at this stage that a small group of protesters broke into the lecture theatre where the event was due to take place via the back doors. ""We understand that these protesters were not UWE Bristol students and did not have tickets for the event. ""We support the democratic right to free speech and peaceful protest. However, we strongly condemn the actions of protesters who disrupted normal debate and behaved in this way. ""There is no place for such action on a university campus or in a civilised society."" It was due to be a fairly routine event - Jacob Rees-Mogg was booked to speak to a few hundred students at a ticketed event. He would've spoken for about half an hour before taking questions. Just a few minutes after he started speaking, a group of protesters came into the back of the lecture theatre and started shouting anti-Conservative rhetoric, very loudly, trying to shout him down. Rather than halting the event, or ignoring them, Mr Rees-Mogg walked up to the back of the theatre to try and talk them down. At that point, various other members of the audience got involved, leading to a scuffle. It looked to me that Mr Rees-Mogg was actually pushed and shoved, although he insists he wasn't. But it was a very aggressive and unexpected scene. After the scuffle, Mr Rees-Mogg said: ""Some people who don't agree with me wanted to make their point, and I don't object to this. ""I think we live in a free society and freedom of speech is very important. ""And people like me, who advocate freedom of speech, support it when it's not exactly what we want, as well as when it is what we want."" Universities Minister Sam Gyimah branded the protesters' behaviour ""thuggish"", adding: ""Free speech under the law is fundamental to our democracy."" He praised Mr Rees-Mogg for ""not being cowed into silence"". Allow Twitter content? This article contains content provided by Twitter. We ask for your permission before anything is loaded, as they may be using cookies and other technologies. You may want to readTwitter’s cookie policy,externalandprivacy policy,externalbefore accepting. To view this content choose‘accept and continue’. Allow Twitter content? This article contains content provided by Twitter. We ask for your permission before anything is loaded, as they may be using cookies and other technologies. You may want to readTwitter’s cookie policy,externalandprivacy policy,externalbefore accepting. To view this content choose‘accept and continue’. Shadow education secretary Angela Rayner condemned the behaviour of ""those who tried to attack"" the MP, branding their actions ""extremely intimidating"". Liberal Democrat Deputy Leader Jo Swinson said it was ""deeply worrying to see violent tactics by political opponents"". A post on the society's Facebook page, advertising the event, said it would be a ""chance to talk to an experienced parliamentarian about the issues of the day, what it's like to be an MP and how you can get there"". On Twitter, eyewitness Chloe Kaye, who filmed the scuffle,described ""a huge amount"" of physical violence,external. Others condemned the protesters. Allow Twitter content? This article contains content provided by Twitter. We ask for your permission before anything is loaded, as they may be using cookies and other technologies. You may want to readTwitter’s cookie policy,externalandprivacy policy,externalbefore accepting. To view this content choose‘accept and continue’. Avon and Somerset Police said officers were called at about 18:30 GMT following a report of a public order incident. ""An investigation is under way to see if any criminal offences were committed,"" the force said, while appealing for mobile phone footage to be passed on to them. Treasury 'fiddling figures' on Brexit May urged to 'see off' hard Brexiteers Rees-Mogg and Hammond at odds over Brexit David Davis v Jacob Rees-Mogg on Brexit transition. Video, 00:01:44David Davis v Jacob Rees-Mogg on Brexit transition University of the West of England New Met Office weather warning as big freeze looms after snow, sleet and rain Flu pressures build on both of Bristol's two hospitals ‘Hotter than a Turbo Island bonfire’ Southmead hospital instructs visitors and staff to wear masks Sound engineer crafts device to play records through digital set up X-Press makes a Mark on local charity Firefighters running out of water as wildfire declared most destructive in LA's history In maps: Thousands of acres on fire in LA 'Patients are collapsing in the waiting room': A&E nurses speak out Why does Trump want Greenland and what do its people think? How Canada's immigration debate soured - and helped seal Trudeau's fate 'I can't get divorced as I can't get my pension valued' What are cold weather payments and who can get them? BBC Sound of 2025: Barry Can't Swim is a new dance music superstar Ros Atkins on...Elon Musk's political interventions Jean-Marie Le Pen - founder of French far right and 'Devil of the Republic' Cases of HMPV are on the rise in China - but what is it? Politics Essential: Get the latest news and analysis delivered to your inbox every weekday Delivering brand-new miracles in 1970s East End Watch the latest series of Call the Midwife on iPlayer now Mark-Anthony Turnage shares the soundtrack of his life Once called 'Britain’s hippest composer', he's tackled topics from drug abuse to football in his work Paddy’s loaf-changing experience inside the bread factory Paddy McGuinness visits the bread factory he used to work in, and sees how they make 1.4 million loaves a week What's behind the global surrogacy boom? More countries are banning surrogacy – but demand is growing © 2025 BBC. The BBC is not responsible for the content of external sites.Read about our approach to external linking."
Spice Girls to reunite on new work,"The Spice Girls have confirmed they are planning to work on new projects, after meeting for the first time since 2012. It comes after Victoria Beckham, Geri Horner, Emma Bunton, Melanie Brown and Melanie Chisholm were pictured together at Horner's house in Hertfordshire. Mel C told BBC Radio 2 they had been talking about ""opportunities and ideas"" but there was ""nothing set in stone"". Their debut single Wannabe propelled the Spice Girls to fame in 1996 and they split up six years later. The five members - nicknamed Posh, Ginger, Baby, Scary and Sporty - were accompanied at the meeting by their former manager Simon Fuller. Mel C told Dermot O'Leary on Radio 2's Saturday Breakfast Show the five stars had wanted ""a little catch up"" to ""see where everyone's at"". ""It's the worst kept secret in showbiz always,"" she said. ""It was lovely to get together, so we are talking about opportunities, ideas we have for the future... but you know, it's early stages and there's nothing set in stone, there is no big announcement."" She added: ""But it's just great to be back in Spiceworld and to see the reaction, all over social media, the press and it's so lovely to know that people out there still care."" Allow Instagram content? This article contains content provided by Instagram.  We ask for your permission before anything is loaded, as they may be using cookies and other technologies.  You may want to readMeta’s Instagram cookie policy,externalandprivacy policy,externalbefore accepting. To view this content choose‘accept and continue’. Allow Instagram content? This article contains content provided by Instagram.  We ask for your permission before anything is loaded, as they may be using cookies and other technologies.  You may want to readMeta’s Instagram cookie policy,externalandprivacy policy,externalbefore accepting. To view this content choose‘accept and continue’. In a statement released after the women were photographed on Friday, the group said: ""We have enjoyed a wonderful afternoon catching up and reminiscing about the amazing times we have spent together. ""We are always overwhelmed at how much interest there is across the whole world for The Spice Girls. ""The time now feels right to explore some incredible new opportunities together,"" they said in a statement. ""We all agree that there are many exciting possibilities that will once again embrace the original essence of The Spice Girls, while reinforcing our message of female empowerment for future generations."" Lady Gaga halts tour due to 'severe pain' Michael Mosley: 'Forget walking 10,000 steps a day' Fake celebrity porn videos deleted from internet Earlier in the day the former band members used their Instagram accounts to hint at a possible reunion. Emma Bunton told her followers that the ""future is looking spicy"" and Geri Horner said ""#girlpower is alive and well"". Beckham wrote: ""Love my girls!!! So many kisses!!!"" adding ""exciting"". Meanwhile Brown praised the group for helping her become ""who I am"". This would not be the first Spice Girls reunion - the group embarked on a tour of Europe and the US which accompanied a release of their greatest hits. They also performed together at the Olympic closing ceremony in 2012, however rumours of a return in 2016 failed to come true. Posh, Baby, Ginger, Sporty and Scary last reunited to perform at the London Olympics closing ceremony In November 2017 Victoria Beckham, now a successful fashion designer, said of a potential reunion album and tour: ""It is not happening. ""At some point you've got to know when it's time. I don't think I'll be slipping into a PVC catsuit anytime soon."" The Sun reported that the group could earn up to £10m,externalfor new projects including TV work in China, a television talent show, endorsement deals and a compilation album. A source also told the newspaper that the reunion will not include singing from Mrs Beckham. Firefighters running out of water as wildfire declared most destructive in LA's history In maps: Thousands of acres on fire in LA 'Patients are collapsing in the waiting room': A&E nurses speak out Why does Trump want Greenland and what do its people think? How Canada's immigration debate soured - and helped seal Trudeau's fate 'I can't get divorced as I can't get my pension valued' What are cold weather payments and who can get them? BBC Sound of 2025: Barry Can't Swim is a new dance music superstar Ros Atkins on...Elon Musk's political interventions Jean-Marie Le Pen - founder of French far right and 'Devil of the Republic' Cases of HMPV are on the rise in China - but what is it? Politics Essential: Get the latest news and analysis delivered to your inbox every weekday Delivering brand-new miracles in 1970s East End Watch the latest series of Call the Midwife on iPlayer now Mark-Anthony Turnage shares the soundtrack of his life Once called 'Britain’s hippest composer', he's tackled topics from drug abuse to football in his work Paddy’s loaf-changing experience inside the bread factory Paddy McGuinness visits the bread factory he used to work in, and sees how they make 1.4 million loaves a week What's behind the global surrogacy boom? More countries are banning surrogacy – but demand is growing © 2025 BBC. The BBC is not responsible for the content of external sites.Read about our approach to external linking."
Mums' names to go on marriage certificate,"Ministers have backed calls for mothers' names to be put on marriage certificates in England and Wales. The Home Office said it will support a private member's bill, which aims to modernise marriage registration for the first time since 1837. If passed, it would allow the names of both parents of the couple to be included on marriage certificates - instead of just those of their fathers. Home Secretary Amber Rudd says the move will modernise an outdated system. 'Keep sex abuse dad's name off my wedding certificate' Put mothers' names on marriage certificates MPs from all parties have spent several years attempting to bring about a change in the law to allow both parents to have their names and occupations recorded. Their campaign received the backing of former Prime Minister David Cameron, who pledged to address this ""inequality in marriage"" - but he was gone from Downing Street before any action could be taken. The move would bring England and Wales into line with the rest of the UK. In Scotland and Northern Ireland, couples are asked to give the names of both parents on marriage documentation. The same applies for those entering a civil partnership. On Friday, the Home Office said it would back Tory MP Tim Loughton's Civil Partnerships, Marriages and Deaths (Registration Etc.) Bill, which also modernises the process of marriage registration away from a solely paper-based system. Ms Rudd said: ""A marriage is not just a major event for the couple but also in the life of any parent - and it is only right that all parents have the opportunity to have their names included on marriage certificates. ""The current legislation which only allows for fathers' names is completely outdated and does not reflect modern Britain. ""There are around 250,000 marriages every year. It is about time that there are equal rights and recognition when it comes to registering a child's marriage."" The changes would mean that marriage entries - currently stored in 84,000 hard copy marriage registers - would be held in a single electronic register, which the Home Office says could result in savings of £33.8m over 10 years. Mr Loughton's billalso calls for heterosexual co-habiting partners to be allowed to form civil partnerships- in the same way as gay couples - a move the government has pledged to review. The MP said it was ""not fair"" that opposite sex couples have ""the single option of marriage"". Mr Loughton also urgedthe registration of stillbirthsdelivered before the required 24-week legal age to be considered viable. His bill received an unopposed second reading. MP's tears over stillborn daughter Call for straight couple civil partnerships Firefighters running out of water as wildfire declared most destructive in LA's history In maps: Thousands of acres on fire in LA 'Patients are collapsing in the waiting room': A&E nurses speak out Why does Trump want Greenland and what do its people think? How Canada's immigration debate soured - and helped seal Trudeau's fate 'I can't get divorced as I can't get my pension valued' What are cold weather payments and who can get them? BBC Sound of 2025: Barry Can't Swim is a new dance music superstar Ros Atkins on...Elon Musk's political interventions Jean-Marie Le Pen - founder of French far right and 'Devil of the Republic' Cases of HMPV are on the rise in China - but what is it? Politics Essential: Get the latest news and analysis delivered to your inbox every weekday Delivering brand-new miracles in 1970s East End Watch the latest series of Call the Midwife on iPlayer now Mark-Anthony Turnage shares the soundtrack of his life Once called 'Britain’s hippest composer', he's tackled topics from drug abuse to football in his work Paddy’s loaf-changing experience inside the bread factory Paddy McGuinness visits the bread factory he used to work in, and sees how they make 1.4 million loaves a week What's behind the global surrogacy boom? More countries are banning surrogacy – but demand is growing © 2025 BBC. The BBC is not responsible for the content of external sites.Read about our approach to external linking."
'Censored' nymphs painting back on show,"Hylas and the Nymphs by JW Waterhouse dates from 1896 A gallery is to put a Victorian painting of naked adolescent girls back on display after a row over censorship. Manchester Art Gallery said it took down Hylas and the Nymphs by JW Waterhouse to ""encourage debate"" about how such images should be displayed. But critics accused curators of being puritanical and politically correct. The painting will return on Saturday. ""It's been clear that many people feel very strongly about the issues raised,"" Manchester City Council said. The 1896 paintingwas removed a week agoin an attempt to rethink the ""very old-fashioned"" way images of women's bodies were exhibited as ""either as passive beautiful objects or femmes fatales"". Curator Clare Gannaway said: ""It's not about saying these things can't exist in a public gallery - it's about saying, maybe we just need to challenge the way these paintings have been read and enable them to speak in a different way."" Visitors were invited to write their views about the decision on sticky notes and post them in the vacant space. Visitors can stick notes to the wall where the painting hung But after a backlash, the city council, which runs the gallery, announced that the painting would return to the wall. The gallery's interim director Amanda Wallace said: ""We were hoping the experiment would stimulate discussion, and it's fair to say we've had that in spades - and not just from local people but from art-lovers around the world. ""Throughout the painting's seven day absence, it's been clear that many people feel very strongly about the issues raised, and we now plan to harness this strength of feeling for some further debate on these wider issues."" The gallery is now planning a series of public events ""to encourage further debate"". Speaking on Thursday, Clare Gannaway denied that the gallery was censoring the picture, but there were strong reactions on social media and in the art world. ""Removing art due to political concerns is exactly censorship,""wrote Gary Brooks on Twitter,external. ""I think you can spark a debate without removing the painting,""said Ben Perkins,external. Professor Liz Prettejohn, who curated a Waterhouse exhibition at the Royal Academy in London in 2009, told BBC News: ""Taking it off display is killing any kind of debate that you might be able to have about it in relation to some of the really interesting issues that it might raise about sexuality and gender relationships. ""The Victorians are always getting criticised because they're supposed to be prudish. But here it would seem it's us who are taking the roles of what we think of as the very moralistic Victorians."" The painting's initial removal was filmed to be made into a new piece of video art forartist Sonia Boyce's exhibition at the gallery,externalin March. Postcards of the painting were also taken out of the gallery shop. The furore came two months after two sisters started a petition asking the Metropolitan Museum of Art in New York to remove, or at least reimagine the way it presented, a painting by Balthus of a neighbour's daughter in an erotic pose. The sisters said the Met was ""romanticising voyeurism and the objectification of children"". The museum refused to remove it,external, saying it wanted to encourage ""the continuing evolution of existing culture through informed discussion and respect for creative expression"". Follow us onFacebook,external, on Twitter@BBCNewsEnts,external, or on Instagram atbbcnewsents,external. If you have a story suggestion emailentertainment.news@bbc.co.uk,external. Gallery denies censoring Victorian nude Curator defends nymph painting removal. Audio, 00:01:55Curator defends nymph painting removal Facebook blocks acclaimed artist's painting 'Offensive' nude art removed from show Is this picture disgusting or beautiful? Manchester Art Gallery Firefighters running out of water as wildfire declared most destructive in LA's history In maps: Thousands of acres on fire in LA 'Patients are collapsing in the waiting room': A&E nurses speak out Why does Trump want Greenland and what do its people think? How Canada's immigration debate soured - and helped seal Trudeau's fate 'I can't get divorced as I can't get my pension valued' What are cold weather payments and who can get them? BBC Sound of 2025: Barry Can't Swim is a new dance music superstar Ros Atkins on...Elon Musk's political interventions Jean-Marie Le Pen - founder of French far right and 'Devil of the Republic' Cases of HMPV are on the rise in China - but what is it? Politics Essential: Get the latest news and analysis delivered to your inbox every weekday Delivering brand-new miracles in 1970s East End Watch the latest series of Call the Midwife on iPlayer now Mark-Anthony Turnage shares the soundtrack of his life Once called 'Britain’s hippest composer', he's tackled topics from drug abuse to football in his work Paddy’s loaf-changing experience inside the bread factory Paddy McGuinness visits the bread factory he used to work in, and sees how they make 1.4 million loaves a week What's behind the global surrogacy boom? More countries are banning surrogacy – but demand is growing © 2025 BBC. The BBC is not responsible for the content of external sites.Read about our approach to external linking."
