headline,article
India Covid aid 'not reaching those in need',"Emergency aid began arriving in Delhi last week As India's devastating Covid-19 crisis mounted last month, countries around the world began sending emergency medical supplies to help stem the surge. Planeloads of ventilators, medicines and oxygen equipment began pouring into India, from countries including the UK and the US, at the start of last week. By Sunday, some 300 tonnes of supplies on 25 flights had arrived at Delhi International Airport alone. But -as cases continue to reach record levels across the country- concerns are mounting about delays in supplying the aid to those most in need. For several days, much of the cargo sat in airport hangars as hospitals called for more support. The supplies did not begin being distributed until as late as Monday evening - more than a week after the first batch of emergency assistance arrived, state officials have told local media. The Indian government has strongly denied there is a delay, issuing a statement on Tuesday evening saying it had introduced a ""streamlined and systematic mechanism"" for distributing the supplies. The health ministry saidin the statement,externalit was ""working 24x7 to fast track and clear the goods"". But on the ground, officials in some of India's worst-hit states told the BBC that they had still not received any supplies. The UK is among countries to send medical supplies to India Kerala - which recorded a record 37,190 new Covid cases earlier this week - had still not received any aid by Wednesday evening, the state's health secretary, Dr Rajan Khobragade, told the BBC. Kerala's chief minister, Prinarayi Vijayan, separatelycalled on India's Prime Minister Narendra Modi to ""urgently"" send Kerala,externalsome of the country's much-needed oxygen imports. He asked that the equipment ""be allotted to Kerala on a priority basis, considering the fact that Kerala has one of the highest active case loads in the country"", in an open letter to Mr Modi on Wednesday. Some healthcare officials claim there has been little to no communication from the central government on how or when they would receive supplies. ""There's still no information about where it is being distributed,"" said Dr Harsh Mahajan, the president of the Healthcare Federation of India, which represents some of the country's biggest private hospitals. ""It seems people don't know - I've tried two or three places and been unable to find out,"" he added. ""It's still not clear."" Some non-governmental groups involved in responding to the crisis also say they are frustrated by an apparent lack of information. ""I don't think anybody has any clarity on where aid is going,"" Pankaj Anand, Oxfam India's director of programme and advocacy, told the BBC. ""There is no tracker on any website giving you an answer."" Why Indian bosses overseas are sending aid India is a Covid disaster - it didn't have to be A visual guide to the Covid crisis in India An alleged absence of information about the relief distribution effort is raising questions - even in foreign donor countries - about where the aid is going. On Friday,the issue was raised at a US state department briefing,external, when a reporter demanded ""accountability for the US taxpayers' money"" being sent to India, and asked if the US government was tracking the aid's whereabouts. ""Rest assured that the United States is committed to making sure that our partners in India are taken care of in this crisis,"" the state department's spokesperson said in response. The BBC asked the UK's Foreign, Commonwealth and Development Office if it had any knowledge of where the country's aid - including its shipments of more than 1,000 ventilators - had been distributed. In response the FCDO said ""the UK has been working with the Indian Red Cross and Government of India to ensure transfer of medical equipment from the UK is as efficient as possible"". ""Distribution processes and decisions on exactly where support provided by the UK will be deployed are matters for the Government of India."" Opposition politicians in India have also called for the government to release more information about how its relief effort is going.""We request and demand from the government... Share it with every Indian: Where has this aid come from, and where is it going?"" said Pawan Khera, a spokesperson for the opposition Congress party. ""You owe it to the public."" It took the Indian government seven days to create a ""streamlined mechanism"" to distribute supplies to states, according to the health ministry. India's government says it has introduced a ""streamlined mechanism"" to handle Covid aid It began work on the plan on 26 April, andissued its Standard Operating Procedure (SOP),external- guidelines on how to distribute aid - on 2 May, it said in a press release. It did not say when aid distribution began. Even when shipments land in India, the distribution process is complex - involving various stages, ministries and outside agencies. After relief flights arrive, aid is received by the Indian Red Cross Society, which is responsible for taking it through customs, according to the government's statement. The shipments are then handed over to another agency, HLL Lifecare, which handles the goods and subsequently transports them across the country. Because supplies are arriving in various forms, authorities have to ""unpack [and] repack"" them before they can be dispatched, further slowing the process, the government admits. ""The materials from abroad are currently coming in different numbers, specifications and at different times,"" the government said. ""In many cases the items received are not as per the list, or the quantities differ, which needs reconciling at the airport."" Once the materials are repacked, they are allocated to areas where ""critical care patients load is high and where the need is highest"". Despite the logistical challenges, India's central government says it is ""working 24x7"" to send supplies to strained areas. It said aid had been dispatched to some 38 institutions in 31 states by Tuesday evening. One badly-hit state, Punjab, has received 100 oxygen concentrators and 2,500 doses of the life-saving drug remdesivir, a state official told the BBC on Wednesday. The air force airlifted the ""first batch"" of 450 oxygen cylinders from the UK to Chennai (Madras) in southern Tamil Nadu state on Tuesday, the city's customs authority said on Twitter. Allow Twitter content? This article contains content provided by Twitter. We ask for your permission before anything is loaded, as they may be using cookies and other technologies. You may want to readTwitterâs cookie policy,externalandprivacy policy,externalbefore accepting. To view this content chooseâaccept and continueâ. Of 1,088 oxygen concentrators flown in from Hong Kong, some 738 remained in Delhi while 350 had been sent on Mumbai,a government minister said on Tuesday,external. Meanwhile, trainloads of oxygen - nicknamed the ""Oxygen Express"" by officials - are being rushed to Delhi to help ease shortages in its hospitals. Allow Twitter content? This article contains content provided by Twitter. We ask for your permission before anything is loaded, as they may be using cookies and other technologies. You may want to readTwitterâs cookie policy,externalandprivacy policy,externalbefore accepting. To view this content chooseâaccept and continueâ. Despite these efforts, India's hospitals are still in dire need of fresh medical supplies - and above all of oxygen. The country reported a record 412,262 new daily coronavirus cases on Thursday and 3,980 virus-related deaths, the health ministry said. India accounted for nearly half of all reported Covid infections across the world last week, and a quarter of all deaths, according to the World Health Organization. Many hospitals remain in urgent need of oxygen supplies Yet some healthcare professionals say what they need most urgently are not the foreign donations, but more on-site oxygen production facilities to be built at hospitals. ""Right now our only problem is oxygen,"" says Dr Mahajan. ""Even if this aid comes or doesn't come, I don't think it's going to make a substantial difference. The oxygen generators will make the difference. That's what is most essential right now."" Two freshly installed medical oxygen plants - producing 1,000 litres per minute - would begin pumping supplies to hundreds of Covid-19 patients in Delhi on Wednesday evening,the health ministry said in a tweet,external. This video can not be played What it's like working in an emergency room in India, as its devastating second Covid wave continues But for many of those on the frontline of India's healthcare emergency, the wait for desperately needed support continues. ""It is frustrating,"" Dr Mahajan says. ""We are overwhelmed... this wave has hit us, the incline has hit us - [and] it's like a jet taking off."" Additional reporting by the BBC's Soutik Biswas and Andrew Clarance in Delhi UK sending 1,000 more ventilators to India First UK aid arrives as India's Covid deaths mount Countries send urgent aid to Covid-stricken India Deadly wildfires rage across LA as fierce winds threaten more destruction UK has enough gas, says No.10 after supply warning UK records coldest night of winter as freeze to last into weekend 'I paid fake doctor thousands for fillers - now I look like a gargoyle' The Papers: 'Lost Angeles' and 'Musk seeks plan to oust Starmer' Pop star Chappell Roan wins BBC Sound Of 2025 Weekly quiz: Zendaya looked happy but who else sparkled at the Golden Globes? The 20 child abuse inquiry proposals - what has happened so far? The '9/11 mastermind' wants to plead guilty. Why is the US trying to stop him? Why are UK borrowing costs rising and what does it mean for me? In maps: Thousands of acres on fire in LA Before and after: How wildfires tore through LA Ed Gamble hosts the official Traitors podcast Join Ed Gamble and guests as they dissect the first episodes of The Traitors! Can art, music and words bind us in divided times? Simon Schama explores how artists have captured the transformations of British society since 1945 Enjoy a satirical smorgasbord of The News Quiz Digest a dramatic year of news as Andy Zaltzman revels in some of 2024's funniest moments The multi-award-winning legal drama returns Two years on, the Defoes are back and have gathered for a beautiful wedding in Barcelona Â© 2025 BBC. The BBC is not responsible for the content of external sites.Read about our approach to external linking."
"Queen wishes great-grandson Archie happy birthdayThe son of the Duke and Duchess of Sussex, who live in California, turns two today.UK","The Duke and Duchess of Sussex have shared a picture of their son Archie to mark his second birthday. The sepia-toned picture, taken on Thursday, shows the toddler standing in a garden with his back to the camera, holding a large bunch of balloons. It was shared on theirArchewell website,external, along with a plea for donations to a fund for Covid vaccinations in poor nations. The Queen and other members of the Royal Family sent birthday messages. A message from the Royal Family's official Twitter account,externalsaid: ""Wishing Archie Mountbatten-Windsor a very happy 2nd birthday today."" The post was shared alongside a picture of the Duke and Duchess of Sussex with their son days after he was born. Royal Family tree and line of succession William and Harry seen chatting after funeral Ina statement on their Archewell foundation website,external, Prince Harry and Meghan - who are expecting their second child - said they were ""deeply touched"" by people who had donated to charities in honour of Archie's birthday in previous years. They urged people to support GAVI, the global vaccine alliance, saying: ""We will not be able to truly recover until everyone, everywhere, has equal access to the vaccine. ""We cannot think of a more resonant way to honour our son's birthday. If we all show up, with compassion for those we both know and don't know, we can have a profound impact."" Meanwhile, the duke and duchess also wrote an open letter to major Covid vaccine manufacturers such as Pfizer, Moderna and AstraZeneca, urging them to redouble support for the UN-sponsored Covax programme distributing doses in poorer parts of the world. And asmomentum builds around a US-backed proposal to waive vaccine patents, Harry and Meghan called on the firms to temporarily suspend intellectual property rights on Covid-19 vaccines. Archie lives with his parents in California, following Prince Harry and Meghan's decision to step back as senior royals and move to the US. The Duke and Duchess of Cambridge, Archie's uncle and aunt, along with his grandparents the Prince of Wales and the Duchess of Cornwall, also posted birthday messages from their Twitter accounts. Alongside their message, Charles and his wife shared a photo of the Prince of Wales with Harry and Archie at his christening. Allow Twitter content? This article contains content provided by Twitter. We ask for your permission before anything is loaded, as they may be using cookies and other technologies. You may want to readTwitterâs cookie policy,externalandprivacy policy,externalbefore accepting. To view this content chooseâaccept and continueâ. Archie, the Sussexes' first child, was born on 6 May 2019 weighing 7lbs 3oz. He is seventh in line to the throne and does not have a title. Allow Twitter content? This article contains content provided by Twitter. We ask for your permission before anything is loaded, as they may be using cookies and other technologies. You may want to readTwitterâs cookie policy,externalandprivacy policy,externalbefore accepting. To view this content chooseâaccept and continueâ. For Archie's first birthday, the Sussexes released a video of Meghan reading the popular children's book, Duck! Rabbit!, to her son. He has rarely been seen in public but last December made a surprise appearance in the couple's first podcast for Spotify, during which he was heard speaking with an American accent. This video can not be played The Duchess of Sussex read the book Duck! Rabbit! to her son It comes afterMeghan revealed she was publishing a children's bookabout father-son relationships, inspired by the bond between Archie and the duke. In February the coupleannounced they were expecting their second child. Prince Harry was last in the UK in April for the funeral of his grandfather, the Duke of Edinburgh. However, Meghan stayed in California on the advice of her doctor. The Sussexesstepped back as senior royalsand said they would work to become financially independent last March. Additional reporting by Joseph Lee. Duchess of Sussex to publish children's book Meghan's story for Archie's first birthday. Video, 00:00:37Meghan's story for Archie's first birthday William and Harry seen chatting after funeral 'Overjoyed' Harry and Meghan expecting second child Royal Family tree: Charles III and the line of succession Deadly wildfires rage across LA as fierce winds threaten more destruction UK has enough gas, says No.10 after supply warning UK records coldest night of winter as freeze to last into weekend 'I paid fake doctor thousands for fillers - now I look like a gargoyle' The Papers: 'Lost Angeles' and 'Musk seeks plan to oust Starmer' Pop star Chappell Roan wins BBC Sound Of 2025 Weekly quiz: Zendaya looked happy but who else sparkled at the Golden Globes? The 20 child abuse inquiry proposals - what has happened so far? The '9/11 mastermind' wants to plead guilty. Why is the US trying to stop him? Why are UK borrowing costs rising and what does it mean for me? In maps: Thousands of acres on fire in LA Before and after: How wildfires tore through LA Ed Gamble hosts the official Traitors podcast Join Ed Gamble and guests as they dissect the first episodes of The Traitors! Can art, music and words bind us in divided times? Simon Schama explores how artists have captured the transformations of British society since 1945 Enjoy a satirical smorgasbord of The News Quiz Digest a dramatic year of news as Andy Zaltzman revels in some of 2024's funniest moments The multi-award-winning legal drama returns Two years on, the Defoes are back and have gathered for a beautiful wedding in Barcelona Â© 2025 BBC. The BBC is not responsible for the content of external sites.Read about our approach to external linking."
"Can I take a selfie at a polling station?The rules on everything from whether you can take a selfie to voting while drunk.UK PoliticsUS vows to respond to 'irresponsible' Russian actsThe US would prefer more stable and predictable ties with Russia, Antony Blinken tells the BBC.US & Canada","The UK general election is taking place on Thursday 4 July. What can and can't you do in the polling station when voting in person? If you are registered to vote, you will be sent a polling card with your polling number and polling station details. You do not need to take the polling card with you but it might speed up the process. You do have to take valid photo ID. You can only vote at your local polling station, which might not be the same as in previous elections. You can alsofind your local polling station online,external. Polling stations are open between 0700 BST and 2200. You can vote as long as you are in the queue before 22:00. A modern browser with JavaScript and a stable internet connection is required to view this interactive.Opens in a new browser tabMore information about these elections Enter your postcode or constituency name to find out No internet connection There is currently a problem with the service. Please try later. Please select an area on the map or try another postcode search. Note: This look up covers the election of Members of Parliament. There may be council by-elections where you are. Check your local council website for full details. Cartogram map created by Philip Brown and Alasdair Rae To make sure you get the correct information, please choose your address: Writing implements are provided but you can bring your own if you wish. You are not allowed to take photos inside a polling station because the Electoral Commission - which oversees UK elections - says it risks the secrecy of the ballot. The punishment for revealing how someone else voted - even accidentally - is a fine of up to Â£5,000, or six months in prison. People are welcome to take photos outside. You can, but voters are advised not to update their social media accounts inside the polling station. The rules for postal voting are different, so voters can share photos of their own postal ballot paper on social media if they wish. Animals, apart from assistance dogs,are not usually allowed in polling stations.,external However, other dogs can be admitted at the discretion of the local authority. The Electoral Commission says there is nothing in law to prevent someone wearing a political slogan when going into a polling station to vote. However, they should leave immediately afterwards, as campaigning inside polling stations is not allowed. Political discussion is banned inside polling stations. Staff will intervene if they hear any references to candidates or parties. Bringing children to the polling station is encouraged, to help educate them about democracy. But children are not allowed to mark your vote on the ballot paper. People who have been drinking or are drunk can vote, unless they are disruptive. Polling station staff can help you, or you can bring someone with you. In England, anyone over the age of 18 can help you cast your vote. They do not need to be eligible to vote in that election. Polling stations should have large-print sample ballot papers and tactile voting devices to help people with visual impairments. You can take your phone into the polling booth to use magnifier or text-to-speech apps, or the phone torch to improve lighting. But you must not take any photos inside the polling station. Voting in UK elections is not compulsory. It is entirely up to you whether or not to vote. Some people deliberately spoil their vote - for example, by writing a message on the ballot paper as a protest. These are recorded, but do not count for or against any candidate. If you sign your ballot and your name is identifiable, the vote does not count. Sometimes ""tellers"" stand outside the polling station and ask voters for the number on their polling card. They are volunteers who work for candidates. They use the information to check who has voted, so they can remind people who have not yet done so. They are allowed to ask for your polling card number, but you do not have to give it to them. Follow live: Millions head to the polls to vote A simple guide to the UK general election What can and can't I do in a polling station? What ID do I need to vote? How the BBC reports polling day Deadly wildfires rage across LA as fierce winds threaten more destruction UK has enough gas, says No.10 after supply warning UK records coldest night of winter as freeze to last into weekend 'I paid fake doctor thousands for fillers - now I look like a gargoyle' The Papers: 'Lost Angeles' and 'Musk seeks plan to oust Starmer' Pop star Chappell Roan wins BBC Sound Of 2025 Weekly quiz: Zendaya looked happy but who else sparkled at the Golden Globes? The 20 child abuse inquiry proposals - what has happened so far? The '9/11 mastermind' wants to plead guilty. Why is the US trying to stop him? Why are UK borrowing costs rising and what does it mean for me? In maps: Thousands of acres on fire in LA Before and after: How wildfires tore through LA Ed Gamble hosts the official Traitors podcast Join Ed Gamble and guests as they dissect the first episodes of The Traitors! Can art, music and words bind us in divided times? Simon Schama explores how artists have captured the transformations of British society since 1945 Enjoy a satirical smorgasbord of The News Quiz Digest a dramatic year of news as Andy Zaltzman revels in some of 2024's funniest moments The multi-award-winning legal drama returns Two years on, the Defoes are back and have gathered for a beautiful wedding in Barcelona Â© 2025 BBC. The BBC is not responsible for the content of external sites.Read about our approach to external linking."
