headline,article
Energy price cap not fit for purpose - suppliers,"The energy price cap protecting households from sharp rises in gas prices is ""not fit for purpose"", suppliers have said. Natural gas prices are at record highs, which has led to some domestic energy firms failing as they are paying more for gas than they are able to charge. Suppliers have warned that consumers could face a ""huge cost"" from these firms going out of business. There are also calls for an energy price cap to help small businesses. Energy price cap: Why are fuel bills rising? What can I do if my energy supplier goes bust? Is the UK headed for a gas shortage this winter? Gas prices are at record highs as economies around the world begin to recover from the Covid pandemic. Domestic customers are partly protected from sharp rises by a price cap - which sets the maximum price suppliers in England, Wales and Scotland can charge customers on a standard tariff - although energy regulator Ofgem has warned that households will seefurther ""significant rises"" in the spring, when the cap is reviewed. Last month, nine energy companies went out of business, forcing 1.7 million customers to move to new suppliers and on to higher rates. Paul Richards, chief executive of Together Energy, which he said is currently making losses, told the BBC that while he supported a price cap to protect customers, the current mechanism ""is not fit for industry, nor is it fit for customers"". ""Crazy, just crazy"" is how the nursery and soft play owner Gordon Foster describes the sharp rise in energy prices, shaking his head in dismay. Businesses typically fix their energy bills a few years in advance, known as ""hedging"". Mr Foster is one of the unlucky ones whose energy contract is up for renewal, and at the moment he's looking at paying eight times his current rate, taking up a contract that would tie him in for years. The alternative is paying sky high prices now without a contract, and keeping his fingers crossed that prices will stabilise. For him, as for others, this sudden jump in costs makes parts of the business unviable, and certainly means he has to put his prices up for his customers. While households might have an energy cap in place to protect them from such eye-watering spikes in global markets, we are all exposed to the impact of such costs for businesses. Ultimately they feed through to everyone. He said while the cap protected customers in the short term, he thought there was somewhere between £1bn and £3bn in costs which would be spread back across business and households as a result of failed suppliers. Derek Lickorish, chairman of Utilita Energy, which has more than 800,000 customers, said there was no doubt there would be a cost paid by consumers for failed firms. ""The government has to look at the means by which they can support not only energy suppliers, but also big industry,"" he said. Mr Lickorish said he would like to see the price cap reviewed four times a year, rather than the current two, and for a longer period of gas prices to be considered in setting it. Stephen Murray, head of energy, commercial and partners at Moneysupermarket.com, said that while the usual advice for consumers was to shop around, for now it was to stay put, with those on a fixed deal likely to be better off. The price cap provided ""some level of protection"", he said, but ""that comes at a cost and we've seen that through failed suppliers"". Business group the British Chambers of Commerce has called for a similar cap to be introduced for the energy bills of small and medium sized businesses - those with 250 employers or fewer. These firms mostly buy their energy several years in advance, so those whose contracts are due for renewal now are facing a ""difficult time"", it said. The group's co-executive director Claire Walker said the increasing pressure on these sized businesses was ""becoming dire"" and said that a price cap would give them the confidence to maintain normal business activities. Dave Dalton, chief executive of British Glass, said he thought a cap would help but was probably ""too little, too late"" and that an ""immediate intervention"" was needed. The government said it was in regular contact with business groups to explore ways to manage the impact of global prices. Business Secretary Kwasi Kwarteng met leaders from heavy industry on Friday amid warnings that some sectors could have to shut down, but they failed to find any solutions. Labour has accused the government of being in denial about gas prices, with wholesale prices rising 250% since January. A number of Conservative MPs have called for the government to take action, and the Energy Intensive Users Group - which represents firms that use a lot of energy - said measures were needed ""right now"". The group's chair Dr Richard Leese said that energy-heavy industries were ""intrinsically linked"" and if some sectors were forced to shut down, it would have a knock-on impact. ""We've seen the curtailment in production in the steel and fertiliser sector - that's had a knock-on impact into the supply chains in the industrial supply chains and domestic supply chains,"" he said. UK Steel boss Gareth Stace said he was ""baffled"" that the UK government had failed to find solutions because governments in the rest of Europe had stepped in to support industry - although they faced lower energy costs than in the UK. GIRL, WOMAN, OTHER:Listen along to Bernardine Evaristo's Booker Prize-winning novel AUTUMN IS HERE:What is the obsession with all things autumn, Halloween and pumpkin spice? Regulator warns of significant energy price hikes A million more will struggle to pay energy bills Firms warn of price rises as energy costs soar UK gas prices fall from high after Russia steps in How much are energy bills going up? Night-time curfew imposed in fire-hit areas of LA as police warn against 'despicable' looting 'I have nothing to go back to' - BBC reporter tells of LA fires heartbreak Trump avoids prison or fine in hush-money case sentencing LA fires: How three days of devastation unfolded What's the latest on the Los Angeles wildfires and what caused them? The '9/11 mastermind' wants to plead guilty. Why is the US trying to stop him? Pop star Chappell Roan wins BBC Sound Of 2025 Weekly quiz: Zendaya looked happy but who else sparkled at the Golden Globes? Inside the UK's first legal drug consumption room Sheen to fund new national theatre for Wales Danes struggle with response to Trump Greenland threat The Upbeat newsletter: Start your week on a high with uplifting stories delivered to your inbox Dragons’ Den returns with a new line-up of celebrity guests Can a fresh batch of entrepreneurs secure the deal of a lifetime? Are smart scales really as ‘smart’ as they claim to be? Greg Foot explores whether they can accurately measure weight, body fat, muscle and bone mass The award-winning psychological competition is back A nail-biting game of detection, backstabbing and trust. Who will make it through? How close are we to a cancer vaccine? How might it help in the treatment of the disease? © 2025 BBC. The BBC is not responsible for the content of external sites.Read about our approach to external linking."
Firms warn on costs,"High energy costs are forcing manufacturers to warn of higher prices for their goods as they pass on increases to consumers. Iceland boss Richard Walker said higher energy bills and other costs meant price rises were now ""inevitable"". The warning came as analysts predicted that household energy bills could rise by hundreds of pounds next year. They said the energy price cap, which protects domestic consumers, could soar by £400 in the spring. Cornwall Insight forecasts that the energy price cap will rise to about £1,660 by next summer. That is about 30% higher than the record £1,277 level for the cap set for winter 2021-22, which began at the start of October. ""With wholesale gas and electricity prices continuing to reach new records, successive supplier exits during September 2021 and a new level for the default tariff cap, the Great British energy market remains on edge for fresh volatility and further consolidation,"" said Craig Lowrey, senior consultant at Cornwall Insight. Energy regulator Ofgem said the price cap ""will ensure that consumers don't pay more than is absolutely necessary this winter"". But if gas prices stay high, the price cap will rise, Ofgem said. The regulator said its ""number one priority is to protect customers"", but acknowledged ""this is a worrying time for many people"". What can I do if my energy supplier goes bust? Energy price cap: Why are fuel bills rising? UK gas prices fall from record high after Russia steps in But while the price cap helps households, there is no such safeguard for businesses, which have to absorb the full impact of rising global energy prices. Mr Walker warned that Iceland's energy bill would go up by £20m next year. Alongside higher salaries to address lorry driver shortages and other new costs, he said grocery prices would have to increase. ""It's inevitable that we will see price rises,"" he told the BBC. ""The UK supermarket industry is one of the most competitive in the world. ""Our margins are very very tight and we're not an endless sponge that can just absorb all of these different cost increases."" Andrew Large, director general of the Confederation of Paper Industries, said: ""This is a highly inflationary situation for the British economy and members will clearly be in a position where they do try to pass those costs on to consumers where they can."" One paper manufacturer, the Northwood Group, said the industry had been ""left to fend for itself"" in the face of ""horrendous"" knock-on effects from the gas price rise. ""The spike [in gas prices] that we have seen since January is equivalent to a 550% price increase, which of course destroys any industrial planning,"" said chairman Paul Fecher. Laura Cohen, chief executive of the British Ceramic Confederation, said many of her member firms could even be forced to stop production ""due to uneconomic higher energy costs"". This could cause ""severe damage"" to production facilities such as brick kilns, which could not easily be turned off at short notice, she said. Meanwhile, Business Secretary Kwasi Kwarteng has said that by decarbonising the UK's power supply, the country will protect customers from volatile fossil fuel prices. ""The UK so far, as many of you know, has made great progress in diversifying our energy mix. But we are still very dependent, perhaps too dependent, on fossil fuels and their volatile prices,"" he told a conference organised by trade body Energy UK. He said that the government's recent pledge to decarbonise the electricity grid by 2035 - 15 years ahead of the previous target - would help. ""Our homes and businesses will be powered by affordable, clean and secure electricity generated here in the UK, for people in the UK,"" Mr Kwarteng said. The Energy Shop - a price comparison site - warned people to prepare themselves for even greater increases in household bills. It said that the next increase in the price cap, due to come in from 1 April 2022, could be £500 or even higher. Founder Joe Malinowski warned: ""If things don't settle down soon, increases of £600, £700 or even £800 cannot be ruled out."" Nine energy suppliers have already collapsed in recent weeks and more could be facing the same fate. They were unable to keep their price promises as the wholesale price of gas soared. Their customers have already seen annual bill increases of hundreds of pounds when they moved to a new provider and away from whichever low-rate fixed deal their supplier had offered. Some of the heat was drawn from the crisis on Wednesday when Russia said it would increase gas supplies to Europe. UK wholesale gas prices hit a record high during the day before falling after the Russian intervention. But price volatility could continue as investors remain nervous about low stockpiles of gas across Europe. If you feel powerless against international business and politics when watching your domestic energy bill go up, you are in good company. Normally, customers are urged to get active, search and switch to save money - but not now. Until recently, the energy price cap was a backstop, protecting the vulnerable. Now it is the most competitive tariff available. The cap is shielding households from the wild fluctuation in prices seen on the wholesale markets, but that is only a crumb of comfort when bills and prices across the board are still expected to see a sharp increase. So for now, experts simply advise customers to find ways to save energy, brace themselves and budget for bigger bills. Wrap up for a financial chill that could last longer than the winter. The energy price cap sets the maximum price suppliers in England, Wales and Scotland can charge customers on a standard - or default - tariff. That includes the fixed daily amount customers pay, plus the price per unit they pay for electricity and gas. The cap was increased on 1 October, with about 15 million households facing a 12% rise in energy bills, the biggest jump, to the highest amount, seen since the backstop was introduced in January 2019. Those on standard tariffs, with typical household levels of energy use, saw an increase of £139 - from £1,138 to £1,277 a year. Prepayment meter customers with average energy use saw a £153 increase. That's a far cry from a year previously when on 1 October 2020, the energy price cap was cut by £84, to £1,042. Will you be affected by rising energy prices? Share your experiences by emailinghaveyoursay@bbc.co.uk,external. Please include a contact number if you are willing to speak to a BBC journalist. You can also get in touch in the following ways: WhatsApp:+44 7756 165803 Tweet:@BBC_HaveYourSay,external Upload pictures or video Please read ourterms & conditionsandprivacy policy If you are reading this page and can't see the form you will need to visit the mobile version of theBBC websiteto submit your question or comment or you can email us atHaveYourSay@bbc.co.uk,external. Please include your name, age and location with any submission. WORLD LEADERS EXPOSED:One of the biggest offshore leaks in history THE NEW LABOUR REVOLUTION:Two powerful personalities at the heart of a political phenomenon What can I do if my energy supplier goes bust? UK gas prices fall from high after Russia steps in How much are energy bills going up? Comments can not be loaded To load Comments you need to enable JavaScript in your browser Night-time curfew imposed in fire-hit areas of LA as police warn against 'despicable' looting 'I have nothing to go back to' - BBC reporter tells of LA fires heartbreak Trump avoids prison or fine in hush-money case sentencing LA fires: How three days of devastation unfolded What's the latest on the Los Angeles wildfires and what caused them? The '9/11 mastermind' wants to plead guilty. Why is the US trying to stop him? Pop star Chappell Roan wins BBC Sound Of 2025 Weekly quiz: Zendaya looked happy but who else sparkled at the Golden Globes? Inside the UK's first legal drug consumption room Sheen to fund new national theatre for Wales Danes struggle with response to Trump Greenland threat The Upbeat newsletter: Start your week on a high with uplifting stories delivered to your inbox Dragons’ Den returns with a new line-up of celebrity guests Can a fresh batch of entrepreneurs secure the deal of a lifetime? Are smart scales really as ‘smart’ as they claim to be? Greg Foot explores whether they can accurately measure weight, body fat, muscle and bone mass The award-winning psychological competition is back A nail-biting game of detection, backstabbing and trust. Who will make it through? How close are we to a cancer vaccine? How might it help in the treatment of the disease? © 2025 BBC. The BBC is not responsible for the content of external sites.Read about our approach to external linking."
'I haven't had any mental health care for 18 months',"This video can not be played Aimee says she has not had a face-to-face appointment in 18 months, despite being sectioned in 2019 ""I couldn't even take my children to school without a voice in my head."" Aimee, 29, from Bridgend, tried to take her own life after her mother's suicide in 2019, feeling it was a ""trigger"" for her mental health issues. She said because of the pandemic she has not had a face-to-face appointment in 18 months, despite being sectioned in 2019. The Welsh government said improving mental health is a priority, with an extra £42m spent this year. How has coronavirus affected mental health? Runner 'feels incredible' after hitting 189 peaks Facebook under fire over secret teen research The mother-of-two was diagnosed with complexpost-traumatic stress disorder,externaland emotionally unstablepersonality disorder,externaland said she been unable to access specialised help during the pandemic. She said: ""My mother, Louise, had suffered all of her life with mental health problems. ""I was experiencing the normal stages of grief, and we as a family were all in a great deal of shock - we were not expecting it. ""I had spoken to mum the night before and I thought she seemed OK and quite feisty which is what she was like. ""After the funeral I just couldn't eat, or sleep and it all took its toll on my body."" The treatment Aimee wants has a long waiting list and she said it could cost her thousands privately Aimee said even walking her children to school or making a cup of tea became difficult. ""I'd already previously suffered with my mental health. I started getting intrusive thoughts so I would have random things pop into my head. ""It was a constant battle against myself and it was exhausting. I had to try and act normal for my children, who had no idea what was going on but also fight against something which is still ongoing and how am I meant to fix it, without help?"" She said she felt services had been lacking during the pandemic and ""mental health has become a new virus in itself"". ""I have not had a single face-to-face appointment since moving back to Wales, so I haven't had any mental healthcare for 18 months. ""I've had no psychologist or psychiatrist appointments, all my treatment has been solely over the phone with a GP and the advice is just to double my medication."" Third of doctors seek pandemic mental health help Crisis concerns for young people's mental health Mental health sanctuaries urged for young Aimee wants to undergo eye movement desensitisation and reprocessing therapy (EMDR), for which she said the waiting list was ""years long"". She said privately the sessions she looked at cost £500 each, with patients usually needing at least five, according to Aimee. ""I haven't got that kind of money and I can't access it,"" she said. ""I'm dosed up to the eyeballs on medication. And if I don't take it I get extremely poorly. I'm looking for different ways of managing my mental health but how can I get better if I can't get help?"" The Cwm Taf Morgannwg health board said it could not comment on individual cases. A spokesman said: ""We encourage anyone who wishes to discuss a concern or complaint with us directly, and we will do our best to put it right. ""We continue to provide a comprehensive range of services for people with mental health issues, and we encourage anyone who may be needing support to get in touch with our teams."" Lockdown has increased mental health referrals, Mind Cymru says A recent report from the Samaritans found people who needed support during the pandemic had experienced reduced access to already-strained mental health services. Executive director in Wales Sarah Stone said: ""What we need is for people to have the services that suit them. So face to face is really important to people and tailored services. ""The pandemic has highlighted and increased inequalities in a range of ways so the work we have done has showed issues about mental health and well-being, fear of unemployment, financial struggles and also people struggling to find the basics of feeding themselves and their families."" Sunday marks World Mental Health Day 2021, with its main theme being mental health in an unequal world. A survey carried out by mental health charity Mind Cymru found people living in a household receiving benefits had seen their mental health hit hardest during the pandemic. Nearly six in 10 of the 650 people surveyed who lived in a household receiving benefits said they had poor or very poor mental health. That compares with 34% of those not receiving benefits. Head of policy Simon Jones said there was an urgent need to tackle inequalities brought into focus by the pandemic. He said: ""We know that mental health services were under huge pressure even before the pandemic. ""The impact will have a lasting effect on the mental health of many people in Wales, and there is increasing evidence to suggest that it has had, and continues to have, a disproportionate impact on certain groups of people - specifically people in poverty, and those from non-white communities."" A Welsh government spokesperson said: ""Improving mental health and well-being is a priority for us and we are investing an additional £42m this year. ""Many people in crisis need a range of social and welfare support, as opposed to specialist mental healthcare and we continue to work on strengthening the multi-agency response. ""Our Discretionary Assistance Fund has been available to provide hardship payments and working in partnership with Citizens Advice to address underlying financial needs, including specialist debt advice. ""We have also expanded support for low-level mental health issues, like easy-to-access online cognitive behavioural therapy, which includes support for money worries."" TheBBC Action Linehas details of organisations that may be able to offer help for mental health problems Mental health sanctuaries urged for young Has the pandemic affected your mental health? Loophole creating risks for children, report says Samaritans Mind Cymru Night-time curfew imposed in fire-hit areas of LA as police warn against 'despicable' looting 'I have nothing to go back to' - BBC reporter tells of LA fires heartbreak Trump avoids prison or fine in hush-money case sentencing LA fires: How three days of devastation unfolded What's the latest on the Los Angeles wildfires and what caused them? The '9/11 mastermind' wants to plead guilty. Why is the US trying to stop him? Pop star Chappell Roan wins BBC Sound Of 2025 Weekly quiz: Zendaya looked happy but who else sparkled at the Golden Globes? Inside the UK's first legal drug consumption room Sheen to fund new national theatre for Wales Danes struggle with response to Trump Greenland threat The Upbeat newsletter: Start your week on a high with uplifting stories delivered to your inbox Dragons’ Den returns with a new line-up of celebrity guests Can a fresh batch of entrepreneurs secure the deal of a lifetime? Are smart scales really as ‘smart’ as they claim to be? Greg Foot explores whether they can accurately measure weight, body fat, muscle and bone mass The award-winning psychological competition is back A nail-biting game of detection, backstabbing and trust. Who will make it through? How close are we to a cancer vaccine? How might it help in the treatment of the disease? © 2025 BBC. The BBC is not responsible for the content of external sites.Read about our approach to external linking."
