headline,article
Missing Houston tiger handed into police,"The tiger's new home is an animal sanctuary elsewhere in Texas A tiger that was missing for a week after being spotted roaming around a Houston neighbourhood has been found, police confirmed. India, the nine-month-old Bengal tiger, was turned in to police on Saturday and is said to be in good health. Footage shared on social media last week appeared to show the tiger wandering around the streets of in the west of the Texan city, India's new home is an animal sanctuary. The animal was spotted out on the streets on 9 May. When officers arrived at the scene, a man put the tiger into an SUV and drove off, police said. Houston Police attempted to follow the vehicle but lost sight of it a short time later. US man arrested as pet tiger remains on the loose Escaped leopard on the loose near Chinese city The alleged owner, Hugo Cuevas, was arrested several days later for evading arrest. At the time of the incident, Mr Cuevas was already on bail for a murder charge. Mr Cuevas' lawyer has insisted that the animal was not his but told the Associated Press that hewas involved ""in the caretaking of India often"",external. Late on Saturday, police said at a news conference that the animal was turned over to officers by Mr Cuevas' wife Giorgiana. Allow Twitter content? This article contains content provided by Twitter. We ask for your permission before anything is loaded, as they may be using cookies and other technologies. You may want to readTwitterâs cookie policy,externalandprivacy policy,externalbefore accepting. To view this content chooseâaccept and continueâ. It is not clear where the animal has been for the past week but Houston Police Commander Ron Borza said earlier this week that he believed the animal wasbeing passed around several safe houses,external. Speaking at a news conference on Saturday, Mr Borza said: ""In no way, shape or form should you have an animal like that in your household. That animal is only nine months old and already weighs 175 lbs (80kgs) - full grown, that animal can get to 600 lbs. It still had its claws and it could do a lot of damage if he decided to. ""Luckily for us, he's very tame and he will be going to a sanctuary tomorrow where, hopefully, he'll live the rest of his life in a very safe environment."" The tiger will have its own enclosure with a wooded area and pool at the Cleveland Amory Black Beauty Ranch. Carole Baskin, star of Netflix documentary Tiger King, said on Facebook that she was ""grateful"" the animal will be going to the sanctuary and said it had ""excellent facilities"". Tigers are not allowed within Houston City limits although it is permitted in many parts of the state under certain conditions. According to the World Wildlife Fund, there are an estimated 5,000 tigers in captivity in the United States. You might also be interested in: This video can not be played How the Indian government launched âProject Tigerâ to save the animals from extinction US man arrested as pet tiger remains on the loose Escaped leopard on the loose near Chinese city Zookeeper killed after tigers escape in Indonesia Fierce winds threaten more fire destruction as LA struggles to contain blazes UK has enough gas says No 10 after supply warning UK records coldest night of winter as snap to last into weekend What's the latest on the Los Angeles wildfires and what caused them? 'I paid fake doctor thousands for fillers - now I look like a gargoyle' Pop star Chappell Roan wins BBC Sound Of 2025 Weekly quiz: Zendaya looked happy but who else sparkled at the Golden Globes? Inside the UK's first legal drug consumption room What happened to Ryan Giggs' football coaching career? Danes struggle with response to Trump Greenland threat The '9/11 mastermind' wants to plead guilty. Why is the US trying to stop him? The Upbeat newsletter: Start your week on a high with uplifting stories delivered to your inbox Ed Gamble hosts the official Traitors podcast Join Ed Gamble and guests as they dissect the first episodes of The Traitors! Can art, music and words bind us in divided times? Simon Schama explores how artists have captured the transformations of British society since 1945 Enjoy a satirical smorgasbord of The News Quiz Digest a dramatic year of news as Andy Zaltzman revels in some of 2024's funniest moments The multi-award-winning legal drama returns Two years on, the Defoes are back and have gathered for a beautiful wedding in Barcelona Â© 2025 BBC. The BBC is not responsible for the content of external sites.Read about our approach to external linking."
Thousands set for overseas holidays as rules ease,"This video can not be played Holidaying Brits touch down in Portugal: 'It feels unreal' Thousands of British holidaymakers have begun taking advantage of the easing of lockdown rules on overseas travel. Travellers from England, Scotland and Wales are jetting off to some countries in what the crisis-hit tourism industry hopes is the start of a recovery. Travellers can now visit 12 countries on the government's green list, including Portugal and Israel, without isolating on their return. The bosses of British Airways and Ryanair said confidence was returning. The vast majority of tourist destinations remain on the amber and red lists, meaning travellers must quarantine when they get back. Bookings also remain well down on pre-pandemic levels. However, BA chief executive Sean Doyle told the BBC that the airline's six flights due to depart from Heathrow on Monday to ""green"" destinations such as Lisbon, Faro and Madeira were ""very busy"". He said the latest relaxation of restrictions was ""a small step in the right direction"". Ryanair chief executive Michael O'Leary said there weredefinite signs of an early reboundin travel to European destinations. Bookings are up from 500,000 a week in early April to 1.5 million a week now. ""The rate of bookings suggests there is a huge amount of confidence,"" he told BBC Breakfast. ""We are very optimistic for the next couple of months."" Nellie and Jill are off to Portugal on Monday - but it seemed touch and go right up to the moment they got to the airport. They are ""super excited and really happy to be able to travel again"". But the past few weeks have been stressful, especially as it was only confirmed on Friday that they could definitely travel. Nellie said it was then a real scramble to get PCR coronavirus tests over the weekend, which Jill added was quite complicated. ""Adding all the documentation wasn't easy but we persevered and we're glad we did,"" Jill said. Some holiday sun and a glass of wine on their balcony would make it all worth it, she added. Gatwick Airport chief executive Stewart Wingate said welcoming holidaymakers for the first time in months was a ""big relief"". He expected the number of travellers to increase significantly by the end of May - but this will still be less than 15% of the traffic seen in pre-pandemic times. ""It's an important day for us... we're looking forward to seeing more countries added to the green list in the weeks ahead,"" he added. But there is still caution. Online travel agent Thomas Cook said the number of people booking to travel abroad was ""still small"". It said 75% of its bookings were for Portugal, although Thomas Cook customers planning to jet off this week numbered only in their hundreds. Live: Indoor pints and trips abroad as lockdown eases What are my refund rights for foreign holidays? The rules for holidays in green list countries such as Portugal Public must play their part as lockdown eases - PM People in Wales asked not to travel abroad On Friday, Portugal announced that travellers from the UK would be allowed to enter its borders provided they could show a negative PCR test result from the previous 72 hours. That led to an increase in demand for flights to the country. Tui, which has 19 flights scheduled from the UK to Portugal next week, said eight of those would now be on a Boeing Dreamliner, which can carry up to 345 people - almost twice as many people as the Boeing 737s that it had planned to use. Passengers checking in at Gatwick Many of those who do intend to get away plan to do so in style. Thomas Cook reported that 85% of customers had booked four or five-star hotels. Before the crisis, only around half of people chose to splash out on that kind of luxury. Hays Travel has noticed a similar trend. At present around half of its customers are booking for next year but it highlighted a ""cautious optimism"" among travellers following an almost four-fold increase in bookings for Portugal this summer. Chief operating officer Jonathon Woodall said the average spend on a two-week holiday for a family of four had increased by Â£370 to Â£4,000 as people look to ""fulfil their bucket list"". ""People are upgrading to better destinations and accommodation, spending more to treat themselves,"" he said. After months of keeping apart, travelling on a busy plane feels both familiar and strange. Face masks are mandatory except to allow for eating and drinking, but seats are not socially distanced. I was handed a complimentary antibacterial wipe on boarding. The paperwork is far more complicated than normal. Alongside my passport and ticket, I'm carrying proof of my negative PCR test, a passenger locator form for Portugal and proof of my booked tests for my journey home. I'll have to complete another locator form to come back to the U.K. Still at 35,000 feet, we don't know how long the queues will be at the Portuguese border when we land or on the return journey. Passengers on board have said they feel a little like guinea pigs. The travel industry knows it's important to make this process smooth and safe if it's to have a good summer. While travel from England, Scotland and Wales is permitted to the 12 countries on the green list, most of the destinations are either remote islands or do not currently allow UK tourists to enter. And the government is advising people not to make non-essential trips to locations on its amber list, which covers popular destinations such as Spain, France, Italy and Greece. However, the guidance is expected to be ignored by some holidaymakers. EasyJet and Tui have both said that they will operate holidays to countries classified as amber, provided Foreign, Commonwealth and Development Office (FCDO) does not advise against ""all but essential"" travel. The majority of countries around the world are in the amber category, meaning that arrivals from these places to the UK are required to quarantine at home for 10 days as well as taking a Covid test before departure and two more on arrival. Travellers arriving back in England from an amber country have the option after five days of quarantine to pay for a private Covid test under theTest to Release scheme,external. If the result is negative, the quarantine can end. Masked sunbathers in Portugal BA boss Sean Doyle said ""cautious optimism"" should be exercised when decisions are made about whether to expand the green list when it is reviewed on 7 June. He said vaccination and infection rates in a number of the major aviation markets were ""trending positively"", noting that the US - an important market for both tourism and business ""now has 60% of its adult population vaccinated [and] infections are falling"". From Monday, people travelling abroad will be able to use the NHS app - which is different to the NHS Covid-19 app - to prove they have had the vaccine. Transport Secretary Grant Shapps previously said people who have had both doses will be able to use the app at border controls, although the government says people should still check countries' entry requirements as tests or quarantine might still be needed. Are you travelling abroad today?  Share your story. Emailhaveyoursay@bbc.co.uk,external WhatsApp:+44 7756 165803,external OrUpload your pictures/video here Tweet:@BBC_HaveYourSay,external Please read ourterms & conditionsandprivacy policy How are travel rules being relaxed? Portugal to allow UK tourists from Monday Comments can not be loaded To load Comments you need to enable JavaScript in your browser Fierce winds threaten more fire destruction as LA struggles to contain blazes UK has enough gas says No 10 after supply warning UK records coldest night of winter as snap to last into weekend What's the latest on the Los Angeles wildfires and what caused them? 'I paid fake doctor thousands for fillers - now I look like a gargoyle' Pop star Chappell Roan wins BBC Sound Of 2025 Weekly quiz: Zendaya looked happy but who else sparkled at the Golden Globes? Inside the UK's first legal drug consumption room What happened to Ryan Giggs' football coaching career? Danes struggle with response to Trump Greenland threat The '9/11 mastermind' wants to plead guilty. Why is the US trying to stop him? The Upbeat newsletter: Start your week on a high with uplifting stories delivered to your inbox Ed Gamble hosts the official Traitors podcast Join Ed Gamble and guests as they dissect the first episodes of The Traitors! Can art, music and words bind us in divided times? Simon Schama explores how artists have captured the transformations of British society since 1945 Enjoy a satirical smorgasbord of The News Quiz Digest a dramatic year of news as Andy Zaltzman revels in some of 2024's funniest moments The multi-award-winning legal drama returns Two years on, the Defoes are back and have gathered for a beautiful wedding in Barcelona Â© 2025 BBC. The BBC is not responsible for the content of external sites.Read about our approach to external linking."
Campaign launched to mark Queen's Platinum Jubilee,"The Queen joined Prince Charles for the first Jubilee tree planting in the grounds of Windsor Castle in March People across the UK are being urged to plant trees in an initiative to mark the Queen's Platinum Jubilee in 2022. The Queen joined the Prince of Wales as he planted the first Jubilee tree at Windsor Castle earlier this year to launch the scheme honouring the monarch's 70-year reign. TheQueen's Green Canopy (QGC),externalwill see new trees planted, as well as ancient woodlands and forests protected. Prince Charles encouraged people to ""plant a tree for the jubilee"". ""In other words, a 'tree-bilee'"", he said in a video message. Taking part in the scheme, hosted by climate charity Cool Earth, could range from individuals planting trees in their own gardens to the creation of platinum jubilee copses on council land or avenues in cities or housing developments.. Schools and community groups will be able to apply for a share of three million free saplings from the Woodland Trust as part of the project. Charles' tree was planted earlier this year during official planting season (October-March) The prince said: ""Whether you are an individual hoping to plant a single sapling in your garden, a school or community group planting a tree, a council, charity or business intending to plant a whole avenue of trees or a farmer looking to create new hedgerows, everyone across the country can get involved."" He said it is vital more of theright species of trees are planted, in the right placesand that more woodlands, avenues, hedgerows and urban planting schemes should be established, while protecting and sustaining what we already have. Describing it as a ""statement of hope and faith in the future"", the prince said planting trees and hedgerows and protecting existing woodlands and forests were simple, cost-effective ways to protect the planet. The initiative will also highlight 70 irreplaceable ancient woodlands across the UK and identify 70 ancient trees. A pilot training programme for unemployed young people aged between 16 and 24 to plant and manage trees will also be created and run through Capel Manor College, London's only specialist environmental college, of which the Queen Mother was patron. Donations to the scheme will go to deprived areas and urban schools via one of the partner organisations of the Queen's Green Canopy, Trees for Cities. Prime Minister Boris Johnson has thrown his support behind the initiative. He said: ""Our trees stand at the frontline of our fight against climate change and by sustaining our beautiful countryside for generations to come. ""The Queen's Green Canopy is a fitting tribute to her majesty's years of service to this country. I urge everyone to get involved."" The Queen has herself planted more than 1,500 trees around the world during her reign. Woodland Trust chief executive, Darren Moorcroft, said the last year had ""emphasised the central role that trees and woods play in the life of the nation"". He added: ""We need more projects like this, giving people access to our natural heritage, opportunities to do something positive for the environment, and helping to safeguard it for our children in the face of a combined climate and nature crisis."" Prince Charles calls for 'swift' action on climate Queen pictured resuming official public duties Scientists address myths over tree planting Queen 'still capable of planting a tree' Fierce winds threaten more fire destruction as LA struggles to contain blazes UK has enough gas says No 10 after supply warning UK records coldest night of winter as snap to last into weekend What's the latest on the Los Angeles wildfires and what caused them? 'I paid fake doctor thousands for fillers - now I look like a gargoyle' Pop star Chappell Roan wins BBC Sound Of 2025 Weekly quiz: Zendaya looked happy but who else sparkled at the Golden Globes? Inside the UK's first legal drug consumption room What happened to Ryan Giggs' football coaching career? Danes struggle with response to Trump Greenland threat The '9/11 mastermind' wants to plead guilty. Why is the US trying to stop him? The Upbeat newsletter: Start your week on a high with uplifting stories delivered to your inbox Ed Gamble hosts the official Traitors podcast Join Ed Gamble and guests as they dissect the first episodes of The Traitors! Can art, music and words bind us in divided times? Simon Schama explores how artists have captured the transformations of British society since 1945 Enjoy a satirical smorgasbord of The News Quiz Digest a dramatic year of news as Andy Zaltzman revels in some of 2024's funniest moments The multi-award-winning legal drama returns Two years on, the Defoes are back and have gathered for a beautiful wedding in Barcelona Â© 2025 BBC. The BBC is not responsible for the content of external sites.Read about our approach to external linking."
