headline,article
Goodfellas star Ray Liotta dies aged 67,"Ray Liotta played mobster Henry Hill in Goodfellas Goodfellas actor Ray Liotta has died in his sleep in the Dominican Republic at the age of 67. The US star had been on location filming the movie Dangerous Waters, his publicist Jennifer Allen said. He was best known for playing mobster Henry Hill in Martin Scorsese's 1990 gangster film Goodfellas and also appeared in Field of Dreams. Liotta got his big break playing ex-convict Ray Sinclair in 1986 black comedy Something Wild. He got a Golden Globe nomination for that role and went on to star in the 1988 film Dominick and Eugene, about the strained relationship between twins with very different characters. By the 90s he was starring in Unlawful Entry, Cop Land and Corrina, Corrina with Whoopi Goldberg. Last year he starred in the Sopranos prequel filmThe Many Saints Of Newark,having turned down a role in the original series. The New Jersey-born actor said in 2016 that he regretted turning down the chance to audition for Tim Burton's Batman film. ""When I did my first movie, Tim Burton was getting ready to do Batman and he was interested in me because he wanted it to be edgy and real. ""I thought, 'Batman? That's a stupid idea', even though he had just done one of my favourite movies of all time, Beetlejuice. So yes, I regret not auditioning for that'."" Listen: Radio 1's Screen Time on Goodfellas Listen: Radio 4's The Film Programme on Goodfellas He also played lawyer Jay Marotta in the critically acclaimed 2019 film Marriage Story, which starred Adam Driver and Scarlett Johansson as a couple whose relationship was breaking up. Laura Dern won a best supporting actress Oscar for playing a lawyer in the film. Liotta, pictured in 1980 The actor had recently finished working on the 2023 film The Cocaine Bear, directed by Elizabeth Banks. Liotta also narrated documentary series The Making Of The Mob, and appeared in several music videos including David Guetta's song Lovers On The Sun. Liotta leaves his daughter Karsen, who he shares with his ex-wife Michelle Grace, and his fiancee Jacy Nittolo. Death toll rises as governor confirms hydrants issue 'impaired' LA wildfires fight 'I have nothing to go back to' - reporter tells of LA fires heartbreak Reeves pledges to 'make UK better off' on China visit LA fires: How three days of devastation unfolded What's the latest on the Los Angeles wildfires and what caused them? 'Cold bites' gas supply and 'Dementia shock' 'My mum died after four days on an A&E trolley' The '9/11 mastermind' wants to plead guilty. Why is the US trying to stop him? Pop star Chappell Roan wins BBC Sound Of 2025 Weekly quiz: Zendaya looked happy but who else sparkled at the Golden Globes? Inside the UK's first legal drug consumption room Danes struggle with response to Trump Greenland threat Dragons’ Den returns with a new line-up of celebrity guests Can a fresh batch of entrepreneurs secure the deal of a lifetime? Are smart scales really as ‘smart’ as they claim to be? Greg Foot explores whether they can accurately measure weight, body fat, muscle and bone mass The award-winning psychological competition is back A nail-biting game of detection, backstabbing and trust. Who will make it through? How close are we to a cancer vaccine? How might it help in the treatment of the disease? © 2025 BBC. The BBC is not responsible for the content of external sites.Read about our approach to external linking."
Wales' Covid laws end as hospital mask rule axedMasks will no longer be legally required in health and social care as all rules end on Monday.,"This video can not be played First Minister Mark Drakeford removes all remaining Covid restrictions in Wales The wearing of face masks will no longer be legally required in Welsh health and social care services from Monday. First Minister Mark Drakeford confirmed the ending of the last of Wales' Covid rules, which have been in place in some form since March 2020. Ministers said the public health situation had continued to improve over the last few weeks. Wales was the last part of the UK with Covid restrictions still in place. However most of the rules that affected people's day to day lives, such as wearing face masks in shops and on public transport and self-isolation rules,ended in March. It will no longer be a legal requirement to wear a mask in hospitals from Monday - but guidance will remain The number of people estimated to have Covid-19 in Wales has fallen for the sixth week in a row. However the Welsh government said the NHS continued to experience ""emergency and pandemic pressures"". Guidance will remain in place strongly recommending the use of face coverings in health settings to help protect the most vulnerable. Wales' Covid laws and mass testing to be axed What are the latest Covid rules for Wales? What's the guidance for Covid in the UK now? Announcing the decision in a news conference, Mr Drakeford said authorities were planning to deal with Covid like ""any other seasonal illness"" from now on. But he warned measures were in reality ""on hold"" in case of another wave - with two new variants already being monitored by health officials. ""We have learned, time and again, that this virus can behave in ways that are neither expected nor predictable,"" he said. He said that the Welsh government was ""ready to bring back testing and contact tracing"", should that be needed. Booster vaccines are already being made available for the autumn, and ministers are encouraging people to get a flu jab later this year. Early indications were that ministers would be advised to offer an annual Covid jab in future years, the first minister added, possibly only to older age groups and the most vulnerable. Broader mask rules were scrapped earlier in the year Despite the changes to rules on face masks, Helen Whyley, director of nurses union RCN Wales, asked people to continue wearing them in healthcare settings if asked. She said: ""The legal requirement may be removed, however health and social care professionals across settings are still asking people to think carefully about wearing a mask when attending appointments or visiting friends and family. In some circumstances staff may ask you to wear a mask. ""I am encouraging everyone to be respectful with these requests to help keep the people of Wales safe and health care services recover from the pandemic."" Care Forum Wales said the decision was a ""step towards the normality everyone wants"" but admitted there would be a mixture of emotions. ""It's impossible to estimate the level of trauma people have gone through in the sector,"" chief executive Mary Wimbury toldRadio Wales Breakfast. ""It's going to have to be risk assessed for each sector. ""Sometimes you're going into people's homes where there is a lot of people in and out throughout the day, not wearing masks, and it's going to be great for staff not to have to [wear them] throughout the summer. ""Equally there is going to be vulnerable people you are still visiting and they will want you to wear masks. ""We understand why the restrictions have continued, but it is all about balance."" Newport's Lucy Taylor said she remained cautious and still wore her mask at work Lucy Taylor, from Newport, has cystic fibrosis and shielded during the pandemic. The 29-year-old said it had taken her a long time to be able to venture out and she continued to wear her mask at work. She said: ""It's better for me to live normally again. ""I think if I don't do that I'll just go back into my shell and I'm going to be so scared of going out, that I'm not going to want to go out."" Alex Osbourne has been shielding for the past two years due to her MS Alex Osbourne, from Caerphilly, works for the charity Disability Wales and has been shielding since the start of the pandemic due to her multiple sclerosis (MS). ""I'm quite anxious about this,"" she said, of the final rule being dropped. ""Masks made me feel a bit safer. I have to go to hospital quite a lot so the idea that they won't be worn there anymore is really stressful. ""I understand people don't want to wear them anymore, but it's very stressful for people like me with no immune system who don't have that same confidence as everyone else to start mixing again."" There were an estimated 52,900 people with the virus, according to the weekly swab survey of thousands of households in Wales by the Office for National Statistics (ONS). The ONS said this was one in 55 people - or 1.74% of the population, in the week ending 21 May,  a reduction for a sixth successive week. Daily estimates have infections highest in those in their early 40s and lowest in those over 80. Latest hospital figures in Wales showed on Thursday there were only 25 acute patients with Covid who were being actively treated for the virus. According to Digital Health and Care Wales figures, 85% of patients who tested positive for Covid were in hospital to be treated for something else. Looking at patients testing positive for Covid in all hospitals, the average in the last week has dropped by 27% to 215 - the lowest average since last August. Welsh Conservative shadow health minister Russell George said he was delighted that Covid regulations were ending. He said: ""Not only do we need to remember all those who lost lives and loved ones to lockdowns and the virus itself, but learn the lessons about how we can counter another pandemic and assess the impact of deploying harsh emergency restrictions on our population. ""But none of us will ever get the answers we deserve without the Wales-specific public inquiry everyone in the country wants apart from, not surprisingly, the Labour government who run scared of scrutiny."" Answering journalists' questions, Mr Drakeford again rejected such an investigation, saying he was ""confident"" the UK inquiry, chaired by Baroness Hallett, was ""sensitive to the needs of Wales"". A Welsh-only probe ""would not provide the answers people rightly would expect from an inquiry"", he added. Plaid Cymru health spokesman Rhun ap Iorwerth said he shared the ""nervousness among health professionals about the removal of the need to wear masks in health and care settings, because of vulnerability of so many in the sector"". ""[The] Welsh government must make sure they monitor very carefully the extent to which people follow the guidance for people to continue wearing them in these settings,"" he added. Now that the Covid regulations are going, Mr ap Iorwerth said, ""we owe it to our hard-working staff"" to ""bring our health service on to a more sustainable footing, by reducing waiting times, speeding up the patient journey, and joining up health with social care"". Although the requirement to wear a face covering in health and social care was not part of the original legislation, coronavirus rules in Wales have existed in some form since March 2020. The law was used to impose strict curbs on people's day to day lives, including three stay-at-homelockdowns,restrictions on traveland on whatbusinesses could and could not do. In Wales masks became obligatory in all indoor public places in September 2020. Powers under public health legislation meant the rules could be imposed quickly, without always having to go to the Senedd for a vote first. Welsh ministers added and removed measures as the Covid situation changed. Initially the rules were largely the same across the UK, although this changed as England reopened in the summer of 2020, and differences developed between the different nations. Mr Drakeford's approach to sometimes ease restrictions slower than in England, and to impose restrictions during the first Omicron wave in the autumn, had been criticised by the Welsh Conservatives for being too stringent or for not moving fast enough to lift rules. But the Welsh government has said it had the public's support for how it managed the regulations. While the requirement to self-isolate has ended in law, and only LFTs and not PCR tests are now available to the general public, routine contract tracing has continued in Wales. Under the Welsh government's Covid-19 strategy, it will end in June. It ended in England on 24 February. In Friday's news conference, Mr Drakeford said Wales has a stock of 90 million lateral flow tests, and a decision is still to be made on whether to offer those stocks for free in the winter. The decision was whether to keep free tests over the summer - they are due to end at the end of June - or to hold stocks back for the winter, he added. Discussions are still going on with the UK government to see if further purchases of LTF tests will happen on a UK-wide basis, he said. From empty to busy streets as Covid rules to end Wales' Covid laws and mass testing to be axed What are the latest Covid rules for Wales? What's the guidance for Covid in the UK now? Death toll rises as governor confirms hydrants issue 'impaired' LA wildfires fight 'I have nothing to go back to' - reporter tells of LA fires heartbreak Reeves pledges to 'make UK better off' on China visit LA fires: How three days of devastation unfolded What's the latest on the Los Angeles wildfires and what caused them? 'Cold bites' gas supply and 'Dementia shock' 'My mum died after four days on an A&E trolley' The '9/11 mastermind' wants to plead guilty. Why is the US trying to stop him? Pop star Chappell Roan wins BBC Sound Of 2025 Weekly quiz: Zendaya looked happy but who else sparkled at the Golden Globes? Inside the UK's first legal drug consumption room Danes struggle with response to Trump Greenland threat Dragons’ Den returns with a new line-up of celebrity guests Can a fresh batch of entrepreneurs secure the deal of a lifetime? Are smart scales really as ‘smart’ as they claim to be? Greg Foot explores whether they can accurately measure weight, body fat, muscle and bone mass The award-winning psychological competition is back A nail-biting game of detection, backstabbing and trust. Who will make it through? How close are we to a cancer vaccine? How might it help in the treatment of the disease? © 2025 BBC. The BBC is not responsible for the content of external sites.Read about our approach to external linking."
BBC to move CBBC and BBC Four online,"The Beaker Girls was broadcast on CBBC last year The BBC has announced that it plans to stop airing CBBC and BBC Four as traditional broadcast channels. Director-general Tim Davie announced the content of these networks will continue to be produced and made available for online platforms. This means they would only be available on BBC iPlayer, with Radio 4 Extra moving to BBC Sounds, rather than via their traditional broadcast outlets. He added that the corporation's two news channels will be merged into one. Tim Davie said: ""We are moving decisively to a largely on-demand world"" The corporation currently has two different news networks for UK and World audiences, and the changes are part of cost-saving measures, which the BBC said are part of a plan to create a ""modern, digital-led and streamlined organisation"". The changes announced on Thursday would mean cuts of £200m a year and the reorganisation of services which prioritise digital platforms. But CBBC, BBC Four will stay on linear TV and Radio 4 Extra will stay on the radio airwaves for at least three years. Mr Davie also announced changes to local radio and regional news, which will see TV news programmes in Oxford and Cambridge merged with the BBC's Southampton and Norwich operations. BBC plans to axe local TV news bulletin BBC One regional programme We Are England will also end after its second series later this year. In January, the latest licence fee settlement was announced which will keep it at £159 a year for two years and then rise in line with inflation. Overall, the plans could mean up to 1,000 job losses in the publicly-funded part of the corporation over the next few years. Mr Davie said the BBC would consult with trade unions on the proposals. In a statement, he said the BBC must ""evolve faster and embrace the huge shifts in the market around us"". ""This is our moment to build a digital-first BBC,"" he said. ""Something genuinely new, a Reithian organisation for the digital age, a positive force for the UK and the world. ""Independent, impartial, constantly innovating and serving all. A fresh, new, global digital media organisation which has never been seen before."" The director-general told staff that too many BBC resources are currently focused on broadcast output rather than online, adding: ""We are moving decisively to a largely on-demand world."" The newly merged news channel will mean a single, 24-hour broadcast, simply called BBC News, serving UK and international audiences and offering greater amounts of shared content. Plans to stop scheduling separate content for Radio 4 Long Wave Additional online news services for Sunderland, Bradford, Wolverhampton and Peterborough, creating 100 new job posts Alternative funding for some performance groups such as the BBC's orchestras The end of bespoke television operations in Oxford and Cambridge, which will merge with the wider regional 18:30 news programmes Requesting Ofcom to remove regulatory restrictions on iPlayer to expand boxsets and archive content - with an ambition to reach 75% of BBC viewers through iPlayer each week Shifting a number of World Service languages to being digital only Reviewing commercial options for audio production, which could mean some podcasts are produced by the corporation's commercial arm, BBC Studios This announcement amounts to an ambitious, even radical, acceleration of the BBC's pivot to digital services. It is an attempt to ward off two threats: the first, financial; the second, technological. Financially, the two-year freeze in the licence fee - amid a cost-of-living crisis - forces the BBC to find further savings. Technologically, future licence fee payers are primarily digital creatures. Yet the BBC is still mostly consumed through TVs and radios, and spends most of its money on services that reach people through those traditional means. There will be a big impact on what shows people watch and listen to. Some of that is positive: new dramas, TV formats and podcasts that are widely enjoyed. But some is negative: shows treasured by people who have paid their licence fee for years will go. Which shows remains unclear, though the recent licence fee freeze does give the BBC some cover for those hard choices. Earlier on Thursday, Culture Secretary Nadine Dorries issued the BBC with a legal direction ordering it to ""promote equality of opportunity"" for people from working-class backgrounds. The stipulation came as part of the mid-term review into the corporation's royal charter and includes a target for 25% of staff to be from low socio-economic backgrounds. The BBC said this direction affirms targets the corporation has already set itself. The BBC has also been asked to ensure 50% of radio and 60% of TV production spend is outside London by the end of 2027. Culture Secretary Nadine Dorries has said the BBC's funding model is ""completely outdated"" The corporation must also deliver 1,000 apprenticeships per year by 2025 and ensure that 30% of those are from low socio-economic groups. In a statement, the BBC's chairman, Richard Sharp, said: ""The mid-term review is built into our Charter. We welcome it and we will engage fully and constructively. We look forward to working with government and Ofcom."" Ms Dorries has previously said she wants to find a new funding model for the BBC before the current licence fee deal expires in 2027, as she says it is ""completely outdated"". Prime Minister Boris Johnson's official spokesman said on Thursday: ""The prime minister is firmly of the view that the BBC is a world-class broadcaster, but like other broadcasters one that needs to adapt to a rapidly changing landscape."" BBC plans to axe local TV news bulletin How much is the BBC licence fee and what does it pay for? BBC licence fee deal will be the last - Dorries Comments can not be loaded To load Comments you need to enable JavaScript in your browser Death toll rises as governor confirms hydrants issue 'impaired' LA wildfires fight 'I have nothing to go back to' - reporter tells of LA fires heartbreak Reeves pledges to 'make UK better off' on China visit LA fires: How three days of devastation unfolded What's the latest on the Los Angeles wildfires and what caused them? 'Cold bites' gas supply and 'Dementia shock' 'My mum died after four days on an A&E trolley' The '9/11 mastermind' wants to plead guilty. Why is the US trying to stop him? Pop star Chappell Roan wins BBC Sound Of 2025 Weekly quiz: Zendaya looked happy but who else sparkled at the Golden Globes? Inside the UK's first legal drug consumption room Danes struggle with response to Trump Greenland threat Dragons’ Den returns with a new line-up of celebrity guests Can a fresh batch of entrepreneurs secure the deal of a lifetime? Are smart scales really as ‘smart’ as they claim to be? Greg Foot explores whether they can accurately measure weight, body fat, muscle and bone mass The award-winning psychological competition is back A nail-biting game of detection, backstabbing and trust. Who will make it through? How close are we to a cancer vaccine? How might it help in the treatment of the disease? © 2025 BBC. The BBC is not responsible for the content of external sites.Read about our approach to external linking."
