headline,article
Burns beaten on points by Indongo,"Indongo adds WBA super-lightweight title to IBF and IBO crowns Namibian wins by unanimous points verdict Judges score fight 120-108, 118-110, and 116-112 Scot Burns was attempting to unify division Alex Bysouth Indongo wins by unanimous decision Well, it wasn't to be for Scotland's Ricky Burns. A valiant and whole-hearted performance from the home fighter, but Burns came up against an opponent in Julius Indongo who had the better of him from the first bell. Scintillating stuff from the Namibian, who deservedly unifies the division. It's Indongo who leaves Glasgow as the IBF, IBO and WBA super-lightweight champion of the world. What a performance. We'll catch you next time. Indongo wins by unanimous decision Promoter Eddie Hearn on 5 live sports extra: ""Whenever you're fighting in a unification fight you'll come up against great fighters. We had hoped Indongo wasn't that good and it wasn't Ricky's greatest performance.Â ""Indongo punched very hard, had great footwork and was an awkward southpaw. He was too good for Ricky. It was a very frustrating fight."" Indongo wins by unanimous decision Adam BoothFormer trainer of David Haye on BBC Radio 5 live sports extra Julius Indongo was dominant, knew what he was about, kept swinging dangerous bombs and didn't let Ricky Burns in at all.Â In the last two rounds, when he had the match won, he still wanted to dominate, and like true champions, wanted to get rid of his challenger. Burns loses to Indongo Ricky Burns, speaking to Sky Sports after his defeat:Â ""The better man won, no excuses.Â ""He was so, so awkward. He was a lot better than we thought he was going to be, he can hit as well.Â ""I'm going to have all the doubters saying I'm finished - but I'll come again. ""He started the rounds fast and the height and reach advantage meant he was out of my distance."" Adam BoothFormer trainer of David Haye on BBC Radio 5 live sports extra Ricky should be proud of his career and now take some time out and take stock. If he decides not to fight again, he's earned the respect of all British boxing fans. Indongo wins by unanimous decision And here is the IBF, IBO and now also WBA super-lightweight champion, Julius Indongo ""I feel very proud,"" he tells Sky Sports. ""My home crowd are watching. It's for the whole of Africa. This is so great. ""I am very proud for opening my doors and now the world can see me."" Adam BoothFormer trainer of David Haye on BBC Radio 5 live sports extra Indongo held it together, maintained his discipline and as far as I'm concerned he's a worthy world champion. And there you have it. Julius Indongo has unified the super-lightweight division. Well deserved. A superb performance. Burns v Indongo The smile on the face of Julius Indongo tells you he's confident of taking this one. The southpaw looks to have held on to his undefeated record. A scintillating performance. Ricky Burns claps the crowd. They love him, win or lose. But it's the red corner of the Namibian celebrating in Glasgow. Burns v Indongo Ricky Burns is throwing everything into this but he looks shattered.Â Julius Indongo barely seems to have tired. He continues to burrow forward and looks for the body of Burns as he has all night. Indongo skips out of the way of a late, desperate flurry from Burns. But that's it. Burns v Indongo Ricky Burns is smiling. But he could be a beaten man. Burns hits the canvas again as he dives in and Julius Indongo just ducks out and helps the Scot's momentum take him down. He's straight back on his feet. But it's the calm, composed figure of Indongo who's on top here. Burns v Indongo Adam BoothFormer trainer of David Haye on BBC Radio 5 live sports extra Julius Indongo is showing he is a genuine world champion. He is so far ahead and he still wants to get rid of Ricky Burns. This last round is going to be dangerous for Burns. The atmosphere in the crowd has been finished by Indongo. Burns v Indongo One last big effort from Ricky Burns.Â He saunters forward with a left-right combination but finds Julius Indongo too quick to catch. Burns then absorbs a left-hander from Indongo himself. Indongo has the height, the reach. Burns has the crowd, but he needs something more than that right now. He goes down onto the mat, that was via a wild swing rather than an Indongo punch. Burns v Indongo Mike CostelloBBC boxing correspondent, ringside at the SSE Hydro Arena Julius Indongo is about to upset the odds unless Ricky Burns produces something we have never seen. Burns v Indongo Six minutes to go. Julius Indongo has peppered the body of Ricky Burns all night, but he catches a counter punch from Burns on his way in. But Indongo gets Burns on the ropes, works the body and doesn't look like tiring here. Burns v Indongo Adam BoothFormer trainer of David Haye on BBC Radio 5 live sports extra This fight has become very repetitive - every round is identical. The brief moments of success Ricky Burns has had are when Julius Indongo has let him off first. Indongo is leading and coming back with one or two more shots. He's winning almost every round. Burns needs Indongo to tire. Burns v Indongo You have to say Julius Indongo has looked good tonight. Ricky Burns is trying everything he can to find a way round the awkward southpaw, but it's Indongo with the lead and he's the one who can afford to take a step back if he needs to. Indongo goes low again, looking for the body. Burns sidesteps his way along the edge of the ring, then finds the middle ground. But he can't land anything on Indongo. Burns v Indongo Mike CostelloBBC boxing correspondent, ringside at the SSE Hydro Arena Ricky Burns is known for his terrific stamina - but even he is tiring. He needs to throw more punches. Burns v Indongo We're into the 10th. Ricky Burns is bouncing, but it's Julius Indongo who flicks jab after jab towards the Scot. Burns finds a counter jab, and it might have cut the lip of Indongo. Is that a way in? Burns v Indongo Adam BoothFormer trainer of David Haye on BBC Radio 5 live sports extra I have to give that round to Indongo again. Indongo is taller with longer arms so Ricky Burns is trying to close the distance but he is leaving his head at same height. His lack of head movement is making it difficult for him to close the distance. Â© 2025 BBC. The BBC is not responsible for the content of external sites.Read about our approach to external linking."
LiveRicky Burns v Julius Indongo,"Indongo adds WBA super-lightweight title to IBF and IBO crowns Namibian wins by unanimous points verdict Judges score fight 120-108, 118-110, and 116-112 Scot Burns was attempting to unify division Alex Bysouth Indongo wins by unanimous decision Well, it wasn't to be for Scotland's Ricky Burns. A valiant and whole-hearted performance from the home fighter, but Burns came up against an opponent in Julius Indongo who had the better of him from the first bell. Scintillating stuff from the Namibian, who deservedly unifies the division. It's Indongo who leaves Glasgow as the IBF, IBO and WBA super-lightweight champion of the world. What a performance. We'll catch you next time. Indongo wins by unanimous decision Promoter Eddie Hearn on 5 live sports extra: ""Whenever you're fighting in a unification fight you'll come up against great fighters. We had hoped Indongo wasn't that good and it wasn't Ricky's greatest performance.Â ""Indongo punched very hard, had great footwork and was an awkward southpaw. He was too good for Ricky. It was a very frustrating fight."" Indongo wins by unanimous decision Adam BoothFormer trainer of David Haye on BBC Radio 5 live sports extra Julius Indongo was dominant, knew what he was about, kept swinging dangerous bombs and didn't let Ricky Burns in at all.Â In the last two rounds, when he had the match won, he still wanted to dominate, and like true champions, wanted to get rid of his challenger. Burns loses to Indongo Ricky Burns, speaking to Sky Sports after his defeat:Â ""The better man won, no excuses.Â ""He was so, so awkward. He was a lot better than we thought he was going to be, he can hit as well.Â ""I'm going to have all the doubters saying I'm finished - but I'll come again. ""He started the rounds fast and the height and reach advantage meant he was out of my distance."" Adam BoothFormer trainer of David Haye on BBC Radio 5 live sports extra Ricky should be proud of his career and now take some time out and take stock. If he decides not to fight again, he's earned the respect of all British boxing fans. Indongo wins by unanimous decision And here is the IBF, IBO and now also WBA super-lightweight champion, Julius Indongo ""I feel very proud,"" he tells Sky Sports. ""My home crowd are watching. It's for the whole of Africa. This is so great. ""I am very proud for opening my doors and now the world can see me."" Adam BoothFormer trainer of David Haye on BBC Radio 5 live sports extra Indongo held it together, maintained his discipline and as far as I'm concerned he's a worthy world champion. And there you have it. Julius Indongo has unified the super-lightweight division. Well deserved. A superb performance. Burns v Indongo The smile on the face of Julius Indongo tells you he's confident of taking this one. The southpaw looks to have held on to his undefeated record. A scintillating performance. Ricky Burns claps the crowd. They love him, win or lose. But it's the red corner of the Namibian celebrating in Glasgow. Burns v Indongo Ricky Burns is throwing everything into this but he looks shattered.Â Julius Indongo barely seems to have tired. He continues to burrow forward and looks for the body of Burns as he has all night. Indongo skips out of the way of a late, desperate flurry from Burns. But that's it. Burns v Indongo Ricky Burns is smiling. But he could be a beaten man. Burns hits the canvas again as he dives in and Julius Indongo just ducks out and helps the Scot's momentum take him down. He's straight back on his feet. But it's the calm, composed figure of Indongo who's on top here. Burns v Indongo Adam BoothFormer trainer of David Haye on BBC Radio 5 live sports extra Julius Indongo is showing he is a genuine world champion. He is so far ahead and he still wants to get rid of Ricky Burns. This last round is going to be dangerous for Burns. The atmosphere in the crowd has been finished by Indongo. Burns v Indongo One last big effort from Ricky Burns.Â He saunters forward with a left-right combination but finds Julius Indongo too quick to catch. Burns then absorbs a left-hander from Indongo himself. Indongo has the height, the reach. Burns has the crowd, but he needs something more than that right now. He goes down onto the mat, that was via a wild swing rather than an Indongo punch. Burns v Indongo Mike CostelloBBC boxing correspondent, ringside at the SSE Hydro Arena Julius Indongo is about to upset the odds unless Ricky Burns produces something we have never seen. Burns v Indongo Six minutes to go. Julius Indongo has peppered the body of Ricky Burns all night, but he catches a counter punch from Burns on his way in. But Indongo gets Burns on the ropes, works the body and doesn't look like tiring here. Burns v Indongo Adam BoothFormer trainer of David Haye on BBC Radio 5 live sports extra This fight has become very repetitive - every round is identical. The brief moments of success Ricky Burns has had are when Julius Indongo has let him off first. Indongo is leading and coming back with one or two more shots. He's winning almost every round. Burns needs Indongo to tire. Burns v Indongo You have to say Julius Indongo has looked good tonight. Ricky Burns is trying everything he can to find a way round the awkward southpaw, but it's Indongo with the lead and he's the one who can afford to take a step back if he needs to. Indongo goes low again, looking for the body. Burns sidesteps his way along the edge of the ring, then finds the middle ground. But he can't land anything on Indongo. Burns v Indongo Mike CostelloBBC boxing correspondent, ringside at the SSE Hydro Arena Ricky Burns is known for his terrific stamina - but even he is tiring. He needs to throw more punches. Burns v Indongo We're into the 10th. Ricky Burns is bouncing, but it's Julius Indongo who flicks jab after jab towards the Scot. Burns finds a counter jab, and it might have cut the lip of Indongo. Is that a way in? Burns v Indongo Adam BoothFormer trainer of David Haye on BBC Radio 5 live sports extra I have to give that round to Indongo again. Indongo is taller with longer arms so Ricky Burns is trying to close the distance but he is leaving his head at same height. His lack of head movement is making it difficult for him to close the distance. Â© 2025 BBC. The BBC is not responsible for the content of external sites.Read about our approach to external linking."
Ricky Burns v Julius Indongo,"Indongo adds WBA super-lightweight title to IBF and IBO crowns Namibian wins by unanimous points verdict Judges score fight 120-108, 118-110, and 116-112 Scot Burns was attempting to unify division Alex Bysouth Indongo wins by unanimous decision Well, it wasn't to be for Scotland's Ricky Burns. A valiant and whole-hearted performance from the home fighter, but Burns came up against an opponent in Julius Indongo who had the better of him from the first bell. Scintillating stuff from the Namibian, who deservedly unifies the division. It's Indongo who leaves Glasgow as the IBF, IBO and WBA super-lightweight champion of the world. What a performance. We'll catch you next time. Indongo wins by unanimous decision Promoter Eddie Hearn on 5 live sports extra: ""Whenever you're fighting in a unification fight you'll come up against great fighters. We had hoped Indongo wasn't that good and it wasn't Ricky's greatest performance.Â ""Indongo punched very hard, had great footwork and was an awkward southpaw. He was too good for Ricky. It was a very frustrating fight."" Indongo wins by unanimous decision Adam BoothFormer trainer of David Haye on BBC Radio 5 live sports extra Julius Indongo was dominant, knew what he was about, kept swinging dangerous bombs and didn't let Ricky Burns in at all.Â In the last two rounds, when he had the match won, he still wanted to dominate, and like true champions, wanted to get rid of his challenger. Burns loses to Indongo Ricky Burns, speaking to Sky Sports after his defeat:Â ""The better man won, no excuses.Â ""He was so, so awkward. He was a lot better than we thought he was going to be, he can hit as well.Â ""I'm going to have all the doubters saying I'm finished - but I'll come again. ""He started the rounds fast and the height and reach advantage meant he was out of my distance."" Adam BoothFormer trainer of David Haye on BBC Radio 5 live sports extra Ricky should be proud of his career and now take some time out and take stock. If he decides not to fight again, he's earned the respect of all British boxing fans. Indongo wins by unanimous decision And here is the IBF, IBO and now also WBA super-lightweight champion, Julius Indongo ""I feel very proud,"" he tells Sky Sports. ""My home crowd are watching. It's for the whole of Africa. This is so great. ""I am very proud for opening my doors and now the world can see me."" Adam BoothFormer trainer of David Haye on BBC Radio 5 live sports extra Indongo held it together, maintained his discipline and as far as I'm concerned he's a worthy world champion. And there you have it. Julius Indongo has unified the super-lightweight division. Well deserved. A superb performance. Burns v Indongo The smile on the face of Julius Indongo tells you he's confident of taking this one. The southpaw looks to have held on to his undefeated record. A scintillating performance. Ricky Burns claps the crowd. They love him, win or lose. But it's the red corner of the Namibian celebrating in Glasgow. Burns v Indongo Ricky Burns is throwing everything into this but he looks shattered.Â Julius Indongo barely seems to have tired. He continues to burrow forward and looks for the body of Burns as he has all night. Indongo skips out of the way of a late, desperate flurry from Burns. But that's it. Burns v Indongo Ricky Burns is smiling. But he could be a beaten man. Burns hits the canvas again as he dives in and Julius Indongo just ducks out and helps the Scot's momentum take him down. He's straight back on his feet. But it's the calm, composed figure of Indongo who's on top here. Burns v Indongo Adam BoothFormer trainer of David Haye on BBC Radio 5 live sports extra Julius Indongo is showing he is a genuine world champion. He is so far ahead and he still wants to get rid of Ricky Burns. This last round is going to be dangerous for Burns. The atmosphere in the crowd has been finished by Indongo. Burns v Indongo One last big effort from Ricky Burns.Â He saunters forward with a left-right combination but finds Julius Indongo too quick to catch. Burns then absorbs a left-hander from Indongo himself. Indongo has the height, the reach. Burns has the crowd, but he needs something more than that right now. He goes down onto the mat, that was via a wild swing rather than an Indongo punch. Burns v Indongo Mike CostelloBBC boxing correspondent, ringside at the SSE Hydro Arena Julius Indongo is about to upset the odds unless Ricky Burns produces something we have never seen. Burns v Indongo Six minutes to go. Julius Indongo has peppered the body of Ricky Burns all night, but he catches a counter punch from Burns on his way in. But Indongo gets Burns on the ropes, works the body and doesn't look like tiring here. Burns v Indongo Adam BoothFormer trainer of David Haye on BBC Radio 5 live sports extra This fight has become very repetitive - every round is identical. The brief moments of success Ricky Burns has had are when Julius Indongo has let him off first. Indongo is leading and coming back with one or two more shots. He's winning almost every round. Burns needs Indongo to tire. Burns v Indongo You have to say Julius Indongo has looked good tonight. Ricky Burns is trying everything he can to find a way round the awkward southpaw, but it's Indongo with the lead and he's the one who can afford to take a step back if he needs to. Indongo goes low again, looking for the body. Burns sidesteps his way along the edge of the ring, then finds the middle ground. But he can't land anything on Indongo. Burns v Indongo Mike CostelloBBC boxing correspondent, ringside at the SSE Hydro Arena Ricky Burns is known for his terrific stamina - but even he is tiring. He needs to throw more punches. Burns v Indongo We're into the 10th. Ricky Burns is bouncing, but it's Julius Indongo who flicks jab after jab towards the Scot. Burns finds a counter jab, and it might have cut the lip of Indongo. Is that a way in? Burns v Indongo Adam BoothFormer trainer of David Haye on BBC Radio 5 live sports extra I have to give that round to Indongo again. Indongo is taller with longer arms so Ricky Burns is trying to close the distance but he is leaving his head at same height. His lack of head movement is making it difficult for him to close the distance. Â© 2025 BBC. The BBC is not responsible for the content of external sites.Read about our approach to external linking."
Pro12 Welsh Judgement Day,"Pro12 Welsh Judgement Day as the four Welsh regions meet at Principality Stadium in back-to-back Guinness Pro12 fixtures Cardiff Blues shock Ospreys with 35-17 win in first JDV game Blues run in five tries to put dent in Ospreys Pro12 play-off hopes Newport Gwent Dragons suffer 10th straight defeat as Scarlets win day's second game Jay Freeman, Michael Pearlman and Gareth Griffiths Well what a day of rugby that was. Two brilliant games. Okay, one decent game and another that didn't pipe up until late into the second half. We've seen dent to the hopes of Ospreys' play-off ambitions and Scarlets seize victory against struggling Newport Gwent Dragons who have now lost 10 straight games. In the mean time, enjoy your Saturday night and thank you for joining us. Newport Gwent Dragons 16-21 Scarletys Too little too late for the Dragons but they do score a late
consolation try through wingAdam Hugheswith Angus OâBrien converting to give
Kingsley Jonesâ men a losing bonus point. Dragons flanker Ollie Griffiths man-of-the-match as he does
his cause no harm for a Wales summer touring squad spot. The Scarlets go above the Ospreys to third in the Pro 12
table. A forgettable game. Newport Gwent Dragons 16-21 Scarlets  Newport Gwent Dragons 9-21 Scarlets Dafydd PritchardBBC Sport Wales at the Principality Stadium Moments of quality were a long time coming in this match, but the Scarlets' international class has eventually made the difference. After centre Jonathan Davies crossed for the opening try, a touchdown in the opposite corner from his Wales team-mate Liam Williams has made the game safe for the Scarlets. Newport Gwent Dragons 9-21 Scarlets The Scarlets have wrapped up the game with Liam Williams
enjoying a successful second-half. He powered over for the second try although his conversion
this time hits the post. Crunching collision as a tackle from Scarlets number eight
John Barclay injures Dorian Jones. Replacement outside-half Jones has to go off the field to be
replaced by Jack Dixon but Barclay stays on. Newport Gwent Dragons 9-16 Scarlets This video can not be played Scarlets' Jonathan Davies scores try against Dragons And here's the try that gave Scarlets some breathing room against the Dragons. Newport Gwent Dragons 9-16 Scarlets Bit-part kicker Liam Williams proving more than handy with
the boot as he slots over a penalty to restore the seven point advantage. Newport Gwent Dragons 9-13 Scarlets Newport Gwent Dragons bring on Dorian Jones with Angus OâBrien moving
to full-back. The Dragons reduce the deficit with OâBrienâs third penalty after
the Scarlets are penalised. This underwhelming match has not been decided yet. At last some class from Wales and Scarlets centreJonathan
Davies. He produces a searing break before passing to replacement scrum-half
Jonathan Evans. Dragons wing Adam Hughes is guilty of blatantly killing the
ball and yellow carded by referee Nigel Owens. Scarlets pressure continues and Jonathan Davies strolls over
for a try. Liam Williams kicks the conversion off the post. Newport Gwent Dragons 6-13 Scarlets  Illtud DafyddBBC Radio Cymru Hadleigh Parkes comes on
for Dan Jones. Parkes has played more
minutes than anyone else in the Pro12 this season. None of those minutes as
a fly-half, where he's playing at the moment for the Scarlets. Whilst you're here, who
will kick for goal for the visitors? Parkes has not successfully kicked a
penalty or conversion for the visitors. Stay tuned to find out! No recognised kicker in Scarlets side now and it shows. Liam
Williams steps up and kicks the ball dead from a penalty while attempting to
reach the corner. Sums up how poor this game as been. Outside-half Dan Jones has been replaced by a centre in
Hadleigh Parkes. Walked off the field and didnât look injured. Intriguing
change if tactical. Wales scrum-half Gareth Davies also taken off with former Newport Gwent Dragons number nine Jonathan Evans coming on. All change for Scarlets at half-back. Newport Gwent Dragons 6-6 Scarlets Dafydd PritchardBBC Sport Wales at the Principality Stadium With no entertainment on the pitch, Scarlets seem to be trying to create some by bringing on Hadleigh Parkes - a centre or wing by trade - at fly-half, replacing Dan Jones. An unexpected switch from the Scarlets. Maybe it will bring this stale encounter to life. Newport Gwent Dragons 6-6 Scarlets A thumping tackle from impressive Dragons flanker Ollie
Griffiths on Scarlets prop Rob Evans proves to no avail as the Dragons are
penalised. Dan Jones slots over his second penalty to tie things up. Adam Warren has been forced off the field and replaced by
Tom Prydie who is set to join the Scarlets next season. Scarlets are dominant at the scrum and a penalty earned
there almost provides the platform for their opening try. Dan Jones kicks to the corner for an attacking line-out but
despite the wave of Scarlets attack the Dragons defence holds firm. And the Scarlets get us under way in the second half. HT: Newport Gwent Dragons 6-3 Scarlets Illtud DafyddBBC Radio Cymru RUGBY STAT NERD KLAXON When was the last time
the Dragons lead a game at the halfway point I hear you ask? Think of that historic
rugby nation and their biggest club... The Bears... Loads of snow.. No? The Rodney Parade side
were beating (13-0) and then beat (34-10) Enisei-STM from Russia in the
Challenge Cup back in January this year That was also Kingsley
Jones' last taste of victory, nine defeats on the trot since then Â© 2025 BBC. The BBC is not responsible for the content of external sites.Read about our approach to external linking."
