headline,article
LiveLiveCall for people with health conditions to have jab7 minutes ago,"People in England in priority group six - aged 16-64 and with underlying health conditions - are being called forward for their vaccine Charities including Cancer Research UK, Mencap and the Terrence Higgins Trust are encouraging them to take up their jab Health Secretary Matt Hancock says their support is helping to save lives Ireland suspends use of the AstraZeneca vaccine, against WHO guidance Dutch riot police use water cannon and batons to disperse a crowd of anti-lockdown protesters in The Hague A further 52 UK deaths were recorded within 28 days of a positive Covid test, 4,618 new cases and 24.2m people have had their first dose of a vaccine Met Police face criticism for their handling of women at a vigil for Sarah Everard, officially called off under Covid restrictions Labour's shadow domestic violence minister Jess Phillips says ""the police got it wrong at every single turn"" The home secretary asks for a report on their actions; Police say they made four arrests to protect safety The full force of the pandemic is yet to be felt on the High Street, accountants PwC say More than 17,500 chain stores and other venues closed in Britain last year, according to new data And on Mother's Day, we take a look at some of the new mothers who faced giving birth and beginning to raise their child during the pandemic Claire Heald and Jennifer Meierhans On Mother's Day we've been hearing from the parents of babies like Nora who were born during lockdown We are going to be drawing this weekend's coverage of the coronavirus pandemic to a close soon, so here's a reminder of the day's stories.  Updates were brought to you today by Jo Couzens, Sarah Collerton, Jennifer Meierhans and Claire Heald. Do join us again tomorrow. Labour leader Sir Keir Starmer has urged people to take the coronavirus vaccine when they are offered it as he received his first dose. The 58-year-old thanked staff and volunteers as he had his jab at the Francis Crick Institute in his Holborn and St Pancras constituency earlier. He says: ""From the help they gave our local hospitals with testing last year, to this vaccination centre, they have been at the forefront of efforts to support our NHS and keep our community safe. ""It has been such a difficult year and the vaccination programme is the light at the end of the tunnel. ""The vaccine is safe, effective and I urge everyone in our community to take it when it's their turn."" Meanwhile Welsh Health Minister Vaughan Gething said he was ""delighted"" to be vaccinated and explained that, although aged in his 40s,a kidney condition puts him in a priority group. Liverpool's cultural heritage has helped it become a magnet for events and tourism Liverpool will bepart of a pilot scheme to test crowd safetybefore lockdown rules in England ease later this year. The government said it will work with organisers to get spectators for test events at a nightclub, comedy club and business events venue in the city. Culture Secretary Oliver Dowden said they would help audiences return ""safely without social distancing"". The test events - includingthe FA Cup final and the World Snooker Championship- will take place nationwide this spring as part of the government's Events Research Programme (ERP). Claire McColgan, director of culture and tourism in Liverpool, said: ""Our experience as the pilot city for mass testing means we have the knowledge and infrastructure in place to deliver complicated projects safely."" In November, all Liverpool residents - about 498,000 of them - were offered regular Covid-19 tests over a two-week period in thefirst trial of whole city testingin England. The prime minister has told the Scottish Conservative conference that the UK will
""beat Covid"" in the coming months. Boris Johnson says ""in the not-too-distant
future"" businesses will be able to reopen and people will once again be
able to hold family and friends. He spoke about how the ""kindness and perseverance of
the British spirit"" had shown ""how much we can achieve when we all
pull together"" during the coronavirus pandemic. And with the UK vaccination programme having ""roared
into life in every corner of this country"", he says restrictions that have
been in place across the UK for much of the last year can soon be removed. Johnson thanked everyone who had been involved in delivering the vaccination
programme. ""It shows that the great British spirit that saw us
through so much adversary in the past, lives on in us today,"" he says. Plans to keep indoor hospitality venues closed for weeks longer than non-essential shops in England are facing a legal challenge from a leading restaurateur. Hugh Osmond, the founder of Punch Taverns and a former director of Pizza Express, and Sacha Lord, Greater Manchester's night time economy adviser, have submitted a claim for a judicial review to the government. They believe there is ""no evidence or justification for the prioritisation"" of non-essential retail over hospitality, and said it could have a ""potentially indirectly discriminatory effect"" on young people and people from BAME backgrounds working in hospitality. The letter to the government's legal department argues that hospitality venues are safer than non-essential retail, and that they are essential for local communities and mental health. Under the prime minister's roadmap for unlocking restrictions in England, non-essential retail will open no earlier than April 12. But indoor hospitality venues will not open until at least May 17. There have been a further 52 coronavirus deaths in the UK,government daily figures show.,external This brings the total number of deaths within 28 days of a positive Covid test to 125,516. There were also 4,618 new infections recorded in the last 24 hours. A total of 24,196,211 people have received their first dose of a vaccine in the UK. Meanwhile, 1,584,909 people have received their second dose. Rangers manager Steven Gerrard hasurged the club's fans to stay away from next Sunday's Old Firm derbyat Celtic Park. It comes afterfans broke Covid rules to celebrate the Glasgow club's title successlast weekend. Sunday's game could be postponed if the Scottish government cannot be assured similar scenes will not be repeated. Last weekend fans gathered to celebrate Rangers winning the Scottish Premiership ""Make no doubt about it, we want you there with us, but sadly, right now, you can’t be,"" Gerrard told fans in an open letter. The former England and Liverpool captain said the best place to support him and his players ""is from the comfort of your own home"". ""We know you are with us here in spirit and we know how much last weekend meant to you when we secured the title. ""We know all of you enjoyed it, but we must stay safe, and stay at home."" We've got more from the Netherlands where riot police have used water cannon and mounted police to disperse several thousand anti-lockdown protesters in the centre of The Hague. Local media says several arrests were made but there are no immediate reports of injuries. Dutch authorities had stopped train services to the city, the seat of government, to prevent more protesters arriving, according to Reuters. Police initially told people to go home and announced over loudspeakers that the event was over. They warned they would break up the protest by force if necessary. The Netherlands has been under a tough lockdown since late Januarywith gatherings of more than two people banned, restaurants and bars shut, and with the country having its first night-time curfew since World War Two. Dutch riot police have used a water cannon and batons to disperse a crowd of anti-lockdown protesters gathered at a field in the centre of The Hague a day before general elections, according to Reuters. The demonstration was broken up after the crowd violated social distancing rules and ignored a police warning to leave. It follows months of protestsover coronavirus curfews.We will bring you more as we have it. Cousins Cleona, John, Sadie and Hugo were born within a couple of months last year Coronavirus restrictions - and the weather in some places - has put a bit of a dampener on Mother's Day celebrations across the UK. In Scotland and Wales, four adults from two households can meet up outdoors. But in England and Northern Ireland the limit is two. This is no help to NI grandmother Marie Lindsay, whose two daughters each gave birth to a set of twins during the pandemic. But Marie says she is just grateful for the safe arrival of Hugo, Clíona, John and Sadie during lockdown. ""These are tough times and we are so, so thankful to have these blessings in our lives,"" she says. In June 2020, when coronavirus restrictions allowed, the proud parents got to show off their newborns together to ""the happiest grandparents in the world"" at a socially-distanced gathering in a back garden. The whole family are unable to meet up in person for Mother's Day this year, but will be celebrating virtually. Marie, like many other grandmothers, says she is counting down the days until she can see all of her grandchildren in person once again.But for now here's some lovely pictures of how the twins have grown. The official vigil planned at Clapham Common was cancelled, but hundreds still gathered to pay their respects We've been bringing you reaction to the vigil for Sarah Everard in London which ended with police moving in to enforce coronavirus regulations. The events last night on Clapham Common came after hundreds gathered despite an organised vigil being called off due to Covid restrictions. Meanwhile, across the UK, people were paying their respects to the 33-year-old marketing executive by holding their own vigils.Here are some photographs of the tributes in memory of Sarah Everard. College Green in Bristol Birmingham City Centre Queen Victoria statue in Dalton Square, Lancaster The University of Leeds in West Yorkshire Hospitality leaders have urged the Scottish government to change its Covid lockdown levels to stop businesses failing. An industry group has submitted its own version of the system to ministers. The document, seen by the BBC, urges ministers to mirror the reopening plans for England - stripping away curfews and naming dates. The Scottish government said lockdown exit will be driven by data, not dates. Five of Scotland's main hospitality trade bodies said if changes are implemented,60,000 jobs in the sector could be saved. We've been hearing today about the next group of people to be called forward to have their coronavirus vaccine.Three Covid-19 vaccines have been approved for use in the UK. It means a lot of people are asking: ""When will I get the Covid vaccine? What are the groups for the Covid vaccine? Who is classed as extremely clinically vulnerable?"" Immunisations with the Pfizer-BioNTech vaccine and Oxford-AstraZeneca began on 8 December and 4 January for those in priority groups. Shots of the Moderna vaccine will not arrive until Spring 2021. Margaret Keenan, 91, was thefirst person in the UK to be given the Covid jab. BBC health reporter Laura Foster explains who was first in line to get the shot and why. This video can not be played Covid-19 vaccine rollout: Who will get the vaccine first in UK? People hoping to spruce up their gardens in anticipation of some al fresco socialising may face problems due to a garden furniture shortage. A combination ofhigh demand and shipping problems is being blamed, with furniture giant Ikea among the retailers experiencing supply issues. Companies say shipping costs to import goods from countries such as China have risen dramatically. The Leisure and Outdoor Furniture Association, which represents 70 manufacturers and wholesalers, says all of its members are having problems with outdoor furniture supply. Ikea says the shortages have been caused by both a huge rise in demand through the pandemic, as people spend more time at home, and problems with its global supply chain. However, the retail giant says it hopes to have things back to normal by the time its stores reopen. Coronavirus has heightened anxieties around food for those with eating disorders, experts say. Charity Beat says demand for its helpline ""soared"" as a result of the pandemic. Spokesman Tom Quinn says: ""It's not surprising, as those affected and their families have had to cope with extreme changes to their daily routines, support networks and care plans, all while also dealing with the additional stress the pandemic has brought."" Phoenix Richardson, 15, has avoidant/restrictive food intake disorder, or ARFID. When the pandemic hit, his mum Vickie was frantically buying up ""safe"" foods that he would eat, stockpiling pasta and sausages while some were buying up toilet roll. Phoenix says loss of control forms part of his anxiety around food: ""For a period of time, I could only trust Mum or myself to cook, otherwise I would panic. My own dad couldn't even cook... or granny. Even if I watched I would be like 'this is different, I don't like it, I'm panicking'."" Find out more about the effect of the pandemic on those with eating disordershere. We've got more from Professor Sir Ian Diamond, head of the Office for National Statistics (ONS) on its work to track levels of coronavirus antibodies in the population. Sir Ian told the BBC's Andrew Marr show there was evidence of ""quite remarkable increases in the level of antibodies in the over-80s, and increasingly in the over-70s"". He says he is ""very, very confident that the vaccine rollout is really starting to provide some real protection"". At the other end of the age bracket, there are ""relatively high levels (of antibodies) amongst young people"", he says. ""Which just shows how much young people have been affected by the virus"". But he says the data on antibodies across the UK shows ""a lot of regional variation"". ""We find 30% of London have antibodies whereas only 16% in the South West, so we need to recognise that as well,"" he says. Hairdressers are set to reopen in Wales on Monday - but
mobile stylists say they’re confused as to whether they can pick up the
scissors again. On Friday, the Welsh government saidall hairdressers,
including mobile salons, could reopen. But the Nation Hair & Beauty Federation (NHBF) said it
had been told mobile stylists ""might not be able to resume"". The Welsh government said they could work only ""where
the client physically cannot leave the home"". Mobile hairdresser Antonia Sparkles, 32, from Pencoed,
Bridgend, says she does not understand the rules. ""It should only be a yes or no, with clear instructions
on what services we can do,"" she says. ""I feel a bit confused. I know three people who can't
leave the house physically - that is not going to pay my bills. ""In the last hour I've had more confused clients saying
I'm allowed back - it's more stress. I'm telling clients there's no answer yet,
it's not clear."" Here’s more on that story. The use of the Oxford-AstraZeneca vaccine has been suspended in the Republic of Ireland. The National Immunisation Advisory Committee (NIAC) recommended the move following reports of serious blood clotting events in adults in Norway. In a tweet, the Irish Minister for Health Stephen Donnelly said it was a""precautionary step"".,external Last week,Denmark and Norway suspended the use of vaccine. But the World Health Organisation said countriesshould not stop using the vaccineover fears it causes blood clots as there is no indication this is true. We've got the full story here. On Mother's Day we've been hearing the experiences of women like Tash, who gave birth to son Ziggy during the pandemic It's lunchtime in the UK, so let's have a recap on the stories we've been talking about. Last year, Covid rules meant some expectant mothers faced being alone for baby scans, appointments and giving birth. Bristol-based portrait photographer, Nina Raingold, met mothers who have experienced the challenges of giving birth during Covid restrictions in the UK. Here's what they shared in their own words. Jo and her daughter Olive ""The hardest part about being pregnant in lockdown was that my husband Pete couldn't come to my appointments or scans, and it's quite scary to do that by yourself. ""We were always a bit worried that one of us would get sick; it put a fog of anxiety over the last trimester. ""Pete couldn't be with me for some of my labour. I had to go into the maternity triage and he wasn't allowed in. ""All the stuff you prepare for labour is with your birth partner; I hadn't planned to do 45 minutes of it in the waiting room on my own!"" Naomi and her son Akirou ""We were in complete lockdown on the day I gave birth. ""It was so quiet getting to the hospital. Looking out of the window, there was nobody on the streets. ""I thought maybe I wanted to give birth at home because of the virus, but they said I had to have the baby in the labour ward. ""The virus was so new and they didn't know what was going to happen. ""They just had the high numbers of deaths from all the other countries. I remember it being a very surreal time. ""So many people were dying every day. To have that on your mind and then to go to hospital where you'll be in contact with so many different people was a scary thought."" Steph and her daughter Nora ""The worst thing in the whole pregnancy was that after an incredibly long labour, [my partner] Joe had to leave the hospital an hour after I had given birth. ""We did skin-to-skin contact with the baby with me, and then with him, and then he had to go. ""I had to stay with her for two days by myself. If he'd have been there, I think I would have been fine. ""I was dealing with it because all the other women were dealing with it, but it didn't feel good at all. ""Being pregnant during the pandemic wasn't actually that bad because we had some lovely 'us time', much more than we would have done before having a baby. ""If you're getting on with your partner, then actually you go into a lovely little cocoon. ""But it's sad for your partner not to be with the baby immediately."" You can hear more from the mums and see their gorgeous baby pictureshere. © 2025 BBC. The BBC is not responsible for the content of external sites.Read about our approach to external linking."
