headline,article
"The rise of left-wing, anti-Trump fake news","Since the US election presidential race, fact checking websites report what seems like an increase in anti-Trump, 'liberal fake news'. The fact-checking siteSnopes,externaltoldBBC Trending radiothat in the past week, for example, they have debunked many more anti-Republican party stories than pro-Republican ones. One example of an incorrect story is the unflattering, digitally-manipulated image, which suggested that US President Donald Trump had diarrhoea during a recent golf outing. It's hard to gather definitive data on the political bias in fake news stories, so the evidence for a rise in 'liberal fake news' is essentially anecdotal. But a recent study did effectively debunk the stereotype that fake news tends to be shared more by uneducated people or those with right-leaning politics, as compared to other groups. ""It [fake news] affects both the right and the left. It affects educated and uneducated. So the stereotypes of it being simply right-wing and simply uneducated are 100% not true,"" says Jeff Green, who is the CEO of Trade Desk, an internet advertising company that was recently commissioned by American TV channel CBS to investigate who is reading and sharing fake news online. His company did this by initially putting out two fake news stories - one from the left which falsely stated police had raided a protestors camp at Standing Rock and burnt it down, and the other from a right-wing website about false claims there was a congressional plot to oust Donald Trump. A left-wing fake story falsely claimed police had raided a protestors camp at Standing Rock and burnt it down By using specialist software, the company's researchers then followed readers' online behaviour to get an idea of who and where they were. ""On the left if you're consuming fake news you're 34 times more likely than the general population to be a college graduate,"" says Green. If you're on the right, he says, you're 18 times more likely than the general population to to be in the top 20 percent of income earners. And the study revealed another disturbing trend: the more you consume fake news, the more likely you are to vote.  It's ""fascinating and frightening at the same time,"" says Green. One of the reasons for the growth in liberal fake news is financial. ""Those people who generate this kind of fake news don't care about politics. They just care about generating clicks, and so sometimes they generate similar messages for the right and the left,"" says Filippo Menczer, a professor of Informatics and Computer Science at Indiana University who runs the fake news tracking site Hoaxy. Visit theTrending Facebook page,external As for where the market for liberal fake news comes from, according to Claire Wardle, who is a research director at First Draft - a non-profit organisation which is looking for solutions around trust and truth in the digital age - the appetite stems from so-called confirmation bias. ""People like to share information that makes them feel good, "" she says. ""Many people on the left right now are feeling overwhelmed and fearful and unsure of what's going to happen next. While they're scrolling through their information feeds at speed on small mobile phones their critical functions are not kicking in, and they're seeing information that makes them feel immediately connected with other people who think similarly to them. And without doing the usual checks that they would do, they're sharing and very quickly passing on similarly false and problematic content that we were seeing before the election."" ""Check your sources,"" says Brooke Binkowski from fact-checking site Snopes Brooke Binkowski, who is managing editor at Snopes website, warns newsreaders to stay aware of the emotions they feel when consuming content. ""If you are a newsreader or someone who likes reading news but you don't know immediately what may or may not be fake, ask yourself by reading the headline, what emotions do I feel? Am I really angry, scared, frustrated, do I want to share this to tell everybody what's going on? If the answer to any of these questions is yes, then check your sources."" Correction 17 April 2017: A reference to Snopes finding that suggestions President Trump profited from the US missile strikes in Syria were false has been removed from this story. It found the claims unproven. You can follow BBC Trending on Twitter@BBCtrending,external, and find us onFacebook,external.  All our stories are atbbc.com/trending. NEXT STORY:US internet 'warriors' send racially charged symbols to France The far-right online strategy in France is very different, Marine Le Pen's party says. WATCH:US internet 'warriors' send racially charged symbols to France LA firefighters say 'no possibility' of containing blazes as fifth wildfire breaks out Inside the neighbourhood totally lost in LA fires Starmer and Badenoch clash over call for grooming inquiry How Canada's immigration debate soured - and helped seal Trudeau's fate 'I can't get divorced as I can't get my pension valued' BBC Sound of 2025: Barry Can't Swim is a new dance music superstar Ros Atkins on...Elon Musk's political interventions A journalist's murder highlights risks of reporting in small-town India Jean-Marie Le Pen - founder of French far right and 'Devil of the Republic' Cases of HMPV are on the rise in China - but what is it? Cryptocurrencies and personal AI: Tech to watch out for in 2025 Politics Essential: Get the latest news and analysis delivered to your inbox every weekday Delivering brand-new miracles in 1970s East End Watch the latest series of Call the Midwife on iPlayer now Mark-Anthony Turnage shares the soundtrack of his life Once called 'Britainâs hippest composer', he's tackled topics from drug abuse to football in his work Paddyâs loaf-changing experience inside the bread factory Paddy McGuinness visits the bread factory he used to work in, and sees how they make 1.4 million loaves a week What's behind the global surrogacy boom? More countries are banning surrogacy â but demand is growing Â© 2025 BBC. The BBC is not responsible for the content of external sites.Read about our approach to external linking."
"Tale of two mothers: One deported, one not","Immigrants take part in a workshop called ""Me Preparo"" to plan what happens to their US-born children if they are deported Under Donald Trump's new immigration order, even undocumented immigrants with similar circumstances can have opposite outcomes. Under an Obama administration policy, some undocumented immigrants without criminal records and established families and careers in the US were given a temporary reprieve from deportation. In February, the Trump administration issued new enforcement memos that made virtually anyone residing in the US illegally a priority for removal, removing such considerations. The new policy leaves the decision who to deport to deportation agents and encourages a ""case-by-case"" evaluation. Such individual discretion can spur dramatically different results for immigrants with otherwise remarkably similar circumstances. This week, we looked two cases that illustrate this effect, as well as some of the others making news for facing deportation. Veronica Castro, 38 Order of supervision extended: 4 April 2017 Ms Castro, who was born in Mexico and lives in Lothian, Maryland, is the wife of an Army veteran. She has four children, including a disabled son, who are all US citizens. She also has a 20-year-old removal order that places her on uncertain ground with immigration officials. Under the Obama administration, Ms Castro had been attending regular meetings with Immigration and Customs Enforcement (Ice) since 2011 and even had a legal work permit. When the Trump administration said that it would prioritise deporting anyone with a final order for removal, Ms Castro and her family dreaded their next appointment with immigration officials. Despite her fears, Ms Castro decided to go to her appointment, hoping that the agency would allow her to stay with her family because she had no criminal record. On 4 April, Ice granted Ms Castro a ""non-detained order of supervision"" which means she is required to report her status to immigration officials, said an Ice spokesperson. Because of this agreement, she will be able to stay in the US for at least one more year until her next check-in with Ice. Ms Castro's continued order of supervision ""doesn't mean someone else in her exact same situation would be granted another year,"" Joshua Doherty, Ms Castro's lawyer says. Maribel Trujillo-Diaz, 42 Detained: 5 April 2017 Maribel Trujillo-Diaz's case mirrors Ms Castro's in many ways. She is also a mother to four US citizens living near Cincinnati, Ohio. Under the Obama administration, she too had been attending regular meetings with Ice for several years and had been allowed to stay in the US with her family. With no criminal record, Ms Trujillo-Diaz also obtained a legal work permit through US Citizenship and Immigration Services (USCIS). Ms Trujillo-Diaz came to the US in 2002, but she first encountered Ice agents during a workplace raid of the Koch Foods factory where she was working in 2007, before she had her work permit. She pursued an asylum hearing, as she had fled Mexico after gang members began targeting her family because her brother refused to join the gang, according to her lawyer, Emily Brown. Ms Trujillo-Diaz's application for asylum was rejected, as was her appeal. Despite a final order of removal issued in 2014, immigration officials had allowed Ms Trujillo-Diaz to live in the US with the understanding that she would check in with Ice once a year. At her first check in since the Trump administration issued its new enforcement priorities, Ice agents told Ms Trujillo-Diaz to prepare for deportation proceedings. She returned for a second check in on 3 April, and again Ice agents told her to be ready to be removed from the US. Two days later, Ice officers arrested her as she was leaving for work. Ms Trujillo-Diaz is now in a detention centre in Louisiana, and a request for a stay in her case has been denied. Ice has scheduled her deportation for 19 April, Ms Brown said. Some of the reasons undocumented immigrants were not deported under Obama administration policy: having an American citizen child being married to a veteran being the caretaker for a disabled family member a longstanding presence in the US and history of co-operating with immigration enforcement officials Tichelman at a court hearing in 2015 Alix Tichelman, 29 Order of Removal:6 April 2017 Ms Tichelman, a Canadian national, faces deportation after serving a two-year sentence in the Santa Clara County Jail in California. In 2014, while on board a yacht after being hired as a prostitute, Ms Tichelman injected a 51-year-old Google executive with heroin, causing the man to accidentally overdose and die. She was convicted of felony involuntary manslaughter. A judge determined that Ms Tichelman's crimes made her ineligible to remain in the US legally and issued an order for her removal on 6 April. She will remain in Ice custody until arrangements for her deportation are finalised, an Ice spokesperson said. Abdi Ali, 28 Detained:6 April, 2017 Mr Ali, a resident of Portland, fled Somalia in 1996 as a seven year old. A year later, he had gained permanent legal status in the US. According to Ice officials, Mr Ali has an ""extensive criminal record"" that includes two convictions for misdemeanour assault. None of his criminal charges have been for felonies. Ice agents arrested Mr Ali while he was visiting a country courthouse to plead not guilty to a drink-driving charge. The arrest inside the courthouse caused backlash from local immigration lawyers and advocates who worry that such arrests will discourage immigrants from seeking legal help. Mr Ali remains in Ice custody in the Strafford County Correction facility in New Hampshire. ""I've been here my whole life, and they [are] kicking me out for this one charge,"" Mr Ali toldthe Bangor Daily News,external. ""If I go back to my country, they're going to pretty much kill me. I don't know [anything] about my country. I'm American. I consider myself American."" Beristain, in blue, has been in the US for 20 years Roberto Beristain, 43 Deported: 4 April, 2017 Mr Beristain, whose wife voted for Donald Trump, was deported on 4 Aprilafter his family and community in Indianafought to keep him in the US. The restaurant owner and father was removed from the US and dropped off in JuÃ¡rez, Mexico last week, after living in the US for nearly 20 years. He can apply to have the 10-year ban on entering the US after a deportation waived and try to gain legal residency, but the outcome of such a petition is uncertain. See the previous report.Add your stories below. LA firefighters say 'no possibility' of containing blazes as fifth wildfire breaks out Inside the neighbourhood totally lost in LA fires Starmer and Badenoch clash over call for grooming inquiry How Canada's immigration debate soured - and helped seal Trudeau's fate 'I can't get divorced as I can't get my pension valued' BBC Sound of 2025: Barry Can't Swim is a new dance music superstar Ros Atkins on...Elon Musk's political interventions A journalist's murder highlights risks of reporting in small-town India Jean-Marie Le Pen - founder of French far right and 'Devil of the Republic' Cases of HMPV are on the rise in China - but what is it? Cryptocurrencies and personal AI: Tech to watch out for in 2025 Politics Essential: Get the latest news and analysis delivered to your inbox every weekday Delivering brand-new miracles in 1970s East End Watch the latest series of Call the Midwife on iPlayer now Mark-Anthony Turnage shares the soundtrack of his life Once called 'Britainâs hippest composer', he's tackled topics from drug abuse to football in his work Paddyâs loaf-changing experience inside the bread factory Paddy McGuinness visits the bread factory he used to work in, and sees how they make 1.4 million loaves a week What's behind the global surrogacy boom? More countries are banning surrogacy â but demand is growing Â© 2025 BBC. The BBC is not responsible for the content of external sites.Read about our approach to external linking."
Delivering famine lifelines from the sky,"Planes drop aid sacks into famine-hit areas of South Sudan In the dusty, baking emptiness of Leer in South Sudan, bags of British food aid fall from the sky to relieve the hunger below. It is here in the north of the country that the United Nations has declared a famine. It is here that the fighting between government and rebel forces has driven so many into hunger and homelessness. And it is here that UK aid is being carefully targeted from the air. To watch these bags of cereal and pulses and food substitutes pour from the bellies of ageing Russian transport planes that have been hired by the aid agencies is to witness an absolute good. For without it, more people in this war-ravaged, hunger-stricken country in central Africa would starve to death. I watched the Ilyushin planes lumber slowly into view alongside Priti Patel, the International Development Secretary, who had travelled many hours to see what impact the money she had authorised was having on the ground. Despite the controversy over her Â£13bn aid budget, Ms Patel insisted that Britain's humanitarian spending gave it influence in the world. UK International Development Secretary Priti Patel inspects aid sacks that have been dropped by plane First the planes practise a low pass over the drop zone, marked by a large white cross. They make another wide circuit to let nearby villages know an aid delivery is on its way. And then, at around 300 metres above the ground, they begin to drop their cargoes. Each plane can carry about 30 metric tonnes of aid, about 600 sacks. They make three passes, dropping 200 sacks each time. These are not parachute-born crates, just individual bags hurtling towards the ground. Like some dreadful game of pass-the-parcel, each sack is bagged seven times to stop it exploding on impact. South Sudan: World's first famine since 2011 Why are there still famines? What is a famine? South Sudan ravaged by ethnic cleansing - UN To watch this, to see the gleam of hope in the eyes of those waiting below, is a moving experience. For many of them, without this aid, they would be forced to live off what nuts, leaves and water lilies they can forage, none of which provides adequate nutrition. ""UK aid is providing a much-needed lifeline to people who have been persecuted, driven off their homes, forced to flee,"" Ms Patel told me. ""The aid that we are providing right now is the difference between life and death."" Yet the problem is this. Each plane contains food enough for only 2,000 people a month. The cost of the planes is astronomic and there are only seven in the region that the World Food Programme can operate. There is a scarcity of available food aid because there are so many other droughts in the region. Each drop has to be negotiated with local community leaders and armed groups, whose permission is needed to ensure that any fighting is put on hold. The hungry will come only if they feel safe. Any food drop in a government-held area has to be matched by one in territory held by the rebels The distribution centre on the ground - a temporary, pop-up affair - can exist only for a few days before the security risks become again too great. Any food drop in a government-held area has to be matched by one in territory held by the rebels. The amount of aid has to be roughly equal in size to avoid accusations that the aid agencies are taking sides. This video can not be played A history of South Sudan in 105 seconds In other words, this aid that falls from the sky may help people who are the hardest to reach in a severe humanitarian crisis. But it is expensive, complicated and, as aid workers repeatedly told me, not nearly enough. There are three road corridors into South Sudan along which aid can travel by truck. And this can be more efficient. One truck alone can carry as much as a Russian transport plane. Yet trucks have deal with checkpoints, fighting and simple banditry. And soon they will lose the roads when the rains come and render much of the country impassable. So there is, aid workers say, a race against time to build up aid dumps before the weather closes in. Such is the reality of delivering British and other aid in the north. To the south, in the capital, Juba, the UK is funding much of South Sudan's only children's hospital - its medicines, its water tanks, its solar panels. Here doctors are seeing rising numbers of children with acute malnutrition. And inevitably they need more resources, above all more space. Children in South Sudan are suffering from acute malnutrition On the day we visited, in one ward alone, there were 43 children sharing 21 beds. I spoke to Rhoda, a 50-year-old woman who had brought in her granddaughter 10 days previously. Cecilia, only 18 months old, arrived severely malnourished. Her mother had died and Rhoda had no milk to feed her. But, she told me, Cecilia's fever and diarrhoea had abated after a few days of milk and porridge. Further south, the problem is one of refugees. More than a million South Sudanese have fled the country to escape the fighting. We travelled to northern Uganda where on average 2,000 people are pouring over the border each day. Last week there was one 24-hour period when no fewer than 7,000 refugees came across. Bidibidi refugee camp, across the border in Uganda, has quickly grown into the world's largest Uganda - unusually - welcomes refugees and gives them a plot of land with shelter and access to services. Here millions of pounds of UK aid is being spent to provide some of the basic infrastructure. Yet here again the scale of the crisis outweighs the humanitarian response. Last August there was next to nothing at the main refugee settlement at Bidibidi. Now, it is the largest such settlement in the world, home to more than 270,000 people. Clearly, the scale of the humanitarian challenge is huge and growing. But the aid agencies report that the United Nation emergency response for South Sudan is hugely underfunded, with some international donors showing reluctance to stump up the cash. So this is a crisis that many expect to get worse before it gets better. South Sudan country profile Aid workers killed in South Sudan ambush What is a famine? S Sudan ravaged by ethnic cleansing - UN LA firefighters say 'no possibility' of containing blazes as fifth wildfire breaks out Inside the neighbourhood totally lost in LA fires Starmer and Badenoch clash over call for grooming inquiry How Canada's immigration debate soured - and helped seal Trudeau's fate 'I can't get divorced as I can't get my pension valued' BBC Sound of 2025: Barry Can't Swim is a new dance music superstar Ros Atkins on...Elon Musk's political interventions A journalist's murder highlights risks of reporting in small-town India Jean-Marie Le Pen - founder of French far right and 'Devil of the Republic' Cases of HMPV are on the rise in China - but what is it? Cryptocurrencies and personal AI: Tech to watch out for in 2025 Politics Essential: Get the latest news and analysis delivered to your inbox every weekday Delivering brand-new miracles in 1970s East End Watch the latest series of Call the Midwife on iPlayer now Mark-Anthony Turnage shares the soundtrack of his life Once called 'Britainâs hippest composer', he's tackled topics from drug abuse to football in his work Paddyâs loaf-changing experience inside the bread factory Paddy McGuinness visits the bread factory he used to work in, and sees how they make 1.4 million loaves a week What's behind the global surrogacy boom? More countries are banning surrogacy â but demand is growing Â© 2025 BBC. The BBC is not responsible for the content of external sites.Read about our approach to external linking."
