headline,article
Tory rebellion over betting machinesMore than 20 Conservative MPs join opposition parties demanding a crackdown be brought forward.UK Politics,"This video can not be played What are fixed-odds betting terminals? The government is facing a rebellion over the timing of its crackdown on fixed-odds gambling machines. Ministers have promised to cut the machines' maximum stake from £100 to £2 in October 2019 - but some MPs are calling for it to happen sooner. More than 20 Conservatives have joined opposition politicians in trying to bring the change forward to April 2019. They backed an amendment to the Finance Bill, which was tabled on Monday evening. The government said it had consulted widely and considered ""all of the evidence"" before making its decision on a timeframe. It has denied that MPs were led to believe the cut in the maximum stake would come into force in April - but the timing, announced in last month's Budget, has been criticised, with sports minister Tracey Crouch resigning in protest. High stakes for fixed-odds betting machines Pro-betting MPs more persuasive - Crouch 16 MPs receive free tickets from betting firms In her resignation letter, Ms Crouch suggested MPs who supported the betting industry had been ""more persuasive in their arguments"" to senior ministers - and it was this that had convinced them to opt for the later date. Scheduling the change for October means it will happen at the same time as increases in the amount of tax charged to gambling firms who are based abroad but operate in the UK. The government says doing it this way means the public finances will not be hit by a fall in the amount of tax coming in. Fixed-odds betting terminals generate £1.8bn in revenue a year for the betting industry, according to the Gambling Commission, and bring in taxes of £400m for the government. The Finance Bill is the legislation that puts the proposals outlined in the Budget into law. Senior Tories Iain Duncan Smith, David Davis and Justine Greening backed the amendment on Monday evening, along with four DUP MPs. Currently, people can bet as much as £100 every 20 seconds on electronic casino games such as roulette. Anti-gambling campaigners say the machines let players lose money too quickly, leading to addiction and social, mental and financial problems. But bookmakers have warned the cut in stakes could lead to thousands of outlets closing. Labour's Carolyn Harris, who chairs the all-party parliamentary group on fixed-odds betting terminals, told BBC Radio 4's Today programme the MPs were trying to ""force the government into doing the right thing"". The Welsh Labour deputy leader said there was a ""very realistic chance"" that MPs would back bringing in the cut to April 2019 when they discuss the Finance Bill. ""There's a huge feeling in the House that this is the wrong decision and we need to implement it as a matter of urgency,"" she added. The government said it was making ""a significant change that will help stop extreme losses and protect the most vulnerable in our society"". The amendment will be voted on next week. Comments can not be loaded To load Comments you need to enable JavaScript in your browser Wildfire sweeps through Hollywood Hills and threatens landmarks as chaos grips LA Paris Hilton among stars 'heartbroken' as she watches home 'burn to ground' Commuters warned of icy roads as cold snap continues to freeze UK Sound Of 2025: Ezra Collective are 'keeping music real' The Papers: 'Apocalypse' LA and 'Reeves faces extra tax rises' How Australia's beach cabana drama sparked a turf war H-1B: Visa row under Trump fuels anxiety for Indian dreamers 'I thought I was going to die': Jailed Venezuelan activist details brutality of prison life The man who could become Canada's future PM 'Trump 2.0' looms large over the global economy A politician was shot dead in Bangkok. Did another country do it? Chris Mason: Is Starmer leaving the door open to an abuse inquiry? Delivering brand-new miracles in 1970s East End Watch the latest series of Call the Midwife on iPlayer now Mark-Anthony Turnage shares the soundtrack of his life Once called 'Britain’s hippest composer', he's tackled topics from drug abuse to football in his work Paddy’s loaf-changing experience inside the bread factory Paddy McGuinness visits the bread factory he used to work in, and sees how they make 1.4 million loaves a week What's behind the global surrogacy boom? More countries are banning surrogacy – but demand is growing © 2025 BBC. The BBC is not responsible for the content of external sites.Read about our approach to external linking."
Apple iPhone sales fears rock Wall StreetThe tech giant's share price fall has wiped more than $40bn off its market value.Business,"Apple chief executive Tim Cook presenting the firm's newest line of products last month Apple shares sank by 5% on Monday, dragging down US markets and wiping more than $40bn (£31bn; €35bn) off the tech giant's market value. The fall followed a profit warning from some of the firm's suppliers, which exacerbated concerns that demand for iPhones is slowing. The declines made the company one of the biggest losers on the Dow, which closed down 2.3%. The wider S&P 500 ended about 2% lower, while the Nasdaq fell more than 2.75%. Technology stocks led the Wall Street sell-off which saw shares in most sectors tumble. Tech firms helped drive many of the stock market gains earlier in the year but now face rising calls for regulatory and tax changes that could hurt their growth. Amazon shares lost more than 4%, Alphabet dropped over 2.5% while Facebook fell 2.3%. Apple's share price fall came after Lumentum, a US manufacturer of facial recognition technology and Apple supplier, said one of its major customers had reduced its shipments. As a result, Lumentum downgraded its sales and profit outlook, sending its shares down over 30%. Lumentum's warning came shortly after another Apple supplier, Japan Display, also cut its full-year guidance blaming ""volatile customer demand"". The warnings from Apple suppliers extendeda slide in Apple shares that started earlier this monthafter the firm's sales forecast disappointed investors. The shares closed at about $194, down 5% for the day and more than 15% below their peak in October. Apple has said it will no longer report individual sales of iPhones, iPads and Macs Apple has insisted that it is optimistic about its Christmas season outlook, attributing the weaker than expected forecast to one-off changes, such as the timing of the release of new phones, and temporary supply chain issues. Apple falls below $1tn despite revenue and profit rise Five big things that have made Apple Smartphone use falls among young for first time It continues to make record profits, thanks to higher prices and growing income from its services business, which includes services such as the App Store, Apple Pay, Apple Music. But analysts have remained sceptical, especially after the firm said it would stop sharing the number of iPhones, iPads and Macs it sells with investors. They have warned that Apple's reliance on higher prices could also make it especially vulnerable if there is a broader pullback in consumer spending. Meanwhile, Goldman Sachs, which has been embroiled in a corruption scandal at Malaysia's state-backed development fund, also dragged Wall Street indexes lower. Shares in the investment bank ended down about 7.5%, after a Malaysian official said the country wanted a refund of the fees Goldman earned for work on bond sales for the 1MDB fund. A former Goldman executive this month pleaded guilty to US charges that he had participated in a scheme to use some of the money raised in those offerings for bribes. The US market declines come amid an extended period of volatility on Wall Street, with investors wary due to warnings of a slowdown in global growth, trade tensions, falling oil prices and rising interest rates. US companies are also facing a rising dollar, which hurts sales overseas. The combination of factors has helped fuel speculation that corporate profits may be at their peak, especially after several companies, including Apple and Amazon, issued weaker than expected sales forecasts for the months ahead. Apple loses its $1tn crown as shares fall Five big things that have made Apple Wildfire sweeps through Hollywood Hills and threatens landmarks as chaos grips LA Paris Hilton among stars 'heartbroken' as she watches home 'burn to ground' Commuters warned of icy roads as cold snap continues to freeze UK Sound Of 2025: Ezra Collective are 'keeping music real' The Papers: 'Apocalypse' LA and 'Reeves faces extra tax rises' How Australia's beach cabana drama sparked a turf war H-1B: Visa row under Trump fuels anxiety for Indian dreamers 'I thought I was going to die': Jailed Venezuelan activist details brutality of prison life The man who could become Canada's future PM 'Trump 2.0' looms large over the global economy A politician was shot dead in Bangkok. Did another country do it? Chris Mason: Is Starmer leaving the door open to an abuse inquiry? Delivering brand-new miracles in 1970s East End Watch the latest series of Call the Midwife on iPlayer now Mark-Anthony Turnage shares the soundtrack of his life Once called 'Britain’s hippest composer', he's tackled topics from drug abuse to football in his work Paddy’s loaf-changing experience inside the bread factory Paddy McGuinness visits the bread factory he used to work in, and sees how they make 1.4 million loaves a week What's behind the global surrogacy boom? More countries are banning surrogacy – but demand is growing © 2025 BBC. The BBC is not responsible for the content of external sites.Read about our approach to external linking."
Stolen dog found 300 miles from homeThe Pomeranian's owner had given up hope of ever finding her after she was taken more than a year ago.Wales,"Juan Mino was reunited with Kiara in Bangor more than a year after she was stolen from his garden in London An 11-year-old dog has been found nearly 300 miles from home more than a year after she was stolen. Pomeranian Kiara was taken from her garden in London in August 2017. But when two stray dogs wandered into Peter Daniel's house in Bangor, Gwynedd, he was able to find Kiara's owners Juan and Antoinette Mino via her microchip and reunite the family. Mrs Mino said she was ""so thankful"" her precious pooch had been found after she had given up hope. Mr Daniel said he spotted two dogs going through his bins on Saturday while he got ready to go to his work, before one of them - Kiara - walked into his house and made herself at home. Mourning dog waits for 80 days in road where owner died Dog trapped in engine during drive After he put out posts on lost dog groups on social media, Tess Jones volunteered to scan the dogs for microchips on Sunday - and while the other dog did not have one, Kiara's contained a phone number for her owners. ""They couldn't get their heads around it, I can't believe it myself,"" Mr Daniel said. ""While I was on the phone to the lady that owned the dog, her partner was getting in the car to drive the six or seven hours up here."" Kiara at home in London before she was stolen last year Co-operative worker Mr Daniel said when Mr Mino was reunited with Kiara, there was not a dry eye in the house. ""It was lovely,"" he said. ""I think we all shed a tear. Dogs are family members."" When Kiara was taken, Mr and Mrs Mino printed 500 lost dog posters, offered a reward and kept across lost dog agencies and councils. But after a year went by with two false alarms and no sign of Kiara, they gave up hope  - until this weekend. Finally reunited with her dog on Monday, Mrs Mino said she had spent more than a year haunted by thoughts of Kiara being abused or killed. ""I've just been crying for days, I am so thankful,"" she said. ""We are animal lovers and we have had dogs who have died before but with Kiara, we were always thinking 'what's happened to her? Was she ill-treated? Was she killed? Are they hitting her?' ""My husband was home when she was stolen and he always felt guilty. Peter Daniel with the other stray dog who he has now fostered ""It is so nice to have her back."" But alongside the celebrations, Kiara will need some tender loving care while she recovers. ""She came home in such a state, and she smells, apparently she was with another dog and they had been living rough for months."" Mrs Mino added Kiara's coat is in knots and she will have to be shaved by a vet, along with needing health checks and vaccinations. But Mr Daniel's life has also been changed after finding the dogs - as he is now fostering Kiara's stray friend with a view to permanently adopting the Jack Russell if its owners cannot be found. He described the weekend's events as a ""Christmas miracle"". Runaway dog found 400km from home The dogs stolen from their owners' homes On the case with the dog drone detectives. Video, 00:01:17On the case with the dog drone detectives Missing dog found after four years Wildfire sweeps through Hollywood Hills and threatens landmarks as chaos grips LA Paris Hilton among stars 'heartbroken' as she watches home 'burn to ground' Commuters warned of icy roads as cold snap continues to freeze UK Sound Of 2025: Ezra Collective are 'keeping music real' The Papers: 'Apocalypse' LA and 'Reeves faces extra tax rises' How Australia's beach cabana drama sparked a turf war H-1B: Visa row under Trump fuels anxiety for Indian dreamers 'I thought I was going to die': Jailed Venezuelan activist details brutality of prison life The man who could become Canada's future PM 'Trump 2.0' looms large over the global economy A politician was shot dead in Bangkok. Did another country do it? Chris Mason: Is Starmer leaving the door open to an abuse inquiry? Delivering brand-new miracles in 1970s East End Watch the latest series of Call the Midwife on iPlayer now Mark-Anthony Turnage shares the soundtrack of his life Once called 'Britain’s hippest composer', he's tackled topics from drug abuse to football in his work Paddy’s loaf-changing experience inside the bread factory Paddy McGuinness visits the bread factory he used to work in, and sees how they make 1.4 million loaves a week What's behind the global surrogacy boom? More countries are banning surrogacy – but demand is growing © 2025 BBC. The BBC is not responsible for the content of external sites.Read about our approach to external linking."
Three guilty of Nazi group membership,"Claudia Patatas and Adam Thomas named their baby Adolf out of ""admiration"" for Hitler A couple who named their baby after Adolf Hitler have been found guilty of being members of a banned terrorist group. Adam Thomas, 22, and Claudia Patatas, 38, from Banbury, along with Daniel Bogunovic, 27, from Leicester, were convicted of being in National Action. Birmingham Crown Court heard the couple gave their child the middle name Adolf in honour of the Nazi leader. Jurors saw images of Thomas in Ku Klux Klan robes while cradling his baby. The Neo-Nazi terrorist group National Action, founded in 2013, was outlawed under anti-terror legislation three years later after it celebratedthe murder of Labour MP Jo Cox. Prosecutors said the Midlands chapter of the group ""shed one skin for another"" and ""rebranded"" after being banned. They said the case was about ""a specific type of terror...born out of fanatical and tribal belief in white supremacy"". Thomas told the court that the pictures showing him wearing KKK clothing were ""just play"", but he admitted being a racist. Thomas was also found guilty of having a copy of terrorist manual the Anarchist Cookbook. Daniel Bogunovic, Adam Thomas and Claudia Patatas stayed in National Action after it was banned Thomas and Patatas had two machetes, one with a serrated 18in (46cm) blade, in the bedroom where their baby son slept. A police search of their home in January also found one of two crossbows just a few feet from the baby's crib, the jury was told. Also found was a pastry cutter shaped like a swastika in a kitchen drawer, as well as pendants, flags and clothing emblazoned with symbols of the Nazi-era SS and National Action. Nazi-themed goods on Amazon marketplace Is National Action a threat to the UK? National Action co-founder confronted by the BBC YouTube attacked over Neo-Nazi video Barnaby Jameson QC, prosecuting, said a deleted Skype log was recovered from Thomas's laptop. He said the messages sent between two parties spoke of National Action being ""destroyed"", with its leaders agreeing to disband with ""no attempt at revival"". The group was founded in 2013 by Ben Raymond, now 29, and Alex Davies, now 24 It was intended to be an explicitly neo-Nazi party Raymond was a politics graduate from the University of Essex, and Davies was a Welsh former member of the British National Party National Action shunned democratic politics, regarding itself instead as a youth-based street movement It is believed it never had more than 100 members Its activities involved leafleting university campuses, aggressive publicity stunts and city-centre demonstrations In 2015, 25-year-old member Zack Davies used a hammer and machete to attack a Sikh dentist and was jailed for attempted murder After the murder of Jo Cox in 2016, an official National Action Twitter account posted: ""Only 649 MPs to go #WhiteJihad"" The group was banned later that year after the government concluded it was ""concerned in terrorism"" It became the first far-right group to be proscribed in this country since World War Two Reading from the log, Mr Jameson said: ""But the Midlands branch of NA, which is just 17-20 of us, have decided to ignore this and we've renamed ourselves the Thule Combat League. ""Traitors. Midlands will continue the fight alone."" Jurors reached unanimous verdicts after 12 hours of deliberating. The three defendants will be sentenced on 14 December. Patatas was given bail, while Thomas and Bogunovic were remanded in custody. Earlier this year Darren Fletcher, 28, from Wolverhampton; Nathan Pryke, 27, from March, Cambridgeshire; and Joel Wilmore, 24, from Stockport; also pleaded guilty to being in National Action. Jurors were shown a picture showing Adam Thomas in the robes of the Ku Klux Klan A swastika-shaped pastry cutter was found in the home of Patatas and Thomas Det Ch Supt Matt Ward, from West Midlands Police, said the defendants ""were not simply racist fantasists; we now know they were a dangerous, well-structured organisation"". He added: ""Their aim was to spread neo-Nazi ideology by provoking a race war in the UK, and they had spent years acquiring the skills to carry this out. ""Unchecked, they would have inspired violence and spread hatred and fear across the West Midlands."" Home Secretary Sajid Javid said the convictions were a ""significant success"" for the police. He said: ""We are determined to tackle the threat presented by extreme right-wing terrorism, as we are all forms of terrorism, which is why this government banned National Action in 2016."" The new parents and the UK's neo-Nazi terror threat 'Nazi' accused admits being a racist 'Nazi' posed in 'KKK robes with baby' Neo-Nazi accused 'had Anarchist Cookbook' Crossbow 'found near baby Adolf's crib' Dad 'posed in KKK robes with baby Adolf' 'Neo-nazi' couple named baby after Hitler HM Courts & Tribunals Service UK's 'first automotive resort' in Oxfordshire town approved Plans for vacant trading estate to be used as car park near shopping centre Calls that 'national inquiry now needed' for Oxford grooming gangs Public invited to join meeting on Oxfordshire health services Boy threatens dad with bread knife after 12 years in foster care No need for public inquiry on Oxford grooming gang, says council Wildfire sweeps through Hollywood Hills and threatens landmarks as chaos grips LA Paris Hilton among stars 'heartbroken' as she watches home 'burn to ground' Commuters warned of icy roads as cold snap continues to freeze UK Sound Of 2025: Ezra Collective are 'keeping music real' The Papers: 'Apocalypse' LA and 'Reeves faces extra tax rises' How Australia's beach cabana drama sparked a turf war H-1B: Visa row under Trump fuels anxiety for Indian dreamers 'I thought I was going to die': Jailed Venezuelan activist details brutality of prison life The man who could become Canada's future PM 'Trump 2.0' looms large over the global economy A politician was shot dead in Bangkok. Did another country do it? Chris Mason: Is Starmer leaving the door open to an abuse inquiry? Delivering brand-new miracles in 1970s East End Watch the latest series of Call the Midwife on iPlayer now Mark-Anthony Turnage shares the soundtrack of his life Once called 'Britain’s hippest composer', he's tackled topics from drug abuse to football in his work Paddy’s loaf-changing experience inside the bread factory Paddy McGuinness visits the bread factory he used to work in, and sees how they make 1.4 million loaves a week What's behind the global surrogacy boom? More countries are banning surrogacy – but demand is growing © 2025 BBC. The BBC is not responsible for the content of external sites.Read about our approach to external linking."
