headline,article
Buying a home an 'unachievable dream' for many,"Alys Patosit has three jobs, but says buying a home is out of her family's reach. For many working parents in Wales, buying their own home is an ""unachievable dream,"" according to three charities. Nearly half the homeowners helped by the Help to Buy scheme in 2020-21 earned at least Â£40,000. The Joseph Rowntree Foundation said evidence suggested it was ""not helping people on lower incomes"". The Welsh government said a new phase of the scheme will help those ""who most need support"". Alys Patosit, 41, and her husband Pin, 48, live in Monmouthshire with their two children. Mrs Patosit works part-time as an administrative assistant and as a carer for the elderly, as well as running her own online business, but said her family might never be able to afford their own home, no matter how hard they work. ""Since returning to work after having my children, I have found myself working three jobs and still having to claim Universal Credit to make ends meet, leaving us with nothing to save for a deposit,"" she said. ""We dream of being able to afford a modest home in the area I grew up in, but we feel trapped in a cycle and having housing security feels impossible, sometimes it feels completely hopeless."" Dozens queue overnight to snap up new houses House sales and prices see early spring surge 5% deposit mortgage 'will help daughter's future' Help to Buy is a scheme which allows those eligible to buy a new-build property up to the value of Â£250,000 with help from the Welsh government by way of a shared equity loan. Since January 2014, 11,959 properties have been purchased using a Help to Buy loan in Wales. A recent official report on the scheme found that, over the last three years, the proportion of completed purchases by those on higher incomes had increased. ""During 2020-21, 49% of all homes purchased under the scheme were by those with an average household income of Â£40,000 to Â£60,000,"" saidthe report,external. ""In contrast, homes purchased by those with a household income of less than Â£20,000 have been decreasing annually and in 2020-21 accounted for only 2% of all completed purchases using the scheme."" Carmen Jackson, co-ordinator of Home-Start's Helping Working Families project across Monmouthshire, Blaenau Gwent and Caerphilly, said: ""Housing is an issue that comes up again and again with many of our families. ""Feelings are running high about the current housing situation. Many families feel that home ownership for their family is a completely unachievable dream. ""We have found in some regions, social housing stock is low, which creates demand for rentals, forcing up the prices of rentals which makes investors buying homes as buy-to-lets attractive and making home ownership unrealistic for all but the wealthiest."" She added that affordable housing seemed to be only affordable where both parents were working full-time on a good wage or have significant help from family. ""We are noticing the knock-on effects for families, with families either overstretching themselves to try to create better lives for their families or feeling hopeless because the dream is completely out of reach,"" she said. Eve (who did not want her surname published), her husband and three children bought a home through the Help to Buy scheme, but were disappointed. ""The government's idea of affordable and most working families' incomes don't match up,"" said Eve. ""We ended up buying a house that's really too small for our family and needs loads of work doing, that we can't afford to do, but we were desperate. ""Local rents are just too high, the stress was wearing us down."" Dr Steffan Evans, policy and research officer at the Bevan Foundation, said: ""There have long been questions about whether Help to Buy is a scheme that helps boost the availability of genuinely affordable housing. ""The latest evidence adds further weight to these concerns. Investing the funds in other programmes such as the Social Housing Grant, which funds the construction of new social housing, could prove to be far more effective use of Welsh government funds."" Rachel Casey of the Joseph Rowntree Foundation says support is not being given to the people who need it most Rachel Casey, policy and partnerships officer at the Joseph Rowntree Foundation, said: ""Even before coronavirus, around 700,000 people in Wales were trapped in poverty. Together with low wages and inadequate benefit levels, high private rents lock people in Wales in poverty. ""So it's not right that the majority of support in the housing market is currently being directed towards people who are not in poverty and who may already own their own homes. ""This evidence suggests that the Help to Buy scheme in Wales is not helping people on lower incomes to access home ownership, but instead supporting people on higher incomes. ""Across the UK, the stamp duty holiday policy is benefiting existing homeowners but making it much harder for renters to get on the property ladder."" Movers 'more likely to buy than first-time buyers' What does the chancellor's Budget mean for me? A Welsh government spokesperson said: ""We understand the difficulties first-time buyers face and the uncertainties in the jobs market as a result of the pandemic. ""Our Help to Buy Wales scheme plays an important role in helping people get onto the property ladder with three-quarters of the 12,000 homes already delivered through the programme going to first-time buyers. ""Phase 3 of Help to Buy Wales was launched last month and has been designed to ensure the scheme further benefits those who most need support in securing home ownership."" Dozens queue overnight to snap up new houses House sales and prices see early spring surge 5% deposit mortgage 'will help daughter's future' Average house price tops Â£200k in 'race for space' Help to Buy in Wales Fierce winds threaten more fire destruction as LA struggles to contain blazes UK has enough gas says No 10 after supply warning UK records coldest night of winter as snap to last into weekend What's the latest on the Los Angeles wildfires and what caused them? 'I paid fake doctor thousands for fillers - now I look like a gargoyle' Pop star Chappell Roan wins BBC Sound Of 2025 Weekly quiz: Zendaya looked happy but who else sparkled at the Golden Globes? Inside the UK's first legal drug consumption room What happened to Ryan Giggs' football coaching career? Danes struggle with response to Trump Greenland threat The '9/11 mastermind' wants to plead guilty. Why is the US trying to stop him? The Upbeat newsletter: Start your week on a high with uplifting stories delivered to your inbox Ed Gamble hosts the official Traitors podcast Join Ed Gamble and guests as they dissect the first episodes of The Traitors! Can art, music and words bind us in divided times? Simon Schama explores how artists have captured the transformations of British society since 1945 Enjoy a satirical smorgasbord of The News Quiz Digest a dramatic year of news as Andy Zaltzman revels in some of 2024's funniest moments The multi-award-winning legal drama returns Two years on, the Defoes are back and have gathered for a beautiful wedding in Barcelona Â© 2025 BBC. The BBC is not responsible for the content of external sites.Read about our approach to external linking."
LiveLiveNetanyahu says strikes to 'continue at full force'22 minutes ago22 minutes ago We're pausing our live coverageWe're pausing our live coverage30 minutes ago UK Prime Minister condemns megaphone anti-Semitism in LondonUK Prime Minister condemns megaphone anti-Semitism in London36 minutes ago Deadly collapse caused by attack on tunnels - IsraelDeadly collapse caused by attack on tunnels - Israel,"Israelâs prime minister, Benjamin Netanyahu, says its military operation against Hamas will continue ""with full force"" despite international calls for a ceasefire The Hamas-run Gaza Health Ministry says 188 Palestinians have died since Monday, and Israel has reported 10 dead Sunday marks the seventh day of elevated Israeli-Palestinian violence, the worst since 2014 More rockets have been fired from Gaza towards southern Israel. Israel says the concentration of rocket fire in the past week has been the highest ever The UN Security Council is holding an emergency meeting to discuss the hostilities UN Secretary-General Antonio Guterres has urged all parties to end the ""utterly appalling"" violence Israel says air strikes targeted the home of Hamas's leader in Gaza overnight Edited by Rebecca Seales We're now pausing our live coverage of the ongoing Israel-Gaza conflict - many thanks for staying with us. To recap, here are the key developments from the past 24 hours:  You can still get all the latest updates on this fast-moving storyon the BBC News website. Sunday's live coverage was brought to you by a team of journalists in London - Rebecca Seales, Paul Kirby and David Walker. Prime Minister Boris Johnson has condemned anti-Semitism targeting British Jews, after a video emerged of a convoy of cars brandishing Palestinian flags in North London, with anti-Semitic abuse apparently being shouted through a megaphone. London's Metropolitan Police said they were aware of the video, which appeared to be filmed in the St John's Wood area, which is home to a Jewish community. Allow Twitter content? This article contains content provided by Twitter. We ask for your permission before anything is loaded, as they may be using cookies and other technologies. You may want to readTwitterâs cookie policy,externalandprivacy policy,externalbefore accepting. To view this content chooseâaccept and continueâ. Opposition Labour leaderKeir Starmer said the incident was ""utterly disgusting"",external, tweeting that there had to be consequences: ""Antisemitism, misogyny and hate have no place on our streets or in our society."" The Jewish community's Community Security Trust said it was fully aware of ""appalling anti-Semitic intimidation and incitement from [a] âpro-Palestinianâ car convoy from Bradford"". The Mayor of LondonSadiq Khan has said he is deeply concerned,externalby reports of ""hateful, intimidating and racist language used on marches and social media"". ""Behaviour that incites anti-Jewish or anti-Muslim hatred has no place in our city,"" he said. We have more details on this story here. Nine police officers were hurt during big pro-Palestinian protests in central London yesterday. Protesters called for the UK government to ""stop allowing Israel's brutal violence"" against the Palestinians. Police said the demonstrations had been largely peaceful but projectiles had been thrown in ""small pockets of disorder"". Air raids have reduced buildings to rubble in Gaza Israel's military says the destruction of homes in Gaza City which killed 42 Palestinians was caused by an attack on a Hamas tunnel system. Several homes were reduced to rubble following an air strike early on Sunday. Israel said it had attacked a militant tunnel system which collapsed, bringing residential buildings down with it. It said the deaths were unintentional. Ten children were among the victims. Rescue workers combed through the debris of the buildings on Sunday recovering bodies. ""These are moments of horror that no-one can describe. Like
an earthquake hit the area,"" said Mahmoud Hmaid, who was helping the efforts. Paul AdamsBBC diplomatic correspondent in Jerusalem Is Israelâs military
operation in Gaza, dubbed âGuardian of the Wallsâ, nearing its conclusion? Not obviously. Benjamin
Netanyahu says attacks are continuing with âfull forceâ and will âtake timeâ. In a news conference this
afternoon, Israelâs prime minister admitted there were âpressuresâ but thanked
US President Joe Biden, in particular, for his support. Mr Netanyahu has so far resisted calls for a ceasefire with Hamas Mr Bidenâs envoy, Hady Amr, has been in Israel since Friday, discussing the crisis with Israeli officials. Unusually, at the end of a week that has also seen an alarming spate of inter-communal violence in mixed Jewish-Arab cities, he also met Israeli-Arab leaders. Since the US, like Israel and many other countries, regards Hamas as a terrorist organisation, Mr Amr will not be meeting one of the two warring parties. Any messages for Hamas will have to go through traditional interlocutors, like Egypt or Qatar. Local reports suggest Hamas has been offering some kind of ceasefire for several days, only to be rebuffed by Israel, which clearly wants to inflict as much damage as it can on the militants before the fighting is finally brought to a close. These episodes follow a familiar pattern: Israel presses home its undoubted military advantage until the international outcry over civilian casualties, and a deteriorating humanitarian situation in Gaza, demand that the operation end. In Israelâs estimation, we have not yet reached that point. Former Israeli Defense Minister Naftali Bennett has said it will be Israel, and not Hamas, that decides when the military operation is complete. Mr Bennett, who heads the right-wing party Yamina, told the BBC that all the casualties in the current conflict were down to Hamas's decision to start it. This video can not be played Naftali Bennett spoke to the BBC earlier on Sunday Israeli Prime Minister Benjamin Netanyahu has insisted that destroying the Jala high-rise block in Gaza yesterday was justified. He's given an interview with US network CBS in which he maintained there was ""an intelligence office for the Palestinian terrorist organisation housed in that building that plots and organises terror attacks against Israeli civilians, so it's a perfectly legitimate target"". The building housed crews from the Associated Press and Al-Jazeera, who were given an hour to leave before it was destroyed in an air strike. Mr Netanyahu confirmed Israeli reports that US officials had been given information about the attack. The building's landlord has denied it has any connection with Hamas. The Associated Press has asked Israel to present evidence. News agency Agence France Presse said earlier that its media colleagues would be moving into its offices in Gaza. This is the moment the tower block was brought down in yesterday's air strike. This video can not be played Gaza tower containing media offices collapses after Israeli strike The Palestinian foreign minister accused Israel of war crimes In a statement to the UN Security Council, Palestinian Foreign Minister
Riyad Al-Maliki denounced Israeli âaggressionâ, detailing attacks that had
destroyed families in the Gaza Strip. ""Israel keeps telling you 'put yourself
in our shoes', but Israel is not wearing shoes, it is wearing military boots,"" he
said. He asked how many victims were enough for the Security Council to
condemn what was going on. âWhat is the threshold for outrage?â Israelâs UN ambassador Gilad Erdan also appealed to the Security Council to
understand the Israeli response: ""This is not the first time that Hamas has
fired at Israeli civilians while hiding behind Palestinian civilians. But this time
it was different."" He said Hamas was seeking to seize power from the
Palestinian Authority of Mahmoud Abbas. ""There is never a justification for
terror,"" he said, accusing Hamas of inciting violence in Jerusalem. He was adamant that Israel was taking ""unparalleled steps"" to avoid civilian casualties. Jeremy BowenBBC Middle East editor The end games in the wars between Hamas and Israel have followed a pattern since Hamas seized control of Gaza in 2007. Foreign mediators have thrashed out a variety of ceasefires. That's what the Americans, Egyptians, the UN and others are trying to do now. For that to work, both sides need to be able to tell their people they've won. Hamas will want to say that it is the real protector of Palestinian rights, not just in Gaza but also in the occupied West Bank including Jerusalem. Israel will want to show its people that it has done serious damage to the Hamas infrastructure. A much used phrase is ""restore deterrence"". That means showing their enemies that hitting Israel will only bring pain and suffering. Both sides will struggle to find words for bereaved families or traumatised children. If you are just joining us, here are today's key developments in the Israel-Palestinian conflict: In a televised address, Israeli Prime Minister Benjamin Netanyahu has said the military operation against Hamas is ""continuing at full strength"", appearing to reject international attempts to arrange a ceasefire. ""Our campaign against the terrorist organisations is continuing with full force. We are acting now, for as long as necessary, to restore
calm and quiet to you, Israel's citizens. It will take time,"" he said. Mr Netanyahu added that Israel wanted to exact a price from the ""aggressor"" and to restore deterrence. He was speaking after a meeting of Israel's security cabinet which went on for several hours. Allow Twitter content? This article contains content provided by Twitter. We ask for your permission before anything is loaded, as they may be using cookies and other technologies. You may want to readTwitterâs cookie policy,externalandprivacy policy,externalbefore accepting. To view this content chooseâaccept and continueâ. More from the UN Security Council meeting currently taking place online. Secretary-General Antonio Guterres also said that the violence was a threat to the whole region. ""It has the potential to unleash an uncontainable security and humanitarian crisis and to further foster extremism, not only in the occupied Palestinian territory and Israel, but in the region as a whole,"" he said. UN Secretary-General Antonio Guterres In his opening remarks to the UN Security Council meeting, Secretary-General Antonio Guterres said the UN was ""actively engaging all sides towards an immediate ceasefire"". He described the violence as ""utterly appalling"" and said the fighting must stop immediately. Mr Guterres also called on all parties ""to allow mediation efforts to intensify and succeed"". UN Special Coordinator for the Middle East Peace Process, Tor Wennesland, told the online meeting that casualties on both sides were mounting and that the situation in Gaza was ""more dire by the day"". The UN was working tirelessly with all sides to restore calm, he said. Mr Wennesland said Gaza militants should stop firing rockets from civilians areas and Israeli authorities had to abide by international law, maintaining maximum restraint to spare civilians. The Israeli cities of Ashdod, Ashkelon and Beersheba have been hit by rocket fire from Gaza in the past hour. So far there have been no reports of major injuries but Israel's fire and rescue authority reports substantial damage to homes and cars, and to a synagogue in Ashkelon.  This is the scene of the synagogue, in a picture posted by Israel's fire and rescue services Earlier, Israel's military said more than 3,000 rockets had been fired from the Gaza Strip since the latest conflict began. Cars were hit in Ashdod and reports say a residential building under construction was also struck. This video was posted from the scene in Ashdod.  Allow Twitter content? This article contains content provided by Twitter. We ask for your permission before anything is loaded, as they may be using cookies and other technologies. You may want to readTwitterâs cookie policy,externalandprivacy policy,externalbefore accepting. To view this content chooseâaccept and continueâ. The UN Security Council is due to convene shortly to discuss the Israel-Palestinian conflict. The US - a long-time ally of Israel - blocked a meeting scheduled for Friday and has faced criticism for not doing enough to halt the violence. US President Joe Biden held phone calls on Saturday with Israeli Prime Minister Benjamin Netanyahu and Palestinian leader Mahmoud Abbas. In his talks with Netanyahu he underscored Israel's right to defend itself. The US Secretary for Israel-Palestinian Affairs, Hady Amr, held talks earlier with Defence Minister Benny Gantz and was due to meet Palestinian officials too. Hundreds of people have been attending funerals in Gaza, the West Bank and Israel for victims of the latest violence. In Gaza City, funerals were held for members of the al-Kulak family who died in an Israeli air strike earlier today. Funeral prayers are performed for a member of the al-Kulak family In the West Bank village of Saida, near the city of Tulkarem, mourners carried the body of Yaseen Hamad who was killed during clashes with Israeli troops near his village. The streets of Saida were filled with mourners for Yaseen Hamad's funeral Crowds gathered in the West Bank city of Hebron for the funeral of teenager Muhammad Yunus Freijat, who was also killed during clashes with Israel security forces. Muhammad Yunus Freijat was killed during a protest in Hebron Meanwhile in Israel, the funeral took place for Gershon Franco, 55, who died on Saturday when a rocket fired from Gaza landed in the Tel Aviv suburb of Ramat Gan. The rocket attack in Ramat Gan caused widespread damage Hamas and other Islamist militant groups in Gaza have a variety of weapons to deploy Israel says the past week has seen the highest ever rate of rocket attacks on its territory from Gaza. So just how much firepower does Hamas have there? Foreign affairs analyst Jonathan Marcus says estimating the militant group's stockpile of rockets is impossible, but it will include many thousands of projectiles of varying ranges. Some of the weaponry will have been smuggled in through tunnels from Egypt's Sinai peninsula but the bulk of it is believed to be manufactured inside the Gaza Strip itself. You can read more of Jonathan's analysis here. Differing reports are emerging about whether Israel is considering a ceasefire to halt the fighting. The Financial Times newspaper reports that the UN, Egypt and Qatar are working on a short ceasefire to enable fuel to reach Gaza's only power plant, citing two Western diplomats. Israeli officials believe the plant could run out as soon as tomorrow. However, Israeli media have quoted their own sources saying no ceasefire proposal was made or assessed when the country's security cabinet met for several hours earlier today. The Hamas-run health ministry in Gaza has updated its figures on the number of people killed in Israeli air strikes in the early hours of Sunday. It now says 33 people died. A spokesman said 12 women and 8 children were among them, and a further 50 people were wounded. Fourteen hours on, paramedics are still searching the rubble of collapsed buildings for potential survivors. A Palestinian father carries his injured daughter from the rubble of a destroyed house after an Israeli air strike in Gaza City This brings to 181 the number of deaths in Gaza since the conflict erupted a week ago. In Israel, officials say 10 people, including two children, have been killed by militant attacks. Several more rocket attacks have taken place on southern towns and cities today, but there are no details of casualties. This video can not be played The fighting between Israel and Hamas militants in Gaza is taking a brutal toll on people's everyday lives. Here families on both sides of the border tell of their fear amid the daily bombardment. Israel has seen the highest ever concentration of rocket attacks on its territory during the latest conflict with Hamas in Gaza, the military says. Major General Ori Gordin told reporters that since Monday, Hamas had fired about 3,000 rockets towards Israel. He said the rate of rocket launches surpassed previous attacks from Gaza and also from the 2006 war with Hezbollah in Lebanon. Â© 2025 BBC. The BBC is not responsible for the content of external sites.Read about our approach to external linking."
