headline,article
Clubs complain about Newcastle takeover,"This video can not be played 'It won't sink in for some time' - Football Focus discusses Newcastle takeover Top-flight clubs have complained to the Premier League after it cleared the £305m takeover of Newcastle by a Saudi Arabian-backed group. There is understood to be frustration from clubs about how the deal passed the owners' and directors' test. Concerns also arose as to why they were not kept informed after the surprise news emerged on Wednesday. Additionally, there are worries as to how Saudi Arabian owners will reflect on the league itself. There are many human rights issues linked to the kingdom. This video can not be played Newcastle co-owner Amanda Staveley speaks to BBC Sports Editor Dan Roan on day Saudi takeover was completed Clubs are demanding a meeting with the Premier League, which has previously said the takeover process would remain confidential. There is irritation with the Premier League board from all 19 other clubs, who are united in a view they should have been kept updated on an issue of such significance. The clubs also feel they should have been told what had changed to allow the deal to proceed before it was completed. When approving the takeover on Thursday, the Premier League said it has received legal assurances from the new owners that the Saudi state would not control Newcastle United and there would be punishments if it was proven otherwise. The takeover was 80% financed by Saudi Arabia's Public Investment Fund, whose chair is Crown Prince Mohammed bin Salman. Western intelligence agencies say he ordered the killing of journalist Jamal Khashoggi, an allegation Bin Salman denies. Following Thursday's takeover, Amanda Staveley, Newcastle's director, told BBC sports editor Dan Roan that PCP Capital took concerns over Saudi Arabia's human rights record ""very seriously"" but reiterated that their partner ""is not that Saudi state, it's PIF"". When asked if this was a case of 'sportswashing' by Saudi Arabia, she said: ""No, not at all, this is very much about the PIF's investment into a fantastic football team and we look forward to growing the club."" Our coverage of your Premier League club is bigger and better than ever before -follow your team and sign up for notificationsin the BBC Sport app to make sure you never miss a moment Premier League official site FA Cup: Build-up to two third-round ties, including Aston Villa v West Ham Moyes in talks with Everton over return to club Amorim cannot guarantee Mainoo's Man Utd future Dragons’ Den returns with a new line-up of celebrity guests Can a fresh batch of entrepreneurs secure the deal of a lifetime? Are humans the only animals that laugh? Marnie Chesterton delves into the science of laughter, live from the Hay Festival Winter Weekend A raucous 80s throwback horror comedy Three teens go on an epic quest for a cult VHS collection, only to get mixed up in a murder Hugh Bonneville narrates Sherlock Holmes’ greatest cases Fresh, atmospheric adaptations of Sir Arthur Conan Doyle’s classic crime mysteries England's decade-long quest to bring Women's Ashes home The Liverpool fan set to play at Anfield for Accrington 'My goodness!' Vata scores 'special' equaliser for Watford. Video'My goodness!' Vata scores 'special' equaliser for Watford Ryan Giggs - what happened? World Sports Photography Awards 2025 winner revealed Everton overcome Peterborough after Dyche sacking. VideoEverton overcome Peterborough after Dyche sacking How Amorim's tactics gave Man Utd hope after the 'storm' 'Dyche looked a beaten man - now Everton owners face huge decision' The qualifier using the Australian Open as 'fashion runway' Was Deschamps right to leave and will Zidane replace him? Is Potter the right fit for West Ham? 'This is Detroit's Super Bowl chance' - plus my Wildcard Weekend predictions Fantasy holes with lava fields - it's golf for the 21st Century How the man who signed Henry, Bale and Suarez is reshaping Toulouse How the role of a goalkeeper changed Can Djokovic win record 25th Grand Slam aged 37? 'Epic moment!' - 355lb Pierce interception tops NFL best plays. Video'Epic moment!' - 355lb Pierce interception tops NFL best plays Teenage kicks - what makes history-making Littler so good? Sporting highlights to look forward to in 2025 © 2025 BBC. The BBC is not responsible for the content of external sites.Read about our approach to external linking."
"The UK is Europe's Covid hotspot - does it matter?Winter is approaching with infection levels higher than elsewhere, so is the UK in trouble?Health","With the news dominated by other issues, it has gone almost unnoticed that the UK now has one of the highest rates of Covid infection in Europe. But, as winter fast approaches, how worried should we be? The rates certainly look troubling. Only a handful of countries, including Romania and Serbia, have higher infection levels than the UK. And compared with the big nations in western Europe, the numbers are significantly higher. There is a variety of reasons for this. The UK - or rather England - was the first nation in Europe to fully unlock when it ended most Covid restrictions on 19 July. It was not until late August that an EU country - Denmark - followed suit. Others, such as Norway, have only taken this step in recent weeks, while many have retained a significant number of measures, such as limits on large gatherings, Covid passports to enter bars and restaurants, social distancing and mandatory mask-wearing. For example, in Germany and Italy there are still restrictions on large crowds at events like football matches. And in a number of nations, such as Spain, social distancing remains in schools as does wearing masks from the age of six. So it is hardly surprising a virus that thrives on human contact has taken off in the UK compared with the rest of Europe. Another factor is vaccination. At the start of the year and into the spring, the UK was leading the way on vaccination. But not any more, with the likes of Spain, Portugal and France all having administered more doses per head of population. A big reason for this is that many nations have started vaccinating under-16s, whereas this is only just getting going in the UK. But when it comes to protecting people from serious illness - older people and those with health conditions - the UK has similar high levels of vaccine uptake. And that protection means the gap in the numbers dying is much smaller. There are currently just over 100 deaths a day on average linked to Covid. That may sound a lot, but it is similar to what happens in a bad flu season for months on end. Of course, death should not be the only measure. Every day there are about 700 people being admitted into hospital with Covid. For some, the road to recovery will be long and arduous. There is also then the risk of ""long Covid"" among those who have not become severely ill. The idea of persistent symptoms after a viral infection is not unique to Covid - it also happens with flu. But given we are still learning about Covid and it appears to happen more often, there are some who argue this warrants more action to contain spread. Prof Christina Pagel and Prof Martin McKee, both of whom are members of Independent Sage, a self-appointed group of experts which has been critical of the approach taken by the government,wrote in the Guardian,externalthis week about the benefits of the ""vaccine-plus"" approaches taken on mainland Europe. But extra measures do come with a cost, so for others it comes back to trade-offs. Prof Mike Tildesley, an expert in infectious disease modelling at the University of Warwick, believes there needs to be a debate about what is an ""acceptable"" level of Covid or we could find ourselves relying on extra measures long-term. ""Covid is here to stay - we need to discuss what we are willing to live with."" But it is not just where we are at, it's where we are heading that matters. There has always been variation in rates across Europe as a result of different approaches and being at different stages of the pandemic. The UK was hit by the more infectious variants Alpha and then Delta before other parts of Europe. Back in early spring, for example, the UK had one of the lowest rates in Europe because our Alpha wave had passed and Europe's was in full swing. With Covid the situation can change quickly. And as the chart on deaths above illustrates, this may already be happening. The UK death rate is falling - an achievement in itself given how open society is and a sign that the virus has been brought under some control. If nothing else really rapid surges in infection should be a thing of the past because of the amount of immunity in the population most experts agree. The epidemic here is largely being fuelled by high rates in teenagers - and, in particular, those under the age of 16 who have not had a chance to get vaccinated over the summer, unlike many of their peers elsewhere in Europe. Children are, of course, at very low risk of serious illness. So the concern has always been that infections in the young could spread into older age groups. But the early signs are that that is not happening - and the rise in children may have peaked. Prof Tildesley says he is ""cautiously optimistic"" about the data although he says it is quite possible rates in teenagers will remain high for a little while. When this wave in teenagers ends, through a combination of natural immunity and the vaccination programme that is clicking into gear, we could actually start to see a sustained fall in infections as winter approaches. That, after all, was always the argument the government and its senior scientists - Prof Chris Whitty and Sir Patrick Vallance - made when they decided to unlock on 19 July - that is was better to have our ""exit wave"" before winter really hit. Prof Neil Ferguson, one of the senior scientists advising ministers, said this week there was a lot of uncertainty about what would happen next, but a sustained decline from this point on was possible. ""It's not guaranteed we will see a winter wave,"" he told MPs on the All-Party Parliamentary Group on Coronavirus. But the problem, he said, was there was ""limited headroom"" in the NHS to cope with even a little surge. And that is one of the big risks with the government's approach. The NHS has, compared with other nations, much less capacity to absorb extra demand. And this winter that will not just come from Covid. Lockdowns and social distancing meant the traditional winter viruses were largely absent last year. That will have led to less immunity across the population, prompting fears they could rebound back in a big way. A virus called RSV, which can cause 30,000 admissions every winter among the under-fives - six times what we have seen so far in that age group from Covid - is already circulating at very high levels. The flu season is just beginning. It will not take much for the situation to unravel. Follow Nickon Twitter,external Read more from Nick NHS pressure would trigger Covid Plan B - minister UK coronavirus death toll passes 50,000 How many cases are there in your area? Which country has been hit hardest? Coronavirus: The lives lost in a single day Night-time curfew imposed in fire-hit areas of LA as police warn against 'despicable' looting 'I have nothing to go back to' - BBC reporter tells of LA fires heartbreak Trump avoids prison or fine in hush-money case sentencing LA fires: How three days of devastation unfolded What's the latest on the Los Angeles wildfires and what caused them? The '9/11 mastermind' wants to plead guilty. Why is the US trying to stop him? Pop star Chappell Roan wins BBC Sound Of 2025 Weekly quiz: Zendaya looked happy but who else sparkled at the Golden Globes? Inside the UK's first legal drug consumption room Sheen to fund new national theatre for Wales Danes struggle with response to Trump Greenland threat The Upbeat newsletter: Start your week on a high with uplifting stories delivered to your inbox Dragons’ Den returns with a new line-up of celebrity guests Can a fresh batch of entrepreneurs secure the deal of a lifetime? Are smart scales really as ‘smart’ as they claim to be? Greg Foot explores whether they can accurately measure weight, body fat, muscle and bone mass The award-winning psychological competition is back A nail-biting game of detection, backstabbing and trust. Who will make it through? How close are we to a cancer vaccine? How might it help in the treatment of the disease? © 2025 BBC. The BBC is not responsible for the content of external sites.Read about our approach to external linking."
James Bond actor gives fundraising dads £10k boostThree fathers doing a charity walk receive a donation from film star Daniel Craig as they set out.,"Mr Airey said he was happy the actor had allowed them to share details of his donation Film star Daniel Craig has donated £10,000 to three fathers who have set out on a 300-mile walk to raise funds for a suicide prevention charity after their daughters took their own lives. Andy Airey, Mike Palmer and Tim Owen's ""Three Dads Walking"" trek will see them walk between their homes in Cumbria, Greater Manchester and Norfolk. They are raising money for the Papyrus charity. They said the donation from the James Bond actor was ""amazing"". This video can not be played Three dads united by daughters' suicides take on challenge Mr Airey said he was happy that the actor had let them share the news of his generosity. ""Allowing us to shout about it is fantastic news, especially as he's just about the most famous film actor in the world at the moment, isn't he?"" he said. The trio, who set out earlier, will be walking about 20 miles a day between Mr Airey's home, near Cumbria, Mr Palmer's house in Sale, Greater Manchester, and Mr Owen's property in Shouldham, Norfolk. They expect to complete the challenge on 23 October. Mr Airey, whose 29-year-old daughter Sophie took her own life in 2018, said they had ""three different stories to tell, but each has the same tragic ending; the devastating loss of a daughter to suicide"". ""Daniel Craig has clearly been moved by the indescribable pain we and our families are suffering and wants to help us to bring something positive out of the utter devastation,"" he added. Mr Palmer, whose daughter Beth died in 2020, said being part of the challenge was ""not a club I want to belong to, but [it gives us] an opportunity to fight back and maybe make a difference. ""We hope that by linking our three homes and telling our three daughters' very different stories, we will put a spotlight on young mental health."" As well as fundraising, the trio want to raise awareness of the help and support available Mr Owen added that ""strongly"" believed that ""in a moment of darkness"", his 19-year-old daughter Emily ""made a wrong decision"" last year. ""Had she just taken time to think or to speak to someone, her decision and my family's lives would be on another path,"" he said. ""Instead, she decided she could no longer go on, leaving behind a devastating ripple effect on her family and friends."" If you're affected by the issues in this piece, you can find support fromBBC Action Line. Follow BBC North East & Cumbria onTwitter,external,Facebook,externalandInstagram,external. Send your story ideas tonortheastandcumbria@bbc.co.uk,external. The three dads united by their daughters' suicides. Video, 00:04:00The three dads united by their daughters' suicides Papyrus UK Cumbria police operation leads to reduction in antisocial behaviour 'Concerning' reports of children playing on frozen pond Plans for new urgent treatment centre at Cumberland Infirmary approved Ulverston event to celebrate Burns Night with alternative to traditional supper Tributes pour in for popular businessman and community stalwart Bryan Lloyd Gritters set off on 840-mile journey to treat icy roads in Cumbria Night-time curfew imposed in fire-hit areas of LA as police warn against 'despicable' looting 'I have nothing to go back to' - BBC reporter tells of LA fires heartbreak Trump avoids prison or fine in hush-money case sentencing LA fires: How three days of devastation unfolded What's the latest on the Los Angeles wildfires and what caused them? The '9/11 mastermind' wants to plead guilty. Why is the US trying to stop him? Pop star Chappell Roan wins BBC Sound Of 2025 Weekly quiz: Zendaya looked happy but who else sparkled at the Golden Globes? Inside the UK's first legal drug consumption room Sheen to fund new national theatre for Wales Danes struggle with response to Trump Greenland threat The Upbeat newsletter: Start your week on a high with uplifting stories delivered to your inbox Dragons’ Den returns with a new line-up of celebrity guests Can a fresh batch of entrepreneurs secure the deal of a lifetime? Are smart scales really as ‘smart’ as they claim to be? Greg Foot explores whether they can accurately measure weight, body fat, muscle and bone mass The award-winning psychological competition is back A nail-biting game of detection, backstabbing and trust. Who will make it through? How close are we to a cancer vaccine? How might it help in the treatment of the disease? © 2025 BBC. The BBC is not responsible for the content of external sites.Read about our approach to external linking."
Zahawi vows to tackle pupil absences 'head on',"The education secretary has vowed to tackle persistent pupil absences ""head on"", describing it as a ""key priority"". In a speech to head teachers on Saturday, Nadhim Zahawi said disadvantaged children lose out most from not being in school. Ahead of the spending review later this month, he pledged to invest ""record sums"" in children's education. It comes after the number of pupils in England absent for Covid-related reasons rose two-thirds in a fortnight. The latest government figures showed204,000 children - 2.5% of state school pupils in England - were out of school for this reason in the fortnight to 30 September. There are also concerns children may be missing lessonsbecause of mental health issues. Are schools back to normal? Not quite Nadhim Zahawi: Iraqi refugee to education secretary Speaking at the conference of the NAHT school leaders' union in London, Mr Zahawi said: ""Another key priority for me will be getting to the root of what is causing children to be persistently absent and then tackling it head on. ""Because the children who lose out the most from not being in school are likely to be the ones who can cope least - the vulnerable, the disadvantaged. You can't help them if they aren't there. ""For all these reasons, we will continue to invest record sums in our children's education."" He added that he would not give a ""running commentary"" on the spending review, but said he would ""not stop"" making the case for investing in children and young people. He also called for better understanding of and support for mental health issues. ""I want us to put wellbeing at the centre of everything we do in schools alongside a drive for rigorous standards and high performance. But, of course, we can't do this if children are not at school,"" he added. In response to the education secretary's comments, Paul Whiteman, NAHT's general secretary, said Mr Zahawi needed to match the ""passion and ambition"" of school leaders. ""The real test though, is what he is prepared to do immediately, to prise more investment from the Treasury in the comprehensive spending review, and then how he chooses to develop policy in the coming weeks and months,"" he said. Addressing the conference on Friday, Mr Whiteman said the government's goals for helping children catch-up after the pandemic needed to be more ambitious. ""Recovery implies a return to what we had before, which is simply not good enough,"" he added. In June,the government's schools catch-up tsar Sir Kevan Collins resigned, saying the £1.4bn in funding pledged to help pupils make up for lost learning fell ""far short of what is needed"". School Covid absences rise two-thirds in fortnight Parents warn of tsunami of school-anxiety cases Are schools back to normal? Not quite Who is Nadhim Zahawi? Night-time curfew imposed in fire-hit areas of LA as police warn against 'despicable' looting 'I have nothing to go back to' - BBC reporter tells of LA fires heartbreak Trump avoids prison or fine in hush-money case sentencing LA fires: How three days of devastation unfolded What's the latest on the Los Angeles wildfires and what caused them? The '9/11 mastermind' wants to plead guilty. Why is the US trying to stop him? Pop star Chappell Roan wins BBC Sound Of 2025 Weekly quiz: Zendaya looked happy but who else sparkled at the Golden Globes? Inside the UK's first legal drug consumption room Sheen to fund new national theatre for Wales Danes struggle with response to Trump Greenland threat The Upbeat newsletter: Start your week on a high with uplifting stories delivered to your inbox Dragons’ Den returns with a new line-up of celebrity guests Can a fresh batch of entrepreneurs secure the deal of a lifetime? Are smart scales really as ‘smart’ as they claim to be? Greg Foot explores whether they can accurately measure weight, body fat, muscle and bone mass The award-winning psychological competition is back A nail-biting game of detection, backstabbing and trust. Who will make it through? How close are we to a cancer vaccine? How might it help in the treatment of the disease? © 2025 BBC. The BBC is not responsible for the content of external sites.Read about our approach to external linking."
