headline,article
May snowfall brings disruption to Highlands,"A thick covering of snow at Errogie in the Highlands May snowfall has brought disruption to parts of Scotland, with the Highlands under a thick blanket of snow. The Met Office issued a yellow ""be aware"" warning as the unseasonal weather affected travel on key routes in the area. The southbound carriageway of the A9 at Daviot, south of Inverness, was blocked for a time by a fallen tree. This was later cleared but Traffic Scotland said snow continued to affect driving conditions. The A939 near Tomintoul in Moray was closed because a tanker was stuck in snow. Police said diversions would be in place while the road was closed. Snowy conditions at a polling station in the village of Farr, near Inverness. A chilly start to Thursday at Carrbridge in the Cairngorms There were some difficult driving conditions on roads in the Highlands The Met Office warning,external, in place until 11:00, covers parts of north, north east, central and south west Scotland. Forecasters said snow could accumulate to up to 3cm (1in) below 150m (492ft) and possibly 6cm (2in) over higher roads. Bear Scotland North West said it had seven gritters on the A9 between Drumochter and Inverness working to keep the road clear. A power cut affected the polling station at Gergask Primary School in Laggan, but Highland Council said the electricity supply was restored at 10:00. Allow Twitter content? This article contains content provided by Twitter. We ask for your permission before anything is loaded, as they may be using cookies and other technologies. You may want to readTwitterâs cookie policy,externalandprivacy policy,externalbefore accepting. To view this content chooseâaccept and continueâ. The Scottish Avalanche Information Service has said it will be issuing forecasts for this weekend following what it described as ""significant snowfall"" in Scotland's mountains. The service's season is usually wrapped up by mid-April. The cold and snowy start to May follows what is expected to have been a record month of frosts. Provisional data from the Met Office suggests it wasthe frostiest April for at least 60 years- with the lowest average minimum temperatures since 1922. The frostiest place of all was Aboyne in Aberdeenshire, which dropped below freezing on 25 different nights. The scene at Loch Morlich - the location of Britain's highest beach - near Aviemore in the Cairngorms Snowy at Bridge of Gaur in Perthshire A wintry scene at Drumgask in the Highlands A dusting of snow at Stow in the Scottish Borders âThey totally ignore usâ: Wick/Aberdeen refund delays are âunacceptableâ âThey totally ignore usâ: Wick/Aberdeen refund delays are âunacceptableâ Thurso woman 4 times limit given ârelatively substantialâ fine for drink-drive offence What did Highland shoppers make of these kidsâ business brainwaves? Council approve plans for âurgentâ repairs and improvements to former East Church turned Gaelic language and cultural centre Highland League hit by heavy snow as 7 of 9 matches fall St Giles Closure: Elgin Subway boss speaks out about the future of the shop in the town Deadly wildfires rage across LA as fierce winds threaten more destruction UK has enough gas, says No.10 after supply warning UK records coldest night of winter as freeze to last into weekend 'I paid fake doctor thousands for fillers - now I look like a gargoyle' The Papers: 'Lost Angeles' and 'Musk seeks plan to oust Starmer' Pop star Chappell Roan wins BBC Sound Of 2025 Weekly quiz: Zendaya looked happy but who else sparkled at the Golden Globes? The 20 child abuse inquiry proposals - what has happened so far? The '9/11 mastermind' wants to plead guilty. Why is the US trying to stop him? Why are UK borrowing costs rising and what does it mean for me? In maps: Thousands of acres on fire in LA Before and after: How wildfires tore through LA Ed Gamble hosts the official Traitors podcast Join Ed Gamble and guests as they dissect the first episodes of The Traitors! Can art, music and words bind us in divided times? Simon Schama explores how artists have captured the transformations of British society since 1945 Enjoy a satirical smorgasbord of The News Quiz Digest a dramatic year of news as Andy Zaltzman revels in some of 2024's funniest moments The multi-award-winning legal drama returns Two years on, the Defoes are back and have gathered for a beautiful wedding in Barcelona Â© 2025 BBC. The BBC is not responsible for the content of external sites.Read about our approach to external linking."
"Boy, 16, charged with murder of father of fourPolice believe James Gibbons was stabbed to death when he went to the aid of another man.","James Gibbons had just celebrated his two-year-old twin daughters' birthday A 16-year-old boy has been charged with the murder of a father of four who was stabbed to death in the street where he lived. James Gibbons, 34, was attacked at Iris Mews, Laindon, Basildon in Essex, at about 21:30 BST on Sunday. Police believe the self-employed plumber had gone to the aid of another man and died during an argument that followed. The teenager will appear at Chelmsford Magistrates' Court on Friday. Essex Police said it had arrested six teenagers as part of the investigation. A 13-year-old boy arrested on suspicion of murder and a 14-year-old boy held in connection with Mr Gibbons' death have been released on bail. Another 13-year-old boy has been released on bail in connection with an assault, while two girls, aged 15 and 16, arrested on suspicion of murder will not face charges, officers said. Flowers have been left near where James Gibbons was attacked Earlier on Sunday Mr Gibbons had celebrated his two-year-old twin daughters' birthday at home, his family said. In a statement released through Essex Police, they said: ""We are absolutely broken beyond belief at this pointless loss which has had a devastating effect on us all. ""James was the kind of person who would always be prepared to help anyone less fortunate than himself, which is what he was doing on Sunday night."" Find BBC News: East of England onFacebook,external,Instagram,externalandTwitter,external. If you have a story suggestion emaileastofenglandnews@bbc.co.uk,external HM Courts Service Two motorbikes recovered in Harwich after policing team work to find stolen vehicles Woman taken to hospital after being hit by car in serious south Essex crash Road blocked both ways with queueing traffic after crash on A120 near Colchester 'We will miss it terribly' say owners as popular pub hits the market for Â£595k Nearly Â£4k raised for St Helena Hospice after loved dad, 52, dies of rare cancer Thurrock Council races to spend Â£12m contributions from developers Deadly wildfires rage across LA as fierce winds threaten more destruction UK has enough gas, says No.10 after supply warning UK records coldest night of winter as freeze to last into weekend 'I paid fake doctor thousands for fillers - now I look like a gargoyle' The Papers: 'Lost Angeles' and 'Musk seeks plan to oust Starmer' Pop star Chappell Roan wins BBC Sound Of 2025 Weekly quiz: Zendaya looked happy but who else sparkled at the Golden Globes? The 20 child abuse inquiry proposals - what has happened so far? The '9/11 mastermind' wants to plead guilty. Why is the US trying to stop him? Why are UK borrowing costs rising and what does it mean for me? In maps: Thousands of acres on fire in LA Before and after: How wildfires tore through LA Ed Gamble hosts the official Traitors podcast Join Ed Gamble and guests as they dissect the first episodes of The Traitors! Can art, music and words bind us in divided times? Simon Schama explores how artists have captured the transformations of British society since 1945 Enjoy a satirical smorgasbord of The News Quiz Digest a dramatic year of news as Andy Zaltzman revels in some of 2024's funniest moments The multi-award-winning legal drama returns Two years on, the Defoes are back and have gathered for a beautiful wedding in Barcelona Â© 2025 BBC. The BBC is not responsible for the content of external sites.Read about our approach to external linking."
Dad stabbed while helping man a 'fantastic bloke',"James Gibbons had just celebrated his two-year-old twin daughters' birthday A 16-year-old boy has been charged with the murder of a father of four who was stabbed to death in the street where he lived. James Gibbons, 34, was attacked at Iris Mews, Laindon, Basildon in Essex, at about 21:30 BST on Sunday. Police believe the self-employed plumber had gone to the aid of another man and died during an argument that followed. The teenager will appear at Chelmsford Magistrates' Court on Friday. Essex Police said it had arrested six teenagers as part of the investigation. A 13-year-old boy arrested on suspicion of murder and a 14-year-old boy held in connection with Mr Gibbons' death have been released on bail. Another 13-year-old boy has been released on bail in connection with an assault, while two girls, aged 15 and 16, arrested on suspicion of murder will not face charges, officers said. Flowers have been left near where James Gibbons was attacked Earlier on Sunday Mr Gibbons had celebrated his two-year-old twin daughters' birthday at home, his family said. In a statement released through Essex Police, they said: ""We are absolutely broken beyond belief at this pointless loss which has had a devastating effect on us all. ""James was the kind of person who would always be prepared to help anyone less fortunate than himself, which is what he was doing on Sunday night."" Find BBC News: East of England onFacebook,external,Instagram,externalandTwitter,external. If you have a story suggestion emaileastofenglandnews@bbc.co.uk,external HM Courts Service Two motorbikes recovered in Harwich after policing team work to find stolen vehicles Woman taken to hospital after being hit by car in serious south Essex crash Road blocked both ways with queueing traffic after crash on A120 near Colchester 'We will miss it terribly' say owners as popular pub hits the market for Â£595k Nearly Â£4k raised for St Helena Hospice after loved dad, 52, dies of rare cancer Thurrock Council races to spend Â£12m contributions from developers Deadly wildfires rage across LA as fierce winds threaten more destruction UK has enough gas, says No.10 after supply warning UK records coldest night of winter as freeze to last into weekend 'I paid fake doctor thousands for fillers - now I look like a gargoyle' The Papers: 'Lost Angeles' and 'Musk seeks plan to oust Starmer' Pop star Chappell Roan wins BBC Sound Of 2025 Weekly quiz: Zendaya looked happy but who else sparkled at the Golden Globes? The 20 child abuse inquiry proposals - what has happened so far? The '9/11 mastermind' wants to plead guilty. Why is the US trying to stop him? Why are UK borrowing costs rising and what does it mean for me? In maps: Thousands of acres on fire in LA Before and after: How wildfires tore through LA Ed Gamble hosts the official Traitors podcast Join Ed Gamble and guests as they dissect the first episodes of The Traitors! Can art, music and words bind us in divided times? Simon Schama explores how artists have captured the transformations of British society since 1945 Enjoy a satirical smorgasbord of The News Quiz Digest a dramatic year of news as Andy Zaltzman revels in some of 2024's funniest moments The multi-award-winning legal drama returns Two years on, the Defoes are back and have gathered for a beautiful wedding in Barcelona Â© 2025 BBC. The BBC is not responsible for the content of external sites.Read about our approach to external linking."
At least 25 killed in Rio de Janeiro shootout,"This video can not be played Aerial footage shows suspects of a wanted drug gang trying to escape police At least 25 people including a police officer have been killed in a shootout in Rio de Janeiro, according to local media. The shootout took place during a police operation in a favela in the Jacarezinho area of the city. Police launched the operation after receiving reports that drug traffickers were recruiting children for their gang. Two passengers on a metro train were hit by bullets but survived. Police in the Brazilian city confirmed the death of one of their officers, Inspector Andre Leonardo de Mello Frias. A statement on Facebook said""he honoured the profession he loved and will be missed"".,external Police Chief Ronaldo Oliveira told Reuters news agency that Thursday's raid was ""the largest number of deaths in a police operation in Rio"". From 2019: A 'policy of massacre' in Rio's favelas? Listen to the documentary Lethal force in Rio's favelas Brazil's racial reckoning: 'Black lives matter here, too' According to local news, the gang targeted in this raid engages in drug trafficking, mugging, murders and kidnappings. Television images showed suspects trying to escape across rooftops as police entered the favela. Civil Police showed off weapons and drugs seized during the raid Meanwhile, residents of Jacarezinho have shared accounts of what they witnessed on social media. One resident posted a photo of his blood-covered floor and said two people had died in his house as police chased the criminals. The man, who did not want to give his name, said he would try to move out of the area as soon as possible. ""We're trying to sell the house as fast as possible, we can't continue to live here,"" he said. Other residents said officers had seized their phones, accusing them of warning gang members of the raid. Sociology professor Ignacio Cano from the Laboratory for the Analysis of Violence at Rio State University dismissed the reasons the police gave for the raid: ""To say that drug traffickers recruit children and teenagers to deal drugs is almost laughable because everyone knows that these gangs have minors who work for them. ""To say that you're going to launch a massive raid because you've discovered that traffickers recruit children is a joke,"" he told O Dia newspaper. Rio de Janeiro is one of Brazil's most violent states Rio de Janeiro is one of Brazil's most violent states and vast areas are under the control of criminals, many of them linked to powerful drug-trafficking gangs. Security forces in Brazil have often been accused of excessive use of force against the civilian population during anti-crime operations in major cities. A court ruling last June restricted police action in poor neighbourhoods of Rio during the pandemic unless it was deemed essential. Rio de Janeiro is the city with the biggest percentage of people living in shanty towns in Brazil - 22%. It's a population of 1,3 million, 70% of which are black. Analysis by Camilla Motta, BBC Brasil reporter, Sao Paulo Police operations targeting favelas controlled by drug traffickers are quite common in Rio. This, however, is the deadliest operation since 2016. Since a court ruling last June restricted police action in poor neighbourhoods in Rio, the number of deaths in shootouts in favelas has fallen. In the first month alone, deaths plummeted 70% when compared to the average recorded since 2007, according to the research group Grupo de Estudos dos Novos Ilegalismos, from Universidade Federal Fluminense. The drop was not followed by a rise in crime. In fact, property crimes were down by 40% and homicides by 48%. Researchers argue this shows that police operations are not the best strategy to tackle crime. Five people a day killed by Rio police in 2019 One of world's biggest arms traffickers recaptured Deadly wildfires rage across LA as fierce winds threaten more destruction UK has enough gas, says No.10 after supply warning UK records coldest night of winter as freeze to last into weekend 'I paid fake doctor thousands for fillers - now I look like a gargoyle' The Papers: 'Lost Angeles' and 'Musk seeks plan to oust Starmer' Pop star Chappell Roan wins BBC Sound Of 2025 Weekly quiz: Zendaya looked happy but who else sparkled at the Golden Globes? The 20 child abuse inquiry proposals - what has happened so far? The '9/11 mastermind' wants to plead guilty. Why is the US trying to stop him? Why are UK borrowing costs rising and what does it mean for me? In maps: Thousands of acres on fire in LA Before and after: How wildfires tore through LA Ed Gamble hosts the official Traitors podcast Join Ed Gamble and guests as they dissect the first episodes of The Traitors! Can art, music and words bind us in divided times? Simon Schama explores how artists have captured the transformations of British society since 1945 Enjoy a satirical smorgasbord of The News Quiz Digest a dramatic year of news as Andy Zaltzman revels in some of 2024's funniest moments The multi-award-winning legal drama returns Two years on, the Defoes are back and have gathered for a beautiful wedding in Barcelona Â© 2025 BBC. The BBC is not responsible for the content of external sites.Read about our approach to external linking."
EU willing to discuss waiving vaccine patents,"Germany has voiced opposition to a US-backed proposal to waive patents on Covid-19 vaccines, saying they were not hindering production of the jabs. Its government said ""the protection of intellectual property is a source of innovation and must remain so"". The European Union earlier said it was ready to talk about the proposal, and some states gave it their full backing. Supporters of the plan say it will allow more manufactures to produce the life-saving vaccines. They argue that this will increase access to jabs in poorer countries. But opponents, including drug makers, say it may not have the desired effect. Could lifting patents mean Covid vaccines for all? How will we know Covid vaccines are safe? Covid map: Where are cases the highest? The idea was originally proposed by India and South Africa, who have been leading a group of about 60 countries at the World Trade Organization (WTO) -an intergovernmental body that promotes global commerce. The group is pushing for the temporary removal of intellectual property protections on vaccines. The proposal was met with strong opposition from the previous US administration of Donald Trump, as well as the UK and the EU. But it gained momentum this week afterthe US backed it. WTO head Ngozi Okonjo-Iweala told the BBC's Newshour programme that she welcomed US support for the waiver. She said members should negotiate a pragmatic agreement over vaccine production because the current inequity was ""not right"". Ms Okonjo-Iweala acknowledged the shortage of raw materials and technical expertise required on the ground, but said they would need to start somewhere to boost global supplies. Meanwhile in Germany, Health Minister Jens Spahn said the country would allow the AstraZeneca vaccine to be administered to all adults, reversing aprevious decision to restrict the shot to people over the age of 60 because of concerns over rare blood clotsseen in a tiny number of recipients.Â In a statement on Thursday, the German government said the US-backed proposal would have ""significant implications for vaccine production as a whole"". ""The limiting factors in the production of vaccines are the production capacities and the high quality standards and not patents,"" it said, adding that pharmaceutical companies were already working with partners to ramp up manufacturing. Germany is the EU's biggest economic power and home to a major pharmaceutical sector, including BioNTech which developed one of the most widely-used coronavirus vaccines. The remarks by the German government came after European Commission President Ursula von der Leyen said the bloc was ""ready to discuss"" the proposal on waiving patents. Ms von der Leyen has previously spoken about her opposition to lifting intellectual property rights, telling the New York Times just weeks ago that she was ""not at all a friend of releasing patents"". Ursula von der Leyen said the EU was ""ready to discuss any proposals that address the crisis in an effective and pragmatic manner"" Meanwhile, officials in other member states such as France and Italy gave the proposal their full backing. The issue is reportedly set to be on the agenda at a two-day EU meeting this week. Outside of the EU, Russian President Vladimir Putin said he supported the idea of a waiver. The UK government said it was ""working with WTO members to resolve this issue"" and was ""in discussions with the US and WTO members to facilitate increased production and supply of Covid-19 vaccines"". Intellectual property describes creations, such as inventions, which are protected by patents, copyrights and trademarks. These prevent copying and allow the originator to be financially rewarded. Patents give innovating firms a short-term monopoly on production to cover the costs of development and encourage investment. Biotech firms argue that such protection has provided incentives to produce Covid vaccines in record times. Many developing countries have argued that rules requiring countries to protect patents and other forms of intellectual property are an obstacle to increasing the production of vaccines and other products needed to tackle the pandemic. Calls for a vaccine patent waiver come as lower income countries face acute vaccine shortages. This video can not be played How to tell a Covid-19 vaccine sceptic the facts But opponents, particularly from the industry, have said it will not solve the problem. The head of the International Federation of Pharmaceutical Manufacturers and Associations, Thomas Cueni, told the BBC's Today programme he was ""deeply concerned"" that ""you could compromise the quality and safety of vaccines which we see now"". ""It is shortages and scarcity in the supply chains, which need to be addressed. And it is also right now the disappointing unwillingness of rich countries to early share doses with the poor countries,"" he said. Some experts say pharmaceutical companies would also need to share know-how, such as production techniques, with poorer countries to have any real beneficial effect. Nobody is protected until everyone's protected: on that world and business leaders are agreed. But pharmaceutical companies have called the decision by the US to back the sharing of secret recipes for vaccinations shortsighted, claiming it is understanding the production process that is the real challenge. It is, they say, akin to handing out a recipe without sharing the method or the ingredients, and could lead to quality issues and less efficient production Instead, the UK and the EU have favoured a system of licensing, whereby knowhow is shared and there is more oversight. It is already being done on some cases on a voluntary basis - such as the tie up between Oxford-AstraZeneca and the Serum Institute of India. And that licensing can be made compulsory, although the pharmaceutical companies could then be eligible for compensation. Some trade specialists have speculated that the US might be hoping that, by backing a lifting of patents, manufacturers might be more open to sharing expertise voluntarily - or at least, for a reduced charge. Vaccine makers 'should work with poorer countries' Where are cases the highest? The Americans hesitant about the Covid vaccine. Video, 00:05:17The Americans hesitant about the Covid vaccine Deadly wildfires rage across LA as fierce winds threaten more destruction UK has enough gas, says No.10 after supply warning UK records coldest night of winter as freeze to last into weekend 'I paid fake doctor thousands for fillers - now I look like a gargoyle' The Papers: 'Lost Angeles' and 'Musk seeks plan to oust Starmer' Pop star Chappell Roan wins BBC Sound Of 2025 Weekly quiz: Zendaya looked happy but who else sparkled at the Golden Globes? The 20 child abuse inquiry proposals - what has happened so far? The '9/11 mastermind' wants to plead guilty. Why is the US trying to stop him? Why are UK borrowing costs rising and what does it mean for me? In maps: Thousands of acres on fire in LA Before and after: How wildfires tore through LA Ed Gamble hosts the official Traitors podcast Join Ed Gamble and guests as they dissect the first episodes of The Traitors! Can art, music and words bind us in divided times? Simon Schama explores how artists have captured the transformations of British society since 1945 Enjoy a satirical smorgasbord of The News Quiz Digest a dramatic year of news as Andy Zaltzman revels in some of 2024's funniest moments The multi-award-winning legal drama returns Two years on, the Defoes are back and have gathered for a beautiful wedding in Barcelona Â© 2025 BBC. The BBC is not responsible for the content of external sites.Read about our approach to external linking."
