headline,article
Dutch police break up anti-lockdown protest,"This video can not be played Protesters used umbrellas to shield themselves from water cannon Police in the Netherlands have used water cannon to clear anti-government demonstrators from a park in The Hague. Some 2,000 demonstrators rallied in the centre of the city to protest against Covid-19 restrictions and other government policies. Mounted officers as well as riot police with batons and dogs moved in after some of the protesters refused to leave at the end of the demonstration. The protests come a day before voting begins in a general election. The vote is taking place over three days to avoid congestion that would risk spreading coronavirus at polling stations. How are European countries tackling the pandemic? What Europeans have learned from a year of Covid The authorities had set a limit of 200 people for the protest at the Malieveld area near the city's central station and not far the Dutch parliament, but police said that number had been exceeded. Train services to the city were halted for a while to prevent more people from joining the demonstration. Police have arrested several people, according to local media. Protesters are opposed to the government's anti-Covid measures One video, widely shared on social media, appeared to show officers hitting a man on the ground with their truncheons. Police said he had attacked them with a stick, says the BBC's Anna Holligan in The Hague. Dutch police later said a warning shot had been fired as officers cleared away the demonstrators. A statement said the incident was being investigated. ""There might be a virus, but the shutdown of the total society is not proportional,"" protester Michel Koot, 68, told the AFP news agency. ""I see that a lot of our rights are easily taken away and the majority of the people don't even notice, but there's a lot going on. So I'm concerned for my grandchildren."" A night-time curfew - from 21:00 (20:00 GMT) to 04:30 - imposed in January led to rioting in several Dutch cities. The Netherlands had not seen a curfew since the Nazi occupation in World War Two. It is expected to remain in place till the end of March. Bars and restaurants remain closed, along with non-essential shops. Gatherings of more than two people are banned. The Netherlands has had more than 1.1 million confirmed Covid cases since the start of the outbreak, with more than 16,000 deaths, according to data collated by Johns Hopkins University in the US. Water cannon on Hague protesters. Video, 00:00:58Water cannon on Hague protesters How are Covid rules changing in Europe? What Europeans have learned from a year of Covid Dutch crisis as court orders end to Covid curfew Curfew riots rage for third night in Netherlands Deadly wildfires rage across LA as fierce winds threaten more destruction What's the latest on the LA fires, and why can't they be put out? Danes struggle with response to Trump Greenland threat 'I paid fake doctor thousands for fillers - now I look like a gargoyle' The Papers: 'Lost Angeles' and 'Musk seeks plan to oust Starmer' Pop star Chappell Roan wins BBC Sound Of 2025 Weekly quiz: Zendaya looked happy but who else sparkled at the Golden Globes? The 20 child abuse inquiry proposals - what has happened so far? The '9/11 mastermind' wants to plead guilty. Why is the US trying to stop him? Why are UK borrowing costs rising and what does it mean for me? In maps: Thousands of acres on fire in LA Before and after: How wildfires tore through LA Ed Gamble hosts the official Traitors podcast Join Ed Gamble and guests as they dissect the first episodes of The Traitors! Can art, music and words bind us in divided times? Simon Schama explores how artists have captured the transformations of British society since 1945 Enjoy a satirical smorgasbord of The News Quiz Digest a dramatic year of news as Andy Zaltzman revels in some of 2024's funniest moments The multi-award-winning legal drama returns Two years on, the Defoes are back and have gathered for a beautiful wedding in Barcelona © 2025 BBC. The BBC is not responsible for the content of external sites.Read about our approach to external linking."
"Early Grammys go to Beyoncé, Gaga and Billie Eilish","Beyonce, Lady Gaga and Billie Eilish were among the early winners Beyoncé has picked up her 25th and 26th Grammy Awards, as ""music's biggest night"" kicks off in Los Angeles. The star won best music video for Brown Skin Girl and best rap performance for her duet with Megan Thee Stallion, Savage (Remix). Billie Eilish, who dominated last year's awards, also won a prize for her Bond theme, No Time To Die. Lady Gaga and Ariana Grande's Rain On Me became the first female duet to win best the best pop duo category. The stars beat Korean pop group BTS in to the prize. The seven-piece boyband had hoped to be the first K-Pop act to win a Grammy with their hit single, Dynamite. Grammys 2021: In pictures Harry Styles and Billie Eilish kick off the Grammys Grammys 2021: Seven things to look out for Grammys 2021: Beyoncé and Dua Lipa lead nominations Grammy Awards 2021: Winners and nominees The awards were announced online ahead of the main Grammys ceremony on Sunday night, which is expected to be a hybrid of live and pre-taped performances. Host Trevor Noah said the show would be different to the usual event, where music's biggest stars congregate at Los Angeles' Staples Center, but promised a night of spectacular entertainment. ""They have figured out how to make an awards show for the time as opposed to trying to crowbar an awards show into it,"" he said last week. ""It's not Zoom, it's not pandemic-y... The bands are sort of going to be performing for each other."" Beyoncé had the most nominations going into the ceremony - with nine in total. If she wins two more, she will overtake bluegrass singer Alison Krauss as the most-awarded woman in Grammy history. Beyonce's Grammy success added to an already record-breaking career Taylor Swift and Dua Lipa both have six nominations each, alongside rapper Roddy Ricch. British star Harry Styles will open the ceremony, with other performances due from BTS, Taylor Swift, Cardi B, Megan Thee Stallion and Chris Martin of Coldplay. The early pre-ceremony raced through dozens of genre categories - from world music to rap and bluegrass - as well as some of the more esoteric awards, like best packaging (which went to rock supergroup The Desert Sessions for their album Vols 11 & 12). Megan Thee Stallion's win in the best rap category could make her a strong contender for song of the year Kanye West took the Grammy for his gospel album Jesus is King, while John Prine won two posthumous awards for his song I Love Life. The star, who died last April of Covid-19, was honoured with best American roots performance and American roots song. Nigerian stars Burna Boy and Wizkid win Grammys Bruce Springsteen leads tributes to John Prine The Grammy nominee making music in his childhood bedroom London-born musician Jacob Collier made Grammy history by becoming the first British artist ever to win a prize for each of his first four albums. The 26-year-old, who is also up for album of the year at the main ceremony, won the best arrangement for his track He Won't Hold You. Nigeria's Burna Boy won the best global music album for Twice As Tall album; while his fellow countryman Wizkid shared the award for best music video with Beyonce and her daughter Blue Ivy. In the rock categories, The Strokes picked up best album for The New Abnormal; and Fiona Apple's Fetch The Bolt Cutters took home best alternative album. The award show is taking place against the backdrop of controversy surrounding its voting procedures. Canadian superstar The Weeknd said he will boycott the awards in future due to what he described as the ""secret committees"" that vote for the winners. He was a surprise snub at this year's ceremony despite having one of 2020's biggest-selling albums. Follow us onFacebook,external, or on Twitter@BBCNewsEnts,external. If you have a story suggestion emailentertainment.news@bbc.co.uk,external. Grammys 2021: Seven things to look out for Grammys 2021: Beyoncé and Dua Lipa lead nominations Nigerian stars Burna Boy and Wizkid win Grammys Grammy Awards 2021: Winners and nominees Deadly wildfires rage across LA as fierce winds threaten more destruction What's the latest on the LA fires, and why can't they be put out? Danes struggle with response to Trump Greenland threat 'I paid fake doctor thousands for fillers - now I look like a gargoyle' The Papers: 'Lost Angeles' and 'Musk seeks plan to oust Starmer' Pop star Chappell Roan wins BBC Sound Of 2025 Weekly quiz: Zendaya looked happy but who else sparkled at the Golden Globes? The 20 child abuse inquiry proposals - what has happened so far? The '9/11 mastermind' wants to plead guilty. Why is the US trying to stop him? Why are UK borrowing costs rising and what does it mean for me? In maps: Thousands of acres on fire in LA Before and after: How wildfires tore through LA Ed Gamble hosts the official Traitors podcast Join Ed Gamble and guests as they dissect the first episodes of The Traitors! Can art, music and words bind us in divided times? Simon Schama explores how artists have captured the transformations of British society since 1945 Enjoy a satirical smorgasbord of The News Quiz Digest a dramatic year of news as Andy Zaltzman revels in some of 2024's funniest moments The multi-award-winning legal drama returns Two years on, the Defoes are back and have gathered for a beautiful wedding in Barcelona © 2025 BBC. The BBC is not responsible for the content of external sites.Read about our approach to external linking."
BA plans app-based Covid travel pass,"British Airways is planning to make it easier for passengers to prove they are safe to travel once they have been vaccinated against Covid. Under the plans, people who have had both jabs will be able to register their status on BA's smartphone app. The airline's chief executive, Sean Doyle, hailed the UK's ""great progress"" in tackling the pandemic. Last month, BA ownerIAG called for digital health passes""to reopen our skies safely"". IAG's boss, Luis Gallego, said at the time that the airline group wanted international common testing standards for travel. The UK government has said it will give the go-ahead for a return to international travel on 17 May at the earliest. The announcement prompted a flood of bookings, but it remains unclear which routes will be available. BA's move comes amid heated debate about the possibility that ""vaccine passports"" could become a feature of foreign travel and even be used within the UK to allow entry to places such as pubs or sports stadiums. Will I need a vaccine passport? In his latest comments to journalists, BA's Mr Doyle said the UK should be a global leader in reopening international travel. He urged the government to ""set an example"" and ""be ambitious"" in developing systems, including the use of digital technology to verify the vaccination and test status of passengers. ""We're making great progress in Britain in dealing with the pandemic,"" he said, pointing to the Oxford-AstraZeneca vaccine and the success of the UK's vaccination programme. ""It's fair to say that Britain has developed a really strong leadership position in coming out the other end of the pandemic,"" he said. ""What we want to make sure is that we also take that leadership position into restoring travel and restoring the economy."" In another incentive for passengers, BA said it had already reintroduced free water and snacks on short-haul economy flights and that this policy would continue. In another development, rival airline Virgin Atlantic has said it is close to finalising a £160m financing package to tide it over until travel restrictions are lifted. The money is coming from loans made by existing shareholders, including the Virgin Group and US airline Delta. A Virgin Atlantic spokesperson said: ""We continue to bolster our balance sheet in anticipation of the lifting of international travel restrictions during the second quarter of 2021. ""This latest £160m financing provides further resilience against a slower revenue recovery in 2021 and follows a $230m financing on two Boeing 787s in January, which allowed us to pay down debt and strengthen our cash position. ""We remain confident that Virgin Atlantic will emerge a sustainably profitable airline and would like to thank our creditors and shareholders, Virgin Group and Delta, for their ongoing support and unwavering belief in our future."" HOLIDAYS:When can I go on holiday abroad or in the UK? LOCKDOWN RULES:What are they and when will they end? JOBS:How will I be kept safe at work? GLOBAL SPREAD:How many worldwide cases are there? QUARANTINE:Will I need to self-isolate in a hotel? BA owner calls for health passes 'to reopen skies' Heathrow passenger numbers fall to 1970s' levels Airlines' Covid travel pass ready 'within weeks' Holiday bookings surge on lockdown exit plans Comments can not be loaded To load Comments you need to enable JavaScript in your browser Deadly wildfires rage across LA as fierce winds threaten more destruction What's the latest on the LA fires, and why can't they be put out? Danes struggle with response to Trump Greenland threat 'I paid fake doctor thousands for fillers - now I look like a gargoyle' The Papers: 'Lost Angeles' and 'Musk seeks plan to oust Starmer' Pop star Chappell Roan wins BBC Sound Of 2025 Weekly quiz: Zendaya looked happy but who else sparkled at the Golden Globes? The 20 child abuse inquiry proposals - what has happened so far? The '9/11 mastermind' wants to plead guilty. Why is the US trying to stop him? Why are UK borrowing costs rising and what does it mean for me? In maps: Thousands of acres on fire in LA Before and after: How wildfires tore through LA Ed Gamble hosts the official Traitors podcast Join Ed Gamble and guests as they dissect the first episodes of The Traitors! Can art, music and words bind us in divided times? Simon Schama explores how artists have captured the transformations of British society since 1945 Enjoy a satirical smorgasbord of The News Quiz Digest a dramatic year of news as Andy Zaltzman revels in some of 2024's funniest moments The multi-award-winning legal drama returns Two years on, the Defoes are back and have gathered for a beautiful wedding in Barcelona © 2025 BBC. The BBC is not responsible for the content of external sites.Read about our approach to external linking."
"Call for all homes to be minutes from green spaceOne in eight households did not have access to a garden, yard or balcony in lockdown, figures show.Wales","The grounds of Cardiff Castle were opened for socially distanced picnics last summer Cities, towns and villages must be redesigned to improve access to nature in the aftermath of the Covid-19 pandemic, campaigners have said. The future generations commissioner wants everyone to have a public green space within four minute's walk. During the first lockdown one in eight households in Wales did not have access to a garden, yard or balcony, official statistics show. The Welsh government has committed £110m to transforming towns in Wales. Planning experts and designers said the pandemic was a ""profound opportunity"" to rethink communities to tackle climate change and health issues. Ideas include planting trees, more cycle routes, reopening disused railway lines, creating ""pocket"" parks, and a campaign to create neighbourhoods where everything needed is within a 20-minute walk. Sophie Howe said access to green spaces should be a right for everyone Future generations commissioner Sophie Howe said public green spaces had been a ""lifeline"" for many during lockdowns and were vital for physical and mental health. Ms Howe wants to see changes to towns, cities and villages, to make sure no-one in Wales lives more than four minutes' walk - about 330yds or 300m - from a public green space. She said people who did not have a garden were reliant on being able to access open public spaces - but many had struggled to do that due to travel restrictions. ""It shouldn't be based on where you live, and the price of your house, it should be a right for everyone,"" said Ms Howe. The Welsh Government said its local places nature fund had created more than 400 wildlife gardens in and around residential areas in the past year. Some people set up ""fairy homes"" in woods during the first lockdown It is almost a year since Wales was first placed under lockdown, with people only allowed to leave home for essential reasons, including to exercise. While about a fifth of Wales is covered by national parks, the mountains and coastlines have been off-limits during lockdowns to all but those who live on their doorsteps. How much of the country do parks, fields and public gardens make up (not including National Parks)? 10,000 areasof accessible public green spaces, such as parks, fields and gardens Less than 1%of Wales is made up of publically accessible green space 432.22 metresaverage distance people live from a public park or garden 3.61public green spaces on average in a 1,000m radius of homes At the start of the first lockdown, official figures showed 133,542 Welsh households did not have access to a private outdoor space. This is the equivalent of 9% of households in Wales,according to Office for National Statistics figures,external. The data also shows at least 36% of those living in flats in Wales did not have access to a private space, a higher rate than in England or Scotland. More than 17,000 people on the shielding list, who were told not to leave their homes, had noaccess to any outdoor space,external. This video can not be played ""How do we make Swansea better?"" Some councils are investing more in improving green spaces, while others have reported conflict as more people use footpaths. In Cardiff, the council is planning to spend around £2m improving green spaces, parks and pavements in 2021-22. While in Rhondda Cynon Taf, the council said a significant increase in people using footpaths had led to a number of landowners ""taking matters into their own hands"" and closing paths. £38m announced for cycling and walking routes Meanwhile in Swansea, the council and Natural Resources Wales are ploughing ahead with plans to double the city's green space, including building the first park in the city since Victorian times. This video can not be played Cardiff’s Castle Street was turned into an al fresco dining area last summer In many towns and cities, Covid forced adaptations, with one-way systems in high streets and more space for outside seating. While some of the measures were divisive - limiting parking and delivery spaces or shutting major roads - there were other calls to make them permanent. Not-for-profit group For Cardiff, which represents more than 700 businesses, said with more people set to work from home in the long term, changes had to be made to draw people into the city. Adrian Field, executive director, said having more outdoor seating had allowed many businesses to survive and the group was looking at whether a new public space could be opened. ""It might have entertainment... PE equipment or a big screen to watch films or sporting events... there is an eagerness for that space to be used,"" he said. ""I think all towns and cities need to create environments where people can linger, interact, exercise... hopefully that includes pocket parks, if we can get more tables and chairs outside I think there will be a lot of demand long term."" Charity Sustrans said despite efforts, no area in Wales had been designated an official 20-minute neighbourhood in Wales - where every facility is within a 10-minute bike ride or walk of their home. This video can not be played Could changes we have been forced to make in the pandemic become long-term environmental solutions? One major issue planners have been looking at is how to connect rural communities which may have been cut off from neighbours in lockdown. Sarah Featherstone, of consultants VeloCity, hopes villages can be linked up using footpaths and cycle routes to create ""villages in a garden"". ""We call it the big back garden,"" said the Brecon-based architect. She said while there was a housing crisis, sprawling development meant many were now having to get in their cars to get to the middle of their village to access shops. Her vision is for the area to be used for people to grow food and for community gardens, while villages would pool together to address issues like poorly maintained pavements, pot holes and reducing speed limits. Parks have seen increased numbers of walkers, cyclists and runners ""All of the traffic has been pushed to the edges, so that you have this much safer, greener landscape between the villages that can be safeguarded and used for leisure,"" she said. Ms Featherstone said changing planning laws and addressing infrastructure could allow more people to move out of flats in cities to live and work in rural communities. ""There's a potential for a fresh look at things, but we need to keep that momentum going, otherwise we could easily slip back into jumping back in cars again,"" she said. The Welsh government said more than £50m had been allocated for permanent and temporary improvements to walking and cycling routes routes ""to allow people to safely and conveniently travel"" to local destinations, including outdoor spaces. The tight-knit design of valleys communities was partly blamed by some on high case rates in the area Last year a spike in Covid cases in valleys communities was partly blamed by some on the design of the areas, with tightly packed lines of terraced houses. In Merthyr Tydfil - which in November had the highest Covid case rate in the UK - the council kept parks open during the firebreak lockdown,as the Brecon Beacons national park was just out of reach for many. There are also thoughts on how south Wales valley communities could be reimagined and opened up with more access to green spaces. Matthew Jones said the recovery post-Covid was an opportunity to ""profoundly change"" towns, as more people worked from home and had developed an appreciation for local shops, paths and parks. ""There's a potential to really rethink what we do with public spaces... how streets connect together, how people can move safely around where they live,"" he said. Dr Jones, who has looked at the future of towns for the Design Commission for Wales, said homes and workspaces could be redesigned to include garden elements. Planners believe more buildings with green spaces built in could appear, like these plans in Swansea In Swansea, plans have been approved for a ""living"" building, with rooftop gardens and allotments, and Dr Jones said ideas like this could help towards a bid for Wales to have carbon neutral emissions by 2050. He said it would be interesting to see which communities chose to keep temporary measures - such as shutting roads and widening pavements - to create more room for walking and cycling once the pandemic ended. The Welsh government said it was already delivering green infrastructure schemes worth £9m to make town centres ""greener, more attractive and safer"". It has also launched a national forest programme to create a ""connected woodland extending the length of Wales"". In the first year of the programme, projects included more than 20 small woodlands created by and for schoolchildren. Covid jobs: how can Wales have a 'green recovery'? UK budget's £93m for 'Welsh green recovery' Plans to double city's green space Welsh cycling and walking routes get £38m Valleys' social distancing 'like changing DNA' Can UK cities be reshaped for the world after lockdown? Switch back to cars 'detrimental' for environment 'Devastating' effect of litter rise after lockdown Deadly wildfires rage across LA as fierce winds threaten more destruction What's the latest on the LA fires, and why can't they be put out? Danes struggle with response to Trump Greenland threat 'I paid fake doctor thousands for fillers - now I look like a gargoyle' The Papers: 'Lost Angeles' and 'Musk seeks plan to oust Starmer' Pop star Chappell Roan wins BBC Sound Of 2025 Weekly quiz: Zendaya looked happy but who else sparkled at the Golden Globes? The 20 child abuse inquiry proposals - what has happened so far? The '9/11 mastermind' wants to plead guilty. Why is the US trying to stop him? Why are UK borrowing costs rising and what does it mean for me? In maps: Thousands of acres on fire in LA Before and after: How wildfires tore through LA Ed Gamble hosts the official Traitors podcast Join Ed Gamble and guests as they dissect the first episodes of The Traitors! Can art, music and words bind us in divided times? Simon Schama explores how artists have captured the transformations of British society since 1945 Enjoy a satirical smorgasbord of The News Quiz Digest a dramatic year of news as Andy Zaltzman revels in some of 2024's funniest moments The multi-award-winning legal drama returns Two years on, the Defoes are back and have gathered for a beautiful wedding in Barcelona © 2025 BBC. The BBC is not responsible for the content of external sites.Read about our approach to external linking."
