headline,article
"World complacent on Covid, warns Gordon Brown","Mr Brown said political leaders are not listening to medical advice Gordon Brown has warned that the world risks ""sleepwalking"" into another Covid variant crisis if it does not increase vaccinations in low-income countries. Wealthier countries needed to share the cost of global vaccinations, tests and treatments, he told the BBC. Speaking before an international Covid summit on Thursday, the former UK prime minister said the world had become ""complacent"" about the virus. US President Joe Biden is due to host the virtual summit at the White House. He does so at a time when Congress has failed to approve key funds earmarked for the global pandemic response. Campaigners fear that could mean other countries will not offer extra money either, leaving the push for better vaccine coverage around the world without momentum. Mr Brown, who is a World Health Organization (WHO) ambassador on health finance, said the numbers were ""shocking"". ""Only 11% have been vaccinated in low-income countries and we set a target of 70%,"" he said. ""Tragically, we are sleepwalking into the next variant, and political leaders are still not listening to the medical advice that is still there - that we've got to increase vaccination, continue to test at a high level, and provide the new treatments available."" Mr Brown said that if wealthy countries did not pay for what is needed now, they might face huge economic costs later if a more lethal variant emerges in low-income countries and is detected too late. He also said daily testing in poorer countries was only averaging five tests per 100,000 people, rather than the goal of 100 per 100,000, as suggested by the WHO. Congress has so far been reluctant to approve extra funds of $5bn (£4bn) for international vaccination programmes. Mr Brown and other former leaders have written to Mr Biden urging the United States to keep up the momentum on the global vaccination push. Mr Brown said: ""I think the Americans have forgotten that if they take no action, then the virus will spread from places that are least vaccinated and least protected, and it will come back to haunt them - even if they've been vaccinated four times."" The WHO says there's a $15bn financing gap which richer countries need to fill collectively if the developing world is to have the right tools to fight the pandemic properly. But pressure groups are not expecting countries like the UK to allocate any more money than it has already. In Africa, more than 45 faith leaders have also called for ""immediate action to address the massive inequalities in the global pandemic response"". In a joint statement, the religious leaders point out that only one in five Africans has received their first dose of vaccine, while high-income countries are rolling out third and fourth doses. The Archbishop of Cape Town, Thabo Makgoba, is one of those urging world politicians ""not to see this as just a number, but as a reminder that each statistic represents a human being who deserves dignity and the ability to thrive in a post-pandemic world"". True Covid pandemic death toll is 15 million - WHO Why India's real Covid toll may never be known Global vaccine rollout a stain on our soul - Brown How Covid funds went missing in DR Congo - report Vaccine hold-ups risk new Covid wave in DR Congo Comments can not be loaded To load Comments you need to enable JavaScript in your browser Death toll rises as governor confirms hydrants issue 'impaired' LA wildfires fight 'I have nothing to go back to' - reporter tells of LA fires heartbreak Reeves pledges to 'make UK better off' on China visit LA fires: How three days of devastation unfolded What's the latest on the Los Angeles wildfires and what caused them? 'Cold bites' gas supply and 'Dementia shock' 'My mum died after four days on an A&E trolley' The '9/11 mastermind' wants to plead guilty. Why is the US trying to stop him? Pop star Chappell Roan wins BBC Sound Of 2025 Weekly quiz: Zendaya looked happy but who else sparkled at the Golden Globes? Inside the UK's first legal drug consumption room Danes struggle with response to Trump Greenland threat Dragons’ Den returns with a new line-up of celebrity guests Can a fresh batch of entrepreneurs secure the deal of a lifetime? Are smart scales really as ‘smart’ as they claim to be? Greg Foot explores whether they can accurately measure weight, body fat, muscle and bone mass The award-winning psychological competition is back A nail-biting game of detection, backstabbing and trust. Who will make it through? How close are we to a cancer vaccine? How might it help in the treatment of the disease? © 2025 BBC. The BBC is not responsible for the content of external sites.Read about our approach to external linking."
'Critical mass' of polluters set carbon targets,"A record number of big polluters are committing to cutting CO2 emissions, a UN-backed report has said. But firms in Asia, Africa and Latin America are lagging behind Europe, the US and Japan, the Science-Based Targets Initiative said. Separately, a report cast doubt on whether oil companies can all deliver carbon cuts they've promised. Big oil firms are relying on unproven technologies, a think tank said. The Science-Based Targets Initiative advises firms on how to set emissions reduction targets in line with climate science. It says targets have now been adopted by more than 2,000 firms worth $38tn across 70 countries in 15 industries. The authors say that in the most polluting sectors a critical mass of firms (27%) has joined the initiative. They believe this could prove a positive tipping point, as the polluting giants influence actions across the whole supply chain. More than half the companies setting targets are in the G7 rich nations, but there are also participants from China, India, Brazil, South Korea and South Africa. Canada and Italy are lagging behind, the report says. And Africa and Asia need more participants. The document says: Around 80% of the targets approved by the firms in 2021 were aligned with the benchmark of holding global temperature rises to 1.5ºC above pre-industrial times. Between 2015-2020, the majority of companies with 1.5°C targets cut emissions twice as fast as required. Environmentalist Tom Burke from the think tank E3G welcomed the target setting. ""This is really good news"", he said, ""but it's very late in the day. We are way past the time when we should be tackling climate change. ""It's great to have targets but there's a huge gap in government and business between targets and achievements"". A separate report today urged caution over oil companies' targets. The think tank Carbon Tracker said that oil and gas firms are basing their emissions goals on either selling polluting assets or on unproven or controversial technologies. These include carbon capture and storage (CCS) - or carbon offsetting which can include trees being planted to compensate for industrial emissions. Carbon Tracker says investors should ask whether companies' targets are not just ambitious but also credible. The author, Mike Coffin, said: ""Emissions mitigation technologies pose a huge risk to investors and the climate because most, such as CCS, are at an early stage of development, and solutions involving tree-planting require vast areas of land. ""Costs will be enormous and it is not clear whether they will be technically feasible or economically viable."" The report ranks oil and gas firms. It says: Enihas the strongest policy, pledging a 35% cut in emissions by 2030 from the production and use of its products. But its plans involve CCS and nature-based solutions such as tree planting. BPranks fourth but its position is expected to improve once it formally ends its Rosneft gas shareholding. It says CCS will be a ""lever"" for emissions reductions. Shellranks fifth, pledging only to reduce the carbon intensity of its operations and the products it sells. Nine North American companies all have weaker policies than Europeans and only commit to reducing emissions intensity - that's a measure of carbon emissions per dollar earned. ExxonMobilhas the weakest policy, the report says. It adopted a net zero target last year but has not said how it will get there. However, the oil giant said that it ""has long acknowledged the reality and risks of climate change, and it has devoted significant resources to addressing those risks"". ""We have announced our ambition to achieve net zero greenhouse gas emissions for operated assets by 2050. As part of that, we are developing detailed emission-reduction roadmaps for major facilities and assets,"" it said. A Met Office report this week said new global record temperatures are expected again in the next few years. Wales remains top UK recycler for over 10 years Is the UK on track to meet its climate targets? Comments can not be loaded To load Comments you need to enable JavaScript in your browser Death toll rises as governor confirms hydrants issue 'impaired' LA wildfires fight 'I have nothing to go back to' - reporter tells of LA fires heartbreak Reeves pledges to 'make UK better off' on China visit LA fires: How three days of devastation unfolded What's the latest on the Los Angeles wildfires and what caused them? 'Cold bites' gas supply and 'Dementia shock' 'My mum died after four days on an A&E trolley' The '9/11 mastermind' wants to plead guilty. Why is the US trying to stop him? Pop star Chappell Roan wins BBC Sound Of 2025 Weekly quiz: Zendaya looked happy but who else sparkled at the Golden Globes? Inside the UK's first legal drug consumption room Danes struggle with response to Trump Greenland threat Dragons’ Den returns with a new line-up of celebrity guests Can a fresh batch of entrepreneurs secure the deal of a lifetime? Are smart scales really as ‘smart’ as they claim to be? Greg Foot explores whether they can accurately measure weight, body fat, muscle and bone mass The award-winning psychological competition is back A nail-biting game of detection, backstabbing and trust. Who will make it through? How close are we to a cancer vaccine? How might it help in the treatment of the disease? © 2025 BBC. The BBC is not responsible for the content of external sites.Read about our approach to external linking."
Watchdog highlights 'precarious state' of nature,"A report from an independent watchdog says it's very concerned about the ""precarious state"" of England's environment. The Office for Environmental Protection says that existing laws are failing to slow the damage to land, air and water. Protecting the environment should have the same urgency as efforts to reach net zero emissions, the study says. The government says current laws will make a real difference and put nature on the road to recovery this decade. 'Fifty-fifty chance' global warming tops 1.5C soon What will Australia's election mean for the planet? Airlines miss all but one climate target - report TheOffice for Environmental Protection,external(OEP) was set up under the 2021 Environment Act to hold the government and other public bodies to account in England and Northern Ireland. Its first report, described as a ""polite demolition"" of the government's track record, paints a picture of environmental crises on land, in the air and in the seas and rivers. A swan making a home among the debris Among the issues identified by the OEP are thestate of England's inland rivers and waterways. They face pollution from multiple sources including agricultural runoff and discharges from sewage treatment works. While the government is praised for putting in place a25-year environment plan in 2018, the OEP says that progress on delivery has been far too slow, and, so far, it has failed to halt the loss of species or the unsustainable use of resources. ""The 25-year environment plan was an ambitious attempt to confront the challenges facing the environment, yet we continue to see worrying and persistent trends of environmental decline,"" said Dame Glenys Stacey, chair of the OEP. ""Our rivers are in a poor state, bird and other species numbers are in serious decline, poor air quality threatens the health of many, and our seas and sea floor are not managed sustainably."" Of even greater concern are the potential for ""tipping points"", where long term, slow declines become irreversible. The OEP identifies a number of these points, including the decline in fish stocks and the widespread use of nutrients on farmland. To tackle the problems, the report says the government needs to urgently ""take stock"" and set out an ""ambitious vision"". The OEP highlights six ""building blocks"" that it believes are needed to help turn around environmental decline. These include a better understanding of environmental pressures and drivers, setting more effective targets, and having a coherent strategy and policy. Protestors demand that sewage runoffs into the rivers and seas should end ""Our argument is that with the resources that are already available to government, for protecting, restoring and enhancing the environment, a much better job could be done, if the building blocks that we highlight are considered,"" said Dame Stacey. ""If there is a persistent effort, and a real attention to prioritisation in relation to environmental matters, we'll get a long way,"" she said. In response to the new study, Environment Minister Rebecca Pow said: ""We welcome this report, which acknowledges that our Environment Act gives us new tools to make a real difference to our environment, putting it at the heart of government and transitioning us to a sustainable future with nature on the road to recovery during this decade. ""Six months on from the Act gaining Royal Assent, we are currently consulting on legally binding environmental targets which include a world-leading target to halt species decline by 2030. We have launched a consultation to deliver the largest programme in history to tackle storm sewage discharges and we have taken action to transform the way that we deal with waste."" The government says it will formally respond to the OEP's recommendations this summer. Follow Matt on Twitter@mattmcgrathbbc,external. Comments can not be loaded To load Comments you need to enable JavaScript in your browser Death toll rises as governor confirms hydrants issue 'impaired' LA wildfires fight 'I have nothing to go back to' - reporter tells of LA fires heartbreak Reeves pledges to 'make UK better off' on China visit LA fires: How three days of devastation unfolded What's the latest on the Los Angeles wildfires and what caused them? 'Cold bites' gas supply and 'Dementia shock' 'My mum died after four days on an A&E trolley' The '9/11 mastermind' wants to plead guilty. Why is the US trying to stop him? Pop star Chappell Roan wins BBC Sound Of 2025 Weekly quiz: Zendaya looked happy but who else sparkled at the Golden Globes? Inside the UK's first legal drug consumption room Danes struggle with response to Trump Greenland threat Dragons’ Den returns with a new line-up of celebrity guests Can a fresh batch of entrepreneurs secure the deal of a lifetime? Are smart scales really as ‘smart’ as they claim to be? Greg Foot explores whether they can accurately measure weight, body fat, muscle and bone mass The award-winning psychological competition is back A nail-biting game of detection, backstabbing and trust. Who will make it through? How close are we to a cancer vaccine? How might it help in the treatment of the disease? © 2025 BBC. The BBC is not responsible for the content of external sites.Read about our approach to external linking."
Disney sees better than expected streaming growth,"Encanto is about a family called the Madrigals who live hidden in the mountains of Colombia Walt Disney has reported another jump in sign-ups for its streaming services, escaping the slowdown that hit arch rival Netflix. More than 9 million people subscribed to the firm's online video platforms in the first three months of the year, most of them to its flagship Disney+. The parks business also boomed, extending a rebound from the pandemic. Disney's performance was under scrutiny after Netflix reported a fall in subscribers last month. Netflix, an early pioneer in streaming, has been having a harder time signing up new members, as it tries to build from an already massive 220 million base and more competitors enter the industry. But analysts had worried that its troubles might be more widespread and signal a wider slowdown in consumer demand for streaming. ""A huge sigh of relief for Disney"", said Paolo Pescatore, PP Foresight analyst. Disney has poured investment into its streaming services, seeing them as key to the future of its business, as movie attendance wanes and more people turn from traditional television. Since launching in 2019, the number of Disney+ subscribers has reached nearly 138 million, drawn by hits such as Marvel's ""Moon Knight"" series and Pixar movie ""Turning Red"". The firm also owns Hulu, ESPN and Hotstar in India. Disney executives said subscriber growth over the last six months was stronger than they had expected. They said that may slow in coming months, as the firm enters markets, like Poland, where the war in Ukraine is affecting sentiment. But they said they remained confident that they will hit sign-up goals. ""We still do expect an increase in growth,"" said chief financial officer Christine McCarthy. Mr Pescatore said the company's growth was likely to remain strong, as the company launches in more markets overseas. The company is also planning an ad-supported service. ""For now, take-up for its direct-to-consumer services like Disney+ remains robust and will continue to do so,"" he said. ""Ultimately, it is in a different phase of growth compared to rivals including Netflix, akin to a start-up."" Overall Disney revenues in the first three months of the year rose 23% from a year ago to $19.25bn, boosted by its amusement park business, which saw revenues more than double. Profits fell to $470m, down from roughly $900m last year. The streaming business is still losing money; the company was also hit by a $1bn charge it paid to end distribution deals for movies and television so they could put the content on their own services. Have we had enough of Netflix? Netflix hints at password sharing crackdown Comments can not be loaded To load Comments you need to enable JavaScript in your browser Death toll rises as governor confirms hydrants issue 'impaired' LA wildfires fight 'I have nothing to go back to' - reporter tells of LA fires heartbreak Reeves pledges to 'make UK better off' on China visit LA fires: How three days of devastation unfolded What's the latest on the Los Angeles wildfires and what caused them? 'Cold bites' gas supply and 'Dementia shock' 'My mum died after four days on an A&E trolley' The '9/11 mastermind' wants to plead guilty. Why is the US trying to stop him? Pop star Chappell Roan wins BBC Sound Of 2025 Weekly quiz: Zendaya looked happy but who else sparkled at the Golden Globes? Inside the UK's first legal drug consumption room Danes struggle with response to Trump Greenland threat Dragons’ Den returns with a new line-up of celebrity guests Can a fresh batch of entrepreneurs secure the deal of a lifetime? Are smart scales really as ‘smart’ as they claim to be? Greg Foot explores whether they can accurately measure weight, body fat, muscle and bone mass The award-winning psychological competition is back A nail-biting game of detection, backstabbing and trust. Who will make it through? How close are we to a cancer vaccine? How might it help in the treatment of the disease? © 2025 BBC. The BBC is not responsible for the content of external sites.Read about our approach to external linking."
