headline,article
EU 'preparing for possible talks collapse',"Michel Barnier says ""everyone needs to plan"" for the possible collapse of Brexit negotiations The EU's chief negotiator, Michel Barnier, says he is planning for the possible collapse of Brexit negotiations with the UK. Mr Barnier was talking to French newspaper Le Journal du Dimanche,externaldays after giving the UK a two-week deadline to clarify key issues. Failing to reach an agreement was not his preferred option, he stressed. The UK's Brexit Secretary David Davis has said it is time for both sides ""to work to find solutions"". On Friday, Mr Davis insisted good progress was being made across the board, and that the negotiations had narrowed to a ""few outstanding, albeit important, issues"". How are the talks really progressing? All you need to know about Brexit Barnier: The EU's point man on Brexit negotiations Discussing the likelihood of the talks collapsing, Mr Barnier said: ""It's not my option, but it's a possibility. Everyone needs to plan for it, member states and businesses alike. We too are preparing for it technically. ""A failure of the negotiations would have consequences on multiple domains."" Mr Barnier has asked the UK to clarify its stance on its financial obligations to the EUif future trade talks are to go ahead in December. But Mr Davis has made conflicting remarks, suggesting the UK would not have to give a figure for a financial settlement before it could move on to talks about a future trading relationship. Speaking to Sky News on Sunday, he said: ""In every negotiation, each side tries to control the timetable. The real deadline on this is, of course, December."" Mr Davis was referring to the next EU summit which will take place in Brussels in December. This video can not be played David Davis says there cannot be a new border within the UK He said British taxpayers ""would not want me to just come along and just give away billions of pounds"". He added: ""We've been very, very careful, and it's taking time and we will take our time to get to the right answer."" His comments followed a sixth round of talks between Mr Davis and Mr Barnier in Brussels. Speaking after the talks on Friday,Mr Davis said any solution for the Irish border could not be at the expense of the constitutional integrity of the UK. Davis stands firm on Irish border issue May warns rebels as Brexit timing set out Sturgeon 'kept in dark' over Brexit Barnier: 'Time pressing' in Brexit talks Comments can not be loaded To load Comments you need to enable JavaScript in your browser At least two killed and 1,000 structures destroyed as wildfires rage in Los Angeles In maps: Thousands of acres on fire in LA 'Patients are collapsing in the waiting room': A&E nurses speak out Why does Trump want Greenland and what do its people think? How Canada's immigration debate soured - and helped seal Trudeau's fate 'I can't get divorced as I can't get my pension valued' What are cold weather payments and who can get them? BBC Sound of 2025: Barry Can't Swim is a new dance music superstar Ros Atkins on...Elon Musk's political interventions Jean-Marie Le Pen - founder of French far right and 'Devil of the Republic' Cases of HMPV are on the rise in China - but what is it? Politics Essential: Get the latest news and analysis delivered to your inbox every weekday Delivering brand-new miracles in 1970s East End Watch the latest series of Call the Midwife on iPlayer now Mark-Anthony Turnage shares the soundtrack of his life Once called 'Britainâs hippest composer', he's tackled topics from drug abuse to football in his work Paddyâs loaf-changing experience inside the bread factory Paddy McGuinness visits the bread factory he used to work in, and sees how they make 1.4 million loaves a week What's behind the global surrogacy boom? More countries are banning surrogacy â but demand is growing Â© 2025 BBC. The BBC is not responsible for the content of external sites.Read about our approach to external linking."
Breaking|,"Irish musician and activist Bob Geldof said he is ""shamed"" to share the honour with Suu Kyi Bob Geldof has said he will return his Freedom of the City of Dublin in protest against the Myanmar leader Aung San Suu Kyi, who also holds the award. Mr Geldof said ""her association with our city shames us all"". Ms Suu Kyi has faced heavy criticism over her failure to address allegations of ethnic cleansing against Myanmar's Rohingya Muslims. More than half a million Rohingya have fled to Bangladesh following recent violence. Mr Geldof, the musician and founder of Band Aid, said in a statement: ""Her association with our city shames us all and we should have no truck with it, even by default. We honoured her, now she appals and shames us."" He is handing back the award at City Hall in the Irish capital on Monday morning. What you need to know about the crisis What sparked latest violence in Rakhine? Who are the Rohingya group behind attacks? Aung San Suu Kyi has faced widespread criticism over her response to reported atrocities Ms Suu Kyi has been condemned by international leaders and human rights groups over her reluctance to acknowledge the military violence, which the UN has called a ""textbook example of ethnic cleansing"". There have also been calls for her to be stripped of the Nobel Peace Prize she won in 1991. Reacting to Mr Geldof's announcement, Lord Mayor Micheal Mac Donnacha of Dublin City Council said on Monday: ""I find it ironic that he makes this gesture while proudly retaining his title as Knight Commander of the Order of the British Empire, given the shameful record of British imperialism across the globe."" Fellow Irish musicians U2 also criticised Ms Suu Kyi, the civilian leader of Myanmar, also known as Burma, urging her on Saturday to take a stronger stance against the reported violence by security forces. In a statement on the band's website, they said her failure to address the crisis was ""starting to look a lot like assent"". ""So we say to you now what we would have said to her: the violence and terror being visited on the Rohingya people are appalling atrocities and must stop."" This video can not be played Thousands of Rohingya refugees flee to Bangladesh Last month,Oxford City Council decided to strip Ms Suu Kyi of the freedom of the city,which she was awarded in 1997, in an ""unprecedented step"" for the local authority. The City of London is also toconsider a similar step. Earlier this month, she was alsostripped of the freedom of the cities of SheffieldandGlasgowbecause of her response to the Rohingya crisis. St Hugh's College at Oxford University, where Ms Suu Kyi read politics, has removed a portrait of her from display. This video can not be played Rohingya Muslims had to decide what to bring and what to leave. The violence in Rakhine erupted on 25 August when Rohingya militants attacked security posts in Myanmar's Rakhine state, triggering a military crackdown. Scores of people have been killed in the crackdown and there are widespread allegations of villages being burned and Rohingya being driven out. Myanmar's military says it is fighting Rohingya militants and denies targeting civilians. About 600,000 Rohingya have fled to Bangladesh since 25 August. Reality Check: Are Suu Kyi's Rohingya claims correct? Myanmar's Suu Kyi visits troubled Rakhine In pictures: Rohingya fleeing Myanmar 'I had to leave my favourite dress behind' Video, 00:02:31'I had to leave my favourite dress behind' At least two killed and 1,000 structures destroyed as wildfires rage in Los Angeles In maps: Thousands of acres on fire in LA 'Patients are collapsing in the waiting room': A&E nurses speak out Why does Trump want Greenland and what do its people think? How Canada's immigration debate soured - and helped seal Trudeau's fate 'I can't get divorced as I can't get my pension valued' What are cold weather payments and who can get them? BBC Sound of 2025: Barry Can't Swim is a new dance music superstar Ros Atkins on...Elon Musk's political interventions Jean-Marie Le Pen - founder of French far right and 'Devil of the Republic' Cases of HMPV are on the rise in China - but what is it? Politics Essential: Get the latest news and analysis delivered to your inbox every weekday Delivering brand-new miracles in 1970s East End Watch the latest series of Call the Midwife on iPlayer now Mark-Anthony Turnage shares the soundtrack of his life Once called 'Britainâs hippest composer', he's tackled topics from drug abuse to football in his work Paddyâs loaf-changing experience inside the bread factory Paddy McGuinness visits the bread factory he used to work in, and sees how they make 1.4 million loaves a week What's behind the global surrogacy boom? More countries are banning surrogacy â but demand is growing Â© 2025 BBC. The BBC is not responsible for the content of external sites.Read about our approach to external linking."
PM 'will return to Lebanon in days',"Hariri's resignation has sent shockwaves through Lebanon and the region Lebanon's Prime Minister Saad Hariri says he will return home ""in days"" to formally submit his resignation. Mr Hariri spoke to Future TV from Riyadh, his first public remarks since he announced he was stepping down last week. His cabinet allies say he is being held captive, but Mr Hariri denied this. He has blamed the Iran-backed Hezbollah movement for his resignation, citing concerns over his and his family's safety. The US and UK have warned other countries not to use Lebanon for proxy conflicts. Mr Hariri, a Sunni leader and businessman, was nominated to form Lebanon's government in November 2016. Iran and Saudi Arabia: Who's siding with whom Lebanon caught in crosshairs of Saudi-Iran tension Riyadh's night of long knives and long-range missiles ""I have resigned. I am going to Lebanon very soon and I will resign in the constitutional manner,"" he said in the TV interview. Under Lebanese law the prime minister has to submit his resignation to the president, who must accept it for it to take effect. However, Mr Hariri also held out the prospect that he might reconsider resigning if Hezbollah stopped intervening in neighbouring countries. ""If we want to go back on the resignation, we have to return to the policy of distancing ourselves"" from regional conflicts,""he said, according to the Associated Press,external. ""I am not against Hezbollah as a party, I have a problem with Hezbollah destroying the country,"" he said. The main problem for the region, he said, was ""Iran interfering in Arab states"". A sombre Mr Hariri recognised that he did not resign in the ""usual way"" but said he wanted to give his country a ""positive shock"". ""My resignation came as a wake-up call for Lebanon,"" he said. Posters of Mr Hariri have appeared across Beirut. This one says: ""We are all Saad"" Iran and Hezbollah have accused Saudi Arabia of holding Mr Hariri hostage. But Mr Hariri insisted that he was free to travel as he pleased in the country. ""I am free here. If I want to travel tomorrow, I will,"" he said. Observers noted the journalist who interviewed Mr Hariri made an effort to demonstrate that the event was live, rather than pre-recorded, thoughthere were several moments which raised suspicions about the conditions under which the interview was held,,externalthe Associated Press reported. Lebanon demands answers from Saudis French president makes surprise Saudi visit Lebanon caught in Saudi-Iran tension Iran rejects Lebanon PM's claims Saudis accuse Iran of 'direct aggression' At least two killed and 1,000 structures destroyed as wildfires rage in Los Angeles In maps: Thousands of acres on fire in LA 'Patients are collapsing in the waiting room': A&E nurses speak out Why does Trump want Greenland and what do its people think? How Canada's immigration debate soured - and helped seal Trudeau's fate 'I can't get divorced as I can't get my pension valued' What are cold weather payments and who can get them? BBC Sound of 2025: Barry Can't Swim is a new dance music superstar Ros Atkins on...Elon Musk's political interventions Jean-Marie Le Pen - founder of French far right and 'Devil of the Republic' Cases of HMPV are on the rise in China - but what is it? Politics Essential: Get the latest news and analysis delivered to your inbox every weekday Delivering brand-new miracles in 1970s East End Watch the latest series of Call the Midwife on iPlayer now Mark-Anthony Turnage shares the soundtrack of his life Once called 'Britainâs hippest composer', he's tackled topics from drug abuse to football in his work Paddyâs loaf-changing experience inside the bread factory Paddy McGuinness visits the bread factory he used to work in, and sees how they make 1.4 million loaves a week What's behind the global surrogacy boom? More countries are banning surrogacy â but demand is growing Â© 2025 BBC. The BBC is not responsible for the content of external sites.Read about our approach to external linking."
Omagh alert caused by pipe bomb device,"An Army robot at the scene of the alert on Sunday A security alert that postponed a wreath-laying ceremony in Omagh earlier was caused by a viable pipe bomb type device, police have said. Police Service of Northern Ireland (PSNI) Chief Constable George Hamilton said police were following a ""strong line of enquiry"" that dissident republicans were responsible. The alert began after the discovery of a suspicious object on Drumragh Avenue. The rest of the Remembrance Sunday service was able to go ahead. Cordons were in place at Drumragh Avenue, Mountjoy Road, Sedan Avenue, George Street and High Street. The alert has now ended. The PSNI Chief Constable said that the device was ""left to cause maximum disruption"" to the commemorations and described it as ""sickening and appalling"". An Army bomb expert examines the scene ""This is the action of a small and callous group of violent people who have nothing to offer our communities other than fear and intimidation,"" he said. ""Whilst our investigation into the incident is at a very early stage, one strong line of enquiry is that violent dissident republicans are responsible. ""Their actions today have demonstrated the disregard and disrespect they have for this community, which has already suffered so much pain and hurt at the hands of terrorists."" In 1998, a Real IRA bomb in Omagh killed 29 people. DUP MLA Tom Buchanan said he believed the planting of the pipe bomb was a ""re-run"" of the Enniskillen Poppy Day bomb 30 years ago that resulted in the deaths of 12 people. ""Innocent men, women and children's lives were taken and maimed with a similar type of device at that particular time,"" he said. ""And, again, I find it very difficult to get words strong enough to condemn those that are responsible for planning and pre-meditating such an attack."" Ulster Unionist councillor Chris Smyth said those responsible were cowards. ""It's always going to hurt an awful lot when people come to remember their dead and they come with wreaths, they come with a very clear idea of what they want to do,"" he said. ""Then, because of the actions of a few very sick and very cowardly individuals, they're stopped from doing that."" The Sinn FÃ©in MP for the area, Barry McElduff, said everyone had the ""unfettered right"" to remember their dead. ""Whoever decided to leave a package in this area, a suspicious package, obviously has shown complete disregard for everyone in the community,"" he said. At least two killed and 1,000 structures destroyed as wildfires rage in Los Angeles In maps: Thousands of acres on fire in LA 'Patients are collapsing in the waiting room': A&E nurses speak out Why does Trump want Greenland and what do its people think? How Canada's immigration debate soured - and helped seal Trudeau's fate 'I can't get divorced as I can't get my pension valued' What are cold weather payments and who can get them? BBC Sound of 2025: Barry Can't Swim is a new dance music superstar Ros Atkins on...Elon Musk's political interventions Jean-Marie Le Pen - founder of French far right and 'Devil of the Republic' Cases of HMPV are on the rise in China - but what is it? Politics Essential: Get the latest news and analysis delivered to your inbox every weekday Delivering brand-new miracles in 1970s East End Watch the latest series of Call the Midwife on iPlayer now Mark-Anthony Turnage shares the soundtrack of his life Once called 'Britainâs hippest composer', he's tackled topics from drug abuse to football in his work Paddyâs loaf-changing experience inside the bread factory Paddy McGuinness visits the bread factory he used to work in, and sees how they make 1.4 million loaves a week What's behind the global surrogacy boom? More countries are banning surrogacy â but demand is growing Â© 2025 BBC. The BBC is not responsible for the content of external sites.Read about our approach to external linking."
Trump's Russia stance 'puts US in peril',"Vladimir Putin and Donald Trump met recently at a summit Two former US intelligence chiefs say Donald Trump's stance on Russian meddling in last year's presidential election is putting the US at risk. The US president sparked uproar by suggesting he believed Russian counterpart Vladimir Putin when he said there had been no interference. The two leaders briefly discussed the allegations at an Asia-Pacific summit. US intelligence has long concluded Russia tried to sway the vote in Mr Trump's favour. Trump's Asia tour leaves observers perplexed ""Every time he [Putin] sees me he says I didn't do that, and I really believe that when he tells me that, he means it,"" Mr Trump told reporters. ""I think he is very insulted by it, which is not a good thing for our country."" Mr Trump also disparaged key figures in the US intelligence community who concluded in January that Russian meddling had taken place, including former national intelligence chief James Clapper, ex-CIA director John Brennan and sacked FBI chief James Comey, whom he called ""political hacks"". Mr Trump has since sought to mollify critics of his commentsfollowing uproar at his apparent defence of Mr Putin. Mr Clapper said he was alarmed by the president's comments. ""Putin is committed to undermining our system, our democracy and our whole process,""he told CNN,external. ""To try to paint it in any other way is, I think, astounding and in fact poses a peril to this country."" This video can not be played Mr Putin stood up to greet Mr Trump Appearing alongside him, Mr Brennan, said he found it ""puzzling"" why Mr Trump was not more explicit in condemning the Russian president when it represented a ""national security problem"". Referring to Mr Trumps criticism of him, Mr Brennan said: ""Considering the source of the criticism, I consider that criticism a badge of honour."" Soon after, Treasury Secretary Steven Mnuchin rejected suggestions from both men that Mr Trump was being ""played"", saying he was focused on tackling difficult issues like North Korea and Syria. Questions surrounding Russia's role in last year's US elections and allegations of collusion involving Donald Trump's campaign team have dogged his presidency. US intelligence agencies believe Russia tried to help Mr Trump win the presidency by hacking and releasing emails damaging to his opponent Hillary Clinton. While Russian hackers are widely suspected of involvement, there has been no conclusive link to the Kremlin. Russia: The 'cloud' over the White House Who's who in the drama to end all dramas? Special counsel Robert Mueller is currently investigating whether there were any links between Russia and the Trump campaign. Both deny there was any collusion. Last month, former Trump campaign adviser George Papadopoulos pleaded guilty to having lied to the FBI about the timing of meetings with alleged go-betweens for Russia. Mr Trump's former campaign manager, Paul Manafort, and an associate were also placed under house arrest on charges of money laundering as a result of the Mueller inquiry, but the charges do not relate to the election. Trump and Putin greet each other. Video, 00:00:20Trump and Putin greet each other Russia-Trump probe: Who's who? At least two killed and 1,000 structures destroyed as wildfires rage in Los Angeles In maps: Thousands of acres on fire in LA 'Patients are collapsing in the waiting room': A&E nurses speak out Why does Trump want Greenland and what do its people think? How Canada's immigration debate soured - and helped seal Trudeau's fate 'I can't get divorced as I can't get my pension valued' What are cold weather payments and who can get them? BBC Sound of 2025: Barry Can't Swim is a new dance music superstar Ros Atkins on...Elon Musk's political interventions Jean-Marie Le Pen - founder of French far right and 'Devil of the Republic' Cases of HMPV are on the rise in China - but what is it? Politics Essential: Get the latest news and analysis delivered to your inbox every weekday Delivering brand-new miracles in 1970s East End Watch the latest series of Call the Midwife on iPlayer now Mark-Anthony Turnage shares the soundtrack of his life Once called 'Britainâs hippest composer', he's tackled topics from drug abuse to football in his work Paddyâs loaf-changing experience inside the bread factory Paddy McGuinness visits the bread factory he used to work in, and sees how they make 1.4 million loaves a week What's behind the global surrogacy boom? More countries are banning surrogacy â but demand is growing Â© 2025 BBC. The BBC is not responsible for the content of external sites.Read about our approach to external linking."
