headline,article
Ministers pledge votes on neighbours' extensions,"This video can not be played Levelling Up Secretary Michael Gove casts doubt on 300,000 homes target Neighbours could be allowed to vote on whether planning permission should be given for developments - such as house extensions - on their street. The ""street votes"" would be an alternative to traditional forms of planning permission. It comes as Michael Gove ditched most of the government's reforms of the planning system in England. Downing Street insisted it was still committed to building 300,000 homes a year by the mid-2020s. Mr Gove earlier told BBC Radio 4's Today programme more homes were needed. But, he added, hitting a ""statistical target"" was not the only measure of success, particularly ""if the homes that are built are shoddy, in the wrong place, don't have the infrastructure required, and are not contributing to beautiful communities"". Is the government meeting its new-homes target? The 300,000 target was a key Conservative pledge at the 2019 general election. Mr Gove's predecessor as Communities Secretary, Robert Jenrick, aimed to meet it by forcing councils to accept new housing developments in designated areas. But the plans sparked a significant Tory backlash,including from former Prime Minister Theresa May, who called them ""ill-conceived"". Some in the party said the policy had contributed to by-election losses in former Conservative heartlands - includingChesham and Amersham- fears that would only have been exacerbated bylast week's local elections results. Now Mr Jenrick's proposals will be dropped in favour of a new Levelling Up and Regeneration Bill,published on Wednesday,external. Other new policies will include: Design codes to let local communities set rules about the layout of new developments and materials which could be used A new infrastructure levy - to be determined locally - to increase funds for projects such as schools, hospitals and roads, by basing the sum on the value of the property when it is sold, rather than when it gets planning permission Digitising the planning system, making plans more accessible online rather than relying on notices on lampposts Labour's shadow levelling up secretary Lisa Nandy said: ""Under the Conservatives housing has become less affordable, spending on rent has sky-rocketed, and homeownership has gone down."" She said the party could ""no longer claim to be the party of homeownership"". Planning reforms paused amid Tory MP anger Why do ministers face a backlash on planning rules? Archaeologists dig in over planning reforms row Michael Gove was confronted by fury inside his own party over planning reforms put forward by his predecessor. So he's junked them. Instead, there's a set of measures designed to give people more say over development in their areas. Mr Gove has suggested communities will be more open to new housing if it's not imposed on them - if it's ""beautiful"" and ""democratic"". But having ditched more radical reforms, the government may well struggle to meet its own target for building new homes. All the while, there are tens of thousands of people on housing waiting lists, families living in unsuitable or temporary accommodation, and many others unable to afford to get on the property ladder. There are other measures in the Queen's Speech designed to improve the housing market - giving renters more protection and suggestions of a clampdown on empty second homes. It's a complex problem of which the planning system is only one part. But the reality is that the country is facing a housing crisis, and so far successive governments have failed to find a solution. In Boris Johnson's first year in office, only 243,000 new homes were supplied,according to the House of Commons Library,external- falling to 216,000 in 2020/21, partly because of the disruption caused by the pandemic. Research conducted by the BBC in 2020found the difference between the housing stock in England and the number of homes needed was more than one million. Robert Jenrick told MPs the government was likely to continue missing its target by a ""country mile"" without more action. The Conservatives pledged to build 300,000 homes a year in England by the mid-2020s as part of its 2019 manifesto Mr Gove said communities had been ""understandably resistant"" to new developments when factors like the appearance of the buildings and the supporting infrastructure - like GP surgeries and schools - were not included in the plans. But he believed more people would be in favour of new housing under his proposals, adding: ""It shouldn't be a case that we impose. It is important that even as we seek to improve housing supply, we also seek to build communities that people love and are proud of."" Labour MP Clive Betts - who chairs the housing select committee - called the ""street vote"" plan a gimmick, telling the BBC it was not possible for communities to ""decide absolutely everything"" about urban planning in their area. He told the BBC the process of building new housing should be simplified, with local people involved in decisions about where homes might be placed much earlier than at the planning permission stage. Before proposals can be put to a local vote, they will be examined against a set of nationally prescribed development rules, which are to be agreed in due course, the government said. Development will go ahead only if the proposal is endorsed by a ""supermajority"" of residents in a referendum. The precise thresholds for approval would be set out in regulations in due course, the government added. Around 340,000 new homes are needed in England each year - 145,000 of them should be affordable, research for the National Housing Federation in 2019 said In 2020, the Affordable Housing Commission found that more than half of 18 to 24 year-olds still lived with family members; 18% continuing to do so when aged 25 to 34 From 2010 to 2020, more than 464,000 affordable homes were built; 114,000 of these were social homes (housing provided for people on low incomes or with particular needs) In England, an average house cost £292,000 (March 2022, ONS) The latest official figure for median monthly rent (for 2021) was £755, the highest ever recorded Are you struggling to get on the housing ladder? Or have you been affected by any of the other issues in this story? Emailhaveyoursay@bbc.co.uk,external. Please include a contact number if you are willing to speak to a BBC journalist. You can also get in touch in the following ways: WhatsApp:+44 7756 165803 Tweet:@BBC_HaveYourSay,external Upload pictures or video Please read ourterms & conditionsandprivacy policy If you are reading this page and can't see the form you will need to visit the mobile version of theBBC websiteto submit your question or comment or you can email us atHaveYourSay@bbc.co.uk,external. Please include your name, age and location with any submission. Comments can not be loaded To load Comments you need to enable JavaScript in your browser Death toll rises as governor confirms hydrants issue 'impaired' LA wildfires fight 'I have nothing to go back to' - reporter tells of LA fires heartbreak Reeves pledges to 'make UK better off' on China visit LA fires: How three days of devastation unfolded What's the latest on the Los Angeles wildfires and what caused them? 'Cold bites' gas supply and 'Dementia shock' 'My mum died after four days on an A&E trolley' The '9/11 mastermind' wants to plead guilty. Why is the US trying to stop him? Pop star Chappell Roan wins BBC Sound Of 2025 Weekly quiz: Zendaya looked happy but who else sparkled at the Golden Globes? Inside the UK's first legal drug consumption room Danes struggle with response to Trump Greenland threat Dragons’ Den returns with a new line-up of celebrity guests Can a fresh batch of entrepreneurs secure the deal of a lifetime? Are smart scales really as ‘smart’ as they claim to be? Greg Foot explores whether they can accurately measure weight, body fat, muscle and bone mass The award-winning psychological competition is back A nail-biting game of detection, backstabbing and trust. Who will make it through? How close are we to a cancer vaccine? How might it help in the treatment of the disease? © 2025 BBC. The BBC is not responsible for the content of external sites.Read about our approach to external linking."
Sri Lanka's ex-PM flees to naval base amid protests,"Mobs have attacked buses as well as property belonging to the Rajapaksas and other politicians Security forces are deployed across Sri Lanka with orders to shoot looters on sight amid continuing protests at the government's handling of a devastating economic crisis. President Gotabaya Rajapaksa has vowed to restore order, in his first national speech since protests began last month. Ignoring calls to resign, he offered to cede some powers to parliament and name a prime minister, but set no timetable. His brother quit as PM on Monday amid fury over soaring prices and shortages. Sri Lankans are desperate as basic items like food and fuel run out or become unaffordable. ""We have come to the protest site despite the curfew,"" one protester, Chandrasekaran, told BBC Tamil in Colombo. ""We are suffering even now. There is no kerosene, no petrol, no diesel, and no power."" Despite a nationwide curfew, there have been two consecutive nights of arson attacks by mobs - many have targeted property belonging to the Rajapaksas and other politicians who are blamed for the mess the country is in. Shops near Colombo were torched, as well as a resort owned by the son of former Prime Minister Mahinda Rajapaksa. Mr Rajapaksa, the president's elder brother and a two-time former president, is holed up in a naval base in the north-east for his own safety, the military has confirmed. This video can not be played ""I never wanted him"" - people from Sri Lanka's protests on the country's leaders At least nine people have been killed and about 200 injured in unrest since Monday. It began when government supporters attacked protesters who are demanding that Gotabaya Rajapaksa leave office. Opposition politicians have warned the violence could have been staged to give the army a pretext to take power. Rumours of a possible coup have been fuelled by the presence of large numbers of troops with armoured vehicles on the streets. But the military have denied any such move is planned. ""When there is a dangerous situation in the country, powers are given to the military to deal with it,"" Defence Secretary Kamal Gunaratne told a news conference. ""Don't ever think that we are trying to capture power. The military has no such intentions."" Sri Lanka had already seen weeks of protests over its dire financial situation, which has caused the Sri Lankan rupee to plunge, provoking severe shortages of basic items such as food, fuel and medical supplies. The worst trouble overnight was in the north of the capital, Colombo, where rival groups set fire to shops in the town of Negombo. On Monday night, mobs burned more than 50 houses belonging to politicians, while a controversial museum dedicated to the Rajapaksa family was also razed to the ground in their traditional heartland, Hambantota, in the country's south. Soldiers and police are under orders to shoot anyone damaging property or threatening life Shops, businesses and offices were shut for a third day on Wednesday under a nationwide curfew in place until Thursday morning. Another protester told the BBC the president's speech on Wednesday was long overdue. ""Where were you for the last 30 days? People don't have medicine, people don't have food, the entire country's at a standstill,"" Kavindya Thennakoon said. ""The reforms he's suggesting are not what we need. What we need right now is for [the president] to resign from office... It baffles my mind that Gotabaya Rajapaksa doesn't understand that."" The streets of the capital, Colombo, bear the evidence of this week's rioting - a heavy police presence, troops on the streets, and overturned and burnt buses after Monday's violence. Why Sri Lankans want their rulers thrown out The divisions behind Sri Lanka's united protests Sri Lankans left desperate over medicine hikes Nonetheless, protesters continue to gather despite the curfew at Galle Face Green. They insist President Rajapaksa has grossly mismanaged the economy and must stand aside. He is the last Rajapaksa family member in office and the resignation of his brother as prime minister did nothing to placate demonstrators or bring calm. Protesters blame Gotabaya (right) and Mahinda Rajapaksa for the current crisis President Rajapaska says he is holding talks with other political parties aimed at forming a unity government. But the main opposition  has said it will not be part of the interim administration unless the president stands down. At present, there is no clarity on which political parties might come together to form such a government. The political stalemate comes as Sri Lanka attempts to iron out a bailout package with the International Monetary Fund (IMF) - the island's $81bn economy is near bankruptcy. It has suspended its foreign debt payments, largely because it cannot service loans from China that paid for massive infrastructure projects. While the pandemic hit the vital tourism sector and shrank Sri Lanka's earnings and foreign exchange reserves, experts say problems have been exacerbated by populist tax cuts in 2019 and a disastrous ban on chemical fertilisers in 2021 that devastated crop yields. Protesters gathered in front of Trincomalee Naval Base in the north-east after reports that Mahinda Rajapaksa had fled there with his family after escaping from his Colombo residence when it was besieged by crowds on Monday night. The military confirmed on Wednesday that he was inside the base. ""We took Mahinda to the naval base for safety reasons,"" the defence secretary said. Earlier, there had been rumours that Mr Rajapaksa and others in the family had fled to India, which the Indian High Commission in Colombo denied. Anbarasan Ethirajan, BBC News, Colombo Sri Lankans are still reeling from the violence that has erupted. Many politicians are sheltering in safe houses or avoiding appearing in public. ""It is not at all safe, particularly for politicians on the government side,"" Nalaka Godahewa, until recently media minister, told the BBC. His house was among those torched. Mahinda Rajapaksa, once celebrated by the majority Sinhalese as a war hero for defeating the Tamil Tiger rebels, has suddenly become a villain. Many blame his supporters for targeting anti-government protesters, which then set off a chain of violent events. The Rajapaksas have always stood together, but this time, their differences are out in the open. The problem appears to have started after Gotabaya asked the family patriarch Mahinda to ""take one for the team"" and resign. How the family, who have dominated Sri Lankan politics for years, overcome this crisis is now an open question. Why is Sri Lanka in crisis? The divisions behind Sri Lanka's united protests Death toll rises as governor confirms hydrants issue 'impaired' LA wildfires fight 'I have nothing to go back to' - reporter tells of LA fires heartbreak Reeves pledges to 'make UK better off' on China visit LA fires: How three days of devastation unfolded What's the latest on the Los Angeles wildfires and what caused them? 'Cold bites' gas supply and 'Dementia shock' 'My mum died after four days on an A&E trolley' The '9/11 mastermind' wants to plead guilty. Why is the US trying to stop him? Pop star Chappell Roan wins BBC Sound Of 2025 Weekly quiz: Zendaya looked happy but who else sparkled at the Golden Globes? Inside the UK's first legal drug consumption room Danes struggle with response to Trump Greenland threat Dragons’ Den returns with a new line-up of celebrity guests Can a fresh batch of entrepreneurs secure the deal of a lifetime? Are smart scales really as ‘smart’ as they claim to be? Greg Foot explores whether they can accurately measure weight, body fat, muscle and bone mass The award-winning psychological competition is back A nail-biting game of detection, backstabbing and trust. Who will make it through? How close are we to a cancer vaccine? How might it help in the treatment of the disease? © 2025 BBC. The BBC is not responsible for the content of external sites.Read about our approach to external linking."
Windfall tax on energy firms still an option,"A windfall tax on big oil and gas companies to help tackle the soaring cost of living has not been ruled out, sources close to the chancellor say. Officials say Rishi Sunak is still open to the idea if firms do not reinvest their bumper profits in the UK. Current policy is still based on the tax deterring investment in new oil and gas fields and green technologies. Prime Minister Boris Johnson warned last week it could put future UK energy security at risk. However, the Treasury is now pointing to comments Rishi Sunak made in an interview with Mumsnet in April in which he said ""nothing's ever off the table in these things"". The chancellor warned that if sufficient investment was not forthcoming ""then of course that [windfall tax] is something I would look at"". The fact that Treasury officials are using the chancellor's comments in April as the primary text in the study of windfall tax probability is further evidence of the ""leeway"" they have on the policy, one official said today. The question remains how much investment would be enough to make the chancellor put the windfall tax stick away? The chancellor and business secretary Kwasi Kwarteng have previously welcomed pledges by BP to invest £18bn in the UK by the end of 2030 and Shell to invest £20-25bn in the next 10 years. However, neither of their commitments has materially increased as their profits have ballooned. Shell made a record £7bnin the first three months of this yearwhile BP reported a decade high £5bn. BP boss Bernard Looney, who famously described the company as a ""cash machine"", told journalists that it would proceed with all of their UK investments with or without a windfall tax. Shell boss Ben van Beurden wouldn't be drawn on whether it would scale back investment but did say Shell's programme of investments would be helped by ""a stable tax and regulatory environment"". Windfall taxes are not something in this chancellor's economic DNA. Oil and gas prices are extremely volatile and when BP and Shell were making record losses when oil prices collapsed, there was no clamour to help them out. The boss of Centrica, Chris O'Shea has likened a windfall tax to ""burning the furniture to keep warm"" - a quick fix but a poor long-term decision. But the chronic squeeze on household incomes has seen some perhaps unexpected advocates for a windfall tax. On Tuesday, Tesco chairman John Allan told the BBC that the case for one was overwhelming in the face of the genuine hardship he was seeing reflected in stores. An oil and gas industry executive conceded ""it's clear this debate is not going away. I don't think the chancellor wants to do it but the political pressure is clearly there"" The evolution of a policy U-turn starts with a few mutations, some of which are shut down and others allowed to persist as it slowly takes a new shape. We are not there yet - but to mix metaphors further, officials seem to be ""rolling the pitch"" before potentially delivering a change. One of the biggest problems may be designing the mechanism to impose the tax. BP and Shell have paid almost zero tax on their North Sea operations over the last few years as prices have been much lower and they are allowed to offset the cost of decommissioning old North Sea facilities against any profits made. Taxing worldwide income would mean taxing BP and Shell on profits made in places like the US, activities they will have paid US tax on already. While big global players like BP and Shell could take such a tax in their stride, UK waters are also home to smaller firms who may be deterred from investing by the prospect of a tax raid. Creating a minimum revenue threshold - as the government did with its digital services tax - could exempt them while hitting the deep pockets of the likes of BP and Shell. The other question is whether it is purely retrospective - and if so, how far back in history do you go. The shareholders of the company now may not be the same as the ones that enjoyed the windfall, so there's a risk in going back too far. However, tax experts say that if you made it purely retrospective, then you could argue it is no disincentive to future investment as long as it comes with a credible promise it's a one-off occurrence. It's likely that these are the exact conversations going on inside the Treasury right now. BP hits back at calls for windfall tax on profits Shell profits nearly triple as oil prices surge Comments can not be loaded To load Comments you need to enable JavaScript in your browser Death toll rises as governor confirms hydrants issue 'impaired' LA wildfires fight 'I have nothing to go back to' - reporter tells of LA fires heartbreak Reeves pledges to 'make UK better off' on China visit LA fires: How three days of devastation unfolded What's the latest on the Los Angeles wildfires and what caused them? 'Cold bites' gas supply and 'Dementia shock' 'My mum died after four days on an A&E trolley' The '9/11 mastermind' wants to plead guilty. Why is the US trying to stop him? Pop star Chappell Roan wins BBC Sound Of 2025 Weekly quiz: Zendaya looked happy but who else sparkled at the Golden Globes? Inside the UK's first legal drug consumption room Danes struggle with response to Trump Greenland threat Dragons’ Den returns with a new line-up of celebrity guests Can a fresh batch of entrepreneurs secure the deal of a lifetime? Are smart scales really as ‘smart’ as they claim to be? Greg Foot explores whether they can accurately measure weight, body fat, muscle and bone mass The award-winning psychological competition is back A nail-biting game of detection, backstabbing and trust. Who will make it through? How close are we to a cancer vaccine? How might it help in the treatment of the disease? © 2025 BBC. The BBC is not responsible for the content of external sites.Read about our approach to external linking."
