headline,article
Apple sells fewer phones but profits riseThe price of the iPhone X compensates for a dip in handset sales during the last three months of 2017.5h5 hours agoBusiness,"The new iPhone X started selling in November Apple sold slightly fewer iPhones in the final three months of 2017 than it did the year before, but higher prices compensated for the dip. The firm reported a record $20bn (£14bn) in quarterly profits, driven by strong growth in Japan and Europe. The results were the first official glimpse of sales figures for Apple's expensive iPhone X. Chief executive Tim Cook said demand for the product, which starts at about $1,000, had surpassed expectations. Quarterly sales at the firm climbed by 13% year-on-year to a record $88.3bn. After an initial fall, Apple shares climbed more than 3% in after-hours trade. Apple released the iPhone X in November, coinciding with the 10th anniversary of the device. And while the overall number of iPhones sold in the period slipped by 1% year-on-year to 77.3 million, the iPhone X had been the top-selling Apple handset  every week since its launch,  Mr Cook said. However the tech giant also issued a weaker-than-expected sales forecast for coming months, which appears to reinforce investor concerns that demand for Apple products may be dimming. Analysis: Dave Lee, BBC North America technology reporter, San Francisco Last year Apple launched three new iPhones, but one was not like the others. The iPhone X was the main event, the talk of the town. In contrast, the iPhone 8 and 8 Plus felt obsolete before Tim Cook had even finished his presentation. Investors were worried that the presence of the iPhone X would put off people buying the cheaper iPhones. And, given the X started at $999, those people may decide not to buy an iPhone at all. And that appears to be basically what happened. Apple sold marginally fewer iPhones compared with this time last year (though the company blamed that on a shorter accounting period compared with the same time in 2016). With the average selling price going up by around $100, to $796, it means Apple may be selling fewer iPhones, but it is making more from each one. Apple investors will be seeing it like this: selling fewer iPhones but dramatically upping the price is certainly one way to solve that ever-present supply chain headache. So, a timid quarter by Apple's unparalleled standards. But by no means a problem. Mr Cook said he was not over-concerned by the dip in handset sales,  adding that the 1.3 billion active Apple devices around the world provided a strong customer base for the firm's services businesses, which include Apple Pay. Analyst Carolina Milanesi, of California-based Creative Strategies,tweeted,externalthat ""1.3 billion users most of whom are extremely engaged with their devices is why the services numbers will be more and more interesting going forward"". Apple has been under a cloud afterrevealing that it deliberately slowed batteries in older phones, prompting investigations in several countries. It has since apologised, offering customers cheaper batteries and other modifications, though analysts have said that could reduce replacement purchases, potentially affecting the firm's bottom line. Jeff Fieldhack, research director at technology consultancy Counterpoint, said while Apple's opening quarter was ""fantastic"" for its new devices, it may struggle to keep sales levels up. ""Because of the higher prices, it will be a challenge to keep those volumes going,"" Mr Fieldhack said. He added the firm's performance in China, India and other emerging markets would also be crucial to future growth. Apple has struggled to lure customers away from several rivals in China, the world's largest smartphone market, as it competes against more affordable devices. It faces similar challenges in India, where the firm currently has just 2% market share . Growing its Indian customer base will be important for future sales, Mr Fieldhack said. iPhone X launch sees overnight queues Apple shares surge as iPhone X launches Apple iPhone X: The internet reacts Comments can not be loaded To load Comments you need to enable JavaScript in your browser Firefighters running out of water as wildfire declared most destructive in LA's history In maps: Thousands of acres on fire in LA 'Patients are collapsing in the waiting room': A&E nurses speak out Why does Trump want Greenland and what do its people think? How Canada's immigration debate soured - and helped seal Trudeau's fate 'I can't get divorced as I can't get my pension valued' What are cold weather payments and who can get them? BBC Sound of 2025: Barry Can't Swim is a new dance music superstar Ros Atkins on...Elon Musk's political interventions Jean-Marie Le Pen - founder of French far right and 'Devil of the Republic' Cases of HMPV are on the rise in China - but what is it? Politics Essential: Get the latest news and analysis delivered to your inbox every weekday Delivering brand-new miracles in 1970s East End Watch the latest series of Call the Midwife on iPlayer now Mark-Anthony Turnage shares the soundtrack of his life Once called 'Britain’s hippest composer', he's tackled topics from drug abuse to football in his work Paddy’s loaf-changing experience inside the bread factory Paddy McGuinness visits the bread factory he used to work in, and sees how they make 1.4 million loaves a week What's behind the global surrogacy boom? More countries are banning surrogacy – but demand is growing © 2025 BBC. The BBC is not responsible for the content of external sites.Read about our approach to external linking."
"Relief as 955 trapped miners are freedThe South African workers had been stuck since Wednesday, when a power cut stopped the lifts.2h2 hours agoAfrica","A rescued miner gestures out a bus window All 955 workers from a gold mine in South Africa have been safely brought back to the surface. They had been trapped underground since a power cut struck on Wednesday night, and back-up generators failed to work. ""Everybody's out,"" said James Wellsted, a spokesman for the operating firm Sibanye-Stillwater. He said there were ""cases of dehydration and high blood pressure but nothing serious"", and the mine would re-open on Monday. The BBC's Pumza Fihlani in South Africa says there were scenes of  jubilation as the miners were brought to the surface in the morning. Through the night, members of the local community and other workers had kept vigil outside the mine shaft, praying for the miners' safe return. The human cost of South Africa's mining industry The illegal gold fuelling gang battles in South Africa South Africa is a leading gold producer, but safety in the industry is often questioned. The Beatrix mine is in Welkom town, about 290km (180 miles) south-west of Johannesburg. It is owned by Sibanye-Stillwater mining firm. It has 23 levels, going down to 1,000 metres (3,280 ft) below ground. ""My children couldn't sleep,"" says Nontuthu Zelo Ngcai, a relative of a miner. She says worried family members called her through the night. The accident is thought to have occurred when a storm knocked over an electricity pylon close to the site, triggering a huge power cut. But on Friday morning electricity was finally restored to a lift, enabling the workers' release. ""It was stressful, there was not enough ventilation,"" said mineworker Mike Khonto. ""Thankfully our management managed to send us food and water."" They are being taken for food and showers upon their release, before having medical health checks. Power has now been restored at the site Anxious family members had gathered along the road to the mine but were kept back by security forces. Mr Wellsted said there was ""no indication so far that anyone has been in distress"" but it had been a ""traumatic experience"". Trade union officials had previously said they feared that the lives of the miners were at risk. They say this accident has highlighted the low safety standards in parts of the industry. More than 80 fatalities were recorded in South African mines in 2017. The human cost of SA's mining industry. Video, 00:02:45The human cost of SA's mining industry The illegal gold fuelling gang battles. Video, 00:04:08The illegal gold fuelling gang battles Africa Today podcast Firefighters running out of water as wildfire declared most destructive in LA's history In maps: Thousands of acres on fire in LA 'Patients are collapsing in the waiting room': A&E nurses speak out Why does Trump want Greenland and what do its people think? How Canada's immigration debate soured - and helped seal Trudeau's fate 'I can't get divorced as I can't get my pension valued' What are cold weather payments and who can get them? BBC Sound of 2025: Barry Can't Swim is a new dance music superstar Ros Atkins on...Elon Musk's political interventions Jean-Marie Le Pen - founder of French far right and 'Devil of the Republic' Cases of HMPV are on the rise in China - but what is it? Politics Essential: Get the latest news and analysis delivered to your inbox every weekday Delivering brand-new miracles in 1970s East End Watch the latest series of Call the Midwife on iPlayer now Mark-Anthony Turnage shares the soundtrack of his life Once called 'Britain’s hippest composer', he's tackled topics from drug abuse to football in his work Paddy’s loaf-changing experience inside the bread factory Paddy McGuinness visits the bread factory he used to work in, and sees how they make 1.4 million loaves a week What's behind the global surrogacy boom? More countries are banning surrogacy – but demand is growing © 2025 BBC. The BBC is not responsible for the content of external sites.Read about our approach to external linking."
Ministers 'too late' on child online safetyThe charity condemns the government for not implementing proposals to protect children online.6h6 hours agoUK,"A children's charity has criticised the government for failing to implement proposals to make young people safer online - 10 years after they were made in a government-commissioned report. The NSPCC says 11 of the 38 proposals were ignored and seven were partially implemented - four are now out of date. It says a mandatory code to regulate social media and tackle online grooming is now required. Ministers say they are working to make the UK the safest place to be online. Internet 'not designed for children' Tech firms must protect children online Children at 'significant' social media risk The recommendations were made following the 2008 ""Safer Children in a Digital World"" review which was commissioned by then-Prime Minister Gordon Brown and led by clinical psychologist Prof Tanya Byron. The Home Office has begun the process of creating a voluntary code to regulate websites, as part of its Internet Safety Strategy. However, the NSPCC said this move was recommended in 2008 and it was now ""too little, too late"". Instead, it wants the code to be mandatory, backed up by an independent regulator with fining powers. Features would include safe accounts for under-18s, extra protections like grooming alerts, and child endangerment reports to be published by social networks. Prof Byron, an NSPCC trustee and clinical psychologist, said the government was ""playing catch-up"". ""The internet is absolutely ubiquitous in children's lives today, and it is much too late for a voluntary code for social networks. ""The internet strategy must absolutely create a legally enforceable safety code to force social networks to keep children safe. ""The online world moves too fast for government to drag its feet for another decade."" The report comes days afterthe NSPCC revealed there had been more than 1,300 grooming offencesin the first six months since the ""sexual communication with a child"" offence came into force. Almost two-thirds of the cases took place on Facebook, Snapchat and Instagram. Prof Byron said: ""Social media companies have been left to mark their own homework, they haven't done it. ""We need specific rules so the social media companies are held to account and fined if they don't stick to those rules around child protection."" She added that the issue was ""too important for us to wait any longer"". Peter Wanless, chief executive of the NSPCC, said: ""It's simply wrong that the government has allowed social networks to mark their own homework for the past decade, and that their new strategy would let that continue. ""It's impossible to fathom how much harm has been done over those years in terms of online sexual abuse, hate speech, violent and harmful content and cyber bullying. ""Government must seize the opportunity to right this wrong in its Internet Safety Strategy and bring in a mandatory rulebook for social networks to protect children now and in the future."" A spokeswoman for the Department for Digital, Culture, Media and Sport said social media companies had to take further action to reduce the risks their platforms posed, particularly to children. She added: ""We are considering all options to make this happen - including changes to the law where necessary. ""We are working with industry, schools and parents to make sure there are robust protections in place."" Most children 'do not feel safe online' Social media sites 'face tax over abuse' Firefighters running out of water as wildfire declared most destructive in LA's history In maps: Thousands of acres on fire in LA 'Patients are collapsing in the waiting room': A&E nurses speak out Why does Trump want Greenland and what do its people think? How Canada's immigration debate soured - and helped seal Trudeau's fate 'I can't get divorced as I can't get my pension valued' What are cold weather payments and who can get them? BBC Sound of 2025: Barry Can't Swim is a new dance music superstar Ros Atkins on...Elon Musk's political interventions Jean-Marie Le Pen - founder of French far right and 'Devil of the Republic' Cases of HMPV are on the rise in China - but what is it? Politics Essential: Get the latest news and analysis delivered to your inbox every weekday Delivering brand-new miracles in 1970s East End Watch the latest series of Call the Midwife on iPlayer now Mark-Anthony Turnage shares the soundtrack of his life Once called 'Britain’s hippest composer', he's tackled topics from drug abuse to football in his work Paddy’s loaf-changing experience inside the bread factory Paddy McGuinness visits the bread factory he used to work in, and sees how they make 1.4 million loaves a week What's behind the global surrogacy boom? More countries are banning surrogacy – but demand is growing © 2025 BBC. The BBC is not responsible for the content of external sites.Read about our approach to external linking."
May under pressure over Brexit position,"This video can not be played PM: The UK will not have to choose between EU deal and one with the rest of the world. Theresa May is coming under increasing pressure to set out where she stands on Britain's future trade agreements. Speaking at the end of a trade visit to China, the PM said Britain would not face a choice between a free trade deal with the EU after Brexit and striking deals with the rest of the world. It comes as she has faced criticism from Eurosceptic Tory MPs that she is heading for a ""Brexit in name only"". Full negotiations on the UK's 2019 exit are to resume on Monday. Brexit Secretary David Davis will meet his EU counterpart Michel Barnier in London on Monday for the first time this year, with officials from both sides continuing technical discussions during the week. Allow Twitter content? This article contains content provided by Twitter. We ask for your permission before anything is loaded, as they may be using cookies and other technologies. You may want to readTwitter’s cookie policy,externalandprivacy policy,externalbefore accepting. To view this content choose‘accept and continue’. During the prime minister's three-day visit to China, Downing Street said more than £9bn of business deals were signed and it agreed to a joint investment and trade review as the ""first step"" to an ""ambitious"" post-Brexit deal with the world's second largest economy. What the EU really wants from the UK Kuenssberg: PM returns from China to Brexit tensions May hails 'first step' to China trade deal However, Mrs May has faced growing criticism from MPs, including many in her own party, who have called for her to be more specific about her priorities on UK's future trade arrangements with the EU. Inan interview with Bloomberg News,external, Liam Fox, who was with Mrs May in China, said the UK cannot be involved in any customs union with the EU following Brexit. Number 10 said the international trade secretary was speaking for the government - but also said the details of future arrangements with Brussels were a matter for negotiation. ""It is fair to say the prime minister has an open mind when it comes to these negotiations,"" a Downing Street spokesman said. Theresa May and her husband Philip in Shanghai By Iain Watson, BBC political correspondent While Theresa May has been away - successfully signing trade deals -  I have been assessing the battles she faces on the home front, within her own party. What is most striking is that some who supported her have, at the very least, become wobblier. One ex-minister said he felt ""badly let down"". She has been accused of blocking, not delivering, radical change. A former supporter questioned her lack of decisiveness: ""She has more reviews than a film critic would produce in a lifetime."" A Remainer who despises Boris Johnson wondered if - to coin a phrase - the foreign secretary's ""bad leadership would be better than no leadership"". Council candidates fear poor results in London's May elections and think this could be a trigger for the PM to go. And a Conservative-supporting business leader felt - though he didn't advocate it - that her opponents ""will pull the pin from the grenade"". Downing Street believes the feeding frenzy of speculation will abate when more progress is made on EU withdrawal. But they are aware of the challenges at home as well as abroad. Speaking to the BBC's political editor Laura Kuenssberg, the prime minister said she had already spelled out what she wants from the deal and did not believe the UK would have to choose between Europe and the rest of the world. ""I don't believe that those are the alternatives,"" she said. ""What the British people voted for is for us to take back control of our money, our borders and our laws and that's exactly what we are going to do. ""We also want to ensure that we can trade across borders."" By Kerry Allen, China Media Analyst, BBC Monitoring Mainland Chinese media have praised Theresa May's 31 January-2 February visit from start to finish. Official broadcaster CCTV says that the nickname media have given her - ""Auntie May"" - shows that she has become ""one of the family"" and newspapers have heralded her trip as showing that Sino-UK ties signal new heights for bilateral cultural exchanges, and post-Brexit trade deals. They have also given a nod to Mrs May for, reportedly, not raising human rights issues in Hong Kong during her stay. Nationalist newspaper Global Timescommends the UK prime minister,externalfor ""not making any comment contrary to the goals of her China trip"", saying ""the losses outweigh the gains if she appeases the British media at the cost of the visit's friendly atmosphere"". Independent Hong Kong and Taiwanese media have been critical of the Prime Minister for not raising the contentious issue of pro-democracy protests. Publications including influential paper South China Morning Postquote former British governor Chris Patten,external, who said the Hong Kong dialogue was ""critical"" to granting assurances that developing ties with the mainland won't come at Hong Kong's expense. The prime minister has come under pressure from Eurosceptics worried about potential concessions by the UK in the Brexit talks. Last week, Chancellor Philip Hammond suggested Britain's relationship with the EU would change only ""very modestly"" after Brexit. However, cabinet members - including Foreign Secretary Boris Johnson - have warned the UK will lose the main advantages of Brexit if it remains bound by trade rules of the single market and customs union. They have called for the prime minister to be clearer about her own position. She told the BBC her goal in upcoming talks with Europe was to strike a deal that ""is going to be good for trade between the UK and EU and good for jobs in Britain"". This video can not be played Theresa May: I am not a quitter She added: ""It means a free trade agreement with the EU. We are now starting to negotiate that free trade agreement with the EU."" She has repeatedly said Brexit will mean leaving the single market and customs union. Asked again about her own future as prime minister, Mrs May said: ""I'm not a quitter. I'm in this because there is a job to be done here and that's delivering for the British people and doing that in a way that ensures the future prosperity of our country."" May to fight post-Brexit residency move PM returns from China to Brexit tensions Comments can not be loaded To load Comments you need to enable JavaScript in your browser Firefighters running out of water as wildfire declared most destructive in LA's history In maps: Thousands of acres on fire in LA 'Patients are collapsing in the waiting room': A&E nurses speak out Why does Trump want Greenland and what do its people think? How Canada's immigration debate soured - and helped seal Trudeau's fate 'I can't get divorced as I can't get my pension valued' What are cold weather payments and who can get them? BBC Sound of 2025: Barry Can't Swim is a new dance music superstar Ros Atkins on...Elon Musk's political interventions Jean-Marie Le Pen - founder of French far right and 'Devil of the Republic' Cases of HMPV are on the rise in China - but what is it? Politics Essential: Get the latest news and analysis delivered to your inbox every weekday Delivering brand-new miracles in 1970s East End Watch the latest series of Call the Midwife on iPlayer now Mark-Anthony Turnage shares the soundtrack of his life Once called 'Britain’s hippest composer', he's tackled topics from drug abuse to football in his work Paddy’s loaf-changing experience inside the bread factory Paddy McGuinness visits the bread factory he used to work in, and sees how they make 1.4 million loaves a week What's behind the global surrogacy boom? More countries are banning surrogacy – but demand is growing © 2025 BBC. The BBC is not responsible for the content of external sites.Read about our approach to external linking."
