headline,article
Russia plans biggest war in Europe since 1945 - PM,"This video can not be played Watch: Boris Johnson says people need to understand the ""sheer cost in human life"" war could entail Evidence suggests Russia is planning ""the biggest war in Europe since 1945"", Prime Minister Boris Johnson has said. He told the BBC's Sophie Raworth in an interview: ""All the signs are that the plan has already in some senses begun."" Intelligence suggests Russia intends to launch an invasion that will encircle Ukrainian capital Kyiv, Mr Johnson said. ""People need to understand the sheer cost in human life that could entail,"" he said. The prime minister was speaking from Munich, where world leaders are meeting for an annual security conference. Ukraine: How big is the Russian military build-up? UK vows to step up support for Ukraine Ukraine invasion would shock the world - PM The latest estimates by the US government suggests that between 169,000 and 190,000 Russian troops are stationed along Ukraine's border, both in Russia and neighbouring Belarus - but this figure also includes Russian-backed rebels in eastern Ukraine. Mr Johnson warned that any conflict could be ""bloody and protracted"", saying Russian President Vladimir Putin was possibly ""thinking illogically about this"" and did not ""see the disaster ahead"". ""I think it's vital for us all now to get over what a catastrophe it would be for Russia,"" he added. He indicated that the UK and US would bring further sanctions against Russiathan have been suggested before,including stopping its companies ""trading in pounds and dollars"" - a move that he said would ""hit very, very hard"". Mr Johnson added: ""The lesson of [the Russian seizure of Crimea from Ukraine in] 2014 is that you can't just let Vladimir Putin get away with it."" An invasion of Ukraine would strengthen, rather than weaken, Nato, he predicted, saying Western countries could not allow opposition forces to come to ""the false conclusion that might is right"". ""If [Mr Putin] thinks he's going to get less Nato as a result of this, he's totally wrong,"" Mr Johnson said. ""He's going to get more Nato."" By Peter Saull, political correspondent While a full-blown Russian invasion of Ukraine is yet to materialise, Boris Johnson's latest comments ratchet up the war of words. The prime minister raising the prospect of a conflict as devastating as World War II is designed to focus minds. The ongoing tensions in eastern Europe have given Mr Johnson, who's faced a myriad of problems at home, a chance to show leadership on the world stage. And on the sidelines of the Munich security conference, he seems to have made some progress on the question of sanctions. Stopping Russian companies' ability to trade in pounds and dollars is a new proposal designed to do serious damage to the country's finances. Ukraine is not a member of Nato or the European Union but has close relations with both. Russia is insisting its neighbour should not be allowed to join Nato, which it sees as a threat to its security. Western nations have accused Russia of trying to stage a fake crisis on Ukraine's border, warning in recent weeks Mr Putin's forces could be preparing to invade at any time. But Russia has denied the claims, saying the massed troops are just conducting military exercises. Asked whether a Russian invasion was still thought to be imminent, Mr Johnson said: ""I'm afraid that that is what the evidence points to. There's no burnishing it."" The prime minister said US President Joe Biden had told Western leaders that intelligence suggested Russian forces were not just planning on entering Ukraine from the east, via Donbas, but down from Belarus and the area surrounding Kyiv. ""I'm afraid to say that the plan we are seeing is for something that could be really the biggest war in Europe since 1945, just in terms of sheer scale,"" he said. People needed to not only consider the potential loss of life of Ukrainians, but also of ""young Russians"", he added. Mr Johnson was speaking after meeting Ukrainian President Volodymyr Zelensky andtelling world leaders in a speechthat any invasion of Ukraine by Russia would ""echo around the world"". During a phone call on Sunday, the prime minister and French President Emmanuel Macron agreed the next week would be ""crucial for diplomacy"". A No 10 spokeswoman said the two leaders updated one another on their ""respective diplomatic efforts"", including Mr Macron's call with Mr Putin on Sunday. ""The prime minister noted that President Putin's commitments to President Macron were a welcome sign that he might still be willing to engage in finding a diplomatic solution,"" the spokeswoman added. She said Mr Johnson stressed Ukraine's ""voice must be central"" in any talks, and that the two leaders ""underscored the need for President Putin to step back from his current threats and withdraw troops from Ukraine's border"". Labour said it stood ""four-square behind the UK government and Nato, with shadow health secretary Wes Streeting telling Sky News: ""There should be no doubt on the resolve of the UK, on a cross-party basis, and the resolve of Nato across the alliance."" But he also urged the government to do more to prevent the City of London being a ""centre"" for ""Russian kleptocrats and money laundering"". Writing in the Sunday Telegraph, Home Secretary Priti Patel warned the crisis could bring an increased risk of cyber attacks in Britain. She said past Russian cyber activity had included interference with UK media, telecommunications, and energy infrastructure, and the government expected to see an escalation of similar operations in the coming months. In the same paper, Lindy Cameron, head of the National Cyber Security Centre (NCSC), said that ""attacks targeting Ukraine's digital infrastructure could be felt here in Britain"". She said that, in 2017, malware used by the Russian military to target infrastructure in Ukraine ""spiralled recklessly out of control to affect many other countries, including the UK'. GRAVITY DEFYING TRICKS:James Woods introduces possibly the greatest skier you've never heard of BOOST YOUR BRAIN:Find out how to banish brain fog with these free and simple steps Watching for an invasion on Ukraine's long border Has Putin's war in Ukraine failed? Ukraine: Russia's possible attack routes Governor says lack of water for hydrants 'impaired' fight against wildfires 'I have nothing to go back to' - BBC reporter tells of LA fires heartbreak Trump avoids prison or fine in hush-money case sentencing LA fires: How three days of devastation unfolded What's the latest on the Los Angeles wildfires and what caused them? 'My mum died after four days on an A&E trolley' The '9/11 mastermind' wants to plead guilty. Why is the US trying to stop him? Pop star Chappell Roan wins BBC Sound Of 2025 Weekly quiz: Zendaya looked happy but who else sparkled at the Golden Globes? Inside the UK's first legal drug consumption room Danes struggle with response to Trump Greenland threat Off air with Laura K: Get Laura Kuenssberg's expert insight emailed directly to you Dragons’ Den returns with a new line-up of celebrity guests Can a fresh batch of entrepreneurs secure the deal of a lifetime? Are smart scales really as ‘smart’ as they claim to be? Greg Foot explores whether they can accurately measure weight, body fat, muscle and bone mass The award-winning psychological competition is back A nail-biting game of detection, backstabbing and trust. Who will make it through? How close are we to a cancer vaccine? How might it help in the treatment of the disease? © 2025 BBC. The BBC is not responsible for the content of external sites.Read about our approach to external linking."
UK vows to step up support for Ukraine,"This video can not be played Visiting Kyiv, UK Foreign Secretary Liz Truss praised Ukrainians' stoicism and fortitude Foreign Secretary Liz Truss says the UK is increasing its financial support for Ukraine, amid tensions with Russia. Speaking in Kyiv, Ms Truss said the UK would be spending an additional £12m on democracy and energy independence projects in the country. Western allies have warned Russia could try to stage an attack to justify invading Ukraine. Russia has repeatedly denied it has plans to invade despite amassing more than 100,000 troops along the border. As part of ongoing diplomatic efforts, Ms Truss visited the Ukrainian capital, holding a press conference alongside the country's Foreign Minister Dmytro Kuleba. She praised the country's ""fortitude in the face of Russian aggression"" and pledged UK's ""steadfast support"". Mr Kuleba said Ukrainian-British relationships had ""reached an unprecedentedly high level"". LIVE: West must not be fooled by Russia's claims - Truss What is Nato and why doesn't Russia trust it? Russian troop withdrawal claim is false, says US In addition to increasing funding for Ukraine's defence capabilities from £88m to £100m, Ms Truss also announced a new ""trilateral partnership"" with Ukraine and Poland to ""intensify work on defence and security, sanctions, energy security and countering disinformation"". The foreign secretary also warned that ""false-flag"" operations were taking place in the region adding: ""We are very clear the aggressor in this situation is Russia."" A false-flag attack is where one side stages or fabricates an attack against it in order to justify the use of force in retaliation. Earlier in the day, Nato Secretary General Jens Stoltenberg said Russia could be ""trying to stage a pretext for an armed attack against Ukraine"". Russia has accused the West of ""hysteria"" over such warnings in recent weeks. It has also called on Nato to guarantee Ukraine will not be allowed to join the defence alliance. Nato insists it will keep its open door policy, and has been increasingly concerned an invasion is on the cards. Mr Stoltenberg, said there were ""signs from Moscow that diplomacy could continue"", but that the West had ""not seen any sign of withdrawal or de-escalation"". Speaking from an RAF base in Waddington, Lincolnshire, UK Prime Minister Boris Johnson said there was ""still time to avoid a catastrophe"" but said the picture from the region was ""very grim"". He added that a Russian invasion would result in a ""bloody and protracted conflict in which, I'm afraid, there will be many casualties and including many Russian casualties"" In a speech following the press conference in Kyiv, Ms Truss, who became foreign secretary last year, said the current crisis in the region was a ""litmus test"" for the West. ""The free world needs to draw the line under a decade of drift... we must stand up to and defuse Russian aggression now, because if we don't it will embolden not only the Kremlin, but aggressors, authoritarians and autocrats everywhere. ""The West needs to wise up. We need to work together to discredit their arguments in public."" Ms Truss is now travelling to Poland for a meeting with her Polish counterpart, before heading to the Munich Security Conference on Saturday for meetings with allies. The UK has no troops in Ukraine but it has increased numbers in Estonia to the ""high hundreds,"" according to the Ministry of Defence, as well as sending additional helicopters, jets and warships to the region. A further 1,000 British troops are also on standby to support Nato if called upon. Comments can not be loaded To load Comments you need to enable JavaScript in your browser Governor says lack of water for hydrants 'impaired' fight against wildfires 'I have nothing to go back to' - BBC reporter tells of LA fires heartbreak Trump avoids prison or fine in hush-money case sentencing LA fires: How three days of devastation unfolded What's the latest on the Los Angeles wildfires and what caused them? 'My mum died after four days on an A&E trolley' The '9/11 mastermind' wants to plead guilty. Why is the US trying to stop him? Pop star Chappell Roan wins BBC Sound Of 2025 Weekly quiz: Zendaya looked happy but who else sparkled at the Golden Globes? Inside the UK's first legal drug consumption room Danes struggle with response to Trump Greenland threat Off air with Laura K: Get Laura Kuenssberg's expert insight emailed directly to you Dragons’ Den returns with a new line-up of celebrity guests Can a fresh batch of entrepreneurs secure the deal of a lifetime? Are smart scales really as ‘smart’ as they claim to be? Greg Foot explores whether they can accurately measure weight, body fat, muscle and bone mass The award-winning psychological competition is back A nail-biting game of detection, backstabbing and trust. Who will make it through? How close are we to a cancer vaccine? How might it help in the treatment of the disease? © 2025 BBC. The BBC is not responsible for the content of external sites.Read about our approach to external linking."
Is ending last Covid rule brave?,"The last remaining Covid restriction in England could be gone in weeks, after the prime minister announcedthe legal requirement to isolate after a positive test may be scrapped early. The plan had been to end it on 24 March - but if the trends remained positive, Boris Johnson said, it could go a month early. The move has taken many experts by surprise, with one describing it as either brave or stupid. When will the self-isolation rules be scrapped? What Covid rules remain across the UK? As often with Covid, the evidence is unclear. Certainly questions are being asked about the politics of the move, with the prime minister under continuing pressure. But there is plenty of positive news in the latest data - as the prime minister suggested. Hospital cases are falling and, despite the large wave of Omicron infections, overall deaths have not risen above what would normally be seen in winter. With new treatments and a huge amount of immunity in the population, from both vaccination and infection, the risk from the virus is lessening all the time. Other nations are also relaxing rules around self-isolation. Denmark, for example, now requires people to stay at home only if they have symptoms. Nonetheless, there are also grounds for caution. Infection levels remain high. And the Office for National Statistics (ONS) monitoring programme suggests they may even be rising again, with about one out of every 19 people in England positive last week. Coupled with this is the rise of a sub-variant of Omicron, BA.2, thought to be even more transmissible than the version, first identified in South Africa, that caused the Christmas surge. BA.2 now accounts for an estimated one out of every six infections - a proportion that is growing every week. This is one of the reasons Prof Paul Hunter, an expert in infectious disease, at the University of East Anglia, was surprised by the announcement on self-isolation. ""At some point, it is going to be the case that all remaining restrictions are dropped, including the need to self-isolate, though I certainly didn't expect that to happen this month,"" he says. Prof Hunter would have preferred to wait a little bit longer to see what happens with infections and the sub-variant. Dr Simon Clarke, from the University of Reading, who says that the move is either ""brave or stupid"", explains that the problem is nobody knows for sure what the impact will be. Some believe people could now feel pressurised into returning to work before they are physically ready or no longer infectious. It is worth bearing in mind, though, not every infected person was isolating anyway. This winter, the testing system has been picking up only half of all infections - so at the peak, an estimated 200,000 people a day in England who should have been were not being formally asked to isolate. Furthermore, about one in five of those who test positive does not fully adhere to the isolation requirements, according to the ONS. It is easy to overestimate the impact of government rules and the significance of removing them. After all, at Christmas there were no limits on mixing in England - but contact levels were still at incredibly low rates, similar to those seen in the first lockdown. Just because the public is no longer under a legal requirement to isolate, it does not mean they will suddenly stop staying home when ill. After all, when the rules do end, there will be guidance about the importance of staying at home if you are ill. Those willing and able to follow the rules - some say there has been insufficient financial support to help people on low incomes isolate when they risk losing earnings - may largely continue with their current behaviours, University College London epidemiologist Prof Tim Colbourn says. ""Ending legal isolation requirements doesn't meant everyone will freely spread Covid everywhere,"" he says. ""People still care about family, friends and colleagues. ""Given the availability of rapid tests and current isolation law being largely unenforceable, it might not actually make much difference."" Follow Nickon Twitter,external. Read morefrom Nick. LOOK-UP TOOL:How many cases in your area? YOUR QUESTIONS:We answer your queries GLOBAL SPREAD:How many worldwide cases are there? TREATMENTS:What progress are we making to help people? COVID IN SCHOOL:What are the risks? Do you have any questions about the end of Covid restrictions? How will it affect you? Share your questions, views and experiences by emailinghaveyoursay@bbc.co.uk,external. Please include a contact number if you are willing to speak to a BBC journalist. You can also get in touch in the following ways: WhatsApp:+44 7756 165803 Tweet:@BBC_HaveYourSay,external Upload pictures or video Please read ourterms & conditionsandprivacy policy If you are reading this page and can't see the form you will need to visit the mobile version of theBBC websiteto submit your question or comment or you can email us atHaveYourSay@bbc.co.uk,external. Please include your name, age and location with any submission. How many cases are there in your area? Which country has been hit hardest? Comments can not be loaded To load Comments you need to enable JavaScript in your browser Governor says lack of water for hydrants 'impaired' fight against wildfires 'I have nothing to go back to' - BBC reporter tells of LA fires heartbreak Trump avoids prison or fine in hush-money case sentencing LA fires: How three days of devastation unfolded What's the latest on the Los Angeles wildfires and what caused them? 'My mum died after four days on an A&E trolley' The '9/11 mastermind' wants to plead guilty. Why is the US trying to stop him? Pop star Chappell Roan wins BBC Sound Of 2025 Weekly quiz: Zendaya looked happy but who else sparkled at the Golden Globes? Inside the UK's first legal drug consumption room Danes struggle with response to Trump Greenland threat Off air with Laura K: Get Laura Kuenssberg's expert insight emailed directly to you Dragons’ Den returns with a new line-up of celebrity guests Can a fresh batch of entrepreneurs secure the deal of a lifetime? Are smart scales really as ‘smart’ as they claim to be? Greg Foot explores whether they can accurately measure weight, body fat, muscle and bone mass The award-winning psychological competition is back A nail-biting game of detection, backstabbing and trust. Who will make it through? How close are we to a cancer vaccine? How might it help in the treatment of the disease? © 2025 BBC. The BBC is not responsible for the content of external sites.Read about our approach to external linking."
