headline,article
"Marvel's Stan Lee dies aged 95Lee, the brains behind Spider-Man, Black Panther and X-Men, is survived by his daughter.Entertainment & Arts","Stan Lee was born Stan Lieberman in 1922 Tributes are being paid to American writer and former president of Marvel Comics Stan Lee, who has died at the age of 95. Lee created The Fantastic Four for Marvel Comics in 1961 and went on to create titles including Spider-Man and The Incredible Hulk. Actor Chris Evans, best known for playing Marvel's Captain America, wrote ""there will never be another Stan Lee,external"". X-Men star Hugh Jackman said ""we've lost a creative genius."" Allow Twitter content? This article contains content provided by Twitter. We ask for your permission before anything is loaded, as they may be using cookies and other technologies. You may want to readTwitter’s cookie policy,externalandprivacy policy,externalbefore accepting. To view this content choose‘accept and continue’. Robert Downey Jr, who played Iron Man, simply wrote: ""I owe it all to you, Rest in Peace Stan."" Allow Instagram content? This article contains content provided by Instagram.  We ask for your permission before anything is loaded, as they may be using cookies and other technologies.  You may want to readMeta’s Instagram cookie policy,externalandprivacy policy,externalbefore accepting. To view this content choose‘accept and continue’. Kevin Feige, the producer and president of Marvel Studios, tweeted: ""No one has had more of an impact on my career and everything we do at Marvel Studios than Stan Lee."" Allow Twitter content? This article contains content provided by Twitter. We ask for your permission before anything is loaded, as they may be using cookies and other technologies. You may want to readTwitter’s cookie policy,externalandprivacy policy,externalbefore accepting. To view this content choose‘accept and continue’. The legendary comic book author died at Cedars Sinai Medical Center in Los Angeles, according to a family lawyer. Tom Hardy, who stars in Venom, the latest film based on a Marvel Comics character, shared a photo of Lee on set, via Instagram. Allow Instagram content? This article contains content provided by Instagram.  We ask for your permission before anything is loaded, as they may be using cookies and other technologies.  You may want to readMeta’s Instagram cookie policy,externalandprivacy policy,externalbefore accepting. To view this content choose‘accept and continue’. Sir Patrick Stewart told Radio 4's Today programme he had met Lee ""numerous times"". ""He loved to visit the set and he became famous, like Hitchcock, for appearing in his movies,"" said the actor, who played Professor X in the X-Men series. ""He created flawed heroes and it was one of the things that made X-Men so interesting for all of us who worked on them,"" he continued. ""We were always very much aware that no matter what our superpowers were, we were human beings, we could make mistakes and things could go wrong. It was that quality which gave humanity to all of Stan's work."" Evangeline Lilly, who portrayed Ant Man's superhero partner, the Wasp, shared a tribute on Twitter. Allow Twitter content? This article contains content provided by Twitter. We ask for your permission before anything is loaded, as they may be using cookies and other technologies. You may want to readTwitter’s cookie policy,externalandprivacy policy,externalbefore accepting. To view this content choose‘accept and continue’. And Deadpool actor Ryan Reynoldsposted,external: ""Damn... RIP Stan. Thanks for everything."" Tom Holland, who is Marvel's latest Spider-Man, wrote that he ""was indebted"" to Lee. Allow Instagram content? This article contains content provided by Instagram.  We ask for your permission before anything is loaded, as they may be using cookies and other technologies.  You may want to readMeta’s Instagram cookie policy,externalandprivacy policy,externalbefore accepting. To view this content choose‘accept and continue’. Other stars to pay tribute include Angela Bassett, Zoe Saldana, Jamie Chung, Josh Groban, Jamie Lee Curtis, Chris Hemsworth, Benedict Cumberbatch, Chris Pratt and Josh Brolin. Shane Duffy, CEO of Lee's Pow! Entertainment, praised the ""father of pop culture"" for inventing ""universes of characters"". He was, Duffy continued, ""a true iconic pioneer with no comparable second."" The Walt Disney Company, which bought Marvel Entertainment in 2009, lauded Lee's  ""unmatchable"" life and career in a statement. ""Every time you open a Marvel comic, Stan will be there,"" it said. ""Please join us today in remembering Stan 'The Man' Lee."" Rival publisher DC Comics also tweeted a tribute. Allow Twitter content? This article contains content provided by Twitter. We ask for your permission before anything is loaded, as they may be using cookies and other technologies. You may want to readTwitter’s cookie policy,externalandprivacy policy,externalbefore accepting. To view this content choose‘accept and continue’. Broadcaster Jonathan Ross remembered Lee as ""an incredible showman"" who had ""touched so many millions with his work"". ""He was also a very warm, very kind and very nice human being,"" Ross told BBC Breakfast. Lee's wife, Joan, died in 2017, also aged 95. He is survived by his daughter, JC Lee. Speaking to celebrity news website TMZ,external, JC Lee said her father was ""the greatest, most decent man"". She told Reuters: ""He felt an obligation to his fans to keep creating."" In recent years Lee had periodically suffered from illnesses, including a bout of pneumonia. Stan Lee was born Stanley Lieber in 1922 He was known for making a cameo in almost every Marvel film. Despite leaving the Marvel company in 1972, he remained chairman emeritus. The genius of superhero creator Stan Lee Stan Lee: 'You are my superhero' 'Marvel muse' Joan Lee dies at 95 On Sunday - Veterans Day - his official Facebook page shared a photograph of Lee in the Army, noting that his official title during World War II was Playwright. Allow Facebook content? This article contains content provided by Facebook. We ask for your permission before anything is loaded, as they may be using cookies and other technologies. You may want to readMeta’s Facebook cookie policy,externalandprivacy policy,externalbefore accepting. To view this content choose‘accept and continue’. Lee was born in 1922 to working-class Jewish immigrants from Romania. He began working at the comics section of Martin Goodman's Timely Publications - a company that would eventually transform into Marvel Comics - and became comics editor there at age 18. For years Lee wrote only simple comics, focusing on crime stories, horrors and westerns and aimed at young readers. Aged 40, he decided to give up on comics. But his wife Joan urged him to create the characters he always wanted to write as his comic swansong. In 1961, Lee and artist Jack Kirby created the Fantastic Four - compelling characters with individual personalities and relatable problems. Timely Publications was renamed Marvel, and the golden age of comic books began. Black Panther (portrayed in film by actor Chadwick Boseman, right) was one of the first black mainstream superheroes in America Many Marvel characters were groundbreaking at the time. For example, Black Panther was the first black superhero featured in a mainstream US comic. Other characters he created include the Silver Surfer, the X-Men, Iron Man and Doctor Strange. Lee was also known for giving artists their due credit. Kirby, Frank Miller, John Romita and others achieved cult status in their own right. In its heyday, Marvel sold 50 million copies a year. Until he retired from editing in 1971, Lee wrote all the copy for Marvel's covers. The genius of superhero creator Stan Lee 'Stan Lee is my superhero' Marvel's Stan Lee 'subject to elder abuse' 'Marvel muse' Joan Lee dies at 95 Wildfire sweeps through Hollywood Hills and threatens landmarks as chaos grips LA Paris Hilton among stars 'heartbroken' as she watches home 'burn to ground' Commuters warned of icy roads as cold snap continues to freeze UK Sound Of 2025: Ezra Collective are 'keeping music real' The Papers: 'Apocalypse' LA and 'Reeves faces extra tax rises' How Australia's beach cabana drama sparked a turf war H-1B: Visa row under Trump fuels anxiety for Indian dreamers 'I thought I was going to die': Jailed Venezuelan activist details brutality of prison life The man who could become Canada's future PM 'Trump 2.0' looms large over the global economy A politician was shot dead in Bangkok. Did another country do it? Chris Mason: Is Starmer leaving the door open to an abuse inquiry? Delivering brand-new miracles in 1970s East End Watch the latest series of Call the Midwife on iPlayer now Mark-Anthony Turnage shares the soundtrack of his life Once called 'Britain’s hippest composer', he's tackled topics from drug abuse to football in his work Paddy’s loaf-changing experience inside the bread factory Paddy McGuinness visits the bread factory he used to work in, and sees how they make 1.4 million loaves a week What's behind the global surrogacy boom? More countries are banning surrogacy – but demand is growing © 2025 BBC. The BBC is not responsible for the content of external sites.Read about our approach to external linking."
"Briton dies from rabies after cat biteThe individual was on holiday in Morocco, a country deemed high risk by public health officials.UK","A cat in Morocco (file picture) A Briton has died after contracting rabies while on holiday in Morocco, health officials have said. Public Health England said the victim became infected after being bitten by a cat. PHEissued a reminder to travellers,externalto avoid coming into contact with animals when in rabies-affected countries. Rabies is not found in wild or domestic animals in the UK, but five Britons became infected between 2000 and 2017 after ""animal exposures abroad"". Some species of bats in the UK can carry a rabies-like virus. According to the World Health Organization,external, the disease occurs in more than 150 countries and causes tens of thousands of deaths every year, mainly in Asia and Africa. It says in up to 99% of cases, domestic dogs are responsible for the transmission of the virus to humans. TheUK government says,externalnorth African countries such as Morocco, Algeria and Tunisia are among 139 nations where there is a high risk. PHE did not release further details about the Briton's death. It said that while there was no risk to the wider public, as a precautionary measure, health workers and close contacts of the person who died were being assessed and offered vaccination if necessary. Rabies is a viral infection that affects the brain and central nervous system. It is passed on through bites and scratches from an infected animal. There are no documented instances of it being transmitted via human to human contact. Dr Mary Ramsay, head of immunisations at PHE, said: ""This is an important reminder of the precautions people should take when travelling to countries where rabies is present."" The last recorded rabies case in Britain was in 2012, after a UK resident was bitten by a dog in south Asia. Electron micrograph of the rabies virus Initial symptoms can include anxiety, headaches and fever As the disease progresses, there may be hallucinations and respiratory failure Spasms of the muscles used for swallowing make it difficult for the patient to drink The incubation period between being infected and showing symptoms is between three and 12 weeks If you are bitten, scratched or licked by an animal you must wash the wound or site of exposure with plenty of soap and water and seek medical advice without delay Once symptoms have developed, rabies is almost always fatal Before symptoms develop, rabies can be treated with a course of vaccine - this is ""extremely effective"" when given promptly after a bite - along with rabies immunoglobulin if required Every year, more than 15m people worldwide receive a post-bite vaccination and this is estimated to prevent hundreds of thousands of deaths But effective treatment for rabies is not readily available to those in need Pre-exposure immunisation is recommended for people in certain high-risk occupations and for travellers to rabies-affected, remote areas Source: Public Health England/World Health Organization Rabies warning over imported puppies Rabies jabs for girl, 8, bitten by bat Wildfire sweeps through Hollywood Hills and threatens landmarks as chaos grips LA Paris Hilton among stars 'heartbroken' as she watches home 'burn to ground' Commuters warned of icy roads as cold snap continues to freeze UK Sound Of 2025: Ezra Collective are 'keeping music real' The Papers: 'Apocalypse' LA and 'Reeves faces extra tax rises' How Australia's beach cabana drama sparked a turf war H-1B: Visa row under Trump fuels anxiety for Indian dreamers 'I thought I was going to die': Jailed Venezuelan activist details brutality of prison life The man who could become Canada's future PM 'Trump 2.0' looms large over the global economy A politician was shot dead in Bangkok. Did another country do it? Chris Mason: Is Starmer leaving the door open to an abuse inquiry? Delivering brand-new miracles in 1970s East End Watch the latest series of Call the Midwife on iPlayer now Mark-Anthony Turnage shares the soundtrack of his life Once called 'Britain’s hippest composer', he's tackled topics from drug abuse to football in his work Paddy’s loaf-changing experience inside the bread factory Paddy McGuinness visits the bread factory he used to work in, and sees how they make 1.4 million loaves a week What's behind the global surrogacy boom? More countries are banning surrogacy – but demand is growing © 2025 BBC. The BBC is not responsible for the content of external sites.Read about our approach to external linking."
Briton dies from rabies after cat bite,"A cat in Morocco (file picture) A Briton has died after contracting rabies while on holiday in Morocco, health officials have said. Public Health England said the victim became infected after being bitten by a cat. PHEissued a reminder to travellers,externalto avoid coming into contact with animals when in rabies-affected countries. Rabies is not found in wild or domestic animals in the UK, but five Britons became infected between 2000 and 2017 after ""animal exposures abroad"". Some species of bats in the UK can carry a rabies-like virus. According to the World Health Organization,external, the disease occurs in more than 150 countries and causes tens of thousands of deaths every year, mainly in Asia and Africa. It says in up to 99% of cases, domestic dogs are responsible for the transmission of the virus to humans. TheUK government says,externalnorth African countries such as Morocco, Algeria and Tunisia are among 139 nations where there is a high risk. PHE did not release further details about the Briton's death. It said that while there was no risk to the wider public, as a precautionary measure, health workers and close contacts of the person who died were being assessed and offered vaccination if necessary. Rabies is a viral infection that affects the brain and central nervous system. It is passed on through bites and scratches from an infected animal. There are no documented instances of it being transmitted via human to human contact. Dr Mary Ramsay, head of immunisations at PHE, said: ""This is an important reminder of the precautions people should take when travelling to countries where rabies is present."" The last recorded rabies case in Britain was in 2012, after a UK resident was bitten by a dog in south Asia. Electron micrograph of the rabies virus Initial symptoms can include anxiety, headaches and fever As the disease progresses, there may be hallucinations and respiratory failure Spasms of the muscles used for swallowing make it difficult for the patient to drink The incubation period between being infected and showing symptoms is between three and 12 weeks If you are bitten, scratched or licked by an animal you must wash the wound or site of exposure with plenty of soap and water and seek medical advice without delay Once symptoms have developed, rabies is almost always fatal Before symptoms develop, rabies can be treated with a course of vaccine - this is ""extremely effective"" when given promptly after a bite - along with rabies immunoglobulin if required Every year, more than 15m people worldwide receive a post-bite vaccination and this is estimated to prevent hundreds of thousands of deaths But effective treatment for rabies is not readily available to those in need Pre-exposure immunisation is recommended for people in certain high-risk occupations and for travellers to rabies-affected, remote areas Source: Public Health England/World Health Organization Rabies warning over imported puppies Rabies jabs for girl, 8, bitten by bat Wildfire sweeps through Hollywood Hills and threatens landmarks as chaos grips LA Paris Hilton among stars 'heartbroken' as she watches home 'burn to ground' Commuters warned of icy roads as cold snap continues to freeze UK Sound Of 2025: Ezra Collective are 'keeping music real' The Papers: 'Apocalypse' LA and 'Reeves faces extra tax rises' How Australia's beach cabana drama sparked a turf war H-1B: Visa row under Trump fuels anxiety for Indian dreamers 'I thought I was going to die': Jailed Venezuelan activist details brutality of prison life The man who could become Canada's future PM 'Trump 2.0' looms large over the global economy A politician was shot dead in Bangkok. Did another country do it? Chris Mason: Is Starmer leaving the door open to an abuse inquiry? Delivering brand-new miracles in 1970s East End Watch the latest series of Call the Midwife on iPlayer now Mark-Anthony Turnage shares the soundtrack of his life Once called 'Britain’s hippest composer', he's tackled topics from drug abuse to football in his work Paddy’s loaf-changing experience inside the bread factory Paddy McGuinness visits the bread factory he used to work in, and sees how they make 1.4 million loaves a week What's behind the global surrogacy boom? More countries are banning surrogacy – but demand is growing © 2025 BBC. The BBC is not responsible for the content of external sites.Read about our approach to external linking."
Pro Green: Knife crime not just a black issue,"Professor Green has said black youths as a whole are being ""criminalised"" over recent stabbings - and that in some places ""knife crime is white"". The rapper claimed the media had an ""agenda"" to ""bring back racially-profiled stop and search"" - but he does not think the practice works. Green, who was stabbed in 2009, blamed poverty for thegrowing problem. His comments come as a senior police officer said current rules on stop and search might be too restrictive. Home Office minister Nick Hurd told the Commons on Monday there were ""no plans"" to ""go back to random stop and search"", but the government would look at ways to reduce bureaucracy around it. Should stronger stop and search powers be used? London's 119 homicide victims of 2018 Violent crime 'could take a generation to solve' Professor Green spoke out onInstagram,externalafter being asked about knife crime on Monday's Good Morning Britain. He wrote: ""There had been a lot of reference to a statistic that it's largely black youths stabbing each other - what was left out was that this is only true of certain areas, as anyone with a brain can work out, in more densely white populated areas, the face of knife crime is white. ""That's never represented in the media. The fact that the face of knife crime they project nationally is black youths, as I said this morning implies institutional racism and criminalises a whole race, fitting their agenda to bring back racially-profiled stop and search."" He said all stop and search achieved was to cause ""more division, friction and lack of trust"" of police. While speaking on GMB, he added that while he was stabbed, he does not see himself as a victim. In London alone, there have been 119 homicides this year - including 69 fatal stabbings. Four of those happened in a five-day period this month. Professor Green said knife crime had been ""a growing problem for years with many different contributing factors"", with ""poverty at the top of the list"". ""Years of neglect"" have caused the current crisis, with social deprivation, lack of paternal role models, inequality in education and cuts to services all to blame, he added. He said he agreed with Mayor of London Sadiq Khan's comment that it might take a generation to solve the problem of knife crime. ""Stop and search isn't going to be a quick fix,"" he added. ""Children should never get to the point of carrying a knife - but society needs to move on a hell of a lot before that will happen."" Meanwhile, Adrian Hanstock - the National Police Chiefs' Council lead on stop and search and deputy chief constable of British Transport Police - has suggested the threshold for stops to take place could be lowered. He told BBC Radio 4's The World at One it was not currently a proposal, but discussions had been held about how to do things differently. ""What's behind this is there's a lot of call for officers up and down the country, not just in the cities, to use more stop and search to tackle violence,"" he said. ""We see every day knives and weapons and other items taken off the streets, and every one of those can save a life."" But Mr Hanstock added: ""If we are to make longstanding impact on these causes of violence, police use of stop and search will not be the single answer to this."" Home Secretary Sajid Javid is expected to outline plans in the coming weeks to make stop and search more efficient and reduce the bureaucracy around it. According toHome Office figures,external, there were 298,949 stop and searches carried out in England and Wales in the 2016-17 financial year. There were four for every 1,000 white people - compared with 29 for every 1,000 black people. The most recent census,external, in 2011, showed 86% of the population was white, with black ethnic groups making up 3.3%. The return of stop and search? Nine charts on the rise of knife crime Prof Green fans respond to photo appeal On a knife edge: Rising violence in London Reality Check: Is stop and search working? Wildfire sweeps through Hollywood Hills and threatens landmarks as chaos grips LA Paris Hilton among stars 'heartbroken' as she watches home 'burn to ground' Commuters warned of icy roads as cold snap continues to freeze UK Sound Of 2025: Ezra Collective are 'keeping music real' The Papers: 'Apocalypse' LA and 'Reeves faces extra tax rises' How Australia's beach cabana drama sparked a turf war H-1B: Visa row under Trump fuels anxiety for Indian dreamers 'I thought I was going to die': Jailed Venezuelan activist details brutality of prison life The man who could become Canada's future PM 'Trump 2.0' looms large over the global economy A politician was shot dead in Bangkok. Did another country do it? Chris Mason: Is Starmer leaving the door open to an abuse inquiry? Delivering brand-new miracles in 1970s East End Watch the latest series of Call the Midwife on iPlayer now Mark-Anthony Turnage shares the soundtrack of his life Once called 'Britain’s hippest composer', he's tackled topics from drug abuse to football in his work Paddy’s loaf-changing experience inside the bread factory Paddy McGuinness visits the bread factory he used to work in, and sees how they make 1.4 million loaves a week What's behind the global surrogacy boom? More countries are banning surrogacy – but demand is growing © 2025 BBC. The BBC is not responsible for the content of external sites.Read about our approach to external linking."
