headline,article
Shock of invasion of Ukraine would echo around world - PM,"This video can not be played Watch: ""If Ukraine is invaded, the shock will echo around the world"" - UK PM Boris Johnson The shock of any invasion of Ukraine by Russia would ""echo around the world"", Boris Johnson has told world leaders. He said we must be ""unflinchingly honest"" about the situation in Ukraine and should not ""underestimate the gravity of this moment"". In a speech at a security conference in Munich, Mr Johnson said he does not know what Russian President Vladimir Putin intends, but ""omens are grim"". ""And that is why we must stand strong together,"" he said. Western nations have warned Russia could invade Ukraine imminently, with over 130,000 of its troops near the border. They accuse Russia of trying to stage a fake crisis in a breakaway eastern region of Ukraine to give it a reason to invade. But Russia has repeatedly denied having plans to invade, saying troops are conducting military exercises in the region, accusing the West of ""hysteria"". Is Russia going to invade Ukraine? How might Russia stage a false flag attack? Satellite images show Russian activity near Ukraine Russia does not want war, Putin says Mr Johnson stressed the UK still hoped diplomacy and dialogue would succeed in resolving the crisis. Urging unity among the UK's Western allies, he said: ""Every time that Western ministers have visited Kyiv, we have assured the people of Ukraine and their leaders that we stand foursquare behind their sovereignty and independence. ""How hollow, how meaningless, how insulting those words would seem, if at the very moment when their sovereignty and independence is imperilled, we simply look away."" If Ukraine were invaded, Mr Johnson said ""we will witness the destruction of a democratic state, a country that has been free for a generation, with a proud history of elections"". Ukraine is a former Soviet republic with historic ties to Russia and shares borders with both the EU and Russia. Russia has long resisted Ukraine's move towards Western institutions, including Nato, seeing the eastward expansion of the military alliance as a threat to its security. Boris Johnson warned ""we will witness the destruction of a democratic state"" if Ukraine is invaded The prime minister warned that any invasion would also be met with sanctions on Russian individuals and companies. He said the UK would ""open up the Matryoshka dolls"" of certain Russian-owned companies and make it impossible for them to raise finance in London. His comments follow the announcement ofnew legislationallowing the UK to widen its sanctions against the country. ""If Ukraine is invaded, the shock will echo around the world, and those echoes will be heard in East Asia they will be heard in Taiwan,"" he told the Munich Security Conference. Mr Johnson met Ukraine's president Volodymyr Zelensky, whosaid,externalthey had agreed ""joint next steps"" and remained united in the pursuit of de-escalation and diplomacy. In a statement, Labour leader Sir Keir Starmer said the party was ""steadfast in our support for the sovereignty and territorial integrity of Ukraine"". ""We stand in solidary with the Ukrainian people and in unity with our international partners and Nato allies in warning President Putin that any attack will lead to immediate, severe and extensive sanctions,"" he said. He said Labour supported the actions the government was taking to bring about an end to the stand-off, adding that ""diplomacy can still succeed"". Writing on Twitter, former Prime Minister Theresa May said Boris Johnson was ""right to press the case for continued diplomacy, while preparing the most severe sanctions for Russia if Putin chooses the catastrophe of war"". Mr Zelensky and Mr Johnson met at the security conference In a joint statement, foreign ministers from the G7 group of wealthy nations said they had seen ""no evidence"" that Russia has withdrawn some of its forces, as it has claimed, and that they remained ""gravely concerned"" by the situation. ""We call on Russia to choose the path of diplomacy, to de-escalate tensions, to substantively withdraw military forces from the proximity of Ukraine's borders and to fully abide by international commitments,"" the statement said. ""As a first step, we expect Russia to implement the announced reduction of its military activities along Ukraine's borders. We will judge Russia by its deeds."" US Vice-President Kamala Harris is also attending the conference in Munich, and said in a speech that Russia faced ""swift, severe and united"" economic consequences if it were to invade. She accused Russia of narrowing the avenues for diplomacy, saying ""their simply do not match their words"". Her remarks come after Moscow said some of its troops had moved away from the border in recent days - but Western powers said there was no evidence of withdrawal. On Friday, US President Joe Bidensaid he is convincedMr Putin has decided to invade and that an assault could happen in the ""coming days"". Mr Biden said the assessment was based on US intelligence, which suggested the capital Kyiv would be targeted. Other Western politicians taking part in the three-day security conference include German Chancellor Olaf Scholz and US Vice-President Kamala Harris. But Russia will not be officially represented at the summit for the first time since 1999 amid the rising tensions over the situation at Ukraine's borders. Meanwhile, the Home Office hasscrapped a visa schemeoffering rich foreign investors fast-track residency, amid pressure on ministers over UK links to Russia. Labour has demanded the immediate publication of an ongoing review into visas granted between 2008 - when the scheme was introduced - and 2015 when checks on applicants were tightened. The Liberal Democrats have also demanded a ""clear timetable"" for revoking visas issued to any Russians ""who have been flagged as posing a national security risk"". The security conference in Germany comes as Ukrainian forces and Russia-backed rebels in the country's east continued to accuse each other of shelling and other ceasefire violations on Friday. Such breaks in the area's years-long ceasefire are not uncommon, and each side blamed the other for the violence on Thursday. On Friday, Washington increased its estimate of the number of Russian troops deployed around Ukraine to between 169,000 and 190,000. Ukraine's defence minister has suggested a figure of 149,000. GRAVITY DEFYING TRICKS:James Woods introduces possibly the greatest skier you've never heard of BOOST YOUR BRAIN:Find out how to banish brain fog with these free and simple steps Watching for an invasion on Ukraine's long border Has Putin's war in Ukraine failed? Ukraine: Russia's possible attack routes Governor says lack of water for hydrants 'impaired' fight against wildfires 'I have nothing to go back to' - BBC reporter tells of LA fires heartbreak Trump avoids prison or fine in hush-money case sentencing LA fires: How three days of devastation unfolded What's the latest on the Los Angeles wildfires and what caused them? 'My mum died after four days on an A&E trolley' The '9/11 mastermind' wants to plead guilty. Why is the US trying to stop him? Pop star Chappell Roan wins BBC Sound Of 2025 Weekly quiz: Zendaya looked happy but who else sparkled at the Golden Globes? Inside the UK's first legal drug consumption room Danes struggle with response to Trump Greenland threat Off air with Laura K: Get Laura Kuenssberg's expert insight emailed directly to you Dragons’ Den returns with a new line-up of celebrity guests Can a fresh batch of entrepreneurs secure the deal of a lifetime? Are smart scales really as ‘smart’ as they claim to be? Greg Foot explores whether they can accurately measure weight, body fat, muscle and bone mass The award-winning psychological competition is back A nail-biting game of detection, backstabbing and trust. Who will make it through? How close are we to a cancer vaccine? How might it help in the treatment of the disease? © 2025 BBC. The BBC is not responsible for the content of external sites.Read about our approach to external linking."
Ukrainian rebels mobilise as fighting escalates,"This video can not be played Watch as US Vice-President Kamala Harris warns Russia of consequences if it invades Ukraine Ukraine's Russian-backed breakaway eastern territories have ordered military mobilisations amid a deadly escalation in fighting. Men of fighting age in the self-declared people's republics of Donetsk and Luhansk are being put on stand-by. US President Joe Biden says he is convinced Russia will invade Ukraine, an allegation Moscow denies. Western nations have accused Russia of trying to stage a fake crisis in the eastern regions as a pretext to invade. International monitors report a ""dramatic increase"" in attacks along the line dividing rebel and government forces. Two Ukrainian soldiers were killed and four injured by shelling on Saturday, the first deaths to be reported in weeks. Mr Biden's Defence Secretary, Lloyd Austin, said Russian forces were beginning to ""uncoil and move closer"" to the border with Ukraine. In the German city of Munich, US Vice-President Kamala Harris told a security conference that if Russia did invade, the US and its allies would impose a ""significant and unprecedented economic cost"", targeting its financial institutions and key industries, as well as those who aided and abetted such an invasion. Echoing her remarks, UK Prime Minister Boris Johnson said that, in the event of an invasion, his country would ""open up the Matryoshka dolls"" of strategic Russian-owned companies and make it impossible for them to raise finance in London. Mr Johnson had talks in Munich with Ukrainian President Volodymyr Zelensky, who was visiting for the security conference against the advice of President Biden, who had said it might not be a ""wise choice"" for the Ukrainian leader to be out of his country at this time. The US estimates there are 169,000-190,000 Russian personnel massed along Ukraine's borders, a figure that includes separatist fighters in Donetsk and Luhansk. Russian President Vladimir Putin, who oversaw major drills of Russia's strategic nuclear missile forces from Moscow on Saturday, has said the situation in eastern Ukraine is deteriorating. He said he remained willing to discuss the crisis with Western leaders, but accused them of ignoring Russia's security concerns. As we climbed the viewing platform, gale-force winds and hail storms were sweeping across the vast Obuz-Lesnovsky Military Range, around 100 miles (160km) from the border with Ukraine. Fluttering furiously, side by side, the flags of Belarus and Russia. The skies cleared and an announcement came over the loudspeaker: ""These are purely defensive drills."" For the next half an hour, Russian and Belarusian forces rehearsed repelling an attacker, with tanks, fighter jets and rocket launchers. Nato considers this the largest Russian military deployment in Belarus since the Cold War. The numbers we've been hearing range from 10,000 to 30,000 Russian troops. Ukraine views the exercises as part of Moscow's ""psychological pressure"" on Kyiv. The drills are due to end on Sunday. When they do, a key question will be how quickly will the Russian soldiers pack up and go home? Ukraine, a former Soviet republic with historic ties to Russia, is not a member of Nato or the European Union but has close relations with both. Russia is insisting Ukraine should not be allowed to join Nato, which it sees as a threat to its security. Accurate figures are difficult to establish but as many as 3.5 million people live in the two rebel territories, which broke away in 2014 after Ukraine's pro-Russian government was overthrown. Since then, at least 720,000 have acquired Russian citizenship, according to Russian media. A number of civilians have been evacuated from the rebel territories to neighbouring Russia, with at least 6,500 leaving Donetsk, according to the separatists. In Luhansk, the first train to Russia since 2014 left with 650 evacuees aboard, Russian media report. One person in rebel-controlled Luhansk told BBC News on condition of anonymity that the separatists were trying to stir panic deliberately and said local people were wary of evacuating. A children's home was evacuated from Luhansk across the border to Russia on Friday Another in rebel-controlled Donetsk confirmed that some people were leaving and added, ""People just want that somebody finally can take control and responsibility for these separatist-held territories whoever it would be - Russia or Ukraine"". EXPLAINER:What is a false flag attack? CONTEXT:Satellite images show Russian activity near Ukraine BACKGROUND:Is Russia going to invade Ukraine? Details of the Ukrainian soldier's death were not given but it was contained ina report that spoke of artillery, mortar and grenade attacks,externalby the separatists. There were also reports of attacks or attempted attacks inside separatist-held territory which could not be independently verified: An unexploded booby-trapped car was discovered on a road being used to bus evacuees from Luhansk to Russia, separatist security sources told Russian media Two overnight blasts targeting a gas pipe in Luhansk were blamed on Ukrainian saboteurs According to Russian news agency Interfax, the separatists in Donetsk say a number of people were killed or injured as a result of acts of sabotage by Ukrainian forces. No details were given In another development, two shells reportedly exploded on Russian territory in Rostov region, about a kilometre from the Ukrainian border. Russia opened a criminal investigation. Ukrainian Foreign Minister Dmytro Kuleba denied shells had hit Russian territory and called for an ""immediate and impartial international investigation of the incidents reported by Russian media"". A nursery was damaged in government-controlled territory International observers from the Organization for Security and Co-operation in Europe have been monitoring a truce between the separatists and government forces, who have fought a bloody war at a cost of at least 14,000 lives. On Friday, the observer mission reported,external""a dramatic increase in kinetic activity along the contact line in eastern Ukraine, equal to the numbers of ceasefire violations reported"" before July 2020. Governor says lack of water for hydrants 'impaired' fight against wildfires 'I have nothing to go back to' - BBC reporter tells of LA fires heartbreak Trump avoids prison or fine in hush-money case sentencing LA fires: How three days of devastation unfolded What's the latest on the Los Angeles wildfires and what caused them? 'My mum died after four days on an A&E trolley' The '9/11 mastermind' wants to plead guilty. Why is the US trying to stop him? Pop star Chappell Roan wins BBC Sound Of 2025 Weekly quiz: Zendaya looked happy but who else sparkled at the Golden Globes? Inside the UK's first legal drug consumption room Danes struggle with response to Trump Greenland threat Off air with Laura K: Get Laura Kuenssberg's expert insight emailed directly to you Dragons’ Den returns with a new line-up of celebrity guests Can a fresh batch of entrepreneurs secure the deal of a lifetime? Are smart scales really as ‘smart’ as they claim to be? Greg Foot explores whether they can accurately measure weight, body fat, muscle and bone mass The award-winning psychological competition is back A nail-biting game of detection, backstabbing and trust. Who will make it through? How close are we to a cancer vaccine? How might it help in the treatment of the disease? © 2025 BBC. The BBC is not responsible for the content of external sites.Read about our approach to external linking."
Probe into more dead crabs and lobsters along coast,"Carcasses of thousands of crabs were found at beaches including Seaton Carew The government is investigating after new reports of dead crabs and lobsters along the North East coast. The Department for Environment, Food and Rural Affairs (Defra) is to ""undertake additional sampling"" after fishermen reported further deaths. Tens of thousands of the crustaceans first washed up on shores from Seaton Carew down to Whitby in October. Defra previously said it had ""completed a thorough investigation"" whichfound a natural ""algal bloom"" was responsible. Thousands of crabs and other marine animals washed up dead along the Teesside coast last year That finding, which Whitby and Scarborough's Conservative MP and former fisheries minister Robert Goodwill said he was ""inclined to believe, having seen the evidence"", has been disputed by many fishermen,as well as a marine pollution expert. Chemical pollution and dredging have been repeatedly ruled out by Defra as likely causes. It said it had now received reports of ""further dead or dying lobsters and crabs found in a small number of pots along the North East coast"" and that it would be taking samples in the area to investigate. Adrian Noble, a Whitby fisherman of more than 40 years, said he believed there was ""not a chance in the world"" the deaths were caused by a naturally-occurring algae, adding the industry has been ""decimated"". ""The way things are at the moment, we don't know if we can go on for much longer,"" he said. ""There's a few fishermen having to go to food banks now. I'm just surviving off my savings."" Adrian Noble fears fishermen will go bankrupt Stockton North Labour MP Alex Cunningham is calling for financial aid for fishermen across the region. ""Fishermen using food banks - that shouldn't be happening in 21st Century Britain,"" he said. ""I hope others will get behind the fight to get the compensation they need to keep their businesses afloat. ""I've had fishermen in touch with me and I think it's important that we work right across the Tees Valley where livelihoods are in danger."" Fishermen say their catches have been badly hit Mr Cunningham said he believed the Environment Agency had ""got it right"", but continuous testing was vital in case it had ""got it a little wrong"". ""If it's natural, or unnatural, the government should be paying out to make sure fishermen aren't accessing food banks,"" he said. Follow BBC North East & Cumbria onTwitter,external,Facebook,externalandInstagram,external. Send your story ideas tonortheastandcumbria@bbc.co.uk,external. Expert disputes algae theory over shellfish deaths Mass shellfish deaths blamed on harmful algae Fishing trade hit by mystery shellfish deaths Crab deaths not caused by sewage or cables - agency Department for Environment Food & Rural Affairs Environment Agency Woman thought she was 'going to die' during assault in Darlington pub People urged to only use A&E in Darlington if seriously unwell amid flu surge Shops have alcohol licences revoked over underage sales concerns Appeal after boy knocked over by car in hit-and-run Hartlepool March of the Mods back for 2025 with over 200 tickets already sold Suspects named and remanded in custody on attempted murder charges after man suffers gunshot wounds in Hartlepool's Garside Drive Governor says lack of water for hydrants 'impaired' fight against wildfires 'I have nothing to go back to' - BBC reporter tells of LA fires heartbreak Trump avoids prison or fine in hush-money case sentencing LA fires: How three days of devastation unfolded What's the latest on the Los Angeles wildfires and what caused them? 'My mum died after four days on an A&E trolley' The '9/11 mastermind' wants to plead guilty. Why is the US trying to stop him? Pop star Chappell Roan wins BBC Sound Of 2025 Weekly quiz: Zendaya looked happy but who else sparkled at the Golden Globes? Inside the UK's first legal drug consumption room Danes struggle with response to Trump Greenland threat Off air with Laura K: Get Laura Kuenssberg's expert insight emailed directly to you Dragons’ Den returns with a new line-up of celebrity guests Can a fresh batch of entrepreneurs secure the deal of a lifetime? Are smart scales really as ‘smart’ as they claim to be? Greg Foot explores whether they can accurately measure weight, body fat, muscle and bone mass The award-winning psychological competition is back A nail-biting game of detection, backstabbing and trust. Who will make it through? How close are we to a cancer vaccine? How might it help in the treatment of the disease? © 2025 BBC. The BBC is not responsible for the content of external sites.Read about our approach to external linking."
Probe into more dead crabs and lobsters along coastDefra says it will take further samples after reports of crustaceans dying across the North East.Tees,"Carcasses of thousands of crabs were found at beaches including Seaton Carew The government is investigating after new reports of dead crabs and lobsters along the North East coast. The Department for Environment, Food and Rural Affairs (Defra) is to ""undertake additional sampling"" after fishermen reported further deaths. Tens of thousands of the crustaceans first washed up on shores from Seaton Carew down to Whitby in October. Defra previously said it had ""completed a thorough investigation"" whichfound a natural ""algal bloom"" was responsible. Thousands of crabs and other marine animals washed up dead along the Teesside coast last year That finding, which Whitby and Scarborough's Conservative MP and former fisheries minister Robert Goodwill said he was ""inclined to believe, having seen the evidence"", has been disputed by many fishermen,as well as a marine pollution expert. Chemical pollution and dredging have been repeatedly ruled out by Defra as likely causes. It said it had now received reports of ""further dead or dying lobsters and crabs found in a small number of pots along the North East coast"" and that it would be taking samples in the area to investigate. Adrian Noble, a Whitby fisherman of more than 40 years, said he believed there was ""not a chance in the world"" the deaths were caused by a naturally-occurring algae, adding the industry has been ""decimated"". ""The way things are at the moment, we don't know if we can go on for much longer,"" he said. ""There's a few fishermen having to go to food banks now. I'm just surviving off my savings."" Adrian Noble fears fishermen will go bankrupt Stockton North Labour MP Alex Cunningham is calling for financial aid for fishermen across the region. ""Fishermen using food banks - that shouldn't be happening in 21st Century Britain,"" he said. ""I hope others will get behind the fight to get the compensation they need to keep their businesses afloat. ""I've had fishermen in touch with me and I think it's important that we work right across the Tees Valley where livelihoods are in danger."" Fishermen say their catches have been badly hit Mr Cunningham said he believed the Environment Agency had ""got it right"", but continuous testing was vital in case it had ""got it a little wrong"". ""If it's natural, or unnatural, the government should be paying out to make sure fishermen aren't accessing food banks,"" he said. Follow BBC North East & Cumbria onTwitter,external,Facebook,externalandInstagram,external. Send your story ideas tonortheastandcumbria@bbc.co.uk,external. Expert disputes algae theory over shellfish deaths Mass shellfish deaths blamed on harmful algae Fishing trade hit by mystery shellfish deaths Crab deaths not caused by sewage or cables - agency Department for Environment Food & Rural Affairs Environment Agency Woman thought she was 'going to die' during assault in Darlington pub People urged to only use A&E in Darlington if seriously unwell amid flu surge Shops have alcohol licences revoked over underage sales concerns Appeal after boy knocked over by car in hit-and-run Hartlepool March of the Mods back for 2025 with over 200 tickets already sold Suspects named and remanded in custody on attempted murder charges after man suffers gunshot wounds in Hartlepool's Garside Drive Governor says lack of water for hydrants 'impaired' fight against wildfires 'I have nothing to go back to' - BBC reporter tells of LA fires heartbreak Trump avoids prison or fine in hush-money case sentencing LA fires: How three days of devastation unfolded What's the latest on the Los Angeles wildfires and what caused them? 'My mum died after four days on an A&E trolley' The '9/11 mastermind' wants to plead guilty. Why is the US trying to stop him? Pop star Chappell Roan wins BBC Sound Of 2025 Weekly quiz: Zendaya looked happy but who else sparkled at the Golden Globes? Inside the UK's first legal drug consumption room Danes struggle with response to Trump Greenland threat Off air with Laura K: Get Laura Kuenssberg's expert insight emailed directly to you Dragons’ Den returns with a new line-up of celebrity guests Can a fresh batch of entrepreneurs secure the deal of a lifetime? Are smart scales really as ‘smart’ as they claim to be? Greg Foot explores whether they can accurately measure weight, body fat, muscle and bone mass The award-winning psychological competition is back A nail-biting game of detection, backstabbing and trust. Who will make it through? How close are we to a cancer vaccine? How might it help in the treatment of the disease? © 2025 BBC. The BBC is not responsible for the content of external sites.Read about our approach to external linking."
