headline,article
Wife's 'awful' journey to husband's assisted death,"Five weeks on from her husband's death at a Swiss euthanasia clinic, Elaine Selley says parts of the experience were ""awful"" The wife of a former teacher who ended his life at a Swiss euthanasia clinic last month has said much of the experience was ""awful"". Elaine Selley's husband Richard battled motor neurone disease (MND) for four years and ended his life at Dignitas in Zurich on 6 September. He had campaigned for euthanasia laws to be introduced in Scotland. Mrs Selley said she believed he made the right choice but having to travel abroad made it much harder to bear. Speaking for the first time since his death, she toldBBC Scotland's The Nine: ""I think you are numb and you are in shock and I think there are moments where I think it happened yesterday and there are moments when I think it has happened to somebody in a different life. ""I think that experience now is part of my experience in life and I have to process and deal with that and it will be with me forever."" Why can't I die with dignity at home? What is assisted suicide and euthanasia? Richard Selley and his wife Elaine made his final journey to Switzerland in September Mrs Selley said that the reality of leaving Scotland and their loved ones behind to make that final journey to Zurich was brutal, especially seeing their children for the last time at the airport. She said: ""It was having to say goodbye to people you loved at the airport surrounded by everybody on their way to Spain and Portugal on their holidays. It was awful. ""We were sitting reading these really comforting, beautiful emails we were being sent and there were a few tears shed when we were reading them, when we were sitting with everybody else in the departure lounge. "" This video can not be played Richard Selley spoke to the BBC about his decision to end his life Richard Selley campaigned for a change to laws on assisted dying right up until his death in September. In Julyhe wrote an open letter to MSPs calling for reform,external. He wrote a blog and a book on the issue and made videos on the emotive subject, the last being shared in the week he travelled to Switzerland to end his life. The 65-year-old said that having to be able to fly meant he chose to die earlier than he would otherwise have wanted. He said that if an assisted death was possible in Scotland, he would have been able to die at a time of his choosing, at home. He said: ""I hope that members of the Scottish Parliament support an assisted dying bill in the future. ""I think the momentum for a change in the law is growing."" Mrs Selley travelled with Richard and his brother Peter from their home in Glenalmond, near Perth. They spent two days in a hotel before they set foot in the clinic itself. Away from his home support, she said Richard was vulnerable, and in pain and distress. Mrs Selley said it was an upsetting experience but that watching him in that final 48 hours made her realise how sick he was and that he had ""taken it to the wire"". Five weeks ago, at 12:40 on 6 September, Richard took his own life. His wife believes he made the right decision and she will continue Richard's campaign to make euthanasia legal in Scotland. She said: ""We wish we weren't there and we didn't have to go through this. ""But for Richard and for his pain and his distress in that moment in time, which was far worse than it was at home, we knew he was doing the right thing for him. ""He really had had enough and wanted out of it and although we didn't want to lose him, didn't want it to happen and it was scary, it was the right thing for him."" Opponents of assisted dying legislation argue that introducing such a law in Scotland risks exposing people to abuse, coercion and exploitation. Richard and Elaine Selley had to make plans for the final trip to Dignitas Mrs Selley disagrees: ""Some people are quite happy to let nature take its course but Richard wanted to take charge of his end of life experience, to ensure it was peaceful and he wasn't in any pain. And I can't see any opposing argument to that if there are safeguards in place. ""These are terminally ill people in the last phase of their life who have no chance of being cured, and there is nothing that can be done, why shouldn't they make a choice?"" Previousbids to introduce new legislation have failed to get through the Scottish Parliament. Attempts to change the law on assisted dying issue were made by the MSP Margo MacDonald, who died in April 2014 after a long fight against Parkinson's. The idea was put before Holyrood twice, but her bills failed to receive parliamentary backing. Euthanasia campaigner dies at Swiss clinic 'Why can't I die with dignity at home?' MSPs reject Assisted Suicide Bill Richard Selley will travel to Zurich to end his life Family’s urgent call for local donor to help former Dundee teacher stave off leukaemia MARTEL MAXWELL: Brave Arbroath woman shows ketamine is anything but fun Home receives 'excellent' care inspectorate rating Falkirk Council claim new town hall could mean £3.8 million a year boost to local economy Falkirk Herald's Bairns family feature in cartoonist's calendar for 2025 Alva: One person taken to hospital following medical emergency LA mayor says winds and drought created 'perfect storm', while official hits out at looters Maps and pictures chart how fires have spread Biden praises Carter's character as former president's coffin heads to Georgia The '9/11 mastermind' is set to plead guilty. Why is the US trying to stop him? Why are UK borrowing costs rising and what does it mean for me? Before and after: How wildfires tore through LA 'Where do I go?' Chaos on Hollywood streets as people flee flames How Elon Musk seized on baseless memo claim to fuel wave of misinformation 'Constant stress': Families tell BBC of life in limbo due to housing crisis How Australia's beach cabana drama sparked a turf war The man who could become Canada's future PM US Election Unspun: Anthony's Zurcher's twice weekly newsletter - sign up now Ed Gamble hosts the official Traitors podcast Join Ed Gamble and guests as they dissect the first episodes of The Traitors! Can art, music and words bind us in divided times? Simon Schama explores how artists have captured the transformations of British society since 1945 Enjoy a satirical smorgasbord of The News Quiz Digest a dramatic year of news as Andy Zaltzman revels in some of 2024's funniest moments The multi-award-winning legal drama returns Two years on, the Defoes are back and have gathered for a beautiful wedding in Barcelona © 2025 BBC. The BBC is not responsible for the content of external sites.Read about our approach to external linking."
Plastic-stemmed cotton buds now banned in Scotland,"Johnson and Johnson's iconic blue cotton bud stems are no longer made from plastic New laws have come into force in Scotland banning the sale and manufacture of plastic-stemmed cotton buds. The move follows concerns about the number ofbuds washing up on beachesafter being flushed down toilets. Most major retailers switched to paper-stemmed buds in the months leading up to the ban following a campaign. A similar ban - also including plastic coffee stirrers and straws - comes into force in the rest of the UK next year. Cotton buds are consistently listed in the top 10 forms of beach litter by the Marine Conservation Society. Thousands of plastic-stemmed buds have washed up on beaches around Scotland Across the UK, about 1.8 billion of them are sold every year. In 2017, the pharmaceutical firm Johnson and Johnson became the first major manufacturer to switch away from plastic. All the major supermarkets have followed suit by either switching to biodegradable paper or committing to doing so. Waitrose is estimated to have saved 21 tonnes of plastic through the policy. Scottish environmental charity Fidra and its volunteers have been at the forefront of working with the industry to promote biodegradable alternatives. Fidra's Heather McFarlane says the buds are particularly harmful to wildlife It praised the Scottish law change as ""great news"" for wildlife and the environment. The charity's project manager Heather McFarlane said: ""Now we are seeing this ban come into place, that will pick up those last few retailers and manufacturers who haven't made the switch from plastic to paper. ""The plastic cotton bids have been washing up on beaches for years and they get into the environment in quite high numbers. ""They are particularly damaging to wildlife. They have been found in our native bird populations and in the intestines of turtles. You can just imagine the damage that can do."" WWF Scotland director Lang Banks said: ""Cotton buds are some of the most pervasive forms of marine pollution, so a ban is very welcome step and one that we hope other countries will follow. ""We know plastic is suffocating our seas and devastating our wildlife with millions of birds, fish and mammals dying each year because of the plastic in our oceans. ""Plastics are also finding their way into the food we eat and the water we drink, so saving our oceans will require further ambitious action from governments, industry and consumers."" Scotland ready to ban plastic cotton buds LA mayor says winds and drought created 'perfect storm', while official hits out at looters Maps and pictures chart how fires have spread Biden praises Carter's character as former president's coffin heads to Georgia The '9/11 mastermind' is set to plead guilty. Why is the US trying to stop him? Why are UK borrowing costs rising and what does it mean for me? Before and after: How wildfires tore through LA 'Where do I go?' Chaos on Hollywood streets as people flee flames How Elon Musk seized on baseless memo claim to fuel wave of misinformation 'Constant stress': Families tell BBC of life in limbo due to housing crisis How Australia's beach cabana drama sparked a turf war The man who could become Canada's future PM US Election Unspun: Anthony's Zurcher's twice weekly newsletter - sign up now Ed Gamble hosts the official Traitors podcast Join Ed Gamble and guests as they dissect the first episodes of The Traitors! Can art, music and words bind us in divided times? Simon Schama explores how artists have captured the transformations of British society since 1945 Enjoy a satirical smorgasbord of The News Quiz Digest a dramatic year of news as Andy Zaltzman revels in some of 2024's funniest moments The multi-award-winning legal drama returns Two years on, the Defoes are back and have gathered for a beautiful wedding in Barcelona © 2025 BBC. The BBC is not responsible for the content of external sites.Read about our approach to external linking."
People praised for 'intervening' in Arndale attack,"A man was apprehended by police after an attack at the Manchester Arndale A Manchester Arndale worker and a member of the public have been praised for helping to stop a stabbing in which three people were hurt. A man""lunged"" at people in the shopping centreon Friday and attacked a 19-year-old woman, a man, 59, and another woman, who are in hospital. Two others were hurt, but none of the injuries are thought to be life-threatening. A 40-year-old man has been detained under the Mental Health Act. Witnesses said people were ""screaming and running"" as they evacuated the centre after a man started to attack shoppers with a large knife. A police spokesman said the 19-year-old woman required surgery after being stabbed in her arm, while the 59-year-old man suffered stab wounds to his hand. As it happened: Manchester Arndale stabbings,external Forensic officers conduct investigations outside the shopping centre Assistant Chief Constable Russ Jackson, from Greater Manchester Police, said: ""We know that at least one member of staff from the Arndale and a member of the public intervened in the attack and we would like to praise and thank them for their bravery."" At a press conference earlier, police revealed they had searched a property in the city where the arrested man lived. Officers said they were trying to establish if he had any political, religious or ideological motivation for the attack, although nothing has so far has come to light. He was initially held on suspicion of assault then re-arrested on suspicion of terror offences before he was detained under the Mental Health Act. Greater Manchester mayor Andy Burnham said officials were keeping an ""open mind"". ""It's important not to jump to any conclusions although what I can say is that, at this stage, it would appear to be more mental-health related than political or religiously motivated."" He said the attack appeared to be ""an isolated incident"" and urged people to ""go about their weekend"" as they had planned. Staff were allowed back into the centre on Friday afternoon The shopping centre, which is close to the arena where a terror attack killed 22 people in 2017, re-opened for business on Saturday. Sir Richard Leese, leader of Manchester City Council, said: ""Every time we have had an incident of this sort in the city, Manchester shows its resilience, its ability to come together and its determination to get on with business - to get on with life - and that's what we see today."" Allow Twitter content? This article contains content provided by Twitter. We ask for your permission before anything is loaded, as they may be using cookies and other technologies. You may want to readTwitter’s cookie policy,externalandprivacy policy,externalbefore accepting. To view this content choose‘accept and continue’. Mr Burnham added the attack highlighted ""the debate about knife crime"" and he would ask police to consider ""more use of stop-and-search powers but in a way that is intelligence-led, non-discriminatory"". ""Like other cities in the UK, in the past few years, Greater Manchester has seen an increase but… we actually recorded a significant fall over summer 2019 and that was, in part, due to a more targeted use of stop-and-search powers."" The force has appealed for anyone who was in the Arndale at the time to send images or footage viaits website,external. Manchester was praised for showing ""resilience"" after the attack by the city's council leader Manchester stabbing victim from Northern Ireland Five people hurt in Arndale Centre knife attack Greater Manchester Police 'I was handed a £1k bill for my pug's teeth - something has to change' Big-time drug dealer pal of cop killer Dale Cregan moans he's skint and owes rival £220k Council to draw down £17.6m exceptional financial support to balance books Bolton weather forecast: Cold and clear skies this weekend Bury weather forecast: Cold and dry weekend ahead Places where you can go to keep warm as temperatures plummet LA mayor says winds and drought created 'perfect storm', while official hits out at looters Maps and pictures chart how fires have spread Biden praises Carter's character as former president's coffin heads to Georgia The '9/11 mastermind' is set to plead guilty. Why is the US trying to stop him? Why are UK borrowing costs rising and what does it mean for me? Before and after: How wildfires tore through LA 'Where do I go?' Chaos on Hollywood streets as people flee flames How Elon Musk seized on baseless memo claim to fuel wave of misinformation 'Constant stress': Families tell BBC of life in limbo due to housing crisis How Australia's beach cabana drama sparked a turf war The man who could become Canada's future PM US Election Unspun: Anthony's Zurcher's twice weekly newsletter - sign up now Ed Gamble hosts the official Traitors podcast Join Ed Gamble and guests as they dissect the first episodes of The Traitors! Can art, music and words bind us in divided times? Simon Schama explores how artists have captured the transformations of British society since 1945 Enjoy a satirical smorgasbord of The News Quiz Digest a dramatic year of news as Andy Zaltzman revels in some of 2024's funniest moments The multi-award-winning legal drama returns Two years on, the Defoes are back and have gathered for a beautiful wedding in Barcelona © 2025 BBC. The BBC is not responsible for the content of external sites.Read about our approach to external linking."
Wife's 'awful' journey to husband's assisted deathElaine Selley wants assisted dying to be allowed in Scotland to make the experience easier for other people.Tayside and Central Scotland,"Five weeks on from her husband's death at a Swiss euthanasia clinic, Elaine Selley says parts of the experience were ""awful"" The wife of a former teacher who ended his life at a Swiss euthanasia clinic last month has said much of the experience was ""awful"". Elaine Selley's husband Richard battled motor neurone disease (MND) for four years and ended his life at Dignitas in Zurich on 6 September. He had campaigned for euthanasia laws to be introduced in Scotland. Mrs Selley said she believed he made the right choice but having to travel abroad made it much harder to bear. Speaking for the first time since his death, she toldBBC Scotland's The Nine: ""I think you are numb and you are in shock and I think there are moments where I think it happened yesterday and there are moments when I think it has happened to somebody in a different life. ""I think that experience now is part of my experience in life and I have to process and deal with that and it will be with me forever."" Why can't I die with dignity at home? What is assisted suicide and euthanasia? Richard Selley and his wife Elaine made his final journey to Switzerland in September Mrs Selley said that the reality of leaving Scotland and their loved ones behind to make that final journey to Zurich was brutal, especially seeing their children for the last time at the airport. She said: ""It was having to say goodbye to people you loved at the airport surrounded by everybody on their way to Spain and Portugal on their holidays. It was awful. ""We were sitting reading these really comforting, beautiful emails we were being sent and there were a few tears shed when we were reading them, when we were sitting with everybody else in the departure lounge. "" This video can not be played Richard Selley spoke to the BBC about his decision to end his life Richard Selley campaigned for a change to laws on assisted dying right up until his death in September. In Julyhe wrote an open letter to MSPs calling for reform,external. He wrote a blog and a book on the issue and made videos on the emotive subject, the last being shared in the week he travelled to Switzerland to end his life. The 65-year-old said that having to be able to fly meant he chose to die earlier than he would otherwise have wanted. He said that if an assisted death was possible in Scotland, he would have been able to die at a time of his choosing, at home. He said: ""I hope that members of the Scottish Parliament support an assisted dying bill in the future. ""I think the momentum for a change in the law is growing."" Mrs Selley travelled with Richard and his brother Peter from their home in Glenalmond, near Perth. They spent two days in a hotel before they set foot in the clinic itself. Away from his home support, she said Richard was vulnerable, and in pain and distress. Mrs Selley said it was an upsetting experience but that watching him in that final 48 hours made her realise how sick he was and that he had ""taken it to the wire"". Five weeks ago, at 12:40 on 6 September, Richard took his own life. His wife believes he made the right decision and she will continue Richard's campaign to make euthanasia legal in Scotland. She said: ""We wish we weren't there and we didn't have to go through this. ""But for Richard and for his pain and his distress in that moment in time, which was far worse than it was at home, we knew he was doing the right thing for him. ""He really had had enough and wanted out of it and although we didn't want to lose him, didn't want it to happen and it was scary, it was the right thing for him."" Opponents of assisted dying legislation argue that introducing such a law in Scotland risks exposing people to abuse, coercion and exploitation. Richard and Elaine Selley had to make plans for the final trip to Dignitas Mrs Selley disagrees: ""Some people are quite happy to let nature take its course but Richard wanted to take charge of his end of life experience, to ensure it was peaceful and he wasn't in any pain. And I can't see any opposing argument to that if there are safeguards in place. ""These are terminally ill people in the last phase of their life who have no chance of being cured, and there is nothing that can be done, why shouldn't they make a choice?"" Previousbids to introduce new legislation have failed to get through the Scottish Parliament. Attempts to change the law on assisted dying issue were made by the MSP Margo MacDonald, who died in April 2014 after a long fight against Parkinson's. The idea was put before Holyrood twice, but her bills failed to receive parliamentary backing. Euthanasia campaigner dies at Swiss clinic 'Why can't I die with dignity at home?' MSPs reject Assisted Suicide Bill Richard Selley will travel to Zurich to end his life Family’s urgent call for local donor to help former Dundee teacher stave off leukaemia MARTEL MAXWELL: Brave Arbroath woman shows ketamine is anything but fun Home receives 'excellent' care inspectorate rating Falkirk Council claim new town hall could mean £3.8 million a year boost to local economy Falkirk Herald's Bairns family feature in cartoonist's calendar for 2025 Alva: One person taken to hospital following medical emergency LA mayor says winds and drought created 'perfect storm', while official hits out at looters Maps and pictures chart how fires have spread Biden praises Carter's character as former president's coffin heads to Georgia The '9/11 mastermind' is set to plead guilty. Why is the US trying to stop him? Why are UK borrowing costs rising and what does it mean for me? Before and after: How wildfires tore through LA 'Where do I go?' Chaos on Hollywood streets as people flee flames How Elon Musk seized on baseless memo claim to fuel wave of misinformation 'Constant stress': Families tell BBC of life in limbo due to housing crisis How Australia's beach cabana drama sparked a turf war The man who could become Canada's future PM US Election Unspun: Anthony's Zurcher's twice weekly newsletter - sign up now Ed Gamble hosts the official Traitors podcast Join Ed Gamble and guests as they dissect the first episodes of The Traitors! Can art, music and words bind us in divided times? Simon Schama explores how artists have captured the transformations of British society since 1945 Enjoy a satirical smorgasbord of The News Quiz Digest a dramatic year of news as Andy Zaltzman revels in some of 2024's funniest moments The multi-award-winning legal drama returns Two years on, the Defoes are back and have gathered for a beautiful wedding in Barcelona © 2025 BBC. The BBC is not responsible for the content of external sites.Read about our approach to external linking."
