headline,article
Ex-police chief 'told about porn claims'Sir Paul Stephenson says he was told material was allegedly found on Damian Green's computer in 2008.,"Former Met Commissioner Sir Paul Stephenson said the allegations against Mr Green showed ""no criminality"" A former Scotland Yard chief was aware pornography had allegedly been found on Damian Green's office computer during a 2008-9 police probe, he has said. Sir Paul Stephenson, the Metropolitan Police Commissioner between 2009-11, said he was briefed about the claims but regarded them as a ""side issue"". The allegations were first made public last week by former Met Assistant Commissioner, Bob Quick. First Secretary of State Mr Green said his accusers had ""ulterior motives"". This video can not be played Porn was allegedly found to have been viewed on Mr Green's office computer after police raids in 2008 Mr Green, who is Prime Minister Theresa May's second-in-command, said: ""I reiterate that no allegations about the presence of improper material on my parliamentary computers have ever been put to me or to the parliamentary authorities by the police. ""I can only assume that they are being made now, nine years later, for ulterior motives."" But Mr Quick, who led the investigation into Home Office leaks which saw Mr Green's Commons office being searched, says pornography was found on a computer there. Both Sir Paul and Mr Quick gave evidence to aCabinet Office inquiry into Mr Green's conductlast week, led by senior Cabinet Office official Sue Gray. The inquiry, which is being held behind closed doors, is also looking at a separate claim that Mr Green, made inappropriate advances towards a female Conservative activist in 2015. He also denies that allegation. Damian Green denies claims police found pornography on a computer in his office Speaking to the BBC, Sir Paul said he thought the claim about Mr Green ""wasn't relevant to the criminal inquiry"" into Home Office leaks, which began in October 2008. Mr Green's home and office were searched as part of that probe and he was briefly arrested in November that year, but the then shadow immigration minister faced no further action. A review of the police inquiry found that ""less intrusive methods"" could have been used. Referring to the pornography allegations, Sir Paul said: ""I regret it's in the public domain. ""There was no criminality involved, there were no victims, there was no vulnerability and it was not a matter of extraordinary public interest."" Sir Paul added that it was not Scotland Yard's role to ""police the workplace"". The Met declined to say whether it was helping the Cabinet Office investigate the claims, but said in a statement: ""As this is not our inquiry the MPS does not believe it is appropriate to comment upon it."" Damian Green quizzed by conduct inquiry This is not a witch hunt, says Harman SNP minister quits over 'previous actions' Harassment 'was never fine' Video, 00:00:46Harassment 'was never fine' Thornberry 'groped and flashed at' Video, 00:01:26Thornberry 'groped and flashed at' At least two killed and 1,000 structures destroyed as wildfires rage in Los Angeles In maps: Thousands of acres on fire in LA 'Patients are collapsing in the waiting room': A&E nurses speak out Why does Trump want Greenland and what do its people think? How Canada's immigration debate soured - and helped seal Trudeau's fate 'I can't get divorced as I can't get my pension valued' What are cold weather payments and who can get them? BBC Sound of 2025: Barry Can't Swim is a new dance music superstar Ros Atkins on...Elon Musk's political interventions Jean-Marie Le Pen - founder of French far right and 'Devil of the Republic' Cases of HMPV are on the rise in China - but what is it? Politics Essential: Get the latest news and analysis delivered to your inbox every weekday Delivering brand-new miracles in 1970s East End Watch the latest series of Call the Midwife on iPlayer now Mark-Anthony Turnage shares the soundtrack of his life Once called 'Britainâs hippest composer', he's tackled topics from drug abuse to football in his work Paddyâs loaf-changing experience inside the bread factory Paddy McGuinness visits the bread factory he used to work in, and sees how they make 1.4 million loaves a week What's behind the global surrogacy boom? More countries are banning surrogacy â but demand is growing Â© 2025 BBC. The BBC is not responsible for the content of external sites.Read about our approach to external linking."
"60,000 join nationalist march in PolandRight-wing rally-goers light flares and carry Polish flags as they march through Warsaw.11h11 hours agoEurope","This video can not be played These were the scenes in 2017 when a nationalist march and counter-protest took place in Warsaw Tens of thousands of people joined a nationalist march in Warsaw on Saturday, organised to coincide with Poland's independence day. Marchers chanted religious slogans such as ""God, honour, country"" and some called out racist chants including ""Pure Poland, white Poland"". An ""anti-fascist"" counter-protest attracted about 2,000 people. Police estimated that 60,000 people took part in the main march. It attracted far-right agitators from elsewhere in Europe, including Tommy Robinson from the UK and Roberto Fiore from Italy. Kamil Staszalek, 30, said he was there to ""honour the memory of those who fought for Poland's freedom"". ""I'd say some people here do have extreme views, maybe even 30% of those marching, but 70% are simply walking peacefully, without shouting any fascist slogans,"" he told the AFP news agency. Supporters of the country's governing conservative Law and Justice (PiS) party took part in the annual march, which takes place alongside other events. Polish Interior Minister Mariusz Blaszczak called the event a ""beautiful sight"". ""We are proud that so many Poles have decided to take part in a celebration connected to the Independence Day holiday,"" he said. Andy Eddles, a British language teacher who has been living in Poland for 27 years, said he was ""shocked that they're allowed to demonstrate on this day"". ""It's 50,000 to 100,000 mostly football hooligans hijacking patriotism,"" the 50-year-old, who joined the counter-protest, told AFP. ""For me it's important to support the anti-fascist coalition, and to support fellow democrats, who are under pressure in Poland today,"" he said. The nationalist marchers carried Polish flags and threw red smoke bombs. Pawel, 21, from the southern city of Rzeszow told AFP it was ""important because religion is important in our country and we don't want Islamisation, of Europe or especially Poland"".Other events were also held in the city for Independence Day, which marks the country regaining independence 123 years after it was carved up by Tsarist Russia, Prussia, and the Austro-Hungarian Empire. An official ceremony was hosted by President Andrzej Duda. All living former Polish presidents attended, as well as the European Union president Donald Tusk. European Council President Donald Tusk lays a wreath at the Tomb of the Unknown Soldier ""Independence Day has always been and will continue to be a celebration of all Poles and not just one party. No politician in Poland has ever had nor will ever have a monopoly on patriotism,"" Mr Tusk said as he arrived at the airport in Warsaw. Poland was the only EU country to vote against Mr Tusk's reelection as EU president in March. The conservative tack taken by the country's ruling PiS party, including anti-migrant andpro-loggingreforms, has put it increasingly at odd with Brussels. Polish president offers courts compromise Poland sued over ancient forest logging Polish MPs agree controversial reforms At least two killed and 1,000 structures destroyed as wildfires rage in Los Angeles In maps: Thousands of acres on fire in LA 'Patients are collapsing in the waiting room': A&E nurses speak out Why does Trump want Greenland and what do its people think? How Canada's immigration debate soured - and helped seal Trudeau's fate 'I can't get divorced as I can't get my pension valued' What are cold weather payments and who can get them? BBC Sound of 2025: Barry Can't Swim is a new dance music superstar Ros Atkins on...Elon Musk's political interventions Jean-Marie Le Pen - founder of French far right and 'Devil of the Republic' Cases of HMPV are on the rise in China - but what is it? Politics Essential: Get the latest news and analysis delivered to your inbox every weekday Delivering brand-new miracles in 1970s East End Watch the latest series of Call the Midwife on iPlayer now Mark-Anthony Turnage shares the soundtrack of his life Once called 'Britainâs hippest composer', he's tackled topics from drug abuse to football in his work Paddyâs loaf-changing experience inside the bread factory Paddy McGuinness visits the bread factory he used to work in, and sees how they make 1.4 million loaves a week What's behind the global surrogacy boom? More countries are banning surrogacy â but demand is growing Â© 2025 BBC. The BBC is not responsible for the content of external sites.Read about our approach to external linking."
"60,000 join nationalist march in Poland","This video can not be played These were the scenes in 2017 when a nationalist march and counter-protest took place in Warsaw Tens of thousands of people joined a nationalist march in Warsaw on Saturday, organised to coincide with Poland's independence day. Marchers chanted religious slogans such as ""God, honour, country"" and some called out racist chants including ""Pure Poland, white Poland"". An ""anti-fascist"" counter-protest attracted about 2,000 people. Police estimated that 60,000 people took part in the main march. It attracted far-right agitators from elsewhere in Europe, including Tommy Robinson from the UK and Roberto Fiore from Italy. Kamil Staszalek, 30, said he was there to ""honour the memory of those who fought for Poland's freedom"". ""I'd say some people here do have extreme views, maybe even 30% of those marching, but 70% are simply walking peacefully, without shouting any fascist slogans,"" he told the AFP news agency. Supporters of the country's governing conservative Law and Justice (PiS) party took part in the annual march, which takes place alongside other events. Polish Interior Minister Mariusz Blaszczak called the event a ""beautiful sight"". ""We are proud that so many Poles have decided to take part in a celebration connected to the Independence Day holiday,"" he said. Andy Eddles, a British language teacher who has been living in Poland for 27 years, said he was ""shocked that they're allowed to demonstrate on this day"". ""It's 50,000 to 100,000 mostly football hooligans hijacking patriotism,"" the 50-year-old, who joined the counter-protest, told AFP. ""For me it's important to support the anti-fascist coalition, and to support fellow democrats, who are under pressure in Poland today,"" he said. The nationalist marchers carried Polish flags and threw red smoke bombs. Pawel, 21, from the southern city of Rzeszow told AFP it was ""important because religion is important in our country and we don't want Islamisation, of Europe or especially Poland"".Other events were also held in the city for Independence Day, which marks the country regaining independence 123 years after it was carved up by Tsarist Russia, Prussia, and the Austro-Hungarian Empire. An official ceremony was hosted by President Andrzej Duda. All living former Polish presidents attended, as well as the European Union president Donald Tusk. European Council President Donald Tusk lays a wreath at the Tomb of the Unknown Soldier ""Independence Day has always been and will continue to be a celebration of all Poles and not just one party. No politician in Poland has ever had nor will ever have a monopoly on patriotism,"" Mr Tusk said as he arrived at the airport in Warsaw. Poland was the only EU country to vote against Mr Tusk's reelection as EU president in March. The conservative tack taken by the country's ruling PiS party, including anti-migrant andpro-loggingreforms, has put it increasingly at odd with Brussels. Polish president offers courts compromise Poland sued over ancient forest logging Polish MPs agree controversial reforms At least two killed and 1,000 structures destroyed as wildfires rage in Los Angeles In maps: Thousands of acres on fire in LA 'Patients are collapsing in the waiting room': A&E nurses speak out Why does Trump want Greenland and what do its people think? How Canada's immigration debate soured - and helped seal Trudeau's fate 'I can't get divorced as I can't get my pension valued' What are cold weather payments and who can get them? BBC Sound of 2025: Barry Can't Swim is a new dance music superstar Ros Atkins on...Elon Musk's political interventions Jean-Marie Le Pen - founder of French far right and 'Devil of the Republic' Cases of HMPV are on the rise in China - but what is it? Politics Essential: Get the latest news and analysis delivered to your inbox every weekday Delivering brand-new miracles in 1970s East End Watch the latest series of Call the Midwife on iPlayer now Mark-Anthony Turnage shares the soundtrack of his life Once called 'Britainâs hippest composer', he's tackled topics from drug abuse to football in his work Paddyâs loaf-changing experience inside the bread factory Paddy McGuinness visits the bread factory he used to work in, and sees how they make 1.4 million loaves a week What's behind the global surrogacy boom? More countries are banning surrogacy â but demand is growing Â© 2025 BBC. The BBC is not responsible for the content of external sites.Read about our approach to external linking."
Spain PM visits after big Catalan protest,"PM Mariano Rajoy (L) joined the leader of his PP party in Catalonia for campaigning on Sunday Spanish Prime Minister Mariano Rajoy has said regional elections next month in Catalonia will help end ""separatist havoc"" in the north-eastern region. He addressed a campaign event on his first visit there since imposing direct rule on the region a fortnight ago. Defending his decision in Barcelona, he said he had ""exhausted all roads"" after the Catalan government's unilateral declaration of independence last month. Several key Catalan leaders are currently being detained over the move. Some 750,000 people protested in Barcelona on Saturday against the arrests, local police estimated. Would Catalonia be a viable country? Basque leaders worry about Catalan chaos The crisis was sparked by a disputed referendum held in Catalonia in October, which had been declared illegal by the Spanish courts. Catalan officials said the independence campaign won 92% of the vote, from a turnout of 43%. Many of those who were against independence did not cast votes, refusing to recognise the legitimacy of the referendum. The Catalan government subsequently declared independence. In response, the Spanish government dissolved the region's parliament, imposed direct rule and called a snap regional election on 21 December. Protesters shone their mobile phone torches during Saturday's rally in Barcelona Speaking at a campaign event in Barcelona for his Popular Party (PP) on Sunday, Mr Rajoy called on the participation of the ""silent majority"" to ""convert their voice into a vote"". ""We must reclaim Catalonia from the havoc of separatism,"" he added, saying: ""With democracy, we want to reclaim Catalonia for everyone."" He told PP supporters that the right result would boost Spain's economic growth next year to above 3%. He called on companies not to leave the region, after hundreds of firms moved their headquarters away amid uncertainty over the region - which accounts for a fifth of Spain's economy. He also urged people in Spain to continue buying Catalan products. By James Reynolds in Barcelona For a short while, the man who ultimately runs Catalonia was in Catalonia. But Mariano Rajoy's advisors made sure he would not run into vocal pro-independence opponents. Instead, he spoke to the party faithful. Mr Rajoy's main campaign event was held inside a hotel ballroom, in front of mostly older supporters. Spain's prime minister came here in order to win the regional Catalan election he's called for 21 December. His People's Party doesn't command widespread support in this region. Mr Rajoy's supporters waved flags left for them on their seats But the pro-Spain movement as a whole makes up about half the population of Catalonia. An election victory for this sector would make it much harder for pro-independence forces to make another attempt to break away from Spain. After speaking for 25 minutes, Mr Rajoy posed for pictures and made his way out of the hotel amid a crush of supporters. ""Will you meet your opponents?"" I asked him. ""Yes,"" he said. But he didn't say where or when. Since the crackdown by Madrid,Catalonia's sacked President Carles Puigdemont has gone into self-imposed exile in Belgium, and many of his top allies have been remanded in custody. Thousands took to the streets of Barcelona on Saturday calling on Spain to free the ministers, as well as two grassroots campaign leaders being detained. They marched behind a banner declaring ""We are a republic"", and carried placards that said the detainees were political prisoners. The sacked former ministers are accused of alleged rebellion and sedition, while the two activists were arrested over a mass protest before the referendum. This video can not be played Here's what protesters in Catalonia are singing about The left-wing ERC party, a key ally of Mr Puigdemont, has announced that some of the prisoners, including party leader Oriol Junqueras, as well as some of the sacked ministers who also went to Belgium, will stand on its electoral list. However, the ERC has rejected a call from Mr Puigdemont to fight the election as part of a single pro-independence bloc with other parties - as they did in 2015. A recent opinion poll in Catalan newspaper La Vanguardia suggests that the ERC will win the biggest share of the vote in December.,external Mr Rajoy's PP won just 8.5% of the vote in the last regional elections two years ago. Mr Rajoy was mocked as the Devil on this recent placard in Barcelona In another development, the mayor of Barcelona, Ada Colau, condemned Catalonia's pro-independence leaders. Ms Colau, who was elected in 2015 on an anti-capitalist platform and whose party is standing in the regional parliamentary election for the first time, said leaders of the independence movement had ""tricked the population for their own interests"". However, her party has also voted to break a pact with the Socialist party in Barcelona in protest at its support for the national government's decision to invoke Article 155 of the constitution, imposing direct rule on Catalonia. Spain could allow referendums, says FM Belting it out for Catalan independence. Video, 00:02:52Belting it out for Catalan independence The man who wants to break up Spain Reality Check: Would Catalonia be a viable country? Basque leaders worry about Catalan chaos Why is this football shirt controversial? At least two killed and 1,000 structures destroyed as wildfires rage in Los Angeles In maps: Thousands of acres on fire in LA 'Patients are collapsing in the waiting room': A&E nurses speak out Why does Trump want Greenland and what do its people think? How Canada's immigration debate soured - and helped seal Trudeau's fate 'I can't get divorced as I can't get my pension valued' What are cold weather payments and who can get them? BBC Sound of 2025: Barry Can't Swim is a new dance music superstar Ros Atkins on...Elon Musk's political interventions Jean-Marie Le Pen - founder of French far right and 'Devil of the Republic' Cases of HMPV are on the rise in China - but what is it? Politics Essential: Get the latest news and analysis delivered to your inbox every weekday Delivering brand-new miracles in 1970s East End Watch the latest series of Call the Midwife on iPlayer now Mark-Anthony Turnage shares the soundtrack of his life Once called 'Britainâs hippest composer', he's tackled topics from drug abuse to football in his work Paddyâs loaf-changing experience inside the bread factory Paddy McGuinness visits the bread factory he used to work in, and sees how they make 1.4 million loaves a week What's behind the global surrogacy boom? More countries are banning surrogacy â but demand is growing Â© 2025 BBC. The BBC is not responsible for the content of external sites.Read about our approach to external linking."
