headline,article
A cultural history of the ponytail,"In 2018, it has a feminist undercurrent, implying âIâm busy, Iâm working, and I need my hair OFF my faceâ There are several specific types of relief that we donât yet have a word for but should: taking your heels off after a night out, removing your bra at the end of the day (read: the second you get home), and the sweet release of taking down a scraped-back ponytail. Ariana Grande can relate to the latter. The 25-year-old pop star has recently admitted being in âconstant painâ from her signature âdo. Considering she premiered it in 2014, that's alongtime to have a hair headache. No wonder she's had a trim and let it alldown,external. Ariana Grande and her signature ponytail on stage at the Billboard Music Awards, May 2018 But until now, she was prepared to suffer for her style, describing her affection for her ponytail as âtrue love,externalâ. French Vogue declared the high ponytail âthe look of Fall 2018,externalâ, and the ponytail hashtag on Instagram brings up 2.3 million hits, with its myriad variations (#ponytailgoals, #ponytailbraids, #highponytail), generating thousands more. All of which seems to suggest that weâre way more yay than neigh (sorry) about 2018âs hottest up-do. But how did we get here? Hereâs a quick hair-story lessonâ¦ Some may think that the semi-bald, semi-ponytail look was invented by a rock music fan who couldnât quite accept the ageing process, but pre-17th century, the male Manchu people of Northeast China grew the hair on the top of their heads long (and often braided it), while the front was shaved. A sort of reverse rocker, if you will. Known as a âqueue,externalâ â the French word for âtailâ â the traditional hairstyle is often associated with theÂ Manchu people, prior to their forming theQing Dynasty,external, the last imperial Chinese Dynasty that ruled from 1644 to 1912. But the ponytail can possibly be traced back to Ancient Greece - when it was seen in frescoes painted thousands of years ago in Crete, set high on the backs of heads of women, according to theEncyclopedia of Hair,external. The Manchu people forcefully introduced the style to Han Chinese men (who along with Han Chinese women, traditionally wore their hair in buns or topknots), during the Manchu conquest of China in the early 17th century. The enforced style was a symbol of submission, with execution the punishment for non-compliance. Chinese men with the Manchu hairstyle from the book Geschichte des KostÃ¼ms (History of the Costume) published in 1905 In 2018, the male ponytail is seen as unconventional and artistic (see celebs identifiable by one name: Zayn, Brad, Jared), but in the 18th century, it was the mandatory style for European soldiers, and considered both hyper-masculine and theepitome of âestablishmentâ,external. French soldiers were required to wear their hair in a queue (ofno longer than eight inches in length,external), while British soldiers and sailors wore their long hair pulled back into ponytails, not always braided, but often greased and/or powdered or tarred. It was secured with ribbon or a strap, so tight that one British soldier said he didnât think heâd be able to âclose his eyelids afterwards,external'. 'Queue' was the commonly used word for the style by soldiers until the 20th century. 'Pony's tail,external' makes one appearance in Anthony Trollope's 1873 book The Eustace Diamonds. The British Army was ordered tocut off its queues in 1800,external, when regulations changed and short hair was deemed smarter and lower maintenance, although the Navy wore a version,known as a 'pigtail',external, until about 1820.Â From left to right: English cavalry officer with braided queue, French officer with loops-pigtail and black ribbon, German officer with pigtail wig and black leather queue Ringlets, chignons, sausage curls, elaborate up-dosâ¦ but the ponytail wasthought of as informal,external. (Anyone who has yanked a hair tie from around their wrist and stuck their hair up in a messy pony, while slobbing about the house can probably agree, right?) It was also viewed as a style for young girls, rather than women. Sandra Dee with Cliff Robertson in Gidget, 1959 When the 20th century arrived, every era had its iconic âdo â the flapper bob in the '20s, the starlet waves in the '40s â and it wasnât until the '50s that the humble ponytail started to get its moment, thanks to thefirst-ever Barbie,external(who came with a perky pony), and film stars such as Sandra Dee making the style famous in films like 1959âsÂGidget,external. As the actress had such a girl-next-door reputation (Rizzo's song inGrease,externalis a quick explanation as to how Dee was regarded in the '50s) the hairstyle, by extension, did too. In the 1960s, the high pony hit pop culture inI Dream of Jeannie,external, another âgoodâ character - a 2,000-year-old genie who devotes her life and sorcery to the human man she loves. It then took the model Brigitte Bardot - AKA the epitome of sexy, insouciant French chic - to tousle it in the '60s, which reinvented the ponytail into a style that the cool girls wore. French film star Brigitte Bardot pioneered the artfully dishevelled ponytail Meanwhile, in the '70s, menâs hair was getting longer again (hello, Jimi Hendrix and The Beatles!) but rather than restricting it, it was all about letting it hang free, man. Itâs pretty apt that the Queen of Reinvention gave the good-girl hairdo another makeover. Madonnaâs 1990 Blonde Ambition tour saw her sporting a clip-on platinum plaited pony that became as legendary as the conical bra she wore it with. Combined with Madgeâs trademark swagger, she made the ponytail synonymous with female empowerment (as well as other style choices). Fans quickly started wearing their hair in copycat ponies to the shows, but Madonna actually dropped the look halfway through the tour because it kept getting caught in her headset â as well as putting too much stress on her natural hair. However, the pony remained iconic, with the hairpiece from the tour selling for Â£12,000 ($20,000)at an auction in 2014,external. Madonna on stage during her Blond Ambition world tour in 1990 Box braids were around long before Janet Jacksonâs romantic moviePoetic Justice, but as theyâre still often referred to as âJanet Jackson braidsâ or âPoetic Justice braids,externalâ, itâs fair to say that she was responsible for their '90s revival. But she didnât stop with one trend. When she pulled the braids back into a high ponytail, she made the box-braid pony officially (as they say in fashion) âa thingâ that A-listers such as Zoe Kravitz and Jada Pinkett-Smith continue to love. In 2013, she paid homage to herself (as only a true diva can) by reviving her own look atMilan fashion week,external. Janet Jackson at the Grammy Awards, 1993 The slicked-back high pony had already been deemed âthe Croydon facelift,externalâ by style snobs - owing to its gravity-defying effect on the visage when pulled tight enough â when Little Britain took any remaining poshness out of the pony. Matt Lucasâs character Vicky Pollard made it synonymous with a tracksuit-wearing teen delinquent.Â Not exactly the ponyâs finest hour, perhaps, but a funny one nonetheless. Kate Moss (left) joins comedian Matt Lucas (aka 'Vicky Pollard') on stage at the Hammersmith Apollo, 2006 Ever wondered at school what equations had to do with real life? Wonder no more. A team of British and American scientists won theIg Nobel for PhysicsÂ for coming up with a calculation that predicts the shape of any ponytail (based on hair length, curliness and the effect of gravity thereon). Sure, we all know theÂequation,externaloff by heart (ahem) - and itâs better known as the âRapunzel Number,externalâ. The award is considered a spoof of the Nobel Prize, but the quirky experiments submitted by the scientists are often designed to tackle real-world problems, and as one of the researchers worked at a giant shampoo company, there was a business interest in 'hairodynamics'. However, it also helped scientists understand other materials better, such as wool and fur. (But it is also a good conversation starter: âHey, whatâs your Rapunzel Number?â) The 2018 pony is a slick, pulled-back number that has a feminist undercurrent, implying âIâm busy, Iâm working, and I need my hair OFF my faceâ. It's a look that's been popularised by the likes of Beyonce at 2015âs Met Gala, J-Lo and the Kardashians, who return to it time and again, and of course Ariana with her seminal pony. BeyoncÃ© makes a statement at the Met Gala, 2015 But as Ariana knows, it comes at a price. Regularly wearing your hair pulled back tightly can cause headaches andtraction alopecia,externalâ a type of hair-loss whereby hair thins out after prolonged stress on the follicle. Which is why Ariana might have decided to give her pony the Thank u, Next treatment (for now). So what now for this unisex, century-spanning do - have we indeed reached peak ponytail? With Meghan Markle regularly pulling her hair back in a simple, mid-height pony, something tells us that itâs not going anywhere, simply reinventing itself again. Billy Crystal and Paris Hilton among celebrities to lose homes in wildfires 'Apocalypse' LA and 'Reeves faces extra tax rises' Commuters warned of icy roads as cold snap continues Clear racism at Al Fayed's Harrods, former staff tell BBC Warning after two lynx released in Highlands Man Utd agree new Diallo deal - Thursday's gossip 'Bergvall is headline act as young Spurs show incredible maturity' Bentancur is 'all good' after being stretchered off Bergvall controversy fuels Postecoglou's tirade on 'change' Is Potter the right fit for West Ham? Â© 2025 BBC. The BBC is not responsible for the content of external sites.Read about our approach to external linking."
Peer's son who killed himself failed by NHSLord Monson's son Rupert Green took his own life while being treated for psychosis.Surrey,"Lord Monson believes his son's mental health problems were related to his use of strong cannabis A peer's son who took his own life was let down by an NHS trust, a coroner has ruled. Rupert Green, a user of strong cannabis and son of hereditary peer Lord Monson, killed himself in January 2017 after displaying symptoms of psychosis. Sitting in Woking, Surrey, assistant coroner Anna Crawford said there had been a failure on the part of Surrey and Borders NHS Trust. The trust said it was ""deeply sorry"" for 21-year-old Mr Green's death. The inquest heard he had been under the care of the Early Intervention in Psychosis Team, a branch of the Surrey trust, since 2016. On 15 January 2017, Mr Green was taken by his mother to an out-of-hours service for people with mental health issues. He was displaying acute psychotic symptoms, ""stating he was the son of God"", and threatening to kill himself if not believed, the inquest heard. Mr Green, pictured here in his childhood, became addicted to skunk cannabis A mental health nurse was said to be ""very concerned about him"" and asked her colleagues at the trust's Home Treatment Team (HTT) to carry out an assessment, but they refused the referral. Instead he was seen for a planned review the following day. He continued to display signs of psychosis but stopped threatening to kill himself. On 18 January he began the threats again, and told his mother there ""would be blood on her hands"" if she did not believe him. He was found dead later that day in the family's garden. Lord Monson has appealed for tougher penalties for those who deal in the skunk strain of cannabis Concluding Friday's inquest hearing, Ms Crawford said there had been ""a failure on the part of the HTT to assess and care for Rupert during the period of 15-18 January 2017"", but there was not a sufficient connection ""between that failure and Rupert's death"" to conclude there had been neglect. Justin Wilson, the trust's chief medical officer, said after the hearing: ""Our serious investigation into the care and treatment provided to Rupert has shown the communication between our Safe Haven service and Home Treatment Team was not clear and requires improvement. ""There was a missed opportunity for more intensive support from our Home Treatment Team and we have worked closely with the services involved to make positive changes."" In 2017, Nicholas Monson told the BBC his son, who was heir to the family's Burton estate in Lincolnshire, had suffered from psychosis as a result of an addiction to skunk - a strong form of cannabis. The peer has campaigned for the legalisation of milder forms of cannabis and tougher penalties for those dealing the skunk strain. In 2012, his son Alexander Monson, 28, died in police custody in Mombasa, Kenya. NHS probe over 'skunk death' of peer's son Aristocrat's son died 'violently' Skunk dangers prompt health fears. Video, 00:01:35Skunk dangers prompt health fears Surrey County Council to request one-year delay in elections Number of staff at the Royal Surrey County Hospital off sick fell by a fifth in the last year 15-hour snow warning issued for parts of south London Woman in her 70s dies after car crashes into wall in Epsom car park Wildfire sweeps through Hollywood Hills and threatens landmarks as chaos grips LA Paris Hilton among stars 'heartbroken' as she watches home 'burn to ground' 'Mum waited 31 hours' : Your stories of A&E Sound Of 2025: Ezra Collective are 'keeping music real' The Papers: 'Apocalypse' LA and 'Reeves faces extra tax rises' How Australia's beach cabana drama sparked a turf war H-1B: Visa row under Trump fuels anxiety for Indian dreamers 'I thought I was going to die': Jailed Venezuelan activist details brutality of prison life The man who could become Canada's future PM 'Trump 2.0' looms large over the global economy A politician was shot dead in Bangkok. Did another country do it? Chris Mason: Is Starmer leaving the door open to an abuse inquiry? Delivering brand-new miracles in 1970s East End Watch the latest series of Call the Midwife on iPlayer now Mark-Anthony Turnage shares the soundtrack of his life Once called 'Britainâs hippest composer', he's tackled topics from drug abuse to football in his work Paddyâs loaf-changing experience inside the bread factory Paddy McGuinness visits the bread factory he used to work in, and sees how they make 1.4 million loaves a week What's behind the global surrogacy boom? More countries are banning surrogacy â but demand is growing Â© 2025 BBC. The BBC is not responsible for the content of external sites.Read about our approach to external linking."
Asylum seeker 'children' found to be adults,"The government say age-disputed cases are ""challenging"" Twenty-four asylum seekers who claimed they were children after being sent to Liverpool were found to be adults, the city's council has said. The authority said another 15 asylum seekers ""should have been identified as children"" by the government and accommodated in London instead. A Home Office spokesman said age-disputed cases remain ""a very challenging area"". Liverpool City Council wants to recover Â£657,000 for supporting the children. A council document,externalsaid 39 asylum seekers sent to Liverpool by the Home Office in 2018 ""have then claimed they were children"". The authority ""had to pay for an 'age assessment' for each one (costing Â£1,500 each) that concluded that 15 were children and 24 were adults"". Support for children includes more benefits and educational provision, ""which they cannot access if they are an adult seeking asylum"", according to the document. ""The 15 children should not have been sent by the Home Office to Liverpool,"" it continued, ""they should have been identified as children by the Home Office and therefore received support from a local social services (such as in Croydon) and not be a cost to Liverpool City Council"". As they had been assessed as children in Liverpool, the council was obliged to support them - the costs of which are ""approximately Â£657,000 per year"". It said it ""should be able to recover the costs associated with the children who should never have been sent to Liverpool"". The document also highlighted: the council has been ""threatened"" with judicial reviews from legal advisers for some of the asylum seekers found to be adults it was providing them with accommodation at a cost of ""approximately Â£350,000 per year"" to avoid legal costs it has decided to fund legal advice to challenge the next six cases ""where the young person is assessed as an adult and a judicial review is threatened by the asylum seeker's legal adviser"" the council has asked the Home Office to fund independent age assessments earlier in the process A Home Office spokesman said ""safeguarding children"" was a priority, adding ""age-disputed cases remain a very challenging area of work in which no single assessment technique, or combination of techniques, is likely to determine an individual's age with precision"". ""The Home Office will treat someone claiming to be a child as an adult where their physical appearance and demeanour very strongly suggests that they are significantly over 18."" He added that funding for unaccompanied asylum-seeking children was under review. David Simmonds, deputy chairman for the Local Government Association, said the issue was spread nationwide. ""The process at the border is pretty weak because there is no definitive way of checking age. ""Lawyers know a judicial review will cost a council between Â£20,000 and Â£60,000 and use the threat of court to get their client what they want. ""Fair play to Liverpool for trying to stand up to it. But win or lose, the taxpayer always loses out."" 'Pupil aged 30' under investigation Asylum whistleblower: Decisions are a âlotteryâ Asylum seekers 'wrongly' banned from study Mayor welcomes 'fairer' asylum system Child migrants 'exploited every 30 minutes' Number of children seeking asylum rises Properties bought by Wirral Council lose Â£9m in value Downton Abbey actress to speak about new book at Linghams Police say 'it's frustrating' as 508 arrests made in 32 days Nan 'keeping strong for everyone' after devastating diagnosis Courageous eight-year-old 'on the right track' after rollercoaster seizure battle Magistrates make decision on destruction order after border collie injured victim Wildfire sweeps through Hollywood Hills and threatens landmarks as chaos grips LA Paris Hilton among stars 'heartbroken' as she watches home 'burn to ground' 'Mum waited 31 hours' : Your stories of A&E Sound Of 2025: Ezra Collective are 'keeping music real' The Papers: 'Apocalypse' LA and 'Reeves faces extra tax rises' How Australia's beach cabana drama sparked a turf war H-1B: Visa row under Trump fuels anxiety for Indian dreamers 'I thought I was going to die': Jailed Venezuelan activist details brutality of prison life The man who could become Canada's future PM 'Trump 2.0' looms large over the global economy A politician was shot dead in Bangkok. Did another country do it? Chris Mason: Is Starmer leaving the door open to an abuse inquiry? Delivering brand-new miracles in 1970s East End Watch the latest series of Call the Midwife on iPlayer now Mark-Anthony Turnage shares the soundtrack of his life Once called 'Britainâs hippest composer', he's tackled topics from drug abuse to football in his work Paddyâs loaf-changing experience inside the bread factory Paddy McGuinness visits the bread factory he used to work in, and sees how they make 1.4 million loaves a week What's behind the global surrogacy boom? More countries are banning surrogacy â but demand is growing Â© 2025 BBC. The BBC is not responsible for the content of external sites.Read about our approach to external linking."
Major government contractor 'seeks rescue',"Among the company's contracts is for cleaning at Network Rail stations One of the UK's largest providers of public services is seeking a rescue deal as it struggles with Â£500m of debt,according to the Financial Times.,external Interserve, which works in prisons, schools, hospitals and on the roads, said it might look for new investment or sell off part of the business. Workers at the Foreign Office and the NHS are among Interserve's tens of thousands of UK employees. The government said it supported the company's long-term recovery plan. The Financial Times reported that the company was looking for a deal to refinance its debt which would mean lenders taking a significant loss while public shareholders would be ""virtually wiped out"". Its share price dropped to a 30-year low last month. Despite lucrative contracts in the Middle East and its wide range of work in the UK, the company has continued to lose money since March, when it agreed an earlier rescue deal. Its troubles have been blamed on cancellations and delays in its construction contracts as well as struggling waste-to-energy projects in Derby and Glasgow. Interserve claims its prospects are improving, and says it will increase profits this year. From its origins in dredging and construction, the company has diversified into wide range of services, such as health care and catering, for clients in government and industry. At King George Hospital in east London, for instance, Interserve has a Â£35 million contract for for cleaning, security, meals, waste management and maintenance. Its infrastructure projects include improving the M5 Junction 6 near Bristol, refurbishing the Rotherham Interchange bus station in Yorkshire, and upgrading sewers and water pipes for Northumbrian Water. But Interserve is also the largest provider of probation services in England and Wales, supervising about 40,000 ""medium-low risk offenders"" for the Ministry of Justice. In a statement, Interserve said: ""The fundamentals of the business are strong and the board is focused on ensuring Interserve has the right financial structure to support its future success."" The company said its options included bringing ""new capital into the business and progressing the disposal of non-core businesses "". Interserve's difficulties follow the collapse of Carillion in January 2018, whichput thousands of jobs at risk and cost taxpayers Â£148m. Interserve shares dive on fears for future Government reassures over Interserve Following that, the government launched a pilot of ""living wills"" for contractors, so that critical services can be taken over in the event of a crisis. Interserve is one of five suppliers taking part. A Cabinet Office spokesperson said: ""We monitor the financial health of all of our strategic suppliers, including Interserve, and have regular discussions with the company's management. The company successfully raised new debt facilities earlier this year, and we fully support them in their long term recovery plan."" Interserve shares dive on fears for future Interserve: The next firm worrying investors Government reassures over Interserve Wildfire sweeps through Hollywood Hills and threatens landmarks as chaos grips LA Paris Hilton among stars 'heartbroken' as she watches home 'burn to ground' 'Mum waited 31 hours' : Your stories of A&E Sound Of 2025: Ezra Collective are 'keeping music real' The Papers: 'Apocalypse' LA and 'Reeves faces extra tax rises' How Australia's beach cabana drama sparked a turf war H-1B: Visa row under Trump fuels anxiety for Indian dreamers 'I thought I was going to die': Jailed Venezuelan activist details brutality of prison life The man who could become Canada's future PM 'Trump 2.0' looms large over the global economy A politician was shot dead in Bangkok. Did another country do it? Chris Mason: Is Starmer leaving the door open to an abuse inquiry? Delivering brand-new miracles in 1970s East End Watch the latest series of Call the Midwife on iPlayer now Mark-Anthony Turnage shares the soundtrack of his life Once called 'Britainâs hippest composer', he's tackled topics from drug abuse to football in his work Paddyâs loaf-changing experience inside the bread factory Paddy McGuinness visits the bread factory he used to work in, and sees how they make 1.4 million loaves a week What's behind the global surrogacy boom? More countries are banning surrogacy â but demand is growing Â© 2025 BBC. The BBC is not responsible for the content of external sites.Read about our approach to external linking."
