headline,article
New wind warnings amid Storm Eunice clean-up,"This video can not be played Footage captures lorry blown over by storm winds More strong winds could hamper clean-up work after 92mph (148km/h) gusts battered parts of Wales on Friday. Thousands of homes are still without power after Storm Eunice caused widespread disruption. Trees were felled, lorries toppled over, and all trains were cancelled. AMet Office yellow warning for wind,externalcovering south and mid Wales was in place until 18:00 GMT. ""These conditions on Saturday may hamper any clear-up,"" it said. A furtheryellow warning for wind,externalfor the whole of Wales is in place from noon on Sunday until 15:00 on Monday. Damage and thousands without power after storm In pictures: Storm's sea surges and flying sheds Storm Eunice: BBC reporter in Porthcawl faces strong winds Almost 4,000 homes are still without power, according to Western Power, with Scottish Power restoring electricity to all its customers in north and mid Wales by midday Saturday. Rhys ap Tegwyn, from Llandyfriog in Ceredigion, said he hoped to have power restored by Saturday evening, after losing supply on Friday morning. ""It was a bit of a shock for our teenage girls - they're so used to Wi-Fi, but they stayed the night with relatives,"" he said. ""We have a huge stock of candles and our oven uses bottled gas. ""At the end of the day we have a roof over us and we're thankful for that."" Storm Eunice damaged neighbours' roofs and brought down Winifred Morgan's garden fence Winifred Morgan, 87, has been staying with her friend since losing power at her home in Porthcawl, Bridgend county, on Friday at about 11:00. ""Luckily my friend Linda has taken me in until the power is restored so I can stay warm as I have no form of heating in my house,"" she said. The Welsh Premiership rugby games involving Aberavon and Llanelli, and Ebbw Vale versus Carmarthen Quins have also been postponed because of waterlogged pitches. Meanwhile, warm drinks and biscuits are being offered to anyone without power by Amman United RFC in Glanamman, Carmarthenshire. Amman United is offering warm drinks and snacks to people whose power has been cut off by the storm Sarah Davies, of the rugby club, said: ""It's a community we should all be helping each other out to be honest with you. ""People are cold, angry, fed-up and bored. ""A lot of other people are reaching out to offer help over Facebook. There are homes in the community, doing similar things - we aren't the only ones; but a lot of families were really grateful we were able to step in."" Slates blew from many seafront properties in Aberystwyth The clean-up is also underway in Aberystwyth, where slates were blown off buildings, according to Richard Griffiths of the Richmond Hotel. He said: ""We were lucky. When they fly, they fly everywhere, and they're just like bits of confetti. ""As a result we're very fortunate nobody got injured."" Several roofs were torn from buildings, with damage at the Co-op petrol station in Pontypridd Road in Barry, Carmarthen railway station, the gym at Merthyr Tydfil's Bishop Hedley school, and a school at Manorbier, Pembrokeshire. And clean up work is continuing at Tywyn in south Gwynedd where 16 residents had to evacuated when Storm Eunice ripped off the roofing on two blocks of flats. Saturday's weather warning covers mid and south Wales An Asda supermarket in Merthyr Tydfil had to be evacuated on Friday after cladding came loose from the front of the shop's entrance. Cardiff Council saidVictoria Park was due to reopen on Saturday,externalfollowing clean-up work after the storm. Prof Liz Bentley, chief executive of the Royal Meteorological Society, said imposing a rarered weather warningfor parts of Wales on Friday allowed people and local authorities to ""batten down the hatches"". ""Damage and disruption was pretty widespread,"" she toldBBC Radio Wales Breakfast. High winds caused two lorries to blow over on the M4 This tree narrowly avoided landing on two cars after falling on Heathwood Road in Cardiff Saturday's less severeyellow warning for winds,externalof up to 60mph (97km/h) covers Blaenau Gwent, Bridgend, Caerphilly, Cardiff, Carmarthenshire, Ceredigion, Merthyr Tydfil, Monmouthshire, Neath Port Talbot, Newport, Pembrokeshire, Powys, Rhondda Cynon Taf, Swansea, Torfaen and Vale of Glamorgan. Ioan Williams, from Natural Resources Wales, said people should ""continue to be vigilant"", with more windy weather to come as well as heavy rain on Saturday and Sunday. ""That could trigger someflood alerts and some flood warning,externals,"" he said. Before and after.... Huw Evans' static caravan was destroyed during the storm in Croesyceiliog, Carmarthenshire, but it was empty at the time Network Rail engineers clear fallen trees from the A487 Derwenlas, Powys Bill Kelly, route director for Wales and borders for Network Rail, said there was ""substantial damage"" across the rail system. ""We are endeavouring to get as many routes open as we can... so please do check before you travel,"" he said. Transport for Wales also advised travellers to check its rail schedule viajourneycheck.com,externalwith ""significant disruption"" expected to continue into Sunday. A tree came down over a vehicle and blocked a road in The Mumbles Both Severn bridges between Wales and England were forced to close on Friday, although the M4 Prince of Wales Bridge has since reopened. But other roads still remain closed due to fallen trees and debris, according traffic analysts Inrix. Multiple trees have blocked the A484 between Cynwyl Elfed and Bronwydd Arms in Carmarthenshire. Fallen power cables have closed Swansea's Bishopston Road from Church Lane to Pyle Road. And traffic lights have ""collapsed"" on Swansea's A483 Fabian Way, near the Amazon distribution centre. Coast roads at Deganwy in Conwy county have also been hit by flooding Meanwhile, volunteers have come forward to help with a clean-up at Greenacres Rescue, in Little Haven, Pembrokeshire, where rabbit and geese enclosures were blown around ""like they were dolls houses"". A roof blew off a stable and the main office - a static caravan - was ""torn apart"" but no animals were hurt and well-wishers pledged more than £2,000 to help with costs. There was substantial damage to a number of the organisation's buildings Staff and volunteers have been at the site trying to repair the damage ""We have had many offers of physical help and we now feel we have enough to get through the first few days of clean up,"" a post on the group'sFacebook page,externalsaid. ""We are thankful no-one was hurt and we've managed to keep all the animals safe and well."" People in parts of mid and north Wales woke up to snow on Saturday. Photos posted byBBC Weather Watchersshowed coverings in Conwy county, Denbighshire, Wrexham and Powys. Snow covering the road near The Sportsmans Arms, near Cerrigydrudion, Conwy county Snowy road near Llyn Celyn, Bala, Gwynedd Snow at Llanfihangel-nant-Melan, Powys Power cuts continue amid new yellow warnings Three people die in UK as Storm Eunice wreaks havoc Damage and thousands without power after storm Do big storms mean more or less wind farm power? Video, 00:01:51Do big storms mean more or less wind farm power? Schools shut and trains cancelled before storm hits What does a red weather warning mean? Video, 00:00:34What does a red weather warning mean? Governor says lack of water for hydrants 'impaired' fight against wildfires 'I have nothing to go back to' - BBC reporter tells of LA fires heartbreak Trump avoids prison or fine in hush-money case sentencing LA fires: How three days of devastation unfolded What's the latest on the Los Angeles wildfires and what caused them? 'My mum died after four days on an A&E trolley' The '9/11 mastermind' wants to plead guilty. Why is the US trying to stop him? Pop star Chappell Roan wins BBC Sound Of 2025 Weekly quiz: Zendaya looked happy but who else sparkled at the Golden Globes? Inside the UK's first legal drug consumption room Danes struggle with response to Trump Greenland threat Off air with Laura K: Get Laura Kuenssberg's expert insight emailed directly to you Dragons’ Den returns with a new line-up of celebrity guests Can a fresh batch of entrepreneurs secure the deal of a lifetime? Are smart scales really as ‘smart’ as they claim to be? Greg Foot explores whether they can accurately measure weight, body fat, muscle and bone mass The award-winning psychological competition is back A nail-biting game of detection, backstabbing and trust. Who will make it through? How close are we to a cancer vaccine? How might it help in the treatment of the disease? © 2025 BBC. The BBC is not responsible for the content of external sites.Read about our approach to external linking."
Ukraine invasion would shock the world - PM,"This video can not be played Watch: ""If Ukraine is invaded, the shock will echo around the world"" - UK PM Boris Johnson The shock of any invasion of Ukraine by Russia would ""echo around the world"", Boris Johnson has told world leaders. He said we must be ""unflinchingly honest"" about the situation in Ukraine and should not ""underestimate the gravity of this moment"". In a speech at a security conference in Munich, Mr Johnson said he does not know what Russian President Vladimir Putin intends, but ""omens are grim"". ""And that is why we must stand strong together,"" he said. Western nations have warned Russia could invade Ukraine imminently, with over 130,000 of its troops near the border. They accuse Russia of trying to stage a fake crisis in a breakaway eastern region of Ukraine to give it a reason to invade. But Russia has repeatedly denied having plans to invade, saying troops are conducting military exercises in the region, accusing the West of ""hysteria"". Is Russia going to invade Ukraine? How might Russia stage a false flag attack? Satellite images show Russian activity near Ukraine Russia does not want war, Putin says Mr Johnson stressed the UK still hoped diplomacy and dialogue would succeed in resolving the crisis. Urging unity among the UK's Western allies, he said: ""Every time that Western ministers have visited Kyiv, we have assured the people of Ukraine and their leaders that we stand foursquare behind their sovereignty and independence. ""How hollow, how meaningless, how insulting those words would seem, if at the very moment when their sovereignty and independence is imperilled, we simply look away."" If Ukraine were invaded, Mr Johnson said ""we will witness the destruction of a democratic state, a country that has been free for a generation, with a proud history of elections"". Ukraine is a former Soviet republic with historic ties to Russia and shares borders with both the EU and Russia. Russia has long resisted Ukraine's move towards Western institutions, including Nato, seeing the eastward expansion of the military alliance as a threat to its security. Boris Johnson warned ""we will witness the destruction of a democratic state"" if Ukraine is invaded The prime minister warned that any invasion would also be met with sanctions on Russian individuals and companies. He said the UK would ""open up the Matryoshka dolls"" of certain Russian-owned companies and make it impossible for them to raise finance in London. His comments follow the announcement ofnew legislationallowing the UK to widen its sanctions against the country. ""If Ukraine is invaded, the shock will echo around the world, and those echoes will be heard in East Asia they will be heard in Taiwan,"" he told the Munich Security Conference. Mr Johnson met Ukraine's president Volodymyr Zelensky, whosaid,externalthey had agreed ""joint next steps"" and remained united in the pursuit of de-escalation and diplomacy. In a statement, Labour leader Sir Keir Starmer said the party was ""steadfast in our support for the sovereignty and territorial integrity of Ukraine"". ""We stand in solidary with the Ukrainian people and in unity with our international partners and Nato allies in warning President Putin that any attack will lead to immediate, severe and extensive sanctions,"" he said. He said Labour supported the actions the government was taking to bring about an end to the stand-off, adding that ""diplomacy can still succeed"". Writing on Twitter, former Prime Minister Theresa May said Boris Johnson was ""right to press the case for continued diplomacy, while preparing the most severe sanctions for Russia if Putin chooses the catastrophe of war"". Mr Zelensky and Mr Johnson met at the security conference In a joint statement, foreign ministers from the G7 group of wealthy nations said they had seen ""no evidence"" that Russia has withdrawn some of its forces, as it has claimed, and that they remained ""gravely concerned"" by the situation. ""We call on Russia to choose the path of diplomacy, to de-escalate tensions, to substantively withdraw military forces from the proximity of Ukraine's borders and to fully abide by international commitments,"" the statement said. ""As a first step, we expect Russia to implement the announced reduction of its military activities along Ukraine's borders. We will judge Russia by its deeds."" US Vice-President Kamala Harris is also attending the conference in Munich, and said in a speech that Russia faced ""swift, severe and united"" economic consequences if it were to invade. She accused Russia of narrowing the avenues for diplomacy, saying ""their simply do not match their words"". Her remarks come after Moscow said some of its troops had moved away from the border in recent days - but Western powers said there was no evidence of withdrawal. On Friday, US President Joe Bidensaid he is convincedMr Putin has decided to invade and that an assault could happen in the ""coming days"". Mr Biden said the assessment was based on US intelligence, which suggested the capital Kyiv would be targeted. Other Western politicians taking part in the three-day security conference include German Chancellor Olaf Scholz and US Vice-President Kamala Harris. But Russia will not be officially represented at the summit for the first time since 1999 amid the rising tensions over the situation at Ukraine's borders. Meanwhile, the Home Office hasscrapped a visa schemeoffering rich foreign investors fast-track residency, amid pressure on ministers over UK links to Russia. Labour has demanded the immediate publication of an ongoing review into visas granted between 2008 - when the scheme was introduced - and 2015 when checks on applicants were tightened. The Liberal Democrats have also demanded a ""clear timetable"" for revoking visas issued to any Russians ""who have been flagged as posing a national security risk"". The security conference in Germany comes as Ukrainian forces and Russia-backed rebels in the country's east continued to accuse each other of shelling and other ceasefire violations on Friday. Such breaks in the area's years-long ceasefire are not uncommon, and each side blamed the other for the violence on Thursday. On Friday, Washington increased its estimate of the number of Russian troops deployed around Ukraine to between 169,000 and 190,000. Ukraine's defence minister has suggested a figure of 149,000. GRAVITY DEFYING TRICKS:James Woods introduces possibly the greatest skier you've never heard of BOOST YOUR BRAIN:Find out how to banish brain fog with these free and simple steps Watching for an invasion on Ukraine's long border Has Putin's war in Ukraine failed? Ukraine: Russia's possible attack routes Governor says lack of water for hydrants 'impaired' fight against wildfires 'I have nothing to go back to' - BBC reporter tells of LA fires heartbreak Trump avoids prison or fine in hush-money case sentencing LA fires: How three days of devastation unfolded What's the latest on the Los Angeles wildfires and what caused them? 'My mum died after four days on an A&E trolley' The '9/11 mastermind' wants to plead guilty. Why is the US trying to stop him? Pop star Chappell Roan wins BBC Sound Of 2025 Weekly quiz: Zendaya looked happy but who else sparkled at the Golden Globes? Inside the UK's first legal drug consumption room Danes struggle with response to Trump Greenland threat Off air with Laura K: Get Laura Kuenssberg's expert insight emailed directly to you Dragons’ Den returns with a new line-up of celebrity guests Can a fresh batch of entrepreneurs secure the deal of a lifetime? Are smart scales really as ‘smart’ as they claim to be? Greg Foot explores whether they can accurately measure weight, body fat, muscle and bone mass The award-winning psychological competition is back A nail-biting game of detection, backstabbing and trust. Who will make it through? How close are we to a cancer vaccine? How might it help in the treatment of the disease? © 2025 BBC. The BBC is not responsible for the content of external sites.Read about our approach to external linking."
Three people die in UK as Storm Eunice wreaks havoc,"This video can not be played Watch videos showing the impact of Storm Eunice - crashing waves, torn roofs and fallen trees Three people have died in one of the worst storms to hit the UK in decades. Fierce winds from Storm Eunice toppled trees and sent debris flying, causing the deaths of a woman in her 30s in London, a man in his 20s in Hampshire, and a man in his 50s in Merseyside. A 122mph gust on the Isle of Wight set a provisional record in England, while the storm closed schools, disrupted travel and tore off roofs. About 400,000 homes were without power as of Friday night. Five people died elsewhere in Europe. Coastal areas of south-west England and south Wales, along with south-east England, had been on alert after rare red weather warnings were issued by the Met Office early on Friday, indicating a danger to life. There are several less-serious yellow warnings in place across Scotland, Northern Ireland and parts of northern England - because of concerns about wind, snow and ice. Check the BBC Weather forecast for your area As it happened: 'Worst storm in decades' hits UK In pictures: Storm Eunice reaches the UK Police in Highgate, north London, said they were called to reports of a tree falling on a car at 16:00 GMT.The woman, a passenger, was pronounced dead at the scene, while the driver, a man in his 30s, was taken to hospital. The man killed in Merseysidewas a passenger in a car heading towards Aintree at about 14:10 when debris reportedly hit the windscreen, police said. Paramedics treated him at the scene, but he was pronounced dead. The driver was not injured. In Alton, Hampshire,two men were in a pickup truck when it was crushed by a falling tree. The passenger was pronounced dead at the scene while the driver was taken to hospital with serious injuries. One man died and another was seriously injured when their pickup truck hit a tree on the A31 in Hampshire Coastal areas experienced some of the strongest winds Fallen trees blocked roads and railway lines across the country Police forces and local authorities across the country reported being inundated with phone calls related to the storm, with some having to ask the public only to dial 999 if there was a risk to life. London Fire Brigade declared a major incident in response to the volume of calls, and the Ambulance service in South Central England declared a critical incident due to demand on its emergency services. Among those injured were a woman with her baby, who was hit by a tree in Bedford - hurting her but leaving the baby unharmed. A driver in Wiltshire was in a serious condition and two passengers were taken to hospital after a car collided with a fallen tree, while others were injured in south London and Henley-on-Thames by falling trees and debris. Ms Price said her daughter was now really frightened of the wind, and the house had been condemned One minute Holly Price and her five-year-old daughter Olivia were having a normal day, the next they were forced to flee the house after the roof caved in. Holly, from Newport, south Wales, said: ""My daughter was upstairs and we heard an almighty bang and a lot of noise. ""I just dropped to the ground, then ran upstairs to grab my daughter because she was screaming."" The chimney breast had fallen through and left ""dust and debris everywhere"". ""The sound will never, ever leave me - it was just heart-breaking to hear my daughter screaming,"" said Holly, adding they were ""lucky to be alive"". The pair will be staying at a family member's house tonight, then see if they can get emergency shelter. UK power networks (Southeast and East):156,000 Scottish and Southern:120,000(mainly in the south) Western Power:112,000 Northern:6,000(mainly in Yorkshire) Electricity Northwest:658 Northern Ireland electricity networks:15 Millions of people were advised to stay at home unless they had to be out for work or essential travel. Landmark buildings suffered damage in the winds, withpanels ripped off the roof of the O2 Arena in Londonwhilethe top of the spire at St Thomas's Church in Wells, Somerset, toppled to the ground. Hundreds of thousands of peoplewatched live footage of planes struggling to land at Heathrowduring the storm, while ferries battled strong gusts as they came into port. Winds ripped off sections of the roof at the O2 Arena in London Strong winds overturned lorries on the M4 in south Wales Neighbours of St Thomas's Church in wells said it was lucky no one was injured when the top of the spire fell Dozens of flights were cancelled and hundreds delayed at airports across the UK, while P&O Ferries stopped services between Dover and Calais. With many railway lines blocked by trees and other debris, major train operators - including Chiltern Railways, Avanti West Coast and Great Western Railway - were forced to suspend services, while in Wales all trains were cancelled. Dangerous winds forced both the M4 Prince of Wales Bridge and M48 Severn Bridge into Wales to be closed to traffic, while the Humber Bridge linking Yorkshire and Lincolnshire closed during Friday afternoon. Eunice is the second storm in a week to hit the UK, after parts of Scotland, northern England and Northern Ireland were battered by Storm Dudley. It has also brought dangerous conditions to areas across north-west Europe. In Ireland, aman in his 60s was killedby a falling tree in County Wexford. Three people also died in the Netherlands after being hit by falling trees, and a Canadian man aged 79 was killed in Belgium. Have you been affected by Storm Eunice? Only if it is safe to do so, please share your experiences by emailinghaveyoursay@bbc.co.uk,external. Please include a contact number if you are willing to speak to a BBC journanlist. You can also get in touch in the following ways: WhatsApp:+44 7756 165803 Tweet:@BBC_HaveYourSay,external Upload pictures or video Please read ourterms & conditionsandprivacy policy If you are reading this page and can't see the form you will need to visit the mobile version of theBBC websiteto submit your question or comment or you can email us atHaveYourSay@bbc.co.uk,external. Please include your name, age and location with any submission. THOMAS SHELBY RETURNS:See what's in store for the final instalment of Peaky Blinders THE LAST STONE:When Great Britain's women's curling team captivated the nation Storm Eunice topples trees and rips roofs. Video, 00:01:41Storm Eunice topples trees and rips roofs Governor says lack of water for hydrants 'impaired' fight against wildfires 'I have nothing to go back to' - BBC reporter tells of LA fires heartbreak Trump avoids prison or fine in hush-money case sentencing LA fires: How three days of devastation unfolded What's the latest on the Los Angeles wildfires and what caused them? 'My mum died after four days on an A&E trolley' The '9/11 mastermind' wants to plead guilty. Why is the US trying to stop him? Pop star Chappell Roan wins BBC Sound Of 2025 Weekly quiz: Zendaya looked happy but who else sparkled at the Golden Globes? Inside the UK's first legal drug consumption room Danes struggle with response to Trump Greenland threat Off air with Laura K: Get Laura Kuenssberg's expert insight emailed directly to you Dragons’ Den returns with a new line-up of celebrity guests Can a fresh batch of entrepreneurs secure the deal of a lifetime? Are smart scales really as ‘smart’ as they claim to be? Greg Foot explores whether they can accurately measure weight, body fat, muscle and bone mass The award-winning psychological competition is back A nail-biting game of detection, backstabbing and trust. Who will make it through? How close are we to a cancer vaccine? How might it help in the treatment of the disease? © 2025 BBC. The BBC is not responsible for the content of external sites.Read about our approach to external linking."
