headline,article
Champions League agony for Liverpool as Real win,"Real Madrid are champions of Europe for a record 14th time Liverpool's bid to claim the Champions League trophy for the seventh time ended in bitter disappointment as Vinicius Jr's second-half winner gave Real Madrid victory in Paris. Jurgen Klopp's side ran into a one-man wall of defiance as Real goalkeeper Thibaut Courtois produced one of the great individual performances to thwart Liverpool time and again. Mohamed Salah, seeking revenge for his early departure through injury in the 2018 final against Real, was denied six times by Courtois who was simply unbeatable. The victory also sees Carlo Ancelotti make history by becoming the first coach to win a fourth Champions League title. Real were always a threat and the decisive moment came after 59 minutes when Vinicius stole in unmarked at the far post to score. This was also a final marred by chaotic scenes outside Stade de France with thousands of Liverpool fans, some targeted with pepper spray by French police, unable to get into the stadium, forcing the kick-off to be delayed by more than 30 minutes. 'A miserable night on every level imaginable' Liverpool want investigation into final scenes From embarrassment to glory - 'remarkable' Real Organisation of final 'a shambles' - Robertson This video can not be played Champions League: Liverpool will 'go again' says Jurgen Klopp Liverpool's magnificent season brought them the Carabao Cup and the FA Cup - both won on penalties against Chelsea - but ended in a double disappointment in the final week of a stellar campaign. The Champions League might have eased the agony of just missing out on the Premier League to Manchester City by one point, only for Liverpool to find themselves on the wrong end of a goalkeeping masterclass from Courtois. The Belgian was simply perfect as he was a constant thorn in Salah's side, turned Sadio Mane's shot on to the post brilliantly and commanded his penalty area with faultless handling. Salah held his head in disbelief on many occasions as Courtois manned the barricade for Real, leaving the Egyptian to nurse the pain of another Champions League final defeat by the Spanish giants. Liverpool will come again after final loss - Klopp I don't get enough respect says Real's Courtois Champions League final: Real Madrid beat Liverpool - recap Go straight to all the best Liverpool content Mohamed Salah was denied several times by Thibaut Courtois Liverpool were not quite at their best and eventually paid the price for not taking chances as Real pounced in trademark fashion to win this tournament for a record-extending 14th time. Klopp's side could not have given any more as they pushed to the final whistle but looked jaded towards the end - no surprise given the demands made of them this season. Liverpool will still take huge credit by maintaining a push for an historic quadruple until the final week of the season but the conclusion will sting. The occasion left even more of a sour taste given the events outside Stade de France. Liverpool are demanding a full investigation into how thousands of their fans could not get into the stadium, with dangerous numbers packed into small areas as kick-off approached. Real Madrid have been living by the skin of their teeth in the Champions League this season, but any side that beats Paris St- Germain, Chelsea, Manchester City and Liverpool to reach their goal answers every question. This is a side that knows how to get the job done, no matter how late they leave it, no matter how much the odds seem stacked against them. Real are bolstered by years of experience and quality that gives them concrete-clad self-belief that has seen them navigate their way out of so many tight situations. And what a moment for their legendary coach Ancelotti, who was brought back to the Bernabeu from Everton a year ago and has won La Liga and the Champions League on his return. Ancelotti can now lay claim to history with that fourth triumph, once again showing his mastery of managing egos and high-class players who respond to the vastly experienced Italian's promptings. He was the most relaxed man in Paris at his pre-match press conference, oozing confidence, and can now look back at two Champions League wins over Liverpool, here and for AC Milan in 2007, after losing in the so-called miracle of Istanbul in 2005. Ancelotti is one of the greats and has proved it again. Our coverage of Liverpool is bigger and better than ever before - here'severything you need to knowto make sure you never miss a moment Everything Liverpool - go straight to all the best content Comments can not be loaded To load Comments you need to enable JavaScript in your browser Australian Open: GB's Draper fighting in fifth set v Kokkinakis after Fearnley wins Transfers,  Premier League build-up and football latest New Match of the Day presenters announced A pregnant young woman is in crisis, but is it all a scam? Sarah Treleaven untangles a complex web of lies and deception in the new series of The Con Chris Packham unravels the world's most bizarre events Discover the secrets behind the bird-killing solar death ray and the monkey that's learnt first aid A psychological thriller set in the world of competitive gaming Limelight returns with a gripping new drama following the mysterious death of an esports athlete Bill Nighy stars in an Agatha Christie mystery The identity of Rachel Argyll's murderer is thrown into doubt eighteen months after the deed New Match of the Day presenters announced In pictures: The 22 best sport photos of the week 'Why have they not run?!' - Bizarre end as England lose second ODI. Video'Why have they not run?!' - Bizarre end as England lose second ODI 'A fabulous and weird goal' - Ivanovic heads in ball on the ground. Video'A fabulous and weird goal' - Ivanovic heads in ball on the ground FA Cup replays: The arguments for and against Jacobs' incredible run features in NFL best plays. VideoJacobs' incredible run features in NFL best plays Bayindir shines as 10-man Man Utd beat Arsenal in Cup thriller  VideoBayindir shines as 10-man Man Utd beat Arsenal in Cup thriller Broken nets, 'Maradona' skill and a new dad - Tamworth's tales on historic day 'A horrible moment!' Long-range shot goes through Burnley keeper's legs. Video'A horrible moment!' Long-range shot goes through Burnley keeper's legs 'He's held onto the ball and his beer' - watch one-handed crowd catch. Video'He's held onto the ball and his beer' - watch one-handed crowd catch World Sports Photography Awards 2025 winner revealed The qualifier using the Australian Open as 'fashion runway' Was Deschamps right to leave and will Zidane replace him? Is Potter the right fit for West Ham? Fantasy holes with lava fields - it's golf for the 21st Century Teenage kicks - what makes history-making Littler so good? Sporting highlights to look forward to in 2025 Â© 2025 BBC. The BBC is not responsible for the content of external sites.Read about our approach to external linking."
Berkshire,"Follow Berkshire Fireworks display killed rabbit and set fire to shed An impromptu New Year's fireworks display in a Reading park set fire to nearby buildings. Calls to stop lorries using town centre short cut Charity concerned by business rate hike plans Crime commissioner backs grooming abuse inquiry Wildlife doing well despite 'challenging' conditions Water pipe row rages as supplies return Council tax could rise more than 5% for third year Fears for people in flats built without permission Enhanced 5G network 'will empower science campus' NHS bosses want 'definitive answer' on hospital future Burst pipe collapses road and disrupts supplies Ice spike and ribbon ice appear on frosty weekend Arrests after Charles Darwin grave spray-painted Council considers whether to join 'Heart of Wessex' Today, High of10Â° Low of3Â° Thursday 16 January,ThuÂ16th High of9Â° Low of3Â° Friday 17 January,FriÂ17th High of7Â° Low of0Â° Saturday 18 January,SatÂ18th High of5Â° Low of0Â° Sunday 19 January,SunÂ19th High of6Â° Low of3Â° Altrincham 4-0 Maidenhead United Flemming takes Burnley past Reading in extra time Royals re-sign Wolves' Campbell for rest of season Maidenhead-York among games frozen off Hunt has 'fingers crossed' for Reading takeover Reading v Stockport County Sutton's FA Cup third-round predictions v Billy Bob Thornton Burnley fend off Reading after extra time. Video, 00:03:35Burnley fend off Reading after extra time 'A horrible moment!' Long-range shot goes through Burnley keeper's legs. Video, 00:00:23'A horrible moment!' Long-range shot goes through Burnley keeper's legs Leeds star linked with Saudi move - Saturday's EFL gossip The best content from your local radio station âPlease wear a face maskâ at the Royal Berks. Audio, 00:02:37âPlease wear a face maskâ at the Royal Berks 'A sparkle over the board': A Scrabble love story. BBC Radio Berkshire. Audio, 00:04:51'A sparkle over the board': A Scrabble love story BBC Radio Berkshire Award for twin who saved sister from crocodile. Audio, 00:04:34Award for twin who saved sister from crocodile Communication expert first to leave The Traitors. Audio, 00:05:53Communication expert first to leave The Traitors Warm clothes donations helping people in need The 80s pop star teaching children to African drum. Video, 00:01:12The 80s pop star teaching children to African drum How Scrabble Championships led to 20 years of marriage South Today. VideoSouth Today BBC Radio Berkshire. AudioBBC Radio Berkshire Politics South. VideoPolitics South Contact Us Facebook Instagram WhatsApp X (Twitter) Calls to stop lorries using town centre short cut Charity concerned by business rate hike plans Wildlife doing well despite 'challenging' conditions Crime commissioner backs grooming abuse inquiry Fireworks display killed rabbit and set fire to shed Water pipe row rages as supplies return Fears for people in flats built without permission Council tax could rise more than 5% for third year Man dies after Ferrari crashes into tree Rail worker accused of Nazi jibe wins Â£70k pay-out Warm clothes donations helping people in need Enhanced 5G network 'will empower science campus' Burst pipe collapses road and disrupts supplies NHS bosses want 'definitive answer' on hospital future Ice spike and ribbon ice appear on frosty weekend Arrests after Charles Darwin grave spray-painted Drivers warned ahead of M4 overnight closures Reading Prison hosts new digital art exhibition Parking charges to increase for town's polluting cars 'Very difficult' keeping secret of New Year Honour Police shelve inquiry into fatal attack on dog Big Picture: This week's images from the South Weekly round-up: Five stories you may have missed Town centre revamp approved despite parking concern Instagram TikTok Facebook X Newby scores hat-trick as Altrincham put four past Maidenhead United When is the best time to book your 2025 holidays to beat the demand? ""Doctors thought I had a UTI - it was cancer and these were hidden signs"" 'Reverse the cuts' says fire union, amid rise in sick days for mental health Planning round-up: Plans approved for new Slough Barclays with uncertain fate Windsor & Eton look to put pressure on league leaders Penn & Tylers Â© 2025 BBC. The BBC is not responsible for the content of external sites.Read about our approach to external linking."
"In 30 years, I've seen too many cases like Star Hobson","Star Hobson's family have many questions about her death ""Why didn't they listen to us?"" Nearly two years after Star Hobson was murdered by her mother's girlfriend, the toddler's aunt and step-great grandfather still have so many questions. Sitting on their sofa, I look up at the photos of Star - with her large blue eyes - on the walls and the mantelpiece. The grief at her loss is so near the surface and runs so deep. They are a close-knit family who have spent most of their lives living in the same few streets. They point to the house a short distance away in West Yorkshire where Star spent some of her last months. In their search for sense, they want to know if people will learn from the mistakes made in Star's case. Sadly this is not the first time I have sat with a family as they try to understand why a child they loved was not better protected. As a journalist working for the BBC, I have spent 30 years covering such tragedies. This week, a review examined how social workers, police, health staff and others handled both Star's case and that of six-year-old Arthur Labinjo-Hughes, who was murdered by his stepmother in Solihull. In both cases, the review concluded that concerns raised by their wider families had been""too often disregarded"". Star's family say they tried to tell professionals they felt cut out of the toddler's life by the woman who would eventually murder her. They believed Star's mother was being abused and manipulated, and that Star had become a shadow of herself. The report concluded their worries had been labelled as malicious and not investigated properly. As I read the review, the jigsaw of each child's life is set out neatly in one place. Hindsight makes the warnings look obvious, but that is rarely the case. Child protection is a difficult, complex job and most of the time professionals do keep children safe. Also, responsibility for what happened to Star and Arthur has to lie with the people who murdered them and the parents who didn't stop the abuse. Social workers and police saw Arthur Labinjo-Hughes before his death and decided there were no safeguarding concerns But as I turn the report's pages, what I find frustrating is that the failings in the child protection system outlined are the same failings I have seen in report after report. Over the decades, poor information-sharing between agencies, manipulative parents, professionals who didn't challenge enough, and too little weight given to the concerns of wider family have all been common themes. Each time, change is promised and we are told ""lessons will be learned"". I remember the first child death I reported on in the early 1990s. The family had been ""known to social services"" for some time, as the jargon goes. The owner let us into the rented flat where the baby girl spent her short life. I can see myself standing in the empty box room where her cot had been - the sun streaming in through the window on to the white woodchip wallpaper. Her dad named her after the model of car he loved. Later, in a fit of rage, he would slam her against the wall of that tiny bedroom. Victoria Climbie's murder in 2000 led to a shake-up of the child protection system The names stay with you; somehow that feels right. Victoria Climbie was the seven-year-old whose murder in 2000 led to a complete shake-up of the child protection system. I sat through the court case. The cruelty was horrifying. Each night, I went home to my baby son and held him that bit tighter, finding it impossible to comprehend how anyone could harm a child like that. It's a reminder of how much time has passed since then that he is now grown up. I later covered the public inquiry into Victoria's death. It found the authorities involved missed 12 opportunities to protect her. Then there was the Old Bailey trial of the killers of Peter Connelly - who was also known as Baby P. A case which also led to a national outcry and major reform. And Khyra Ishaq in Birmingham in 2008 and Daniel Pelka in Coventry in 2012. Sadly, I could go on. On average, at least one child is killed or murdered each week in the UK, the NSPCC says, often at the hands of a parent or carer. That figure has changed little for decades. Not all can be protected, but when these stories make headlines, it is usually because chances to keep a child safe were missed by the authorities, whether that was social workers, police, health staff or schools. There is an important backdrop to this. In England, children's social care has been at best struggling, at worst in crisis for a long time. As far back as the Victoria Climbie case, staff shortages and high caseloads were causing problems. During the decade of austerity, council budgets were squeezed, but the number of families and children needing help increased. Now, as the cost of living crisis intensifies, more families are likely to come under pressure. And there's strong evidence that poverty and deprivationincrease the chance of a child being taken into care or put on a child protection plan. When I speak to social workers they often talk about juggling high caseloads, the complex needs of the families they see, and feeling burnt out. They also talk about how unsupported they feel, not necessarily by those they work with, but by wider society. Early help for families urged in social care reset Family worries ignored, says Arthur and Star review The turnover of social workers is significant and the latest government statistics showthe number of vacancies is at a five-year high,external. Yet on the front line, where difficult decisions are being made about the risk a child faces, you need experienced people who feel confident to challenge and investigate. The review into Star and Arthur's cases proposes new specialist child protection teams, bringing together people with a range of expertise so they can investigate and oversee cases. Also, this week the MacAlister report into children's social care called for children's services toshift their focus from crisis intervention to helping families early. The government says it will put forward its plan for change soon. So, when Star's family ask whether her death will make a difference for other children, I can't give them an answer. It really should, but that will take investment in services and determination from politicians right through to the front line of child protection over time.  And that has been promised many times before. Follow Alison onTwitter,external. Surprise fall in inflation boosts interest rate cut hopes Why a small drop in inflation matters to you Keir Starmer and Kemi Badenoch clash over UK economy at PMQs Red Sea dive-boat survivors accuse authorities of cover up Chris Mason: Political heat map flashes red over Treasury They hired Banksy for Â£50 then painted over his mural 'We sing to them': LA stables turn Noah's Ark for fire rescue animals Fatbergs turned into perfume - inside Britain's bizarre new industrial revolution Gaza 'humanitarian zone' struck almost 100 times since May, BBC Verify finds LA fire victims fear new housing crisis Trapped in the dark for 35 hours - Red Sea dive-boat survivors tell of terrifying escapes 'Your husband's being tortured, and it's your fault' Lily and Miquita answer your questions about respect Join lifelong friends as they discuss the world around them Dragonsâ Den returns with a new line-up of celebrity guests Can a fresh batch of entrepreneurs secure the deal of a lifetime? The dark side of the wellness industry Mirandaâs search for inner peace through yoga leads her into a shocking world Learn more about Britain's gardens with Monty Don What can the humble backyard tell us about our culture, climate and history? Â© 2025 BBC. The BBC is not responsible for the content of external sites.Read about our approach to external linking."
Harris calls for assault weapons ban,"This video can not be played Kamala Harris: ""An assault weapon is a weapon of war, with no place in a civil society"" US Vice-President Kamala Harris has made an impassioned plea for a ban on assault weapons in the wake of two deadly mass shootings in the US. Ms Harris was attending the funeral of Ruth Whitfield, 86, killed in a supermarket in Buffalo on 14 May. That shooting came just 10 days before an attack on a Texas primary school left 19 children and two teachers dead. Ms Harris, listing these and other attacks, said it was time to say ""enough is enough"" to gun violence. ""Everybody's got to stand up and agree that this should not be happening in our country and that we should have the courage to do something about it,"" she told the congregants at the funeral. She added that the solution was clear - and included things like background checks and an assault weapons ban. ""Do you know what an assault weapon is?"" she asked, continuing: ""It was designed for a specific purpose: to kill a lot of human beings quickly. An assault weapon is a weapon of war, with no place, no place in a civil society."" The 18-year-old gunman in Tuesday's shooting in Uvalde had two AR-15-style semi-automatic rifles, at least one of which he is reported to have bought soon after his birthday. After he was shot dead, police found as many as 1,657 rounds of ammunition and 60 magazines in his possession. A memorial to those killed in Uvalde, Texas The Buffalo, New York, shooter, also 18, had previously come into contact with authorities, but no red flags came up when he legally bought his own AR-15-style weapon. ""Why should anyone be able to buy a weapon that can kill other human beings without at least knowing, 'Hey, has that person committed a violent crime before? Are they a threat against themselves or others? That's just reasonable,"" Ms Harris said on Saturday. However, attempts to bring in universal background checks and bans on assault weapons have hit roadblocks. The issue is divisive in the US, with almost all Democrats backing stronger controls, compared to just 24% of Republicans. UVALDE REELS:Consumed by grief, a Texas town turns to prayer BUFFALO:Black Americans describe grief and fear NRA:Why is it so powerful? FACT CHECK:US gun control claims The powerful National Rifle Association (NRA) gun lobby uses its substantial budget to influence members of Congress on gun policy. On Friday, former Republican PresidentDonald Trump called not for tighter gun controls, but for better protected schools. Speaking at the NRA's meeting, he said that decent Americans should be allowed firearms to defend themselves against ""evil"". The same day, it emergedpolice did not enter the classroom in Uvalde, Texas,because of the active shooter inside. Instead - as children called the emergency services begging for help - they waited 40 minutes, a decision police have now admitted was ""wrong"". US President Joe Biden is expected to make his own call for tighter gun controls during a visit to Uvalde on Sunday. On Saturday he urged Americans to ""make their voices heard"" against gun violence. By Will Grant, BBC News, Uvalde President Biden faces a challenge in striking the right balance in Uvalde. Primarily, he will be there to offer his condolences and sympathy to the victims' families. As someone who has lost children himself, he will be deeply empathetic to their loss. However, some mourning relatives do not want to see him, or any politician, amid fears their grief may be co-opted into the wider political debate on gun control. Before travelling to Uvalde, Mr Biden told students in Delaware that it was still possible to ""make America safer"" but as he seeks cross-party support for tighter gun regulations, he's in direct conflict with leading Republicans who blame the problem on issues of school security and mental health, rather than guns. As such, meaningful bipartisan co-operation looks very unlikely. Such questions, however, may well be paused for a few hours in Uvalde while he mourns the 21 victims of one of the worst school shootings in US history. Where does US gun control go from here? US gun control claims fact-checked The numbers behind the rise in US mass shootings Texas shooting response was wrong, says official Trump: US should fund safe schools before Ukraine Surprise fall in inflation boosts interest rate cut hopes Why a small drop in inflation matters to you Keir Starmer and Kemi Badenoch clash over UK economy at PMQs Red Sea dive-boat survivors accuse authorities of cover up Chris Mason: Political heat map flashes red over Treasury They hired Banksy for Â£50 then painted over his mural 'We sing to them': LA stables turn Noah's Ark for fire rescue animals Fatbergs turned into perfume - inside Britain's bizarre new industrial revolution Gaza 'humanitarian zone' struck almost 100 times since May, BBC Verify finds LA fire victims fear new housing crisis Trapped in the dark for 35 hours - Red Sea dive-boat survivors tell of terrifying escapes 'Your husband's being tortured, and it's your fault' Lily and Miquita answer your questions about respect Join lifelong friends as they discuss the world around them Dragonsâ Den returns with a new line-up of celebrity guests Can a fresh batch of entrepreneurs secure the deal of a lifetime? The dark side of the wellness industry Mirandaâs search for inner peace through yoga leads her into a shocking world Learn more about Britain's gardens with Monty Don What can the humble backyard tell us about our culture, climate and history? Â© 2025 BBC. The BBC is not responsible for the content of external sites.Read about our approach to external linking."
