headline,article
What is the Norway model?,"The Prime Minister Theresa May is in Norway for a day of meetings with her Scandinavian counterparts at the Northern Future Forum in Oslo. Brexit is bound to come up in conversation, so it feels like a good day to remind ourselves what the Norway model is. Since the referendum, Norway has been discussed as one possible Brexit solution because a) it is not a member of the European Union, but b) it is in the European Economic Area (EEA), which means that it's also part of the single market. So it's about as close to the EU as you can get without being a member state. And, if the UK followed this example, that would mean its trade relations with its nearest neighbours could remain pretty much as they are now. Alphabet soup alert. You have to join EFTA - the European Free Trade Association, which groups four countries together: Norway, Iceland, Liechtenstein and Switzerland. Just to complicate things further, Switzerland has chosen not to join the EEA, and relies on a series of complex agreements with the EU instead. It means Norway has full access to the single market, and very limited barriers to trade with the EU. In return it makes substantial contributions to the EU budget, and has to follow most EU rules and laws. These include the so-called four freedoms - the freedom of movement of goods, services, capital and people. That means people from across the EU are free to live and work in Norway, and Norwegians can live and work across the EU. But Norway has no formal say in making EU rules, because it has no representation in any of the main European institutions. Norway is not part of the EU's Common Agricultural Policy (CAP) or the Common Fisheries Policy (CFP). So it can set its own policies in those areas. It is also exempt from EU rules on justice and home affairs. Yes. That sounds familiar doesn't it? Of course it helps when you have one of the largest sovereign wealth funds in the world, thanks to huge investments generated by oil and gas revenues. Fishing and agriculture are also big issues in rural Norway (fishing is one of the biggest industries in the country) so being outside the CFP and the CAP are important indicators of national sovereignty. This video can not be played Reality Check: Fishing after Brexit - sink or swim? No, it's not. That means it does need to take some additional administrative steps in order to trade with the EU. But it also means it can sign its own trade deals with other countries around the world. However, being outside the EU customs union means a relationship like Norway's would not solve the thorny Brexit problem of avoiding a hard border in Ireland. To keep theIrish border as open as it is now, you would need to add a new customs union (or equivalent arrangement) with the EU - a ""Norway plus"" solution, if you like. She has. And she has pledged to leave both the single market and the customs union. Some MPs, though, have recently argued in favour of a short-term 'Norway for Now' option. Instead of a transition period after Brexit, it would see the UK joining the EEA (via EFTA) for three years, and agreeing a temporary customs union with the EU. That would, the theory goes, give the UK time to negotiate a free trade agreement with the EU for the future. Good point. EEA membership would certainly be on offer as a long-term solution after Brexit. But it's unlikely that Norway and friends would want to be used as a waiting room on the UK's route out of the EU. ""I don't think it's easy to think that you can enter into an organisation you are preparing to leave at the same time,"" Norwegian Prime Minister Erna Solberg told the Northern Future Forum. ""It is also a little bit difficult for the rest of us."" Logistics and the law would pose a problem as well. There is neither time nor legal authority before 29 March 2019 for the UK to apply to join EFTA and then rejoin the EEA. As things stand, EFTA states are also not allowed to be in a customs union with the EU. In the government's mind it is. Theresa May said in Oslo today that Norway's existing relationship with the EU ""has elements that wouldn't deliver on the vote of the British people."" But these are uncertain times. If a Brexit deal were to be agreed with the EU, and then voted down in the House of Commons, all bets would be off. And all options (including some version of Norway) could be up for debate. What do you want BBC Reality Check to investigate? Get in touch Read more from Reality Check Follow us on Twitter,external Wildfire sweeps through Hollywood Hills and threatens landmarks as chaos grips LA Paris Hilton among stars 'heartbroken' as she watches home 'burn to ground' 'Mum waited 31 hours' : Your stories of A&E Sound Of 2025: Ezra Collective are 'keeping music real' The Papers: 'Apocalypse' LA and 'Reeves faces extra tax rises' How Australia's beach cabana drama sparked a turf war H-1B: Visa row under Trump fuels anxiety for Indian dreamers 'I thought I was going to die': Jailed Venezuelan activist details brutality of prison life The man who could become Canada's future PM 'Trump 2.0' looms large over the global economy A politician was shot dead in Bangkok. Did another country do it? Chris Mason: Is Starmer leaving the door open to an abuse inquiry? Delivering brand-new miracles in 1970s East End Watch the latest series of Call the Midwife on iPlayer now Mark-Anthony Turnage shares the soundtrack of his life Once called 'Britainâs hippest composer', he's tackled topics from drug abuse to football in his work Paddyâs loaf-changing experience inside the bread factory Paddy McGuinness visits the bread factory he used to work in, and sees how they make 1.4 million loaves a week What's behind the global surrogacy boom? More countries are banning surrogacy â but demand is growing Â© 2025 BBC. The BBC is not responsible for the content of external sites.Read about our approach to external linking."
Students 'humiliated by police',"High school students in Mantes-la-Jolie are arrested following protests against education reform Footage of school students being forced to kneel with their hands behind their heads by French riot police has sparked outrage on social media. A demonstration by students outside a school in Mantes-la-Jolie, west of Paris, ended in clashes with police and more than 140 arrests. Students are angry at plans to reform the exam system, which they say will limit opportunity and breed inequality. It comes as France prepares for further violence from ""yellow vest"" protesters. Police said that those arrested at the Saint-Exupery school were suspected of taking part in an ""armed gathering"", adding that officers had wanted to break up a situation that was getting ""out of control"", Le Monde newspaper reported. However, Paris Communist councillor ClÃ©mentine Autain said the images of students forced to kneel in dirt while facing brick walls were ""frightening"", ""humiliating"" and ""unacceptable"". Allow Twitter content? This article contains content provided by Twitter. We ask for your permission before anything is loaded, as they may be using cookies and other technologies. You may want to readTwitterâs cookie policy,externalandprivacy policy,externalbefore accepting. To view this content chooseâaccept and continueâ. FrÃ©dÃ©rique Rolet, of France's education union the SNES-FSU, said she found the footage ""unbearable"", according to French radio station Europe 1. The head of Oxfam France, CÃ©cile Duflot, tweeted that she felt the scenes from the Mantes-la-Jolie school were ""simply intolerable"". Ms Duflot also shareda report produced by former French high school students who participated in demonstrations,externaldating back to the 1960s. In it, they state that the actions taken by authorities in response to the recent protests have been ""disproportionate"". ""We blocked our high schools, occupied the streets,"" the report reads, adding: ""None of us have ever been taken into custody... we were not gassed at close range in front of our schools."" Tourist sites to close on Saturday amid Paris riot fears 'We are not puppets' - voices of 'gilets jaunes' protesters Ball in Macron's court after violent protests Students across the country have been angered by President Emmanuel Macron's plans to change the end-of-school exam, which is known as the baccalaureate and is required for entrance to university, as well as the university admissions platform Parcoursup. Student Louis Benzerrouk said on Thursday that he was demonstrating because young people ""are not listened to"". ""We are despised by [Macron and his government] ... we really have the impression that they are going in the opposite direction,"" he said. Another student, Milena Arvois, said the planned reform will ""kill the vocational schools"", adding that she was also against an increase in fees for foreign students ""because that will be a disaster"". Dozens of schools were blockaded in cities across France this week, including in Marseille, Nantes and Paris. The ""gilets jaunes"" (""yellow vest"") protesters, so-called because they take to the streets wearing the high-visibility yellow clothing required to be carried in every vehicle by French law, initially complained at a sharp increase in diesel taxes but the demonstrations have now widened to include other sources of discontent. Mr Macron said his motivation for the increase was environmental, but protesters accused him of being out of touch. The government later scrapped the plan but the yellow vest protesters have since issued more than 40 demands to government, including a minimum pension and widespread changes to the tax system. Paris sites to close amid riot fears Why the 'yellow vests' won't stop protests Who are the 'gilets jaunes'? Ball in Macron's court after violent protests Wildfire sweeps through Hollywood Hills and threatens landmarks as chaos grips LA Paris Hilton among stars 'heartbroken' as she watches home 'burn to ground' 'Mum waited 31 hours' : Your stories of A&E Sound Of 2025: Ezra Collective are 'keeping music real' The Papers: 'Apocalypse' LA and 'Reeves faces extra tax rises' How Australia's beach cabana drama sparked a turf war H-1B: Visa row under Trump fuels anxiety for Indian dreamers 'I thought I was going to die': Jailed Venezuelan activist details brutality of prison life The man who could become Canada's future PM 'Trump 2.0' looms large over the global economy A politician was shot dead in Bangkok. Did another country do it? Chris Mason: Is Starmer leaving the door open to an abuse inquiry? Delivering brand-new miracles in 1970s East End Watch the latest series of Call the Midwife on iPlayer now Mark-Anthony Turnage shares the soundtrack of his life Once called 'Britainâs hippest composer', he's tackled topics from drug abuse to football in his work Paddyâs loaf-changing experience inside the bread factory Paddy McGuinness visits the bread factory he used to work in, and sees how they make 1.4 million loaves a week What's behind the global surrogacy boom? More countries are banning surrogacy â but demand is growing Â© 2025 BBC. The BBC is not responsible for the content of external sites.Read about our approach to external linking."
'Six months of jams' under no-deal Brexit,"Queues of lorries left residents near the Port of Dover unable to get out to buy basic supplies in 2015 Dover and other Channel ports face disruption for up to six months if the UK leaves the EU without a deal, ministers have said. The ""worst case scenario"" warning,externalcomes after analysis of likely traffic flows, if customs checks are delayed. Lorries carrying medicine could get priority at ports and planes used to fly in drugs, ministers said. But Tory Brexiteer Andrew Bridgen said it was ""Project Fear on steroids,"" ahead of Tuesday's big Brexit vote. He told the BBC: ""It's the last throw of the dice from the prime minister who is desperate to get MPs to vote for her withdrawal agreement."" The prime minister's claim that the alternative to the withdrawal agreement she has negotiated with the EU is a no-deal Brexit, has so far failed to convince many of her own MPs. Ministers 'can still win over Brexit rebels' Piennar: Plotting and scheming afoot as PM's options narrow 'Bodies uncollected' under no-deal Brexit Six post-Brexit vote scenarios Health Secretary Matt Hancock was among ministers trying to promote the deal on Friday, ahead of Tuesday's Commons vote, which the PM is widely expected to lose. He told the BBC: ""I don't know how likely 'no deal' is. It is what happens automatically unless Parliament passes something else. ""I very strongly feel that the best thing for the country, not just for the health service but for the country as a whole, is for Theresa May's deal to pass."" Lib Dems in Commons bid for new Brexit vote Brexit campaign prepares for referendum Updated advice to government departments from officials warns there could be six months of reduced access and delays at Dover and Folkestone, if the UK leaves the EU on 29 March 2019 without a deal. By BBC Health Editor Hugh Pym Drug companies were told in August by the government to create stockpiles in the UK with six weeks worth of supplies. That has largely been achieved although there has not been so much progress with medical devices. But pharma bosses believe the government should do more to ensure continuity of supply and ministers should give more detail of plans to fast-track lorries through ports. Some may be suspicious about the timing of this with political debate over Brexit raging - government sources say the warning is based on analysis of trading patterns by officials which could not be withheld from Whitehall departments. Mr Hancock has written to health leaders, telling them to check their plans for ensuring the continued supply of medicines. Current advice is that there should be a six-week stockpile of medicines in the UK to cover the possibility of disruption after a no-deal Brexit. About 90% of medicines imported by the UK and the Republic of Ireland come in through Dover. This video can not be played Brexit: Can Theresa May win over MPs? The health secretary said the ""worst-case planning assumption"" meant that ""whilst the six-week stockpiling activities remain a critical part of our contingency plans, this now needs to be supplemented with additional actions"". He said the NHS should prepare to use alternative routes in the event of disruption on cross-channel routes, including the use of planes to fly in supplies. He wrote that if France or other EU countries imposed additional border checks in a no-deal scenario, the impact was ""likely to be felt mostly on the short straits crossings into Dover and Folkestone"" affecting both exports and imports, with ""significantly reduced access"" for up to six months. ""This is very much a worst-case scenario. In a 'no deal' exit from the EU we would, of course, be pressing member states hard to introduce pragmatic arrangements to ensure the continued full flow of goods which would be to their benefit as well as ours."" This video can not be played Dover council has three concerns over the impact of Brexit Mike Thompson, chief executive of the Association of the British Pharmaceutical Industry (ABPI), said the government warning was ""stark"" adding that ""stockpiling more medicines is not the solution to this problem"". He welcomed the intention to prioritise the flow of medicines and vaccines, but added, with just four months to go, ""we need the government to take immediate action to open up alternative supply routes between the UK and Europe and tell companies so that they can make plans"". Kent County Council has warned that dead bodies may remain uncollected and children might miss exams due to gridlocked roads in the event of a no-deal Brexit. In an update,externalon its contingency planning, the local authority said refuse could blight the streets and food deliveries could be disrupted as the county copes with 10,000 lorries parked or stacked on its roads. Council leader Paul Carter said preparations had been made for potential difficulties but added: ""We now need far more input and information from national government in how they are going to work with us. ""There must be a national freight transport plan which, when necessary, can hold lorries back from coming into Kent in the first place should the need arise."" The withdrawal deal negotiated between the UK and EU has been endorsed by EU leaders but must also be backed by Parliament if it is to come into force. With many of her own MPs opposing the deal, particularly the controversial issue of the ""backstop"", aimed at preventing the return of a hard border between Northern Ireland and the Republic of Ireland, Mrs May is expected to lose Tuesday's vote on the deal. One senior minister has told the BBC ""the only political common sense is to delay"" it - but Downing Street has said it will go ahead as planned. Comments can not be loaded To load Comments you need to enable JavaScript in your browser Wildfire sweeps through Hollywood Hills and threatens landmarks as chaos grips LA Paris Hilton among stars 'heartbroken' as she watches home 'burn to ground' 'Mum waited 31 hours' : Your stories of A&E Sound Of 2025: Ezra Collective are 'keeping music real' The Papers: 'Apocalypse' LA and 'Reeves faces extra tax rises' How Australia's beach cabana drama sparked a turf war H-1B: Visa row under Trump fuels anxiety for Indian dreamers 'I thought I was going to die': Jailed Venezuelan activist details brutality of prison life The man who could become Canada's future PM 'Trump 2.0' looms large over the global economy A politician was shot dead in Bangkok. Did another country do it? Chris Mason: Is Starmer leaving the door open to an abuse inquiry? Delivering brand-new miracles in 1970s East End Watch the latest series of Call the Midwife on iPlayer now Mark-Anthony Turnage shares the soundtrack of his life Once called 'Britainâs hippest composer', he's tackled topics from drug abuse to football in his work Paddyâs loaf-changing experience inside the bread factory Paddy McGuinness visits the bread factory he used to work in, and sees how they make 1.4 million loaves a week What's behind the global surrogacy boom? More countries are banning surrogacy â but demand is growing Â© 2025 BBC. The BBC is not responsible for the content of external sites.Read about our approach to external linking."
Reality Check: What is the Norway model?,"The Prime Minister Theresa May is in Norway for a day of meetings with her Scandinavian counterparts at the Northern Future Forum in Oslo. Brexit is bound to come up in conversation, so it feels like a good day to remind ourselves what the Norway model is. Since the referendum, Norway has been discussed as one possible Brexit solution because a) it is not a member of the European Union, but b) it is in the European Economic Area (EEA), which means that it's also part of the single market. So it's about as close to the EU as you can get without being a member state. And, if the UK followed this example, that would mean its trade relations with its nearest neighbours could remain pretty much as they are now. Alphabet soup alert. You have to join EFTA - the European Free Trade Association, which groups four countries together: Norway, Iceland, Liechtenstein and Switzerland. Just to complicate things further, Switzerland has chosen not to join the EEA, and relies on a series of complex agreements with the EU instead. It means Norway has full access to the single market, and very limited barriers to trade with the EU. In return it makes substantial contributions to the EU budget, and has to follow most EU rules and laws. These include the so-called four freedoms - the freedom of movement of goods, services, capital and people. That means people from across the EU are free to live and work in Norway, and Norwegians can live and work across the EU. But Norway has no formal say in making EU rules, because it has no representation in any of the main European institutions. Norway is not part of the EU's Common Agricultural Policy (CAP) or the Common Fisheries Policy (CFP). So it can set its own policies in those areas. It is also exempt from EU rules on justice and home affairs. Yes. That sounds familiar doesn't it? Of course it helps when you have one of the largest sovereign wealth funds in the world, thanks to huge investments generated by oil and gas revenues. Fishing and agriculture are also big issues in rural Norway (fishing is one of the biggest industries in the country) so being outside the CFP and the CAP are important indicators of national sovereignty. This video can not be played Reality Check: Fishing after Brexit - sink or swim? No, it's not. That means it does need to take some additional administrative steps in order to trade with the EU. But it also means it can sign its own trade deals with other countries around the world. However, being outside the EU customs union means a relationship like Norway's would not solve the thorny Brexit problem of avoiding a hard border in Ireland. To keep theIrish border as open as it is now, you would need to add a new customs union (or equivalent arrangement) with the EU - a ""Norway plus"" solution, if you like. She has. And she has pledged to leave both the single market and the customs union. Some MPs, though, have recently argued in favour of a short-term 'Norway for Now' option. Instead of a transition period after Brexit, it would see the UK joining the EEA (via EFTA) for three years, and agreeing a temporary customs union with the EU. That would, the theory goes, give the UK time to negotiate a free trade agreement with the EU for the future. Good point. EEA membership would certainly be on offer as a long-term solution after Brexit. But it's unlikely that Norway and friends would want to be used as a waiting room on the UK's route out of the EU. ""I don't think it's easy to think that you can enter into an organisation you are preparing to leave at the same time,"" Norwegian Prime Minister Erna Solberg told the Northern Future Forum. ""It is also a little bit difficult for the rest of us."" Logistics and the law would pose a problem as well. There is neither time nor legal authority before 29 March 2019 for the UK to apply to join EFTA and then rejoin the EEA. As things stand, EFTA states are also not allowed to be in a customs union with the EU. In the government's mind it is. Theresa May said in Oslo today that Norway's existing relationship with the EU ""has elements that wouldn't deliver on the vote of the British people."" But these are uncertain times. If a Brexit deal were to be agreed with the EU, and then voted down in the House of Commons, all bets would be off. And all options (including some version of Norway) could be up for debate. What do you want BBC Reality Check to investigate? Get in touch Read more from Reality Check Follow us on Twitter,external Wildfire sweeps through Hollywood Hills and threatens landmarks as chaos grips LA Paris Hilton among stars 'heartbroken' as she watches home 'burn to ground' 'Mum waited 31 hours' : Your stories of A&E Sound Of 2025: Ezra Collective are 'keeping music real' The Papers: 'Apocalypse' LA and 'Reeves faces extra tax rises' How Australia's beach cabana drama sparked a turf war H-1B: Visa row under Trump fuels anxiety for Indian dreamers 'I thought I was going to die': Jailed Venezuelan activist details brutality of prison life The man who could become Canada's future PM 'Trump 2.0' looms large over the global economy A politician was shot dead in Bangkok. Did another country do it? Chris Mason: Is Starmer leaving the door open to an abuse inquiry? Delivering brand-new miracles in 1970s East End Watch the latest series of Call the Midwife on iPlayer now Mark-Anthony Turnage shares the soundtrack of his life Once called 'Britainâs hippest composer', he's tackled topics from drug abuse to football in his work Paddyâs loaf-changing experience inside the bread factory Paddy McGuinness visits the bread factory he used to work in, and sees how they make 1.4 million loaves a week What's behind the global surrogacy boom? More countries are banning surrogacy â but demand is growing Â© 2025 BBC. The BBC is not responsible for the content of external sites.Read about our approach to external linking."
