headline,article
Blanchett defends straight actors' gay roles,"Cate Blanchett has defended straight actors playing gay roles in film and TV. Hollywood has been criticised for giving LGBT roles to straight actors and earlier this year Scarlett Johanssonpulled out of playing a trans characterfollowing a backlash. Blanchett played a lesbian in 2015's Carol. She said: ""I will fight to the death for the right to suspend disbelief and play roles beyond my experience."" The Australian actress disagrees with the idea that a performer only really knows a character if they have shared experiences. Rooney Mara and Cate Blanchett played lesbians in Carol, based on a novel about forbidden love between two women ""Reality television and all that that entails had an extraordinary impact, a profound impact on the way we view the creation of character,"" she said during a Q&A at the Rome Film Festival. ""I think it provides a lot of opportunity, but the downside of it is that we now, particularly in America, we expect and only expect people to make a profound connection to a character when it's close to their experience."" When Scarlett Johansson was announced as the lead actor in a film about 1970s Pittsburgh crime boss Dante ""Tex"" Gill, who was born Jean Gill, some said it showed the limited opportunities given to transgender actors. Pointing to other actors who've played trans roles, Johansson said of her critics: ""Tell them that they can be directed to Jeffrey Tambor, Jared Leto, and Felicity Huffman's reps for comment."" Allow Twitter content? This article contains content provided by Twitter. We ask for your permission before anything is loaded, as they may be using cookies and other technologies. You may want to readTwitterâs cookie policy,externalandprivacy policy,externalbefore accepting. To view this content chooseâaccept and continueâ. Are trans actors progressing in showbiz? TV to get its first transgender superhero Trace Lysette, who stars in the Amazon series Transparent, said it was representative of a wider problem in Hollywood. ""I wouldn't be as upset if I was getting in the same rooms as Jennifer Lawrence and Scarlett for cis roles, but we know that's not the case,"" she tweeted. ""A mess."" Cisgender describes someone who is not transgender. It applies to an individual whose gender matches their ""assigned"" sex at birth. In her second statement announcing she'd no longer be playing the role, Johansson said she'd ""learned a lot"" from the trans community and was glad there had been a ""larger conversation about diversity and representation in film"". ""While I would have loved the opportunity to bring Dante's story and transition to life, I understand why many feel he should be portrayed by a transgender person."" Sir Ian McKellen has criticised Hollywood's record on gay actors Sir Ian McKellen is an actor who's been critical of Hollywood's attitude to gay actors in the past. He's pointed out that no openly gay man has ever won the Academy Award for best actor, but straight actors have taken home the prize for playing LGBT roles. Tom Hanks won it for Philadelphia and Sean Penn scooped it for Milk. In total, 52 straight people have been Oscar-nominated for playing gay characters, including Cate Blanchett for her portrayal in Carol. Follow Newsbeat onInstagram,external,Facebook,externalandTwitter,external. Listen to Newsbeatliveat 12:45 and 17:45 every weekday on BBC Radio 1 and 1Xtra - if you miss us you can listen backhere. Scarlett Johansson criticised for trans role Scarlett Johansson drops out of trans role Are trans actors progressing in showbiz? 'Why we want transgender rules changed' TV to get its first transgender superhero New fire erupts in Hollywood Hills and threatens landmarks as chaos grips LA Paris Hilton among stars 'heartbroken' as she watches home 'burn to ground' Commuters warned of icy roads as cold snap continues to freeze UK Sound Of 2025: Ezra Collective are 'keeping music real' The Papers: 'Apocalypse' LA and 'Reeves faces extra tax rises' How Australia's beach cabana drama sparked a turf war H-1B: Visa row under Trump fuels anxiety for Indian dreamers 'I thought I was going to die': Jailed Venezuelan activist details brutality of prison life The man who could become Canada's future PM 'Trump 2.0' looms large over the global economy A politician was shot dead in Bangkok. Did another country do it? Chris Mason: Is Starmer leaving the door open to an abuse inquiry? Delivering brand-new miracles in 1970s East End Watch the latest series of Call the Midwife on iPlayer now Mark-Anthony Turnage shares the soundtrack of his life Once called 'Britainâs hippest composer', he's tackled topics from drug abuse to football in his work Paddyâs loaf-changing experience inside the bread factory Paddy McGuinness visits the bread factory he used to work in, and sees how they make 1.4 million loaves a week What's behind the global surrogacy boom? More countries are banning surrogacy â but demand is growing Â© 2025 BBC. The BBC is not responsible for the content of external sites.Read about our approach to external linking."
Charlie Sloth leaving Radio 1 and 1Xtra immediately,"Charlie, on the right, with Drake Charlie Sloth has left BBC Radio 1 with immediate effect. It wasannounced earlier this monththat The Rap Show host would be leaving the job after nearly 10 years on Radio 1 and 1Xtra. But Radio 1 has agreed with Charlie that he will not do the 10 remaining shows that were originally planned. Charlie had been in the spotlight for storming the stage and delivering a sweary, Kanye West-esque rant at an awards show last Thursday. He has since apologised on Twitter. Allow Twitter content? This article contains content provided by Twitter. We ask for your permission before anything is loaded, as they may be using cookies and other technologies. You may want to readTwitterâs cookie policy,externalandprivacy policy,externalbefore accepting. To view this content chooseâaccept and continueâ. The DJ's 1Xtra Rap Show was nominated in the best specialist music show category at the Audio & Radio Industry Awards (ARIAS), alongside Soundtracking with Edith Bowman. When former Radio 1 DJ Edith was announced as the winner, Charlie got on stage, took the mic and shared his thoughts. They weren't positive. Radio 1 and 1Xtra Controller Ben Cooper accepted the station of the year award on behalf of Radio 1 shortly after. ""I'd just like to say Charlie Sloth has left the building and is leaving Radio 1 and 1Xtra. Apologies,"" he said. Charlie apologised for the rant on his Twitter account on Saturday. Allow Twitter content? This article contains content provided by Twitter. We ask for your permission before anything is loaded, as they may be using cookies and other technologies. You may want to readTwitterâs cookie policy,externalandprivacy policy,externalbefore accepting. To view this content chooseâaccept and continueâ. The DJ is yet to announce where he'll be heading after the BBC. When he announced his departure, Charlie said he'd decided to ""seek a new challenge"". Allow Instagram content? This article contains content provided by Instagram.  We ask for your permission before anything is loaded, as they may be using cookies and other technologies.  You may want to readMetaâs Instagram cookie policy,externalandprivacy policy,externalbefore accepting. To view this content chooseâaccept and continueâ. One of the ""moments that will live forever"" he mentioned is Drake's Fire In The Booth. Charlietold Newsbeat at the timethat getting the world's biggest rapper on to his freestyle segment on Radio 1 and 1Xtra was ""four or five years"" in the making. It involved sneaking Drake into New Broadcasting House at 2.30am, something so secret only Charlie's producer knew about it. Warning: Drake's full Fire In The Booth contains some strong language that you may find offensive. Allow Twitter content? This article contains content provided by Twitter. We ask for your permission before anything is loaded, as they may be using cookies and other technologies. You may want to readTwitterâs cookie policy,externalandprivacy policy,externalbefore accepting. To view this content chooseâaccept and continueâ. Earlier this month, Radio 1 Controller Ben Cooper thanked Charlie for being an ""important part of Radio 1 and 1Xtra's history"". ""For nearly 10 years his passion and energy for his music and his shows has been second to none."" Dev will be filling in hosting The 8th until Christmas. Radio 1 says new presenters will be announced for both of Charlie's shows in the coming weeks. Follow Newsbeat onInstagram,external,Facebook,externalandTwitter,external. Listen to Newsbeatliveat 12:45 and 17:45 every weekday on BBC Radio 1 and 1Xtra - if you miss us you can listen backhere. New fire erupts in Hollywood Hills and threatens landmarks as chaos grips LA Paris Hilton among stars 'heartbroken' as she watches home 'burn to ground' Commuters warned of icy roads as cold snap continues to freeze UK Sound Of 2025: Ezra Collective are 'keeping music real' The Papers: 'Apocalypse' LA and 'Reeves faces extra tax rises' How Australia's beach cabana drama sparked a turf war H-1B: Visa row under Trump fuels anxiety for Indian dreamers 'I thought I was going to die': Jailed Venezuelan activist details brutality of prison life The man who could become Canada's future PM 'Trump 2.0' looms large over the global economy A politician was shot dead in Bangkok. Did another country do it? Chris Mason: Is Starmer leaving the door open to an abuse inquiry? Delivering brand-new miracles in 1970s East End Watch the latest series of Call the Midwife on iPlayer now Mark-Anthony Turnage shares the soundtrack of his life Once called 'Britainâs hippest composer', he's tackled topics from drug abuse to football in his work Paddyâs loaf-changing experience inside the bread factory Paddy McGuinness visits the bread factory he used to work in, and sees how they make 1.4 million loaves a week What's behind the global surrogacy boom? More countries are banning surrogacy â but demand is growing Â© 2025 BBC. The BBC is not responsible for the content of external sites.Read about our approach to external linking."
US lottery jackpot hits record $1.6bn,"A record-breaking US lottery jackpot of $1.6bn (Â£1.2bn) is up for grabs after players failed to pick the winning ticket in a $1bn Mega Millions draw. The competition, which saw 15 ""second-tier"" tickets scoop about $1m each, had people lining up at service stations and stores nationwide on Friday. The odds of choosing the matching six numbers to win the Mega Millions prize are said to be one in 302,575,350. Another draw for the huge US jackpot will be held on Tuesday. Three tickets scoop record lottery jackpot Video: Mum quits job after massive win The Mega Millions draws, tickets for which are sold in 44 US states, the District of Columbia and the US Virgin Islands, have failed to produce a top prize winner since July. The competition was created in 2002 and has seen a number of changes to the rules over the years that have reduced the odds of winning, leading to larger jackpots. $1.58bn:A Powerball win in 2016. The prize was split three ways by ticket holders from California, Florida and Tennessee $758.7m:Won in 2017 by mother-of-two Mavis Wanczyk from Massachusetts. She said she had picked the numbers based on relatives' birthdays $656m:A Mega Millions top prize win in 2012, shared between three winners who purchased tickets in Maryland, Kansas and Illinois $648m:Another Mega Millions win, this time in 2013 by two ticket holders; a woman in Georgia and a man in California $590.5m:A Powerball jackpot won by an 84-year-old Florida woman Winner of $758m lottery jackpot: 'I quit' Three tickets win $1.6bn US lottery New fire erupts in Hollywood Hills and threatens landmarks as chaos grips LA Paris Hilton among stars 'heartbroken' as she watches home 'burn to ground' Commuters warned of icy roads as cold snap continues to freeze UK Sound Of 2025: Ezra Collective are 'keeping music real' The Papers: 'Apocalypse' LA and 'Reeves faces extra tax rises' How Australia's beach cabana drama sparked a turf war H-1B: Visa row under Trump fuels anxiety for Indian dreamers 'I thought I was going to die': Jailed Venezuelan activist details brutality of prison life The man who could become Canada's future PM 'Trump 2.0' looms large over the global economy A politician was shot dead in Bangkok. Did another country do it? Chris Mason: Is Starmer leaving the door open to an abuse inquiry? Delivering brand-new miracles in 1970s East End Watch the latest series of Call the Midwife on iPlayer now Mark-Anthony Turnage shares the soundtrack of his life Once called 'Britainâs hippest composer', he's tackled topics from drug abuse to football in his work Paddyâs loaf-changing experience inside the bread factory Paddy McGuinness visits the bread factory he used to work in, and sees how they make 1.4 million loaves a week What's behind the global surrogacy boom? More countries are banning surrogacy â but demand is growing Â© 2025 BBC. The BBC is not responsible for the content of external sites.Read about our approach to external linking."
Bid to stop NI officials acting on backstop,"Steve Baker urged the prime minister to change her Brexit plan earlier this month A Tory ex-minister is trying to put a block on the EU's controversial proposals for a ""backstop"" to guarantee no hard Irish border after Brexit. Steve Baker has put down amendments to the Northern Ireland bill, which is to be discussed in Parliament next week. He wants to make it a legal requirement to get the Stormont Assembly's approval for any plan to treat Northern Ireland differently from the rest of the UK. But the devolved government has not sat since power-sharing collapsed in 2017. The bill aims to give its civil servants greater flexibility in making decisions, in the absence of government. However, it has drawn the attention of those arguing over plans for the UK's future trading relationship with the EU. Politicians criticise NI secretary's bill Brexit: All you need to know Q&A: The Irish border Brexit backstop Both the EU and UK are signed up to the need for a ""backstop"" - effectively an insurance policy to avoid the introduction of checks on the border between Northern Ireland and the Irish Republic - which is an EU member - after Brexit. During the ""transition period"" after the UK leaves the EU in March 2019 until 31 December 2020, the UK's relationship with the EU will stay largely the same - something designed to smooth the path to a future permanent relationship between them. But if there is a gap between the transition period ending, and the ""future relationship"" coming into force, the backstop would ensure no hard border in the meantime. The EU and UK are agreed there can be no return to a hard border - but disagree over how the backstop should operate. This video can not be played Confused by Brexit jargon? Reality Check unpacks the basics. The government has proposed a backstop which would effectively keep the whole of the UK in the EU customs union for a limited period, until a comprehensive agreement is reached. Under the EU's idea of a contingency plan, Northern Ireland would remain in the EU's customs union, large parts of the single market and the EU VAT system - something the UK says is unacceptable as it would create a new border down the Irish Sea, between Northern Ireland and the rest of the UK. Mr Baker, the Tory MP for Wycombe and deputy chairman of the Conservative pro-Brexit European Research Group of Tory MPs. said his amendments would ensure that ""emergency powers"" could not be used to implement measures in the absence of an assembly. ""Northern Ireland is an integral part of the UK."" ""Creating barriers between Northern Ireland and Great Britain, creating a separate regulatory regime or imposing EU laws on Northern Ireland via emergency legislation does not respect Northern Ireland's status in the UK."" Karen Bradley will table the Northen Ireland bill and believes it will provide an opportunity to restart political talks BBC political correspondent Jessica Parker said it was unclear what level of support there was for the amendments. ""But negotiators may not welcome any attempt to impose legal limits on the talks which are already at an impasse,"" she added. A government statement said the Northern Ireland bill is intended to provide civil servants with the ""certainty and clarity"" they needed to deliver public services. ""It enables key appointments that cannot currently be made in the absence of Northern Ireland ministers to be made during the period before an executive is next formed,"" the statement added. ""The bill also creates the necessary time and space to restart political talks with the aim of restoring devolved government as soon as possible."" May: Intensive work needed to get EU deal May says Brexit deal still 'achievable' A-Z of Brexit: The sequel New fire erupts in Hollywood Hills and threatens landmarks as chaos grips LA Paris Hilton among stars 'heartbroken' as she watches home 'burn to ground' Commuters warned of icy roads as cold snap continues to freeze UK Sound Of 2025: Ezra Collective are 'keeping music real' The Papers: 'Apocalypse' LA and 'Reeves faces extra tax rises' How Australia's beach cabana drama sparked a turf war H-1B: Visa row under Trump fuels anxiety for Indian dreamers 'I thought I was going to die': Jailed Venezuelan activist details brutality of prison life The man who could become Canada's future PM 'Trump 2.0' looms large over the global economy A politician was shot dead in Bangkok. Did another country do it? Chris Mason: Is Starmer leaving the door open to an abuse inquiry? Delivering brand-new miracles in 1970s East End Watch the latest series of Call the Midwife on iPlayer now Mark-Anthony Turnage shares the soundtrack of his life Once called 'Britainâs hippest composer', he's tackled topics from drug abuse to football in his work Paddyâs loaf-changing experience inside the bread factory Paddy McGuinness visits the bread factory he used to work in, and sees how they make 1.4 million loaves a week What's behind the global surrogacy boom? More countries are banning surrogacy â but demand is growing Â© 2025 BBC. The BBC is not responsible for the content of external sites.Read about our approach to external linking."
Sturgeon boycotts event in far-right row,"Steve Bannon left his White House job amid reports of a power struggle Nicola Sturgeon has pulled out of a conference in Edinburgh next month because Donald Trump's ex-strategist Steve Bannon was also due to speak. The first minister had been scheduled to take part in the three-day News Xchange event, which is being co-hosted by the BBC, on 13 November. However, she said that giving Mr Bannon a platform risked ""legitimising or normalising far-right, racist views"". Steve Bannon was one of Donald Trump's most trusted aides until August 2017. He left the US government after losing his seat on the National Security Council amid claims of a power struggle among President Trump's top team. Since leaving the White House, Mr Bannon has continued to champion right-wing political causes, although his appearance at events has proved controversial. In September he was disinvited from the New Yorker Festivalafter a high-profile backlash by actor Jim Carrey, producer Judd Apatow and presenter Jimmy Fallon. Nicola Sturgeon said Steve Bannon's inclusion in the event risked normalising far-right views. Nicola Sturgeon was due to be introduced by the BBC's Scotland editor Sarah Smith on the opening evening of the conference on 13 November. Steve Bannon is expected to take part in a session the next morning, which is also due to be moderated by Sarah Smith at the Edinburgh International Conference Centre. In a tweet, Ms Sturgeon said she regretted the position she had been put in by the BBC. She said: ""I believe passionately in free speech but as @ScotGovFM I have to make balanced judgments - and I will not be part of any process that risks legitimising or normalising far right, racist views. I regret that the BBC has put me and others in this position."" She also attacked the event's description of Mr Bannon as a ""powerful and influential figure...promoting an anti-elite movement."" She added: ""This kind of language to describe views that many would describe as fascist does seem to me to run the risk of normalisation."" The event is due to be moderated by BBC Scotland editor Sarah Smith In a statement the BBC said Steve Bannon had been invited on behalf of the European Broadcasting Union's (EBU) News Xchange committee. They added: ""Good journalism in a world of fake news and disinformation is more vital than ever. ""Journalism is about asking tough questions and understanding what is happening in the world and why. ""A conference designed to analyse the big issues impacting that world isn't an endorsement of anyone or anything - it is a function of what journalism is."" Event organisers, the EBU, said Mr Bannon was a ""key influencer"" in the rise of populism. ""We also consider it our journalistic responsibility to share and scrutinise a range of relevant viewpoints within the framework of a balanced debate"", they added. New fire erupts in Hollywood Hills and threatens landmarks as chaos grips LA Paris Hilton among stars 'heartbroken' as she watches home 'burn to ground' Commuters warned of icy roads as cold snap continues to freeze UK Sound Of 2025: Ezra Collective are 'keeping music real' The Papers: 'Apocalypse' LA and 'Reeves faces extra tax rises' How Australia's beach cabana drama sparked a turf war H-1B: Visa row under Trump fuels anxiety for Indian dreamers 'I thought I was going to die': Jailed Venezuelan activist details brutality of prison life The man who could become Canada's future PM 'Trump 2.0' looms large over the global economy A politician was shot dead in Bangkok. Did another country do it? Chris Mason: Is Starmer leaving the door open to an abuse inquiry? Delivering brand-new miracles in 1970s East End Watch the latest series of Call the Midwife on iPlayer now Mark-Anthony Turnage shares the soundtrack of his life Once called 'Britainâs hippest composer', he's tackled topics from drug abuse to football in his work Paddyâs loaf-changing experience inside the bread factory Paddy McGuinness visits the bread factory he used to work in, and sees how they make 1.4 million loaves a week What's behind the global surrogacy boom? More countries are banning surrogacy â but demand is growing Â© 2025 BBC. The BBC is not responsible for the content of external sites.Read about our approach to external linking."
