headline,article
LiveLiveGroups of six can meet and sports resume in England5 minutes ago,"On a day some lockdown measures in England are eased, the PM says being cautious is the way to get the results we want Boris Johnson tells a Downing Street briefing the UK is ""building up our own long-term UK manufacturing capabilities"" for vaccines He says Novavax is going to make a vaccine and GlaxoSmithKline will also finish and bottle vaccines - both in the North East That will provide between 50 and 60 million UK-made vaccines, the PM says Two households or groups of up to six people are now able to meet outside in England as the stay-at-home Covid restrictions order ends Weddings have been taking place in England but only with six people attending and outdoor sports have resumed Johnson says it's only because of months of sacrifice and effort we've been able to take these steps Most Covid transmissions are now among young people who have not yet been vaccinated, chief medical officer Chris Whitty says People living with those who have weakened immune systems should be able to get their vaccine, says the JCVI, the UK's official vaccination body WHO experts conclude that Covid-19 most likely passed to humans from a bat through another animal Edited by James Clarke and Sarah Collerton Thanks for joining us for live coronavirus news. Updates were brought to you by Emma Harrison, Francesca Gillett, George Bowden, Georgina Rannard, James Clarke, Jennifer Meierhans, Sarah Collerton and Sinead Wilson. Jess Warren-Basham and Jonny Cope cut their wedding list from 180 to six ... and here's the main UK headlines: We're pausing our coverage shortly - here's the main headlines about the pandemic around the world:  We told you earlier today about a couple who met online during the pandemic getting married today - as soon as Covid restrictions were relaxed. Dwain Daley and Nyasha Pitt said theyhad spent only four days apart since meeting in July. The couple tied the knot at Coventry Register Office and said they were already thinking of sharing their moment when rules are further relaxed. ""[We] cannot wait to start planning for the party now in the summer, when hopefully everyone is going to be allowed out to celebrate with us,"" Nyasha said. Hear more from them here: This video can not be played A refreshing dip on a spring day was the way some people chose to celebrate the easing of coronavirus lockdown restrictions. In the latest step onthe government's unlocking ""road map"", outdoor pools for exercise are once again allowed to open. The Jubilee Park outdoor swimming pool in Woodhall Spa in Lincolnshire was one of those that reopened today. Joe Stanhope, from the pool, said the phone had been ringing ""off the hook"" with people trying to book their space. He added: ""People are really excited to come back and it's been a real pleasure listening to them all and getting them all back in."" This video can not be played We reported earlier that the World Health Organization has concluded thatCovid-19 most likely passed to humans from a bat through another animal. The findings came in a highly anticipated report, which has been seen by our correspondent Imogen Foulkes. The report, officially due out tomorrow, says that the theory that the virus emerged in a laboratory is ""extremely unlikely"". Its findings don't differ from what the WHO team said at the conclusion of its mission to Wuhan, China, Foulkes explains. But it does urge more research, in particular into the possible intermediary host, and into exactly when and where the virus first began to circulate. Although the Huanan food market was initially thought to be where the outbreak began, WHO and Chinese scientists found evidence the virus could have been circulating for at least some weeks before December 2019, and that some of those infected had no connection with the market. The team judged the laboratory incident to be unlikely because ""there is no record of viruses closely related to SARS-CoV-2 (the virus that causes the Covid-19 disease) in any laboratory before December 2019."" It believes an unknown animal passed the virus to humans because the virus found in bats is ""evolutionarily distant"" from the SARS-CoV-2 found in humans. This interpretation would support the WHO team’s conclusion that it is extremely important to identify the intermediate host of the virus. Last year's FA Cup final was among the games to have been played in front of an empty Wembley during lockdown Next month's FA Cup semi-finals at Wembley will be among the pilot events to trial the return of large crowds to UK venues. Culture Secretary Oliver Dowden has told BBC sports editor Dan Roan the games on 17 and 18 April will be part of the trial programme. The FA Cup final and the World Snooker Championship in Sheffield are also on the schedule. ""We want to get as many people back as safely as possible,"" says Dowden. But he refused to be drawn on how many spectators would be permitted to attend the Wembley semi-finals. The semi-final between Chelsea and Manchester City will beshown live on BBC Oneand the BBC iPlayer on Saturday 17 April, with Leicester v Southampton played the following day. Dowden also said more pilot events will be announced later this week after confirmation from the government that the next stage of the planned easing of restrictions on 12 April is on track. You can read more here. The issue of vaccine passports is becoming increasingly high-profile as governments and people want to open up socialising in places like restaurants, musuems or concerts, as well as travel. The White House has today said that it will not pass a law requiring all citizens to hold a vaccine passport. Instead, White House press secretary Jen Psaki told a press briefing, it expects private businesses will take the lead and decide if it something they require. US President Joe Biden's administration said it will be issuing recommendations on the issue soon. Boris Johnson earlier announced that a further 50 to 60 million new coronavirus vaccines are going to be made in the UK - here are some more details on the plan. The vaccines are being made by Novavax and the protein antigen element of the jab is called NVX-CoV2373. The vaccine will be produced at the Fujifilm plant in Billingham, Stockton-on-Tees. GlaxoSmithKline (GSK) will ""fill and finish"" the jabs, which means preparing vials of the final vaccine and packaging them for distribution from its facility at nearby Barnard Castle. The market town found itself at the centre of a furore last year when the PM's then most senior aideDominic Cummingswent there during lockdown. Novavax was the first coronavirus vaccine toshow efficacy against the new UK variant in clinical trials, the BBC's medical editor Fergus Walsh said. Find out more here. These charts show the number of coronavirus cases in the UK is levelling off and the death rate is falling steadily. More than 30 million people - or half of all UK adults - have now received a first dose of a vaccine and more than three million people have had a second: Marianna SpringSpecialist disinformation and social media reporter France is one
of the most vaccine-sceptical countries in the world - fertile ground for
anti-vaccine activists spreading online misinformation. One of these is Gilles, a
science-fiction fan who helps to run a
conspiracy-themed French-language Facebook group with 50,000 members, many of
whom spread falsehoods about coronavirus. This group is
just one example of a larger trend - an increase in French-language
anti-vaccine content on social media over the past year. These pages
aren't seeking answers to legitimate medical questions. Instead, they're run by those who've firmly made up
their minds against vaccinations, and who spread false rumours about vaccines
killing millions, containing tracking devices, or altering our DNA. I’ve been speaking to some of these sceptics and asking
experts why their views are so widespread in France in particular -you can read more about it here. Secret filming at one of the biggest UK Covid testing labs has found evidence of potential contamination, discarded tests and pressure to hit targets. A BBC reporter working as a lab technician filmed staff cutting corners and processing samples in a way that could cause contamination. This means some people who had taken a test via NHS Test and Trace may have received no result or a wrong result. Read the full investigation by BBC Panorama. A technician pushes a swab back into its sample tube, causing potential contamination Nick TriggleHealth Correspondent The message was loud and clear - a rise in infections is
inevitable as the UK unlocks. But what is uncertain is when this will happen and what
impact it will have on serious illness and deaths. A surge now would be the worst outcome. The UK's vaccination rollout has gone very well, but people are
still in the process of building up immunity and not everyone in the most
at-risk groups has come forward for a jab. The vaccines, while good, are not 100% effective. It is why ministers and their advisers are urging caution. England's chief medical officer Professor Chris Whitty says if people
stick to the rules any increase could be modest. The seasons may also help - respiratory viruses thrive more
in the colder months. The lower estimates of modelling done for the government suggests
there could be 30,000 more deaths by summer 2022. That would be in line with a bad flu winter. But it could
also be much, much worse. If there is one thing we have learnt, nothing can be taken
for granted with Covid. Pakistan's President Arif Alvi has tweeted that he has tested positive for Covid-19. Alvi, who is 71, says he has taken the first dose of a Covid vaccine but is awaiting the second. It is still possible to contract coronavirus after being vaccinated but the jabs protect most people against serious complications of the disease. A second dose also offers greater protection. Pakistan's Prime Minister Imran Khan tested positive earlier this month. Cases in Pakistan are on the rise, with about 4,000 cases a day reported in the past week. Allow Twitter content? This article contains content provided by Twitter. We ask for your permission before anything is loaded, as they may be using cookies and other technologies. You may want to readTwitter’s cookie policy,externalandprivacy policy,externalbefore accepting. To view this content choose‘accept and continue’. Reality Check During the briefing earlier, Prime Minister Boris Johnson was asked about enforcement of coronavirus regulations and said he thought the police have ""handed out about 70,000 fines - at least - for various breaches of one kind or another"". According to the latest figures from the National Police Chiefs’ Council, police in England issued 85,975 fixed penalty notices for breaching Covid-19 rules between 27 March 2020 and 14 March 2021. The figure rises to 94,368 once police fines in Wales are included. The ""vast majority"" of the fines overall were for breaking restrictions on movement, and the rate of fines has increased during the third lockdown - with two-thirds of all penalties handed out since 21 December. You can read more about Covid-19 fines and how crime in general has changedover the course of the pandemic here. Nick TriggleHealth Correspondent The news that the Novavax vaccine is going to go through a
process known as fill and finish in the UK is an interesting development. Fill and finish is the process by which vaccines are
packaged up in vials, ready to be sent out to vaccination clinics. The original plan was for this to be done in Europe once the
vaccine product was manufactured by plants in the North East of England. But a deal has been struck with drug firm GSK to do that
here. Officially, the government is saying that it is all part of
their investment in the British life science industry. But given the threats from Europe about restricting exports
of vaccines, it begs all sorts of other questions too. The north-east plants have already started manufacturing the
60 million doses ordered by the government. If it gets approval from the regulator - expected in the coming weeks - supplies could be available in June.  In case you missed this at the briefing earlier, here is the PM announcing that the UK will make more vaccine doses in the North East of England: This video can not be played Reality Check The PM said that, when it comes coronavirus transmission, ""outdoors is generally much safer than indoors"". Researchers say that the chances of catching Covid outdoors
are massively reduced compared with indoors - although infections can still
happen. This is mainly down to three reasons: Even so, there are a handful of cases where it's believed
that infections did happen outside. Chris MasonPolitical Correspondent This was a news conference where excitement was cloaked in caution. A splash of the giddy with a reference to the al fresco front crawlers at Hillingdon Lido in London. Admiration for the nocturnal peddlers of Ilkeston Cycle Club in Derbyshire, whose love of lycra lured them out at midnight, the moment it was legal to do so. But all the way through, from all three of the contributors, were reminders of the need to be careful. ""We don't know how strong our defences are against a new wave,"" said the prime minister. There is a ""high likelihood of some uptick"" in cases, warned Professor Chris Whitty, given the unlocking measures starting today. A high proportion of those who will catch and transmit the virus have not been vaccinated yet, we were told. Sophia Sleigh of the Evening Standard asks the PM if he can categorically rule out a full lockdown? The PM says ""yes but with at least two very important provisos"". Those are if everybody continues to follow the guidance and if the vaccine rollout continues and the vaccines continue to be as effective as it looks as though they are, he says. He says: ""I'm hopeful. I don't see anything in the data right now that would cause us to deviate from the roadmap but we need to remain humble in the face of nature and be prepared to do whatever it takes to protect the British public."" Sleigh says a report by the Evening Standard reveals care home staff in London are the least likely to take up the vaccine. She asks Whitty if he is shocked by this and asks if it offers enough protection for care home residents He says: ""The great majority of care home staff nationally have had the vaccine and as have an even greater proportion of our health care staff."" He says there are three things it's important to stress to people, firstly ""this vaccine will protect you and your family"", he says. He says ""there is unfortunately some misinformation about vaccines"" so it's important to go to reliable sources that can lay out the facts. Lastly, he says: ""I do consider people who are looking after people who are vulnerable have a professional responsibility to get vaccinated."" And that marks the end of the briefing. © 2025 BBC. The BBC is not responsible for the content of external sites.Read about our approach to external linking."
Stranded Suez container ship freed from shoreline,"This video can not be played Rescue workers used tug boats to wrench the ship's stern from the canal bank The stern of a huge container ship that has been wedged across the Suez Canal for almost a week has been freed from the shoreline, officials say. The course of the 400m-long (1,300ft) Ever Given has been corrected by 80%, according to the Suez Canal Authority. It added that further efforts to move the boat would resume later on Monday. But the head of a company involved in the rescue efforts urged caution, warning that completing the operation would not be ""a piece of cake"". The Ever Given has been blocking one of the world's busiest trade routes, forcing companies to reroute ships and causing long tailbacks of hundreds of vessels. The reports that the ship had been partially freed raised hopes that traffic along the canal could resume within hours, clearing the way for an estimated $9.6bn (£7bn) of goods being held up each day. How do you refloat a giant cargo ship? In pictures: Efforts to shift huge ship from canal The cost of the Suez Canal blockage Rescue workers from the authority and the Dutch company Smit Salvage used tug boats to wrench the rear of the ship from the canal bank. Alongside the tugs, dredgers have been digging out sand and mud from under the bow of the vessel. The stern, which had been 4m from the shore, was now 102m clear, the Suez Canal Authority said, adding that the boat had been fully refloated. Efforts to move the boat resumed at 11:30 local time (09:30 GMT) when the tide was due to rise. In a statement, the Suez Canal Authority said that once the tide had reached 2m, rescue workers would aim to fully restore ""the vessel's direction so it is positioned in the middle of the navigable waterway"". Traffic would resume once the ship was moved to a waiting area in a wider section of the canal, the authority said. A total of 367 vessels are waiting to pass through, and officials have said it will take three and a half days to clear the traffic jam. ""We will not waste one second,"" Suez Canal Authority Chairman Osama Rabie told Egyptian state television. The CEO of the salvage company involved in the rescue efforts told Dutch public radio that the operation was far from complete. ""We have movement, which is good news. But I wouldn't say it's a piece of cake now,"" Peter Berdowski said. He explained that high-pressure water would be used to try and remove sand and clay from underneath the bow of the ship, but if that failed, then containers would have to be lifted in an operation that could take some time. ""The bow is still stuck rock-solid at the moment in the slightly sandy clay,"" he said. Officials are waiting for high tide in order to move the ship to a wider section of the canal The 200,000-tonne Ever Given ran aground on Tuesday morning amid high winds and a sandstorm that affected visibility. Specialist salvage companies were brought in to help refloat the ship. On Sunday, canal officials began preparing to remove some of roughly 18,000 containers on board in order to lighten the load. The containers are carrying a huge variety of items and the insured value of the cargo is believed to amount to hundreds of millions of dollars. Last week, one freight operator in the UK told the BBC they were waiting for 20 boxes containing ""coconut milk and syrups, some spare parts for motors... some fork lift trucks [and] some Amazon goods"". The canal, which separates Africa from the Middle East and Asia, is one of the busiest trade routes in the world with about 12% of total global trade moving through it. It provides the shortest link between Asia and Europe. An alternative route, around the Cape of Good Hope on the southern tip of Africa, can take two weeks longer. According to data from Lloyd's List, the blockage is holding up an estimated $9.6bn of goods each day - or $400m an hour. How was the Suez Canal ship freed? In pictures: The epic task of refloating Suez ship 'Our customers are worried about the Suez blockage' Deadly wildfires rage across LA as fierce winds threaten more destruction What's the latest on the LA fires, and why can't they be put out? Danes struggle with response to Trump Greenland threat 'I paid fake doctor thousands for fillers - now I look like a gargoyle' The Papers: 'Lost Angeles' and 'Musk seeks plan to oust Starmer' Pop star Chappell Roan wins BBC Sound Of 2025 Weekly quiz: Zendaya looked happy but who else sparkled at the Golden Globes? The 20 child abuse inquiry proposals - what has happened so far? The '9/11 mastermind' wants to plead guilty. Why is the US trying to stop him? Why are UK borrowing costs rising and what does it mean for me? In maps: Thousands of acres on fire in LA Before and after: How wildfires tore through LA Ed Gamble hosts the official Traitors podcast Join Ed Gamble and guests as they dissect the first episodes of The Traitors! Can art, music and words bind us in divided times? Simon Schama explores how artists have captured the transformations of British society since 1945 Enjoy a satirical smorgasbord of The News Quiz Digest a dramatic year of news as Andy Zaltzman revels in some of 2024's funniest moments The multi-award-winning legal drama returns Two years on, the Defoes are back and have gathered for a beautiful wedding in Barcelona © 2025 BBC. The BBC is not responsible for the content of external sites.Read about our approach to external linking."
