headline,article
Winter Hill fire 'may burn for days'A man who was arrested on suspicion of arson is currently being held in police custody.Lancashire,"This video can not be played The blaze has spread over Lancashire moorland Firefighters tackling a blaze near a major TV transmitter say it will take days to extinguish but ""fear it may be much longer"". The fire, which started at Winter Hill on Thursday, is smouldering across a 1.9 sq miles (5 sq km) area. A 22-year-old man, from Bolton, was arrested on Friday on suspicion of arson with intent to endanger life. The fire has ""intensified"" following increased winds during the afternoon, Lancashire fire service said. A helicopter has been dropping water over the plume It comes as crews from around the country have joinedfirefighters and the Army to deal with a separate fire at Saddleworth Moorin Greater Manchester, which started on Sunday. Along with the Winter Hill blaze, it has blanketed the region in smoke and ash. People in nearby areas have been asked to keep doors and windows closed. About 100 soldiers from the 4th Battalion, Royal Regiment of Scotland, were sent from their Yorkshire barracks on Thursday to aid firefighters for an initial 48-hour deployment. Their presence has been extended for a further three days following a request by Greater Manchester mayor Andy Burnham. Soldiers have been drafted in to help tackle the Saddleworth Moor fire The Winter Hill blaze started on Thursday A Lancashire Fire and Rescue Service spokesman said the Winter Hill blaze was currently smouldering between the TV transmitter, which serves viewers in north-west England, and Rivington Pike near Bolton. He said predicting when it would be fully extinguished was ""not an exact science"" and depended on the strength and direction of the wind. Following the hot weather and recent blazes across the region, he appealed for people not to use naked flames near dry grass. The Winter Hill blaze stretches over 1.6 sq miles (5 sq km) Area manager Ben Norman, from the service, explained: ""I wouldn't like to say when we'd be leaving the moors - we are hopeful it would be within the next few days but we fear it may be much longer."" A trench has also been dug to prevent the fire from reaching the highest house on the hill. Mike Sewell and his family were evacuated from their home as fire crews and the water firm United Utilities, which manages an area nearby, tried to protect the property. ""It's been a bit of a nightmare but the fire service has been brilliant, they're keeping us informed all the way,"" he said. ""We've had a few little fires before but nothing on this magnitude. ""Normally there are birds flying around but there are not as many now so that's one of the main downfalls."" A trench has been dug around one family's home About 60 firefighters and 10 fire engines were at the scene of the fire earlier. They have been aided by a helicopter crew, who have been dropping water to help douse the fire. Despite the location, the blaze is not expected to affect local TV transmission services. Arson arrest over Winter Hill moor fire Lancashire Fire and Rescue Service Lancashire Constabulary Greater Manchester Fire and Rescue Service Significant pressure at Royal Preston Hospital with decision to declare ‘critical incident’ under constant review 31 hairstylists, barbers and salons in Lancashire you need to try in 2025 Trains cancelled and engineers heading to Blackburn Station – here’s why 31 hairstylists, barbers and salons you need to try in 2025 15 hairstylists, barbers and salons in and around Blackpool you need to try in 2025 Preston charity joins in the Big Adoption Day urging people to consider helping children LA fire chief leaves mid-briefing to confront new wildfire in Hollywood Hills In maps: Thousands of acres on fire in LA 'Patients are collapsing in the waiting room': A&E nurses speak out Chris Mason: Is Starmer leaving the door open to an abuse inquiry? The Papers: 'Apocalypse' LA and 'Reeves faces extra tax rises' Why does Trump want Greenland and what do its people think? How Canada's immigration debate soured - and helped seal Trudeau's fate 'I can't get divorced as I can't get my pension valued' What are cold weather payments and who can get them? BBC Sound of 2025: Barry Can't Swim is a new dance music superstar Ros Atkins on...Elon Musk's political interventions Jean-Marie Le Pen - founder of French far right and 'Devil of the Republic' Delivering brand-new miracles in 1970s East End Watch the latest series of Call the Midwife on iPlayer now Mark-Anthony Turnage shares the soundtrack of his life Once called 'Britain’s hippest composer', he's tackled topics from drug abuse to football in his work Paddy’s loaf-changing experience inside the bread factory Paddy McGuinness visits the bread factory he used to work in, and sees how they make 1.4 million loaves a week What's behind the global surrogacy boom? More countries are banning surrogacy – but demand is growing © 2025 BBC. The BBC is not responsible for the content of external sites.Read about our approach to external linking."
Rob Delaney's wife expecting baby,"Rob Delaney is best known for his role in the Channel 4 sitcom Catastrophe US actor and comedian Rob Delaney has announced he and his wife Leah are to become parents to their fourth child. The star of the Channel 4 sitcom Catastrophe, who lives in London, shared the news with fans on Twitter. It comes five months after the death of the couple's two-year-old son Henry, who was diagnosed with a brain tumour in 2016 and died in January. In a video, the actor praised the NHS and called for US citizens to campaign for better healthcare. US actor Rob Delaney's son dies aged two Delaney, who has two further children with Leah, wrote on Twitter that two ""typically wonderful"" midwives had visited him and his wife to assess them for a home birth. Continuing his praise for the health service, he sent his ""love"" to protesters marching in London on Saturday to mark the NHS' 70th birthday. The tweet also included a video he made for Democratic Socialists for Medicare for All, talking about the differences between the healthcare systems in the US and the UK. Allow Twitter content? This article contains content provided by Twitter. We ask for your permission before anything is loaded, as they may be using cookies and other technologies. You may want to readTwitter’s cookie policy,externalandprivacy policy,externalbefore accepting. To view this content choose‘accept and continue’. In the video, Delaney said: ""Our son Henry passed away in January of this year from cancer and he was a beautiful little boy from the moment he was born until the moment he died. ""And he benefited so much from the healthcare system here and so did we as his parents, because while we endured stress that was truly unbelievable, we didn't endure the financial stress of wondering, 'are we going to be able to pay for this?' ""'Are we going to have to move during his treatment because we have to move into a smaller house? Or move in with relatives?' ""That financial stress, we didn't have to endure here, and what a gift."" Delaney revealed his son's battle with the illness in February, saying Henry had been diagnosed with cancer shortly after his first birthday, following persistent vomiting and weight loss. The one-year-old had surgery to remove the tumour and continued with treatment in 2017, but later that year the cancer returned and he died in January, aged two. Then, Delaney thanked the health service,writing on Facebook,external: ""The NHS nurses and doctors and the home carers and charity workers who helped our family survive Henry's illness will be my heroes until the day I die. ""I am desperately sad right now, but I can say with authority that there is good in this world."" He also called on the public not to take the NHS ""for granted"". US actor Rob Delaney's son dies aged two LA fire chief leaves mid-briefing to confront new wildfire in Hollywood Hills In maps: Thousands of acres on fire in LA 'Patients are collapsing in the waiting room': A&E nurses speak out Chris Mason: Is Starmer leaving the door open to an abuse inquiry? The Papers: 'Apocalypse' LA and 'Reeves faces extra tax rises' Why does Trump want Greenland and what do its people think? How Canada's immigration debate soured - and helped seal Trudeau's fate 'I can't get divorced as I can't get my pension valued' What are cold weather payments and who can get them? BBC Sound of 2025: Barry Can't Swim is a new dance music superstar Ros Atkins on...Elon Musk's political interventions Jean-Marie Le Pen - founder of French far right and 'Devil of the Republic' Delivering brand-new miracles in 1970s East End Watch the latest series of Call the Midwife on iPlayer now Mark-Anthony Turnage shares the soundtrack of his life Once called 'Britain’s hippest composer', he's tackled topics from drug abuse to football in his work Paddy’s loaf-changing experience inside the bread factory Paddy McGuinness visits the bread factory he used to work in, and sees how they make 1.4 million loaves a week What's behind the global surrogacy boom? More countries are banning surrogacy – but demand is growing © 2025 BBC. The BBC is not responsible for the content of external sites.Read about our approach to external linking."
Winter Hill fire 'may burn for days'A man who was arrested on suspicion of arson is currently being held in police custody.,"This video can not be played The blaze has spread over Lancashire moorland Firefighters tackling a blaze near a major TV transmitter say it will take days to extinguish but ""fear it may be much longer"". The fire, which started at Winter Hill on Thursday, is smouldering across a 1.9 sq miles (5 sq km) area. A 22-year-old man, from Bolton, was arrested on Friday on suspicion of arson with intent to endanger life. The fire has ""intensified"" following increased winds during the afternoon, Lancashire fire service said. A helicopter has been dropping water over the plume It comes as crews from around the country have joinedfirefighters and the Army to deal with a separate fire at Saddleworth Moorin Greater Manchester, which started on Sunday. Along with the Winter Hill blaze, it has blanketed the region in smoke and ash. People in nearby areas have been asked to keep doors and windows closed. About 100 soldiers from the 4th Battalion, Royal Regiment of Scotland, were sent from their Yorkshire barracks on Thursday to aid firefighters for an initial 48-hour deployment. Their presence has been extended for a further three days following a request by Greater Manchester mayor Andy Burnham. Soldiers have been drafted in to help tackle the Saddleworth Moor fire The Winter Hill blaze started on Thursday A Lancashire Fire and Rescue Service spokesman said the Winter Hill blaze was currently smouldering between the TV transmitter, which serves viewers in north-west England, and Rivington Pike near Bolton. He said predicting when it would be fully extinguished was ""not an exact science"" and depended on the strength and direction of the wind. Following the hot weather and recent blazes across the region, he appealed for people not to use naked flames near dry grass. The Winter Hill blaze stretches over 1.6 sq miles (5 sq km) Area manager Ben Norman, from the service, explained: ""I wouldn't like to say when we'd be leaving the moors - we are hopeful it would be within the next few days but we fear it may be much longer."" A trench has also been dug to prevent the fire from reaching the highest house on the hill. Mike Sewell and his family were evacuated from their home as fire crews and the water firm United Utilities, which manages an area nearby, tried to protect the property. ""It's been a bit of a nightmare but the fire service has been brilliant, they're keeping us informed all the way,"" he said. ""We've had a few little fires before but nothing on this magnitude. ""Normally there are birds flying around but there are not as many now so that's one of the main downfalls."" A trench has been dug around one family's home About 60 firefighters and 10 fire engines were at the scene of the fire earlier. They have been aided by a helicopter crew, who have been dropping water to help douse the fire. Despite the location, the blaze is not expected to affect local TV transmission services. Arson arrest over Winter Hill moor fire Lancashire Fire and Rescue Service Lancashire Constabulary Greater Manchester Fire and Rescue Service Significant pressure at Royal Preston Hospital with decision to declare ‘critical incident’ under constant review 31 hairstylists, barbers and salons in Lancashire you need to try in 2025 Trains cancelled and engineers heading to Blackburn Station – here’s why 31 hairstylists, barbers and salons you need to try in 2025 15 hairstylists, barbers and salons in and around Blackpool you need to try in 2025 Preston charity joins in the Big Adoption Day urging people to consider helping children LA fire chief leaves mid-briefing to confront new wildfire in Hollywood Hills In maps: Thousands of acres on fire in LA 'Patients are collapsing in the waiting room': A&E nurses speak out Chris Mason: Is Starmer leaving the door open to an abuse inquiry? The Papers: 'Apocalypse' LA and 'Reeves faces extra tax rises' Why does Trump want Greenland and what do its people think? How Canada's immigration debate soured - and helped seal Trudeau's fate 'I can't get divorced as I can't get my pension valued' What are cold weather payments and who can get them? BBC Sound of 2025: Barry Can't Swim is a new dance music superstar Ros Atkins on...Elon Musk's political interventions Jean-Marie Le Pen - founder of French far right and 'Devil of the Republic' Delivering brand-new miracles in 1970s East End Watch the latest series of Call the Midwife on iPlayer now Mark-Anthony Turnage shares the soundtrack of his life Once called 'Britain’s hippest composer', he's tackled topics from drug abuse to football in his work Paddy’s loaf-changing experience inside the bread factory Paddy McGuinness visits the bread factory he used to work in, and sees how they make 1.4 million loaves a week What's behind the global surrogacy boom? More countries are banning surrogacy – but demand is growing © 2025 BBC. The BBC is not responsible for the content of external sites.Read about our approach to external linking."
The rise and rise of Kylian Mbappe,"Kylian Mbappe grew up playing for Bondy on the outskirts of Paris and his talent was obvious from an early age A lot has happened in a short space of time for Kylian Mbappe. Aged 19, he is lighting up the World Cup for France, scoring twice in their4-3 victory over Argentinain the last 16. It is the latest step in a remarkable rise for a player who was celebrating passing his French high school exams just three summers ago. In less than two years he has become a double Ligue 1 title winner and a regular for France andParis St-Germain,for whom he is expected to sign permanently this summer for 180m euros. Mbappe spent his formative years developing his skills at AS Bondy in the north-eastern suburbs of Paris. The club are experiencing a surge in popularity and are inundated with new members wanting to follow in the footsteps of Mbappe. BBC Sport went to the club where Mbappe started his football journey when he was just a toddler and spoke to those who knew him. For more from BBC World Service, download theirWorld Football Podcast. AS Bondy's senior team play in the 10th tier of French football, in the ""Excellence"" division of the League of Paris ile-de-France but they have a very successful youth system. Players who have passed through their age groups include Sevilla's Sebastien Corchia and DR Congo international Fabrice N'Sakala. Up until only three months ago, Mbappe's father Wilfried was one of the sporting directors at the club looking after the age groups from under-10s up to under-17s but he has had various roles over 25 years at AS Bondy. AS Bondy may soon have to start turning new members away Atmane Airouche, president of AS Bondy:""You could say that Kylian was born here at this club. He was here as a baby when his father was a player and a coach. He was always here and learning about football, even as a toddler. ""When we played games, just before kick-off you'd see a two-year-old walk in with a ball and he'd sit with us to listen to the team talks. I think he's the player here who must have heard the record number of pre-match team talks."" Antonio Riccardi, 28, under-13s coach at AS Bondy:""His father is like my second father so I knew Kylian as a baby but the first time I coached him was when he was six years old. Just a few months after he had started playing here for the debutants age group you could tell he was different. ""Kylian could do much more than the other children. His dribbling was already fantastic and he was much faster than the others."" Airouche:""He was born into football and sport. His father was a youth leader, working with children in the local area and then he was brought in to AS Bondy. He only left us three months ago but his imprint will be here forever. He gave 25 years of his life to us. And his mother is also a big influence. She was a very good professional handball player."" Mbappe was at the famous Clairefontaine academy between the age of 12 and 15 but initially continued to play for Bondy. Riccardi:""Kylian would always think about football, always talk about football, always watch football - and if he wasn't doing that he'd be playing football games on the PlayStation. ""He'd even turn his living room into a football pitch. When he was young I used to take Kylian home from training and I'd babysit until his mother got home from work. ""He always wanted to play in the living room! The sofa or the table would be the goal. He'd say: 'Don't tell my mother, don't tell my father because they don't want me to play here. Please don't tell.' So we used to play and I kept that secret for him. Luckily he never broke anything."" Airouche:""He only thinks about football and that's what makes the difference compared to others. ""Other players think that once they've signed for a club or gone to Clairefontaine they've achieved something, that they've arrived. But no, the hard work is only just starting and Kylian knew that. He'd play anywhere. ""If he came here now and fancied a game he'd just play even now he's a pro. All he thinks about is the game."" Riccardi:""He was a big fan of Cristiano Ronaldo. They were the posters on his bedroom wall, but he was a fan of lots of great players. He didn't follow a particular team but he was a fan of many top footballers. Ronaldo was definitely his childhood hero though."" Mbappe agreed to sign for Monaco at the age of 14. He is said to have turned down every other Ligue 1 side, plus Real Madrid, Chelsea, Manchester City, Liverpool and Bayern Munich. He made his first-team debut for Monaco on 2 December 2015 as a late substitute - in the process breaking former France striker Thierry Henry's record to become Monaco's youngest player at 16 years, 347 days. Mbappe was one of the stars of the Under-19 Euros in Germany in 2016, scoring five goals, including two in the semi-final. The top scorer at that tournament was Jean-Kevin Augustin, who has just left PSG to join German side RB Leipzig. Riccardi:""Kylian was always enthusiastic. You have to work hard when you have a talent like he does because if you don't, others that are less talented but are working hard can catch up. ""In Bondy there were no real moments of difficulty for him because he was far better than the others. But I know that in Monaco the first year was difficult for him because he had a coach that didn't like him very much. Today that coach is no longer at Monaco and Kylian is in PSG and the national team. So it was the coach who was in the wrong."" Airouche:""We went to watch him at the under-19 final, which France won. We met him outside the stadium and we were shocked that he didn't want to go partying with his team-mates. Instead he wanted to go straight home. ""To him, he had achieved his goal to be European champion and was already thinking about his next goal: going back to Monaco, getting into their team, winning more titles. ""I remember when Monaco became champions he was the only player on the pitch who didn't have a mobile phone with him during the celebrations. All the others went out partying, he was the only one who went home to sleep. That's what is so great about him. ""Other professionals should learn from Kylian. You've never reached your goal. Work harder and harder every day."" Mbappe often posts on social media about his family and is very close to his father, Wilfried, and mother, Fayza. He passed his high school exams in science and technology management, combining his studies with his football development. Airouche:""He's a little boy from Bondy who loves football and respects people. That's what we give to our children here. He loves his town, he loves this club, he still talks about it to this day. He's always behind us and when he gets the chance to see the little ones here he does it. That's why lots of people like him because he is simply himself. ""He is a young man who seems to have the maturity of a 40-year-old when he speaks. That's his personality. Generous, respectful and when he comes here he's always just a boy from Bondy and a boy from ASB."" The popularity of AS Bondy has surged since Mbappe's rise to prominence and the club need new sponsors to keep up with demand Riccardi:""He's the same now as he was back then. If he came here now he would say hello to all the young players here, he would give all the coaches a hug, he would take a ball and play with the others. ""We still call and text each other and it's the same easy-going conversations that we had when I was his babysitter. He will never change because his education is so good. Behind him he has his parents, who are fantastic people. He has a great family unit. He believes in family and he doesn't want to let them down."" Airouche:""Kylian's personality - when you see him speaking at 18 but sounding like he's 30, talking with phenomenal maturity - is because of what his parents gave him. They're people that always had their hands on their hearts, they helped a lot. Not just their children but the children here at the club, for them it was the same."" Riccardi:""A move he used to do as a kid that he still does now in the 'passement de jambes' (the stepover). It was his trademark as a boy. From seven or eight years old he was doing that. ""He was the best player I've ever seen in 15 years coaching here. Nobody has even come close. In Paris there are many talents but I'd never seen a talent like him. He was what we call a 'craque' (the best)."" Airouche:""When he was little he was always the smallest but he had technique and vision in the game that most children just don't have. That's why when you see him now you notice he has amazing senses. He's got eyes in the back of his head. He knows how to anticipate where the ball will go. ""Here, he never played for his proper age group, he always played with older children because there was no point leaving him with kids his own age. He'd just get bored. ""Physically that was tough because he was small, but he had the talent that made the difference. He was a phenomenon. Then suddenly, he grew up. I remember not seeing him for a while and then when we met up again he was suddenly as tall as me."" A version of this article was first published on 26 September 2017. Catch-up: France v Argentina in incredible last-16 tie PSG sign Monaco's Mbappe on loan Monaco 2-0 Saint-Etienne Ligue 1 Uefa Champions League 'Bergvall is headline act as young Spurs show incredible maturity' West Ham to appoint Potter after sacking Lopetegui Tottenham's Bentancur taken off on stretcher after injury against Liverpool Paddy’s loaf-changing experience inside the bread factory Paddy McGuinness visits the factory he used to work in to find out how they bake 1.4 million loaves a week Dara Ó  Briain and Isy Suttie discover strange-but-true tales The pair are joined by astronaut Helen Sharman to learn about how humans learned to survive in space A round-up of 2024's top sports stories. VideoA round-up of 2024's top sports stories Jason Manford hosts, with Maisie Adam and Jon Richardson as team captains How Claressa Shields became a boxing legend The story of how Claressa Shields overcame obstacles to reach the top of the boxing game Fantasy holes with lava fields - it's golf for the 21st Century How the man who signed Henry, Bale and Suarez is reshaping Toulouse How the role of a goalkeeper changed Can Djokovic win record 25th Grand Slam aged 37? As Hamilton turns 40, how well do you know seven-time champion? 'Epic moment!' - 355lb Pierce interception tops NFL best plays. Video'Epic moment!' - 355lb Pierce interception tops NFL best plays The Man Utd legend almost broken by Barcelona Kohli, youngsters & Bumrah - talking points from Australia's win over India Clough - the man who made Forest European champions twice How 'impressive' Man Utd caused problems on Liverpool's right side. VideoHow 'impressive' Man Utd caused problems on Liverpool's right side Australia beat India to claim series victory. VideoAustralia beat India to claim series victory Teenage kicks - what makes history-making Littler so good? Sporting highlights to look forward to in 2025 The best sports photos of 2024 - and how they were captured © 2025 BBC. The BBC is not responsible for the content of external sites.Read about our approach to external linking."
