headline,article
'I drive 10 minutes to open an email',"This video can not be played Cothi Valley 'blighted' by poor internet speeds A business owner has said slow internet speeds mean he has to take a 10 minute drive in order to email clients. Rhydian Thomas is among a group of homeowners in the Cothi Valley, Carmarthenshire, who say broadband as slow as 0.1Mbps creates obstacles in their personal and professional lives. Openreach said nearly 95% of Wales now had access to fibre optic broadband. But Mr Thomas said that where he lives, ""it takes an entire day to download a film"". The number of Welsh homes able to access superfast broadband has increased since 2013when availability was the lowest in the UK at just 48%,external, with just 370,000 properties able to access it. Five years later, the number of homes in Wales able to access speeds of 24Mbps or above stands at about 720,000, following the completion of the Superfast Cymru scheme. But critics said Superfast Cymru's rollout was too slow and still left some communities lagging behind. Some residents in the Cothi Valley are connected to the internet via copper wiring to a telephone exchange 6km (3.7miles) away. Electrical contractor Mr Thomas said ""painfully slow"" speeds caused him frequent problems. ""I need the internet to access emails for various jobs or update details on work that I have just done. But the speeds are so slow that it takes forever just to open a webpage,"" he said. ""It can dip out completely if it starts raining - and I've lost count of the amount of times I've had to drive into Carmarthen to use free wifi in a cafe just to send an email."" Welsh internet via satellite over Africa Fed up villagers install fast broadband Why schoolgirl does homework in a lay-by The father-of-one said it has also frustrated him while he launches a new business for audio speakers. Neighbour John Burton said: ""In terms of speeds, it's like we are 10-15 years behind everyone else. The situation is made all the more worse when the mobile signal is non-existent too."" He added that residents' efforts to persuade Openreach and the Welsh Government to upgrade the line had proved fruitless. Residents said they have looked into installing their own network - but it was too expensive given the small number of houses. Rhydian Thomas and other homeowners in the village experience download speeds as low as 0.5Mbps Swansea University business lecturer Dr Robert Bowen said broadband access had improved dramatically - but ""not spots"" meant rural places risked becoming even more isolated. ""When you consider some of these places do not have a local bank anymore, because their bank has closed, then reliable and fast access to the internet isn't a luxury but more of an essential service,"" he said. ""It also limits opportunities for businesses and plays a factor in younger people moving away. ""A lot of progress has been made but more still needs to be done, because for some it's still very much a postcode lottery."" UK homes to get faster broadband by 2020 Village 'abandoned' over broadband Villagers often struggle to connect to the internet Openreach said it was working on the successor to superfast broadband - fibre first - with speeds of up to one gigabit per second. The latest city to be signed up to the upgrade, which aims to reach three million UK homes and businesses by 2020, is Swansea. Managing director Kim Mears said: ""We've already done an incredible amount of work across Wales in improving access to better broadband connectivity - both in rural and urban parts of the country. ""Despite the challenges of planning, street works and permissions, our engineers are already reaching thousands of homes and businesses every week."" The firm also said Wales now had better fibre broadband coverage than Germany, Italy or France. The Welsh Government insisted Superfast Cymru had ""transformed the digital landscape in Wales"". A spokeswoman said: ""In 2013 less than half of premises in Wales had access to superfast broadband compared with over nine out of 10 now.  We know there is more to do to reach the final premises without access."" How has superfast broadband rollout gone? Superfast Cymru 'failed to deliver' Axjet Openreach Wildfire sweeps through Hollywood Hills and threatens landmarks as chaos grips LA Paris Hilton among stars 'heartbroken' as she watches home 'burn to ground' 'Mum waited 31 hours' : Your stories of A&E Sound Of 2025: Ezra Collective are 'keeping music real' The Papers: 'Apocalypse' LA and 'Reeves faces extra tax rises' How Australia's beach cabana drama sparked a turf war H-1B: Visa row under Trump fuels anxiety for Indian dreamers 'I thought I was going to die': Jailed Venezuelan activist details brutality of prison life The man who could become Canada's future PM 'Trump 2.0' looms large over the global economy A politician was shot dead in Bangkok. Did another country do it? Chris Mason: Is Starmer leaving the door open to an abuse inquiry? Delivering brand-new miracles in 1970s East End Watch the latest series of Call the Midwife on iPlayer now Mark-Anthony Turnage shares the soundtrack of his life Once called 'Britainâs hippest composer', he's tackled topics from drug abuse to football in his work Paddyâs loaf-changing experience inside the bread factory Paddy McGuinness visits the bread factory he used to work in, and sees how they make 1.4 million loaves a week What's behind the global surrogacy boom? More countries are banning surrogacy â but demand is growing Â© 2025 BBC. The BBC is not responsible for the content of external sites.Read about our approach to external linking."
Man traced on missing airman footage,"Corrie Mckeague's mother said the CCTV footage showed her son ""did not go in the bin"" A man captured on CCTV and believed by a missing airman's mother to be her son has identified himself to detectives. Police viewed the footage during their investigation into Corrie Mckeague's disappearance from Bury St Edmunds, Suffolk, in September 2016. His mother Nicola Urquhart said the public would be ""horrified"" to see it, as it cast doubt on the police theories over her son's whereabouts. Police said the man captured on CCTV had been traced. The BBC asked for the CCTV footage to be released under the Freedom of Information Act. Suffolk Police turned down the request on the grounds of data protection laws. Mr Mckeague was last seen on CCTV at 03:25 BST on 24 September 2016 Mr Mckeague was last seen entering a bin loading bay when he was on a night out in Bury St Edmunds, leadingpolice to believe he had gone into one of the bins. But his remains were not found despite a 20-week trawl of a landfill site near Cambridge. Missing airman 'in waste disposal system' The tragedy that shaped Corrie Mckeague Missing airman 'may have dodged CCTV' Mrs Urquhart said she had viewed CCTV footage which she said showed a man leaving the bin loading bay. She said the footage was ""grainy"" but it showed a person ""wearing incredibly bright, reflective clothing, which looks like white trousers"". Mrs Urquhart said she believed it was her son and if members of the public saw the footage ""no-one would believe he went in the bin"". Detectives spent 20 weeks searching the landfill site in Milton, Cambridgeshire Suffolk Police said the footage showed three individuals who were ""tracked walking into the area and away from the area"". It said clearer images of them were found, ""enabling identification"". The force said all three individuals had been spoken to by police and had identified themselves from the images. It said it was ""confident"" none of them was Mr Mckeague. The force said the individuals were ruled out in autumn 2016. Mr Mckeague, originally from Dunfermline, Fife, was 23 when he went missing. He was last seen entering in the bin loading area at 03:25 on 24 September. Missing airman 'may have dodged CCTV' Missing airman 'in waste disposal system' Missing Corrie search to be stood down Corrie Mckeague's mother shares video. Video, 00:00:24Corrie Mckeague's mother shares video The tortuous search for Corrie Mckeague Missing airman 'known to sleep in bins' Suffolk Constabulary Townâs history brought to life with new description panels Food festival set to return with new wine tasting area High street Post Office announces relocation date Spectacular fireworks displays illuminate skies above landmark pier See inside new steakhouse restaurant on opening day Cordon in place around Job Centre in seaside town Wildfire sweeps through Hollywood Hills and threatens landmarks as chaos grips LA Paris Hilton among stars 'heartbroken' as she watches home 'burn to ground' 'Mum waited 31 hours' : Your stories of A&E Sound Of 2025: Ezra Collective are 'keeping music real' The Papers: 'Apocalypse' LA and 'Reeves faces extra tax rises' How Australia's beach cabana drama sparked a turf war H-1B: Visa row under Trump fuels anxiety for Indian dreamers 'I thought I was going to die': Jailed Venezuelan activist details brutality of prison life The man who could become Canada's future PM 'Trump 2.0' looms large over the global economy A politician was shot dead in Bangkok. Did another country do it? Chris Mason: Is Starmer leaving the door open to an abuse inquiry? Delivering brand-new miracles in 1970s East End Watch the latest series of Call the Midwife on iPlayer now Mark-Anthony Turnage shares the soundtrack of his life Once called 'Britainâs hippest composer', he's tackled topics from drug abuse to football in his work Paddyâs loaf-changing experience inside the bread factory Paddy McGuinness visits the bread factory he used to work in, and sees how they make 1.4 million loaves a week What's behind the global surrogacy boom? More countries are banning surrogacy â but demand is growing Â© 2025 BBC. The BBC is not responsible for the content of external sites.Read about our approach to external linking."
Primark reopens in Belfast after fire,"This video can not be played 'It's like Christmas coming early' More than 1,000 people queued outside the new Primark store in Belfast when its doors opened on Saturday. Crowd control measures, including crush barriers, were in place outside the new store at Commonwealth House, which opened at 09:00 GMT. The retailer has returned to the city four months after a huge fire destroyed its flagship store at Bank Buildings in August. ""It's like Christmas coming early - I'm ecstatic,"" said one shopper. Another woman said: ""I'm from Comber so I have a Primark in Newtownards but this one is the biggest one - it's Belfast."" New plans for fire-damaged Primark Belfast shopper numbers 'fall' after blaze Earlier this week, atemporary walkway was openedto allow eight businesses to resume trading following the fire. Primark said it was ""committed to a long-term future in Belfast"". ""Today marks a significant milestone for our people, our neighbours and the wider community, as we take the first step to get back to business following the fire at Bank Buildings,"" said company director Ben Mansfield. ""We are confident that our store and the newly-built walkway will help restore footfall in the Castle Street and surrounding area at this critical time, just before Christmas."" This video can not be played Drone footage shows the extent of the destruction caused by the fire at the Bank Buildings Primark was extending into Commonwealth House at the time of the fire. The new Primark store is smaller than the original store, but it still has four floors, 23 cash desks and 25 fitting rooms. By Mark Simpson, BBC News NI Primark spent the day handing out free bags and balloons but they are still not ready to offer any interviews. There is no shortage of questions. What caused the fire? Could more have been done to prevent it? Who is going to pay for all the disruption? For more than 100 days, I have asked for an interview. It is always the same answer: ""A Primark spokesperson is not available for comment."" It is hoped the new store will breathe life back into the city centre following adip in footfall following the blaze. Speaking outside the premises on Castle Street, Belfast Lord Mayor Deirdre Hargey said she hoped it would give the city centre a pre-Christmas increase in footfall. ""It's crucial - this can only help but boost the city,"" she said. ""There are challenges ahead with retail but I suppose in the aftermath of what happened at the fire, it allows us to start to reimagine and rethink what we do with our city centre."" Primark first opened in Belfast in 1975 on Donegall Place. Meanwhile, another new store opened in Belfast on Saturday - discount department store Guineys has moved into the former BHS site in Castle Place. Guineys specialises in homeware and clothing, and it has 11 stores in the Republic of Ireland. Primark cordon costs Translink Â£152k Belfast footfall 'down 60%' from last year Cash for businesses hit by Primark fire Primark donates Â£500,000 to city recovery Wildfire sweeps through Hollywood Hills and threatens landmarks as chaos grips LA Paris Hilton among stars 'heartbroken' as she watches home 'burn to ground' 'Mum waited 31 hours' : Your stories of A&E Sound Of 2025: Ezra Collective are 'keeping music real' The Papers: 'Apocalypse' LA and 'Reeves faces extra tax rises' How Australia's beach cabana drama sparked a turf war H-1B: Visa row under Trump fuels anxiety for Indian dreamers 'I thought I was going to die': Jailed Venezuelan activist details brutality of prison life The man who could become Canada's future PM 'Trump 2.0' looms large over the global economy A politician was shot dead in Bangkok. Did another country do it? Chris Mason: Is Starmer leaving the door open to an abuse inquiry? Delivering brand-new miracles in 1970s East End Watch the latest series of Call the Midwife on iPlayer now Mark-Anthony Turnage shares the soundtrack of his life Once called 'Britainâs hippest composer', he's tackled topics from drug abuse to football in his work Paddyâs loaf-changing experience inside the bread factory Paddy McGuinness visits the bread factory he used to work in, and sees how they make 1.4 million loaves a week What's behind the global surrogacy boom? More countries are banning surrogacy â but demand is growing Â© 2025 BBC. The BBC is not responsible for the content of external sites.Read about our approach to external linking."
Grenfell MP's call over Universal Credit,"Emma Dent Coad says Universal Credit could leave many of her constituents without money over Christmas The MP whose seat is home to Grenfell Tower has urged the government to delay next week's launch of Universal Credit in the area, saying it could leave survivors without income at Christmas. The benefit scheme is due to come to North Kensington, where the blaze left 72 dead, just 13 days before Christmas. The first payment takes five weeks to come through, a situation Emma Dent Coad described as ""unacceptable"". The government said it was providing ""targeted support"" for those affected. Universal credit was designed to make claiming benefits simpler, combining six different payments into one,but has proved controversial, with reports of IT issues, massive overspends and administrative problems. It was due to be rolled out in North Kensington in July 2017 but was delayed following the deadly tower block fire the month before. It is now set to be introduced on Wednesday. Ms Dent Coad, who won the west London constituency of Kensington for Labour in the general election just days before the fire, wrote to then work and pensions secretary Esther McVey on 2 November urging the government not to inflict any more pain on families who had ""already lost so much"". She highlighted problems they had faced last Christmas whensome pay-outs to survivors by the local council were delayed. The MP told BBC News: ""It's unthinkable, they're going to have another Christmas now wondering whether they can afford to buy food, let alone presents for their children."" The Department for Work and Pensions (DWP) said advances of up to 100% were available for people from the first day of their claim. But Ms Dent Coad, who set up a food bank in Kensington, said in her letter that requesting advances for Christmas would leave people facing ""many future months without enough income to cover their expenses"". Ms Dent Coad said her constituents had already 'suffered so much' The leader of Kensington and Chelsea Council Elizabeth Campbell also wrote to Ms McVey in March calling for the roll-out to be halted ""for the foreseeable future"". Maher Khoudair, who suffers from polio, and his family survived the tragedy and now live elsewhere in Kensington. He described the decision to roll out the scheme as ""wrong"" and said he did not know how some people would cope over the festive period. How the tragedy unfolded at Grenfell Tower Who were the victims? Should Universal Credit be paid weekly instead of monthly? A DWP spokesperson said: ""In preparation for Universal Credit roll-out in North Kensington, we have put in place a range of special measures. ""This includes providing targeted support from experienced work coaches and working closely with the local authority and Citizens Advice to offer additional help to people."" The spokesperson also said the DWP ""secured a commitment to have a housing officer co-located in the Jobcentre before roll-out and then on an ongoing basis"" and said the department offered a range of activities at the Curve, a Grenfell community centre, such as IT and employability courses. The DWP is also working with the council to ""further support Grenfell residents"", the spokesperson added. How are universal credit rules changing? MP apologises over 'racist' blog post Why some people on universal credit struggle to budget monthly Unsafe cladding still affects thousands Grenfell Tower was 'unsafe to live in' Road closures disrupting traffic in Harrow in January 2025 All London Underground line and stations closed this weekend listed WATCH: Heartwarming action from King's Guard makes young boy's day All the north London chefs and restaurateurs up for Good Food Guide awards Richmond named one of the best places to retire with its 'sense of belonging' All London Underground line and stations closed this weekend listed Wildfire sweeps through Hollywood Hills and threatens landmarks as chaos grips LA Paris Hilton among stars 'heartbroken' as she watches home 'burn to ground' 'Mum waited 31 hours' : Your stories of A&E Sound Of 2025: Ezra Collective are 'keeping music real' The Papers: 'Apocalypse' LA and 'Reeves faces extra tax rises' How Australia's beach cabana drama sparked a turf war H-1B: Visa row under Trump fuels anxiety for Indian dreamers 'I thought I was going to die': Jailed Venezuelan activist details brutality of prison life The man who could become Canada's future PM 'Trump 2.0' looms large over the global economy A politician was shot dead in Bangkok. Did another country do it? Chris Mason: Is Starmer leaving the door open to an abuse inquiry? Delivering brand-new miracles in 1970s East End Watch the latest series of Call the Midwife on iPlayer now Mark-Anthony Turnage shares the soundtrack of his life Once called 'Britainâs hippest composer', he's tackled topics from drug abuse to football in his work Paddyâs loaf-changing experience inside the bread factory Paddy McGuinness visits the bread factory he used to work in, and sees how they make 1.4 million loaves a week What's behind the global surrogacy boom? More countries are banning surrogacy â but demand is growing Â© 2025 BBC. The BBC is not responsible for the content of external sites.Read about our approach to external linking."
Japan eases rules for foreign workers,"Japan will allow some foreigners to work in construction and other sectors Japan's parliament has approved a controversial new law allowing hundreds of thousands of foreigners into the country to ease labour shortages. From next April foreigners will be allowed to take up jobs in sectors such construction, farming and nursing. Japan has traditionally been wary of immigration but the government says more foreigners are needed because of Japan's ageing population. Opposition parties say the law risks exposing newcomers to exploitation. Under the new system, more than 300,000 foreigners could be allowed to work in sectors facing a labour crunch. The law creates two new visa categories. Workers in the first category will be allowed in for five years if they have a certain level of skill and some proficiency in Japanese. The economic lessons Japan can teach the West Trending in Japan: Restless retirees Workers with a higher level of skills would qualify for the second visa category and would eventually be allowed to apply for residency. The opposition has argued that an influx of foreign workers would depress wages and lead to exploitation of migrant labour. The BBC's Rupert Wingfield-Hayes in Tokyo says the current programme of ""technical training"" for low-skilled foreign workers is open to abuse by unscrupulous employers. Businesses in Japan have long argued for changes to immigration rules to recruit workers from other countries. But Prime Minister Shinzo Abe has stressed the proposed law is not an overhaul of immigration policy and Japan will only accept foreigners ""who have specific skills and can work immediately to address serious labour shortages, only in sectors that genuinely need them"". Japan's fertility rate dropped below 2.1 childbirths per woman - replacement level - in the 1970s and now stands at around 1.4.  The country also has one of the world's longest life expectancies (85.5). Japan may relax rules for foreign workers Immigrants held in Japan on hunger strike Why does Japan accept so few refugees- - BBC News Wildfire sweeps through Hollywood Hills and threatens landmarks as chaos grips LA Paris Hilton among stars 'heartbroken' as she watches home 'burn to ground' 'Mum waited 31 hours' : Your stories of A&E Sound Of 2025: Ezra Collective are 'keeping music real' The Papers: 'Apocalypse' LA and 'Reeves faces extra tax rises' How Australia's beach cabana drama sparked a turf war H-1B: Visa row under Trump fuels anxiety for Indian dreamers 'I thought I was going to die': Jailed Venezuelan activist details brutality of prison life The man who could become Canada's future PM 'Trump 2.0' looms large over the global economy A politician was shot dead in Bangkok. Did another country do it? Chris Mason: Is Starmer leaving the door open to an abuse inquiry? Delivering brand-new miracles in 1970s East End Watch the latest series of Call the Midwife on iPlayer now Mark-Anthony Turnage shares the soundtrack of his life Once called 'Britainâs hippest composer', he's tackled topics from drug abuse to football in his work Paddyâs loaf-changing experience inside the bread factory Paddy McGuinness visits the bread factory he used to work in, and sees how they make 1.4 million loaves a week What's behind the global surrogacy boom? More countries are banning surrogacy â but demand is growing Â© 2025 BBC. The BBC is not responsible for the content of external sites.Read about our approach to external linking."
VideoBackpacker's father speaks in Auckland,"This video can not be played The father of missing backpacker Grace Millane has appealed for anyone with information about his daughter's disappearance to come forward. The 22-year-old, from Essex, vanished in New Zealand six days ago. She was last seenat a hotel with a ""male companion"", according to police. Speaking to the press in Auckland, David Millane said his daughter was a ""lovely"" and ""family-orientated"" person. Fighting back the tears, he said: ""As a family we've been extremely concerned for her welfare."" Detectives in Auckland said they had spoken to the man and identified an apartment at the Citylife Hotel as a location of interest. Backpacker's father appeals for help. Video, 00:00:41Backpacker's father appeals for help Up Next. Corrie Mckeague's mother shares video. Video, 00:00:24Corrie Mckeague's mother shares video Father's appeal over missing student. Video, 00:01:05Father's appeal over missing student Fires reach Hollywood with fears iconic sign could be at risk. Video, 00:01:10Fires reach Hollywood with fears iconic sign could be at risk Day two of LA fires: Inferno skies and charred homes. Video, 00:01:19Day two of LA fires: Inferno skies and charred homes Moment friends abandon house as Palisades fire closes in. Video, 00:00:35Moment friends abandon house as Palisades fire closes in Ros Atkins on...Trump's threats to Greenland. Video, 00:01:43Ros Atkins on...Trump's threats to Greenland Timelapse shows rapid spread of Palisades wildfire. Video, 00:00:43Timelapse shows rapid spread of Palisades wildfire Jimmy Carter lies in state after procession to US Capitol. Video, 00:02:02Jimmy Carter lies in state after procession to US Capitol Man trapped inside driverless car as it spins in circles. Video, 00:01:41Man trapped inside driverless car as it spins in circles Ros Atkins on...Elon Musk's political interventions. Video, 00:02:26Ros Atkins on...Elon Musk's political interventions Race to find survivors after deadly Tibet earthquake. Video, 00:00:43Race to find survivors after deadly Tibet earthquake Â© 2025 BBC. The BBC is not responsible for the content of external sites.Read about our approach to external linking."
