headline,article
French company fined over weight loss pill deaths,"A French drug maker has been found guilty of aggravated deceit and involuntary manslaughter over a weight loss pill at the centre of a major health scandal. The drug Mediator was developed for use in overweight diabetics and was on the market for 33 years. It was eventually withdrawn in 2009 over concerns it could cause serious heart problems. Hundreds of people are believed to have died as a result of the drug. Around five million people were prescribed the medicine over the course of three decades, despite various warnings over its side effects. French trial on fatal weight-loss drug begins France braced for drug scandal report France pledges drug system reform Thousands of plaintiffs were involved in the trial, which began in 2019. Drug maker Servier had denied any knowledge of Mediator's side effects but a court on Monday issued it with a fine of  €2.7m (£2.3m, $3.2m). ""Although they knew about the risks for many years... they never took the necessary measures,"" judge Sylvie Daunis said. The company's former deputy chairman, Jean-Philippe Seta, was also given a four-year suspended prison sentence. France's medical regulator, meanwhile, was fined more than €300,000 for its role in the scandal. The judge found the body had ""seriously failed"" in its duties, according to the AFP news agency. Ahead of Monday's verdict, French pulmonologist Dr Irène Frachon, who is credited with exposing the drug's side effects, told AFP that she hoped the ruling would ""give us the tools to understand how such deceit could have gone on for so long"". A number of other European countries, including Italy and Spain, banned Mediator in the early 2000s. In France, however, it continued to be offered to diabetics and other patients as an appetite suppressant. One study concluded that 500 deaths could be linked to Mediator between 1976 and 2009. A second one put the figure at 2,000. This video can not be played How to 'hack' the ageing process French trial on fatal weight-loss drug begins France braced for drug scandal report France pledges drug system reform Deadly wildfires rage across LA as fierce winds threaten more destruction What's the latest on the LA fires, and why can't they be put out? Danes struggle with response to Trump Greenland threat 'I paid fake doctor thousands for fillers - now I look like a gargoyle' The Papers: 'Lost Angeles' and 'Musk seeks plan to oust Starmer' Pop star Chappell Roan wins BBC Sound Of 2025 Weekly quiz: Zendaya looked happy but who else sparkled at the Golden Globes? The 20 child abuse inquiry proposals - what has happened so far? The '9/11 mastermind' wants to plead guilty. Why is the US trying to stop him? Why are UK borrowing costs rising and what does it mean for me? In maps: Thousands of acres on fire in LA Before and after: How wildfires tore through LA Ed Gamble hosts the official Traitors podcast Join Ed Gamble and guests as they dissect the first episodes of The Traitors! Can art, music and words bind us in divided times? Simon Schama explores how artists have captured the transformations of British society since 1945 Enjoy a satirical smorgasbord of The News Quiz Digest a dramatic year of news as Andy Zaltzman revels in some of 2024's funniest moments The multi-award-winning legal drama returns Two years on, the Defoes are back and have gathered for a beautiful wedding in Barcelona © 2025 BBC. The BBC is not responsible for the content of external sites.Read about our approach to external linking."
Labour calls for watchdog to probe Greensill role,"David Cameron stepped down as PM after the Brexit referendum in 2016 Labour has called on a standards watchdog to investigate the extent of government access offered to financial services firm Greensill Capital. The party wants the Committee on Standards in Public Life to examine the role played by the firm's founder in David Cameron's coalition government. The Sunday Times claimed Lex Greensill had been given ""privileged access"" to Whitehall departments under the ex-PM. Neither Mr Greensill nor Mr Cameron has commented on the matter. Minister defends Cameron as 'a man of integrity' Labour seeks probe over Cameron Greensill lobbying Ex-PM Cameron cleared by lobbying watchdog Labour said the reports raised questions about transparency rules. Business Secretary Kwasi Kwarteng told BBC Radio 4's Today programme there was ""no suggestion"" the former prime minister ""could not pursue another career after politics"". He added that he did not think Mr Cameron ""did anything wrong"", but the government was ""always reviewing the rules"" and ""looking at new circumstances... trying to improve the existing rules and improve the system"". In its letter, Labour asked the committee to examine Mr Cameron's reported role in lobbying the government on behalf of the firm after he left office. It has previously been reported that Mr Cameron, who became an adviser to Greensill in 2018, unsuccessfully tried to increase the specialist bank's involvement in a scheme offering government-backed loans to companies struggling due to the Covid pandemic. Greensill, which went bust recently, wasaccredited to supply,externallending under the government's Coronavirus Large Business Interruption Loan Scheme (CLBILS). Mr Cameron wascleared this weekby a lobbying watchdog, which looked at whether he should have declared himself on the register of consultant lobbyists over work he had done for the firm since leaving Downing Street. Over the weekend, the Sunday Times reported that Greensill's founder, Lex Greensill, was given access to various government departments during Mr Cameron's time in No 10. The newspaper said Mr Greensill had been promoting a financial product for pharmacists. The Pharmacy Early Payment Scheme, announced in 2012, saw banks swiftly reimburse pharmacists for providing NHS prescriptions, for a fee, before recovering the money from the government. Greensill Capital went on to provide funds for the scheme. Labour said the reports raised ""serious questions about the level of extensive access to ministers and departments he was granted and the role Mr Cameron played in securing it"". In a letter to its chair, independent peer Lord Evans, the party said the Committee on Standards in Public Life should ask why Mr Greensill's role promoting the scheme had not been ""announced internally or publicly"". Shadow chancellor Anneliese Dodds, who co-wrote Labour's letter along with shadow Cabinet Office minister Rachel Reeves, also called on the committee to look into the decision to accredit Greensill to the CLBILS loan scheme. The pair suggested the committee should look at ""whether proper due diligence was undertaken on the firm's financial health by government"". They added that taxpayers ""deserve to know the true extent of access to this current Conservative government that was afforded to Greensill Capital through the former prime minister"". Replying to their letter, Lord Evans said his committee ""is an advisory body and does not have a remit to investigate individual cases"". But he added the committee would welcome suggestions from the party on improving transparency rules as part of an existing inquiry due to report in the autumn. A government spokesman said Mr Greensill had previously acted as a supply-chain finance adviser and crown representative - adding the appointment had been unpaid and was approved in the normal manner. Labour seeks probe over Cameron Greensill lobbying Deadly wildfires rage across LA as fierce winds threaten more destruction What's the latest on the LA fires, and why can't they be put out? Danes struggle with response to Trump Greenland threat 'I paid fake doctor thousands for fillers - now I look like a gargoyle' The Papers: 'Lost Angeles' and 'Musk seeks plan to oust Starmer' Pop star Chappell Roan wins BBC Sound Of 2025 Weekly quiz: Zendaya looked happy but who else sparkled at the Golden Globes? The 20 child abuse inquiry proposals - what has happened so far? The '9/11 mastermind' wants to plead guilty. Why is the US trying to stop him? Why are UK borrowing costs rising and what does it mean for me? In maps: Thousands of acres on fire in LA Before and after: How wildfires tore through LA Ed Gamble hosts the official Traitors podcast Join Ed Gamble and guests as they dissect the first episodes of The Traitors! Can art, music and words bind us in divided times? Simon Schama explores how artists have captured the transformations of British society since 1945 Enjoy a satirical smorgasbord of The News Quiz Digest a dramatic year of news as Andy Zaltzman revels in some of 2024's funniest moments The multi-award-winning legal drama returns Two years on, the Defoes are back and have gathered for a beautiful wedding in Barcelona © 2025 BBC. The BBC is not responsible for the content of external sites.Read about our approach to external linking."
Suez Canal reopens after stranded ship is freed,"This video can not be played (29 March 2021) The stranded container ship is seen finally on the move and no longer blocking the canal Traffic has resumed in Egypt's Suez Canal after a stranded container ship blocking it for nearly a week was finally freed by salvage crews. Tug boats honked their horns in celebration as the 400m-long (1,300ft) Ever Given was dislodged on Monday with the help of dredgers. Hundreds of ships are waiting to pass through the canal which links the Mediterranean to the Red Sea. It is one of the world's busiest trade routes. The cost of the Suez Canal blockage How do you refloat a giant cargo ship? In pictures: Efforts to shift huge ship from canal Peter Berdowski, CEO of Dutch salvage company Boskalis, said the Ever Given had been refloated at 15:05 (13:05 GMT) on Monday, ""thereby making free passage through the Suez Canal possible again"". Egyptian officials say the backlog of ships waiting to transit through should be cleared in around three days, but experts believe the knock-on effect on global shipping could take weeks or even months to resolve. The Ever Given on the move on Monday Salvage teams had faced a daunting challenge after the 200,000-tonne ship ran aground last Tuesday morning in high winds and a sandstorm which reduced visibility. A Dutch specialist team, SMIT, oversaw a flotilla of 13 tugs, small but powerful vessels that can shift large ships, as they tried to dislodge the Ever Given. Dredgers were brought in and dug 30,000 cubic metres of mud and sand from beneath the ends of the ship. Over the weekend, it was feared that some of the ship's cargo of some 18,000 containers would have to be removed in order to lighten the load. But high tides helped the tugs and dredgers in their work and early on Monday, the stern (rear of the ship) was freed and the great ship swung across the canal, to shouts of celebration. Hours later, the bow (front) too came unstuck, and the Ever Given was able to move out. The vessel was towed to the Great Bitter Lake, which sits between two sections of the canal to the north of the salvage site, where it will undergo safety checks. A marine source told Reuters news agency on Monday evening that ships were travelling southwards towards the Red Sea while canal services provider Leth Agencies said vessels had resumed transit from the Great Bitter Lake. Some ships have already left the region, preferring to take an alternative, longer route around the southern tip of Africa. Inevitably, cargoes will be reaching their destination much later than planned. There may be congestion when they arrive in port, while future sailing schedules have been thrown into disarray, The cost of shipping goods to Europe is expected to rise as a result, BBC Business Correspondent Theo Leggett reports. Shipping group Maersk saidthe ""ripple effects on global capacity and equipment"" were significant,external. ""There'll be an investigation, clearly, because this has had such a big impact and exactly what's happened here, I think, will be debated for some time,"" Marcus Baker, global head of marine and cargo at Marsh Inc, told Reuters. ""What do we do going forward to ensure it doesn't happen again? Again, I would leave that to the competent authorities that are in Egypt to decide how they want to make sure that traffic transits safely through the canal because, look, it's in their interest to do that."" By Sally Nabil, BBC Arabic bilingual correspondent, Port of Suez Spirits here are quite high. There's a strong sense of achievement. Some experts had warned that it might take weeks to free the Ever Given. But the high tide, as well as the specialist equipment brought in, all helped the rescue operation. Now the authorities will have to address another challenge - congestion. The head of the Suez Canal Authority said that hundreds of stranded vessels would be allowed through the canal on a first-come-first-served basis, though there might be some exceptions to specific ships, based on the types of goods on board. The blockage put the authorities under immense pressure, given the major impact it had on global trade. For Egyptians, the canal is not only a source of national pride, but it also provides the economy with much needed foreign currency. A couple of days ago, I asked Osama Rabie, the head of the Suez Canal Authority, whether he was concerned that some shipping companies might be discouraged from sending such giant ships through the canal in the future. He replied that there was no alternative to the Suez Canal, which he said was fast and safe. So, it's not just about time here, but also about security. It will now undergo a full inspection at the Great Bitter Lake, the vessel's technical managers, Bernhard Schulte Shipmanagement, said. It said there had been no reports of pollution or cargo damage, and initial investigations had ruled out any mechanical or engine failure as a cause of the grounding last week. The ship's Indian crew of 25 remaining aboard the vessel are safe and in good health, BSM said, adding: ""Their hard work and tireless professionalism are greatly appreciated."" The ship's containers are carrying a huge variety of items and the insured value of the cargo is believed to amount to hundreds of millions of dollars. Comments can not be loaded To load Comments you need to enable JavaScript in your browser Deadly wildfires rage across LA as fierce winds threaten more destruction What's the latest on the LA fires, and why can't they be put out? Danes struggle with response to Trump Greenland threat 'I paid fake doctor thousands for fillers - now I look like a gargoyle' The Papers: 'Lost Angeles' and 'Musk seeks plan to oust Starmer' Pop star Chappell Roan wins BBC Sound Of 2025 Weekly quiz: Zendaya looked happy but who else sparkled at the Golden Globes? The 20 child abuse inquiry proposals - what has happened so far? The '9/11 mastermind' wants to plead guilty. Why is the US trying to stop him? Why are UK borrowing costs rising and what does it mean for me? In maps: Thousands of acres on fire in LA Before and after: How wildfires tore through LA Ed Gamble hosts the official Traitors podcast Join Ed Gamble and guests as they dissect the first episodes of The Traitors! Can art, music and words bind us in divided times? Simon Schama explores how artists have captured the transformations of British society since 1945 Enjoy a satirical smorgasbord of The News Quiz Digest a dramatic year of news as Andy Zaltzman revels in some of 2024's funniest moments The multi-award-winning legal drama returns Two years on, the Defoes are back and have gathered for a beautiful wedding in Barcelona © 2025 BBC. The BBC is not responsible for the content of external sites.Read about our approach to external linking."
UK 'fill and finish' Novavax vaccine deal agreed,"This video can not be played Boris Johnson: ""We're building up our own long-term UK manufacturing capabilities"" Tens of millions of doses of the Novavax vaccine will now be produced and packaged in north-east England, the prime minister has announced. Boris Johnson said a deal had been agreed with GlaxoSmithKline (GSK) to bottle 60 million doses at its facility in Barnard Castle, County Durham. GSK said it hoped the ""fill and finish"" process can begin as early as May. In January, it was announced the vaccine would bemanufactured at the Fujifilm plant in Billingham. Novavax is currently being assessed by the Medicines and Healthcare products Regulatory Agency. The biotech company behind it, also called Novavax, recently announced its vaccine was 86% effective against the Kent variant of Covid-19 and 96% effective in preventing cases caused by the original strain. Mr Johnson said: ""I'm delighted by GSK's investment, which shows the strength of UK manufacturing, and will further boost our vaccine rollout. ""The Vaccines Taskforce has worked hand in glove with business to successfully deliver vaccines to the whole of the UK, and this agreement will continue to support our approach. ""We remain on track to offer a first jab to all over 50s by 15 April, and all adults by the end of July, and I want to once again encourage everyone to come forward for a vaccine when you're called."" The news that the Novavax vaccine is going to go through a process known as fill and finish in the UK is an interesting development. Fill and finish is the process by which vaccines are packaged up in vials, ready to be sent out to vaccination clinics. The original plan was for this to be done in Europe once the vaccine product was manufactured by plants in the north east. But a deal has been struck with drug firm GSK to do that here. Officially, the government is saying that it is all part of their investment in the British life science industry. But given the threats from Europe about restricting exports of vaccines, it begs all sorts of other questions too. The north east plants have already started manufacturing the 60m doses ordered by the government. If it gets approval by the regulator - expected in the coming weeks - supplies could be available in June. Roger Connor, president of GSK vaccines, said: ""GSK is delighted to support Novavax and the UK Vaccines Taskforce with this manufacturing arrangement for the UK and our Barnard Castle facility is now undertaking the rapid preparation work required to manufacture up to 60 million doses of this vaccine. ""We have ensured that we can deliver these volumes without impacting supply of our other vital medicines and vaccines, and without disruption to the other Covid-19 collaborations GSK is engaged in globally."" Follow BBC North East & Cumbria onTwitter,external,Facebook,externalandInstagram,external. Send your story ideas tonortheastandcumbria@bbc.co.uk,external Novavax Covid jab shows 89% efficacy in UK trials Comments can not be loaded To load Comments you need to enable JavaScript in your browser Man in tracksuit 'slashes two car tyres' as police share CCTV image appeal Woman arrested in connection to Darlington vehicle damage Hartlepool Police seize this 'unroadworthy' car just yards from their own station Support your local Hospice and win £2025 for 2025! Hospitals appeal for unwanted electronic devices for maternity patients North East students brave freezing sea to raise funds for Cambodian health Deadly wildfires rage across LA as fierce winds threaten more destruction What's the latest on the LA fires, and why can't they be put out? Danes struggle with response to Trump Greenland threat 'I paid fake doctor thousands for fillers - now I look like a gargoyle' The Papers: 'Lost Angeles' and 'Musk seeks plan to oust Starmer' Pop star Chappell Roan wins BBC Sound Of 2025 Weekly quiz: Zendaya looked happy but who else sparkled at the Golden Globes? The 20 child abuse inquiry proposals - what has happened so far? The '9/11 mastermind' wants to plead guilty. Why is the US trying to stop him? Why are UK borrowing costs rising and what does it mean for me? In maps: Thousands of acres on fire in LA Before and after: How wildfires tore through LA Ed Gamble hosts the official Traitors podcast Join Ed Gamble and guests as they dissect the first episodes of The Traitors! Can art, music and words bind us in divided times? Simon Schama explores how artists have captured the transformations of British society since 1945 Enjoy a satirical smorgasbord of The News Quiz Digest a dramatic year of news as Andy Zaltzman revels in some of 2024's funniest moments The multi-award-winning legal drama returns Two years on, the Defoes are back and have gathered for a beautiful wedding in Barcelona © 2025 BBC. The BBC is not responsible for the content of external sites.Read about our approach to external linking."
UK 'fill and finish' Novavax vaccine deal agreedA deal is agreed to support the manufacturing of 60 million vaccine doses in North-East England.,"This video can not be played Boris Johnson: ""We're building up our own long-term UK manufacturing capabilities"" Tens of millions of doses of the Novavax vaccine will now be produced and packaged in north-east England, the prime minister has announced. Boris Johnson said a deal had been agreed with GlaxoSmithKline (GSK) to bottle 60 million doses at its facility in Barnard Castle, County Durham. GSK said it hoped the ""fill and finish"" process can begin as early as May. In January, it was announced the vaccine would bemanufactured at the Fujifilm plant in Billingham. Novavax is currently being assessed by the Medicines and Healthcare products Regulatory Agency. The biotech company behind it, also called Novavax, recently announced its vaccine was 86% effective against the Kent variant of Covid-19 and 96% effective in preventing cases caused by the original strain. Mr Johnson said: ""I'm delighted by GSK's investment, which shows the strength of UK manufacturing, and will further boost our vaccine rollout. ""The Vaccines Taskforce has worked hand in glove with business to successfully deliver vaccines to the whole of the UK, and this agreement will continue to support our approach. ""We remain on track to offer a first jab to all over 50s by 15 April, and all adults by the end of July, and I want to once again encourage everyone to come forward for a vaccine when you're called."" The news that the Novavax vaccine is going to go through a process known as fill and finish in the UK is an interesting development. Fill and finish is the process by which vaccines are packaged up in vials, ready to be sent out to vaccination clinics. The original plan was for this to be done in Europe once the vaccine product was manufactured by plants in the north east. But a deal has been struck with drug firm GSK to do that here. Officially, the government is saying that it is all part of their investment in the British life science industry. But given the threats from Europe about restricting exports of vaccines, it begs all sorts of other questions too. The north east plants have already started manufacturing the 60m doses ordered by the government. If it gets approval by the regulator - expected in the coming weeks - supplies could be available in June. Roger Connor, president of GSK vaccines, said: ""GSK is delighted to support Novavax and the UK Vaccines Taskforce with this manufacturing arrangement for the UK and our Barnard Castle facility is now undertaking the rapid preparation work required to manufacture up to 60 million doses of this vaccine. ""We have ensured that we can deliver these volumes without impacting supply of our other vital medicines and vaccines, and without disruption to the other Covid-19 collaborations GSK is engaged in globally."" Follow BBC North East & Cumbria onTwitter,external,Facebook,externalandInstagram,external. Send your story ideas tonortheastandcumbria@bbc.co.uk,external Novavax Covid jab shows 89% efficacy in UK trials Comments can not be loaded To load Comments you need to enable JavaScript in your browser Man in tracksuit 'slashes two car tyres' as police share CCTV image appeal Woman arrested in connection to Darlington vehicle damage Hartlepool Police seize this 'unroadworthy' car just yards from their own station Support your local Hospice and win £2025 for 2025! Hospitals appeal for unwanted electronic devices for maternity patients North East students brave freezing sea to raise funds for Cambodian health Deadly wildfires rage across LA as fierce winds threaten more destruction What's the latest on the LA fires, and why can't they be put out? Danes struggle with response to Trump Greenland threat 'I paid fake doctor thousands for fillers - now I look like a gargoyle' The Papers: 'Lost Angeles' and 'Musk seeks plan to oust Starmer' Pop star Chappell Roan wins BBC Sound Of 2025 Weekly quiz: Zendaya looked happy but who else sparkled at the Golden Globes? The 20 child abuse inquiry proposals - what has happened so far? The '9/11 mastermind' wants to plead guilty. Why is the US trying to stop him? Why are UK borrowing costs rising and what does it mean for me? In maps: Thousands of acres on fire in LA Before and after: How wildfires tore through LA Ed Gamble hosts the official Traitors podcast Join Ed Gamble and guests as they dissect the first episodes of The Traitors! Can art, music and words bind us in divided times? Simon Schama explores how artists have captured the transformations of British society since 1945 Enjoy a satirical smorgasbord of The News Quiz Digest a dramatic year of news as Andy Zaltzman revels in some of 2024's funniest moments The multi-award-winning legal drama returns Two years on, the Defoes are back and have gathered for a beautiful wedding in Barcelona © 2025 BBC. The BBC is not responsible for the content of external sites.Read about our approach to external linking."
