headline,article
The path from violent crime to killer,"Westminster attacker Khalid Masood had a history of violence, but how typical is his past of those who go on to carry out acts of terror? Masood, 52, who has been claimed by so-called Islamic State as a ""soldier of the Caliphate"", had spent time in prison for offences including violent assaults and possession of offensive weapons. In one instance, when in his mid-30s, Masood slashed a man's face with a knife following an argument in a pub, for which he served two years. While this criminal past may contradict stereotypes of those involved in religious extremism, Masood is only the latest manifestation of a criminal-turned-jihadist. Throughout Europe, there has been a pattern of criminals being drawn to violent jihad. Those who travel to Syria as foreign fighters are typically already known to police for something other than extremism. Khalid Masood had been jailed for violent crimes In Germany, two-thirds of foreign fighters had criminal records and more than half of those from Belgium and the Netherlands had a similar background. Among perpetrators of terrorist attacks, criminal pasts are also common. Berlin Christmas market attacker Anis Amrihad convictions for theft and violence, and had sold cocaine in the months before the attack. Among theperpetrators of the November 2015 Paris attacks, a number had previous convictions for robberies and drug dealing. This is no mere coincidence, as the extremist narrative often resonates with criminals. What we know about attacker Khalid Masood Who were the victims of the attack? More stories on the attack and aftermath,external At the International Centre for the Study of Radicalisation (ICSR) in King's College London, we recently published a report analysing the criminal backgrounds of European jihadists and found their radicalisation is often linked to their criminality. Indeed, jihadism is sometimes used to legitimise further crime against ""non-believers"", with some extremists stating that crime and violence is permissible when living in the West. They also claim that jihadism offers redemption from previous sins, the search for which typically comes after a period of crisis in the perpetrators' lives. That crisis is often prompted by criminality - such as being imprisoned - but it need not be. Masood crashed his car into railings outside Parliament However, it is striking that Masood does not fit the typical profile of a criminal-turned-jihadist, simply due to his age of 52. Older jihadists are usually more involved in extremist support networks - as radicalisers and recruiters, rather than as attackers. While Theresa May said Masood had been investigated in relation to concerns about violent extremism, he was considered a peripheral figure and was not part of current investigations into extremism. In one crucial respect, however, Masood does fit the picture of the criminals-turned-jihadists that we have examined - he was familiar with violence. If a terrorist has a criminal background, it is very often a violent one. Stabbings, assaults, and violent behaviour are recurrent patterns amongst perpetrators of terrorist attacks with existing criminal records. This violent group is disproportionately represented when compared with those convicted of non-violent crimes. For Masood, this familiarity with personal violence may have made the ""jump"" into ideologically motivated violence that much smaller than it would otherwise have been. Rajan Basra is a Research Fellow at the International Centre for the Study of Radicalisation, in the Department of War Studies, at King's College London. Follow him@rajanbasra,external Get news from the BBC in your inbox, each weekday morning,external The victims of the Westminster terror attack Security of Parliament under microscope The attack the UK has been preparing for ICSR at King's College LA firefighters say 'no possibility' of containing blazes as fifth wildfire breaks out Inside the neighbourhood totally lost in LA fires Starmer and Badenoch clash over call for grooming inquiry How Canada's immigration debate soured - and helped seal Trudeau's fate 'I can't get divorced as I can't get my pension valued' BBC Sound of 2025: Barry Can't Swim is a new dance music superstar Ros Atkins on...Elon Musk's political interventions A journalist's murder highlights risks of reporting in small-town India Jean-Marie Le Pen - founder of French far right and 'Devil of the Republic' Cases of HMPV are on the rise in China - but what is it? Cryptocurrencies and personal AI: Tech to watch out for in 2025 Politics Essential: Get the latest news and analysis delivered to your inbox every weekday Delivering brand-new miracles in 1970s East End Watch the latest series of Call the Midwife on iPlayer now Mark-Anthony Turnage shares the soundtrack of his life Once called 'Britainâs hippest composer', he's tackled topics from drug abuse to football in his work Paddyâs loaf-changing experience inside the bread factory Paddy McGuinness visits the bread factory he used to work in, and sees how they make 1.4 million loaves a week What's behind the global surrogacy boom? More countries are banning surrogacy â but demand is growing Â© 2025 BBC. The BBC is not responsible for the content of external sites.Read about our approach to external linking."
IS leaves trail of destruction in Palmyra,"This video can not be played Lyse Doucet surveys the damage to Palmyra's Roman-era theatre Fariha remembers the exact moment when Islamic State fighters shattered her life in Palmyra. ""It was a quarter to five in the morning. We were asleep and heard a knock on the door,"" she tells me as we sit on thin, grey mattresses in an abandoned school in Homs, 160km (99 miles) from her home. This makeshift shelter, in the ruins of a Homs neighbourhood, is a refuge for her and five children, as well as 29 other families, who fled the brutal rule of so-called Islamic State (IS). ""They shouted at me to cover myself then entered my house, weapons in hand, and took away my husband and niece,"" she recalls as her little ones huddle close, listening, wide-eyed and silent. Her 15-year-old nephew and her brother-in-law were also taken at that fateful time when IS first stormed Palmyra in 2015. They had their throats cut. ""They killed a lot of young men,"" Fariha adds, in her softly-spoken story of unspeakable savagery. As IS loses ground in northern Syria, more and more gruesome accounts are emerging of their catalogue of crimes. IS militants have destroyed large parts of the historic site Damage to the Roman-era theatre is clear to see Families like Fariha's suffered twice over when IS lost, and then recaptured, the Roman ruins of Palmyra and the adjacent city. Now, after a second occupation, lasting only three months, the area was seized a few weeks ago by Syrian forces, bolstered by the blistering firepower of their Russian and Iranian allies. Palmyra's deserted buildings now yield evidence of its dark chapter. In the blackened basement of one villa, Syrian soldiers show us what they describe as a makeshift court room. Lyse Doucet examines Islamic State paperwork condemning people to death Mounds of blue files strewn across the floor are a measure of IS's scales of justice. On one file after another, there's the same small word scribbled in Arabic: ""qatl"" - executed. It was the fate of a woman named Farizha for ""spreading corruption on earth"". Marwan met the same end for ""turning from Islam"". Others faced floggings or fines. Two men, both named Ahmed, were sentenced to be ""thrown off the top of a building"". No reason is listed on their joint file. A sheet of paper taped outside the door, stamped with an IS seal of authority, notifies ""everyone who lives in this state that they must enrol in a course to learn about Sharia law"". ""Everyone who doesn't will be punished."" IS rule is over here. But with homes destroyed, and without electricity or water, Palmyra still isn't a place fit to live in, or safe to return to. Now both ancient and modern Palmyra are ruins. The modern part of Palmyra is also in ruins What was once a vibrant community of 75,000 is now an eerie ghost town. Charred buildings peppered with bullet marks and gaping holes scar every street. People fled not just IS persecution but an urban battlefield including ferocious bombardment by Syrian and Russian warplanes, which flattened multi-storey buildings into stacks of concrete pancakes. Palmyra's pain did not start or end with IS occupation. Its prison, known by the city's Arabic name Tadmur, was a symbol of torture and summary executions long before Syria's uprising began six years ago. Syrian soldiers now go house-to-house searching for explosives and booby traps. Russian troops, camped on the outskirts of the city, are helping to demine the area. The site of the ancient Roman city nearby stands as a stark tribute to Palmyra's survival. Despite the destruction of iconic structures such as the 2,000-year-old Arch of Triumph, Palmyra's elegant colonnaded street and striking symmetrical designs are still breathtaking. The legacy of IS in Palmyra casts a long shadow IS's return had bestowed a second chance to destroy more precious world heritage, but much of these monumental ruins still stand. The circular Roman theatre was their prime target in January. Its imposing centrepiece, a carved facade, was smashed, leaving a jumble of jagged stone boulders on its ancient stage. ""This was their revenge for the concerts staged here by Russia's Red Army Orchestra as well as Syrian orchestras,"" explains a government official, who accompanies us to the site. A dusty pile of glass candle holders wrapped in netting, and red plastic roses caked with dirt, are still tucked in some corners - mementos of the triumphal events in May 2016 when IS was defeated here the first time. There is still evidence of the celebrations after the first defeat of IS ""Recapturing Palmyra the second time was relatively easy,"" says Syrian officer Colonel Malik who fought in both rounds. ""The battles were more ferocious the first time."" Palmyra last fell into IS hands in December as the Syrian military was distracted by the last stages of the brutal battle for Aleppo and IS's ranks were reinforced by fighters fleeing frontlines in Mosul, crossing the border from neighbouring Iraq. ""I don't think we face the threat of losing Palmyra again,"" Colonel Malik tells me confidently as we stand outside the walls of the grand theatre. ""We've retaken the military airport nearby and the mountains, a space of nearly 70 sq km in less than a month, which proves IS is weakening now."" But harder battles, including an assault on IS's self-declared capital in Raqqa, still lie ahead. Confronting IS in their Syrian lair, closer to the Turkish and Iraqi borders, takes the fight onto messier and potentially dangerous political turf. Hundreds of American special forces, backed up artillery and airpower, recently moved into this theatre of war to bolster an array of Syrian Kurdish forces, as well as Arab fighters. Turkish troops are already on the battlefield, playing key roles over the past year in attacks on other IS-held towns. All these commands face a common enemy, but also deep seated rivalries and shifting alliances. The new US administration is still weighing how to balance a vital relationship with Turkey's President Erdogan while still making use of valuable Syrian Kurdish fighters Turkey sees as its enemy. Turkey moved closer to Russia over the past year, but they're still on opposite sides of this war with Ankara insisting President Assad's continuing rule is what's fuelling this conflict. The biggest question is whether President Trump's team, for whom fighting IS is the main goal, will now co-ordinate with Russia, which would end up strengthening President Assad's axis including Iran. ""The Syrian government's decision is to take back every inch of Syrian soil,"" insists Col Malik. ""Those criminals who infiltrated our country were supported by foreign countries like the US and the UK,"" he says, repeating the government's refrain that all rebel groups are creations of Western and Arab states. ""They're supporting, not fighting IS."" The same accusation is levelled against President Bashar al-Assad by the Syrian opposition and its allies who charge him with turning a blind eye to IS's advance to bolster his narrative that this is a global war against terrorism, not a fight for political change. The days of IS occupation may be counted, but its legacy casts a long shadow over a punishing war whose end is still nowhere in sight. Palmyra damage revealed by drone. Video, 00:00:37Palmyra damage revealed by drone Images show Palmyra temple destruction. Video, 00:00:59Images show Palmyra temple destruction Palmyra temple damage an 'appalling loss' Video, 00:01:03Palmyra temple damage an 'appalling loss' Palmyra archaeologist 'killed by IS' Video, 00:01:05Palmyra archaeologist 'killed by IS' Cruickshank: 'Palmyra's fall to IS appalling' Video, 00:01:35Cruickshank: 'Palmyra's fall to IS appalling' Why does IS destroy ancient history? Video, 00:01:00Why does IS destroy ancient history? LA firefighters say 'no possibility' of containing blazes as fifth wildfire breaks out Inside the neighbourhood totally lost in LA fires Starmer and Badenoch clash over call for grooming inquiry How Canada's immigration debate soured - and helped seal Trudeau's fate 'I can't get divorced as I can't get my pension valued' BBC Sound of 2025: Barry Can't Swim is a new dance music superstar Ros Atkins on...Elon Musk's political interventions A journalist's murder highlights risks of reporting in small-town India Jean-Marie Le Pen - founder of French far right and 'Devil of the Republic' Cases of HMPV are on the rise in China - but what is it? Cryptocurrencies and personal AI: Tech to watch out for in 2025 Politics Essential: Get the latest news and analysis delivered to your inbox every weekday Delivering brand-new miracles in 1970s East End Watch the latest series of Call the Midwife on iPlayer now Mark-Anthony Turnage shares the soundtrack of his life Once called 'Britainâs hippest composer', he's tackled topics from drug abuse to football in his work Paddyâs loaf-changing experience inside the bread factory Paddy McGuinness visits the bread factory he used to work in, and sees how they make 1.4 million loaves a week What's behind the global surrogacy boom? More countries are banning surrogacy â but demand is growing Â© 2025 BBC. The BBC is not responsible for the content of external sites.Read about our approach to external linking."
EU 'not in hostile mood' as Brexit talks beckon,"This video can not be played Jean-Claude Juncker: EU will negotiate in 'friendly and fair way' ""It's like musicians in their bow-ties playing on board the Titanic,"" remarked a friend of mine as I was talking to them about the EU's 60th anniversary celebrations in Rome. A mild exaggeration, shall we say - but the image sticks in my mind. Because as the leaders of the EU's 27 countries clink champagne glasses in plush, security-tight surroundings on Saturday - all is not well in the Europe outside their gates: youth unemployment persists (especially in the south), terror attacks, illegal migration, inequalities in the Eurozone, Brexit and a tide of anti-establishment populist nationalism across much of the bloc. To name a few of the challenges. Not to mention ""strongmen"" Presidents Trump, Putin and Erdogan who all eye the EU with suspicion and some animosity. ""Yes,"" conceded European Commission President Jean Claude Juncker to me in an exclusive interview. ""We are not in the best form and shape we could be in."" But, he insisted, the EU was still young, adding that what the bloc had achieved in six decades was remarkable - Europe is now a continent of stability and peace. But that was the vision, the goal after World War Two, I countered. Surely there's a need for a new vision? Something to capture the public imagination. To re-enchant the disenchanted? The EU marks its birthday on Saturday, while the UK will trigger Article 50 on Wednesday Mr Juncker recently published a White Paper on the future of the EU. where he explored five different scenarios - from increased union to paring pooled powers back to the common market only. In between, he breathes life into the old idea of a ""two-speed Europe"" - where some countries share more sovereignty for example over defence or migration, while others opt out. That proposal appears to be the most popular amongst politicians and civil servants, but to me it sounds like an open admission that there is, in fact, no common EU vision - with everyone doing different things at different times. All this at a very sensitive moment - when one of the EU's biggest and most influential members, the UK, is about to walk out of the door. And unity amongst the remaining 27 countries is key for Brussels - to prove to the outside world that the EU still stands strong. Theresa May's absence at the 60th birthday bash on Saturday will be screamingly noticeable. ""Of course we will miss her,"" President Juncker told me. ""I am everything but in a hostile mood with Britain. Britain is part of Europe, and I hope to have a friendly relationship with the UK over the next decades."" This video can not be played Brexit divorce: 'conscious uncoupling' or bitter breakup? Well, that of course will depend on what kind of future relationship the UK and EU can hammer out during Brexit negotiations. I wondered how the EU would balance the competing desires to keep the UK close yet not give it too good a deal so as to avoid the risk of other EU countries walking away? Mr Juncker admitted he did not want any more ""exits"": Nexit, Oexit, Dexit, Frexit or otherwise. That would be the end, he said, if three, four or five more countries left. The EU would collapse. But he doesn't believe that will happen. The EU and the Commission, he said, would negotiate with the UK in a friendly way - fair but never naive. Interesting choice of adverbs there. Echoed precisely in a speech delivered on Thursday by the EU's chief Brexit negotiator - Commission man Michel Barnier. ""Not naive""â¦ Now, does that refer to talk of the UK aiming to cosy up to individual EU countries (like the Baltic nations with promises of security co-operation) to cajole them into pressing for a good trade deal for Britain? Or does it perhaps allude to the government rejecting the idea of an ""exit bill"" as part of the EU divorce? It's an invoice that Mr Juncker insists must be paid. ""You cannot pretend you were never a member of the union,"" he practically spluttered. ""The British government and parliament took on certain commitments as EU members and they must be honoured. This isn't a punishment or sanctions against the UK."" Despite mutterings about the Commission drawing up a Â£50bn ($63bn) bill, Mr Juncker said the precise amount remained to be ""scientifically calculated."" But one thing he insisted that could not be haggled over was the fate of the 4.5 million EU citizens living in the UK and British citizens currently living across the EU. President Juncker said no-one had a right to eject them from their homes and jobs. ""This is not about bargaining,"" he insisted. ""This is about respecting human dignity."" As they  mark the EU's anniversary on Saturday, the bloc's remaining leaders will look with furrowed brows towards the future. But they may well take heart in a new trend emerging. While populist nationalist, anti-establishment candidates enjoy strong followings, at the same time unashamed Europhiles like the youthful leader of the Netherlands Green party, the French presidential hopeful Emmanuel Macron and the German candidate for Chancellor Martin Schulz resonate with the large sections of the public too. But Mr Juncker and others I've spoken to in the lead-up to the EU's anniversary, like his Vice-President Frans Timmermans and Antonio Tajani, the new President of the European Parliamant, all believe this is no time for complacency. In just a few days' time Britain will deliver a letter to Brussels, officially triggering the countdown to Brexit. How will Mr Juncker feel that day, I asked. ""Sad,"" he replied. ""It's a tragedy. ""A failure and a tragedy."" EU abuzz ahead of two key dates Brexit: The Divorce Papers. Video, 00:01:36Brexit: The Divorce Papers May to trigger Brexit process next week What is Article 50? What happens now that a deal's been done? EU negotiator issues Brexit warning. Video, 00:02:01EU negotiator issues Brexit warning Brexit - BBC News Comments can not be loaded To load Comments you need to enable JavaScript in your browser LA firefighters say 'no possibility' of containing blazes as fifth wildfire breaks out Inside the neighbourhood totally lost in LA fires Starmer and Badenoch clash over call for grooming inquiry How Canada's immigration debate soured - and helped seal Trudeau's fate 'I can't get divorced as I can't get my pension valued' BBC Sound of 2025: Barry Can't Swim is a new dance music superstar Ros Atkins on...Elon Musk's political interventions A journalist's murder highlights risks of reporting in small-town India Jean-Marie Le Pen - founder of French far right and 'Devil of the Republic' Cases of HMPV are on the rise in China - but what is it? Cryptocurrencies and personal AI: Tech to watch out for in 2025 Politics Essential: Get the latest news and analysis delivered to your inbox every weekday Delivering brand-new miracles in 1970s East End Watch the latest series of Call the Midwife on iPlayer now Mark-Anthony Turnage shares the soundtrack of his life Once called 'Britainâs hippest composer', he's tackled topics from drug abuse to football in his work Paddyâs loaf-changing experience inside the bread factory Paddy McGuinness visits the bread factory he used to work in, and sees how they make 1.4 million loaves a week What's behind the global surrogacy boom? More countries are banning surrogacy â but demand is growing Â© 2025 BBC. The BBC is not responsible for the content of external sites.Read about our approach to external linking."
