headline,article
Man guilty of wife-in-suitcase murder,"This video can not be played CCTV of Ashwin Daudia dragging the suitcase with his ex inside was shown to the jury A ""controlling"" husband who was caught on CCTV dragging his ex-wife's body in a suitcase has been jailed for her murder. Ashwin Daudia, 51, strangled Kiran Daudia and stuffed her remains into the luggage before dumping it in an alley behind bins. Leicester Crown Court heard Daudia killed Kiran on the day he was due to be kicked out of the home they shared. He was given a life sentence with a minimum of 18 years behind bars. The court heard Kiran was reported missing by her family when she did not return home from work. Kiran Daudia was 46 when she died and had two sons, then aged 17 and 25 Police went to the home address and spoke to Daudia, who claimed he had not seen her. Live updates and stories from across the East Midlands Officers received a call the next morning from a neighbour who had found the suitcase abandoned in their back yard. They later discovered the footage of Daudia dragging the suitcase around a corner near Kiran's home. The court heard the couple, who had an arranged marriage in 1998, continued living together after their divorce in 2014. But their house in Lyme Road had been sold to Kiran's sister, with Daudia set to move out on 16 January last year. Ashwin Daudia was given a life sentence with a minimum of 18 years behind bars Prosecutors said Daudia's claim he had ""lost control"" and killed his ex in self-defence was a lie designed to protect himself. They argued ligature marks on her neck suggested she had been strangled with her own scarf. Passing sentence, Judge Timothy Spencer QC said he was satisfied Daudia had killed Kiran ""in what should have been the safety of her own home"". ""In my judgment you were arrogant, bullying and bent upon maintaining control. ""In short, I'm quite satisfied the course of destruction of your family was a course charted by you. ""Your selfish pride fuelled your anger."" In a statement, Kiran's family said she had ""lots of dreams and aspirations which were... taken away by this demonic act"". ""Life without her will never be the same."" 'Murderer' dragged ex's body in suitcase Dead woman 'joked about husband killing her' Ex-wife 'strangled and crammed in suitcase' Plans to install hundreds of solar panels on roofs of leisure centres 'Violent gang of wildlife abusers': Chris Packham livestreams Rutland’s Cottesmore Hunt to expose illegal foxhunting Leicestershire entrepreneur named one of 2025’s most impressive female founders Dambusters memorabilia goes under the hammer for £24,000 MP Alicia Kearns criticises Rutland County Council for working too slowly on their review on flooding Coalville area residents urged to have their say on Leicestershire County Council's budget plan Firefighters running out of water as wildfire declared most destructive in LA's history In maps: Thousands of acres on fire in LA 'Patients are collapsing in the waiting room': A&E nurses speak out Why does Trump want Greenland and what do its people think? How Canada's immigration debate soured - and helped seal Trudeau's fate 'I can't get divorced as I can't get my pension valued' What are cold weather payments and who can get them? BBC Sound of 2025: Barry Can't Swim is a new dance music superstar Ros Atkins on...Elon Musk's political interventions Jean-Marie Le Pen - founder of French far right and 'Devil of the Republic' Cases of HMPV are on the rise in China - but what is it? Politics Essential: Get the latest news and analysis delivered to your inbox every weekday Delivering brand-new miracles in 1970s East End Watch the latest series of Call the Midwife on iPlayer now Mark-Anthony Turnage shares the soundtrack of his life Once called 'Britain’s hippest composer', he's tackled topics from drug abuse to football in his work Paddy’s loaf-changing experience inside the bread factory Paddy McGuinness visits the bread factory he used to work in, and sees how they make 1.4 million loaves a week What's behind the global surrogacy boom? More countries are banning surrogacy – but demand is growing © 2025 BBC. The BBC is not responsible for the content of external sites.Read about our approach to external linking."
"Finsbury Park attacker jailed for lifeDarren Osborne, who drove a van into a crowd of Muslims in London, will serve a minimum of 43 years.","Darren Osborne was found guilty of murder and attempted murder, at Woolwich Crown Court A man who drove a van into a crowd of Muslims near a north London mosque has been sentenced to life in prison, with a minimum term of 43 years behind bars. Darren Osborne, 48, was found guilty of murdering Makram Ali, 51, after deliberately ploughing into a crowd of people in Finsbury Park in June. Mrs Justice Cheema-Grubb told Osborne, from Cardiff: ""This was a terrorist attack. You intended to kill."" Mr Ali's family said they could not imagine the trauma he felt as he died. Speaking outside court, his daughter, Ruzina Akhtar, said: ""Our father, like the victims of most terrorism, was entirely innocent which makes his death in this violent way all the more hurtful."" ""He was such a peaceful and simple man, he had no bad thoughts for anyone,"" she added. Osborne mowed down worshippers in Finsbury Park shortly after 12.15am on 19 June last year, killing Mr Ali and injuring nine others. The father-of-four, who was also found guilty of attempted murder, said ""God bless you all, thank you"", as he was led away from court. The jury took an hour to return the verdict at Woolwich Crown Court on Thursday after a nine-day trial. This video can not be played Ruzina Akhtar says her father, who died in the Finsbury Park attack, 'will never be forgotten'. Sentencing him,Justice Cheema-Grubb told Osborne,externalthe jury in his trial had seen though his ""pathetic last-ditch attempt to deceive them"", by claiming an apparent accomplice called ""Dave"" had been the driver. The judge said Osborne had planned ""a suicide mission"" and expected to be shot dead by the police. He was guilty of a ""terrorist murder"", she added. Osborne had been ""rapidly radicalised over the internet by those determined to spread hatred of Muslims"", she said. ""Your use of Twitter exposed you to racists and anti-Islamic ideology,"" she added. ""In short, you allowed your mind to be poisoned by those who claimed to be leaders."" This video can not be played CCTV showed Darren Osborne's movements before and during the attack Before sentencing, the court heard a statement from Mr Ali's daughter, who said she had suffered ""recurring nightmares"" since the death of her father. Ms Akhtar said: ""The incident was near to our house and I walk past it most days. It keeps me awake at night thinking about the attack."" She said her mother was now scared to go outside by herself for fear of being attacked. ""My father was the most sincere and warmest person I know. He was full of jokes and laughter, and full of love for his family and grandchildren. ""His life was taken in a cruel way by a narrow-minded, heartless being,"" the statement added. Other witnesses suffered feelings of anxiety, flashbacks, fear of going out and loss of confidence, prosecutors said. Makram Ali, 51, was killed in the attack Mrs Justice Cheema-Grubb also heard a list of Osborne's previous convictions - including a string of violent offences - spanning more than 30 years. Osborne had appeared before the courts on 33 occasions for 102 offences, she was told. The judge said Osborne's previous convictions showed he was a ""belligerent and violent character"". She said Mr Ali died immediately after being struck by the van. He was found with tyre marks on his torso, she added. Reacting to the sentencing, Home Secretary Amber Rudd, said she hoped Osborne's conviction for a ""horrific terrorist attack"" would come as ""some solace to his family and those injured"". Cdr Dean Haydon, head of the Metropolitan Police counter-terrorism team, said Osborne had carried out an ""evil and cowardly attack"". ""Some of those injured have still not fully recovered and could suffer from health issues for the rest of their lives,"" he said. ""I would like to pay tribute to Mr Ali's family and the local community in Finsbury Park, for their tremendous support and understanding with our investigation during what must have been an extremely difficult time for them."" This video can not be played Jurors were shown footage which allegedly shows Darren Osborne writing at a pub table two days before the attack During the trial, the court the victims of the attack had been outside the Muslim Welfare House, in Finsbury Park, when the area had been busy with worshippers attending Ramadan prayers. Mr Ali had collapsed at the roadside in the minutes before the attack. Police later found a letter in the van written by Osborne, referring to Muslim people as ""rapists"" and ""feral"". He also wrote that Muslim men were ""preying on our children"". Osborne, the trial heard, had became ""obsessed"" with Muslims in the weeks leading up to the attack, having watched the BBC drama Three Girls, about the Rochdale grooming scandal. He then rented a van and had intended to target an Al Qud's Day march, on 18 June. Unable to access the march, he drove around London until arriving in north London at about midnight. Firefighters running out of water as wildfire declared most destructive in LA's history In maps: Thousands of acres on fire in LA 'Patients are collapsing in the waiting room': A&E nurses speak out Why does Trump want Greenland and what do its people think? How Canada's immigration debate soured - and helped seal Trudeau's fate 'I can't get divorced as I can't get my pension valued' What are cold weather payments and who can get them? BBC Sound of 2025: Barry Can't Swim is a new dance music superstar Ros Atkins on...Elon Musk's political interventions Jean-Marie Le Pen - founder of French far right and 'Devil of the Republic' Cases of HMPV are on the rise in China - but what is it? Politics Essential: Get the latest news and analysis delivered to your inbox every weekday Delivering brand-new miracles in 1970s East End Watch the latest series of Call the Midwife on iPlayer now Mark-Anthony Turnage shares the soundtrack of his life Once called 'Britain’s hippest composer', he's tackled topics from drug abuse to football in his work Paddy’s loaf-changing experience inside the bread factory Paddy McGuinness visits the bread factory he used to work in, and sees how they make 1.4 million loaves a week What's behind the global surrogacy boom? More countries are banning surrogacy – but demand is growing © 2025 BBC. The BBC is not responsible for the content of external sites.Read about our approach to external linking."
"US killer dad taunts ex-wife at execution""I've seen enough of him,"" John Battaglia's ex-wife said as she walked away after his execution.5h5 hours agoUS & Canada","John Battaglia killed the girls in his Texas apartment ""Well hi, Mary Jean,"" a Texas death row inmate said to his ex-wife as he was executed for murdering their two daughters in 2001. ""See ya'll later. Go ahead please,"" said John Battaglia, 62, as he prepared for Thursday night's lethal injection. The former accountant murdered his six- and nine-year-old daughters in his apartment as ex-wife Mary Jean Pearl listened helplessly on the phone. Lawyers filed a last-minute appeal to spare his life, but it was rejected. The Americans volunteering to watch executions Battaglia's legal team had asked the US Supreme Court to review his case because his ""perception of reality may be so distorted that he is incompetent to be executed"". John Battaglia with Liberty (L) and Faith After the lethal injection was administered, he closed his eyes for several moments, opened them, smiled and asked: ""Am I still alive?"" Battaglia then grinned and sighed,according to Dallas Morning News,external. ""Oh, here, I feel it,"" he said before gasping for breath and beginning to snore. After 22 minutes Battaglia was pronounced dead at 21:40 local time (03:45 GMT on Friday). ""I've seen enough of him,"" his ex-wife said as she walked away from the glass window that separated her from Battaglia,according to the Associated Press,external. He was the third prisoner put to death in the US this year. All the executions in 2018 have taken place in the state of Texas. 'Dementia' inmate's execution called off Battaglia and Ms Pearl divorced a year before the killings. She was seeking his arrest for violating a protective order against her on the day he murdered their daughters Liberty, six, and Faith, nine. On that evening in May 2001, Battaglia was scheduled to have dinner with the two girls when police informed him that he was violating probation and needed to surrender, court documents show. Battaglia's ex-wife heard gunshots and screams When the girls arrived at his Dallas apartment he called his wife and put her on speaker phone. Faith asked: ""Mommy, why do you want Daddy to go to jail?"" US death sentences fall to 40-year low A few seconds later Ms Pearl said she heard her daughter say: ""No, Daddy, please don't, don't do it."" Ms Pearl then heard gunshots and screams. The girls were found dead in Battaglia's apartment after being shot multiple times, police said. According to court documents, he went to a bar with his girlfriend after killing his daughters. Battaglia was later arrested at a tattoo parlour where he was getting tattoos of roses to remember them. A jury took 20 minutes to convict him in 2002. Experts determined that he had ""delusional disorder of the persecutory type"" after examining him. However, prosecutors said that Battaglia was aware of his crimes and therefore fit to be executed. The Americans volunteering to watch executions 'Dementia' inmate's execution called off Firefighters running out of water as wildfire declared most destructive in LA's history In maps: Thousands of acres on fire in LA 'Patients are collapsing in the waiting room': A&E nurses speak out Why does Trump want Greenland and what do its people think? How Canada's immigration debate soured - and helped seal Trudeau's fate 'I can't get divorced as I can't get my pension valued' What are cold weather payments and who can get them? BBC Sound of 2025: Barry Can't Swim is a new dance music superstar Ros Atkins on...Elon Musk's political interventions Jean-Marie Le Pen - founder of French far right and 'Devil of the Republic' Cases of HMPV are on the rise in China - but what is it? Politics Essential: Get the latest news and analysis delivered to your inbox every weekday Delivering brand-new miracles in 1970s East End Watch the latest series of Call the Midwife on iPlayer now Mark-Anthony Turnage shares the soundtrack of his life Once called 'Britain’s hippest composer', he's tackled topics from drug abuse to football in his work Paddy’s loaf-changing experience inside the bread factory Paddy McGuinness visits the bread factory he used to work in, and sees how they make 1.4 million loaves a week What's behind the global surrogacy boom? More countries are banning surrogacy – but demand is growing © 2025 BBC. The BBC is not responsible for the content of external sites.Read about our approach to external linking."
New regimental goat evades Army capture,"This video can not be played The Great Orme goat evaded Army capture for eight hours Stealthy, fleet of foot and elusive - The Royal Welsh's newest recruit is everything a battalion could want. Unfortunately, the kid in question is Shenkin IV - a wild goat on the Great Orme in Conwy county who the Army hoped to dart and capture to be the 3rd battalion's newest mascot. After eight fruitless hours, the search was called off on Friday afternoon and will resume near Llandudno next week. A new goat is needed afterShenkin III died in September, aged seven. An Army team, accompanied by an RSPCA vet, was deployed to select the successor before the new Shenkin could be taken to Maindy Barracks in Cardiff to begin his training. But after unsuccessfully pursuing the Kashmiri from the royal herd across the hills, they had to call off the search when it began to get dark. Bureaucats: Felines with official positions Indonesian army destroys ridiculed tiger statue Half-eel, half-aeroplane named Japan's best mascot So near, yet so far - the chosen successor to Shenkin III proved too quick to catch Camouflage was not enough to stop Shenkin spotting his potential would-be captors The regiment's Goat Major, Sgt Mark Jackson, said: ""He's a cheeky looking chap - when I was calling him, he was looking directly at me. He's got a lovely quiff of hair on top of his horns - he's the one we want."" Once Shenkin IV has been caught, Sgt Jackson will be responsible for introducing him to new sights and sounds - including a trip to Baglan RFC and walks around Cardiff city centre - so he is placid and well-disciplined around people when it is time to clip clop into the spotlight. Shenkin IV will hold the rank of fusilier and it is hoped his first public appearance will be at National Armed Forces Day in Llandudno on 30 June. Presuming they can catch him by then. Strike a pose: Shenkin shows he is not camera shy at an event at Cardiff Castle in March 2000 The National Army Museum said The Royal Welsh and its predecessor units have adopted goats as mascots since the 1770s It stems from the Battle of Bunker Hill during the American War of Independence when a wild goat is said to have strayed into the battle and led the Royal Welsh Fusiliers' colour party from the field Another story said a young Welsh soldier found a kid goat during the Crimean War and kept him as a pet. While on sentry duty one night, he tucked the goat inside his coat to keep warm and fell asleep, but was alerted to the enemy's advance when the goat bleated, giving him time to tell his fellow soldiers who were then able to repel the Russian attack In 1884, Queen Victoria presented the regiment with a Kashmir goat from the royal herd, starting the tradition that continues to this day All Royal Welsh goats hold a rank within the regiment A wild goat chase for new Army recruit. Video, 00:00:30A wild goat chase for new Army recruit 'Legendary' Royal Welsh goat dies Royal Welsh soldiers parade into town Royal Welsh has new regimental goat Firefighters running out of water as wildfire declared most destructive in LA's history In maps: Thousands of acres on fire in LA 'Patients are collapsing in the waiting room': A&E nurses speak out Why does Trump want Greenland and what do its people think? How Canada's immigration debate soured - and helped seal Trudeau's fate 'I can't get divorced as I can't get my pension valued' What are cold weather payments and who can get them? BBC Sound of 2025: Barry Can't Swim is a new dance music superstar Ros Atkins on...Elon Musk's political interventions Jean-Marie Le Pen - founder of French far right and 'Devil of the Republic' Cases of HMPV are on the rise in China - but what is it? Politics Essential: Get the latest news and analysis delivered to your inbox every weekday Delivering brand-new miracles in 1970s East End Watch the latest series of Call the Midwife on iPlayer now Mark-Anthony Turnage shares the soundtrack of his life Once called 'Britain’s hippest composer', he's tackled topics from drug abuse to football in his work Paddy’s loaf-changing experience inside the bread factory Paddy McGuinness visits the bread factory he used to work in, and sees how they make 1.4 million loaves a week What's behind the global surrogacy boom? More countries are banning surrogacy – but demand is growing © 2025 BBC. The BBC is not responsible for the content of external sites.Read about our approach to external linking."
Online estate agent in row over sales claimPurplebricks refutes a claim that it only sells about half of properties listed by customers.8h8 hours agoBusiness,"Online estate agency Purplebricks has defended its business after critical comments by analysts. On Thursday, stockbrokers Jefferies issued a research note questioning its claim it sold more than three quarters of homes listed with it. Jefferies said Purplebricks' sales success rate was just over 51% and near the middle of the pack of its study of 7,000 agents. But Purplebricks said it sold 78% of homes listed. Purplebricks charges a flat fee rather than a percentage of the sale price and uses a mix of online and local agents. The company's latest results, published in December, reported that its average revenue per UK customer was £1,138. Jefferies called selling with Purplebricks a ""£1,000 coin toss"", saying that, unlike traditional agents, its customers had to pay the fee regardless of whether the property sold. The brokers said the business model had not been sufficiently tested and that its shares were priced ""for perfection"". The note from Jefferies said: ""Purplebricks does not disclose how many homes it sells. Our research sample found that it had sold 51.6% of the homes listed in November 2016 within 10 months, a similar success rate to the overall market, but below the company's claim of 88% [made in an interview on the BBC's Moneybox programme]. ""Our concern is that the group has expanded quickly across three continents before the model has been proven and therefore that the shares are priced for perfection. Our research is not able to replicate the views on selling success expressed by the company."" In a statement, Purplebricks said: ""Purplebricks firmly refutes the criticism in the research note of its revenue recognition policy and stands behind both the fully audited results and the accounting policy itself."" It added that the estimated completion rate in the Jefferies research note was based on one month's data and did not cover deals that have yet to be included on the Land Registry. The company said its most recently published sales conversion rate was 78%, which it said ""more accurately reflects its sales performance"". Shares in Purplebricks fell 7% on Thursday, and dropped a further 3% on Friday to about 440p. However, this is still well above the valuation given in the Jefferies note, which said the true value of the shares was between 94-158p. Purplebricks, which operates in Australia as well as the UK and is moving into the US, has come in for criticism in the past. The Advertising Standards Authority has upheld a number of complaints about its marketing. The BBC's5 live Investigatesis taking a deeper look into the world of online estate agency on Sunday, 4 February from 11:00am. Estate agents 'stretching the facts' Firefighters running out of water as wildfire declared most destructive in LA's history In maps: Thousands of acres on fire in LA 'Patients are collapsing in the waiting room': A&E nurses speak out Why does Trump want Greenland and what do its people think? How Canada's immigration debate soured - and helped seal Trudeau's fate 'I can't get divorced as I can't get my pension valued' What are cold weather payments and who can get them? BBC Sound of 2025: Barry Can't Swim is a new dance music superstar Ros Atkins on...Elon Musk's political interventions Jean-Marie Le Pen - founder of French far right and 'Devil of the Republic' Cases of HMPV are on the rise in China - but what is it? Politics Essential: Get the latest news and analysis delivered to your inbox every weekday Delivering brand-new miracles in 1970s East End Watch the latest series of Call the Midwife on iPlayer now Mark-Anthony Turnage shares the soundtrack of his life Once called 'Britain’s hippest composer', he's tackled topics from drug abuse to football in his work Paddy’s loaf-changing experience inside the bread factory Paddy McGuinness visits the bread factory he used to work in, and sees how they make 1.4 million loaves a week What's behind the global surrogacy boom? More countries are banning surrogacy – but demand is growing © 2025 BBC. The BBC is not responsible for the content of external sites.Read about our approach to external linking."
