headline,article
Trump voter's husband faces deportation,"A rally for two young people detained by immigration officials in Vermont The Trump Administration's immigration enforcement priorities have revived deportation orders ignored during the Obama Administration. On Monday, Mr Trump criticized local law enforcement agencies for refusing to cooperate with Immigration and Customs Enforcement (Ice) to detain and deport people living in the US illegally. The administration started publishing a weekly ""Declined Detainer Outcome Report"", which calls out local agencies that ignored orders to detain undocumented immigrants arrested for unrelated crimes. The report names the immigrants in question and lists ""crimes associated with those released individuals."" Despite promising to focus on violent criminals and gang members, President Donald Trump's executive orders on immigration and his executive memo to the Department of Homeland Security empowers Ice to deport virtually anyone living in the US without documentation. Only one clear exception exists, for people with active Deferred Action for Childhood Arrivals (Daca) status. Here's a look at some of the most recent immigration cases across the US. Beristain, in blue, has been in the us for 19 years Roberto Beristain, 43 Detained: 6 February, from Granger, Indiana In 1998, Mr Beristain came to the US to visit an aunt and decided to stay. In 2000, he and his wife, a naturalised US citizen originally from Greece, accidentally crossed the Canadian border while sightseeing at Niagara Falls. When they crossed back into the US, border patrol agents detained Mr Beristain. A judge initially issued an order mandating that Mr Beristain voluntarily return to Mexico. When Beristain declined to leave, the order reverted to a final order. Instead Mr Beristain's lawyer convinced Ice agents to grant him leniency due to his family ties in the US and lack of criminal records. The agents helped Mr Beristain obtain a driver's licence, a work permit and a legal Social Security Number, and Mr Beristain went to work in the restaurant business. He is now co-owner of Eddie's Steak Shed in Granger, Indiana. Mr Beristain had to check in with Ice agents every year. This February, agents at the Indianapolis Ice office took him into custody. ""Trump says we're deporting bad hombres. Roberto is the farthest thing from a bad guy,"" said Jason Flora, who served as Mr Beristain's attorney until Saturday. ""You ask 100 people to paint a picture of a bad guy, not one would draw something remotely resembling Roberto."" His wife supported Mr Trump because of his immigration programmes, and thought her husband - a businessman and father - would be spared. ""We don't want to have cartels here, you don't want to have drugs in your high schools, you don't want killers next to you,"" Helen Beristain toldIndiana Public Media,externalearlier this year. ""You want to feel safe when you leave your house. I truly believe that. And this is why I voted for Mr Trump."" Because of the deportation order from 2000, Mr Beristain could be deported as early as Friday without a hearing before an immigration court. Henry Sanchez-Milian, 18 Arrested: 17 March, in Rockville, Maryland Police arrested Henry Sanchez-Milian and another undocumented teenager, Jose O Montano, 17, on charges of sexual assault after they allegedly trapped a fellow Rockville High School student in a school bathroom and raped her. Mr Montano is being charged as an adult. Immigration row over US school rape case Mr Sanchez-Milian has lived in the US for only eight months, after fleeing Guatemala. He had been awaiting a hearing with an immigration judge. Because he is considered a serious flight risk, he will likely remain in jail until a he's brought before a criminal court, said Montgomery County Assistant States Attorney Rebecca MacVittie. When an undocumented individual is convicted of a serious crime, standard procedure is to allow them to serve their prison sentence in the US and then transfer them to Ice custody to initiate the deportation process. It is unclear whether Mr Sanchez-Milian will be deported before a trial. Ice has issued an order for local law enforcement to keep him in custody. The case has been referenced by members of Mr Trump's administration as reason for  Mr Trump's ""crackdown"" on immigration. Gerardo Martinez-Morales, 52 Deported: 17 March, 2017, from Galveston, Texas Earlier this month, Mr Martinez-Morales was pulled over for a broken tail light, at which point officers identified him as an undocumented immigrant. He had lived in the US for nearly 20 years. He married a US citizen and has four American-born children under the age of 12. In 2004, Mr Martinez-Morales returned to Mexico to see family. Upon his return, he was arrested for crossing illegally at the Texas border, which set in motion his deportation order. Mr Martinez-Morales returned to the Houston area, and lived there without incident until this month. The Obama Administration's immigration priorities that allowed people living in the US illegally with no criminal record to stay in the US, even if they had a deportation order that predated 1 January 2014. Under the Trump administration, individual with a deportation order is a priority for removal. ""There has been a total change with this new administration,"" says Raed Gonzalez, Mr Martinze-Morales' attorney. ""This is a sharp shift in policy."" Mr Martinez-Morales was deported one week after his detention. Cesar Carrillo, 23,Enrique Balcazar, 24,Zully Palacios Rodriguez, 23 Detained:15 March and 17 March, in Burlington, Vermont Zully Palacios and Enrique Balcazar Mr Carrillo, Mr Balcazar and Ms Rodriguez are activists who belong to a Vermont-based immigration rights advocacy group called Migrant Justice. Ice agents arrested Mr Carrillo-Sanchez on Wednesday, as he was arriving to a court hearing for a misdemeanour charge at the Chittenden County courthouse. Two days later, Ice officials stopped a car that Mr Balcazar was driving, with Ms Rodriguez in the passenger seat, as they were leaving the Migrant Justice office. Both were detained by immigration officials, according to the organisation. Alex Carrillo (left) with daughter and wife at a rally to free Victor Diazz Members of Migrant Justice said that they view their detention as a sign that immigration officials are targeting activists and community leaders. Migrant Justice members have had run-ins with Ice in the past. Two other members, Victor Diaz and Miguel Alcudia, were detained last year, but were both released and had their deportation proceedings halted after public outcry. Mr Carrillo-Sanchez  and Mr Balcazar both immigrated to the US from Mexico. Ms Rodriguez is from Peru. Aaron Sarmiento-Sanchez, 35 Arrested: 17 March near Sells, Arizona Border Patrol agents from the Casa Grande Station in Arizona arrested Aaron Sarmiento-Sanchez for entering the US illegally. He had previously been deported in April 2013. When officers ran a background check on Mr Sarmiento-Sanchez, they found a 2006 conviction in Salinas, California, for ""lewd or lascivious acts with a child"". Mr Sarmiento-Sanchez was sentenced to six years in prison for that crime. Mr Sarmiento-Sanchez faces federal charges for re-entering the country illegally and will remain in detention until a judge rules on those criminal charges. See last week's report. Add your own stories below. LA firefighters say 'no possibility' of containing blazes as fifth wildfire breaks out Inside the neighbourhood totally lost in LA fires Starmer and Badenoch clash over call for grooming inquiry How Canada's immigration debate soured - and helped seal Trudeau's fate 'I can't get divorced as I can't get my pension valued' BBC Sound of 2025: Barry Can't Swim is a new dance music superstar Ros Atkins on...Elon Musk's political interventions A journalist's murder highlights risks of reporting in small-town India Jean-Marie Le Pen - founder of French far right and 'Devil of the Republic' Cases of HMPV are on the rise in China - but what is it? Cryptocurrencies and personal AI: Tech to watch out for in 2025 Politics Essential: Get the latest news and analysis delivered to your inbox every weekday Delivering brand-new miracles in 1970s East End Watch the latest series of Call the Midwife on iPlayer now Mark-Anthony Turnage shares the soundtrack of his life Once called 'Britainâs hippest composer', he's tackled topics from drug abuse to football in his work Paddyâs loaf-changing experience inside the bread factory Paddy McGuinness visits the bread factory he used to work in, and sees how they make 1.4 million loaves a week What's behind the global surrogacy boom? More countries are banning surrogacy â but demand is growing Â© 2025 BBC. The BBC is not responsible for the content of external sites.Read about our approach to external linking."
"New broom, new vroom? The future for Formula 1","Game faces on: The drivers are gearing up for the new season Much has changed in Formula 1 since Lewis Hamilton took the chequered flag at last year's season finale in Abu Dhabi. The reigning world champion, Nico Rosberg, haswalked off into the sunset. The cars have evolved, with new rules allowing them to become bigger, faster and more aggressive-looking. But the most significant transformation has taken place behind the scenes. Formula 1 isunder new ownership. Control has passed from private equity firm CVC Capital Partners to the US groupLiberty Media. As a result, former chief executive Bernie Ecclestone, the man who is credited with turning F1 into one of the world's most lucrative sports, has finally stepped down at the age of 86. The new chief executive is Chase Carey, a veteran of the US media industry and a former associate of Rupert Murdoch. He has already suggested thatF1 ""needs a fresh start"". So what might actually be changed? In commercial terms, Formula 1 is a curious beast. It is certainly lucrative. In 2015, its revenues reached $1.7bn, according to motorsport analysts Formula Money. Yet teams towards the back of the grid often struggle to make ends meet. Ferrari is well-funded under the current system Earlier this year, the Manor team finally closed down after several years of financial problems. Its collapse followed those of HRT and Caterham, who folded in 2012 and 2014 respectively. And even as revenues have been rising, TV audiences have been falling. The sport claimed 400 million viewers in 2016, down from a peak of 600 million in 2008. That may be partly due to a shift towards pay-TV in major markets such as the UK, Italy, France and Spain. Formula 1 is an expensive business: even the smallest teams employ about 200 people, and it costs at least $100m just to get on to the starting grid. Remaining there, however, is the biggest challenge. Small squads that don't win races and that don't get much television airtime often struggle to raise the sponsorship they need. And although roughly half of F1's revenues are distributed among the teams, they are not divided equally. Part of this is merit-based. The higher you finish in the World Championship, the more money you get. But some teams get extra bonuses, irrespective of how well they perform. Smaller teams like Sauber want to see F1 revenues distributed more evenly amongst the teams Ferrari, McLaren, Red Bull, Mercedes and Williams all get extra funding. And Ferrari gets more than $60m simply for turning up, because of its place in the sport's heritage. The smaller teams think this is deeply unfair and argue that because in F1, success is heavily linked to financial resources, it distorts the competition. In 2015, the Sauber and Force India teamslodged a formal complaint,externalwith the European Commission. Sauber team principal Monisha Kaltenborn says she hopes matters will change under Liberty Media. Talks so far, she says, have been ""very encouraging"". Although altering the way payments are made would inevitably mean some of the larger teams getting less, she thinks they will co-operate. ""Why shouldn't it happen?"" she says. ""The big teams know that the show has to be a healthy show. ""If viewing figures continue to go down and we don't have that 'aha effect', sponsorship will go down and they will suffer equally, probably more, because they need more money to keep their operations going."" Graeme Lowdon, a motor racing entrepreneur who helped to found the Manor team, agrees that a more level playing field is needed, ""What people want to see in F1 is a sport where skill is rewarded,"" he says. ""The sports that have grown in the past few years are the ones that are focused on parity, such as the NFL."" Nico Rosberg retired days after winning his first F1 world title Another area where change may be needed is in how F1 reaches out to its fanbase. In recent years, the sport has focused on maximising its revenues, but despite expanding into new markets, it has arguably failed to attract a new generation of enthusiasts. Races have been held in countries with little or no F1 heritage or established audiences, but where governments have proved willing to pay ever-higher sanctioning fees in exchange for the glamour associated with hosting a grand prix. At the same time, fewer events have been held in the sport's European heartlands, where organisers are less willing to pay more than $30m for the privilege. Liberty Media appears keen to reverse that trend and introduce new races in the United States, in an effort to broaden the sport's appeal. Chase Carey has taken over at the helm of Formula 1 That could mean getting rid of lucrative but controversial events like the Azerbaijan Grand Prix, which Liberty Media's chief executive Greg Maffei recently said ""does nothing to build the long-term brand and health of the business"". However, according to Formula Money's Christian Sylt, that strategy may not work if F1 wants to keep its revenues at their current level. ""I do not believe there is a 'big ticket' alternative revenue stream to race hosting fees"", he says. But perhaps the biggest challenge of all is to bring in a new generation of enthusiasts. ""We need to do something to connect with younger fans,"" says Sauber's Monisha Kaltenborn. ""You know, we don't want people who are just 40-something watching the sport. We have to go into digital media and social media far more. ""That's not a question about instantly making money, but it's about positioning yourself towards young people, so that tomorrow they'll come and watch a race."" Can F1 under Liberty Media succeed in attracting younger fans? Former Jordan team commercial manager Ian Phillips puts it even more bluntly. ""At the moment Formula 1, it hurts me to say it, is just not that exciting,"" he says. The problem, he thinks, is cost. Champions Mercedes spend upwards of $400m a year on their cars, and other teams simply can't compete. So the racing becomes boring. ""I have a 13-year-old son who just watches the first lap, then he goes away,"" he says. So wealthy F1 may be - but if it can't attract the kids, it may well find itself overtaken by other, more appealing sports before long. You can hear more on this story onBusiness Daily: Financing Formula 1 LA firefighters say 'no possibility' of containing blazes as fifth wildfire breaks out Inside the neighbourhood totally lost in LA fires Starmer and Badenoch clash over call for grooming inquiry How Canada's immigration debate soured - and helped seal Trudeau's fate 'I can't get divorced as I can't get my pension valued' BBC Sound of 2025: Barry Can't Swim is a new dance music superstar Ros Atkins on...Elon Musk's political interventions A journalist's murder highlights risks of reporting in small-town India Jean-Marie Le Pen - founder of French far right and 'Devil of the Republic' Cases of HMPV are on the rise in China - but what is it? Cryptocurrencies and personal AI: Tech to watch out for in 2025 Politics Essential: Get the latest news and analysis delivered to your inbox every weekday Delivering brand-new miracles in 1970s East End Watch the latest series of Call the Midwife on iPlayer now Mark-Anthony Turnage shares the soundtrack of his life Once called 'Britainâs hippest composer', he's tackled topics from drug abuse to football in his work Paddyâs loaf-changing experience inside the bread factory Paddy McGuinness visits the bread factory he used to work in, and sees how they make 1.4 million loaves a week What's behind the global surrogacy boom? More countries are banning surrogacy â but demand is growing Â© 2025 BBC. The BBC is not responsible for the content of external sites.Read about our approach to external linking."
Victims of the Westminster terror attack,"(From left) PC Keith Palmer, Kurt Cochran and Aysha Frade all died in the attack A mother of two young daughters, a retired window cleaner and an American tourist celebrating 25 years of marriage were among the victims of a terror attack in the heart of London. Five people were killed when Khalid Masood drove his car into crowds on Westminster Bridge and then stabbed a policeman outside the Houses of Parliament on 22 March 2017. Here are their stories. John and Aysha Frade Aysha Frade had been walking across Westminster Bridge to pick up her two young daughters from school when she was killed. She had suffered head and chest injuries and died at the scene. The British national, 44, worked as a PA at a nearby independent sixth-form, DLD College London. Ms Frade's husband John said it caused the family ""excruciating pain to think of Aysha in the past tense"", saying she had been ""cruelly and brutally ripped away from us"". He said she was ""relaxed, fun to be around, laughing and smiling"" and had a smile that was like the sun ""popping out from behind a cloud"". ""Her spirit lives on in the eyes of her children,"" he added. Ms Frade's sister, Michelle, said: ""People cannot understand how this despicable act of futile atrocity has impacted on not only her families' lives but also herself. ""She will never be able to smile again or see her daughters grow up."" Principal Rachel Borland described her as ""a highly regarded and loved"" member of staff, adding: ""She will be deeply missed by all of us."" Her father was of Cypriot origin, while her mother was from the Galician town of Betanzos in Spain, where her two sisters run an English school, theVoz de Galicia,externalreported. Leslie Rhodes, from Clapham, south London, had been visiting St Thomas' Hospital when he was hit by the car driven by Masood. The 75-year-old retired window cleaner was taken to King's College Hospital but died the following day from a head injury. Mr Rhodes was one of three people to have died after being hit on Westminster Bridge His niece, Amanda Rhodes, said the family was ""devastated"" and ""incredibly angry"" about his death. She described him as ""placid, quiet, and kind"", adding that ""everyone loved him"" and he ""would do anything to help anyone who needed it"". Ms Rhodes said he loved his job as a window cleaner and would stop and enjoy tea with his customers before his retirement. She said: ""Les will be greatly missed by all his family and friends who loved him."" Friend Janine Roebuck said Mr Rhodes had been ""immensely proud"" of having cleaned the windows at Chartwell - the Kent home of Sir Winston Churchill - for ""many years"". ""He was exceptionally fit for a man of his age. I would turn around and he had bounded up the ladder like someone half his age,"" she said. Kurt Cochran's wife Melissa survived the attack but was left with a broken leg and rib Kurt Cochran, 54, from the US state of Utah, was in London as part of a holiday celebrating 25 years of marriage to Melissa, who was seriously injured in the attack. He died at the scene on Westminster Bridge from multiple injuries. CCTV footage of the attack, played at the inquest, showed the moment Mr Cochran saved his wife's life by pushing her away from the path of Masood's car before being hit by it himself. Melissa described her husband as ""my inspiration, my rock star, and most of all my hero"", adding: ""We wish everyone had Kurt's love and compassion for others."" She said: ""I was so lucky to have had 25 wonderful years with the man of my dreams. He made me laugh every single day. ""I cherish every single memory we made."" She said she was ""forever grateful"" for their time together, ""and especially his heroic actions on that day, saving my life"". It was the couple's first trip abroad. They were also visiting Melissa's parents, who work on a Church of Jesus Christ of Latter-day Saints mission, and had been due to return to the US the day after the attack. Mr Cochran owned Onion Street Studio, a sound-recording studio in his home state. His friend, Evan Mullaly, told BBC Breakfast: ""He was always happy-go-lucky, very passionate about his work in the music industry. ""The kind of guy who would give you the shirt off his back, a genuinely kind human being. It's a tragedy what happened."" Andreea Cristea was visiting London with her boyfriend Romanian tourist Andreea Cristea, 31, fell into the River Thames after being driven at by Masood as she walked across Westminster Bridge with her boyfriend, Andrei Burnaz. She died in hospital just over two weeks later. Her family described the interior designer as a ""lovely, enchanting and life-loving"" woman, who had a thriving business. She had written a note on what would turn out to be her final New Year's Eve, saying the coming year would be ""the best of my life"". ""I will have a wonderful man by my side, who will love and cherish me and with this man I will start a wonderful family,"" the note said. Her family said they had been ""hoping for a miracle"" when she was in hospital following the attack and told of their ""heartbreakingly sad"" loss when she died. ""All her dreams were shattered when she went on her final trip,"" they added in a statement. The couple were in London to celebrate Mr Burnaz's birthday and he had been planning to propose to Ms Cristea that day. PC Keith Palmer, 48, was killed as he tried to stop Masood outside the Houses of Parliament. He was an unarmed member of the parliamentary and diplomatic protection squad, who had served in the Met for 15 years. PC Palmer, who had a young daughter, died at the scene after being stabbed in the chest. He had been wearing a body armour vest issued as routine to Metropolitan Police officers. In a statement issued shortly after his death, his family said that they were ""shocked and devastated"" and he would be remembered as ""a wonderful dad and husband"". ""A loving son, brother and uncle. A long-time supporter of Charlton FC. Dedicated to his job and proud to be a police officer, brave and courageous. A friend to everyone who knew him. ""He will be deeply missed. We love him so much."" His sister Angela said he joined the force because he wanted to ""make a difference"". She said: ""Keith died protecting strangers whilst doing his job and he will be remembered by many for his courage and bravery."" Chief Inspector Neil Sawyer said ""his brave actions that day did not surprise me"". ""While many would remember him for his ""brave actions"" and ""ultimate sacrifice"", Mr Sawyer added: ""To me and others he was our dear friend."" This video can not be played Conservative MP and former colleague James Cleverly's emotional tribute to PC Palmer His funeral was held at Southwark Cathedral, with thousands of police officers lining the route of the funeral cortege, starting at the Palace of Westminster. A fundraising appeal from the Metropolitan Police Federation in PC Palmer's memory has raised hundreds of thousands, with the money going to his family. In total, 50 people were injured in the Westminster attack. Among those injured were British and Irish citizens, as well as those from France, Greece, Germany, Poland, Portugal, Italy, China and South Korea. They included three French schoolchildren on a trip to London from St Joseph's School in Concarneau, Brittany, and four politics students from Edge Hill University in Ormskirk, Lancashire, who were on a visit to Parliament. Two police officers were among those treated in hospital. LA firefighters say 'no possibility' of containing blazes as fifth wildfire breaks out Inside the neighbourhood totally lost in LA fires Starmer and Badenoch clash over call for grooming inquiry How Canada's immigration debate soured - and helped seal Trudeau's fate 'I can't get divorced as I can't get my pension valued' BBC Sound of 2025: Barry Can't Swim is a new dance music superstar Ros Atkins on...Elon Musk's political interventions A journalist's murder highlights risks of reporting in small-town India Jean-Marie Le Pen - founder of French far right and 'Devil of the Republic' Cases of HMPV are on the rise in China - but what is it? Cryptocurrencies and personal AI: Tech to watch out for in 2025 Politics Essential: Get the latest news and analysis delivered to your inbox every weekday Delivering brand-new miracles in 1970s East End Watch the latest series of Call the Midwife on iPlayer now Mark-Anthony Turnage shares the soundtrack of his life Once called 'Britainâs hippest composer', he's tackled topics from drug abuse to football in his work Paddyâs loaf-changing experience inside the bread factory Paddy McGuinness visits the bread factory he used to work in, and sees how they make 1.4 million loaves a week What's behind the global surrogacy boom? More countries are banning surrogacy â but demand is growing Â© 2025 BBC. The BBC is not responsible for the content of external sites.Read about our approach to external linking."
