headline,article
PM to unveil 'cautious' England lockdown exit plan,"This video can not be played Vaccines Minister Nadhim Zahawi outlined some lockdown-easing measures in England All schools in England are to reopen on 8 March as part of the prime minister's ""cautious"" four-part plan to lift the coronavirus lockdown. Boris Johnson will share his finalised roadmap with ministers later, before unveiling it to MPs and then leading a news conference at 19:00 GMT. Up to six people or two households will be allowed to meet outdoors from 29 March, the vaccines minister said. Rules will be lifted in stages and four conditions must be met at each stage. Vaccines Minister Nadhim Zahawi told BBC Breakfast the prime minister would set out more details on the plan in a Commons statement, which is expected at around 15:30. The first stage of easing will be split into two parts: From 8 March -All schools will open with outdoor after-school sports and activities allowed. Recreation in a public space - such as a park - will be allowed between two people, meaning they would be allowed to sit down for a coffee, drink or picnic From 29 March -Outdoor gatherings of either six people or two households will be allowed. It is understood this will include gatherings in private gardens. Outdoor sports facilities such as tennis or basketball courts will reopen andorganised adult and children's sport, such as grassroots football, will also return Although schools are set to reopen to all pupils on 8 March, it is thought a few days' flexibility may be built in to allow measures like testing to be put in place. Also on 8 March, new rules will alloweach care home resident in England to have one regular visitor, with whom they can hold hands. And from 29 March it is also understood that people will once again be able to travel out of their areas - although guidance will likely still recommend staying local, and overnight stays will not be permitted. The gap between each stage of restrictions being eased is expected to be five weeks, according to BBC political editor Laura Kuenssberg. It comes aschildren aged three to seven in Wales return to the classroom, along with some students on practical college courses. Scotland's youngest pupils are also returning to face-to-face teachingin the first step of the phased reopening of schools there. Meanwhile, vaccination has had a significant impact on the risk of serious illness from Covid-19,analysis by Public Health Scotland shows. Figures for England are expected later. What time will lockdown changes be announced? How risky are the routes out of lockdown? Gym boss: 'We are burning through about £500,000 a day' 'Reckless' if all pupils back 8 March, say unions Data will be used to inform ""every step"" of lifting restrictions, Mr Johnson said. ""We will be cautious about this approach so that we do not undo the progress we have achieved so far and the sacrifices each and every one of you has made to keep yourself and others safe,"" he added. The roadmap will outline four steps for easing restrictions. But before proceeding to each next step, the government will examine the data to assess the impact of previous changes. The four conditions that must be met at each phase of lockdown easing are: The coronavirus vaccine programme continues to go to plan Evidence shows vaccines are sufficiently reducing the number of people dying with the virus or needing hospital treatment Infection rates do not risk a surge in hospital admissions New variants of the virus do not fundamentally change the risk of lifting restrictions Downing Street said the four tests are currently being met so the first step of lockdown easing in England will proceed as planned on 8 March. The first stage of easing restrictions will be across the whole of England, Downing Street added, due to the current uniform spread of the virus. MPs will be given the chance to vote on the regulations enabling England's roadmap in the coming weeks. Sir Charles Walker, the vice-chair of the 1922 Committee of backbench Conservative MPs, said the government needed ""flexibility"" if infections levels dropped more quickly than expected. ""You can't have a timeline and say you you're going to be data driven. You can either have one or the other,"" he told BBC Radio 4's World at One programme. The rules of combat are beginning to change. No longer is controlling infection and keeping R below 1 seen as the be-all and end-all. That much is clear from the government's four tests for its roadmap to lift lockdown in England. Infection rates are only being seen as a problem if they risk a surge in hospital admissions. The reasons for that change can be found from the early results published on the UK vaccination programme. Scottish researchers have found a ""spectacular"" reduction in the risk of serious illness four weeks after the first dose of the vaccine is given. The link between infections and serious illness is being broken. That is not to say a surge in infections can or will be tolerated - the number of Covid patients in hospital is still only just below where it was in the first peak and not all vulnerable people have been vaccinated yet. But it does give ministers some room for manoeuvre. That is important. Schools are not seen as a significant driver of infection, but reopening them for all could push infection levels up. Labour leader Sir Keir Starmer said he wanted the prime minister ""to learn the lessons of the last two lockdowns"" when ""he came out too quickly"". He told LBC that with restrictions in place for longer, businesses ""desperately"" needed more support, including the extension of business rates relief and VAT cuts for the hospitality sector. All four UK nations have been in lockdown for weeks, after hospitals were put under unprecedented pressure due to the rapid spread of a variant of the virus, first detected in Kent. The devolved nations have the power to set their own restrictions. First Minister Nicola Sturgeon saidScotlandwould return to a tiered system of restrictions when lockdown measures are eased, meaning different parts of the country could be under different rules. She added that she would set out the likely phases for a gradual lifting of restrictions on Tuesday. InWales, First Minister Mark Drakeford said he hopes the ""stay-at-home"" requirement could end within three weeks, with some non-essential shops and hairdressers possibly reopening at the same time. Northern Ireland's health minister has played down the prospect of restrictions being eased in time for Easter. A review of current measures will take place on 18 March. Pre-school, nursery and pupils in primaries one to threewill return to classrooms in Northern Ireland on 8 March. After two weeks, they will resume remote learning so older pupils in years 12 to 14 can go back to school. Children of key workers and vulnerable pupils have been able to attend school in all parts of the UK throughout the lockdown. On Sunday,Health Secretary Matt Hancock said there was ""early data"" suggesting a reduction in transmission of the virus in people who have had a vaccine, adding that hospital admissions were falling ""much more sharply"" than they were in the pandemic's first wave. But he told the BBC's Andrew Marr Show that the number of people in hospital - currently around 18,000 - was still ""far too high"". Sir David Spiegelhalter, professor of statistics at the University of Cambridge, said the data on factors like hospital admissions and deaths were ""extremely positive"" and ""better than people would have predicted"". However, he told BBC Radio 4's Today programme the government would need to ""keep in reserve"" the option of using local measures to tackle outbreaks because of the big difference in infection rates in different parts of the country. LOOK-UP TOOL:How many cases in your area? YOUR QUESTIONS:We answer your queries GLOBAL SPREAD:How many worldwide cases are there? THE R NUMBER:What it means and why it matters TEST AND TRACE:How does it work? The government has set a new targetof offering a coronavirus jab to adults aged 50 and over and those in the top nine priority groups by 15 April, followed by all adults by the end of July. So far, more than 17.5 million people in the UK have received a vaccine dose. The order of priority for the under-50s to receive jabs has yet to be outlined bythe Joint Committee on Vaccination and Immunisation (JCVI),external. Prof Adam Finn, a member of the JCVI, told the BBC on Sunday that he expected an announcement to be made on vaccine priorities at some point this week. BBC HEADROOM:Your mental health toolkit - Mindful tips, mood mixes and motivation 'I WANT PEOPLE TO TALK':West Ham Women captain opens up on mental health Latest data 'shows jab reduces transmission' England care home residents to get one visitor each 'Reckless' if all pupils back 8 March, say unions Comments can not be loaded To load Comments you need to enable JavaScript in your browser LA fire chief warns of further destruction from high winds as 10 confirmed dead What's the latest on the LA fires, and why can't they be put out? Danes struggle with response to Trump Greenland threat 'I paid fake doctor thousands for fillers - now I look like a gargoyle' The Papers: 'Lost Angeles' and 'Musk seeks plan to oust Starmer' Pop star Chappell Roan wins BBC Sound Of 2025 Weekly quiz: Zendaya looked happy but who else sparkled at the Golden Globes? The 20 child abuse inquiry proposals - what has happened so far? The '9/11 mastermind' wants to plead guilty. Why is the US trying to stop him? Why are UK borrowing costs rising and what does it mean for me? In maps: Thousands of acres on fire in LA Before and after: How wildfires tore through LA Ed Gamble hosts the official Traitors podcast Join Ed Gamble and guests as they dissect the first episodes of The Traitors! Can art, music and words bind us in divided times? Simon Schama explores how artists have captured the transformations of British society since 1945 Enjoy a satirical smorgasbord of The News Quiz Digest a dramatic year of news as Andy Zaltzman revels in some of 2024's funniest moments The multi-award-winning legal drama returns Two years on, the Defoes are back and have gathered for a beautiful wedding in Barcelona © 2025 BBC. The BBC is not responsible for the content of external sites.Read about our approach to external linking."
"Unionist parties to join NI Protocol legal bidThe DUP, UUP and TUV say they will be part of a legal challenge against the NI Protocol.Northern Ireland","Democratic Unionist Party (DUP) leader Arlene Foster; Ulster Unionist (UUP) leader Steve Aiken; and Traditional Unionist Voice (TUV) leader Jim Allister Northern Ireland's major unionist parties will be part of a legal bid to challenge the NI Protocol. The Democratic Unionist Party (DUP), Ulster Unionists (UUP) and Traditional Unionist Voice (TUV) have said they are supporting judicial review proceedings. Former MEP Ben Habib and former Labour MP Kate Hoey are also backing it. DUP leader Arlene Foster said they were committed to challenging the NI Protocol ""in the courts, in Parliament, in Stormont and in Brussels"". She added that the judicial review proceedings will challenge the NI Protocol's ""compatibility with the Act of Union 1800, the Northern Ireland Act of 1998 and the Belfast Agreement"". The Northern Ireland Protocol is the part of the Brexit deal which prevents a hardening of the land border between Northern Ireland and the Republic of Ireland. It does that by keeping Northern Ireland in the EU single market for goods. That has created a new trade border with Northern Ireland and the rest of the UK. What is the Northern Ireland Protocol? Unionism 'coming together' to oppose NI Protocol What are Brexit border controls between GB and NI? Unionists want the protocol to be scrapped because they say it damages trade and threatens Northern Ireland's place in the UK union. The DUP said Northern Ireland's First Minister Arlene Foster will be named parties in the proceedings along with deputy leader Nigel Dodds, Westminster leader Sir Jeffrey Donaldson and Sammy Wilson, the party's Westminster chief whip. Arlene Foster said that unionists' concerns will not be silenced Mrs Foster said Mr Habib, Mrs Hoey and Traditional Unionist Voice (TUV) leader Jim Allister were so far ""committed to these proceedings but we expect others to also join this path"". She said the protocol ""drove a coach and horses"" through both the Act of Union and the Belfast Agreement, also known as the Good Friday Agreement. ""We are following our five-point plan of opposition to the protocol and will challenge its imposition in the courts, in Parliament, in Stormont and in Brussels,"" she added. ""The views of unionists will not be side-lined nor our concerns silenced."" UUP leader Steve Aiken said that ""testing the NI Protocol in the courts is a fair and legitimate thing to do"". He added that the actions that brought the protocol into force ""fundamentally undermine the principle of consent and laid out in the Belfast Agreement"". ""The absurdities of the protocol affect everyone in Northern Ireland; every legitimate action needs to be taken to deal with this very unequal, disproportionate and divisive treaty,"" he added. TUV leader Jim Allister said he welcomed the planned judicial review challenge and that he hoped ""all strands of unionism will join in this necessary effort"". He said that ""without Ben Habib and Baroness Hoey we would not be at this point"". However, he said that it was ""not a substitute or alternative to sustained and effective political action against the protocol"". The Social Democratic and Labour Party (SDLP), who campaigned against Brexit and have said parties must work together to make the protocol work, described the legal action as ""ill-judged"". ""There will be few with sympathy for the argument that the protocol, which prevents a hard border in Ireland and guarantees dual market access for local businesses, breaches the Good Friday Agreement,"" said SDLP leader Colum Eastwood. ""That notion is stretched even further when the argument is made by a party that opposed the agreement in the first place. ""I'm sure the courts will decide what we all, including the DUP, already know. The protocol is necessary because of the hard Brexit that they supported."" Sinn Féin MP Chris Hazzard said those supporting the judicial review were ""the same unionists who saddled up to the Tories, who throughout the course of the Brexit shambles have treated the people here with utter contempt"". He added that the protocol ""safeguards the Good Friday Agreement, and avoids a hard border on the island of Ireland, and ensures the maintenance of north-south co-operation"". ""What matters is that executive ministers fulfil their legal duty and implement the protocol where they have responsibility to do so, in accordance with the law."" Unionism 'coming together' to oppose NI Protocol What is the new Northern Ireland Brexit trade deal? PM urged to replace 'unworkable' NI Brexit deal LA fire chief warns of further destruction from high winds as 10 confirmed dead What's the latest on the LA fires, and why can't they be put out? Danes struggle with response to Trump Greenland threat 'I paid fake doctor thousands for fillers - now I look like a gargoyle' The Papers: 'Lost Angeles' and 'Musk seeks plan to oust Starmer' Pop star Chappell Roan wins BBC Sound Of 2025 Weekly quiz: Zendaya looked happy but who else sparkled at the Golden Globes? The 20 child abuse inquiry proposals - what has happened so far? The '9/11 mastermind' wants to plead guilty. Why is the US trying to stop him? Why are UK borrowing costs rising and what does it mean for me? In maps: Thousands of acres on fire in LA Before and after: How wildfires tore through LA Ed Gamble hosts the official Traitors podcast Join Ed Gamble and guests as they dissect the first episodes of The Traitors! Can art, music and words bind us in divided times? Simon Schama explores how artists have captured the transformations of British society since 1945 Enjoy a satirical smorgasbord of The News Quiz Digest a dramatic year of news as Andy Zaltzman revels in some of 2024's funniest moments The multi-award-winning legal drama returns Two years on, the Defoes are back and have gathered for a beautiful wedding in Barcelona © 2025 BBC. The BBC is not responsible for the content of external sites.Read about our approach to external linking."
"Global response to moonflower bloom 'amazing'Having thousands watch a rare cactus bloom online leaves the team that planted it ""overwhelmed"".Cambridgeshire","This video can not be played Cambridge moonflower: Time-lapse video captures 'UK first' The team who cared for a rare Amazonian cactus that flowered for just one night have been ""overwhelmed"" by the global response to the bloom. Experts at Cambridge University Botanic Garden believe it is the first time the moonflowerSelenicereus wittiihas bloomed in the UK. Thousands tuned in as the flowering drew close and a YouTube stream has had almost 195,000 views. Glasshouse supervisor Alex Summers said the experience had been ""amazing"". Mr Summers said the flower's scent changed from ""lovely"" to something ""in the realm of public toilets"" The cactus -which normally flowers at night for just 12 hours- caught many of those awaiting the bloom off guardwhen it started to blossom at about 15:00 GMT on Saturday. A webcam had been focused on the single bud for the previous 11 days. Mr Summers said the flower,which was spotted developing in November, had been ""supposed to come out"" at 21:00, ""but plants never read the books"". He said since the bloom, the team had ""been able to record it, pollinate it and share it with as many people as possible"". 'Rotten flesh' flower finally flourishes Botanic garden's plant collection listed online Uni garden shares 'asparagus on steroids' plants However, only the glasshouse's staff have been able to experience its unique scent, which Mr Summers said had ""started off... like honeysuckle or gardenias"", but by morning, had ""slightly altered and we're now in the realm of public toilets"". The bud was spotted developing by the garden's staff in November The plant normally grows high above the Amazonian floodplains by attaching itself to a host plant and flowers at night to attract its two pollinating species of hawkmoth. The delicate petals of the white flower, measuring 11in (28cm) long by 6in (15cm) wide and sitting at a height of 12ft (3.5m) on the plant, started to fade overnight. Thegarden's dedicated moonflower page,externalhas received nearly 205,000 views, from people as far afield as Australia, Finland and Thailand. The moonflower started to bloom in the early afternoon and not at sunset as expected Mr Summers said he thought the interest was due to the cactus usually being ""inaccessible"" where it grows in the ""deepest, darkest Amazon"". He said the team had been ""overwhelmed"", adding: ""People have followed it from start to finish."" Find BBC News: East of England onFacebook,external,Instagram,externalandTwitter,external. If you have a story suggestion emaileastofenglandnews@bbc.co.uk Time-lapse film captures moonflower bloom. Video, 00:00:49Time-lapse film captures moonflower bloom Moonflower's single bloom is 'UK's first' Global viewers wait for 'UK's first' moonflower 'UK first' moonflower to bloom - for 12 hours only Botanic garden's plant collection listed online 'Asparagus on steroids' flowers after 57 years 'Rotten flesh' flower finally flourishes Cambridge University Botanic Garden Stagecoach East bus drivers are standing up against abuse Multi-million pound busway plans move forward as public inquiry looms Campaigners pursue legal challenge to Cambourne to Cambridge busway Cambridge scientists explore science of loneliness - and find interactions may help us avoid disease Free and cheap exercise classes launching in Fenland Seven people found inside cucumber lorry in Cambridgeshire LA fire chief warns of further destruction from high winds as 10 confirmed dead What's the latest on the LA fires, and why can't they be put out? Danes struggle with response to Trump Greenland threat 'I paid fake doctor thousands for fillers - now I look like a gargoyle' The Papers: 'Lost Angeles' and 'Musk seeks plan to oust Starmer' Pop star Chappell Roan wins BBC Sound Of 2025 Weekly quiz: Zendaya looked happy but who else sparkled at the Golden Globes? The 20 child abuse inquiry proposals - what has happened so far? The '9/11 mastermind' wants to plead guilty. Why is the US trying to stop him? Why are UK borrowing costs rising and what does it mean for me? In maps: Thousands of acres on fire in LA Before and after: How wildfires tore through LA Ed Gamble hosts the official Traitors podcast Join Ed Gamble and guests as they dissect the first episodes of The Traitors! Can art, music and words bind us in divided times? Simon Schama explores how artists have captured the transformations of British society since 1945 Enjoy a satirical smorgasbord of The News Quiz Digest a dramatic year of news as Andy Zaltzman revels in some of 2024's funniest moments The multi-award-winning legal drama returns Two years on, the Defoes are back and have gathered for a beautiful wedding in Barcelona © 2025 BBC. The BBC is not responsible for the content of external sites.Read about our approach to external linking."
