headline,article
Sunak confirms U-turn on windfall tax,"This video can not be played Rishi Sunak says eight million households will get £1,200 in support, when combining measures announced on Thursday and before The government has U-turned on its opposition to a windfall tax on oil and gas firms, announcing it will introduce a levy to help tackle rising bills. Ministers had rejected the idea - put forward by opposition parties - that would see a one-off charge imposed on the company's record profits. But Chancellor Rishi Sunak said his levy would ""tax extraordinary profits fairly and incentivise investments"". Labour's Rachel Reeves said Mr Sunak had ""finally come to his senses"". The chancellor said new tax would raise £5bn over the course of the next year, allowing the government to ""help families with the cost of living"", while avoiding ""having to increase our debt burden further"". He added: ""There is nothing noble in burdening future generations with ever more debt today because politicians of the day were too weak to make the tough decisions."" LIVE: Sunak unveils more cost of living help How would a windfall tax on energy firms work? Typical energy bill set to rise by £800 a year The new tax will help funda £15bn package from the government, which includes a £650 one-off payment for eight million low income households, and a change to the £200 loan scheme for energy bills for all homes in the autumn - increasing it to £400 without the need to pay it back. But Liberal Democrat Treasury spokeswoman Christine Jardine said the measures were ""too little, too late"". The plans received a mixed reaction from the Conservative backbenchers, with some calling it ""tripe"" and others saying it did not go far enough. The government faced accusations that it had timed the announcement to distract fromthe release of the Sue Gray reportinto lockdown-breaking parties in Downing Street during the pandemic. But the claims were denied by No 10. This video can not be played Rachel Reeves says the Conservative windfall tax is a ""policy that dare not speak its name"". Households across the country have faced soaring costs in recent months as the prices of food, fuel and energy have all rocketed, with inflation hitting a 40-year high. The government has been under growing pressure to act, especially afterenergy regulator Ofgem warned of an additional rise to bills of £800 in the autumn. The Liberal Democrats first put forward the idea of a windfall tax on the profits of oil and gas companies - which have peaked as the economy restarted after the pandemic - in November, with Labour outlining its own version in January. The SNP has also called for such a measure. The parties said the money raised could go towards helping those households hardest hit by the cost of living increases. Initially, the idea was rejected by ministers, including Boris Johnson, who warned it could ""deter"" investment. But both Mr Johnson and Mr Sunak subsequently softened their stance, and now the policy U-turn has been confirmed. Making a statement in the Commons, the chancellor said the inflation faced by the UK was causing ""acute distress for the people of this country"" and he knew people were worried. But, Mr Sunak added: ""This government will never stop trying to help people, to fix problems where we can, to do what is right - as we did during the pandemic."" He confirmed the government would introduce a ""temporary targeted energy profits levy"" charged at a rate of 25% on profits of oil and gas companies to fund ""significant support for the British people"". However, he said his ""sensible middle ground"" plan included a new investment allowance, so ""for every pound a company invests they will get back 90% in tax relief - the more the company invests the less tax they will pay"". Mr Sunak said: ""We should not be ideological about this, we should be pragmatic. ""It is possible to both tax extraordinary profits fairly and incentivise investments."" The chancellor said the tax would then be removed when energy prices returned to normal levels. Shadow chancellor Ms Reeves said the government had been ""dragged kicking and screaming"" to its new policy position. She added: ""The chancellor has finally come to his senses, U-turned, and adopted Labour's plan for a windfall tax on oil and gas producer profits to lower bills."" But Ms Reeves claimed the government ""still have no long term plan to grow our economy and pull us out of the mess they've got us into"". What does this change of tack signal? The cabinet was split on whether to bring in a windfall tax Analysis by David Wallace Lockhart, BBC political correspondent Ministers have been facing calls to do more to help with the cost of living for quite some time. So why today? As recently as the weekend, Downing Street sources were indicating there would be no imminent announcement on windfall taxes. And it was only a couple of weekends ago Business Secretary Kwasi Kwarteng called it a ""bad idea"". So why the change of heart? Well, ministers have been clear for some time that more help is on the way. And they did get a clearer idea of future energy prices this week. But - to be more cynical - the government had a particularly uncomfortable day on Wednesday with the publication of the Sue Gray report into Downing Street gatherings. Boris Johnson has made it clear that he's desperate to stop talking about parties. An announcement of billions of pounds of assistance for households certainly helps to move the agenda on. Downing Street deny that the timing of this has anything to do with Partygate. But plenty of opposition MPs won't buy that argument. The package of measures announced by Mr Sunak was attacked by many of his opponents for not going far enough. Lib Dem leader Sir Ed Davey criticised the government for failing to cut taxes for workers, pointing to the new health and social care levy introduced in April amid the cost of living crisis. He tweeted: ""Sunak's like a thief who steals your car and then wants you to be grateful when he returns the steering wheel."" The SNP's Kirsty Blackman said the government had ""listened to a certain extent"", but had ""failed"" on a number of measures, especially her party's call to uprate benefits in line with inflation. She told the BBC the one-off payment was ""kicking the can down the road"" and those hit hardest could face more difficulties in the future. When it came to Mr Sunak's own benches, Conservatives appeared split on both the policies and how to fund them. Richard Drax accused the chancellor of ""throwing red meat to the socialists by raising taxes on businesses"", adding a windfall tax was ""not the Conservative way"" of doing things. Another backbench Tory, Craig Mackinlay, said he was ""appalled that a Conservative chancellor could come up with this tripe"", calling the tax ""outrageous"" and ""inherently wrong"". Former party leader Sir Iain Duncan Smith, however, called the chancellor's statement ""a good start and welcome"", but added: ""More needs to be done. ""Our response to this economic crisis should have three goals at its centre: adequate financial support for the poorest, helping those who are able into work, and reducing the burden of taxation."" Comments can not be loaded To load Comments you need to enable JavaScript in your browser Death toll rises as governor confirms hydrants issue 'impaired' LA wildfires fight 'I have nothing to go back to' - reporter tells of LA fires heartbreak Reeves pledges to 'make UK better off' on China visit LA fires: How three days of devastation unfolded What's the latest on the Los Angeles wildfires and what caused them? 'Cold bites' gas supply and 'Dementia shock' 'My mum died after four days on an A&E trolley' The '9/11 mastermind' wants to plead guilty. Why is the US trying to stop him? Pop star Chappell Roan wins BBC Sound Of 2025 Weekly quiz: Zendaya looked happy but who else sparkled at the Golden Globes? Inside the UK's first legal drug consumption room Danes struggle with response to Trump Greenland threat Dragons’ Den returns with a new line-up of celebrity guests Can a fresh batch of entrepreneurs secure the deal of a lifetime? Are smart scales really as ‘smart’ as they claim to be? Greg Foot explores whether they can accurately measure weight, body fat, muscle and bone mass The award-winning psychological competition is back A nail-biting game of detection, backstabbing and trust. Who will make it through? How close are we to a cancer vaccine? How might it help in the treatment of the disease? © 2025 BBC. The BBC is not responsible for the content of external sites.Read about our approach to external linking."
Bills help will have minimal inflation impact - Sunak,"This video can not be played BBC Political Editor Chris Mason asks the chancellor why he uses “energy profits levy"" phrase - and not say windfall tax. Rishi Sunak says new measures to ease the cost of living crisis will have a ""minimal impact"" on inflation. The chancellor told the BBC he had struck the ""right balance"" between supporting people and pushing prices ""excessively"" higher. Earlier, Mr Sunakannounced£15bn to reduce energy bills, partly funded by a windfall tax on oil and gas firms. He denied the announcement was rushed out to divert attention from areportinto rule-breaking parties in No 10. He said he had chosen to set out the measures this week because Ofgem, the energy regulator,had released their forecastof expected energy price rises. ""That meant we could scale and size our policies effectively,"" he said. How would a windfall tax on energy firms work? Sunak confirms U-turn on windfall tax Chris Mason: What was behind Sunak's mini Budget? The chancellor's decision to impose a 25% levy on oil and gas firms came after weeks of government ministers repeatedly rejecting the idea. The windfall tax plan - put forward by Labour, the Liberal Democrats and SNP - would see a one-off charge imposed on the companies' record profits. Mr Sunak avoided calling his measure a windfall tax, instead referring to it as a ""temporary, targeted energy profits levy"". ""These are windfall profits and they will be taxed,"" he said, but added that the levy would also include incentives to encourage businesses to invest. He noted that opposition parties had made similar proposals, but said: ""I think they were blunt instruments."" ""We have designed something that will continue to incentivise and encourage investment,"" he told BBC political editor Chris Mason. Households have come under pressure in recent months as food and energy costs have risen, with inflation hitting a 40-year high. Under Mr Sunak's new measures, every household will get an energy bill discount of £400. Eight million households on means-tested benefits will also get a payment of £650 paid into their account in two lump sums. In addition to a windfall tax, the extra support will be funded by around £10bn of extra borrowing. Prime Minister Boris Johnson has previously suggested providing more support could risk an ""inflationary spiral"" as giving people more money could lead to further price rises. But Mr Sunak said he had targeted support at the most vulnerable households in order to avoid ""fuelling inflation and making the situation worse"". ""That is something that I do watch and I worry about."" This video can not be played Rachel Reeves says the Conservative windfall tax is a ""policy that dare not speak its name"". Asked if he was worried about a recession Mr Sunak said he was concerned about inflationary pressures but confident about the future of the economy. Responding to his announcement in Parliament, shadow chancellor Rachel Reeves said Mr Sunak had ""finally come to his senses"". But his method of partly funding support through a windfall tax was criticised by some Conservative backbenchers. Richard Drax accused the chancellor of ""throwing red meat to socialists"". And Craig Mackinlay described the tax as ""tripe"". Sunak confirms U-turn on windfall tax Death toll rises as governor confirms hydrants issue 'impaired' LA wildfires fight 'I have nothing to go back to' - reporter tells of LA fires heartbreak Reeves pledges to 'make UK better off' on China visit LA fires: How three days of devastation unfolded What's the latest on the Los Angeles wildfires and what caused them? 'Cold bites' gas supply and 'Dementia shock' 'My mum died after four days on an A&E trolley' The '9/11 mastermind' wants to plead guilty. Why is the US trying to stop him? Pop star Chappell Roan wins BBC Sound Of 2025 Weekly quiz: Zendaya looked happy but who else sparkled at the Golden Globes? Inside the UK's first legal drug consumption room Danes struggle with response to Trump Greenland threat Dragons’ Den returns with a new line-up of celebrity guests Can a fresh batch of entrepreneurs secure the deal of a lifetime? Are smart scales really as ‘smart’ as they claim to be? Greg Foot explores whether they can accurately measure weight, body fat, muscle and bone mass The award-winning psychological competition is back A nail-biting game of detection, backstabbing and trust. Who will make it through? How close are we to a cancer vaccine? How might it help in the treatment of the disease? © 2025 BBC. The BBC is not responsible for the content of external sites.Read about our approach to external linking."
P&O boss 'incredibly sorry' for impact of sackings,"This video can not be played P&O boss Peter Hebblethwaite spoke to the BBC's Transport Correspondent Katy Austin The boss of P&O Ferries has said he is ""incredibly sorry"" for the impact felt by hundreds of staff who were recently sacked by the company without notice. But Peter Hebblethwaite insisted the decision was ""the route we only deemed possible"". P&O Ferries sacked almost 800 seafarers in March and replaced them with foreign agency workers paid less than the minimum wage. The move sparked outrage andled to calls for Mr Hebblethwaite to resign. At the time, P&O Ferries said the decision would ensure the future of the business. When asked how he would feel if he was sacked in the same way, Mr Hebblethwaite told the BBC it is ""not pleasant being made redundant"". ""I'm incredibly sorry, on the decision we took had a material impact on a number of our ex-employees. And I do regret that,"" he added. However, the P&O Ferries boss insisted the move was ""the route we only deemed possible for us to take"", and part of ""a difficult decision and repositioning for a better future"". P&O brings back passengers on cross-Channel route P&O Ferries hits back at new staff pay cut claim Are the P&O Ferries sackings legal? When P&O Ferries previously made redundancies due to economic pressures caused by the coronavirus pandemic, the business had consulted unions before, but decided not to when it sacked hundreds more 10 weeks ago. Mr Hebblethwaite denied the decision to sack staff meant the firm was taking part in a race to the bottom on pay and standards, saying P&O needed to modernise and become competitive. He claimed it had issued the biggest redundancy package in maritime history. When pushed on how he justified ignoring the legal requirement to consult staff in advance of redundancy, and on the details of how and when the decision was made on how staff were to be sacked, the P&O Ferries boss declined to comment due to an ongoing investigation by the insolvency service. He also refused to comment on whether the flag status of P&O Ferries' ships meant the company could get round UK workers' rights. It was put to Mr Hebblethwaite that the decision had resulted in a huge reputational hit, but he said that was not what the P&O was experiencing, adding the firm had ""seen really encouraging bookings coming through"". When challenged on pay levels, and the fact that seafarers on Dover to Calais route were being paid well below the UK National Minimum Wage, he said the firm's wages were consistent with international standards, adding the crewing model was consistent with 80% of global shipping. However, he said if the law was changed in the UK, as per the government's ambitions to pay seafarers working in and out of British ports the minimum wage, the company ""will absolutely do what we are required to do by law"". The chief executive also said the firm was ""trying very hard"" to return items to former workers, but admitted some possessions were still missing after being left on the ships when sacked workers were escorted off. This was the first time Peter Hebblethwaite has taken questions from the media, on camera, since the shock dismissal of 786 seafarers. We learned a bit about his background. He trained as an accountant and worked in retail and hospitality operations before joining P&O Ferries in 2019. Mr Hebblethwaite on the one hand expressed regret over the impact on sacked workers, but on the other hand was bullish about the company's future. He confirmed some sacked workers still haven't had personal belongings returned but insisted this was a small number and efforts continued to locate missing items - although he couldn't guarantee they would all be found. He described plans to give the business a ""glorious"" future, and believes customers will return. The company expects to take delivery of new high-tech ships next year. P&O clearly wishes to move on. But the events of 17 March did not only affect workers who lost their jobs, and prompt outrage from politicians and unions. They also clearly caused reputational damage to the business. Real anger still exists among sacked workers about how they have been treated. And it seems unlikely the difficult questions will disappear, even as P&O looks to the future. Separately, Mr Hebblethwaite apologised to customers about the impact of ferries being out of service, particularly on the busy Dover-Calais crossing. P&O Ferries services were suspended after the mass sackings and several of the company's vessels failed safety inspections before being cleared to re-enter service. The reduced ferry capacity was a contributing factor in particularly long lorry queues building up on the way to Dover before Easter. Mr Hebblethwaite spoke to the BBC for an exclusive interview aboard the Pride of Kent, which was passed fit to sail at the fourth attempt. Admitting it took ""longer than they would have liked"" to get its ships back into service, the chief executive said it had been ""a difficult couple of months"". ""I want to say sorry to our customers for the delay in us getting back into service, but it was important that safety was right. We are being held to a high standard,"" he said. Are the P&O Ferries sackings legal? Not consulting on cuts broke law, P&O boss admits Death toll rises as governor confirms hydrants issue 'impaired' LA wildfires fight 'I have nothing to go back to' - reporter tells of LA fires heartbreak Reeves pledges to 'make UK better off' on China visit LA fires: How three days of devastation unfolded What's the latest on the Los Angeles wildfires and what caused them? 'Cold bites' gas supply and 'Dementia shock' 'My mum died after four days on an A&E trolley' The '9/11 mastermind' wants to plead guilty. Why is the US trying to stop him? Pop star Chappell Roan wins BBC Sound Of 2025 Weekly quiz: Zendaya looked happy but who else sparkled at the Golden Globes? Inside the UK's first legal drug consumption room Danes struggle with response to Trump Greenland threat Dragons’ Den returns with a new line-up of celebrity guests Can a fresh batch of entrepreneurs secure the deal of a lifetime? Are smart scales really as ‘smart’ as they claim to be? Greg Foot explores whether they can accurately measure weight, body fat, muscle and bone mass The award-winning psychological competition is back A nail-biting game of detection, backstabbing and trust. Who will make it through? How close are we to a cancer vaccine? How might it help in the treatment of the disease? © 2025 BBC. The BBC is not responsible for the content of external sites.Read about our approach to external linking."
