headline,article
China threatens Huawei arrest consequences,"Meng Wanzhou is the daughter of the company's founder China has demanded that Canada release the arrested Huawei executive Meng Wanzhou or face consequences. Vice Foreign Minister Le Yucheng separately summoned both the US and Canadian ambassadors and lodged a ""strong protest"" urging her release. The ministry described Ms Meng's arrest as ""extremely nasty"". Ms Meng, Huawei's chief financial officer and daughter of the firm's founder, is accused of breaking US sanctions on Iran. She was held in Vancouver last Saturday and faces extradition to the US, where she could be jailed for up to 30 years if found guilty. China insists that she has not violated any laws. Why Huawei matters in five charts What's going on with Huawei? A quick guide to the US-China trade war On Friday Ms Meng appeared before a Canadian court, which adjourned a decision on whether or not to allow bail until Monday. Ms Meng's arrest while she was changing planes in Vancouver last Saturday was a serious breach of her rights, Reuters quoted the foreign ministry as saying. It ""ignored the law"" and was ""unreasonable"", it said. ""China strongly urges the Canadian side to immediately release the detained person... otherwise Canada must accept full responsibility for the serious consequences caused,"" the statement added. On Sunday, Le Yucheng made similar demands to the US, warning: ""China will respond further depending on US actions."" The Supreme Court of British Columbia was told that Ms Meng had used a Huawei subsidiary called Skycom to evade sanctions on Iran between 2009 and 2014. A court sketch shows Meng Wanzhou during Friday's bail hearing The court was told that she had publicly misrepresented Skycom as being a separate company. It heard a Canadian prosecutor say that Ms Meng was accused of ""conspiracy to defraud multiple financial institutions"". The prosecutor said she had denied to US bankers any direct connections between Huawei and SkyCom, when in fact ""SkyCom is Huawei"". Ms Meng could be a flight risk and thus should be denied bail, he added. The arrest has put further strain on US-China relations. The two countries have been locked in trade disputes, althougha 90-day truce had been agreedon Saturday - before news of the arrest came to light on Wednesday. Huawei is one of the largest telecommunications equipment and services providers in the world, recently passing Apple to become the second-biggest smartphone maker after Samsung. Canadian Foreign Minister Chrystia Freeland said on Friday that China had been assured that due process was being followed and Ms Meng would have consular access while her case was before the courts. Ms Freeland reiterated Prime Minister Justin Trudeau's claim that Ms Meng's arrest had ""no political involvement"". By BBC Monitoring Meng Wanzhou, 46, joined Huawei as early as 1993, when she began a career at her father's company as a receptionist. After she graduated with a master's degree in accountancy from the Huazhong University of Science and Technology in 1999, she joined the finance department of Huawei. She became the company's chief finance officer in 2011 and was promoted to vice-chair a few months before her arrest. Ms Meng's links to her father, Ren Zhengfei, were not known to the public until a few years ago. In a practice highly unusual in Chinese tradition, she adopted her family name not from her father but her mother, Meng Jun, who was Mr Ren's first wife. Some Western governments fear Beijing will gain access to fifth-generation (5G) mobile and other communications networks through Huawei and expand its spying ability, although the firm insists there is no government control. Japan is expected to ban government use of products made by Huawei and ZTE over cybersecurity concerns, local media reported on Friday.It would follow moves by New Zealand and Australia to block Huawei. Should we worry about Huawei? Why has the UK not blocked Huawei? US National Security Adviser John Bolton said his country has had ""enormous concerns for years"" about the practice of Chinese firms ""to use stolen American intellectual property, to engage in forced technology transfers, and to be used as arms of the Chinese government's objectives in terms of information technology in particular"". ""Not respecting this particular arrest, but Huawei is one company we've been concerned about,"" he said. US PresidentDonald Trump last month reinstated all the US sanctions on Iranthat had been removed under a 2015 nuclear deal. Trump re-imposes Iran sanctions: Now what? Iran nuclear deal: Key details Mr Trump had been fiercely opposed to the deal, which saw Iran limit its controversial nuclear activities in exchange for sanctions relief. The re-imposed sanctions hit oil exports, shipping and banks - all core parts of Iran's economy. Although there are some waivers, US Treasury Secretary Steven Mnuchin has said the US will ""aggressively"" target any firm or organisation ""evading our sanctions"". Timeline: What's going on with Huawei? Huawei arrest a 'hostage' in a new tech war US-China trade war in 300 words Should we worry about Huawei? Wildfire sweeps through Hollywood Hills and threatens landmarks as chaos grips LA Paris Hilton among stars 'heartbroken' as she watches home 'burn to ground' 'Mum waited 31 hours' : Your stories of A&E Sound Of 2025: Ezra Collective are 'keeping music real' The Papers: 'Apocalypse' LA and 'Reeves faces extra tax rises' How Australia's beach cabana drama sparked a turf war H-1B: Visa row under Trump fuels anxiety for Indian dreamers 'I thought I was going to die': Jailed Venezuelan activist details brutality of prison life The man who could become Canada's future PM 'Trump 2.0' looms large over the global economy A politician was shot dead in Bangkok. Did another country do it? Chris Mason: Is Starmer leaving the door open to an abuse inquiry? Delivering brand-new miracles in 1970s East End Watch the latest series of Call the Midwife on iPlayer now Mark-Anthony Turnage shares the soundtrack of his life Once called 'Britainâs hippest composer', he's tackled topics from drug abuse to football in his work Paddyâs loaf-changing experience inside the bread factory Paddy McGuinness visits the bread factory he used to work in, and sees how they make 1.4 million loaves a week What's behind the global surrogacy boom? More countries are banning surrogacy â but demand is growing Â© 2025 BBC. The BBC is not responsible for the content of external sites.Read about our approach to external linking."
How China's tech sensation overtook Apple,"Huawei is the poster child for China's dynamic tech sector. It has grown phenomenally in recent years, from a small manufacturer of telephone exchange switches, to become a global leader in the tech industry. While the brand is familiar to many from its mobile phone handsets, Huawei has its finger in many other pies - from cloud services to artificial intelligence. And despite increasing controversy around whether using Huawei telecoms equipmentposes a security risk, the block on its business deals in some countries, andthe arrest in Canada of one of its executives, the company itself has continued on its steady path of global growth. That growth has come against the backdrop of China's continued rise, on its way to becoming the world's second largest economy, providing the firm with a huge base upon which to build its initial market as a springboard to international expansion. Most noticeably for consumers, Huawei has swept into the market for consumer electronics, in particular with smartphones. Earlier this year it overtook Apple in the number of handsets it was shipping worldwide. Shipments don't always translate into phones reaching consumers, but the uptick in production and distribution still reflectsa rise in Huawei's popularity, including for both premium models and its lower-priced Honor brand. Expanding sales of smartphones comes despite political hostility towards the brand in some parts of the world, especially the US. There, no carriers support Huawei, so while consumers can buy a Huawei phone, they aren't widely marketed. But it's in telecoms network equipment, which forms the largest part of Huawei's business, that is having its greatest impact on the company. The US has banned the use of Huawei equipment in communications networks, warning of security risks and has called for other governments to follow suit. Nevertheless, in all parts of the world, even in the Americas, the market for Huawei products has grown over the past three years. Washington's decision to block the use of Huawei equipment in telecommunications infrastructure on security grounds has been emulated in New Zealand, Australia and Japan. With the US pressing for other governments to follow suit, that raises questions over whether the firm's global expansion is set to be curtailed in some regions in the near future. Currently though, Huawei is holding its own in one of the largest parts of its business, the sale of mobile telecommunications infrastructure equipment, such as that needed to supportthe roll-out of faster 5G networks. But how much Huawei continues to grow, won't depend only on political attitudes in Western capitals. It will depend on how well the Chinese tech giant's products compare with its competitors. In the past, the firm has been accused - like many Chinese companies - of copying technology developed in the West and then undercutting rivals on prices. But Huawei is currently outspending many other global players in research and development in a bid to gain a future edge. Prospects may not be as bright for Huawei now as they used to be, given the political squeeze from the West. But, the firm went through the financial crisis largely unaffected thanks to a powerful domestic market in China, IHS Markit industry analyst Stephane Teral points out. The same could happen again if it loses more contracts in the West. ""Huawei went through this unfazed with no problems, because they were able to diversify at a time when China was just taking off, including telecoms restructuring, that really helped Huawei,"" he said. Should we worry about Huawei? Huawei arrest a 'hostage' in a new tech war Wildfire sweeps through Hollywood Hills and threatens landmarks as chaos grips LA Paris Hilton among stars 'heartbroken' as she watches home 'burn to ground' 'Mum waited 31 hours' : Your stories of A&E Sound Of 2025: Ezra Collective are 'keeping music real' The Papers: 'Apocalypse' LA and 'Reeves faces extra tax rises' How Australia's beach cabana drama sparked a turf war H-1B: Visa row under Trump fuels anxiety for Indian dreamers 'I thought I was going to die': Jailed Venezuelan activist details brutality of prison life The man who could become Canada's future PM 'Trump 2.0' looms large over the global economy A politician was shot dead in Bangkok. Did another country do it? Chris Mason: Is Starmer leaving the door open to an abuse inquiry? Delivering brand-new miracles in 1970s East End Watch the latest series of Call the Midwife on iPlayer now Mark-Anthony Turnage shares the soundtrack of his life Once called 'Britainâs hippest composer', he's tackled topics from drug abuse to football in his work Paddyâs loaf-changing experience inside the bread factory Paddy McGuinness visits the bread factory he used to work in, and sees how they make 1.4 million loaves a week What's behind the global surrogacy boom? More countries are banning surrogacy â but demand is growing Â© 2025 BBC. The BBC is not responsible for the content of external sites.Read about our approach to external linking."
'I feel cheated' - right to die campaigner,"Noel Conway is dependent on a ventilator to help him breathe Noel Conway says ""a medieval mindset"" has prevented him having the right to control when he dies. The retired lecturer from Shropshire, who is terminally ill with motor neurone disease, was refused permission by the Supreme Court last week to challenge the law on assisted dying. He told me he was ""bitterly disappointed, bewildered, and felt cheated"" by the decision. The only way he can end his life now in the UK is to remove his ventilator. But Mr Conway is not ready to die. He is too busy publishing a collection of short stories and finishing his memoirs. He uses voice recognition software to dictate to his computer because he has no movement below his head and neck. Mr Conway wants a doctor to be allowed to prescribe him a lethal dose of drugs, when he has less than six months to live. Before his illness Noel Conway was a keen skier, climber and cyclist Supported by the campaign group Dignity in Dying, his legal team have spent the past two years challenging the blanket ban on assisted dying. They argue that the Suicide Act, which makes it an offence to help someone to die, contravenes the European Convention on Human Rights. But that legal challenge came to an abrupt end at the end of November, when the Supreme Court refused permission to hear an appeal - Mr Conway's case had already been rejected by two lower courts. Mr Conway, who was diagnosed with motor neurone disease in 2014, told me he was ""bitterly disappointed, bewildered, and felt cheated"". Speaking at his home in Shropshire he told me that more and more jurisdictions around the world were introducing assisted dying: ""One hundred million people worldwide can access a dignified and humane ending to their lives, but we can't in this country. ""We are governed by a medieval mindset which overrides more modern ways of thinking, like the Human Rights Act."" Mr Conway said his only option of ending his life in this country was by removing his ventilator. He is still able to breathe without the mechanical device for short periods, and there is uncertainty as to how long he might survive without it. ""If it's removed I should have only a few minutes to live, but it could be hours or even days."" The Supreme Court was told that any distress could be managed through palliative care. Mr Conway says he accepts there would be pain relief, but argues that it would leave him in a ""semi-conscious state"" and deny him a dignified death: ""It would be terrible for my wife and family, not knowing whether I could hear them or how long it would take before I expired."" Mr Conway told me he would continue to campaign for assisted dying, even though all legal options are now closed. MPs overwhelmingly rejected proposals to allow assisted dying in England and Wales in 2015. Care Not Killing, which opposes assisted dying, said the Supreme Court had been right to reject a ""dangerous attempt to legalise assisted suicide"", adding that the current law balances an individual's rights with the need to protect vulnerable people, who could feel pressured into ending their lives. Follow Fergus onTwitter.,external Terminally ill man's right-to-die fight Right-to-die man loses final legal bid Wildfire sweeps through Hollywood Hills and threatens landmarks as chaos grips LA Paris Hilton among stars 'heartbroken' as she watches home 'burn to ground' 'Mum waited 31 hours' : Your stories of A&E Sound Of 2025: Ezra Collective are 'keeping music real' The Papers: 'Apocalypse' LA and 'Reeves faces extra tax rises' How Australia's beach cabana drama sparked a turf war H-1B: Visa row under Trump fuels anxiety for Indian dreamers 'I thought I was going to die': Jailed Venezuelan activist details brutality of prison life The man who could become Canada's future PM 'Trump 2.0' looms large over the global economy A politician was shot dead in Bangkok. Did another country do it? Chris Mason: Is Starmer leaving the door open to an abuse inquiry? Delivering brand-new miracles in 1970s East End Watch the latest series of Call the Midwife on iPlayer now Mark-Anthony Turnage shares the soundtrack of his life Once called 'Britainâs hippest composer', he's tackled topics from drug abuse to football in his work Paddyâs loaf-changing experience inside the bread factory Paddy McGuinness visits the bread factory he used to work in, and sees how they make 1.4 million loaves a week What's behind the global surrogacy boom? More countries are banning surrogacy â but demand is growing Â© 2025 BBC. The BBC is not responsible for the content of external sites.Read about our approach to external linking."
Gunman's seized trainers up for auction,"A studded pair of Christian Louboutin high tops is among the pairs of trainers that will be up for auction Dozens of pairs of designer trainers that were seized after a gangster was arrested are to be sold at auction. Isaiah Hanson-Frost, 22, is serving a six-year jail sentence for shooting a gun at a car containing rival gang members. The 55 pairs of trainers, valued at about Â£18,500. include brands such as Christian Louboutin, Louis Vuitton, Jimmy Choo and Gucci. The money raised will go towards helping to prevent crime. During a hearing at Gloucester Crown Court on 23 November, Hanson-Frost denied possession of criminal property but agreed to hand over the collection. A total of 55 pairs will be auctioned off to raise money for the High Sheriff's Fund in Gloucestershire Under the Police Property Act, the Gloucestershire force can auction off the trainers. Det Insp Dave Shore-Nye said: ""We often see the reason for someone to commit crime is down to their own personal greed and to make money. ""We are keen to put a stop to anyone who is living a lavish lifestyle which has been funded through crime, and this shows the level Gloucestershire Constabulary will go to in order to strip a criminal of their assets and then put the money to good use."" These trainers are by the Italian designer Giacomo Morelli Hanson-Frost was jailed in Aprilafter admitting violent disorder and possessing a firearm with intent to cause fear of violence in relation to the shooting, which happened on the Chase Lane Industrial Estate in Gloucester. Hanson-Frost, who was cleared of possession of criminal property last month when the prosecution chose not to proceed with the case, will be allowed to keep any Nike trainers valued at less than Â£100. This pair of Jimmy Choo trainers was one of many pairs owned by the fashion-conscious criminal Men jailed after drugs feud shooting Man's guilty plea after death of much-loved Yate mum Thief grabs knife whilst stealing Rolex and car in Cotswold home burglary Best pothole repair machine selected after trial Queenâs son and Strictly star to compete in special Cirencester event The Cotswolds named as one of best places to live in country Where our area ranks as 'best places to live' in country revealed Wildfire sweeps through Hollywood Hills and threatens landmarks as chaos grips LA Paris Hilton among stars 'heartbroken' as she watches home 'burn to ground' 'Mum waited 31 hours' : Your stories of A&E Sound Of 2025: Ezra Collective are 'keeping music real' The Papers: 'Apocalypse' LA and 'Reeves faces extra tax rises' How Australia's beach cabana drama sparked a turf war H-1B: Visa row under Trump fuels anxiety for Indian dreamers 'I thought I was going to die': Jailed Venezuelan activist details brutality of prison life The man who could become Canada's future PM 'Trump 2.0' looms large over the global economy A politician was shot dead in Bangkok. Did another country do it? Chris Mason: Is Starmer leaving the door open to an abuse inquiry? Delivering brand-new miracles in 1970s East End Watch the latest series of Call the Midwife on iPlayer now Mark-Anthony Turnage shares the soundtrack of his life Once called 'Britainâs hippest composer', he's tackled topics from drug abuse to football in his work Paddyâs loaf-changing experience inside the bread factory Paddy McGuinness visits the bread factory he used to work in, and sees how they make 1.4 million loaves a week What's behind the global surrogacy boom? More countries are banning surrogacy â but demand is growing Â© 2025 BBC. The BBC is not responsible for the content of external sites.Read about our approach to external linking."
"Man traced on missing airman footageCorrie Mckeague's mother says the public would be ""horrified"" if they saw the CCTV footage.Suffolk","Corrie Mckeague's mother said the CCTV footage showed her son ""did not go in the bin"" A man captured on CCTV and believed by a missing airman's mother to be her son has identified himself to detectives. Police viewed the footage during their investigation into Corrie Mckeague's disappearance from Bury St Edmunds, Suffolk, in September 2016. His mother Nicola Urquhart said the public would be ""horrified"" to see it, as it cast doubt on the police theories over her son's whereabouts. Police said the man captured on CCTV had been traced. The BBC asked for the CCTV footage to be released under the Freedom of Information Act. Suffolk Police turned down the request on the grounds of data protection laws. Mr Mckeague was last seen on CCTV at 03:25 BST on 24 September 2016 Mr Mckeague was last seen entering a bin loading bay when he was on a night out in Bury St Edmunds, leadingpolice to believe he had gone into one of the bins. But his remains were not found despite a 20-week trawl of a landfill site near Cambridge. Missing airman 'in waste disposal system' The tragedy that shaped Corrie Mckeague Missing airman 'may have dodged CCTV' Mrs Urquhart said she had viewed CCTV footage which she said showed a man leaving the bin loading bay. She said the footage was ""grainy"" but it showed a person ""wearing incredibly bright, reflective clothing, which looks like white trousers"". Mrs Urquhart said she believed it was her son and if members of the public saw the footage ""no-one would believe he went in the bin"". Detectives spent 20 weeks searching the landfill site in Milton, Cambridgeshire Suffolk Police said the footage showed three individuals who were ""tracked walking into the area and away from the area"". It said clearer images of them were found, ""enabling identification"". The force said all three individuals had been spoken to by police and had identified themselves from the images. It said it was ""confident"" none of them was Mr Mckeague. The force said the individuals were ruled out in autumn 2016. Mr Mckeague, originally from Dunfermline, Fife, was 23 when he went missing. He was last seen entering in the bin loading area at 03:25 on 24 September. Missing airman 'may have dodged CCTV' Missing airman 'in waste disposal system' Missing Corrie search to be stood down Corrie Mckeague's mother shares video. Video, 00:00:24Corrie Mckeague's mother shares video The tortuous search for Corrie Mckeague Missing airman 'known to sleep in bins' Suffolk Constabulary Townâs history brought to life with new description panels Food festival set to return with new wine tasting area High street Post Office announces relocation date Spectacular fireworks displays illuminate skies above landmark pier See inside new steakhouse restaurant on opening day Cordon in place around Job Centre in seaside town Wildfire sweeps through Hollywood Hills and threatens landmarks as chaos grips LA Paris Hilton among stars 'heartbroken' as she watches home 'burn to ground' 'Mum waited 31 hours' : Your stories of A&E Sound Of 2025: Ezra Collective are 'keeping music real' The Papers: 'Apocalypse' LA and 'Reeves faces extra tax rises' How Australia's beach cabana drama sparked a turf war H-1B: Visa row under Trump fuels anxiety for Indian dreamers 'I thought I was going to die': Jailed Venezuelan activist details brutality of prison life The man who could become Canada's future PM 'Trump 2.0' looms large over the global economy A politician was shot dead in Bangkok. Did another country do it? Chris Mason: Is Starmer leaving the door open to an abuse inquiry? Delivering brand-new miracles in 1970s East End Watch the latest series of Call the Midwife on iPlayer now Mark-Anthony Turnage shares the soundtrack of his life Once called 'Britainâs hippest composer', he's tackled topics from drug abuse to football in his work Paddyâs loaf-changing experience inside the bread factory Paddy McGuinness visits the bread factory he used to work in, and sees how they make 1.4 million loaves a week What's behind the global surrogacy boom? More countries are banning surrogacy â but demand is growing Â© 2025 BBC. The BBC is not responsible for the content of external sites.Read about our approach to external linking."
