headline,article
Four dead and three hurt in Leeds crash,"The four men, aged 18, 19, 19, and 21, died at the scene Four young men died and a teenage girl was left critically ill in a collision involving a car and a taxi in the early hours. The four men, aged 18, 19, 19, and 21, died at the scene on the A6120 outer ring road, West Yorkshire Police said. Their Seat Leon ""was travelling at speed"" when it crashed in Horsforth at about 02:40 BST, the force said. Two girls, aged 16 and 17 also in the car, were taken to hospital.  The Uber taxi driver was also seriously hurt. The 16-year-old remains in a critical condition and the 17-year-old's injuries are not considered life threatening, the force said. All six people who were in the car come from the local area, said police. The driver of the taxi, a 42-year-old man from Bradford, is also being treated in hospital but his condition is not considered life threatening. More stories from Yorkshire Acting Supt Richard Padwell, of Leeds District Police, said: ""The deaths of four young people in these circumstances is clearly very tragic and our thoughts and condolences go out to everyone affected by it. ""We don't underestimate the impact that the deaths of these young people will be having in the community and we would ask that people focus on supporting each other and supporting the police investigation."" Acting Supt Richard Padwell said the car was travelling 'at speed' Allan Vickers, who lives nearby, said he was woken by a ""big crash"" and it was ""like a chimney coming down"". When he went outside to help he said police were already there and would not let him through. He described the scene as ""chaos, carnage, people being dragged out and given CPR, it's something you don't want to see, it's awful."" He said the emergency services' response had been ""epic, fast as lightning, they were here in a flash"". The road, which has a 40mph speed limit, had witnessed other high-speed crashes, Mr Vickers said, adding: ""This is my third time here, it's a blackspot"". An investigation is under way into the collision on Broadway, at the junction of Bank Gardens. Debris littered Broadway at the scene of the crash The A6120 outer ring road remains closed in Horsforth Measles outbreak prompts health warning Girl breaks spine in 60ft cliff fall Winter Hill fire may burn for days, fire crews fear The crash occurred in the early hours of Saturday Sgt Fiona Hoodless said: ""This is a very tragic incident where four young men have lost their lives and three other people are in hospital with serious injuries. ""The families of those involved are devastated by what has happened. ""Early indications are that the Leon was travelling at speed at the time of the collision."" Police are appealing for witnesses. West Yorkshire Police Commuter hits out over 'sheet ice' at Bradford railway station 'Robbie Williams' to play at Calderdale indie cinema's showing of new biopic Appeal issued to find relatives of man living in Bradford who has died One of Halifax's best-loved restaurants announces new premises and bar Leeds man and teenager to appear in court charged with violent disorder and arson following Harehills disorder Director of Yorkshire firms given nine-year ban for ‘scheme designed to undermine the insolvency system’ LA fire chief leaves mid-briefing to confront new wildfire in Hollywood Hills In maps: Thousands of acres on fire in LA 'Patients are collapsing in the waiting room': A&E nurses speak out Chris Mason: Is Starmer leaving the door open to an abuse inquiry? The Papers: 'Apocalypse' LA and 'Reeves faces extra tax rises' Why does Trump want Greenland and what do its people think? How Canada's immigration debate soured - and helped seal Trudeau's fate 'I can't get divorced as I can't get my pension valued' What are cold weather payments and who can get them? BBC Sound of 2025: Barry Can't Swim is a new dance music superstar Ros Atkins on...Elon Musk's political interventions Jean-Marie Le Pen - founder of French far right and 'Devil of the Republic' Delivering brand-new miracles in 1970s East End Watch the latest series of Call the Midwife on iPlayer now Mark-Anthony Turnage shares the soundtrack of his life Once called 'Britain’s hippest composer', he's tackled topics from drug abuse to football in his work Paddy’s loaf-changing experience inside the bread factory Paddy McGuinness visits the bread factory he used to work in, and sees how they make 1.4 million loaves a week What's behind the global surrogacy boom? More countries are banning surrogacy – but demand is growing © 2025 BBC. The BBC is not responsible for the content of external sites.Read about our approach to external linking."
NHS plan: What we need to know,"It was a significant funding announcement - few at senior levels in the NHS in England disagree with that. But as the dust settles after the weekend, several unanswered questions are still hanging in the air. What about the areas of health which are not covered? What about investment in hospital buildings and equipment? How will it be paid for? NHS funding: PM calls for 10-year plan to spend cash Chris Ham of the King's Fund told the BBC's Today programme that the 3.4% annual budget increases above inflation for NHS England amounted to a welcome funding boost which would go ""some way to dealing with operational pressures"". Others, including Sir David Nicholson, former head of NHS England, have praised Jeremy Hunt, the Health and Social Care Secretary, for his efforts in robust negotiations with the Treasury which were not concluded till late on Friday night. Sir David said on Twitter ""I do not believe that any other of the Secretaries of State that I have worked for could have got more out of the Treasury than Jeremy Hunt has - congratulations, longevity has its benefits"". Health leaders acknowledge that to be given a five year budget ahead of the main Whitehall spending review is unprecedented in recent times. They say it will allow them to plan the future delivery of services with more certainty.  An extra £4bn annually in real terms by 2023 will be allocated to Scotland, Wales and Northern Ireland as a consequence of the new financial package for England. But what now can be delivered? Chris Ham has urged caution about promising big improvements. The health think tanks had argued before the announcement that a 3.3% annual health spending increase in England was needed just to sustain current levels of care, given the demand pressures associated with an ageing population. The five year spending settlement covers frontline NHS services in England but not investment in new buildings and technology, known as capital spending. Funding in this area has been cut back in recent years to prop up day to day running costs of hospitals. Government sources indicate that the capital spending allocations will be set out in the autumn and Jeremy Hunt is expected to call for a 10-year plan. But given the recent squeeze on capital funding there will be scepticism until the details are spelled out. The money announced over the weekend is for NHS England and does not cover public health, including prevention initiatives. Local authorities are responsible for services in this area and have seen their budgets cut in recent years. Waiting times for sexual health clinics have increased with finances under pressure. The funding of Health Education England, covering the training of doctors, nurses and other health professionals, is also not part of the new Government deal. Like public health, budgets were squeezed and one result was the abolition of free tuition for nurse trainees. Many in the health world will suspend judgement until financial plans for public health and medical training are set out later this year. They remember only too well that the former Chancellor George Osborne's plan to fund the NHS in 2014 excluded other areas of health spending. Social care remains the big unknown. The government did not promise a funding announcement for both the NHS and social care this summer but is committed to a policy statement (a so-called Green Paper) within weeks. Ministers know that failure to come up with a credible plan for funding will severely damage the credibility of the new NHS funding strategy. Caroline Dinenage, the care minister, told the BBC that dealing with NHS finances and not social care was like running a bath without a tap in place. Jeremy Hunt, after a hectic few weeks of talks on NHS funding, now has to turn his mind to social care. He told the Today programme it would be ""funded so as not to create additional pressure on the system."" The funding package for local authorities providing care, expected in the spending review, will be closely scrutinised. So too any new ideas put forward to tackle the problems caused by means testing. A winter of severe strain on the NHS in England and rising waiting times left Mr Hunt and ministerial colleagues under pressure to come up with new money and thinking for a service which was creaking at the seams. The first important steps have been taken. Several more will be needed to convince patients and the wider public that the government really has got a grip. Tax rise to pay for NHS boost - PM The NHS needs more money - but how much? LA fire chief leaves mid-briefing to confront new wildfire in Hollywood Hills In maps: Thousands of acres on fire in LA 'Patients are collapsing in the waiting room': A&E nurses speak out Chris Mason: Is Starmer leaving the door open to an abuse inquiry? The Papers: 'Apocalypse' LA and 'Reeves faces extra tax rises' Why does Trump want Greenland and what do its people think? How Canada's immigration debate soured - and helped seal Trudeau's fate 'I can't get divorced as I can't get my pension valued' What are cold weather payments and who can get them? BBC Sound of 2025: Barry Can't Swim is a new dance music superstar Ros Atkins on...Elon Musk's political interventions Jean-Marie Le Pen - founder of French far right and 'Devil of the Republic' Delivering brand-new miracles in 1970s East End Watch the latest series of Call the Midwife on iPlayer now Mark-Anthony Turnage shares the soundtrack of his life Once called 'Britain’s hippest composer', he's tackled topics from drug abuse to football in his work Paddy’s loaf-changing experience inside the bread factory Paddy McGuinness visits the bread factory he used to work in, and sees how they make 1.4 million loaves a week What's behind the global surrogacy boom? More countries are banning surrogacy – but demand is growing © 2025 BBC. The BBC is not responsible for the content of external sites.Read about our approach to external linking."
NHS cuts dandruff treatment,"NHS England has announced a crackdown on the treatment of ""minor"" ailments such as dandruff and diarrhoea. Thirty-five treatments responsible for £570m of spending have been targeted. All are available over-the-counter in pharmacies. And the restriction will apply only where the ailment is judged to be a minor, short-term problem. NHS bosses says the move could cut spending by a fifth. But experts warned the poorest risked losing out on treatment. While the new rules, which apply from April, allow doctors to issue prescriptions where for a long-term ailment or one related to a more serious condition, the Royal Pharmaceutical Society said those on low incomes could still end up being denied drugs ""because of their inability to pay"". And Andrew McCracken, from the National Voices patient group, urged GPs to use their ""medical judgement"" and prescribe treatments when people could not afford to buy them. The treatments targeted include those for: constipation athletes foot mild acne dandruff diarrhoea head lice cold sores earwax NHS England chief executive Simon Stevens said: ""Every pound we save from cutting waste is another pound we can then invest in better [accident and emergency] care, new cancer treatments and much better mental health services."" And Dr Graham Jackson, of NHS Clinical Commissioners, which represents local health managers, said unfortunately ""difficult decisions"" had to be made. The move follows a similar measure last year, which saw the NHS stop paying for things such as gluten-free food and suncream. NHS targets suncream prescriptions for cuts NHS drug decisions 'are flawed' How much is a year of life worth? NICE Provider of national guidance and advice to improve health and social care Centre for Health Economics, The University of York LA fire chief leaves mid-briefing to confront new wildfire in Hollywood Hills In maps: Thousands of acres on fire in LA 'Patients are collapsing in the waiting room': A&E nurses speak out Chris Mason: Is Starmer leaving the door open to an abuse inquiry? The Papers: 'Apocalypse' LA and 'Reeves faces extra tax rises' Why does Trump want Greenland and what do its people think? How Canada's immigration debate soured - and helped seal Trudeau's fate 'I can't get divorced as I can't get my pension valued' What are cold weather payments and who can get them? BBC Sound of 2025: Barry Can't Swim is a new dance music superstar Ros Atkins on...Elon Musk's political interventions Jean-Marie Le Pen - founder of French far right and 'Devil of the Republic' Delivering brand-new miracles in 1970s East End Watch the latest series of Call the Midwife on iPlayer now Mark-Anthony Turnage shares the soundtrack of his life Once called 'Britain’s hippest composer', he's tackled topics from drug abuse to football in his work Paddy’s loaf-changing experience inside the bread factory Paddy McGuinness visits the bread factory he used to work in, and sees how they make 1.4 million loaves a week What's behind the global surrogacy boom? More countries are banning surrogacy – but demand is growing © 2025 BBC. The BBC is not responsible for the content of external sites.Read about our approach to external linking."
"Surge in Britons getting EU nationalityGermany gave citizenship to more Britons than any other EU country, data obtained by the BBC shows.UK Politics","There has been a surge in UK citizens acquiring the nationality of another EU country since the Brexit referendum, according to data obtained by the BBC. In 2017 a total of 13,141 UK citizens obtained the nationality of one of the 18 member states from which the BBC has received figures. This compares with 5,056 in 2016 and only 1,826 in 2015. The most frequent new nationality was German, which saw a huge jump from just 594 cases in 2015 up to 7,493 in 2017. One applicant, Paul Petty, from Bath, gained a German passport and is now a dual German/British citizen. ""I feel like Europe is pulling apart a bit at the moment,"" he told the BBC. ""I want to remain part of the EU."" More Britons became EU citizens in 2016 All you need to know about Brexit It took three weeks for Mr Petty to receive his new passport. He was eligible because of his mother's status as a Jewish refugee. He described the process as ""really easy"", as he still had his mother's passport. The rise is presumed to be the result of Britons who can meet the criteria seeking to keep their legal rights attached to European Union membership. The 2017 figure is about seven times the 2015 level. The dramatic increase is consistent across many countries.  France was the second most popular nationality, jumping from 320 instances in 2015 to 1,518 last year, and then Belgium, where the increase was from 127 to 1,381. The number for Ireland rose from 54 in 2015 to 529 in 2017. However, this does not include new Irish passport applications from the much larger number of people who already had entitlement to Irish citizenship, due for example to being born in Northern Ireland. Their new nationalities will guarantee the recipients the rights to travel, live and work throughout the EU after Brexit, and they may be able to pass these on to their children. In most cases those involved have also retained their British citizenship and so have become dual nationals. Lucy Hales has been living in Italy for five years, having previously spent 12 years in Spain, and plans to apply for Italian passports. ""It is likely that we will move to another European country, because of my husband's job, so having Italian citizenship would give us some certainty,"" she said. The BBC has obtained this data for 2017 from 18 of the 27 other EU member states. In the other cases it is not yet ready for publication. These 18 include most of the particularly relevant countries, accounting for over three-quarters of all such new citizenships in 2016. Only a limited proportion of British citizens would qualify for citizenship of another EU state. The bureaucratic process of applying can be slow and laborious. The criteria vary from one country to another and are sometimes complex, usually depending on ancestry and family links or residency. In the case of Germany, there is special provision for people whose German ancestors were victims of Nazi persecution. British citizens who fit a nation's requirements will still be able to apply after Brexit, although for some countries there may be complications. For example, Germany allows dual nationality only with EU states. Unless this changes Britons who become German after Brexit has happened could then find they have to renounce their UK citizenship. Research by Patrick Cowling You can follow Martin Rosenbaum on Twitter as@rosenbaum6,external More Britons became EU citizens in 2016 Reality Check: Is there a British rush on EU passports? 'Last call' for Brexit deal, Tusk warns Eurostat LA fire chief leaves mid-briefing to confront new wildfire in Hollywood Hills In maps: Thousands of acres on fire in LA 'Patients are collapsing in the waiting room': A&E nurses speak out Chris Mason: Is Starmer leaving the door open to an abuse inquiry? The Papers: 'Apocalypse' LA and 'Reeves faces extra tax rises' Why does Trump want Greenland and what do its people think? How Canada's immigration debate soured - and helped seal Trudeau's fate 'I can't get divorced as I can't get my pension valued' What are cold weather payments and who can get them? BBC Sound of 2025: Barry Can't Swim is a new dance music superstar Ros Atkins on...Elon Musk's political interventions Jean-Marie Le Pen - founder of French far right and 'Devil of the Republic' Delivering brand-new miracles in 1970s East End Watch the latest series of Call the Midwife on iPlayer now Mark-Anthony Turnage shares the soundtrack of his life Once called 'Britain’s hippest composer', he's tackled topics from drug abuse to football in his work Paddy’s loaf-changing experience inside the bread factory Paddy McGuinness visits the bread factory he used to work in, and sees how they make 1.4 million loaves a week What's behind the global surrogacy boom? More countries are banning surrogacy – but demand is growing © 2025 BBC. The BBC is not responsible for the content of external sites.Read about our approach to external linking."
Four dead and three hurt in Leeds crashThe crash between a car and a taxi happened in the early hours of the morning in Horsforth.Leeds & West Yorkshire,"The four men, aged 18, 19, 19, and 21, died at the scene Four young men died and a teenage girl was left critically ill in a collision involving a car and a taxi in the early hours. The four men, aged 18, 19, 19, and 21, died at the scene on the A6120 outer ring road, West Yorkshire Police said. Their Seat Leon ""was travelling at speed"" when it crashed in Horsforth at about 02:40 BST, the force said. Two girls, aged 16 and 17 also in the car, were taken to hospital.  The Uber taxi driver was also seriously hurt. The 16-year-old remains in a critical condition and the 17-year-old's injuries are not considered life threatening, the force said. All six people who were in the car come from the local area, said police. The driver of the taxi, a 42-year-old man from Bradford, is also being treated in hospital but his condition is not considered life threatening. More stories from Yorkshire Acting Supt Richard Padwell, of Leeds District Police, said: ""The deaths of four young people in these circumstances is clearly very tragic and our thoughts and condolences go out to everyone affected by it. ""We don't underestimate the impact that the deaths of these young people will be having in the community and we would ask that people focus on supporting each other and supporting the police investigation."" Acting Supt Richard Padwell said the car was travelling 'at speed' Allan Vickers, who lives nearby, said he was woken by a ""big crash"" and it was ""like a chimney coming down"". When he went outside to help he said police were already there and would not let him through. He described the scene as ""chaos, carnage, people being dragged out and given CPR, it's something you don't want to see, it's awful."" He said the emergency services' response had been ""epic, fast as lightning, they were here in a flash"". The road, which has a 40mph speed limit, had witnessed other high-speed crashes, Mr Vickers said, adding: ""This is my third time here, it's a blackspot"". An investigation is under way into the collision on Broadway, at the junction of Bank Gardens. Debris littered Broadway at the scene of the crash The A6120 outer ring road remains closed in Horsforth Measles outbreak prompts health warning Girl breaks spine in 60ft cliff fall Winter Hill fire may burn for days, fire crews fear The crash occurred in the early hours of Saturday Sgt Fiona Hoodless said: ""This is a very tragic incident where four young men have lost their lives and three other people are in hospital with serious injuries. ""The families of those involved are devastated by what has happened. ""Early indications are that the Leon was travelling at speed at the time of the collision."" Police are appealing for witnesses. West Yorkshire Police Commuter hits out over 'sheet ice' at Bradford railway station 'Robbie Williams' to play at Calderdale indie cinema's showing of new biopic Appeal issued to find relatives of man living in Bradford who has died One of Halifax's best-loved restaurants announces new premises and bar Leeds man and teenager to appear in court charged with violent disorder and arson following Harehills disorder Director of Yorkshire firms given nine-year ban for ‘scheme designed to undermine the insolvency system’ LA fire chief leaves mid-briefing to confront new wildfire in Hollywood Hills In maps: Thousands of acres on fire in LA 'Patients are collapsing in the waiting room': A&E nurses speak out Chris Mason: Is Starmer leaving the door open to an abuse inquiry? The Papers: 'Apocalypse' LA and 'Reeves faces extra tax rises' Why does Trump want Greenland and what do its people think? How Canada's immigration debate soured - and helped seal Trudeau's fate 'I can't get divorced as I can't get my pension valued' What are cold weather payments and who can get them? BBC Sound of 2025: Barry Can't Swim is a new dance music superstar Ros Atkins on...Elon Musk's political interventions Jean-Marie Le Pen - founder of French far right and 'Devil of the Republic' Delivering brand-new miracles in 1970s East End Watch the latest series of Call the Midwife on iPlayer now Mark-Anthony Turnage shares the soundtrack of his life Once called 'Britain’s hippest composer', he's tackled topics from drug abuse to football in his work Paddy’s loaf-changing experience inside the bread factory Paddy McGuinness visits the bread factory he used to work in, and sees how they make 1.4 million loaves a week What's behind the global surrogacy boom? More countries are banning surrogacy – but demand is growing © 2025 BBC. The BBC is not responsible for the content of external sites.Read about our approach to external linking."
