headline,article
Canada 'will not back down' over tariffs,"Canada will ""not back down"" in the face of new US tariffs on steel and aluminium, according to the country's foreign minister. Chrystia Freeland spoke as officials unveiled a C$2bn (US$1.5bn; £1.15bn) package to support the country's steel and aluminium industries. Retaliatory tariffs on C$16.6bn worth of US products are due to come into effect on 1 July. Ms Freeland said US tariffs left Canada ""no choice"" but to respond. Canada's tariffs target US steel and aluminium products. It also includes items such as yoghurt, ketchup and orange juice, which are made in key political battlegrounds such as Wisconsin, Pennsylvania and Florida. Where does Trump's 'America First' leave Canada? G7 summit: Trump's Trudeau jibes bring Canadians and Americans together The list of products is intended to match ""dollar for dollar"" the US tariffs, which came into effect on 1 June, Ms Freeland said. ""Our approach is we will not escalate but equally we will not back down,"" she said. The US and Canada are among each other's top trade partners, exchanging nearly US$700bn in goods and services last year. But trade relations between the two countries have grown tense, amid disputes over issues such as lumber, dairy and wine. This video can not be played Dairy wars: Why is Trump threatening Canada over milk? The two countries, with Mexico, are also locked in negotiations over the North American Free Trade Agreement. In May, when the US said it would not extend exemptions from the tariffs to Canada and Mexico, it said those talks were moving too slowly. Ms Freeland said the discussions continue and will heat up again after the Mexican election on Sunday. She said she is confident that ""common sense"" will prevail. ""There's too much at stake,"" she said. The US is the top foreign market for Canada's steel and aluminium, while Canada is the destination for more than half of US steel exports. In Canada, the steel and aluminium industries employ more than 33,500 people, according to the government. About 6,000 jobs in Canada are at risk due to the US tariffs, the CD Howe Institute has estimated. President Donald Trump has complained about Canadian Prime Minister Justin Trudeau on Twitter Ken Neumann, director in Canada for the United Steelworkers union, said the aid package, which includes loan assistance, should help companies, but the support for workers is more ""modest"". The package ""a good first step that will need to be expanded if the trade dispute continues beyond the short-term"", he said. The US is also exposed to thousands of potential job losses, as higher costs for steel and aluminium hurt US firms and trigger retaliation from Canada and elsewhere. In addition to Canada, the European Union and Mexico are among those that have announced tariffs on US goods in response. US tariffs: Allies retaliate with levies on jam, lamps and sleeping bags Who is losing out from Trump's tariffs? The Trump administration has said the tariffs are necessary to protect the steel and aluminium industries, arguing that their success is vital to America's national security. Several countries, including Canada, are challenging that rationale with complaints against the US to the World Trade Organisation (WTO). Where does Trump's 'America First' leave Canada? Trump's Trudeau jibes unite Canadians LA fire chief leaves mid-briefing to confront new wildfire in Hollywood Hills In maps: Thousands of acres on fire in LA 'Patients are collapsing in the waiting room': A&E nurses speak out Chris Mason: Is Starmer leaving the door open to an abuse inquiry? The Papers: 'Apocalypse' LA and 'Reeves faces extra tax rises' Why does Trump want Greenland and what do its people think? How Canada's immigration debate soured - and helped seal Trudeau's fate 'I can't get divorced as I can't get my pension valued' What are cold weather payments and who can get them? BBC Sound of 2025: Barry Can't Swim is a new dance music superstar Ros Atkins on...Elon Musk's political interventions Jean-Marie Le Pen - founder of French far right and 'Devil of the Republic' Delivering brand-new miracles in 1970s East End Watch the latest series of Call the Midwife on iPlayer now Mark-Anthony Turnage shares the soundtrack of his life Once called 'Britain’s hippest composer', he's tackled topics from drug abuse to football in his work Paddy’s loaf-changing experience inside the bread factory Paddy McGuinness visits the bread factory he used to work in, and sees how they make 1.4 million loaves a week What's behind the global surrogacy boom? More countries are banning surrogacy – but demand is growing © 2025 BBC. The BBC is not responsible for the content of external sites.Read about our approach to external linking."
UK heatwave: Lettuce shortage 'imminent',"There could be a shortage of lettuce in UK supermarkets as soon as the middle of next week, growers have warned. The unusually high temperatures have boosted demand for leafy salads at the same time as the heat has stopped the UK crop growing. Growers say they may have to import leaves from the US to make up the shortfall at a time when more than 90% of salad leaves is usually UK grown. Broccoli and cauliflower crops have also been affected by the weather. Trade body the British Leafy Salad Growers Association (BLSGA) said the ""soaring"" temperatures were causing ""havoc"" for growers. It said the last week a record 18 million lettuces had been sold, about 40% more than last year. However, it added ""when the mercury hits 30C lettuces can't grow"". BLSGA spokesman Dieter Lloyd said it ""looks entirely likely that there will be shortages"" from the ""middle to end of next week"". And one lettuce grower in East Anglia, who did not want to be named, told the BBC this summer had been ""very challenging"". Normally in good weather the crop grows rapidly, he said. But at the current temperatures the crop effectively stops growing because its ""under stress"". ""I think that if the weather keeps going the way that it's going absolutely we wouldn't be in a position to fulfil the demand that we're seeing with UK-grown produce,"" he added. At this time of peak demand more than 90% of UK leafy salads are usually grown in the UK. The grower had already looked to Germany to try to find alternative supplies, but with similar weather conditions there, farmers there did not have enough spare. ""If this goes on for another five days I wouldn't be surprised if we had to look to the US."" And it is not just lettuce that is affected, he added. Both broccoli and cauliflower crops have been hit by the weather as well. How to cope with the vegetable shortage Why is there a vegetable shortage? Vegetable rationing hits UK supermarkets LA fire chief leaves mid-briefing to confront new wildfire in Hollywood Hills In maps: Thousands of acres on fire in LA 'Patients are collapsing in the waiting room': A&E nurses speak out Chris Mason: Is Starmer leaving the door open to an abuse inquiry? The Papers: 'Apocalypse' LA and 'Reeves faces extra tax rises' Why does Trump want Greenland and what do its people think? How Canada's immigration debate soured - and helped seal Trudeau's fate 'I can't get divorced as I can't get my pension valued' What are cold weather payments and who can get them? BBC Sound of 2025: Barry Can't Swim is a new dance music superstar Ros Atkins on...Elon Musk's political interventions Jean-Marie Le Pen - founder of French far right and 'Devil of the Republic' Delivering brand-new miracles in 1970s East End Watch the latest series of Call the Midwife on iPlayer now Mark-Anthony Turnage shares the soundtrack of his life Once called 'Britain’s hippest composer', he's tackled topics from drug abuse to football in his work Paddy’s loaf-changing experience inside the bread factory Paddy McGuinness visits the bread factory he used to work in, and sees how they make 1.4 million loaves a week What's behind the global surrogacy boom? More countries are banning surrogacy – but demand is growing © 2025 BBC. The BBC is not responsible for the content of external sites.Read about our approach to external linking."
DRC to drill for oil in wildlife parks,"Virguna national park is home to the critically endangered mountain gorilla The Democratic Republic of Congo government  is looking into whether to allow oil exploration in two protected wildlife parks, Virunga and Salonga. The move is strongly opposed by environmental activists, who say drilling would place wildlife at risk and contribute to global warming. Around one-fifth of Virunga national park could be opened to oil drilling. The parks are home to bush elephants, critically endangered mountain gorillas and the bonobo, an endangered ape. Both parks are Unesco World Heritage Sites, with Salonga national park covering 36,000 sq km (13,900 sq miles) of the Congo Basin - the world's second-largest rainforest after the Amazon. Gorillas, guns and guerrillas - a deadly mix in an African park DR Congo profile My daughter the gorilla The government has defended its right to authorise drilling anywhere in the country, saying in a statement that it is mindful of protecting animals and plants in the two parks. Virunga national park is considered the most bio-diverse park in Africa The cabinet said it had approved commissions charged with looking into whether to declassify parts of the parks, including 1,720 sq km (664 sq miles), or 21.5%, of eastern Congo's Virunga, the continent's oldest wildlife reserve. Earlier this year, park authorities decided to close the park famous for its volcanoes to visitors until 2019 aftertwo British tourists were kidnapped and a female park ranger was killed. The region has suffered rising instability and violence, with at least 12 rangers killed in clashes with armed groups and poachers in the past year. British company Soco International performed seismic testing therebut let its licence lapse in 2015. In total, 175 park rangers in Virguna national park have been killed in the line of duty since 1925 Correction 2 July 2018: This story has been changed to make it clear that the commission will decide whether oil drilling should be allowed. We initially reported that oil drilling had already been allowed. Gorillas, guns and guerrillas - a deadly mix in an African park DR Congo country profile British tourists kidnapped in DR Congo DR Congo upsets big miners with new law My daughter the gorilla LA fire chief leaves mid-briefing to confront new wildfire in Hollywood Hills In maps: Thousands of acres on fire in LA 'Patients are collapsing in the waiting room': A&E nurses speak out Chris Mason: Is Starmer leaving the door open to an abuse inquiry? The Papers: 'Apocalypse' LA and 'Reeves faces extra tax rises' Why does Trump want Greenland and what do its people think? How Canada's immigration debate soured - and helped seal Trudeau's fate 'I can't get divorced as I can't get my pension valued' What are cold weather payments and who can get them? BBC Sound of 2025: Barry Can't Swim is a new dance music superstar Ros Atkins on...Elon Musk's political interventions Jean-Marie Le Pen - founder of French far right and 'Devil of the Republic' Delivering brand-new miracles in 1970s East End Watch the latest series of Call the Midwife on iPlayer now Mark-Anthony Turnage shares the soundtrack of his life Once called 'Britain’s hippest composer', he's tackled topics from drug abuse to football in his work Paddy’s loaf-changing experience inside the bread factory Paddy McGuinness visits the bread factory he used to work in, and sees how they make 1.4 million loaves a week What's behind the global surrogacy boom? More countries are banning surrogacy – but demand is growing © 2025 BBC. The BBC is not responsible for the content of external sites.Read about our approach to external linking."
Trump narrows down Supreme Court candidates,"President Trump spoke to journalists during a flight to his private golf club in Bedminster, New Jersey US President Donald Trump says he plans to announce his nominee for a new Supreme Court judge on 9 July. He told reporters on board the presidential aircraft Air Force One he had narrowed the choice down to ""about five"" candidates, including two women. The vacancy arose when Justice Anthony Kennedy announced his retirement earlier this week. It gives President Trump the opportunity to solidify a conservative majority on the top court. His nominee will need to be confirmed by the Senate where the president's Republican Party holds a narrow majority. Allow Twitter content? This article contains content provided by Twitter. We ask for your permission before anything is loaded, as they may be using cookies and other technologies. You may want to readTwitter’s cookie policy,externalandprivacy policy,externalbefore accepting. To view this content choose‘accept and continue’. In other comments to reporters on Friday, Mr Trump: Said he would discuss allegations of election tampering when he met Russian President Vladimir Putin in Helsinki next month Called on Germany and other European nations to spend more on Nato, adding: ""The United States is paying much more, disproportionately to anyone else"" Said the World Trade Organization (WTO) had treated the US ""very badly"" but insisted he was ""not talking about pulling out"" Speaking on a flight from Washington to New Jersey on Friday, President Trump said he would not ask Supreme Court candidates about their position on the landmark 1973 Roe v Wade decision which legalised abortion across the US. During his campaign, Mr Trump promised to deliver ""pro-life"" judges to the Supreme Court - a prospect that has alarmed women's rights groups. Women fear abortion rights under threat Analysis: Why a fight over US abortion law looms Why is the US Supreme Court so important? ""I've got it narrowed to about five [candidates],"" he told reporters, adding: ""I like them all."" Mr Trump said he planned to interview one or two of the candidates over the weekend while staying at his golf club in Bedminster. Justice Kennedy, 81, is the second-oldest justice on the nine-member US Supreme Court. The court plays a key role in US society and is often the final word on highly contentious laws, disputes between states and the federal government, and final appeals to stay executions. In recent years it has expanded gay marriage to all 50 states, stopped President Barack Obama's immigration orders and delayed a US plan to cut carbon emissions while appeals went forward. Justice Anthony Kennedy will retire on 31 July Although a conservative, Justice Kennedy has sided with liberals on previous decisions, including the 5-4 rulings that decided same-sex marriage and upheld abortion rights. US media have reported several front-runners who could replace him: Brett Kavanaugh, who is at the top of most lists, is an appeals court judge in Washington DC and was a former clerk to Justice Kennedy Amul Thapar, a Kentucky judge handpicked by Senate Majority Leader Mitch McConnell, and Amy Comey Barrett, a former professor at Catholic university Notre Dame, are both likely nominees Raymond Kethledge, a judge on the 6th US Circuit Court of Appeals and also a former clerk to Justice Kennedy, is another possible contender. Meet the Supremes - the nine judges on US top court In other remarks to reporters, President Trump said he would raise the issue of alleged Russian election meddling when he met President Putin in Finland on 16 July. ""We'll be talking about elections... we don't want anybody tampering with elections,"" he said. US intelligence agencies have concluded that Russia tried to sway the 2016 US election in Mr Trump's favour, a claim the Kremlin has consistently denied. US punishes Russians over vote meddling All you need to know about Trump Russia story Russia's annexation of Crimea from Ukraine in 2014, which led to US and EU sanctions, and the war in Syria, would also be discussed, Mr Trump confirmed. This video can not be played A short guide to the Syrian civil war He refused to rule out accepting the annexation when he met Mr Putin, saying: ""We're going to have to see."" When asked whether US sanctions on Russia might be lifted, he said: ""We'll see what Russia does."" Crimea: the place that's rather difficult to get into This video can not be played The $3.7bn (£2.7bn) bridge links southern Russia with the territory it annexed in 2014 Women fear abortion rights under threat Why fight over abortion law looms Why US Supreme Court is important Trump has 'list of 25 nominees' Video, 00:01:24Trump has 'list of 25 nominees' The nine judges on US top court LA fire chief leaves mid-briefing to confront new wildfire in Hollywood Hills In maps: Thousands of acres on fire in LA 'Patients are collapsing in the waiting room': A&E nurses speak out Chris Mason: Is Starmer leaving the door open to an abuse inquiry? The Papers: 'Apocalypse' LA and 'Reeves faces extra tax rises' Why does Trump want Greenland and what do its people think? How Canada's immigration debate soured - and helped seal Trudeau's fate 'I can't get divorced as I can't get my pension valued' What are cold weather payments and who can get them? BBC Sound of 2025: Barry Can't Swim is a new dance music superstar Ros Atkins on...Elon Musk's political interventions Jean-Marie Le Pen - founder of French far right and 'Devil of the Republic' Delivering brand-new miracles in 1970s East End Watch the latest series of Call the Midwife on iPlayer now Mark-Anthony Turnage shares the soundtrack of his life Once called 'Britain’s hippest composer', he's tackled topics from drug abuse to football in his work Paddy’s loaf-changing experience inside the bread factory Paddy McGuinness visits the bread factory he used to work in, and sees how they make 1.4 million loaves a week What's behind the global surrogacy boom? More countries are banning surrogacy – but demand is growing © 2025 BBC. The BBC is not responsible for the content of external sites.Read about our approach to external linking."
Tom Daley and husband become parents,"The couple got married in Devon last May Olympic diver Tom Daley and his US film-maker husband Dustin Lance Black have become parents. The couple, who announced the pregnancyin February, revealed the news in the Times on Saturday. They later posted pictures of the baby on social media withDaley tweeting,external: ""Welcome to the world our precious little Robbie Ray Black-Daley."" The pair had their child via a surrogate and previously said they had received some negative feedback. Allow Instagram content? This article contains content provided by Instagram.  We ask for your permission before anything is loaded, as they may be using cookies and other technologies.  You may want to readMeta’s Instagram cookie policy,externalandprivacy policy,externalbefore accepting. To view this content choose‘accept and continue’. Allow Twitter content? This article contains content provided by Twitter. We ask for your permission before anything is loaded, as they may be using cookies and other technologies. You may want to readTwitter’s cookie policy,externalandprivacy policy,externalbefore accepting. To view this content choose‘accept and continue’. Three-time World Champion diver Daley had also said he wanted to be as good a dad as his father, who was also called Robert and died in 2011. Daley, 24, and 44-year-old Black got engaged in 2015 and marriedin Devon last year. When they announced their baby news, Daley posted a picture of the couple holding up to the camera and black and white image from their baby scan Speaking about using a surrogate on Fearne Cotton's Happy Place podcast in March, Daley said: ""With Kim Kardashian West, people felt sorry she's not able to have a child because of health reasons and 'how lovely it is that a surrogate has been willing to do that'. ""But for every other gay couple that is not able to have a child, but desperately would love to bring up a child like any heterosexual couple, we have been treated quite differently."" Daley, from Plymouth, won bronze medals at the Olympic Games in London and Rio de Janeiro. Black won the best original screenplay Oscar for the 2008 film Milk, which was based on the life of gay rights activist and politician, Harvey Milk. The hottest quiz of the year? Teachers upstage pupils in leavers' film Mapping England's World Cup squad The baby, full name Robert Ray Black-Daley, was named after Tom's father Rob who died of cancer aged 40 in 2011. Rob Daley gave up his electrician's business to follow son Tom's diving events around the world Speaking at the family home, Daley's brother Will said naming the baby Rob was a ""nice way to remember him"". ""It was really good that he thought of him in that way,"" he said. ""It means a lot to the family because the legacy continues really and hopefully he will grow up to be just like him."" Will and Tom's mother Debbie is in Los Angeles with Daley and Black. ""We're all chuffed to bits and she's over the moon as we all are,"" he said. ""She's a grandmother for the first time and it's like starting a whole new family."" Tom Daley and husband expecting baby boy Daley and partner marry at luxury hotel New South West weather warning as big freeze looms after snow Tearful and panicked drivers in four-hour A380 snow traffic nightmare Desperate appeal to bring Lacey Lake 'home' after shock death New speed cameras set for North Devon roads Celebrity chef Paul Ainsworth has splashed out on huge new venture to expand restaurant empire Man jailed for life after 'frenzied, random and unprovoked late-night attack' LA fire chief leaves mid-briefing to confront new wildfire in Hollywood Hills In maps: Thousands of acres on fire in LA 'Patients are collapsing in the waiting room': A&E nurses speak out Chris Mason: Is Starmer leaving the door open to an abuse inquiry? The Papers: 'Apocalypse' LA and 'Reeves faces extra tax rises' Why does Trump want Greenland and what do its people think? How Canada's immigration debate soured - and helped seal Trudeau's fate 'I can't get divorced as I can't get my pension valued' What are cold weather payments and who can get them? BBC Sound of 2025: Barry Can't Swim is a new dance music superstar Ros Atkins on...Elon Musk's political interventions Jean-Marie Le Pen - founder of French far right and 'Devil of the Republic' Delivering brand-new miracles in 1970s East End Watch the latest series of Call the Midwife on iPlayer now Mark-Anthony Turnage shares the soundtrack of his life Once called 'Britain’s hippest composer', he's tackled topics from drug abuse to football in his work Paddy’s loaf-changing experience inside the bread factory Paddy McGuinness visits the bread factory he used to work in, and sees how they make 1.4 million loaves a week What's behind the global surrogacy boom? More countries are banning surrogacy – but demand is growing © 2025 BBC. The BBC is not responsible for the content of external sites.Read about our approach to external linking."
