headline,article
US threatens tariffs on UK goods in 'tech tax' row,"The US has warned it could put tariffs of up to 25% on a host of UK exports in retaliation for a UK tax on tech firms. Ceramics, make-up, overcoats, games consoles and furniture,externalcould all be hit, according to a list published by the Biden administration. The duties are designed to raise $325m (£235.8m), the amount the US believes the UK will raise from US tech firms. A UK government spokesperson said it wanted to ""make sure tech firms pay their fair share of tax"". They added: ""Should the US proceed to implement these measures, we would consider all options to defend UK interests and industry."" Washington is pressing ahead with the action, initiated under President Donald Trump, and has scheduled hearings on the list. It argues the recently introduced digital services tax - which taxes tech firms on their revenues - has ""unreasonable, discriminatory, and burdensome attributes"". US suspends tariffs on single malt Scotch whisky Sunak urges US to back digital services tax Facebook agrees to pay France €106m in back taxes Such actions have proceeded against similar taxes in India, Austria and Spain, but action against the European Union as a whole was dropped. The US Section 301 action is designed to apply domestic political pressure within the UK and other countries over the imposition of such taxes. The UK and US held talks about the digital services tax on 4 December, and UK government sources stressed that the tariff list was being seen as procedural, rather than an escalation. The tariffs are now subject to a consultation in the US over the next few weeks. Burberry's famous trench coats would be affected UK ceramics are on the US Trade Representative's list, including certain tiles, bathroom ware like sinks and bidets, as well as ceramics for laboratory uses. About £17m of these products were exported to the US in 2020, and £24m in 2019 before Covid. Trade group the British Ceramic Confederation said it was ""monitoring developments closely, working with UK officials"". Meanwhile Adam Mansell, head of the UK Fashion & Textile Association (UKFT), called the threat to UK-made overcoats ""hugely disappointing"", noting the US had only removed separate tariffs on other types of fashion goods, such as British cashmere last month. ""At a time when we are trying to start discussions over a UK-US trade deal, it is extremely important that both governments get around the table to remove this threat as soon as possible,"" he said. ""With the industry still struggling with the impact of Covid-19 and understanding the new trade arrangements with the EU, an additional burden on our exports couldn't come at a worse time."" At the Budget, the Office for Budget Responsibility calculated the digital services tax would raise £300m in the current financial year, and as much as £700m in future years. Brought in last April it taxes at 2% the revenues - not profits - of search engines, social media services and online marketplaces which derive value from UK users. It followed years of claims in Europe and elsewhere that big tech firms do not pay enough tax in the countries where they operate. Last August, Facebook agreed to pay the French government €106m (£95.7m) in back taxes to settle a dispute over revenues earned in the country. Earlier that year, Facebook boss Mark Zuckerbergsaid he recognised the public's frustration over the amount of tax paid by tech giants. A UK government spokesperson said: ""Like many countries around the world, we want to make sure tech firms pay their fair share of tax. Our digital services tax (DST) is reasonable, proportionate and non-discriminatory. ""It's also temporary. We're working positively with the US and other international partners to find a global solution to this problem and will remove the DST when that is in place."" There are signs the Biden administration wants a more conciliatory relationship on trade with the UK than Donald Trump did. Last month, Washington agreed to suspend tariffs on UK goods, including single malt whiskies, that were imposed in retaliation over subsidies to aircraft maker Airbus. However, the UK is still lobbying the US to drop duties on British steel brought in in 2018. US suspends tariffs on single malt Scotch whisky Sunak urges US to back digital services tax Facebook agrees to pay France €106m in back taxes Comments can not be loaded To load Comments you need to enable JavaScript in your browser Deadly wildfires rage across LA as fierce winds threaten more destruction What's the latest on the LA fires, and why can't they be put out? Danes struggle with response to Trump Greenland threat 'I paid fake doctor thousands for fillers - now I look like a gargoyle' The Papers: 'Lost Angeles' and 'Musk seeks plan to oust Starmer' Pop star Chappell Roan wins BBC Sound Of 2025 Weekly quiz: Zendaya looked happy but who else sparkled at the Golden Globes? The 20 child abuse inquiry proposals - what has happened so far? The '9/11 mastermind' wants to plead guilty. Why is the US trying to stop him? Why are UK borrowing costs rising and what does it mean for me? In maps: Thousands of acres on fire in LA Before and after: How wildfires tore through LA Ed Gamble hosts the official Traitors podcast Join Ed Gamble and guests as they dissect the first episodes of The Traitors! Can art, music and words bind us in divided times? Simon Schama explores how artists have captured the transformations of British society since 1945 Enjoy a satirical smorgasbord of The News Quiz Digest a dramatic year of news as Andy Zaltzman revels in some of 2024's funniest moments The multi-award-winning legal drama returns Two years on, the Defoes are back and have gathered for a beautiful wedding in Barcelona © 2025 BBC. The BBC is not responsible for the content of external sites.Read about our approach to external linking."
PM: Strength of defence against new wave unclear,"This video can not be played Boris Johnson: ""We're building up our own long-term UK manufacturing capabilities"" The UK does not know ""exactly how strong"" its defences against another wave of Covid will be despite the ""impressive"" vaccine rollout, Prime Minister Boris Johnson has said. He said cases were still rising in Europe and people ""must proceed with caution"" as lockdown eases. The PM was speaking as the stay-at-home rule came to an end in England, allowing groups to meet outdoors. He warned more deaths, infections and hospitalisations were inevitable. European countries have seen a rising number of cases in recent weeks amid a slower vaccine rollout than in the UK. Mr Johnson told a Downing Street press conference the relaxation of restrictions would be ""prized"" by people and that it was ""only because of months of sacrifice and effort that we can take this small step toward freedom"". What can I do from Monday... and what comes next? How many people can I meet now? Swimmers and golfers enjoy new freedoms Deal reached for 60m UK-made Novavax doses He added: ""The vaccine rollout has been very impressive... but what we don't know is exactly how strong our fortifications now are, how robust our defences are against another wave. ""What we need to do is to continue flat out to build the immunity of our population, build our defences against that wave when it comes."" The prime minister said: ""That's why I stress the importance of everybody maintaining the discipline people have shown for so long."" The message was loud and clear - a rise in infections is inevitable as the UK unlocks. But what is uncertain is when this will happen and what impact it will have on serious illness and deaths. A surge now would be the worst outcome. The vaccination rollout has gone very well, but people are still in the process of building up immunity and not everyone in the most at-risk groups has come forward for a jab. The vaccines, while good, are not 100% effective.  It is why ministers and their advisers are urging caution. UK chief medical adviser Prof Chris Whitty says if people stick to the rules any increase could be modest. The seasons may also help - respiratory viruses thrive more in the colder months. The lower estimates of modelling done for the government suggests there could be 30,000 deaths by summer 2022. That would be in line with a bad flu winter. But it could also be much, much worse. If there is one thing we have learnt, nothing can be taken for granted with Covid. Along with England's Chief Medical Officer Prof Chris Whitty and the Chief Scientific Adviser Sir Patrick Vallance, Mr Johnson stressed the importance of people who had a first dose of a vaccine getting a second jab. Prof Whitty said the ""wall of vaccination"" will get stronger once people receive their second doses. But he said ""it is not a complete wall"" and highlighted risks for the UK from rising cases elsewhere - the chance of importing infections and the ""much bigger"" concern of variants which could reduce a vaccine's effectiveness. Prof Whitty said: ""If you get a very big wave, that would obviously lead to a significant impact. So that's the reason why the prime minister and ministers have been absolutely determined that this is a slow and steady unlocking, looking at data between each step."" The briefing was held for the first time from the media suite built at Downing Street at a cost of £2.6m. Mr Johnson announced the government had agreed adeal with UK pharmaceutical giant GlaxoSmithKlinethat will see the final stage of the manufacture of up to 60 million doses of its yet-to-be approved Novavax vaccine completed in north-east England. He said Novavax, which is to beproduced at the Fujifilm plant in Stockton-on-Tees,will be finished and bottled by GSK at its facility in Barnard Castle. LOOK-UP TOOL:How many cases in your area? LOCKDOWN RULES:What are they and when will they end? SOCIAL DISTANCING:How can I meet my friend safely? FACE MASKS:When do I need to wear one? A further 4,654 Covid cases were recorded in the UK on Monday, compared with 5,342 cases a week ago. There were another 23 deaths of people within 28 days of a positive test, compared with 17 on the same day last week. The latest figures show 293,542 UK adults received a first dose of the vaccine on Sunday, taking the overall number to 30,444,829 - with 146,785 having their second dose, bringing that total to 3,674,266. People were out enjoying the spring weather in the grounds of Wollaton Hall in Nottingham Outdoor sports facilities were able to open again on Monday Two households or groups of up to six people are now able to meet outside in England after thelatest easing of the lockdown rules. Outdoor sport facilities, including swimming pools, tennis courts and golf courses, have reopened, and organised outdoor sports resumed. Weddings are also on again,attended by up to six people. The next stage in the relaxation of the rules in England will take place no earlier than 12 April with non-essential retail reopening, and restaurants and pubs allowed to serve outdoors. The prime minister told the briefing he could not ""see anything in the data right now that would cause us to deviate from the roadmap"". In Wales, the ""stay local"" rule was lifted on Saturday, with six people allowed to meet outside and stay in self-contained holiday accommodation. The stay home order in Scotland will end on Friday, and from Thursday in Northern Ireland up to six people, or two households, will be able to meet outdoors. NOW THAT'S WHAT I CALL LOCKDOWN:The music that got you through WALKING HOME ALONE:""I'm just too terrified"" PM announces plans for more UK made vaccines. Video, 00:02:42PM announces plans for more UK made vaccines How many people have been vaccinated? Can you catch Covid outside? Deadly wildfires rage across LA as fierce winds threaten more destruction What's the latest on the LA fires, and why can't they be put out? Danes struggle with response to Trump Greenland threat 'I paid fake doctor thousands for fillers - now I look like a gargoyle' The Papers: 'Lost Angeles' and 'Musk seeks plan to oust Starmer' Pop star Chappell Roan wins BBC Sound Of 2025 Weekly quiz: Zendaya looked happy but who else sparkled at the Golden Globes? The 20 child abuse inquiry proposals - what has happened so far? The '9/11 mastermind' wants to plead guilty. Why is the US trying to stop him? Why are UK borrowing costs rising and what does it mean for me? In maps: Thousands of acres on fire in LA Before and after: How wildfires tore through LA Ed Gamble hosts the official Traitors podcast Join Ed Gamble and guests as they dissect the first episodes of The Traitors! Can art, music and words bind us in divided times? Simon Schama explores how artists have captured the transformations of British society since 1945 Enjoy a satirical smorgasbord of The News Quiz Digest a dramatic year of news as Andy Zaltzman revels in some of 2024's funniest moments The multi-award-winning legal drama returns Two years on, the Defoes are back and have gathered for a beautiful wedding in Barcelona © 2025 BBC. The BBC is not responsible for the content of external sites.Read about our approach to external linking."
Deal to manufacture 60m Novavax doses in UK,"This video can not be played Boris Johnson: ""We're building up our own long-term UK manufacturing capabilities"" Tens of millions of doses of the Novavax vaccine will now be produced and packaged in north-east England, the prime minister has announced. Boris Johnson said a deal had been agreed with GlaxoSmithKline (GSK) to bottle 60 million doses at its facility in Barnard Castle, County Durham. GSK said it hoped the ""fill and finish"" process can begin as early as May. In January, it was announced the vaccine would bemanufactured at the Fujifilm plant in Billingham. Novavax is currently being assessed by the Medicines and Healthcare products Regulatory Agency. The biotech company behind it, also called Novavax, recently announced its vaccine was 86% effective against the Kent variant of Covid-19 and 96% effective in preventing cases caused by the original strain. Mr Johnson said: ""I'm delighted by GSK's investment, which shows the strength of UK manufacturing, and will further boost our vaccine rollout. ""The Vaccines Taskforce has worked hand in glove with business to successfully deliver vaccines to the whole of the UK, and this agreement will continue to support our approach. ""We remain on track to offer a first jab to all over 50s by 15 April, and all adults by the end of July, and I want to once again encourage everyone to come forward for a vaccine when you're called."" The news that the Novavax vaccine is going to go through a process known as fill and finish in the UK is an interesting development. Fill and finish is the process by which vaccines are packaged up in vials, ready to be sent out to vaccination clinics. The original plan was for this to be done in Europe once the vaccine product was manufactured by plants in the north east. But a deal has been struck with drug firm GSK to do that here. Officially, the government is saying that it is all part of their investment in the British life science industry. But given the threats from Europe about restricting exports of vaccines, it begs all sorts of other questions too. The north east plants have already started manufacturing the 60m doses ordered by the government. If it gets approval by the regulator - expected in the coming weeks - supplies could be available in June. Roger Connor, president of GSK vaccines, said: ""GSK is delighted to support Novavax and the UK Vaccines Taskforce with this manufacturing arrangement for the UK and our Barnard Castle facility is now undertaking the rapid preparation work required to manufacture up to 60 million doses of this vaccine. ""We have ensured that we can deliver these volumes without impacting supply of our other vital medicines and vaccines, and without disruption to the other Covid-19 collaborations GSK is engaged in globally."" Follow BBC North East & Cumbria onTwitter,external,Facebook,externalandInstagram,external. Send your story ideas tonortheastandcumbria@bbc.co.uk,external Novavax Covid jab shows 89% efficacy in UK trials Comments can not be loaded To load Comments you need to enable JavaScript in your browser British Engines Group launches its 2025 apprenticeship programme to attract Hartlepool’s top engineering talent Man in tracksuit 'slashes two car tyres' as police share CCTV image appeal Woman arrested in connection to Darlington vehicle damage Hartlepool Police seize this 'unroadworthy' car just yards from their own station Hospitals appeal for unwanted electronic devices for maternity patients North East students brave freezing sea to raise funds for Cambodian health Deadly wildfires rage across LA as fierce winds threaten more destruction What's the latest on the LA fires, and why can't they be put out? Danes struggle with response to Trump Greenland threat 'I paid fake doctor thousands for fillers - now I look like a gargoyle' The Papers: 'Lost Angeles' and 'Musk seeks plan to oust Starmer' Pop star Chappell Roan wins BBC Sound Of 2025 Weekly quiz: Zendaya looked happy but who else sparkled at the Golden Globes? The 20 child abuse inquiry proposals - what has happened so far? The '9/11 mastermind' wants to plead guilty. Why is the US trying to stop him? Why are UK borrowing costs rising and what does it mean for me? In maps: Thousands of acres on fire in LA Before and after: How wildfires tore through LA Ed Gamble hosts the official Traitors podcast Join Ed Gamble and guests as they dissect the first episodes of The Traitors! Can art, music and words bind us in divided times? Simon Schama explores how artists have captured the transformations of British society since 1945 Enjoy a satirical smorgasbord of The News Quiz Digest a dramatic year of news as Andy Zaltzman revels in some of 2024's funniest moments The multi-award-winning legal drama returns Two years on, the Defoes are back and have gathered for a beautiful wedding in Barcelona © 2025 BBC. The BBC is not responsible for the content of external sites.Read about our approach to external linking."
Suez Canal reopens after stranded ship is freedIt took almost a week to dislodge a giant container ship blocking one the world's busiest trade routes.Middle EastCommentsNo further Covid-19 related deaths recorded in NIA further 65 cases of the virus are recorded in the last 24 hours.Northern Ireland,"This video can not be played (29 March 2021) The stranded container ship is seen finally on the move and no longer blocking the canal Traffic has resumed in Egypt's Suez Canal after a stranded container ship blocking it for nearly a week was finally freed by salvage crews. Tug boats honked their horns in celebration as the 400m-long (1,300ft) Ever Given was dislodged on Monday with the help of dredgers. Hundreds of ships are waiting to pass through the canal which links the Mediterranean to the Red Sea. It is one of the world's busiest trade routes. The cost of the Suez Canal blockage How do you refloat a giant cargo ship? In pictures: Efforts to shift huge ship from canal Peter Berdowski, CEO of Dutch salvage company Boskalis, said the Ever Given had been refloated at 15:05 (13:05 GMT) on Monday, ""thereby making free passage through the Suez Canal possible again"". Egyptian officials say the backlog of ships waiting to transit through should be cleared in around three days, but experts believe the knock-on effect on global shipping could take weeks or even months to resolve. The Ever Given on the move on Monday Salvage teams had faced a daunting challenge after the 200,000-tonne ship ran aground last Tuesday morning in high winds and a sandstorm which reduced visibility. A Dutch specialist team, SMIT, oversaw a flotilla of 13 tugs, small but powerful vessels that can shift large ships, as they tried to dislodge the Ever Given. Dredgers were brought in and dug 30,000 cubic metres of mud and sand from beneath the ends of the ship. Over the weekend, it was feared that some of the ship's cargo of some 18,000 containers would have to be removed in order to lighten the load. But high tides helped the tugs and dredgers in their work and early on Monday, the stern (rear of the ship) was freed and the great ship swung across the canal, to shouts of celebration. Hours later, the bow (front) too came unstuck, and the Ever Given was able to move out. The vessel was towed to the Great Bitter Lake, which sits between two sections of the canal to the north of the salvage site, where it will undergo safety checks. A marine source told Reuters news agency on Monday evening that ships were travelling southwards towards the Red Sea while canal services provider Leth Agencies said vessels had resumed transit from the Great Bitter Lake. Some ships have already left the region, preferring to take an alternative, longer route around the southern tip of Africa. Inevitably, cargoes will be reaching their destination much later than planned. There may be congestion when they arrive in port, while future sailing schedules have been thrown into disarray, The cost of shipping goods to Europe is expected to rise as a result, BBC Business Correspondent Theo Leggett reports. Shipping group Maersk saidthe ""ripple effects on global capacity and equipment"" were significant,external. ""There'll be an investigation, clearly, because this has had such a big impact and exactly what's happened here, I think, will be debated for some time,"" Marcus Baker, global head of marine and cargo at Marsh Inc, told Reuters. ""What do we do going forward to ensure it doesn't happen again? Again, I would leave that to the competent authorities that are in Egypt to decide how they want to make sure that traffic transits safely through the canal because, look, it's in their interest to do that."" By Sally Nabil, BBC Arabic bilingual correspondent, Port of Suez Spirits here are quite high. There's a strong sense of achievement. Some experts had warned that it might take weeks to free the Ever Given. But the high tide, as well as the specialist equipment brought in, all helped the rescue operation. Now the authorities will have to address another challenge - congestion. The head of the Suez Canal Authority said that hundreds of stranded vessels would be allowed through the canal on a first-come-first-served basis, though there might be some exceptions to specific ships, based on the types of goods on board. The blockage put the authorities under immense pressure, given the major impact it had on global trade. For Egyptians, the canal is not only a source of national pride, but it also provides the economy with much needed foreign currency. A couple of days ago, I asked Osama Rabie, the head of the Suez Canal Authority, whether he was concerned that some shipping companies might be discouraged from sending such giant ships through the canal in the future. He replied that there was no alternative to the Suez Canal, which he said was fast and safe. So, it's not just about time here, but also about security. It will now undergo a full inspection at the Great Bitter Lake, the vessel's technical managers, Bernhard Schulte Shipmanagement, said. It said there had been no reports of pollution or cargo damage, and initial investigations had ruled out any mechanical or engine failure as a cause of the grounding last week. The ship's Indian crew of 25 remaining aboard the vessel are safe and in good health, BSM said, adding: ""Their hard work and tireless professionalism are greatly appreciated."" The ship's containers are carrying a huge variety of items and the insured value of the cargo is believed to amount to hundreds of millions of dollars. Comments can not be loaded To load Comments you need to enable JavaScript in your browser Deadly wildfires rage across LA as fierce winds threaten more destruction What's the latest on the LA fires, and why can't they be put out? Danes struggle with response to Trump Greenland threat 'I paid fake doctor thousands for fillers - now I look like a gargoyle' The Papers: 'Lost Angeles' and 'Musk seeks plan to oust Starmer' Pop star Chappell Roan wins BBC Sound Of 2025 Weekly quiz: Zendaya looked happy but who else sparkled at the Golden Globes? The 20 child abuse inquiry proposals - what has happened so far? The '9/11 mastermind' wants to plead guilty. Why is the US trying to stop him? Why are UK borrowing costs rising and what does it mean for me? In maps: Thousands of acres on fire in LA Before and after: How wildfires tore through LA Ed Gamble hosts the official Traitors podcast Join Ed Gamble and guests as they dissect the first episodes of The Traitors! Can art, music and words bind us in divided times? Simon Schama explores how artists have captured the transformations of British society since 1945 Enjoy a satirical smorgasbord of The News Quiz Digest a dramatic year of news as Andy Zaltzman revels in some of 2024's funniest moments The multi-award-winning legal drama returns Two years on, the Defoes are back and have gathered for a beautiful wedding in Barcelona © 2025 BBC. The BBC is not responsible for the content of external sites.Read about our approach to external linking."
